,created_at,full_text,sentiment_score
0,2021-12-08 11:59:54+00:00,vaccine passport policy demonstrably fail prevent infection surge country af,-0.5
1,2021-12-08 11:59:54+00:00,big question lnp pick rennick senator last election go hard right th,-0.0014880952380952467
2,2021-12-08 11:59:54+00:00,heart disease stroke type diabetes prevent reduce prevalence obesity division nutrition physical activity obesity dnpao center disease control prevention cdc provide support state local health,-0.03333333333333333
3,2021-12-08 11:59:55+00:00,onetime process saywe be not abolish filibuster say suspend raise th,0.0
4,2021-12-08 11:59:55+00:00,gov abbott say order vaccine mandate allow texas,0.0
5,2021-12-08 11:59:55+00:00,ahead nhs elective recovery plan listen part conversation ceo david ezra steve roest,0.0
6,2021-12-08 11:59:55+00:00,well I ve never need flu jab offer vulnerable choose take surely covid want do not should not force,0.0
7,2021-12-08 11:59:55+00:00,antilockdown protestors belgium try break ministry health,0.0
8,2021-12-08 11:59:55+00:00,christmas party covid rule follow time,0.0
9,2021-12-08 11:59:55+00:00,do lie constantly we minister lie we behalf heres ri,0.0
10,2021-12-08 11:59:55+00:00,important observe follow sops guideline set help fight communitysong like eteredde helped spread message song available youtube via,0.4
11,2021-12-08 11:59:55+00:00,biontech say datum also show omicron variant probably sufficiently neutralize dose,0.0
12,2021-12-08 11:59:55+00:00,say goodbye christmas,0.0
13,2021-12-08 11:59:55+00:00,canadian business owner expect sale rebound prepandemic level survey national,0.0
14,2021-12-08 11:59:55+00:00,do lie constantly we minister lie we behalf heres ri,0.0
15,2021-12-08 11:59:55+00:00,liar go put restriction place distract we he s use covid health shield,0.0
16,2021-12-08 11:59:55+00:00,government audacity try implement plan b variant resemble common cold shortly,-0.3
17,2021-12-08 11:59:55+00:00,put much pressure set unrealistic target happenslot fake vaccination entry biharhtt,-0.26666666666666666
18,2021-12-08 11:59:55+00:00,eilmeldung eil breakingpfizer say booster dose vaccine protect omicron variant,0.0
19,2021-12-08 11:59:55+00:00,lot important new info virus neutralize antibody datum comment review con,0.2681818181818182
20,2021-12-08 11:59:55+00:00,scared randi purpose union work cdc keep classroom keep apart,0.0
21,2021-12-08 11:59:55+00:00,johnson sit blame everyone else find someone sack toss coin tougher cov,0.0
22,2021-12-08 11:59:55+00:00,break pfizer report third dose vaccine provide similar level neutralize antibody omicron comparable,0.0
23,2021-12-08 11:59:56+00:00,worth listen,0.3
24,2021-12-08 11:59:56+00:00,normal statement normal country enter year three pandemic,0.15
25,2021-12-08 11:59:56+00:00,wake ted war enemy china help traitor high government try bring usa make we communist nation understand go understand open bordervaccine mandate etc,0.08
26,2021-12-08 11:59:56+00:00,go distraction,0.0
27,2021-12-08 11:59:56+00:00,bn teameurope bold commitment tackle global nutrition crisis pledge en,0.16666666666666666
28,2021-12-08 11:59:56+00:00,covid passport come never take againyou must resist child grandc,0.0
29,2021-12-08 11:59:56+00:00,plan b restriction explain vaccine passport home,0.0
30,2021-12-08 11:59:56+00:00,do not investigate covid breach year ago hunt ordinary people cou,-0.25
31,2021-12-08 11:59:56+00:00,break pfe say dose vaccine neutralize omicron variant report,0.0
32,2021-12-08 11:59:56+00:00,sure,0.5
33,2021-12-08 11:59:56+00:00,people enough need vote confidence general election,0.02500000000000001
34,2021-12-08 11:59:56+00:00,remindervaccine passport make sense change way life forever fight generation,0.0
35,2021-12-08 11:59:56+00:00,follow rule down street joke break covid stat december new people people intensive,-0.009595959595959616
36,2021-12-08 11:59:56+00:00,illegal christmas party hold drug trace find throughout parliament gov fail help afghans e,-0.5
37,2021-12-08 11:59:56+00:00,coronavirus measure work home could announce soon today accord report,0.0
38,2021-12-08 11:59:56+00:00,that s case vaccine vaccine passport,0.0
39,2021-12-08 11:59:56+00:00,question worker vaxe many natural immunity many already covid amp board supervisor real threat health amp safety,0.325
40,2021-12-08 11:59:56+00:00,vaccine work get runnerup,0.0
41,2021-12-08 11:59:56+00:00,good luck non compliance lockdown go go shop close,0.7
42,2021-12-08 11:59:56+00:00,anyone travel v saturday need vaccine pass make sure dow,0.5
43,2021-12-08 11:59:56+00:00,postal telecom worker go work every single day pandemic they ve go home different se,-0.03571428571428571
44,2021-12-08 11:59:56+00:00,think seriously need get kid urgently vaccinate shot like crazy uks jcvi,-0.4666666666666667
45,2021-12-08 11:59:56+00:00,complacent cynical behaviour throughout pandemic damage compliance future inquiry must address,-0.3
46,2021-12-08 11:59:56+00:00,go distraction,0.0
47,2021-12-08 11:59:56+00:00,happy stay home husband,0.8
48,2021-12-08 11:59:56+00:00,music get life pandemic time world name year pandemic b,0.0
49,2021-12-08 11:59:56+00:00,spy qqq,0.0
50,2021-12-08 11:59:56+00:00,pleasure moderate vaccine manufacture research commercialization session th,0.0
51,2021-12-08 11:59:56+00:00,fada sale report november state indian car industry corona read shocking statistic fada november reveal vehicle registration datum,-1.0
52,2021-12-08 11:59:57+00:00,health care coverage affordable ever subsidy covid relief tha,0.0
53,2021-12-08 11:59:57+00:00,want help people burma stay home shut thank,0.0
54,2021-12-08 11:59:57+00:00,u r forget western journalist showcase burn pyres india nd wave chinese virus selectivethey do not care brown ppl,0.0
55,2021-12-08 11:59:57+00:00,government piss away sense national unity first lockdown protect dominic cumming,0.25
56,2021-12-08 11:59:57+00:00,tell follow rule guideline anymore rule maker do not follow rule I ve covid I m double jabbed I ve booster book think announce restriction deflect bullshit he s mistaken,0.0
57,2021-12-08 11:59:57+00:00,prep basketball highlight improve home win hermantown cloquet girl stay un,0.8
58,2021-12-08 11:59:57+00:00,totally coincidence we account similar proportion incarcerate people worldwide,0.0
59,2021-12-08 11:59:57+00:00,apparently boris announce covid plan b unprecedented rush afternoon can not imagine perhaps he s goi,0.325
60,2021-12-08 11:59:57+00:00,update say permanently replace worker go strike new system cut,0.13636363636363635
61,2021-12-08 11:59:57+00:00,kelloggs say permanently replace worker go strike new system cut new worker,0.13636363636363635
62,2021-12-08 11:59:57+00:00,get accuse cynical guidance probably would not know enough,-0.3
63,2021-12-08 11:59:57+00:00,please wear mask enter theatre watch rrrtrailer tomorrow know excitement unstoppa,0.0
64,2021-12-08 11:59:57+00:00,superman jackson hyde team superman son kalel variant coverciantormey,0.0
65,2021-12-08 11:59:57+00:00,france strict mask mandate vaccine passport place month hit high covid case rat,0.16
66,2021-12-08 11:59:57+00:00,please wear mask enter theatre watch rrrtrailer tomorrow know excitement unstoppa,0.0
67,2021-12-08 11:59:58+00:00,scared omicron government,0.0
68,2021-12-08 11:59:58+00:00,forensic measure factual brilliant,0.9
69,2021-12-08 11:59:58+00:00,please wear mask enter theatre watch rrrtrailer tomorrow know excitement unstoppa,0.0
70,2021-12-08 11:59:58+00:00,read catalogue selfinflicted disaster south africa weep reaction covidno wonder aft,0.0
71,2021-12-08 11:59:58+00:00,pfizerbiontech say booster dose vaccine appear provide strong protection omicron variant,0.4333333333333333
72,2021-12-08 11:59:58+00:00,pfizerbiontech say booster dose vaccine appear provide strong protection omicron variant ht,0.4333333333333333
73,2021-12-08 11:59:58+00:00,christmas party covid rule follow time,0.0
74,2021-12-08 11:59:58+00:00,could purge instead another lockdown know spice bit,0.0
75,2021-12-08 11:59:58+00:00,please wear mask enter theatre watch rrrtrailer tomorrow know excitement unstoppa,0.0
76,2021-12-08 11:59:58+00:00,plan b calibrate deltanot omicron,0.0
77,2021-12-08 11:59:58+00:00,legend,0.0
78,2021-12-08 11:59:58+00:00,nasdaq sampp stock future accelerate gain positive vaccine headline respectively,0.07575757575757576
79,2021-12-08 11:59:58+00:00,isabel diaz ayuso far one good politician europe salvation madrid leadership popular union force save rest spain socialist decadence,0.4666666666666666
80,2021-12-08 11:59:58+00:00,heathrow recreate love actuallys iconic scene follow pandemic reunion,0.5
81,2021-12-08 11:59:58+00:00,hey you all know social distancing be not strongly enforce nowadays do not mean need actively crawl,-0.04010416666666666
82,2021-12-08 11:59:58+00:00,baby cold outside day crrcmas response pandemic wrisk run online survey explore people,-0.3
83,2021-12-08 11:59:58+00:00,covid plan b restriction could reintroduce race save christmas,0.0
84,2021-12-08 11:59:58+00:00,pfizerbiontech release lab study dose neutralize omicron level dose wildtype,0.0
85,2021-12-08 11:59:58+00:00,mass awakening happen can not stop people get jabbed government get desperat,0.0
86,2021-12-08 11:59:58+00:00,please wear mask enter theatre watch rrrtrailer tomorrow know excitement unstoppa,0.0
87,2021-12-08 11:59:58+00:00,covid restriction expect announce later today whitehall source tell bbchere what s plan b ht,0.0
88,2021-12-08 11:59:58+00:00,much want see johnson face consequence mention thousand preventable covid death pretty obvious manipulate time release story,0.15
89,2021-12-08 11:59:59+00:00,julia slam down street staff joke christmas partyin video they re laugh we stupi,0.0722222222222222
90,2021-12-08 11:59:59+00:00,client call ask bump appointment next week kid isolate home,0.0
91,2021-12-08 11:59:59+00:00,anyways death omicron far,0.1
92,2021-12-08 11:59:59+00:00,free evening get bored pandemic,-0.04999999999999999
93,2021-12-08 11:59:59+00:00,want introduce strict covid rule today tomorrow,0.0
94,2021-12-08 11:59:59+00:00,lokishang di cv go tlo nkga vacancy next year mandatory vaccine mandate,0.0
95,2021-12-08 11:59:59+00:00,stress ongoing pandemic there s grow drive make wellness priority expert offer strategy incorporate wellness activity,0.0
96,2021-12-08 11:59:59+00:00,business strategy work covid work post covid need different approach scale encompassbt itconsulting itstrategy itprocess itservice revenue risk leadership,0.0
97,2021-12-08 11:59:59+00:00,high unemployment record contraction economy follow two nationwide lockdown family across count,0.16
98,2021-12-08 11:59:59+00:00,business strategy work covid work post covid need different approach scale encompassbt itconsulting itstrategy itprocess itservice revenue risk leadership,0.0
99,2021-12-08 11:59:59+00:00,feel great though day do not know covid booster jab england woeful start ashe tour,0.8
100,2021-12-08 11:59:59+00:00,people receive two covid vaccine shot gross I m grateful atlantic step bestow th,0.0
101,2021-12-08 11:59:59+00:00,feel need rant today think go leave entire life restart somewhere else beca,0.0
102,2021-12-08 11:59:59+00:00,really case corona everyday,0.0
103,2021-12-08 11:59:59+00:00,liedabout brexitcovidnorthern ireland nhspovertyrefugeesprorogationpartiesemissionsaffairsracismhomophob,0.0
104,2021-12-08 11:59:59+00:00,turn start vaccinate middle pandemic virus find try get around,0.0
105,2021-12-08 11:59:59+00:00,liar go put restriction place distract we he s use covid health shield,0.0
106,2021-12-08 11:59:59+00:00,breaking do not let pandemic grip germany another year german president tell scholz,0.0
107,2021-12-08 11:59:59+00:00,month ago see immunologist cnn predict forever covid situation reason,0.0
108,2021-12-08 11:59:59+00:00,study examine several vaccine amp booster amp find fold,0.0
109,2021-12-08 11:59:59+00:00,do not fall said week would assess know variant impact week today,0.0
110,2021-12-08 11:59:59+00:00,vaccine passport policy demonstrably fail prevent infection surge country af,-0.5
111,2021-12-08 12:00:00+00:00,clear everyone one lockdown break party number last year,0.05000000000000001
112,2021-12-08 12:00:00+00:00,critical funding help support rural hospital continue keep family amp community safe amp h,0.16666666666666666
113,2021-12-08 12:00:00+00:00,homeless unvaccinated people can not sleep warm train station anymore guess societys grumble appendix,0.6
114,2021-12-08 12:00:00+00:00,will not hear say often mirror excellent job boris johnsons conservative take we,1.0
115,2021-12-08 12:00:00+00:00,good news week,0.7
116,2021-12-08 12:00:00+00:00,emerge online science teaching practice insight high school physics teaching case south korea pandemic,0.16
117,2021-12-08 12:00:00+00:00,canadian company medicago develop plantbase potential vaccine show effective delta variant via,0.3
118,2021-12-08 12:00:00+00:00,lock we proof never want enditll lockdown til summer againspanish flu go,0.0
119,2021-12-08 12:00:00+00:00,good case every child kid might suffer long covid please do not take fun important health important individual perspective,0.2916666666666667
120,2021-12-08 12:00:00+00:00,I m stayathome parent lose home angry mob geese I m win new car,0.14545454545454548
121,2021-12-08 12:00:00+00:00,infection spiral ashfordhttpstcoupcqaydpew,0.0
122,2021-12-08 12:00:00+00:00,may concern omicron variant encourage get necessary dose vaccine protect,0.0
123,2021-12-08 12:00:00+00:00,crisis pause button longterm growth global travel sector tui group tuigroup boss,0.0
124,2021-12-08 12:00:00+00:00,government audacity try implement plan b variant resemble common cold shortly,-0.3
125,2021-12-08 12:00:00+00:00,omicron variant likely severe delta still highly transmissible say fauci,0.08
126,2021-12-08 12:00:00+00:00,europes far right vaccine skepticism trap foreignpolicy,0.19285714285714284
127,2021-12-08 12:00:00+00:00,lead front rear adm buzz donnelly commander task force receive covid booster immunization aboard uss ronald reagan cvn reaganready,0.0
128,2021-12-08 12:00:00+00:00,use picture visual help improve health understanding communicate new complex idea find healthliteracy coronavirus amp,-0.05454545454545454
129,2021-12-08 12:00:00+00:00,corrupt people target educationrelate coronavirus recovery aid think quick easy payoffpreye other time crisis help we stop learn,0.035416666666666666
130,2021-12-08 12:00:00+00:00,pandemic impact sector across globe datum solution postpandemic risk financial stress,0.0
131,2021-12-08 12:00:00+00:00,omicronvariant dangerous omicron variant child sayhttpstcodlaqmgtdqh,-0.6
132,2021-12-08 12:00:00+00:00,contribute rise gbv worldwide learn agricultural intervention help mitigate genderbased violence pandemic beyond,0.0
133,2021-12-08 12:00:00+00:00,deeply challenge delivery cancer treatment timetoactcancer make health system resilient join collective effort build well future cancerpatient,0.0
134,2021-12-08 12:00:00+00:00,good news,0.7
135,2021-12-08 12:00:00+00:00,first twopart webinar series explore healthcare provider uk amp abroad deliver innovative amp effective virtual care home hundred patient global pandemic december,0.3375
136,2021-12-08 12:00:00+00:00,poultry producer talk taste bud year christmas sale expectation postpandemic,0.0
137,2021-12-08 12:00:00+00:00,excited announce talkinghands association series free film direct film throughout pandemic extend commitment provide opportunity deaf artist time create live theatre be not possible,0.20227272727272724
138,2021-12-08 12:00:00+00:00,nearly child suffer pandemic restriction watchdog tell mps education educationnew,0.1
139,2021-12-08 12:00:00+00:00,want say thank continue work mental health substance misuse range primary care service people across sheffield respond challenge pandemic vital work sheffieldccgchristmascheer,0.13333333333333333
140,2021-12-08 12:00:00+00:00,feel like important reiterate something covid vaccine like vaccine general covid vaccin,0.22500000000000003
141,2021-12-08 12:00:00+00:00,do lie constantly we minister lie we behalf heres ri,0.0
142,2021-12-08 12:00:00+00:00,government piss away sense national unity first lockdown protect dominic cumming,0.25
143,2021-12-08 12:00:00+00:00,keep return cathy lipskis pandemic diary entry feel vulnerable unlike gorge tree river waterfall remain constant steadfast journaling diary,-0.033333333333333326
144,2021-12-08 12:00:00+00:00,free vaccine booster available,0.4
145,2021-12-08 12:00:00+00:00,simply soon say impact omicron term vaccine efficacy hospitalisation death backtotravel travelsafeeatsafe saveoursummer,0.0
146,2021-12-08 12:00:00+00:00,pfizerbiontech release lab study dose neutralize omicron level dose wildtype,0.0
147,2021-12-08 12:00:00+00:00,respected doctor know say person able walk unaided would medical reason qualify mask exemptionand although accept mental ptsd etc reason wear mask I m sure would apply visor,0.225
148,2021-12-08 12:00:00+00:00,true insane one one case covid coldomicron though fast spread mild,-0.029166666666666674
149,2021-12-08 12:00:00+00:00,yeah moderna ceo say be not expect omicron level mutation another two year,0.0
150,2021-12-08 12:00:00+00:00,come back around cul de sac send,0.0
151,2021-12-08 12:00:00+00:00,pmqs live boris johnson expect face barrage question footage staff laugh allege,0.21818181818181817
152,2021-12-08 12:00:01+00:00,transition onpremise cloudcompute inevitable especially since pandemic accelerate hybridworke however haste adopt cloud datum platform many business fail meet ultimate goal improve business agility efficiency,0.0
153,2021-12-08 12:00:01+00:00,flu vaccine boost immunity help pass protection baby book appointment nowspeak midwife get free vaccination,0.4
154,2021-12-08 12:00:01+00:00,one year covid vaccine administer dorset include booster,0.0
155,2021-12-08 12:00:01+00:00,demonstrate receive booster vaccination use nhs covid pass get covid pass free nhs app,0.4
156,2021-12-08 12:00:01+00:00,grab jab ironstone centre scunthorpe thursday december age welcome attend first second boosterno appointment necessary turn,0.2625
