,created_at,full_text,sentiment_score
0,2021-12-05 21:59:54+00:00,mean like cold entire thread show hysterical hypochondriac determine save fro,-0.478125
1,2021-12-05 21:59:55+00:00,today first take dec every year since daughter haley die dec vaccine preventa,0.25
2,2021-12-05 21:59:55+00:00,south africa president refuse vaccine mandate vaccine passportsbravohttpstcopqpacxqjbk,0.0
3,2021-12-05 21:59:55+00:00,trend ontario elementary school outbreak case like outbreak category summary past two week,0.024999999999999994
4,2021-12-05 21:59:55+00:00,see multiple omicron super spreader event huge attendee getting infect please do not go wor,0.24444444444444446
5,2021-12-05 21:59:55+00:00,video interview vaccine skeptic clapton discuss he s attack minute begin say anythi,0.0
6,2021-12-05 21:59:55+00:00,south africa president refuse vaccine mandate vaccine passportsbravohttpstcopqpacxqjbk,0.0
7,2021-12-05 21:59:55+00:00,everyone want get back normal spoiler alert vaccine passport digital i d system opposite normal,0.06
8,2021-12-05 21:59:55+00:00,downingstchristmasparty two meet police consider complaint down street christmas party break r,-0.2277777777777778
9,2021-12-05 21:59:55+00:00,soon close southern border illegal covid spreader multiple variant cross everyday stop nonsense biden killing americans fail policy every dem vote next nov lame duck dementia patient,-0.2125
10,2021-12-05 21:59:55+00:00,know collection shot day first lockdown wks pregnantmy fav little town aj,0.03125
11,2021-12-05 21:59:55+00:00,vaccinate cruise ship catch covid,0.0
12,2021-12-05 21:59:55+00:00,austria february next year effectively regard criminal do not get vaccine still tria,0.06666666666666665
13,2021-12-05 21:59:55+00:00,south africa president refuse vaccine mandate vaccine passportsbravohttpstcopqpacxqjbk,0.0
14,2021-12-05 21:59:55+00:00,omicron rly fuck w go home,-0.4
15,2021-12-05 21:59:55+00:00,hypocrite say unvaccinated vector transmission variant impose str,0.0
16,2021-12-05 21:59:55+00:00,say blessing disguise thinking coronavirus solve issue global warming paris c,0.0
17,2021-12-05 21:59:56+00:00,live later demand pda progressive town hall week return subject healthcare human,-0.007575757575757576
18,2021-12-05 21:59:56+00:00,sure people mad absolute good argument vaccination return semblance pre,0.19374999999999998
19,2021-12-05 21:59:56+00:00,icecold iowa bank aid fight coronavirus btn livebig big ten network via,0.0
20,2021-12-05 21:59:56+00:00,austrians vienna last night break lockdown party street protest,0.0
21,2021-12-05 21:59:56+00:00,covid superspreader event two year be not enough,0.0
22,2021-12-05 21:59:56+00:00,thank share follow we substack,0.0
23,2021-12-05 21:59:56+00:00,break israeli ministry health announce today soon approve vaccine shotit mean,-0.3125
24,2021-12-05 21:59:56+00:00,write hornysad pandemic new issue ghost city review,0.13636363636363635
25,2021-12-05 21:59:56+00:00,quit lyingall people die mostly republicans believe vaccine republican liars congress like youthis republican madeperpetual pandemic,0.5
26,2021-12-05 21:59:56+00:00,release ivermectin wold need vaccine would upset pfizer contract govt sign,0.0
27,2021-12-05 21:59:56+00:00,austin deny oklahoma bid exception vaccine mandate,0.0
28,2021-12-05 21:59:56+00:00,vaccine war truth pfizer dispatch friday hear claim drug company war profi,0.0
29,2021-12-05 21:59:56+00:00,none surprise anyone know florida hide datarecent death rate find six time high heavilyrepublican county reportraw story celebrate year independent journalism jodotcom,0.08
30,2021-12-05 21:59:56+00:00,anyone get job back,0.0
31,2021-12-05 21:59:56+00:00,vaccination rate unrelated covid case novaccinemandate,0.0
32,2021-12-05 21:59:56+00:00,time last week doctor describe health leader tell australian across print tv medium,0.0
33,2021-12-05 21:59:56+00:00,take woman know right country germany america watchingup,0.2857142857142857
34,2021-12-05 21:59:56+00:00,superspreader event oslo prepare many school insane time infect grandparent xmas omicronvariant nicolasturgeon,-0.25
35,2021-12-05 21:59:56+00:00,ppl keep say unpredictable know predictable long ppl vector mingle,-0.1388888888888889
36,2021-12-05 21:59:56+00:00,indeed still zero public health advice treat covid infection home seek help etc,0.0
37,2021-12-05 21:59:56+00:00,still,0.0
38,2021-12-05 21:59:56+00:00,hope whoever give covid perishe bad way imaginable,-0.6999999999999998
39,2021-12-05 21:59:56+00:00,want clear nu variantwe know know south africa invest advanced genomic sequ,0.25
40,2021-12-05 21:59:56+00:00,force choose jab job wa man jamie ireland feel like heart attack three day,0.0
41,2021-12-05 21:59:57+00:00,never fully vaccinatedjustsayno,0.0
42,2021-12-05 21:59:57+00:00,fully vaccinate require booster obviously,0.0
43,2021-12-05 21:59:57+00:00,huge march denmark weekend lockdown vaccine mandate,0.4000000000000001
44,2021-12-05 21:59:57+00:00,break study south african medical research council find case tshwane epicentre omicron outbreak,0.0
45,2021-12-05 21:59:57+00:00,hey know we ve away long ass time start get shit together lockdown currently artist want commission lack fund please follow instagram risquekat,-0.08333333333333333
46,2021-12-05 21:59:57+00:00,disgusted way herald sun opposition denigrate entire community political gain last,-0.25
47,2021-12-05 21:59:57+00:00,tga provisionally approve pfizer vaccine child aged year oldatagi expect pr,-0.1
48,2021-12-05 21:59:57+00:00,face mask face covering provide another layer protection defence help prevent,0.0
49,2021-12-05 21:59:57+00:00,pretravel testing mean boris johnson warn grave omicron risk yet still refuse mandate,-0.3125
50,2021-12-05 21:59:57+00:00,truth,0.0
51,2021-12-05 21:59:57+00:00,exclusive repeat threat dr yan say continue fight tell world chi,0.0
52,2021-12-05 21:59:57+00:00,april call exposure scientist help pandemic expertise need,0.0
53,2021-12-05 21:59:57+00:00,anti coronavirus passport mandate protest across slovenia,0.0
54,2021-12-05 21:59:57+00:00,say follow money thing do not make sense,0.0
55,2021-12-05 21:59:57+00:00,table lack competence pandemic manage people knowledge pandemic rather health service researcher like juni weak health policy academic brown ever hold accountable much harm,-0.05833333333333333
56,2021-12-05 21:59:57+00:00,dr anthony fauci respond sen ron johnson rwi say fauci overhyped aid covidoverhype aid kill,0.0
57,2021-12-05 21:59:57+00:00,always think lightning conductor church godsaviourvaccine great secondary measure,0.25
58,2021-12-05 21:59:57+00:00,vaccine stop spread virus,0.0
59,2021-12-05 21:59:57+00:00,need fundamental reset globally deal start key statement fro,0.0
60,2021-12-05 21:59:57+00:00,warning signal may avert many death interview botswana virologist may well discover,0.5
61,2021-12-05 21:59:57+00:00,republican party party school shooting book ban covid spread let child live learn,0.13636363636363635
62,2021-12-05 21:59:57+00:00,lets forget time college coach everywhere hold school hostage squeeze every possible ce,0.0
63,2021-12-05 21:59:57+00:00,I m sure breathe awful lot wear mask exhale steam accumula,-0.25
64,2021-12-05 21:59:57+00:00,disgust,0.0
65,2021-12-05 21:59:58+00:00,geopolitic tool long science keep world safe africa africans need wake responsibility start make decision that ll help grow continent wait hand out otherscovidvariant omicronvariant,0.225
66,2021-12-05 21:59:58+00:00,republican party party school shooting book ban covid spread let child live learn,0.13636363636363635
67,2021-12-05 21:59:58+00:00,black face omicron publish la trabuna albacete spain,-0.16666666666666666
68,2021-12-05 21:59:58+00:00,wallahi love one fillah lock go wtsp group share knowledge diine discussion subject every week good time,0.3444444444444444
69,2021-12-05 21:59:58+00:00,good praise peta win south sudanese community incredible leadership htt,0.7999999999999999
70,2021-12-05 21:59:58+00:00,thank p suppose show year half ago game first come covid mean con got delay feel super nostalgic go back show bit,-0.1136904761904762
71,2021-12-05 21:59:58+00:00,weekend vibe almost month lockdown bar back open let say give back hospitality industry pain real,0.05
72,2021-12-05 21:59:58+00:00,add strong body evidence long space vs week substantially improve immune response mrna v,0.19166666666666665
73,2021-12-05 21:59:58+00:00,grammy be not good enough bt deserve win nobel prize unite million around world music,0.15000000000000002
74,2021-12-05 21:59:58+00:00,criminal provision lethal misinformatiomn,-0.4
75,2021-12-05 21:59:58+00:00,pcr pos confirm omicron rest wait sequence result,0.0
76,2021-12-05 21:59:58+00:00,watch one two ahead find covid tester kitalthough think,0.0
77,2021-12-05 21:59:58+00:00,repmtg say cancer covid stat comparablein word woman dumb bag rock,-0.375
78,2021-12-05 21:59:58+00:00,do not think she s nurse also annoy cancer patient vulnerable infection even chemo radiotherapy put even high risk covid therefore advocate measure reduce infection,-0.16999999999999998
79,2021-12-05 21:59:58+00:00,number newjersey gop lawmaker defy new policy show proof vaccination negative test order,-0.08181818181818182
80,2021-12-05 21:59:58+00:00,since may people live county vote heavily donald trump last presidential election nearly three time likely die live area go nowpresident,0.028787878787878782
81,2021-12-05 21:59:58+00:00,pointless distinction like say noone die aid hiv kill directlyanyhow covid victim die lung damage,-0.1625
82,2021-12-05 21:59:59+00:00,look like need two new police officer one even wear mask properly whilst enfor,0.06818181818181818
83,2021-12-05 21:59:59+00:00,boris johnson turn tide within next week I m absolutely confident send coronavirus p,0.25
84,2021-12-05 21:59:59+00:00,we ve shit time we ve light time uk government hokey pokey covid restriction imaceleb,0.1
85,2021-12-05 21:59:59+00:00,unvaccinated people take bed sick people become sicker result vaccinate dur,-0.7142857142857143
86,2021-12-05 21:59:59+00:00,defence force ready case omicron,0.2
87,2021-12-05 21:59:59+00:00,woman go quesnel say loves able show daughter reward follow passion n,0.5
88,2021-12-05 21:59:59+00:00,correct people deal germany austria view stay home allow,0.0
89,2021-12-05 21:59:59+00:00,never history world ineffectiveness vaccine blame,0.0
90,2021-12-05 21:59:59+00:00,they ve fully make south africa wear clothe do not belong epicentre omicron outbreak lolsha th,0.0
91,2021-12-05 21:59:59+00:00,norway omicron superspreader thirty people become infected party end people leave new group arr,0.13636363636363635
92,2021-12-05 21:59:59+00:00,fun fact eric clapton do not become asshole pandemic he s one since least unl,0.0
93,2021-12-05 21:59:59+00:00,last time mad cbs cut away second half national championship game air,-0.23833333333333334
94,2021-12-05 21:59:59+00:00,glass particulate reach blood vessel travel various organ block blood vessel hear,0.0
95,2021-12-05 21:59:59+00:00,imagine try fix shortage icu capacity county even precovid getting accuse want kill peopleit show much battle face return sort normality ireland,0.2
96,2021-12-05 21:59:59+00:00,blink mad,-0.625
97,2021-12-05 21:59:59+00:00,one year ago diagnose be not vaccinate survive without many side effect time,0.5
98,2021-12-05 21:59:59+00:00,can not fucking can not like hear new covid variant pop,0.21818181818181817
99,2021-12-05 21:59:59+00:00,break county vote heavy trump die time rate covid place vote heavy biden,-0.2
100,2021-12-05 22:00:00+00:00,be not scientist doctor covid denier hdc however healthy skeptic situation government power financial interest coalesce scienceoffear covid covidfear propaganda followthemoney thepandemicisover,0.13333333333333333
101,2021-12-05 22:00:00+00:00,dr shaquita bell absolutely certain vaccine can not make child sick covidbecause vaccine do not contain,-0.25
102,2021-12-05 22:00:00+00:00,bad news israels vaccine programme,-0.6999999999999998
103,2021-12-05 22:00:00+00:00,use dynamic adaptive branching asynchronous learn perfect solution educator pandemic ultimately good way think education go forward,0.5666666666666667
104,2021-12-05 22:00:00+00:00,month ago today collapse home day astrazeneca I m should not lose left leg,0.0
105,2021-12-05 22:00:00+00:00,restaurant group meet tanaiste claim half business miss covid support,-0.16666666666666666
106,2021-12-05 22:00:00+00:00,iran coronavirus updatemore people die novel coronavirus city checker across irans province accord iranian opposition pmoimekfull,0.0
107,2021-12-05 22:00:00+00:00,fort mcmurray today mancini also say ucps handle pandemic exhaust health care worker allow viral wave push health care system brink collapseableg abpoli,0.0
108,2021-12-05 22:00:00+00:00,tornado photograph near gallatin tn april part large outbreak tornado deadly tornado middle tn since april outbreak tornado kill people history wxtwitter photo credit nws ohx,0.028571428571428567
109,2021-12-05 22:00:00+00:00,stock last dab holiday festivity hotones cop,0.0
110,2021-12-05 22:00:00+00:00,norwegian cruise line ship least passenger crew member infect dock sunday new orleans health official say attempt get people ship without spread,-0.05454545454545454
111,2021-12-05 22:00:00+00:00,spread new york city march matthew heineman bring camera inside long island jewish medical center queen stay four month,-0.002727272727272731
112,2021-12-05 22:00:00+00:00,uk vaccine coverage dose low neighbour still among high world believe heavily skewed old age eg maybe young adult socialise presumably that s omi start take hold,0.043333333333333335
113,2021-12-05 22:00:00+00:00,headline refer omicron variant virus africa derogatory simply wrong amp h,-0.5
114,2021-12-05 22:00:00+00:00,grim diagnosis pandemic worcester county case rise coldflu season near,-0.45
115,2021-12-05 22:00:00+00:00,I d say certainly covid big shock company part company year old company never make loss,0.10476190476190476
116,2021-12-05 22:00:00+00:00,thank availability vaccine upcoming holiday season look little different last year check tip dr kristi moffitt safely enjoy holiday celebration,0.053125000000000006
117,2021-12-05 22:00:00+00:00,reject cynical fatalism there s nothing another large omicron wave action matter wear mask,-0.09523809523809523
118,2021-12-05 22:00:00+00:00,medical qualification master medical microbiology vaccinate many child adult even help develop vaccine oh doublevaxxed antivaxxer apparently want laugh really funny,0.17142857142857143
119,2021-12-05 22:00:00+00:00,one ireland big business success story build back covid hit,0.09999999999999999
120,2021-12-05 22:00:00+00:00,st stephen cathedral recently host musical reflection station cross honor community lose,0.0
121,2021-12-05 22:00:00+00:00,irish economy continue expand omicron effect yet know oecd note rebound conceal permanent structural change overall forecast good write,0.2333333333333333
122,2021-12-05 22:00:00+00:00,dec japan covid deaths uk covid death yup uk government still world beat,0.0
123,2021-12-05 22:00:00+00:00,gee marjorie maybe cancer spit face probably will not catch covid spit face might,0.0
124,2021-12-05 22:00:00+00:00,perhaps questioner would like say yes coronaviru come end whole world quaranti,0.2
125,2021-12-05 22:00:00+00:00,omicron variant coronaviru spread onethird us state delta version remain majority case nationwide us health official say sundayread,0.0
126,2021-12-05 22:00:00+00:00,us health official say sunday omicron variant coronaviru rapidly spread throughout country early indication suggest may less dangerous delta continue drive surge,-0.2222222222222222
127,2021-12-05 22:00:00+00:00,battle vaccine mandate pull religion spotlight expert say people ever claim vaccine conflict religious belief assertion employer must try evaluate amid deep vaccination divide,0.0
128,2021-12-05 22:00:00+00:00,quarter billion hud receive combat impact spend one reason housing agency overwhelm,0.0
129,2021-12-05 22:00:01+00:00,break study publish south african medical research council find early datum relatively low number c,0.025
130,2021-12-05 22:00:01+00:00,omicron variant make week top pfizer moderna shareholder,0.5
131,2021-12-05 22:00:01+00:00,sweden show common sense beat,-0.3
132,2021-12-05 22:00:01+00:00,stay home someone household sick prevent spread community,-0.7142857142857143
133,2021-12-05 22:00:01+00:00,good protection omicron simple get fully vaccinate get booster shot,0.35
134,2021-12-05 22:00:01+00:00,discovery omicron variant increase wealth eight top pfizer moderna shareholder combine,0.5
135,2021-12-05 22:00:01+00:00,vaccine andrew wakey wakey,0.0
136,2021-12-05 22:00:01+00:00,biden plan magat antivaxxer put wrench spoke plan want everyone vaccinate yet vaccination rate covid death magatsantivaxxer,0.0
137,2021-12-05 22:00:01+00:00,model two emerge tickborne hemorrhagic virus identify vaccine antiviral kyasanurforestdisease alkhurmahemorrhagicdisease flavivirus flaviviridae via,0.0
138,2021-12-05 22:00:01+00:00,fauci say early report encourage omicron,0.1
139,2021-12-05 22:00:01+00:00,recover covid brexit uk must upskill workforce,0.0
140,2021-12-05 22:00:01+00:00,cheyanne vlismas take big risk take fight day battle covidneedless say pay,0.0
141,2021-12-05 22:00:01+00:00,susan sarandon make bill clinton fly epstein island almost time,0.8
142,2021-12-05 22:00:01+00:00,enjoy,0.4
143,2021-12-05 22:00:01+00:00,one us child diagnose autism cdc find,0.0
144,2021-12-05 22:00:01+00:00,case sweep europe breakdown country react,0.0
145,2021-12-05 22:00:01+00:00,rush vaccineseeke customer staff shortage squeeze drugstore around we lead frazzle worker temporary pharmacy,0.0
146,2021-12-05 22:00:01+00:00,covid vax short guarantee arthur daleys car,0.0
147,2021-12-05 22:00:01+00:00,lot anecdotal evidence alcohol become symptomatic drinking,0.0
148,2021-12-05 22:00:01+00:00,he s correct time vaccine pass will not good waste yet money time give freedom fighter something else steal media spotlight,-0.275
149,2021-12-05 22:00:01+00:00,hometeach children talkingtile phonic speechtherapy need get child back track pandemic order today see voice therapy product literacy edutwitter aimhigh,0.0
150,2021-12-05 22:00:01+00:00,need proof animation pay they re owe take seriously exec look much people,-0.06666666666666665
151,2021-12-05 22:00:01+00:00,I m really sorry tell david frum vote joe biden amp loves pay gasoline,-0.5
152,2021-12-05 22:00:01+00:00,prepare face yet uncertainty cause omicronhttpstcoiubdylqzwk,0.0
153,2021-12-05 22:00:01+00:00,mike hosking what s future vaccine,0.0
