,created_at,full_text,sentiment_score
0,2021-02-03 03:59:54+00:00,RT It is not enough to confront the consequences of this pandemic - any agreement must be designed to empower us to defeat...,"{'neg': 0.108, 'neu': 0.722, 'pos': 0.17, 'compound': 0.1823}"
1,2021-02-03 03:59:55+00:00,RT life pre covid was so unsanitary if you actually think about it.,"{'neg': 0.0, 'neu': 1.0, 'pos': 0.0, 'compound': 0.0}"
2,2021-02-03 03:59:55+00:00,RT 1 in 500 South Dakotans has died from Covid,"{'neg': 0.286, 'neu': 0.714, 'pos': 0.0, 'compound': -0.5574}"
3,2021-02-03 03:59:55+00:00,"RT My beautiful wife of 30 years died this evening of COVID-19.

This thing is real, people. Wear a mask and get vaccinated...","{'neg': 0.126, 'neu': 0.737, 'pos': 0.137, 'compound': 0.0772}"
4,2021-02-03 03:59:55+00:00,RT BREAKING: The Senate has voted 50-49 in favor of moving the $1.9 trillion COVID relief package forward using budget re...,"{'neg': 0.0, 'neu': 0.766, 'pos': 0.234, 'compound': 0.7003}"
5,2021-02-03 03:59:55+00:00,RT JUST IN: Japan's government officiallly extends coronavirus state of emergency until March,"{'neg': 0.172, 'neu': 0.728, 'pos': 0.099, 'compound': -0.2732}"
6,2021-02-03 03:59:55+00:00,RT after covid i hope we stay as clean as we are now. i still would like y'all to stand 6 feet away from me,"{'neg': 0.0, 'neu': 0.731, 'pos': 0.269, 'compound': 0.7964}"
7,2021-02-03 03:59:55+00:00,RT I'm at a spur-of-the-moment protest outside of one of Justin Trudeau's COVID Jails. I have never seen everyday Canadians...,"{'neg': 0.095, 'neu': 0.905, 'pos': 0.0, 'compound': -0.25}"
8,2021-02-03 03:59:55+00:00,"RT Valeriano Luz, 60yo NP, Urgent Care, West Covina, CA, died of #covid19 12/16. He had a big extended family with lots of siblin...","{'neg': 0.122, 'neu': 0.709, 'pos': 0.169, 'compound': 0.1027}"
9,2021-02-03 03:59:55+00:00,RT GALLERY: Photographer Soren Solkaer used his COVID year to capture one of the most spectacular - but littl...,"{'neg': 0.0, 'neu': 1.0, 'pos': 0.0, 'compound': 0.0}"
10,2021-02-03 03:59:55+00:00,RT .@TXMotorSpeedway #COVID19 mega vaccine clinic 'surprisingly fast':,"{'neg': 0.0, 'neu': 0.761, 'pos': 0.239, 'compound': 0.296}"
11,2021-02-03 03:59:55+00:00,RT Joe Manchin says he supports using budget reconciliation to pass Biden's $1.9T COVID relief bill. This means the filibus...,"{'neg': 0.0, 'neu': 0.763, 'pos': 0.237, 'compound': 0.6808}"
12,2021-02-03 03:59:55+00:00,"RT .@JohnsHopkins has launched a nationwide study to determine how many people have had "" Long COVID"" or post-acute symptoms f...","{'neg': 0.0, 'neu': 0.93, 'pos': 0.07, 'compound': 0.128}"
13,2021-02-03 03:59:55+00:00,RT The widespread incompetence shown at federal Public Health Agency (in documents Libs fought against making public) dealing w...,"{'neg': 0.248, 'neu': 0.752, 'pos': 0.0, 'compound': -0.6808}"
14,2021-02-03 03:59:55+00:00,RT Capitalism is when a vaccine to a deadly pandemic exists but we can't create or distribute enough of it because two pharm...,"{'neg': 0.092, 'neu': 0.908, 'pos': 0.0, 'compound': -0.3007}"
15,2021-02-03 03:59:55+00:00,RT Not a single Republican voted for the COVID relief package. Republicans don't care about you. Stop voting for them.,"{'neg': 0.194, 'neu': 0.682, 'pos': 0.124, 'compound': -0.1847}"
16,2021-02-03 03:59:55+00:00,"RT Kristi Noem, responsible for deaths and mayhem in South Dakota. For months, her state led the country in per capita...","{'neg': 0.0, 'neu': 0.897, 'pos': 0.103, 'compound': 0.3182}"
17,2021-02-03 03:59:55+00:00,RT i'll remember who partied during COVID for the rest of my life,"{'neg': 0.0, 'neu': 0.833, 'pos': 0.167, 'compound': 0.34}"
18,2021-02-03 03:59:55+00:00,"RT The #Dubai Health Authority (@DHA_Dubai), announces that the first shipment of the AstraZeneca COVID-19 vaccine has arr...","{'neg': 0.0, 'neu': 0.929, 'pos': 0.071, 'compound': 0.0772}"
19,2021-02-03 03:59:55+00:00,RT #bcpoli A beloved grandma who was vaccinated at Royal City Manor in New West on Jan 22 and then got covid days later is o...,"{'neg': 0.0, 'neu': 0.883, 'pos': 0.117, 'compound': 0.5106}"
20,2021-02-03 03:59:55+00:00,"RT This is Chicago public school teacher Dwayne Reed.

His wife is eight months pregnant with their first child. In an attempt...","{'neg': 0.0, 'neu': 1.0, 'pos': 0.0, 'compound': 0.0}"
21,2021-02-03 03:59:55+00:00,RT It is no coincidence that at a time when the Indian Economy is set to bounce back and COVID-19 is fast burning out that...,"{'neg': 0.084, 'neu': 0.916, 'pos': 0.0, 'compound': -0.296}"
22,2021-02-03 03:59:55+00:00,F*ck No!,"{'neg': 0.0, 'neu': 1.0, 'pos': 0.0, 'compound': 0.0}"
23,2021-02-03 03:59:55+00:00,I can't believe is actually got COVID. I thought it was going to skip right over me,"{'neg': 0.0, 'neu': 1.0, 'pos': 0.0, 'compound': 0.0}"
24,2021-02-03 03:59:55+00:00,RT I will never forgive covid for stealing one of my hot years,"{'neg': 0.334, 'neu': 0.666, 'pos': 0.0, 'compound': -0.672}"
25,2021-02-03 03:59:56+00:00,RT That would be the equivalent of debating whether the moon landing happened? It's not a debate if one side is talking gobble...,"{'neg': 0.0, 'neu': 1.0, 'pos': 0.0, 'compound': 0.0}"
26,2021-02-03 03:59:56+00:00,"RT noem's ""unique approach"":","{'neg': 0.0, 'neu': 1.0, 'pos': 0.0, 'compound': 0.0}"
27,2021-02-03 03:59:56+00:00,He wants to be sure all these other countries have heard the U.S. has open borders. He wants to kill Americans w/ COVID infected illegal aliens. It's another illegal move like Obama's DACA but nobody cares about Americans enough to sue.Have they lost their minds? Sue him please!,"{'neg': 0.189, 'neu': 0.641, 'pos': 0.17, 'compound': 0.1134}"
28,2021-02-03 03:59:56+00:00,RT after covid i hope we stay as clean as we are now. i still would like y'all to stand 6 feet away from me,"{'neg': 0.0, 'neu': 0.731, 'pos': 0.269, 'compound': 0.7964}"
29,2021-02-03 03:59:56+00:00,"RT Coronavirus Shut Down Effect:

US Mint Unable to Meet Surging Demand for Gold, Silver Bullion Coins","{'neg': 0.086, 'neu': 0.914, 'pos': 0.0, 'compound': -0.128}"
30,2021-02-03 03:59:56+00:00,RT Jeff Bezos will step down as CEO of Amazon and transition to exec. board chair later this year. He made $90 billion last year d...,"{'neg': 0.0, 'neu': 0.936, 'pos': 0.064, 'compound': 0.1779}"
31,2021-02-03 03:59:56+00:00,RT Here are 3 pandemic activities you don't have to be afraid of.,"{'neg': 0.0, 'neu': 1.0, 'pos': 0.0, 'compound': 0.0}"
32,2021-02-03 03:59:56+00:00,RT Stunning survey: Four in ten Americans believe COVID restrictions eased after Trump exit for 'partisan political reaso...,"{'neg': 0.0, 'neu': 0.769, 'pos': 0.231, 'compound': 0.5859}"
33,2021-02-03 03:59:56+00:00,RT Because they were.,"{'neg': 0.0, 'neu': 1.0, 'pos': 0.0, 'compound': 0.0}"
34,2021-02-03 03:59:56+00:00,"COVID UPDATE: Premier Mark McGowan says if WA continues on a zero streak, the lockdown will end on Friday, but some restrictions will remain for another week. #9News","{'neg': 0.0, 'neu': 1.0, 'pos': 0.0, 'compound': 0.0}"
35,2021-02-03 03:59:56+00:00,RT From serology studies it is estimated that 80 to 100 million Americans have had covid-19 infections. New data from,"{'neg': 0.0, 'neu': 1.0, 'pos': 0.0, 'compound': 0.0}"
36,2021-02-03 03:59:56+00:00,"RT ""We don't support our teams"" but then thousands ha...","{'neg': 0.153, 'neu': 0.847, 'pos': 0.0, 'compound': -0.1603}"
37,2021-02-03 03:59:56+00:00,Please dont message me just to talk?? And say whats up??? Nothing is up im in fucking lockdown all i ever do is school and fill out applications???? Do you think I have time to tell you that NOTHING is up when I have to write fifty thousand cover letters????????,"{'neg': 0.0, 'neu': 0.938, 'pos': 0.062, 'compound': 0.504}"
38,2021-02-03 03:59:56+00:00,RT - this is the link to my original blog post which I mentioned in the email,"{'neg': 0.0, 'neu': 0.874, 'pos': 0.126, 'compound': 0.3182}"
39,2021-02-03 03:59:56+00:00,Get through it?!!  I didn't know the pandemic was over in South Dakota.,"{'neg': 0.0, 'neu': 1.0, 'pos': 0.0, 'compound': 0.0}"
40,2021-02-03 03:59:56+00:00,RT life pre covid was so unsanitary if you actually think about it.,"{'neg': 0.0, 'neu': 1.0, 'pos': 0.0, 'compound': 0.0}"
41,2021-02-03 03:59:56+00:00,"Ivermectin is effective for COVID-19.

Early treatment - 82% improvement, p &lt; 0.0001
Late treatment - 39% improvement, p = 0.0002

56 global studies

 #c19study via","{'neg': 0.0, 'neu': 0.717, 'pos': 0.283, 'compound': 0.8442}"
42,2021-02-03 03:59:56+00:00,RT Capitalism is when a vaccine to a deadly pandemic exists but we can't create or distribute enough of it because two pharm...,"{'neg': 0.092, 'neu': 0.908, 'pos': 0.0, 'compound': -0.3007}"
43,2021-02-03 03:59:56+00:00,"On Monday, Gov. Greg Abbott unveiled a legislative agenda centered on the state's recovery from the coronavirus pandemic and a series of more politically charged issues such as police funding and ""election integrity.""","{'neg': 0.058, 'neu': 0.869, 'pos': 0.073, 'compound': 0.1335}"
44,2021-02-03 03:59:57+00:00,"1 in 500 South Dakotans are dead due to Covid, 1 in 8 South Dakotans were infected with Covid. She traveled all over the country to stump for the GOP, they all lost. She only cares about herself. #barnyardbarbie","{'neg': 0.205, 'neu': 0.732, 'pos': 0.063, 'compound': -0.7783}"
45,2021-02-03 03:59:57+00:00,You have an excellent Count Judge in Andy Eads!! He has worked tirelessly on COVID issues. That event is the largest in the country!,"{'neg': 0.0, 'neu': 0.834, 'pos': 0.166, 'compound': 0.6784}"
46,2021-02-03 03:59:57+00:00,"RT This week, calmly and authentically tell a believer that you do not believe the COVID stories. Don't try to convince or...","{'neg': 0.072, 'neu': 0.832, 'pos': 0.096, 'compound': 0.1431}"
47,2021-02-03 03:59:57+00:00,The Premier says if the state continues on a zero case streak until Friday the full lockdown will end but some restrictions will remain in place until the state has seen at least 14 days of no community transmission.,"{'neg': 0.069, 'neu': 0.931, 'pos': 0.0, 'compound': -0.4215}"
48,2021-02-03 03:59:57+00:00,"Just wow...

I almost want to work through the calculations of all scenarios w/odds to prove just how asinine this is.

Allowing someone to choke to death is way riskier than the smaller probability of catching AND dying from covid-19.","{'neg': 0.198, 'neu': 0.706, 'pos': 0.097, 'compound': -0.7178}"
49,2021-02-03 03:59:57+00:00,But Fauci's CoVid narratives are 100% legit.,"{'neg': 0.0, 'neu': 1.0, 'pos': 0.0, 'compound': 0.0}"
50,2021-02-03 03:59:57+00:00,RT My deepest condolences to the loved ones of the 13 Albertans who have lost their lives to COVID 19 in the past day. One o...,"{'neg': 0.076, 'neu': 0.795, 'pos': 0.129, 'compound': 0.3818}"
51,2021-02-03 03:59:57+00:00,"RT One out of every 500 South Dakotans would like a word, but can't have one, because they're dead.","{'neg': 0.241, 'neu': 0.688, 'pos': 0.071, 'compound': -0.7351}"
52,2021-02-03 03:59:57+00:00,RT Not one Republican voted for the covid relief package. Not one.,"{'neg': 0.0, 'neu': 0.78, 'pos': 0.22, 'compound': 0.4767}"
53,2021-02-03 03:59:57+00:00,RT BREAKING: The Senate has voted 50-49 in favor of moving the $1.9 trillion COVID relief package forward using budget re...,"{'neg': 0.0, 'neu': 0.766, 'pos': 0.234, 'compound': 0.7003}"
54,2021-02-03 03:59:57+00:00,"RT The Biden administration needs to reign in and immediately halt these deportation flights, particularly to nat...","{'neg': 0.0, 'neu': 1.0, 'pos': 0.0, 'compound': 0.0}"
55,2021-02-03 03:59:57+00:00,"My name is [not important]. At the end of 2020, I realized that #coronavirus only served to increase the existing plagues affecting people like me

And that's why in 2021, I'll be doing all I can to figure out ways to change those narratives. It is my belief that we can do better","{'neg': 0.027, 'neu': 0.841, 'pos': 0.132, 'compound': 0.7276}"
56,2021-02-03 03:59:57+00:00,RT Hear me out: Maury Povich reading celebrities' Covid-19 test results live in prime time.,"{'neg': 0.0, 'neu': 1.0, 'pos': 0.0, 'compound': 0.0}"
57,2021-02-03 03:59:57+00:00,Billionaires are billionaires b/c of their greed and selfishness,"{'neg': 0.435, 'neu': 0.565, 'pos': 0.0, 'compound': -0.6597}"
58,2021-02-03 03:59:57+00:00,"I looked at a training gym today and they were really emphatic about having special cleaners come through.  I asked about ventilation, and it's basically just a garage where they keep the doors open.","{'neg': 0.0, 'neu': 0.924, 'pos': 0.076, 'compound': 0.4019}"
59,2021-02-03 03:59:57+00:00,RT call me lame but I'll cancel plans just to stay home LMAO,"{'neg': 0.211, 'neu': 0.48, 'pos': 0.309, 'compound': 0.6186}"
60,2021-02-03 03:59:57+00:00,"RT Reserve Bank governor warns against lowering jobseeker payment, by ","{'neg': 0.298, 'neu': 0.702, 'pos': 0.0, 'compound': -0.34}"
61,2021-02-03 03:59:57+00:00,"RT The fact that, as far as I know, the Commission is not even pursuing this avenue to solve the supply problem *it created* should...","{'neg': 0.095, 'neu': 0.772, 'pos': 0.133, 'compound': 0.0258}"
62,2021-02-03 03:59:58+00:00,RT tanzania is actually dealing with covid in the most entertaining way possible,"{'neg': 0.0, 'neu': 0.79, 'pos': 0.21, 'compound': 0.4927}"
63,2021-02-03 03:59:58+00:00,"RT 2020: free the children! No more cages!

2021: free the children? No, more cages!","{'neg': 0.1, 'neu': 0.547, 'pos': 0.353, 'compound': 0.7608}"
64,2021-02-03 03:59:58+00:00,"RT Things Scott Morrison could do in the face of Craig Kelly's campaign of COVID-19 misinformation:

- Demand that he take dow...","{'neg': 0.16, 'neu': 0.84, 'pos': 0.0, 'compound': -0.4215}"
65,2021-02-03 03:59:58+00:00,RT I'm gonna cry I can't go through another lockdown,"{'neg': 0.256, 'neu': 0.744, 'pos': 0.0, 'compound': -0.4767}"
66,2021-02-03 03:59:58+00:00,RT The lack of awareness that this tweet shows is just... I wonder if you can say this to the 20+ millio...,"{'neg': 0.099, 'neu': 0.901, 'pos': 0.0, 'compound': -0.3182}"
67,2021-02-03 03:59:58+00:00,RT This story strikes exactly the right level of concern about SARS-CoV-2 mutants and what is being done to analyze...,"{'neg': 0.116, 'neu': 0.884, 'pos': 0.0, 'compound': -0.3612}"
68,2021-02-03 03:59:58+00:00,"RT While Tory incompetents bluster and blather,we've just recorded more deaths from Covid in the second wave than we did in the...","{'neg': 0.0, 'neu': 1.0, 'pos': 0.0, 'compound': 0.0}"
69,2021-02-03 03:59:58+00:00,"RT COVID-19 deaths per 100,000 people:

South Dakota: 201
Population: 884,659

New York: 223
Population: 19.4 million

Cal...","{'neg': 0.0, 'neu': 1.0, 'pos': 0.0, 'compound': 0.0}"
70,2021-02-03 03:59:58+00:00,"RT I got arrested for not wearing a mask today.
Police Officers weren't interested in hearing about the scar tissues in my l...","{'neg': 0.203, 'neu': 0.797, 'pos': 0.0, 'compound': -0.6551}"
71,2021-02-03 03:59:58+00:00,RT Im just happy I experienced college before COVID,"{'neg': 0.0, 'neu': 0.684, 'pos': 0.316, 'compound': 0.5719}"
72,2021-02-03 03:59:58+00:00,RT Friends - Not one! I repeat not one Senator voted in favor of the $1.9 trillion dollar COVID Relief Bill. That should d...,"{'neg': 0.0, 'neu': 0.696, 'pos': 0.304, 'compound': 0.8478}"
73,2021-02-03 03:59:58+00:00,RT NO. REPUBLICANS. VOTED. TO. HELP. THE. PEOPLE.,"{'neg': 0.0, 'neu': 0.722, 'pos': 0.278, 'compound': 0.4019}"
74,2021-02-03 03:59:59+00:00,RT I will never forgive covid for stealing one of my hot years,"{'neg': 0.334, 'neu': 0.666, 'pos': 0.0, 'compound': -0.672}"
75,2021-02-03 03:59:59+00:00,RT Capitalism is when a vaccine to a deadly pandemic exists but we can't create or distribute enough of it because two pharm...,"{'neg': 0.092, 'neu': 0.908, 'pos': 0.0, 'compound': -0.3007}"
76,2021-02-03 03:59:59+00:00,"RT .@drreddys is pleased to share that #SputnikV showed strong efficacy, immunogenicity, &amp; safety results in the Interim Phase-3...","{'neg': 0.0, 'neu': 0.573, 'pos': 0.427, 'compound': 0.8807}"
77,2021-02-03 03:59:59+00:00,Its Covid out here ,"{'neg': 0.0, 'neu': 1.0, 'pos': 0.0, 'compound': 0.0}"
78,2021-02-03 03:59:59+00:00,"COVID-19 Forces Many Companies to Sublease Office Space #CRE #COVID-19 #Subleasing #Office #TenantTips  
https://t.co/JjuHeo9rIl","{'neg': 0.0, 'neu': 1.0, 'pos': 0.0, 'compound': 0.0}"
79,2021-02-03 03:59:59+00:00,RT after covid i hope we stay as clean as we are now. i still would like y'all to stand 6 feet away from me,"{'neg': 0.0, 'neu': 0.731, 'pos': 0.269, 'compound': 0.7964}"
80,2021-02-03 03:59:59+00:00,RT Best tweet of the month,"{'neg': 0.0, 'neu': 0.543, 'pos': 0.457, 'compound': 0.6369}"
81,2021-02-03 03:59:59+00:00,Hahaha is this the same boss who almost gave you covid?  social distancing,"{'neg': 0.0, 'neu': 0.769, 'pos': 0.231, 'compound': 0.5574}"
82,2021-02-03 03:59:59+00:00,RT Even this Democrat Senator admits it was a mistake for Biden to cancel the Keystone Pipeline and destroy thousands of...,"{'neg': 0.292, 'neu': 0.627, 'pos': 0.081, 'compound': -0.6908}"
83,2021-02-03 03:59:59+00:00,"RT America won't die of Covid.
Our economy will collapse because of Covid lies and the Marxist government that just won a...","{'neg': 0.195, 'neu': 0.584, 'pos': 0.222, 'compound': 0.2134}"
84,2021-02-03 03:59:59+00:00,"RT The Times is mad Cuomo is opening indoor dining when covid metrics are ""dire.""  You know what's missing from the artic...","{'neg': 0.307, 'neu': 0.693, 'pos': 0.0, 'compound': -0.8126}"
85,2021-02-03 03:59:59+00:00,"RT Giving away a spot for every 65 new followers. We are at 3228. Ends Thursday at noon. Make me regret this, Twitter. Do your t...","{'neg': 0.096, 'neu': 0.822, 'pos': 0.082, 'compound': -0.1027}"
86,2021-02-03 03:59:59+00:00,No they may have covid,"{'neg': 0.355, 'neu': 0.645, 'pos': 0.0, 'compound': -0.296}"
87,2021-02-03 03:59:59+00:00,RT Great to catch up with Craig Kelly yesterday and discuss the importance of a unified health message and how essential it...,"{'neg': 0.0, 'neu': 0.674, 'pos': 0.326, 'compound': 0.8481}"
88,2021-02-03 03:59:59+00:00,"RT how do we tell hollywood that nobody wants to see the pandemic on tv. we are depressed, unemployed, and existentially pl...","{'neg': 0.136, 'neu': 0.864, 'pos': 0.0, 'compound': -0.5106}"
89,2021-02-03 03:59:59+00:00,"RT No Republicans voted for the Covid stimulus package.  

Can we stop the nonsense that they care for the average man an...","{'neg': 0.251, 'neu': 0.636, 'pos': 0.113, 'compound': -0.4404}"
90,2021-02-03 03:59:59+00:00,"RT Americans are dying of Covid19 and the government doesn't have enough money to test people, distribute vaccines or pay for...","{'neg': 0.065, 'neu': 0.935, 'pos': 0.0, 'compound': -0.1027}"
91,2021-02-03 03:59:59+00:00,Not yet but have switched from a cloth mask to N95,"{'neg': 0.0, 'neu': 1.0, 'pos': 0.0, 'compound': 0.0}"
92,2021-02-03 03:59:59+00:00,"RT 'Aatmanirbharta' implying self-reliance has been named by Oxford Languages as its Hindi word of the year 2020 as it"" val...","{'neg': 0.0, 'neu': 1.0, 'pos': 0.0, 'compound': 0.0}"
93,2021-02-03 03:59:59+00:00,Yupppp #fail #newvariants listen to the science and not your popularity because that is non existent how about all those travelling #ucpvacations,"{'neg': 0.232, 'neu': 0.768, 'pos': 0.0, 'compound': -0.7231}"
94,2021-02-03 03:59:59+00:00,RT An updated school district property tax forecast by the IFO estimates that collections will decline by $269 million (-...,"{'neg': 0.0, 'neu': 1.0, 'pos': 0.0, 'compound': 0.0}"
95,2021-02-03 03:59:59+00:00,RT Capitalism is when a vaccine to a deadly pandemic exists but we can't create or distribute enough of it because two pharm...,"{'neg': 0.092, 'neu': 0.908, 'pos': 0.0, 'compound': -0.3007}"
96,2021-02-03 04:00:00+00:00,RT BREAKING: The Senate has voted 50-49 in favor of moving the $1.9 trillion COVID relief package forward using budget re...,"{'neg': 0.0, 'neu': 0.766, 'pos': 0.234, 'compound': 0.7003}"
97,2021-02-03 04:00:00+00:00,RT life pre covid was so unsanitary if you actually think about it.,"{'neg': 0.0, 'neu': 1.0, 'pos': 0.0, 'compound': 0.0}"
98,2021-02-03 04:00:00+00:00,"RT Fck!
This asshole is from Saskatchewan. 
Fck!","{'neg': 0.0, 'neu': 1.0, 'pos': 0.0, 'compound': 0.0}"
99,2021-02-03 04:00:00+00:00,"""Russia's Sputnik V vaccine is 91.6% effective against symptomatic Covid-19""","{'neg': 0.0, 'neu': 0.744, 'pos': 0.256, 'compound': 0.4767}"
100,2021-02-03 04:00:00+00:00,"knowing however that you could've very well been so up close and personal with death but managed to pull away at what could've been the last minute is a scary ass thought

regardless, you're here with us now, and you kicked covid's ass","{'neg': 0.29, 'neu': 0.679, 'pos': 0.03, 'compound': -0.9481}"
101,2021-02-03 04:00:00+00:00,"""The proclamation of FBBP will surely spur pharma-related research, manufacturing, and tourism in the country especially with the Covid-19 (coronavirus disease 2019) global pandemic,"" Plaza added.
 
https://t.co/E0jpoOaNRH","{'neg': 0.0, 'neu': 0.9, 'pos': 0.1, 'compound': 0.4404}"
102,2021-02-03 04:00:00+00:00,#China surpassed economic growth previous to the health crisis: 6.5% in Q420 against 6% in the same period of 2019. It guarantees China's rapid #recovery and also highlighs the country's margin for facing up to any contingency linked to #COVID19 resurgence,"{'neg': 0.09, 'neu': 0.853, 'pos': 0.057, 'compound': -0.3612}"
103,2021-02-03 04:00:00+00:00,"Little is known about why some people, after coming through the acute phase of COVID-19, struggle to recover and suffer ongoing symptoms including tiredness, brain fog, cardiac and neurological disorders.

https://t.co/Gwfi8tXdg4","{'neg': 0.167, 'neu': 0.833, 'pos': 0.0, 'compound': -0.7003}"
104,2021-02-03 04:00:00+00:00,"Frustration is a common emotion shared by many local restaurants after Oregon Governor Kate Brown relaxed COVID-19 restrictions for other industries
by","{'neg': 0.112, 'neu': 0.686, 'pos': 0.202, 'compound': 0.3612}"
105,2021-02-03 04:00:00+00:00,"Kaya Natin! Champion Sen. who was among the first to call for a preemptive ban of travelers from China in 2020, said this poor performance on COVID-19 control and management has severely affected the economy.

READ MORE:","{'neg': 0.252, 'neu': 0.666, 'pos': 0.081, 'compound': -0.8029}"
106,2021-02-03 04:00:00+00:00,"1936 California License Plate

#tuesdaymotivations 
#COVID19 
#CovidVaccine","{'neg': 0.0, 'neu': 1.0, 'pos': 0.0, 'compound': 0.0}"
107,2021-02-03 04:00:00+00:00,The B.C. government says about $600 million in rebates from ICBC will be mailed out next month. #Kamloops #bcpoli #covid19,"{'neg': 0.0, 'neu': 1.0, 'pos': 0.0, 'compound': 0.0}"
108,2021-02-03 04:00:00+00:00,RT Inaction on COVID is clearly costing lives--we have to act now.,"{'neg': 0.136, 'neu': 0.68, 'pos': 0.184, 'compound': 0.1779}"
109,2021-02-03 04:00:00+00:00,"The national government ended 2020 with a record-high outstanding debt of P9.795 trillion and a 14-year-high debt-to-GDP ratio of P54.5 percent as the government had to borrow more money to fund its response to the Covid-19 pandemic.

https://t.co/CvvJdwFYKk","{'neg': 0.059, 'neu': 0.847, 'pos': 0.094, 'compound': 0.3612}"
110,2021-02-03 04:00:00+00:00,"World Health Organization investigators on Wednesday visited a research center in the Chinese city of Wuhan that has been the subject of speculation about the origins of the coronavirus.

https://t.co/mL5JCmQdvM","{'neg': 0.0, 'neu': 1.0, 'pos': 0.0, 'compound': 0.0}"
111,2021-02-03 04:00:00+00:00,"RT Michigan prosecutor dismisses over 1,600 of Gov. Whitmer's COVID violations ruled unconstitutional | Just The News
htt...","{'neg': 0.167, 'neu': 0.833, 'pos': 0.0, 'compound': -0.5267}"
112,2021-02-03 04:00:00+00:00,RT pandemic fine -- noun -- a state of being in which you are employed and healthy during a pandemic but you're also tired an...,"{'neg': 0.132, 'neu': 0.756, 'pos': 0.112, 'compound': -0.3818}"
113,2021-02-03 04:00:00+00:00,"COMING UP  A panel of experts debates whether the COVID-19 pandemic could be leveraged to act as a springboard towards green and more resilient economies in Asia and the Pacific. 

Watch the third episode of #adbinsight on February 5, Friday at 8:00AM (GMT +8) on FB LIVE.","{'neg': 0.0, 'neu': 1.0, 'pos': 0.0, 'compound': 0.0}"
114,2021-02-03 04:00:00+00:00,Covid-19 has had no discernible effect on the presence of the China Coast Guard in the South China Sea. AIS data from the past 12 months indicates that the CCG has increased the frequency of its patrols and expanded its routine presence to Vanguard Bank:,"{'neg': 0.047, 'neu': 0.909, 'pos': 0.044, 'compound': -0.0258}"
115,2021-02-03 04:00:00+00:00,"#Russia approved a #coronavirusvaccine before confirming it was safe and effective. Experts say the nation's risky bet paid off. 

https://t.co/MmTjberKj2","{'neg': 0.068, 'neu': 0.602, 'pos': 0.331, 'compound': 0.7906}"
116,2021-02-03 04:00:00+00:00,#AeroIndia goes ahead in defiance of #Covid19 via #Covid,"{'neg': 0.0, 'neu': 1.0, 'pos': 0.0, 'compound': 0.0}"
117,2021-02-03 04:00:00+00:00,"Middle East airports to return to pre-COVID traffic by 2024 

https://t.co/g6fq6Z2nCt","{'neg': 0.0, 'neu': 1.0, 'pos': 0.0, 'compound': 0.0}"
118,2021-02-03 04:00:00+00:00,"RT South Dakota reported 1,600 deaths from COVID, i.e. 179 deaths per 100,000 people. It ranks fifth worst in the US, despite...","{'neg': 0.163, 'neu': 0.837, 'pos': 0.0, 'compound': -0.6249}"
119,2021-02-03 04:00:00+00:00,RT Capitalism is when a vaccine to a deadly pandemic exists but we can't create or distribute enough of it because two pharm...,"{'neg': 0.092, 'neu': 0.908, 'pos': 0.0, 'compound': -0.3007}"
120,2021-02-03 04:00:00+00:00,"The new policy requires masks to be worn in NPS buildings and facilities and on parklands when physical distancing can't be maintained, ""including narrow or busy trails, overlooks, and historic homes.""","{'neg': 0.068, 'neu': 0.932, 'pos': 0.0, 'compound': -0.296}"
