,created_at,full_text,sentiment_score
121,2021-02-03 04:00:00+00:00,"More than 100,000 people have died of COVID-19 in the United States so far this year, according to Johns Hopkins University data.","{'neg': 0.136, 'neu': 0.758, 'pos': 0.106, 'compound': -0.2023}"
122,2021-02-03 04:00:00+00:00,RT Gov. Andrew Cuomo of New York said on Friday that New York City could reopen indoor dining on Feb. 14. But by nearly every mea...,"{'neg': 0.0, 'neu': 1.0, 'pos': 0.0, 'compound': 0.0}"
123,2021-02-03 04:00:00+00:00,"Experts warn Covid-19 strain in UK picks up mutation that could impact vaccines

https://t.co/O0AgSAJcPi","{'neg': 0.178, 'neu': 0.822, 'pos': 0.0, 'compound': -0.1531}"
124,2021-02-03 04:00:00+00:00,COVID-19 industry loss estimate lowered to $40bn - $60bn by Berenberg,"{'neg': 0.297, 'neu': 0.703, 'pos': 0.0, 'compound': -0.4215}"
125,2021-02-03 04:00:00+00:00,RT 1/2 Humbled to be the first poet to perform at the Super Bowl! I'm so excited to place poetry at the forefront of the...,"{'neg': 0.0, 'neu': 0.759, 'pos': 0.241, 'compound': 0.8078}"
126,2021-02-03 04:00:00+00:00,"9NEWS compiled questions from Coloradans about COVID vaccines for a town hall Tuesday night with Gov. Jared Polis (D-Colorado) and other state expert panelists.
","{'neg': 0.0, 'neu': 1.0, 'pos': 0.0, 'compound': 0.0}"
127,2021-02-03 04:00:00+00:00,"Little is known about why some people, after coming through the acute phase of COVID-19, struggle to recover and suffer ongoing symptoms including tiredness, brain fog, cardiac and neurological disorders.

https://t.co/EOZkWiutYI","{'neg': 0.167, 'neu': 0.833, 'pos': 0.0, 'compound': -0.7003}"
128,2021-02-03 04:00:00+00:00,"RT Delta is launching new technology to make it easier for travelers to navigate Covid-19.  

https://t.co/1AHbaAFl7k

#tra...","{'neg': 0.0, 'neu': 0.851, 'pos': 0.149, 'compound': 0.4215}"
129,2021-02-03 04:00:00+00:00,Nurses are hardly celebrated enough for the work they do. This #HealthHeroes comic goes out to all the nurses who have selflessly volunteered to care for Covid-19 patients:,"{'neg': 0.0, 'neu': 0.797, 'pos': 0.203, 'compound': 0.7655}"
130,2021-02-03 04:00:00+00:00,. #COVID19 vaccine eligibility by state: Here's what is happening in every state in the US,"{'neg': 0.0, 'neu': 1.0, 'pos': 0.0, 'compound': 0.0}"
131,2021-02-03 04:00:00+00:00,"#ColabaEdit -- The COVID-19 pandemic highlighted the interwoven nature of city systems, economies and communities. Elizabeth Hessek writes.","{'neg': 0.0, 'neu': 1.0, 'pos': 0.0, 'compound': 0.0}"
132,2021-02-03 04:00:00+00:00,"Study: Killings surged in 2020, likely worst one-year homicide rate increase everhttps://www.wkyc.com/article/news/nation-world/killings-surge-in-2020-pandemic-protests-play-roles/507-1e91b109-b365-4638-bb2b-43684a0696cf","{'neg': 0.432, 'neu': 0.452, 'pos': 0.116, 'compound': -0.8074}"
133,2021-02-03 04:00:00+00:00,RT after covid i hope we stay as clean as we are now. i still would like y'all to stand 6 feet away from me,"{'neg': 0.0, 'neu': 0.731, 'pos': 0.269, 'compound': 0.7964}"
134,2021-02-03 04:00:00+00:00,Weekly coronavirus cases decrease in Florida for third week in a row,"{'neg': 0.0, 'neu': 1.0, 'pos': 0.0, 'compound': 0.0}"
135,2021-02-03 04:00:00+00:00,"The COVID-19 pandemic is a story told, in many ways, through numbers. State health leaders said Tuesday those numbers tell an improving story, despite other measuring sticks. 
https://t.co/xV2hYmdD1V","{'neg': 0.0, 'neu': 0.906, 'pos': 0.094, 'compound': 0.4215}"
136,2021-02-03 04:00:00+00:00,"A House subcommittee has launched an investigation into how major meat processors and OSHA responded to coronavirus outbreaks and deaths in meatpacking facilities, a source of rapid transmission of the virus during the early months of the pandemic","{'neg': 0.0, 'neu': 0.961, 'pos': 0.039, 'compound': 0.128}"
137,2021-02-03 04:00:01+00:00,Money Clinic Podcast: How can my small business survive Covid?  -,"{'neg': 0.0, 'neu': 1.0, 'pos': 0.0, 'compound': 0.0}"
138,2021-02-03 04:00:01+00:00,"Not sure how it's possible that the most upsetting thing about this is the phrase ""all the girls,"" but here we are.","{'neg': 0.155, 'neu': 0.845, 'pos': 0.0, 'compound': -0.3974}"
139,2021-02-03 04:00:01+00:00,"RT Wong said #HongKongers blame the political system, blame the govt, yes, the system is totally corrupted, paralysed by #CC...","{'neg': 0.196, 'neu': 0.694, 'pos': 0.11, 'compound': -0.2732}"
140,2021-02-03 04:00:01+00:00,"Time: 04:00 * Temp: 4.5degC * Wind: NE 4.0 to 18.0mph * Pressure: 981.0hPa * Rain: 3.0mm * Hum: 98% * ET: 0.0mm * Solar: 0.0W/m2 * UV Index: 0.0 * Sunrise: 08:08 * Sunset: 17:05 * Cloudbase: 240ft * #conlig, #bangor * #stayathome *","{'neg': 0.048, 'neu': 0.952, 'pos': 0.0, 'compound': -0.296}"
141,2021-02-03 04:00:01+00:00,"RT The critical dependency I see is one of thinking. Sri Lankans aren't stupid, but we just sat there and unc...","{'neg': 0.073, 'neu': 0.843, 'pos': 0.084, 'compound': 0.0613}"
142,2021-02-03 04:00:01+00:00,Mass hysteria over Covid flipped it. Biden didn't do shi-!,"{'neg': 0.262, 'neu': 0.738, 'pos': 0.0, 'compound': -0.4926}"
143,2021-02-03 04:00:01+00:00,"RT Senate Majority Leader Chuck Schumer said President Biden told Senate Democrats at lunch that he wants a ""big, bold package"" on Co...","{'neg': 0.0, 'neu': 0.894, 'pos': 0.106, 'compound': 0.3818}"
144,2021-02-03 04:00:01+00:00,"MADISON -- Low COVID-19 vaccine supply continues to restrict efforts to vaccinate more people in Wisconsin, even as the state added more vaccine supply last week.","{'neg': 0.164, 'neu': 0.836, 'pos': 0.0, 'compound': -0.5719}"
145,2021-02-03 04:00:01+00:00,RT Stunning survey: Four in ten Americans believe COVID restrictions eased after Trump exit for 'partisan political reaso...,"{'neg': 0.0, 'neu': 0.769, 'pos': 0.231, 'compound': 0.5859}"
146,2021-02-03 04:00:01+00:00,RT NO. REPUBLICANS. VOTED. TO. HELP. THE. PEOPLE.,"{'neg': 0.0, 'neu': 0.722, 'pos': 0.278, 'compound': 0.4019}"
147,2021-02-03 04:00:01+00:00,RT life pre covid was so unsanitary if you actually think about it.,"{'neg': 0.0, 'neu': 1.0, 'pos': 0.0, 'compound': 0.0}"
148,2021-02-03 04:00:02+00:00,"RT COVID-19 deaths per 100,000 people:

South Dakota: 201
Population: 884,659

New York: 223
Population: 19.4 million

Cal...","{'neg': 0.0, 'neu': 1.0, 'pos': 0.0, 'compound': 0.0}"
149,2021-02-03 04:00:02+00:00,RT *waves* Hey! Hi! Our kindergartener contracted covid from a school outbreak and guess who ended up the mo...,"{'neg': 0.0, 'neu': 1.0, 'pos': 0.0, 'compound': 0.0}"
150,2021-02-03 04:00:02+00:00,"RT I got arrested for not wearing a mask today.
Police Officers weren't interested in hearing about the scar tissues in my l...","{'neg': 0.203, 'neu': 0.797, 'pos': 0.0, 'compound': -0.6551}"
151,2021-02-03 04:00:02+00:00,"There is more hope if you're still waiting for your chance to get the COVID-19 vaccine.

https://t.co/h9XLRwa9Vu","{'neg': 0.0, 'neu': 0.743, 'pos': 0.257, 'compound': 0.6361}"
152,2021-02-03 04:00:02+00:00,"It's hysterical alright.  GOP cries for unity now, after allowing this country to be torn apart.  Let's sweep the attempted coup under the rug and sing 'Kum Ba Yah'.  Let's work on controlling the pandemic now, after denying its existence. Yup, hysterical.","{'neg': 0.197, 'neu': 0.761, 'pos': 0.042, 'compound': -0.6486}"
153,2021-02-03 04:00:02+00:00,Here's how 4 startups are making the post-pandemic world a better place. ,"{'neg': 0.0, 'neu': 0.791, 'pos': 0.209, 'compound': 0.4404}"
154,2021-02-03 04:00:02+00:00,"RT Not a single Republican senator voted for Pres. Biden's COVID relief bill.

Republicans whine about ""unity"" but don't give a...","{'neg': 0.077, 'neu': 0.833, 'pos': 0.09, 'compound': 0.0772}"
155,2021-02-03 04:00:02+00:00, Thai COVID-19 Lockdown for 5 Provinces [VIDEO] The Thai COVID-19 lockdown news is now coming thick,"{'neg': 0.0, 'neu': 1.0, 'pos': 0.0, 'compound': 0.0}"
156,2021-02-03 04:00:02+00:00,RT Filibuster update: Sens. &amp; are discussing mental health during the time of COVID. Razer also b...,"{'neg': 0.0, 'neu': 1.0, 'pos': 0.0, 'compound': 0.0}"
157,2021-02-03 04:00:02+00:00,"My mom is so amazing, she noticed that I have been struggling with acne breakouts since I started having to wear a mask for 13+ hours at work so she made me a turmeric, nem powder, &amp; rose water mask ","{'neg': 0.061, 'neu': 0.832, 'pos': 0.107, 'compound': 0.4707}"
158,2021-02-03 04:00:02+00:00,RT BREAKING: The Senate has voted 50-49 in favor of moving the $1.9 trillion COVID relief package forward using budget recon...,"{'neg': 0.0, 'neu': 0.766, 'pos': 0.234, 'compound': 0.7003}"
