,full_text
0,enough confront consequence pandemic agreement must design empower we defeat
1,life pre covid unsanitary actually think
2,south dakotan die covid
3,beautiful wife year die evening thing real people wear mask get vaccinate
4,break senate vote favor move trillion covid relief package forward use budget
5,japans government officiallly extend coronavirus state emergency march
6,covid hope stay clean still would like you all stand foot away
7,I m spurofthemoment protest outside one justin trudeaus covid jail never see everyday canadians
8,valeriano luz np urgent care west covina can die big extended family lot siblin
9,gallery photographer soren solkaer use covid year capture one spectacular littl
10,txmotorspeedway mega vaccine clinic surprisingly fast
11,joe manchin say support use budget reconciliation pass biden covid relief bill mean filibus
12,johnshopkin launch nationwide study determine many people long covid postacute symptom f
13,widespread incompetence show federal public health agency document lib fight make public deal w
14,capitalism vaccine deadly pandemic exist can not create distribute enough two pharm
15,single republican vote covid relief package republican do not care stop vote
16,kristi noem responsible death mayhem south dakota month state lead country per capita
17,ill remember partie covid rest life
18,dubai health authority dhadubai announce first shipment astrazeneca vaccine arr
19,bcpoli beloved grandma vaccinate royal city manor new west jan get covid day later
20,chicago public school teacher dwayne reedhis wife eight month pregnant first child attempt
21,coincidence time indian economy set bounce back fast burning
22,fck
23,can not believe actually got covid think go skip right
24,never forgive covid steal one hot year
25,would equivalent debate whether moon landing happen debate one side talk gobble
26,noem unique approach
27,want sure country hear we open border want kill americans w covid infect illegal alien another illegal move like obamas daca nobody care americans enough suehave lose mind sue please
28,covid hope stay clean still would like you all stand foot away
29,coronavirus shut effectus mint unable meet surge demand gold silver bullion coin
30,jeff bezos step ceo amazon transition exec board chair later year make billion last year
31,pandemic activity do not afraid
32,stunning survey four ten americans believe covid restriction ease trump exit partisan political reaso
33,
34,covid update premier mark mcgowan say wa continue zero streak lockdown end friday restriction remain another week
35,serology study estimate million americans infection new datum
36,do not support team thousand ha
37,please do not message talk say what s nothing I m fuck lockdown ever school fill application think time tell nothing write fifty thousand cover letter
38,link original blog post mention email
39,get do not know pandemic south dakota
40,life pre covid unsanitary actually think
41,ivermectin effective treatment improvement p lt treatment improvement p global study via
42,capitalism vaccine deadly pandemic exist can not create distribute enough two pharm
43,monday gov greg abbott unveil legislative agenda center state recovery coronavirus pandemic series politically charge issue police fund election integrity
44,south dakotan dead due covid south dakotan infect covid travel country stump gop lose care barnyardbarbie
45,excellent count judge andy eads work tirelessly covid issue event large country
46,week calmly authentically tell believer believe covid story do not try convince
47,premier say state continue zero case streak friday full lockdown end restriction remain place state see least day community transmission
48,wowi almost want work calculation scenario wodd prove asinine isallowe someone choke death way risky small probability catch die
49,faucis covid narrative legit
50,deep condolence love one albertan lose life covid past day one
51,one every south dakotan would like word can not one they re dead
52,one republican vote covid relief package one
53,break senate vote favor move trillion covid relief package forward use budget
54,biden administration need reign immediately halt deportation flight particularly nat
55,name important end realize coronavirus serve increase exist plague affect people like meand that s ill figure way change narrative belief well
56,hear maury povich read celebrity test result live prime time
57,billionaire billionaire bc greed selfishness
58,look training gym today really emphatic special cleaner come ask ventilation basically garage keep door open
59,call lame ill cancel plan stay home lmao
60,reserve bank governor warn lower jobseeker payment
61,fact far know commission even pursue avenue solve supply problem create
62,tanzania actually deal covid entertaining way possible
63,free child free child cage
64,thing scott morrison could face craig kellys campaign misinformation demand take dow
65,I m go to cry can not go another lockdown
66,lack awareness tweet show wonder say millio
67,story strike exactly right level concern mutant done analyze
68,tory incompetent bluster blatherweve record death covid second wave
69,death per peoplesouth dakota york millioncal
70,got arrest wear mask todaypolice officer be not interested hear scar tissue l
71,I m happy experienced college covid
72,friend one repeat one senator vote favor trillion dollar covid relief bill
73,republicans vote help people
74,never forgive covid steal one hot year
75,capitalism vaccine deadly pandemic exist can not create distribute enough two pharm
76,drreddys please share sputnikv show strong efficacy immunogenicity amp safety result interim
77,covid
78,force many company sublease office space cre sublease office tenanttip
79,covid hope stay clean still would like you all stand foot away
80,good tweet month
81,hahaha boss almost give covid social distancing
82,even democrat senator admit mistake biden cancel keystone pipeline destroy thousand
83,america will not die covidour economy collapse covid lie marxist government
84,time mad cuomo open indoor dining covid metric dire know what s miss artic
85,give away spot every new follower ends thursday noon make regret twitter
86,may covid
87,great catch craig kelly yesterday discuss importance unified health message essential
88,tell hollywood nobody want see pandemic tv depress unemployed existentially pl
89,republicans vote covid stimulus package stop nonsense care average man
90,americans die government do not enough money test people distribute vaccine pay
91,yet switch cloth mask
92,aatmanirbharta imply selfreliance name oxford language hindi word year val
93,yupppp fail newvariant listen science popularity non existent travelling ucpvacation
94,update school district property tax forecast ifo estimate collection decline million
95,capitalism vaccine deadly pandemic exist can not create distribute enough two pharm
96,break senate vote favor move trillion covid relief package forward use budget
97,life pre covid unsanitary actually think
98,fckthis asshole saskatchewan fck
99,russias sputnik v vaccine effective symptomatic
100,know however could ve well close personal death manage pull away could ve last minute scary ass thoughtregardless you re we kick covid ass
101,proclamation fbbp surely spur pharmarelate research manufacturing tourism country especially coronavirus disease global pandemic plaza add
102,china surpass economic growth previous health crisis period guarantee chinas rapid recovery also highligh countrys margin face contingency link resurgence
103,little known people come acute phase struggle recover suffer ongoing symptom include tiredness brain fog cardiac neurological
104,frustration common emotion share many local restaurant oregon governor kate brown relaxed restriction industriesby
105,kaya natin champion sen among first call preemptive ban traveler china say poor performance control management severely affect economyread
106,california license platetuesdaymotivation covidvaccine
107,bc government say million rebate icbc mail next month kamloops bcpoli
108,inaction covid clearly cost liveswe act
109,national government end recordhigh outstanding debt trillion debttogdp ratio percent government borrow money fund response pandemichttpstcocvvjdwfykk
110,world health organization investigator wednesday visit research center chinese city wuhan subject speculation origin
111,michigan prosecutor dismiss gov whitmer covid violation rule unconstitutional newshtt
112,pandemic fine noun state employ healthy pandemic you re also tired
113,come panel expert debate whether pandemic could leverage act springboard towards green resilient economy asia pacific watch third episode adbinsight february friday gmt fb live
114,discernible effect presence china coast guard south china sea ais datum past month indicate ccg increase frequency patrol expand routine presence vanguard bank
115,russia approve coronavirusvaccine confirm safe effective expert say nation risky bet pay
116,aeroindia go ahead defiance via covid
117,middle east airport return precovid traffic
118,south dakota report death covid ie death per people rank fifth bad we despite
119,capitalism vaccine deadly pandemic exist can not create distribute enough two pharm
120,new policy require mask wear nps building facility parkland physical distancing can not maintain include narrow busy trail overlook historic home
121,people die united states far year accord johns hopkins university datum
122,gov andrew cuomo new york say friday new york city could reopen indoor dining feb nearly every mea
123,expert warn strain uk pick mutation could impact
124,industry loss estimate lower berenberg
125,humble first poet perform super bowl I m excited place poetry forefront
126,compile question coloradan covid vaccine town hall tuesday night gov jared polis dcolorado state expert panelist
127,little known people come acute phase struggle recover suffer ongoing symptom include tiredness brain fog cardiac neurological disordershttpstcoeozkwiutyi
128,delta launch new technology make easy traveler navigate
129,nurse hardly celebrate enough work healthheroe comic go nurse selflessly volunteer care patient
130,vaccine eligibility state here happen every state we
131,colabaedit pandemic highlight interweave nature city system economy community elizabeth hessek write
132,study killing surge likely bad oneyear homicide rate increase
133,covid hope stay clean still would like you all stand foot away
134,weekly coronavirus case decrease florida third week row
135,pandemic story tell many way number state health leader say tuesday number tell improve story despite measure stick
136,house subcommittee launch investigation major meat processor osha respond coronavirus outbreak death meatpacke facility source rapid transmission virus early month pandemic
137,money clinic podcast small business survive covid
138,sure possible upsetting thing phrase girl
139,wong say hongkonger blame political system blame govt yes system totally corrupt paralysed cc
140,time temp wind ne pressure rain hum et solar uv index sunrise sunset cloudbase conlig bangor stayathome
141,critical dependency see one think sri lankans be not stupid sat unc
142,mass hysteria covid flip biden do not shi
143,senate majority leader chuck schumer say president biden tell senate democrats lunch want big bold package co
144,madison low vaccine supply continue restrict effort vaccinate people wisconsin even state add vaccine supply last week
145,stunning survey four ten americans believe covid restriction ease trump exit partisan political reaso
146,republicans vote help people
147,life pre covid unsanitary actually think
148,death per peoplesouth dakota york millioncal
149,wave hey hi kindergartener contract covid school outbreak guess end mo
150,got arrest wear mask todaypolice officer be not interested hear scar tissue l
151,hope you re still wait chance get
152,hysterical alright gop cry unity allow country tear apart let sweep attempt coup rug sing kum ba yah let work control pandemic deny existence yup hysterical
153,heres startup make postpandemic world well place
154,single republican senator vote pres biden covid relief billrepublican whine unity do not give
155,thai lockdown province video thai lockdown news come thick
156,filibuster update sens amp discuss mental health time covid razer also b
157,mom amazing noticed struggle acne breakout since start wear mask hour work make turmeric nem powder amp rise water mask
158,break senate vote favor move trillion covid relief package forward use budget recon
