,full_text
0,many people moan democraticdan smirkandmirror scottyfrommarkete can not manage ge
1,mr minister survey post march copr holder find adversely impact travel restriction impose cause covid kindly christinenorm pattyhajdu jennykwanbc citimmcanada
2,back track lockdown amp chill day
3,good news business generate alreadysuffere lot amid recovery time china
4,maafit start daystoday private jetstomorrow privilege expense taxpayer
5,taylor swift work hard
6,can not wait guzzle vaccine vial smash vial floor like willem dafoe spiderman htt
7,spare think we will not able spend valentine day love one instead play sevent
8,tell we keep school close equity
9,biden beat back pandemic define challenge presidency test central promise american
10,flaw story china undeniably excellent cpc record deal truth media undeniably authoritarian state sadly equally undeniable west europe continue kowtow court emperor xi
11,break doctor we protest call stop industrialize agriculture adverse effect human health environment afraid time risk life fight factoryfarm nursing cure
12,meanwhile ontario reporterim bit confused presentation miss something pre
13,live ontario canada reading article melbournes holiday inn cluster public health response
14,click full bbc studio interview renata sago chick corea discuss inspiration write proce
15,covid conspiracy anthea turner
16,deserve sell crowd covid k
17,confirm bad anyone feel since start pandemic right like
18,thing disable people learn pandemic far
19,unlike trump
20,time trump do not tweet election fraud hour august january hospitalize c
21,job can not understand life thing happen amp could potentially need unexpected time deal job exist I m glad able quit job amp hope life far well despite pandemic stuff course
22,actually hcw expert call national
23,pandemic make people crave physical contact way would make baby boomer parent blush birth spike follow covid annihilation legendary
24,provision rs crore vaccine indigenous development pneumococcal vaccine amp increase bud
25,I m actually glad put logo vaccine promo know blame delay
26,confirm bad anyone feel since start pandemic right like
27,china allow broadcast bbc world news chinese mainland broadcaster slew falsify reporting
28,overhear watercooler rehydrate hurculean task lockdown break ladno bitch I m save humanity
29,coronavirus india daily case fall time february hindi
30,new number recover patient send hundred nursing home percent high th
31,hello yatris every pass week covid spread going thus generate great opportunity artist connoisseur interact here ahmedabad art weekly guide towards cultural enrichment always discover
32,amen
33,physically pandemic emotionally I m storm good dress fearless
34,truly limit depoliticized antiasian racism infographic defang amp detach analysis
35,false prophet deceive many miracle cause receive mark right hand forehead one may buy sell except one mark revelation
36,maharashtra surge fuel price affect many mumbai price petrol amp diesel metropolis stand rs
37,wandavision episode five recap warn stay home will not bother will not bother
38,physically pandemic emotionally I m storm good dress fearless
39,new york times today say case volume testing also fall last
40,break we ve purchase enough vaccine supply vaccinate americans president biden say announce pu
41,nothing say love like spread communicable disease could likely kill person love stay fuck home order f
42,department tourism recently announce creation equity fund aim support smallscale stakeholder industry sector continue reel global pandemic
43,number nyer nursing home die covid exceed
44,fully vaccinate americans will not need quarantine exposure cdc say
45,new zealand get first batch coronavirus vaccine next week
46,way change office space cre office tenanttip newnormal
47,rinku sharma give blood one murderer one month back save covidone month later gu
48,military arrest doctor nurse join civil disobedience movement myanmar take away medical supply provide medical service myanmar people cruel thing we pandemic hearthevoiceofmyanmar
49,kermit would violation nsac rule regard covid
50,really that s two total number respondent survey else vote one male respond
51,iiitd irdnewsletter anusndhaan research iiitdcailink
52,thank
53,uk strain dan andrews talk point today sth african covid variant sleeve future lo
54,new bmjresearch patient give prophylactic anticoagulant within hour admission hospital le
55,reason victoria go third lockdown nothing virus wi
56,hold
57,confirm bad anyone feel since start pandemic right like
58,india daily coronavirus case sevenday move september october november
59,think see vast impact full school return september december play significant role create terrible second wave surely need proceed caution area avoid yet another full devastating lockdown
60,confirm bad anyone feel since start pandemic right like
61,break bbc ban china report say bbc responsible slew falsify reporting
62,stop people courage expose include international journalist l
63,poor victoria they ve get another covid breakout rachel baxendale
64,truly safety kid go back school tuesday say stay school stop spread think kid stay home remote learn xmas stop spread policy suck
65,malaysians google chocolate anyone else regionmalaysia chocolate pandemic
66,china ban british state own broadcaster spread fake news impossible take side
67,discernible effect presence china coast guard south china sea ais datum past month indicate ccg increase frequency patrol expand routine presence vanguard bank
68,keep sane leo martinez encourage everyone express one feeling amid pandemic
69,put forth maintain white would not go indianapolisarea physician battle say httpstcogfhwuksoxm
70,easy question come across internet smarter wear mask stay strong indiafightscorona maskmakesyoustronger
71,rs cr npas writtenoff since rbi predict npas double post covid
72,mass urban vaccination we hamper lack language diversity vaccine team book system
73,late dentime thank
74,still catch spread covid vaccinate one ask waiver pharma company ask indemnify potential health problem result vaccine
75,you re aware kushner pick pence worthless governor charge hep chiv epidemic indiana chris christie trump pick jared put stop due christie refuse keep kushner crooked father prison jersey politic
76,play part fighting register internet banking send email subject internet banking contactcentrestaffcbzcozwno need go bank transaction enquiry get touch contact centre team
77,ensure employee free use rapid test kit call schedule onsite testing guarantee result minutespreventmorewithsahl
78,mumbai local train restriction general public unlikely go covid case spike
79,increase death africa tragic chief say thursday say must refocus everyone stamp virushttpstcozbkxibwbuw
80,infuriatingcuomo hide covid death datum run clock investigation trump dojand look like th
81,digital shift enable save facilitate operation many sector pandemic retail key one read secret retail success modern datum storage
82,hello morning june covid disrupt everything schedule tweet ill schedule random date idk yet far enough away covid go know life pretty good
83,photography like art form help we see beyond life give we access other world enjoy life lockdown image across middle east
84,covid spark resurgence isil terrorist threaten international peace security security council hear
85,defeat coronavirus sms social distancing w wear mask sanitisingwashing
86,frontline worker anxious many succumb leave without ppe due government procurement oversight catch amp unpack key takeaway special
87,social distancing restriction remain place least autumn reduce transmission coronavirus plan consider minister time report
88,reach test trace system countyhttpstcowfazdawrud
89,president joe biden visit nation lead scientist frontline fight thursday administration look boost supply vaccine end pandemic
90,accordance victorias stage four lockdown diversitat site close thursday februarystaff work home continue call we business hour
91,week christmas coronavirus case number hospitalization soar portland
92,family upset elderly member die covid leave lie hospital
93,pakistan automotive makers association give breakdown car pakistani buy economic activity pick amid coronavirus read pakistan car
94,icymi north texas vaccine center close today due inclement
95,last march opponent kevin mccarthy use racist term describe amp criticize quarantine save life
96,king poll inslee approval rating fall pandemic drag
97,blockbuster exhibition day
98,kuwaits ministry health record thursday new case past hour high number since may
99,cure aidscancer eyesight problem touch corona amitshahoffice amitshah niain
100,need farm worker amp other along food chain need vaccinate matter national food securityazdhs see clinic winter lettuce capitol
101,oh say though people around country do amazing job contain covid despite various failing top
102,traditional greek sweet deliver sydney free shipping get koulourakia shortbread biscuit deliver home work httpstcoxnbszicxnb dessert dessertlover biscuit greeksweet friend family koulourakia tellafriend sydney baklava stayhome
103,audre lordes word pat parker feel like huge reminder many we survive pandemic
104,miss someone lockdown want give personal message grandma grandad love let deliver message talk heart record message favouritesong order lockdownlove lovemyfamily
105,time temp wind sse pressure rain hum et solar uv index sunrise sunset cloudbase conlig bangor stayathome
106,perhaps time come suffer entire state million constantly go lockdown thousand return traveller maybe wait
107,love eat fish read article eat fish wait next outbreak fish farm across india find highly contaminate full waste goveg healthylifestyle healthyfood animalsright
108,pandemic prove loneliness way design livewhitney wolfe herd billionaire ceo
109,good pandemic purchase big ass porcelainonsteel whiteboard home office right ipad pro nespresso machine ever need leave home academictwitter academicchatter
110,that s joyreid sadly reid might suffer debilitate newsstrain virus call call stds severetrumpderangementsyndrome symptom include rapid worsen amp pathological hate everyone amp everything country afflict virus
111,britains economy reach level within two year reuters poll britains economy narrowly dodge doubledip recession return level within two year accord economist reuters poll say bank england u
112,vote hope stay home need senate present convict say
113,britain eu stress commitment solve northern ireland border row britain european union thursday reiterate commitment resolve postbrexit trade friction northern ireland border wake row vaccine
114,cure aidscancer eyesight problem touch corona amitshahoffice amitshah niain
115,take effort team ensure deal good can not run away rather face ityednetworkke amrefkenya mohkenya mohamade
116,rahul gandhi repeatedly attack ambani adani qs nation gain hurt indias big business w
117,vaccine important tool help we protect loved one end pandemic
118,usually fade black china ban ground falsify report xinjiang amp
119,uk social distancing rule could remain autumn time social distancing norm britain could remain autumn plan consider minister times newspaper report friday
120,physically pandemic emotionally I m storm good dress fearless
121,delhi police thursday say civil defence volunteer power prosecute covid violation coronavirus civildefence covidviolation delhipolice
122,anyone vote person april city council election require wear face mask accord strict guideline vote law city council monday
123,confirm bad anyone feel since start pandemic right like
124,join we next statscafe monday continuation discussion mixedmode datum collection light pandemicto learn register
125,gladys run victoria new south wales us lockdown tomorrow morning
126,uks restriction could place adult vaccinate public health england britain may keep measure place restrict spread entire adult population vaccinate susan hopkins managing director publi
127,break cuomo aide say state withhold nursing home covid death datum fear federal prosecutor news ht
128,politician break coronavirus rule immediately remove office first legislator int
129,learn use zerotrust approach protect employee customer device datum itshowcase msftadvocate
130,recommend
131,wellfitte mask reduce spread individual doublemaske may helpful improve fit
132,confirm bad anyone feel since start pandemic right like
133,situation nothing short national emergency congress treat quickly pass bill whose ge
134,uks report case rise death britain record rise number new daily case thursday although fall report death toll
135,thenand strip heirsany complicit spousescronie imprison year ea ptsdd capitol police officer wound imprison year family lose anyone homeless delay grifte ppepua
136,two fraser valley womens life change forever admit hospital suffering
137,change sas sme funding
138,bad news cycling classic
139,pandemic spark unprecedented interest news yet also greatly affect already struggle newspaper industry worldwide share thought amp prediction future africas print newspaper
140,watch video polystudio p series see poly enable remoteworker look sound professional wherever work pandemic beyond wfh hybridworking
141,time trump do not tweet election fraud hour august january hospitalize c
142,rinku sharma give blood one murderer one month back save covidone month later gu
143,frustration pretty much beat covid come back via quarantine strict give melbourne endure
144,uks mutate variant concern might undermine vaccine scientist say coronavirus variant first find british region kent concern mutate could undermine protection give vaccine develop head th
145,aarhusstanford research partnership respond antiadrenergic drug may protective benefit hyperinfl
146,zuma already vaccinate covid deal covid zondo commission direction prov
147,perfect save life astrazeneca say africa back shoot astrazenecas vaccine perfect big impact pandemic chief executive predict thursday drugmaker pledge double output april african un
148,factboxlatest worldwide spread coronavirus lpro pfe jnj azn
149,rinku sharma give blood one murderer one month back save covidone month later gu
150,chinaof course can not broadcast chinese china
151,heres deal can not solve every issue happen believe poverty big issue america precovid remain big issue conservative talk well be not sign tone deafness
152,industry impact grayson seeks understand speak local creative entrepreneur influencer navigate pandemic listen awkwardness minute
153,regressive effect pandemic woman academic oncology onlinefirst
154,today bad guy release prison good guy arrest myanmar burma face extremely difficult situation people suffer oppression dictator addition economic damage cause covidwhatishappeninginmyanmar
155,taylor swift continue provide we pandemic relief government
156,I ve get fellow raspberry blow month old feel fact get playgroup session swimming lesson year first lockdown
