,created_at,full_text,sentiment_score
0,2021-01-20 06:59:54+00:00,read screen front exactly go jack chinese bu,0.125
1,2021-01-20 06:59:55+00:00,take work due covid covid exposure pay leave,-0.125
2,2021-01-20 06:59:55+00:00,always live rock nickname forever middle north atlantic honestly believe less case covid total second wave every case relate travel,0.09494949494949495
3,2021-01-20 06:59:55+00:00,lockdown feel different first one drhilaryjones say get much bett,0.15
4,2021-01-20 06:59:55+00:00,extendcfss benefit small co consider har,-0.25
5,2021-01-20 06:59:55+00:00,dad hours hassle online get appointment vaccine today nyc total mess,-0.0875
6,2021-01-20 06:59:55+00:00,sporty spidey sense tingle great first effort one young star,0.38333333333333336
7,2021-01-20 06:59:55+00:00,gujarat have not get single holiday since covid pandemicemer,-0.07142857142857142
8,2021-01-20 06:59:55+00:00,find analysis comparison give frankly downright insulting uneducated gmb,-1.0
9,2021-01-20 06:59:55+00:00,pivx thank,0.0
10,2021-01-20 06:59:55+00:00,economist question govts failure plan vaccine funding,-0.3166666666666667
11,2021-01-20 06:59:55+00:00,trump supporter do not get healthcare plan wall infrastructure economic growth job get covi,0.2
12,2021-01-20 06:59:55+00:00,I m offend lack care covid allow many die texas,0.5
13,2021-01-20 06:59:55+00:00,ya definitely go straight government rightly soshe trying take easy stick issue guess something happen,0.30634920634920637
14,2021-01-20 06:59:55+00:00,dislike twenty one pilot taste,0.0
15,2021-01-20 06:59:55+00:00,honestly I m unsure think might vary bit past year covid restriction something I ve never look handicapping angle,0.175
16,2021-01-20 06:59:55+00:00,update battle month icu remain friend hospitalize tell they ve do everything,0.0
17,2021-01-20 06:59:56+00:00,murder specifically murder aunt uncle stepmother die aka big hoaxoh yeah curds turkey,0.0
18,2021-01-20 06:59:56+00:00,minute that s long take toll funeral bell time mourn life lose join we,-0.05
19,2021-01-20 06:59:56+00:00,observe number case whole epidemicthough positive case dependent number test condu,0.21363636363636362
20,2021-01-20 06:59:56+00:00,I ve hear covid already reaction first dose,0.25
21,2021-01-20 06:59:56+00:00,fact joe biden even consider open southern border group unvette migrant massive car,0.0
22,2021-01-20 06:59:56+00:00,vaccine boss rattle see turns bumble boris question safety covid vaccine,0.0
23,2021-01-20 06:59:56+00:00,indian covid vaccine shipment maldivesthe box read gift people government coron,0.0
24,2021-01-20 06:59:56+00:00,I m look forward watch real americas voice warroom pandemic fully pardon stephen k bannon,0.2
25,2021-01-20 06:59:56+00:00,lori marie key american herowe thankful service nurse healing perfor,0.0
26,2021-01-20 06:59:57+00:00,covid bush man,0.0
27,2021-01-20 06:59:57+00:00,davis county new hospitalization high amount since january rise day row growth rate new death day last time happen december,0.10818181818181818
28,2021-01-20 06:59:57+00:00,zimbabwean foreign affair minister succumb sabcnew,-0.125
29,2021-01-20 06:59:57+00:00,lifetime opportunity reevaluate what s important school postcovid generation may,0.4
30,2021-01-20 06:59:57+00:00,thailand open praneeth test positive srikanth withdrawsindianshuttlerbsaipraneeth thailandopen badmintonworldfederation toyotathailandopen,0.11363636363636363
31,2021-01-20 06:59:58+00:00,organization affect new canada emergency rent subsidy help cover eligible rent,0.13636363636363635
32,2021-01-20 06:59:58+00:00,first realworld analysis coronavirus vaccine suggest match clinical trial performanc,0.25
33,2021-01-20 06:59:58+00:00,corona corona stay away people always good idea,0.7
34,2021-01-20 06:59:58+00:00,wear mask please use sanitizer corona serious cautious joke,-0.3333333333333333
35,2021-01-20 06:59:58+00:00,family clinic understand importance choose right medical care family love one concentrate provide perfect treatment personal amp healing touchfamily familyclinic familydoctor familyphysician love covid fbd,0.38095238095238093
36,2021-01-20 06:59:58+00:00,fun late night news drop,0.0
37,2021-01-20 06:59:58+00:00,holy hell lady pull mom nursing home halt routine inspection care facilitie,0.0
38,2021-01-20 06:59:58+00:00,people tell good idea one dose week amp week amp week please read,0.7
39,2021-01-20 06:59:58+00:00,archbishop washington pray covid victims lincoln memorial,0.0
40,2021-01-20 06:59:58+00:00,remove fucking bitch goddamn motherfucke lie ass domesticterrorist traitor fuck nowwwwwwwwyou shame country do not give fuckyou goddamn motherfucke nazisgop foxnews lockherup lockthemallup,-0.5
41,2021-01-20 06:59:58+00:00,hi possible majority people around world take vaccine like happen polio possible virus like new strand do not differ old one much otherwise like seasonal flu,0.08727272727272728
42,2021-01-20 06:59:58+00:00,good morning eat well oh drink wateralso wear maskhave great day,0.75
43,2021-01-20 06:59:58+00:00,republican senator do not vote trump get ban ever hold federal office agai,0.0
44,2021-01-20 06:59:58+00:00,people die since totalbrian williams right memorial,0.2857142857142857
45,2021-01-20 06:59:58+00:00,everyone clear mcconnell see write wall desperation preserve,0.10000000000000002
46,2021-01-20 06:59:58+00:00,outbreak pandemic divert resource routine tb service create huge setback,0.4000000000000001
47,2021-01-20 06:59:58+00:00,break news zimbabwe foreign affairs minister minister sb moyo succumb lead comm,-0.125
48,2021-01-20 06:59:58+00:00,never sleep right since pandemic start urgghhhhh,0.2857142857142857
49,2021-01-20 06:59:58+00:00,interesting factthe uk high covid death rate world single minister resign,0.19619047619047622
50,2021-01-20 06:59:58+00:00,stunning email manager nursing home serious covid outbreak resident deadi urge,0.08333333333333334
51,2021-01-20 06:59:58+00:00,mean live eitheror world course easy pick side rather say should not happen different we say everyday stop party atl flexin stupidity go head doe,-0.09046717171717171
52,2021-01-20 06:59:59+00:00,naw be not covid shit round mi casa,-0.2
53,2021-01-20 06:59:59+00:00,do not forget adult need help one number volunteer run group work help people free one one coach covid temporarily stop play experiment online,0.25
54,2021-01-20 06:59:59+00:00,maharashtra stall covid vaccination drive day photo ians mumbai maharashtra government saturday,0.0
55,2021-01-20 06:59:59+00:00,covid really scary pray everyone love care stays protect healthy everybody love care,0.25
56,2021-01-20 06:59:59+00:00,count death covid relate positive test within,0.22727272727272727
57,2021-01-20 06:59:59+00:00,whole disinformation network need shut include simone gold people like peggy hall,0.2
58,2021-01-20 06:59:59+00:00,governmentvote protect nhsagainst parliament say trade dealsfor trading wit,0.0
59,2021-01-20 06:59:59+00:00,glow amber tonight join community across country remember we ve lose encoura,0.0
60,2021-01-20 06:59:59+00:00,covid real,0.2
61,2021-01-20 06:59:59+00:00,should not need mention get first dose vaccine feel terri,0.25
62,2021-01-20 06:59:59+00:00,us coronavirus death top trump leave office trumpslegacy,0.5
63,2021-01-20 06:59:59+00:00,come together offer light ring bell grieve love one lose always know ar,0.45
64,2021-01-20 06:59:59+00:00,trump supporter do not get healthcare plan wall infrastructure economic growth job get covi,0.2
65,2021-01-20 07:00:00+00:00,tell titostitastiastio stay vigilant national city,0.0
66,2021-01-20 07:00:00+00:00,coronaviru diary rev daniel joaquim evangelical church christ mozambique explain christians respond family struggle daily bread,0.0
67,2021-01-20 07:00:00+00:00,want know vaccine click detail,0.0
68,2021-01-20 07:00:00+00:00,john mcintosh push limit throughout,0.0
69,2021-01-20 07:00:00+00:00,philippine enough fund finance vaccination program national action plan deputy chief implementer vince dizon say even significant portion secure,0.21875
70,2021-01-20 07:00:00+00:00,want bame staff patient feel safe getting vaccination continue protect other much possible,0.125
71,2021-01-20 07:00:00+00:00,work standardize report still interesting question think person die covid would die cause covid cause death even preexist health complication,0.5
72,2021-01-20 07:00:00+00:00,learn vertic help dropbox create dropbox experience platform enable digital transformation speak challenge business postpandemic world still ensure business continuity corporatewebsite,0.0
73,2021-01-20 07:00:00+00:00,go sound strange underreported storywhat mean tell h,0.012500000000000011
74,2021-01-20 07:00:00+00:00,cyber pandemic may next secure cloud cyberattack cloudcompute coronavirus qacycle,0.2
75,2021-01-20 07:00:00+00:00,generate alternative livelihood spread awareness marine conservation late advocacy social distancing kadal osai fm bring significant impact tamil nadus pamban tamilnadu,0.036111111111111115
76,2021-01-20 07:00:00+00:00,recently spend day isolate major hospital unit never virus test negative four time day one test antibody test keep observationhttpstcomguujrgjpp,-0.07916666666666666
77,2021-01-20 07:00:00+00:00,rwanda procure first dose favipiravir use treat patient critical condition shis,0.125
78,2021-01-20 07:00:00+00:00,free rapid covid testing birmingham aids outreach birmingham alevery monday tuesday wednesday amp thursday lgbtq lgbtqevents lgbtqbirmingham lgbtqalabama,0.4
79,2021-01-20 07:00:00+00:00,heal must rememberthis leader lead country mourning covid dead,-0.2
80,2021-01-20 07:00:00+00:00,mexico report new daily coronavirus death country high daily toll since pandemic,0.0740909090909091
81,2021-01-20 07:00:00+00:00,update though kubasaki high school close due series coronavirus infection teacher student continue engage optional enrichment activity online spokeswoman miranda ferguson tell star stripe wednesday,0.0175
82,2021-01-20 07:00:00+00:00,anyone else quarantine million victorian hard lock entitle arsis could come play sport game,-0.3458333333333333
83,2021-01-20 07:00:00+00:00,business owner might heard website web application think theclick remember stay safedigitalmarketing onlinemarketing netwalkerng,0.0
84,2021-01-20 07:00:00+00:00,throughout academic year we ve adapt course enable delivery via online virtual channel believe lockdown do not stop leadership find,0.0
85,2021-01-20 07:00:00+00:00,new episode episode speak talk everything hot coal show amp everything do adapt pandemic well accessibility amp everything make show accessible possible accessibility,0.1903409090909091
86,2021-01-20 07:00:00+00:00,originally illinois reopening plan resurgence case gov pritzker introduce tiere mitigationshere difference tier,0.375
87,2021-01-20 07:00:00+00:00,surpass death we struggle contain virus new administration ready enter white house us presidentelect joe biden plan manage hell operation upon enter office usa,0.11212121212121212
88,2021-01-20 07:00:00+00:00,religion news january joe biden faithful catholic become president united states revolt antigenocide trade deal defeat sacred civic role uk faith group pandemic sikhs celebrate guru gobind singh jis birthday,0.0
89,2021-01-20 07:00:00+00:00,cash today cash go away crypto way,0.0
90,2021-01-20 07:00:00+00:00,have not ask since get corona small mercy,-0.25
91,2021-01-20 07:00:00+00:00,covid case india cases test india bot,0.0
92,2021-01-20 07:00:00+00:00,one man speak afternoon say feel personal responsibility get vaccine,0.0
93,2021-01-20 07:00:00+00:00,total tractor registration compare year amid bad weather amp covid uncertainty,-0.3499999999999999
94,2021-01-20 07:00:00+00:00,yesespecially get many leak sa benefit pr image,0.5
95,2021-01-20 07:00:01+00:00,despite pandemic new foreign brand enter czechrepublics market one previous,-0.05176767676767677
96,2021-01-20 07:00:01+00:00,china rush build massive quarantine camp house people outbreak mont,0.0
97,2021-01-20 07:00:01+00:00,tonight washington dc across nation come together honor americans we ve lose covid,0.0
98,2021-01-20 07:00:01+00:00,although festivity radically scale due rage coronavirus pandemic security threat steady stream alist name sign contribute musical performance,0.013888888888888886
99,2021-01-20 07:00:01+00:00,interesting factthe uk high covid death rate world single minister resign,0.19619047619047622
100,2021-01-20 07:00:01+00:00,undoubtedly cause serious harm uk economy analyse country recover one tough year jan,-0.3611111111111111
101,2021-01-20 07:00:01+00:00,despite socialmedia remained constantly grow place people spend time beforethi mean get onlinepresence right crucial find recruit right agency free tip,0.10982142857142857
102,2021-01-20 07:00:01+00:00,heres nancy preview todays newsit may bit wet tday thanks stormchristoph stay safe dryget digital subscription call today well set home delivery,0.15
103,2021-01-20 07:00:01+00:00,decrease production sale make quick rampup difficult automobile industryread,-0.08333333333333334
104,2021-01-20 07:00:01+00:00,say natashadalal tie knot,0.0
105,2021-01-20 07:00:01+00:00,ceo professor put pen paper share insight change attitude key fighting behavioural medicine must play role click read publish,0.0
106,2021-01-20 07:00:01+00:00,one britain old identical twin doris hobday die coronavirus battle gmb,0.1
107,2021-01-20 07:00:01+00:00,weekend roofie bar long story short go er event report university,-0.025
108,2021-01-20 07:00:01+00:00,since become one first place world reopen tourism dubai boom visitor around world look party like,0.25
109,2021-01-20 07:00:01+00:00,postie help many we get pandemic due rise demand staff shortage area uk face delivery delay here you re affect,0.1875
110,2021-01-20 07:00:01+00:00,inspector catch camera reveal coronavirus manipulation wuhan pandemic,0.0
111,2021-01-20 07:00:01+00:00,datuk seri tajuddin abdul rahman become eighth mp test positive,0.22727272727272727
112,2021-01-20 07:00:01+00:00,postie help many we get pandemic due rise demand staff shortage area uk face delivery delay here you re affect,0.1875
113,2021-01-20 07:00:01+00:00,read one thing keep motivated last year think futurezerodropoutchangestartsnow httpstcopzreeonlxg,0.0
114,2021-01-20 07:00:01+00:00,current condition sayre patemp chill point barometer inhgwind mph scorona virus weekly statscase nepa bradfordcounty,0.0
115,2021-01-20 07:00:01+00:00,tonight ring church bell remember loved one look we may find peace comfort,0.7
116,2021-01-20 07:00:01+00:00,do not programmer topictuesday tastingtuesday tiptuesday,0.0
117,2021-01-20 07:00:02+00:00,break news zimbabwe foreign affairs minister minister sb moyo succumb lead comm,-0.125
118,2021-01-20 07:00:02+00:00,right graph teacher covid infection rate nearly twice general population primary tas three ti,0.20892857142857144
119,2021-01-20 07:00:02+00:00,rest case,0.0
120,2021-01-20 07:00:02+00:00,vaccinevaccine still do not one malaria non hiv month one covid someone tel,0.0
121,2021-01-20 07:00:02+00:00,legal consideration employer may eye vaccination employee,0.2
122,2021-01-20 07:00:02+00:00,usually use real object real situation however due covid restriction sign perform isolationmore ever right need work together togethersignalong signalongwithus together signoftheweek,0.062142857142857146
123,2021-01-20 07:00:02+00:00,troquel de eva foami corona cutter paper cut scrapbooking,0.0
124,2021-01-20 07:00:02+00:00,happy birthday dolly parton turn year old todayin last year alone reallife superhero help fund,0.3
125,2021-01-20 07:00:02+00:00,nowplaying keep calm wash hand stay home drem tgi dremtgi httpstcobqfulgyxoj listen dremtgi dremstuff,0.30000000000000004
126,2021-01-20 07:00:02+00:00,india deeply honour longtruste partner meeting healthcare need global community supply,0.0
127,2021-01-20 07:00:02+00:00,day pandemic lets hear day,0.0
128,2021-01-20 07:00:02+00:00,want saint know minger mom supportampencourage tired please comeampread tag want,-0.4
129,2021-01-20 07:00:02+00:00,wait see biden bullshit narrativehis cabinet pick amp appointment typical wallstreet neol,-0.16666666666666666
130,2021-01-20 07:00:03+00:00,industry expert offer cybersecurity advice covid world cybersecurity covid hacker ethicalhacker cybernews cyb,0.0
131,2021-01-20 07:00:03+00:00,due impact world economic forum global risk report one important since inception see globalrisk,0.11875000000000001
132,2021-01-20 07:00:03+00:00,invest axsm today per share stock price rebound back prepandemic price investment would worth that s growth profit see myd east gpx hov aem,0.15
133,2021-01-20 07:00:03+00:00,oh perfectly okay right covid differentiate left wing right wing gathering right,0.27142857142857146
