,created_at,full_text,sentiment_score
0,2021-01-21 09:59:54+00:00,aww lovely currently help development covid response project remote oximetry monitor virtual ward also work project design reduce harm medication test new health innovation partnership local health system xxx,0.1393939393939394
1,2021-01-21 09:59:54+00:00,ask lockdown measure,0.0
2,2021-01-21 09:59:55+00:00,today country expect mark people confirm lose tonight presidentelect,0.0
3,2021-01-21 09:59:55+00:00,serum institute india manufacturer oxfordastrazeneca coronavirus vaccine covishie,0.0
4,2021-01-21 09:59:55+00:00,spend much parcel delivery lockdown tory fix can not afford htt,0.2
5,2021-01-21 09:59:55+00:00,bad us covid party ff,-0.6999999999999998
6,2021-01-21 09:59:55+00:00,certain point release onerous restrictionswho give fanatic power suspend destroy,-0.09523809523809523
7,2021-01-21 09:59:55+00:00,great turnout mlk day service faculty student csu receive vaccine,0.8
8,2021-01-21 09:59:55+00:00,pandemic capitol attack two week ago like,0.0
9,2021-01-21 09:59:55+00:00,covid death today covid death yesterdaythat death last death every hour,0.0
10,2021-01-21 09:59:55+00:00,covid start sound lot like win lottery,0.6000000000000001
11,2021-01-21 09:59:55+00:00,robbie williams quarantining caribbean,0.0
12,2021-01-21 09:59:55+00:00,modi govt bring economy oglf covid crisis sensex touch first time,0.25
13,2021-01-21 09:59:56+00:00,do not mention season bro injure covid start slow since october arsenal he s,-0.30000000000000004
14,2021-01-21 09:59:56+00:00,covid start sound lot like win lottery,0.6000000000000001
15,2021-01-21 09:59:56+00:00,hopefully lockdown have not age much,0.2
16,2021-01-21 09:59:56+00:00,uk covid death record today past hour death new zealand pop death taiwan pop,-0.05681818181818182
17,2021-01-21 09:59:56+00:00,pandemic capitol attack two week ago like,0.0
18,2021-01-21 09:59:56+00:00,joe biden allow americans die covid inauguration,0.0
19,2021-01-21 09:59:56+00:00,unbelievable situation gavin williamson ignore call make school covidsecu,-0.25
20,2021-01-21 09:59:56+00:00,dead today see libertarian lockdownsceptic crank spike fearlessly use free sp,0.1
21,2021-01-21 09:59:56+00:00,incredible go back look government say march heres government source rubbish italys pan,0.45
22,2021-01-21 09:59:56+00:00,should not comment covid lmao may die today executive order,0.6
23,2021-01-21 09:59:56+00:00,currently face four converge crisis result economic crisis climate change racial inequi,0.1
24,2021-01-21 09:59:56+00:00,president biden attend ceremony today americans die watch hey,0.0
25,2021-01-21 09:59:56+00:00,real,0.2
26,2021-01-21 09:59:57+00:00,coronaviru annual lunar new year parade replace online shopping portal,-0.05681818181818182
27,2021-01-21 09:59:57+00:00,covid pandemic seriously affect economy question city go fund digital transformation certainly crucial one significant experience topic jacques vermeulen able share,0.10833333333333335
28,2021-01-21 09:59:57+00:00,pandemic teach something father never teach isa salary never primary source,-0.2
29,2021-01-21 09:59:57+00:00,convenient death secretary matt hancock self isolate time high daily covid deat,0.08
30,2021-01-21 09:59:57+00:00,thank u hve recover without vaccine without treatment way common cold hell bent make religion covid,-0.44999999999999996
31,2021-01-21 09:59:57+00:00,catch headline sir yes sir patrick vallance worth share vaccine company glaxosmi,0.3
32,2021-01-21 09:59:57+00:00,bitcoin amp therefore arb temporary dip due biden bounce know temporary gold another store value hardly move fact qe increase amp crisis get bad stock market do not reflect thisarbkf zcash,-0.3722222222222222
33,2021-01-21 09:59:57+00:00,they ll expect ride year next election start compare muslims letterboxe,0.0
34,2021-01-21 09:59:57+00:00,hunger cold poverty lockdown via,-0.6
35,2021-01-21 09:59:57+00:00,service update half hourly stansted express service runningplease remember wear face cover travel us service update find,-0.16666666666666666
36,2021-01-21 09:59:57+00:00,service update update service information find please remember wear mask travel we train amp station thank,0.0
37,2021-01-21 09:59:57+00:00,proud many upper division student volunteer today gamecock park assist vac,0.43333333333333335
38,2021-01-21 09:59:57+00:00,well concerned fact levine pull thi mother nursing home admit covid patient say nursing home kill thousand part do not get,0.0
39,2021-01-21 09:59:57+00:00,break least people die yesterday due president joe bidens mishandle coronavirus daily death toll e,-0.14166666666666666
40,2021-01-21 09:59:57+00:00,can not believe gerard way find new job since chem show cancel bc covid,0.13636363636363635
41,2021-01-21 09:59:57+00:00,ill talk statement covid test show direct tester confirm covid pcr test p,-0.2
42,2021-01-21 09:59:57+00:00,workingforbabie important new report baby lockdown lesson thank,0.2681818181818182
43,2021-01-21 09:59:57+00:00,do not forget stay home protect nhs save livesstaysafeessex handsfacespace h,0.0
44,2021-01-21 09:59:57+00:00,covid start sound lot like win lottery,0.6000000000000001
45,2021-01-21 09:59:57+00:00,genesis healthcare huge nursing home chainthey could not afford ppe amid million shortfallgave ceo,0.4000000000000001
46,2021-01-21 09:59:58+00:00,attention span get ready bad lockdown start zone short stint,-0.1666666666666666
47,2021-01-21 09:59:58+00:00,fierce row rapid covid test whether transform society cause wave false negative,-0.35000000000000003
48,2021-01-21 09:59:58+00:00,fox news blast biden unacceptable covid death watch,0.0
49,2021-01-21 09:59:58+00:00,class xii girl student govt model hr sec school periya krishnapuram near vazhapadi salem test positive hostel close rtpcr swab take student stay hostel study schoolxpresstn,0.07575757575757576
50,2021-01-21 09:59:58+00:00,covid start sound lot like win lottery,0.6000000000000001
51,2021-01-21 09:59:58+00:00,united states could face many death less month accord we center disea,0.07777777777777779
52,2021-01-21 09:59:58+00:00,pandemic capitol attack two week ago like,0.0
53,2021-01-21 09:59:58+00:00,get ready generation idol shinee highlight announce plan long await comeback,0.07500000000000001
54,2021-01-21 09:59:58+00:00,overcome vaccine skepticism country reach herd immunity may take public service appealssome economis,0.0
55,2021-01-21 09:59:58+00:00,one thorough analysis role private sector response come take pra,0.0
56,2021-01-21 09:59:58+00:00,easy think pretty much every new contract award without tender link tory donor,0.2549242424242424
57,2021-01-21 09:59:58+00:00,impact coronavirus lowcode development platform market growth trend tech itrtg,0.0
58,2021-01-21 09:59:58+00:00,feel overwhelmed challenge time join texturehuntergatherer creative refocus amp simple indoors outdoors find fascination colour amp texture wherever slow thought find solidarity minutiae mentalhealth anxiety pandemic,0.06666666666666665
59,2021-01-21 09:59:58+00:00,yet europes big construction site hinkley c remain open do whole pandemic adversely affect compare furlough worker home group people worth examine exit normality,0.125
60,2021-01-21 09:59:59+00:00,insecurity deserve attention former governor sokoto state attahiru dalhatu bafarawa tell president,0.0
61,2021-01-21 09:59:59+00:00,oh another bule encourage foreigner stay bali cheat immigration system middle pandemic,0.0
62,2021-01-21 09:59:59+00:00,coronavirus infection rate among teacher school support staff much high among general public,0.07
63,2021-01-21 09:59:59+00:00,rich vaccinated free poor die medical experiment,0.09375
64,2021-01-21 09:59:59+00:00,dr anthony fauci say president joe biden order united states support project deploy vaccine diagnostic,0.0
65,2021-01-21 09:59:59+00:00,make government announce lockdown february erh chale make hot,0.25
66,2021-01-21 09:59:59+00:00,thread nation new long ever since first case,0.11212121212121212
67,2021-01-21 09:59:59+00:00,white house coronavirus task force hold news conference,0.0
68,2021-01-21 09:59:59+00:00,dear leftiesi see people sadly die covid usa bidens presidency yesterday see number b,-0.5
69,2021-01-21 09:59:59+00:00,please help majinder register company rider mostly young boy jobless mco ex airasia,0.1
70,2021-01-21 10:00:00+00:00,legit think one,0.0
71,2021-01-21 10:00:00+00:00,someone say thing last year performance week later lockdown,0.0
72,2021-01-21 10:00:00+00:00,overcome vaccine skepticism country reach herd immunity may take public service appealssome economis,0.0
73,2021-01-21 10:00:00+00:00,fantastic share tip people live dementia fab forgetful friend think,0.14545454545454548
74,2021-01-21 10:00:00+00:00,ok correct many police officer die covid,0.5
75,2021-01-21 10:00:00+00:00,uk govts decision let three family meet christmas day week reveal new covid variant wa,0.13636363636363635
76,2021-01-21 10:00:00+00:00,sad thing never go back like pre pandemic probably go to live year,-0.12121212121212122
77,2021-01-21 10:00:00+00:00,etihad airways emirates airline launch new travel,0.13636363636363635
78,2021-01-21 10:00:00+00:00,cheshire phoenix guard mike mccall jr admit game cancel due covid tough mental blowhttpstcokccbtqztks,-0.25347222222222227
79,2021-01-21 10:00:00+00:00,stay home vital reduce spread may need travel essential reasonswith increase flooding risk make sure check travel use link local radio follow updateshttpstconfgxlssywc,0.15
80,2021-01-21 10:00:00+00:00,brutal amp significant high court say sadiq khans ltns amp cycle lane installation unlawful amp take advantage temporary pandemic push radical amp permanent change london road without consultation they re,-0.11333333333333333
81,2021-01-21 10:00:00+00:00,californias beer industry essentially large country within large country golden state represent overall us beer market influence exceed sheer size,0.1457142857142857
82,2021-01-21 10:00:00+00:00,pandemic hospital emergency service may overwhelmed important know basic firstaid firstaidcansavelive,0.2
83,2021-01-21 10:00:00+00:00,assure god continue presence support journey faith archbishop jose palma cbcpnews feastofstonino faith,0.0
84,2021-01-21 10:00:00+00:00,dance session follow success dua lipa street dance session paige back another series video get dance lockdown access session free email markcooperclubdoncasterfoundationcoukyoyosyork,0.2333333333333333
85,2021-01-21 10:00:00+00:00,pray country hard serve jesus,-0.2916666666666667
86,2021-01-21 10:00:00+00:00,like vaccine vaccine work teach immune system defend attack find,0.0
87,2021-01-21 10:00:00+00:00,lockdown could may vaccination speed say tony blair,0.0
88,2021-01-21 10:00:00+00:00,rely feel safe lockdown number social distancing handgel car youth vaccine you re get pandemic christianlive,0.26666666666666666
89,2021-01-21 10:00:00+00:00,henderson county department public health report system error open several hundred appointment vaccine wednesday morning jan,0.0
90,2021-01-21 10:00:00+00:00,have not do already bookmark page,0.0
91,2021-01-21 10:00:00+00:00,china surpass economic growth previous health crisis period guarantee china rapid recovery also highligh countrys margin face contingency link resurgence,0.016666666666666677
92,2021-01-21 10:00:00+00:00,lincoln surround area callconnect service change include help transport vaccination appointment call info keeplincolnshiresafe heretohelp,0.0
93,2021-01-21 10:00:00+00:00,still provide service support lockdown help please get touch someone know need support nevermoreneeded loyaltolancashire,0.0
94,2021-01-21 10:00:00+00:00,today wekus morning edition former louisville detective brett hankisons jury trial set begin august indias confirm case plummet scientist try figure plus local weather traffic,0.0
95,2021-01-21 10:00:00+00:00,paediatric therapy team take extra work vaccinator help rollout vaccine role healthcare professional member public would like get involve vaccine,0.03333333333333333
96,2021-01-21 10:00:00+00:00,late unifor member register participate vigil covid hero lose pandemic include sister two bother today et live via zoom register,-0.08181818181818182
97,2021-01-21 10:00:00+00:00,pandemic capitol attack two week ago like,0.0
98,2021-01-21 10:00:00+00:00,purchase virgin coconut oil heavens heart percentage go support operation blessing campaign help brave frontliner battle coronaviru available becausewecare,0.6000000000000001
99,2021-01-21 10:00:00+00:00,townsville barra fun park reluctantly close sunday victim skyrocket public liability insurance cost,0.075
100,2021-01-21 10:00:00+00:00,uk trainer joe wicks keep spirit heart rate high online pe class britain endure thi,0.16
101,2021-01-21 10:00:00+00:00,china approach oneyear anniversary wuhan lockdown visitor trickle massive exhibition showcasing,0.0
102,2021-01-21 10:00:00+00:00,yea absolutely right well nothing know covid issue maybe feel argo go click collect mean per customer might effective way do not know,0.19107142857142856
103,2021-01-21 10:00:00+00:00,soooo obvious pass byif allegedly can not wear mask wear visorshield insteadmake compulsory will not get arrest finedeasy surely,0.0875
104,2021-01-21 10:00:00+00:00,there s still time register join govern body morning able ask question panel vaccination programmemore information,0.5
105,2021-01-21 10:00:00+00:00,follow plan letterfurlough universal basic incometake minute read full horror,0.11666666666666665
106,2021-01-21 10:00:00+00:00,ad can not wait hound barber reopen soon lockdown hard haircut keep check hound product contactless deliveriesshoot message treat yourselfhttpstcocqtsphnfol,-0.2916666666666667
107,2021-01-21 10:00:00+00:00,let break ice karibu discussion,0.0
108,2021-01-21 10:00:00+00:00,hp keen grow investment india productionlinked incentive pli scheme cover product laptop server,0.0
109,2021-01-21 10:00:00+00:00,good morning home kit available care stay safe,0.5333333333333333
110,2021-01-21 10:00:00+00:00,who s need lockdown pickmeupwere give one lucky winner chance win spend chi ch,0.5666666666666667
111,2021-01-21 10:00:00+00:00,you re design care service see measure mountain project learn collect carer story also cardiff university seek carer story care pandemic rct wellbeing,0.0
112,2021-01-21 10:00:00+00:00,learn home help we ve make lockdown learn easier accessible ever host recourse inspiration search bitesize northern ireland click,0.375
113,2021-01-21 10:00:00+00:00,january tough month especially hard middle pandemicif someone know feel vulnerable struggle isolation look eresource,-0.3680555555555556
114,2021-01-21 10:00:00+00:00,long streaming industry profit covid android,-0.05
115,2021-01-21 10:00:00+00:00,know feel bad family do not get properly say goodbye love one,-0.06666666666666661
116,2021-01-21 10:00:00+00:00,vaccine appointment hold sumter county,0.0
117,2021-01-21 10:00:00+00:00,leave house also mean let anyone enter home come fair share challenge,0.19374999999999998
118,2021-01-21 10:00:00+00:00,pay street people know amaphara queue overnight outside post office other say pay staff get place inside post,-0.0625
119,2021-01-21 10:00:00+00:00,attract investment fuel industrial growth amid pandemic strengthen state public health infrastructurehttpstcoddnowgehzm,0.0
120,2021-01-21 10:00:00+00:00,technology trend review part two ai knowledge graph effect,0.0
121,2021-01-21 10:00:01+00:00,green recovery really possible,-0.1
122,2021-01-21 10:00:01+00:00,leave business uncertain future amp position alter policy comply current condition click link bio amp let we assist draft policy operating procedure consider fix,0.0
123,2021-01-21 10:00:01+00:00,ppl keep use lame excuse covid hoax replace influenza like bush use invisible enemy osamabinladin hiding cave pass patriot act obama hire isis killary supply gun destroy country steal kid selfdeale profit,-0.25
124,2021-01-21 10:00:01+00:00,government pm andrej babis ask parliament extend emergency state framework anticoronavirus measure another day till february,0.0
125,2021-01-21 10:00:01+00:00,pandemic speed uks journey towards cashless society march atm withdrawal plummet citizen turn online pay good lizodriscoll head innovation,0.7
126,2021-01-21 10:00:01+00:00,european stock high asml help chipmaker highereuropean stock market trade high wednesday positive corporate earning offset tight german restriction fight,0.05267161410018552
127,2021-01-21 10:00:01+00:00,profound gratitude pm people india gift vaccine despite press,0.08333333333333333
128,2021-01-21 10:00:01+00:00,ted cruz would wear come take mask president bidens inauguration especially biden harris,0.0
129,2021-01-21 10:00:01+00:00,new business recovery grant available business sector base countydurham affect pandemicfor information apply,-0.08787878787878789
130,2021-01-21 10:00:01+00:00,school year begin lot child participate amount php help student continue learn pandemic,0.0
131,2021-01-21 10:00:01+00:00,think amazon could help get vaccine fast company offer help dovenews amazon ceo dave clark potus,0.2
132,2021-01-21 10:00:01+00:00,user turn online date app pandemic scammer take notice use app trick user become involve fake investment,-0.5
133,2021-01-21 10:00:01+00:00,ever consider change personal teaching style adapt education pandemic lets create lecture many separate sector via httpstcoffjgcxnxhd amazingeducation amazinglecturer amazingsystemsgoa,0.25
134,2021-01-21 10:00:01+00:00,new day biden sign executive action today combat breakdown wardenfarhi,0.11818181818181818
135,2021-01-21 10:00:01+00:00,hailsham street market take place vicarage field saturday continue operate lockdown covidprotection measure placeplease note time essential item food sell market,0.0
136,2021-01-21 10:00:01+00:00,tune shaker elmarkabi mohammed hilal al zaabi discuss electricity resilience lesson acenergyforum,0.0
137,2021-01-21 10:00:01+00:00,lot pubquiz night virtualpubquiz night replace heres quiz tip lockdown quiznight quiztime,0.0
138,2021-01-21 10:00:01+00:00,amid jail lockdown capital region sheriff office work get staff,-0.1
139,2021-01-21 10:00:01+00:00,myreport though thing add financial burden hiccup travel except lack coordination airline govt quarantine rule say shreyas datir,0.0
140,2021-01-21 10:00:01+00:00,yosemite national park force close two coronaviru vaccination center shut,-0.1
141,2021-01-21 10:00:01+00:00,despite difficulty create pandemic kahramaa complete two substation construction manhour without losttime injury qatar kahramaa,0.1
