,created_at,full_text,sentiment_score
0,2021-01-31 21:59:54+00:00,poverina mary bless little heartso intellectually lazypls accuratescience cdc website say percent number covid death death thank share little glimpse emotional journey,-0.018750000000000003
1,2021-01-31 21:59:54+00:00,study link trump rally case death,0.0
2,2021-01-31 21:59:55+00:00,social distancingthe darknessbetween winter haiku poetry micro,0.03333333333333333
3,2021-01-31 21:59:55+00:00,covid lockdown brit able drive continent without gb sticker thank new reg plate union,0.3181818181818182
4,2021-01-31 21:59:55+00:00,laugh cry question,0.3
5,2021-01-31 21:59:55+00:00,lockdown be not save life killhydroxychloroquine work fauci stop usewith report,0.0
6,2021-01-31 21:59:55+00:00,republican go run congress,0.0
7,2021-01-31 21:59:55+00:00,bidens plan trump plan plus friendly medium coverage,0.375
8,2021-01-31 21:59:55+00:00,hello lovely I m ok still struggle long covid etc I m ok xxx,0.3625
9,2021-01-31 21:59:55+00:00,uhso nutshell election eye clear politician brain back factory reset covid mode activate,0.05000000000000001
10,2021-01-31 21:59:55+00:00,covid,0.0
11,2021-01-31 21:59:55+00:00,america call covid stay home challenge would ve back normal month ago,0.075
12,2021-01-31 21:59:55+00:00,I ve complete dry january prob will not drink lockdown desire drink bare weird consider last year prosecco vodka drink tea instead,-0.08333333333333333
13,2021-01-31 21:59:55+00:00,another person list reach hand unity,0.0
14,2021-01-31 21:59:55+00:00,oxford prof sir john bell uk go nothing manufacture vaccine be not,0.0
15,2021-01-31 21:59:55+00:00,regular people do not care whether pass something vote pandemic large economic contract,0.13809523809523808
16,2021-01-31 21:59:55+00:00,lockdown valentine day problem like amp post wanna comfy cute new botee meggan gru,0.3181818181818182
17,2021-01-31 21:59:55+00:00,long cover middle trolley problem do not get ask want adjust fuck switchit fuck decide get fuck sick fucking democracylockdown people get psychological ill,-0.3404761904761905
18,2021-01-31 21:59:55+00:00,coronaviru late us hospital admission drop first time month,-0.024999999999999994
19,2021-01-31 21:59:55+00:00,worry less coronavirus death outrage preventable death ch,-0.16666666666666666
20,2021-01-31 21:59:55+00:00,need full investigation covid money really go,0.275
21,2021-01-31 21:59:55+00:00,related note every australian outbreak since ruby princess come hotel quarantine always,0.0
22,2021-01-31 21:59:55+00:00,report az friend suzy young cool way fit we die covid,0.2833333333333333
23,2021-01-31 21:59:56+00:00,het coronadashboard,0.0
24,2021-01-31 21:59:56+00:00,concern fiscal restraint trump office amp far partisan nothing mcconnel,0.1
25,2021-01-31 21:59:56+00:00,manic street preacher tolerate child next via song,0.0
26,2021-01-31 21:59:56+00:00,many school staff die covid last week on release figure covid death different occupationa,0.16666666666666666
27,2021-01-31 21:59:56+00:00,perth western australia confirm first case month mandate face mask put plac,0.125
28,2021-01-31 21:59:56+00:00,tell hollywood nobody want see pandemic tv depress unemployed existentially pl,-0.06666666666666667
29,2021-01-31 21:59:56+00:00,I m go individually reply people bc many get yes class relevant bc te,0.3
30,2021-01-31 21:59:56+00:00,wh adviser anita dunn wind biden back opportunity build broad bipartisan support nece,0.03125
31,2021-01-31 21:59:56+00:00,stop ask wyd pandemic I m rot bedroom,0.0
32,2021-01-31 21:59:56+00:00,uk fundraising hero tom moore hospitalize cnn uk fundraising hero tom moore hospitalize captain sir tom moore newsandinformation live strong television network,0.2848484848484848
33,2021-01-31 21:59:56+00:00,matt raw give instruction get wuhan take advice seriouslyexactly one year wishes never get flight back uk uks first covid evacuee wish I d stay wuhan miss,0.006410256410256406
34,2021-01-31 21:59:56+00:00,dispense drug take,0.0
35,2021-01-31 21:59:56+00:00,uk strain osun government raise alarm,0.0
36,2021-01-31 21:59:56+00:00,tdb wi pharmacist sabotage hundred dose moderna coronavirus vaccine bc think hoax,0.0
37,2021-01-31 21:59:56+00:00,poor guy waste breath,-0.30000000000000004
38,2021-01-31 21:59:57+00:00,indomitable tell james obrien thing nhs different ten year ago c,0.0
39,2021-01-31 21:59:57+00:00,vietnam face new wave uk strain vietnamese afraid quarantine well get fr,-0.2318181818181818
40,2021-01-31 21:59:57+00:00,count people expose virus unmasked indoor interaction infect person length time,0.0
41,2021-01-31 21:59:57+00:00,schumer say democrats allow republicans whittle covid aid,0.0
42,2021-01-31 21:59:57+00:00,anthony faucithere data suggest wear two mask offer protection,0.0
43,2021-01-31 21:59:57+00:00,pierre gasly selfisolate testing positive httpstcoiqpnsnmoot,0.22727272727272727
44,2021-01-31 21:59:57+00:00,tell we vaccine effective,0.6
45,2021-01-31 21:59:57+00:00,please help husband lose job home covid shutdown negative bank please help we love much,0.13333333333333333
46,2021-01-31 21:59:57+00:00,well that s pleasant read worth,0.5166666666666666
47,2021-01-31 21:59:57+00:00,two woulda find cure covid,0.0
48,2021-01-31 21:59:57+00:00,girl scout get we covid trump administration ever,0.0
49,2021-01-31 21:59:57+00:00,make filing queue pandemic unemployment make sense mom queue since kick system time inactive every time update status file people ahead make make sense,0.0
50,2021-01-31 21:59:57+00:00,hi I m invite join rewarddollars site lets earn money social medium earn sign today bonus rewarddollars makemoneyfromhome stayathome,0.03333333333333333
51,2021-01-31 21:59:57+00:00,correct chart,0.0
52,2021-01-31 21:59:57+00:00,bill gates create covid pantry marxist pizzeria sound plausible,0.45
53,2021-01-31 21:59:57+00:00,spend defend inquiry be not cute,-0.25
54,2021-01-31 21:59:57+00:00,go rant might long might short full cursingright fatherinlaw fighting,0.09999999999999999
55,2021-01-31 21:59:58+00:00,pm comment amazing,0.6000000000000001
56,2021-01-31 21:59:58+00:00,bidenlie job covid plan court packingwhat else,0.0
57,2021-01-31 21:59:58+00:00,portrait blood ii name photo video lekki ask b,0.0
58,2021-01-31 21:59:58+00:00,happy introduce incredibly talented swiss singer songwriter,0.75
59,2021-01-31 21:59:58+00:00,tax filing season begin feb irs outline step help speed refund pandemic see,0.0
60,2021-01-31 21:59:58+00:00,use everything reason ignore covid twitter must true,0.35
61,2021-01-31 21:59:58+00:00,wear mask save life,0.0
62,2021-01-31 21:59:58+00:00,none get americans kill hundred thousand dead trump lie pandemic,-0.2
63,2021-01-31 21:59:58+00:00,perhaps that s master rename flu covid,0.0
64,2021-01-31 21:59:58+00:00,think thing I m like choose side benson either you re masker understand dilemma find distracting do not wear would presume covid,0.0
65,2021-01-31 21:59:58+00:00,must already covid jab age,0.0
66,2021-01-31 21:59:58+00:00,liberal serve,0.0
67,2021-01-31 21:59:58+00:00,america call covid stay home challenge would ve back normal month ago,0.075
68,2021-01-31 21:59:58+00:00,work er yesterday one canadas covid hotspot rn work care compassionate knowledgeable say do not get mrna vaccine bc would not stop transmission messaging fail undersell misinformation poor decision,-0.45
69,2021-01-31 21:59:58+00:00,hunter biden create covid forcibly vaccinate flag,0.5
70,2021-01-31 21:59:58+00:00,case covid perth western australia today first month response full lockdown day includi,0.19999999999999998
71,2021-01-31 21:59:58+00:00,vaccine efficacy one shot include shot moderna amp pfizermoderna amp johnson,0.0
72,2021-01-31 21:59:58+00:00,medical stat show die every year flu relate virusare number still count separate fro,0.0
73,2021-01-31 21:59:59+00:00,tell hollywood nobody want see pandemic tv depress unemployed existentially pl,-0.06666666666666667
74,2021-01-31 21:59:59+00:00,chinese stateapproved expert give different opinion risk contract ccpvirus import,0.0
75,2021-01-31 21:59:59+00:00,half way goal get many underprivileged child laptop home learn lockdown please retweet please help make familys life little easy,0.14479166666666668
76,2021-01-31 21:59:59+00:00,person pharmacist,0.0
77,2021-01-31 21:59:59+00:00,remind prepandemic incident,0.0
78,2021-01-31 21:59:59+00:00,actual doctor meet people neither wear mask pandemic great example,0.4
79,2021-01-31 21:59:59+00:00,schumer say billion offer senate republicans insufficient late sign democrats plan move pre,-0.3
80,2021-01-31 21:59:59+00:00,family have not affect covid really thank god,0.2
81,2021-01-31 21:59:59+00:00,report new york attorney general letitia james say survey dozen nursing home suggest number,0.09318181818181819
82,2021-01-31 21:59:59+00:00,give onetime payment month onetime payment nine month onetime,0.0
83,2021-01-31 21:59:59+00:00,dec alshilleh bad cough covid die three week laterover people show funeral fu,-0.6999999999999998
84,2021-01-31 21:59:59+00:00,bet ass white angeleno project die within year current level spread,0.0
85,2021-01-31 21:59:59+00:00,office space amp amenity post cre newnormal office amenity tenanttip officespacehttpstconcnvejqkpa,0.0
86,2021-01-31 21:59:59+00:00,control opposition good cop bad cop routine filch public coffer rich,0.09375000000000003
87,2021-01-31 21:59:59+00:00,icymi here full video cover miles malcolm jonesbruceguthro pl,0.35
88,2021-01-31 21:59:59+00:00,thing zero covid even island middle ocean truck freight sensible thing like night curfew place leisurebusiness traveller hotel day testing journey acquire infection,0.0
89,2021-01-31 21:59:59+00:00,america call covid stay home challenge would ve back normal month ago,0.075
90,2021-01-31 21:59:59+00:00,one centenarian another captaintom,0.0
91,2021-01-31 21:59:59+00:00,wh adviser anita dunn wind biden back opportunity build broad bipartisan support nece,0.03125
92,2021-01-31 21:59:59+00:00,bret start livestream podcast march precisely bring careful scientific awareness covid,0.15000000000000002
93,2021-01-31 21:59:59+00:00,stop ask wyd pandemic I m rot bedroom,0.0
94,2021-01-31 21:59:59+00:00,take messi debacle election team rebuild covid he s pretty ok,0.375
95,2021-01-31 21:59:59+00:00,magician london top rate magician amp mindreader neb magic anybody look bday present lockdown nebmindreader magic zoom show amp highly recommend,0.33199999999999996
96,2021-01-31 21:59:59+00:00,do not even like go weekend rather stay home chill,0.0
97,2021-01-31 22:00:00+00:00,pandemic will not long pandemic,0.025
98,2021-01-31 22:00:00+00:00,outfuckingstanding brexit bonus really stake never fleg fekin gb sticker anyth,0.2
99,2021-01-31 22:00:00+00:00,allegedly die covid sound confirm covid,0.15000000000000002
100,2021-01-31 22:00:00+00:00,free drive testing lasvegasour partner medical solution venture proud serve community announce free driveup testing location right las vegas valleylocation e sunset rd las vegas nv,0.3771428571428571
101,2021-01-31 22:00:00+00:00,inna lillahi wa inna ilayhi raajiun mom pass away morning please keep family p,0.0
102,2021-01-31 22:00:00+00:00,group republican senator call biden support relief package framework work dr,0.0
103,2021-01-31 22:00:00+00:00,update mask policy say anyone age include receive vaccine need wear mask time inside,0.0
104,2021-01-31 22:00:00+00:00,tom moore world war ii veteran raise million combat pandemic walk lap around garden hospitalize,0.0
105,2021-01-31 22:00:00+00:00,increase economic development oppose propose biomass plant fight three goal member citys legislative delegation outline recent online forum sponsor springfields democratic committee,0.1
106,2021-01-31 22:00:00+00:00,biden administration lose million covid vaccinesthis entire administration jokehttpstcoapfgplhkgc,0.0
107,2021-01-31 22:00:00+00:00,cervicalcancer awareness monthcervical cancer could first cancer ever world eliminate,0.25
108,2021-01-31 22:00:00+00:00,icymi mice industry feature cnn,0.0
109,2021-01-31 22:00:00+00:00,join tomorrow around gmt play streaming et haul vaccine event channel smallstreamersc streamforgegg,0.0
110,2021-01-31 22:00:00+00:00,patient limbo cancel cancer surgery covid delay nhs care,0.0
111,2021-01-31 22:00:00+00:00,mark wright say he s forever grateful michelle keegan family battle covid,0.0
112,2021-01-31 22:00:00+00:00,even mild symptom keep love one safe gettested testing clinic multicultural resource arabic punjabi spanish lrby pnjaabii espanol,0.3333333333333333
113,2021-01-31 22:00:00+00:00,juggle parenting work pandemic get easierread say home life change,0.0
114,2021-01-31 22:00:00+00:00,mobile library van visit mount hunter oak oakdale today hope see covid safe you ll need mask please visit mobile library feel unwell,0.5
115,2021-01-31 22:00:00+00:00,reduction flu case apparently lockdown nothing label flu case covid,0.05
116,2021-01-31 22:00:00+00:00,he s right bad do not realize he s talk,-0.20714285714285707
117,2021-01-31 22:00:00+00:00,michigan stop steal morph reopen school sport,0.0
118,2021-01-31 22:00:00+00:00,tax change expect shape indias budget government spend prioritiesas finance minister present feb watch wion special broadcast andrew holland hollaand,0.17857142857142858
119,2021-01-31 22:00:00+00:00,new strain covid change ahead covidvaccines be not accident mean work pha,-0.08806818181818182
120,2021-01-31 22:00:00+00:00,law enforcement athens four county share regional jail go keep work within limit face,-0.1
121,2021-01-31 22:00:00+00:00,donna lang bethlehem pennsylvania die covid jan always love mahttpstcorvqxxxlhbf,0.5
122,2021-01-31 22:00:00+00:00,britains centenarian fundraiser captain tom hospital covid,0.0
123,2021-01-31 22:00:00+00:00,bs know hospital state amp coroner get thousand dollar covid diagnosis,0.0
124,2021-01-31 22:00:00+00:00,fairness joe biden can not remember time hell go know million va,0.0
125,2021-01-31 22:00:00+00:00,real talk global health crisis historic economic hardship time compromise resid,0.1
126,2021-01-31 22:00:00+00:00,mess biden first day dominate vaccine mysteriesbiden team still try locate upwards million vaccine dose send state mystery hamper plan speed national vaccination efforthttpstcozuvbldfuav,0.037500000000000006
127,2021-01-31 22:00:00+00:00,annual st patricks parade along greenville avenue dallas cancel second year row due,-0.125
128,2021-01-31 22:00:00+00:00,learn benefit vaccination you ll ready vaccine recommend ourshotdupage,0.2
129,2021-01-31 22:00:00+00:00,like many parent kate middleton quite busy help three child homeschooling pandemic,0.3
130,2021-01-31 22:00:01+00:00,reminder student prekgrade transition fulltime inperson learn monday feb student grade begin fulltime inperson learn five day per week begin feb detail,0.0
131,2021-01-31 22:00:01+00:00,stephanie never want return willow spring love might enough make staylove call home available asmsg iartg amreading bookboost bookplug puyb bynr romance,0.3
132,2021-01-31 22:00:01+00:00,multiple variant virus cause document we globally surprising unexpected virus constantly change mutation sometimes new variant emerge disappear time new variant emerge persist,0.1787878787878788
