,created_at,full_text,sentiment_score
122,2021-12-20 19:00:00+00:00,"RT How wide does the gulf between Omicron data and the overreactions of our ""leaders""  have to become before you stop attr...","{'neg': 0.095, 'neu': 0.905, 'pos': 0.0, 'compound': -0.296}"
123,2021-12-20 19:00:00+00:00,RT #BREAKING Premier League says football to continue despite Covid surge,"{'neg': 0.0, 'neu': 1.0, 'pos': 0.0, 'compound': 0.0}"
124,2021-12-20 19:00:00+00:00,"#WashingtonState has taken a stricter approach to #VaccineMandates, requiring certain workers to provide proof of #vaccination against COVID-19. Here's what employers need to know:","{'neg': 0.0, 'neu': 0.916, 'pos': 0.084, 'compound': 0.2732}"
125,2021-12-20 19:00:00+00:00,"Don't forget to go back for your second COVID-19 vaccine dose! If you received the Pfizer or Moderna vaccines, you won't be fully immunized against the virus until two weeks after your second shot. Find a vaccine site here:","{'neg': 0.0, 'neu': 0.951, 'pos': 0.049, 'compound': 0.2401}"
126,2021-12-20 19:00:00+00:00,"Broadway shows and touring productions across the country have been forced to cancel shows due to breakthrough COVID cases with casts and crews. 
https://t.co/bJzmqjVxah","{'neg': 0.185, 'neu': 0.815, 'pos': 0.0, 'compound': -0.6124}"
127,2021-12-20 19:00:00+00:00,"Former President Trump says he believes China should pay reparations to the entire world for the coronavirus pandemic. Do you agree?
https://t.co/uRm0YaMFlG","{'neg': 0.059, 'neu': 0.837, 'pos': 0.105, 'compound': 0.2732}"
128,2021-12-20 19:00:00+00:00,"I vote instead of #unvaccinatedAmericans being required to get the vaccine, they are forced to decline hospital care. Cuz I mean, they don't need no damn hospital care for this tiny flu bug right?","{'neg': 0.175, 'neu': 0.676, 'pos': 0.149, 'compound': -0.0338}"
129,2021-12-20 19:00:00+00:00,Latest figures from Public Health Wales,"{'neg': 0.0, 'neu': 1.0, 'pos': 0.0, 'compound': 0.0}"
130,2021-12-20 19:00:00+00:00,"Covid stimulus did more than get the economy back on its feet. The trillions of dollars helped power a new generation of stock investors. 

Learn more with ""Challenges and Opportunities in 2022"" by Chief Economist on #MarketMakers:","{'neg': 0.0, 'neu': 0.893, 'pos': 0.107, 'compound': 0.4902}"
131,2021-12-20 19:00:00+00:00,"How Marketing Leaders Can Maintain Company Culture during Covid. 

#LTEN #IndustryBrief","{'neg': 0.0, 'neu': 1.0, 'pos': 0.0, 'compound': 0.0}"
132,2021-12-20 19:00:00+00:00,"Every resident can have an essential care giver who may visit the home to offer companionship or help with care.

Essential care givers should be able to visit inside the care home even during periods of outbreak.

Read the updated guidance on care home visiting ","{'neg': 0.0, 'neu': 0.609, 'pos': 0.391, 'compound': 0.9712}"
133,2021-12-20 19:00:00+00:00,"RT omigawd, omicron is here. 

Everyone, quick. Seek out refuge in the malls and restaurants, because it's too dangerous t...","{'neg': 0.14, 'neu': 0.86, 'pos': 0.0, 'compound': -0.4767}"
134,2021-12-20 19:00:00+00:00,"So IF everybody got the flu vaccine, would the flu be permanently gone?","{'neg': 0.321, 'neu': 0.679, 'pos': 0.0, 'compound': -0.6369}"
135,2021-12-20 19:00:00+00:00,"RT #Browns coach Kevin Stefanski will remain out with COVID-19 and won't coach tonight, source said.","{'neg': 0.0, 'neu': 1.0, 'pos': 0.0, 'compound': 0.0}"
136,2021-12-20 19:00:00+00:00,RT 2/ Vaccines have done a *tremendous* job at reducing hospitalization and death but is now clear (and has been for some time) t...,"{'neg': 0.088, 'neu': 0.79, 'pos': 0.122, 'compound': 0.2382}"
137,2021-12-20 19:00:00+00:00,"EVERY household should have a home test on hand. TEST YOURSELVES and act accordingly. What the hell is so hard about that?? you don't have to report, just stay home if you are hot.","{'neg': 0.163, 'neu': 0.759, 'pos': 0.078, 'compound': -0.5351}"
138,2021-12-20 19:00:00+00:00,"RT the eternal question: do I feel this way because of depression, adhd, the pandemic, gloomy winter weather, holiday obl...","{'neg': 0.212, 'neu': 0.68, 'pos': 0.108, 'compound': -0.3818}"
139,2021-12-20 19:00:00+00:00,"More than 1.9 million 5 to 11-year-olds in the U.S. have been infected with COVID-19, and more than 8,300 have been hospitalized. COVID-19 ranks in the top 10 leading cause of death for this age group since 2020.  #ChooseVaccination","{'neg': 0.158, 'neu': 0.802, 'pos': 0.04, 'compound': -0.743}"
140,2021-12-20 19:00:00+00:00,"Since when does a reduction of hospitalisations by 133 mean ""people in hospital with Covid is increasing slightly""?!","{'neg': 0.0, 'neu': 1.0, 'pos': 0.0, 'compound': 0.0}"
141,2021-12-20 19:00:00+00:00,The will be off all week after games today and Thursday against the Columbus Blue Jackets have been postponed due to a COVID-19 outbreak within the Blue Jackets organization. Wednesday's game against Colorado was also postponed due to COVID.,"{'neg': 0.089, 'neu': 0.911, 'pos': 0.0, 'compound': -0.3818}"
142,2021-12-20 19:00:00+00:00,"Trump says he received a vaccine booster shot

https://t.co/cStX0As1nJ","{'neg': 0.0, 'neu': 1.0, 'pos': 0.0, 'compound': 0.0}"
143,2021-12-20 19:00:00+00:00,"Is black cumin seed or nigella sativa as good as Ivermectin to prevent and treat Covid?

The independent and non-profit, Frontline Covid Critical Care Association seems to think so.

FLCCA is an international group, comprised of leading critical care, medical care professionals.","{'neg': 0.084, 'neu': 0.619, 'pos': 0.297, 'compound': 0.8934}"
144,2021-12-20 19:00:00+00:00,"What Will Office Layouts Look Like After COVID-19? 

#CRE #NewNormal #Office #Layouts #TenantRep #TenantTips #CorporateRealEstate
https://t.co/INOk0OMcHr","{'neg': 0.0, 'neu': 0.857, 'pos': 0.143, 'compound': 0.3612}"
145,2021-12-20 19:00:00+00:00,Ahh. The first positive Covid news. ,"{'neg': 0.0, 'neu': 0.581, 'pos': 0.419, 'compound': 0.5574}"
146,2021-12-20 19:00:00+00:00,"Even outside of the pandemic, the plight of street vendors has remained an unfortunate constant throughout the industry's centuries-long history in New York City.

https://t.co/VyveUBByAM","{'neg': 0.111, 'neu': 0.889, 'pos': 0.0, 'compound': -0.4588}"
147,2021-12-20 19:00:00+00:00,"RT So chilling

""Most importantly, prepare yourself and your loved ones for massive disruptions again. Unlike in 2020, when local...","{'neg': 0.143, 'neu': 0.603, 'pos': 0.254, 'compound': 0.6077}"
148,2021-12-20 19:00:00+00:00,"This week's roster of events is sure to distract you from any general or omicron-related wintry sadness you might be carrying around. Check out everything from Central Cinema's Totally Christmas Sing-Along to Royal Room's 10th Anniversary Party, and more.","{'neg': 0.113, 'neu': 0.776, 'pos': 0.111, 'compound': -0.0258}"
149,2021-12-20 19:00:00+00:00,"It's true. Not to mention other places being further ahead in dealing with the pandemic. Like , what's up Ontario?","{'neg': 0.0, 'neu': 0.773, 'pos': 0.227, 'compound': 0.6486}"
150,2021-12-20 19:00:00+00:00,RT United States warns against travel to Ukraine due to threats from Russia (as well as Covid) -,"{'neg': 0.182, 'neu': 0.606, 'pos': 0.212, 'compound': 0.1779}"
151,2021-12-20 19:00:01+00:00,"Sweden has produced a COVID pass that is hard to lose, being an IMPLANT - a microchip the size of a grain of rice. We spoke with the inventors behind the new 'wearable' tech.","{'neg': 0.114, 'neu': 0.886, 'pos': 0.0, 'compound': -0.4767}"
152,2021-12-20 19:00:01+00:00,Back to wearing N95's in clinic... #WearAMask #WomenInMedicine,"{'neg': 0.0, 'neu': 1.0, 'pos': 0.0, 'compound': 0.0}"
153,2021-12-20 19:00:01+00:00,"#ICYMI: Last week, we shared some steps you can take now to be prepared for winter weather emergencies.

Take some time over the holidays to make a plan for your family, build a kit, know your neighbors, sign up for alerts, take COVID-19 precautions, and #PrepareTravisCounty!","{'neg': 0.0, 'neu': 0.857, 'pos': 0.143, 'compound': 0.7345}"
154,2021-12-20 19:00:01+00:00,"Clay Travis scolds 'CNN's village idiot' Brian Stelter over liberal pundit's latest thoughts on COVID

https://t.co/dB9BStyA36","{'neg': 0.18, 'neu': 0.82, 'pos': 0.0, 'compound': -0.5106}"
155,2021-12-20 19:00:01+00:00,"Zimbabwe on Monday received a batch of Sinovac COVID-19 vaccine donated by China, which will boost the country's vaccination campaign as it battles the fourth wave of COVID-19 pandemic.","{'neg': 0.08, 'neu': 0.836, 'pos': 0.084, 'compound': 0.0258}"
