,created_at,full_text,sentiment_score
118,2021-12-17 00:59:59+00:00,"I believe what the scientific evidence has shown: vaccines reduce--but can never eliminate--risk of infection, transmission, severe disease, hospitalization &amp; death. Millions of ppl, incl caregivers of children, are immune compromised &amp; can die from Covid despite vaccination.","{'neg': 0.223, 'neu': 0.73, 'pos': 0.047, 'compound': -0.8481}"
119,2021-12-17 00:59:59+00:00,"RT You need to get vaccinated because Delta is spreading!

You need to wear a mask because Omicron is spreading among vaccinated!...","{'neg': 0.0, 'neu': 1.0, 'pos': 0.0, 'compound': 0.0}"
120,2021-12-17 00:59:59+00:00,"Biden also declared he would beat COVID...

","{'neg': 0.0, 'neu': 1.0, 'pos': 0.0, 'compound': 0.0}"
121,2021-12-17 00:59:59+00:00,"RT Pro-tip. When going somewhere where they make people downgrade their masks, put a blue mask over your K/N95 mask. When...","{'neg': 0.0, 'neu': 1.0, 'pos': 0.0, 'compound': 0.0}"
122,2021-12-17 00:59:59+00:00,"RT Our politicians promised the drug companies indemnification. So we can't sue them if the vaccines injure us.

Looks like Bi...","{'neg': 0.0, 'neu': 0.792, 'pos': 0.208, 'compound': 0.6124}"
123,2021-12-17 00:59:59+00:00,"RT Kings forward Louis King -- who has been with franchise's G-League team -- is also entering Covid protocols, sources tell ESPN.","{'neg': 0.0, 'neu': 1.0, 'pos': 0.0, 'compound': 0.0}"
124,2021-12-17 00:59:59+00:00,Apparently all of nyc has covid how convenient is that,"{'neg': 0.0, 'neu': 1.0, 'pos': 0.0, 'compound': 0.0}"
125,2021-12-17 00:59:59+00:00,"RT bad news for ron's do nothing to fight the virus strategy, fauci says monoclonal antibody treatment wo...","{'neg': 0.161, 'neu': 0.738, 'pos': 0.101, 'compound': -0.3217}"
126,2021-12-17 00:59:59+00:00,"RT No shit sherlock!

But remember that Vanguard Group own Blackrock!

Handful of people are in charge","{'neg': 0.0, 'neu': 0.863, 'pos': 0.137, 'compound': 0.3707}"
127,2021-12-17 00:59:59+00:00,"RT I have gone through SO MANY boxes of disposable masks because we require them at the shop, but people are oh so s...","{'neg': 0.0, 'neu': 1.0, 'pos': 0.0, 'compound': 0.0}"
128,2021-12-17 00:59:59+00:00,"RT The NFL is 95% vaccinated, the NBA is 97% vaccinated, the NHL is nearly 100% vaccinated. All three leagues are still overwh...","{'neg': 0.0, 'neu': 1.0, 'pos': 0.0, 'compound': 0.0}"
129,2021-12-17 00:59:59+00:00,"RT ""Suffering is suffering is suffering. How can we continue to block vaccines in the Global South while people suffer and lose...","{'neg': 0.535, 'neu': 0.465, 'pos': 0.0, 'compound': -0.9545}"
130,2021-12-17 00:59:59+00:00,"A ""covid passport"" does mean that you MUST get jabbed against your will.
You can get a ""passport"" by taking a test.
You have the choice. Tbh i still have yet to hear a coherent logical argument for not having covid passports or the vaccine.","{'neg': 0.054, 'neu': 0.946, 'pos': 0.0, 'compound': -0.3612}"
131,2021-12-17 00:59:59+00:00,"RT So does BC start doing more? If not now, when? After 1000 daily cases? 2000? ","{'neg': 0.0, 'neu': 1.0, 'pos': 0.0, 'compound': 0.0}"
132,2021-12-17 00:59:59+00:00,"RT Witnessing people getting shut out of society for not taking a vaccine makes me very, very uncomfortable. 

Witnessing people de...","{'neg': 0.137, 'neu': 0.863, 'pos': 0.0, 'compound': -0.489}"
133,2021-12-17 00:59:59+00:00,"RT Israel is still banning foreigners from entering. Unless they are coming on a ""birthright"" trip or making aliyah. Settler c...","{'neg': 0.0, 'neu': 1.0, 'pos': 0.0, 'compound': 0.0}"
134,2021-12-17 00:59:59+00:00,"RT BREAKING: UK reports 88,376 new daily coronavirus cases, the most since the pandemic began.","{'neg': 0.0, 'neu': 1.0, 'pos': 0.0, 'compound': 0.0}"
135,2021-12-17 00:59:59+00:00,RT Money grab by GPs!!! Wtf!!! What exactly should GPs do? They have patients as well!!! Overworked as it is. Frontline in mana...,"{'neg': 0.177, 'neu': 0.748, 'pos': 0.075, 'compound': -0.5951}"
136,2021-12-17 00:59:59+00:00,"Not really exactly what you're looking for but I found this article interesting. 
https://t.co/Im0R6QRU0i","{'neg': 0.0, 'neu': 0.785, 'pos': 0.215, 'compound': 0.5499}"
137,2021-12-17 00:59:59+00:00,"RT UK reports another daily record of 88,376 new COVID cases: AFP","{'neg': 0.0, 'neu': 1.0, 'pos': 0.0, 'compound': 0.0}"
138,2021-12-17 01:00:00+00:00,"Covid, government, and people themselves. Thanks all","{'neg': 0.0, 'neu': 0.674, 'pos': 0.326, 'compound': 0.4404}"
139,2021-12-17 01:00:00+00:00,RT fuck corona,"{'neg': 0.636, 'neu': 0.364, 'pos': 0.0, 'compound': -0.5423}"
140,2021-12-17 01:00:00+00:00,Not everyone getting Covid exam week ,"{'neg': 0.0, 'neu': 1.0, 'pos': 0.0, 'compound': 0.0}"
141,2021-12-17 01:00:00+00:00,RT Why is everybody getting covid r u kissing,"{'neg': 0.0, 'neu': 0.684, 'pos': 0.316, 'compound': 0.5719}"
142,2021-12-17 01:00:00+00:00,RT The coronavirus is airborne. Very airborne. Even if you don't see anyone--doesn't mean the aerosols aren't in the air. WATC...,"{'neg': 0.0, 'neu': 1.0, 'pos': 0.0, 'compound': 0.0}"
143,2021-12-17 01:00:00+00:00,"While a case of the Omicron variant of COVID-19 has not been detected in Kansas yet, the community reacts to how the variant could potentially impact classes.","{'neg': 0.0, 'neu': 1.0, 'pos': 0.0, 'compound': 0.0}"
144,2021-12-17 01:00:00+00:00,"Village Square's packed schedule is a direct result of the pandemic, as the theater has crammed two postponed productions into the gaps in its fall lineup to play catchup.","{'neg': 0.058, 'neu': 0.865, 'pos': 0.077, 'compound': 0.1531}"
145,2021-12-17 01:00:00+00:00,Vaccine doesn't help.,"{'neg': 0.53, 'neu': 0.47, 'pos': 0.0, 'compound': -0.3089}"
146,2021-12-17 01:00:00+00:00,RT Why does it matter to you? You wouldn't report him.,"{'neg': 0.0, 'neu': 0.901, 'pos': 0.099, 'compound': 0.0258}"
147,2021-12-17 01:00:00+00:00,"Uh, because Vaccines work.

And how in the world do you know Omicron has not caused a single death?

And anyway, that's not the point. The point is to protect against all strains of COVID by boosting protection via vaccine.","{'neg': 0.13, 'neu': 0.764, 'pos': 0.106, 'compound': -0.2732}"
148,2021-12-17 01:00:00+00:00,"RT Ffs man, I hope Burnley get relegated","{'neg': 0.299, 'neu': 0.472, 'pos': 0.228, 'compound': -0.2263}"
149,2021-12-17 01:00:00+00:00,Grinch #navidad #inflacion #inseguridad #grinch #omicron,"{'neg': 0.0, 'neu': 1.0, 'pos': 0.0, 'compound': 0.0}"
150,2021-12-17 01:00:00+00:00,RT Nearly all active-duty members of the Army and Navy -- 98% -- are vaccinated against Covid-19. The service members who still ref...,"{'neg': 0.0, 'neu': 1.0, 'pos': 0.0, 'compound': 0.0}"
151,2021-12-17 01:00:00+00:00,"RT From a reliable source:

Hospitals having emergency meetings. The Govt will not lock down so NHS has to be ready. All l...","{'neg': 0.1, 'neu': 0.805, 'pos': 0.096, 'compound': -0.0258}"
152,2021-12-17 01:00:00+00:00,"RT I'm not a vaxx nag, but a lot of you are fucking weirdos OBSESSED with not taking the vaccine. Just do you and stop spamming...","{'neg': 0.376, 'neu': 0.581, 'pos': 0.043, 'compound': -0.9194}"
153,2021-12-17 01:00:00+00:00,"New coronavirus cases in #SaudiArabia stay above the 50-mark
https://t.co/pIVsoHMUfL","{'neg': 0.0, 'neu': 1.0, 'pos': 0.0, 'compound': 0.0}"
154,2021-12-17 01:00:00+00:00,this video is blowing my mind,"{'neg': 0.0, 'neu': 1.0, 'pos': 0.0, 'compound': 0.0}"
155,2021-12-17 01:00:00+00:00,"Orders for PPE and Pulse Oximeters over the holiday period for eligible general practices via their PHN close by COB today, Friday 17 December 2021. Orders resume on 4 January 2022.
https://t.co/pFZ8ueNVxP
#COVID19 
@ama_media 
@healthgovau","{'neg': 0.0, 'neu': 0.926, 'pos': 0.074, 'compound': 0.4019}"
156,2021-12-17 01:00:00+00:00,Stone Cold Lock: 41-30 on year. Double down from Brutal and Man in Stripes. Utah state +7.5 over Oregon St. Utah st. is Undervalued. Utah state 7-0 on road.Logan bonner has thrown 36 TD's and has great receivers. Oregon state is a mediocre team from a mediocre conference.,"{'neg': 0.076, 'neu': 0.849, 'pos': 0.076, 'compound': 0.0}"
157,2021-12-17 01:00:00+00:00,"RT There would be a much better picture of her face if she was not allowed to wear a mask inside of a bank. 

https://t.co...","{'neg': 0.0, 'neu': 0.892, 'pos': 0.108, 'compound': 0.4404}"
158,2021-12-17 01:00:00+00:00,"Instead of helping doctors and nurses fight the pandemic, the UCP openly attacked them. 

#ableg #abhealth #covid19ab","{'neg': 0.257, 'neu': 0.642, 'pos': 0.101, 'compound': -0.5267}"
159,2021-12-17 01:00:00+00:00,RT We're projected to be at a million COVID cases a day by Christmas and the Biden administration is still talking about...,"{'neg': 0.0, 'neu': 1.0, 'pos': 0.0, 'compound': 0.0}"
160,2021-12-17 01:00:00+00:00,"RT Poonawalla family donates Rs 500 crore to Oxford University to build new vaccine research centre 

The donation from Seru...","{'neg': 0.0, 'neu': 1.0, 'pos': 0.0, 'compound': 0.0}"
161,2021-12-17 01:00:00+00:00,I'm actually breathless because I'm so sad that this is where we are today. What a failure.,"{'neg': 0.327, 'neu': 0.673, 'pos': 0.0, 'compound': -0.8069}"
162,2021-12-17 01:00:00+00:00,RT Reclaiming our leadership role in international institutions and convening world leaders to make real progress on the biggest...,"{'neg': 0.0, 'neu': 0.865, 'pos': 0.135, 'compound': 0.4215}"
163,2021-12-17 01:00:00+00:00,"Covid Update!
Latest Changes 

Brier Elementary
Student: +1
Chadbourne Elementary
Student: +1
Glenmoor Elementary
Student: +3

District Totals
Student: 247
Staff: 65

https://t.co/LN70T7RMNe","{'neg': 0.0, 'neu': 1.0, 'pos': 0.0, 'compound': 0.0}"
164,2021-12-17 01:00:00+00:00,RT woj and shams announcing who has COVID like it's draft day,"{'neg': 0.0, 'neu': 0.815, 'pos': 0.185, 'compound': 0.3612}"
165,2021-12-17 01:00:00+00:00,RT Yikes ,"{'neg': 0.0, 'neu': 1.0, 'pos': 0.0, 'compound': 0.0}"
166,2021-12-17 01:00:00+00:00,What happened to only need to flatten the curve?,"{'neg': 0.0, 'neu': 1.0, 'pos': 0.0, 'compound': 0.0}"
167,2021-12-17 01:00:00+00:00,"Texas AG Paxton wins injunction against Biden vaccine mandate for federally-funded healthcare workers
https://t.co/xR8ZKHFLp7","{'neg': 0.0, 'neu': 0.778, 'pos': 0.222, 'compound': 0.5719}"
168,2021-12-17 01:00:00+00:00,"Over 489,100 people have died of the novel #coronavirus in 547 cities checkered across all of #Iran's 31 provinces, according to reports tallied by the Iranian opposition PMOI/MEK as of Thursday afternoon local time, December 16.
https://t.co/eO3MWNCXll","{'neg': 0.088, 'neu': 0.856, 'pos': 0.056, 'compound': -0.3182}"
169,2021-12-17 01:00:01+00:00,the shots have really proven very effective as well ,"{'neg': 0.0, 'neu': 0.538, 'pos': 0.462, 'compound': 0.7202}"
170,2021-12-17 01:00:00+00:00,ICYMI: Increasing ICU capacity to accommodate higher demand during the COVID-19 pandemic ... #freeaccess #research ... #medtwitter,"{'neg': 0.086, 'neu': 0.914, 'pos': 0.0, 'compound': -0.128}"
171,2021-12-17 01:00:01+00:00,"RT The VACCINE is not for health purposes.

It's simply the path to the GOAL.

The VACCINE PASSPORT.
Marked-distanced-dominat...","{'neg': 0.0, 'neu': 1.0, 'pos': 0.0, 'compound': 0.0}"
172,2021-12-17 01:00:01+00:00,RT Applebees. Applebees is the restaurant you willing to go to jail for.,"{'neg': 0.0, 'neu': 1.0, 'pos': 0.0, 'compound': 0.0}"
173,2021-12-17 01:00:01+00:00,RT Omicron variant: what do we know about Covid case numbers and combating it in Australia? | Australia news | The Guardia...,"{'neg': 0.0, 'neu': 1.0, 'pos': 0.0, 'compound': 0.0}"
174,2021-12-17 01:00:01+00:00,"""It is surely the greatest match I have played here in Paris."" 

- 

More 

https://t.co/8J0Etj0wcN","{'neg': 0.0, 'neu': 0.558, 'pos': 0.442, 'compound': 0.8591}"
175,2021-12-17 01:00:01+00:00,Texas Governor sent a letter to the U.S. Secretary of Defense reaffirming that Texas will not impose President COVID-19 vaccine mandate on members of the Texas National Guard. ,"{'neg': 0.0, 'neu': 0.885, 'pos': 0.115, 'compound': 0.3374}"
176,2021-12-17 01:00:01+00:00,"With omicron in 'full force,' NYC to hand out masks, tests

https://t.co/QWVOvYf0WG","{'neg': 0.0, 'neu': 0.775, 'pos': 0.225, 'compound': 0.4939}"
177,2021-12-17 01:00:01+00:00,"RT Or, and bare with me here folks, we could pay people who are doing dangerous work during a pandemic?","{'neg': 0.2, 'neu': 0.8, 'pos': 0.0, 'compound': -0.5423}"
178,2021-12-17 01:00:01+00:00,"To continue to celebrate the one year anniversary since giving out our health system's first #COVID19 vaccines, Check out this message from on who he got vaccinated for. Schedule your appointment today!","{'neg': 0.0, 'neu': 0.824, 'pos': 0.176, 'compound': 0.75}"
179,2021-12-17 01:00:01+00:00,How has the M&amp;A landscape changed due to #COVID19? #ICYMI watch GHJ's webinar recording to find out! GHJ's Peter Brown moderated this exciting panel with GHJ #TAS Expert David Sutton and Jennifer Lee. #TogetherWeMakeItHappen,"{'neg': 0.0, 'neu': 0.891, 'pos': 0.109, 'compound': 0.6177}"
180,2021-12-17 01:00:01+00:00,"It was #ChristmasParty time at Visionflex last night! 

Thank you for your support and for helping make 2021 a fantastic year at Visionflex #telehealth - despite all the challenges wrought by the pandemic.

From our team, we wish you a wonderful festive season and #happynewyear!","{'neg': 0.021, 'neu': 0.625, 'pos': 0.354, 'compound': 0.9626}"
