,created_at,full_text,sentiment_score
124,2021-12-24 01:00:00+00:00,"#COVID19 | Follow #COVIDAppropriateBehaviour - SMS to end #coronavirus 

S - Maintain a safe distance 
M - Wear your #mask properly 
S - Frequently wash/sanitize  your hands with soap 

#Unite2FightCorona","{'neg': 0.0, 'neu': 0.909, 'pos': 0.091, 'compound': 0.4404}"
125,2021-12-24 01:00:00+00:00,"The kits are being sold up to triple the retail price in some locations, according to the AG.
https://t.co/QB2CGcHtWS","{'neg': 0.0, 'neu': 1.0, 'pos': 0.0, 'compound': 0.0}"
126,2021-12-24 01:00:00+00:00,"RT Americans don't need Fauci, we have the data!","{'neg': 0.0, 'neu': 1.0, 'pos': 0.0, 'compound': 0.0}"
127,2021-12-24 01:00:00+00:00,RT With &lt;2 weeks until schools are to reopen we need an Omicron-specific plan to allow kids to return while keeping kids/staff/...,"{'neg': 0.0, 'neu': 0.917, 'pos': 0.083, 'compound': 0.2263}"
128,2021-12-24 01:00:00+00:00,"RT ADJUSTED SEVERITY of Omicron vs Delta--Need to discuss *intrinsic severity* versus *observed severity* of #Omicron, which r...","{'neg': 0.0, 'neu': 1.0, 'pos': 0.0, 'compound': 0.0}"
129,2021-12-24 01:00:00+00:00,"Supreme Court to hold special session on vaccine requirement cases
https://t.co/HC1xpWPVnN","{'neg': 0.0, 'neu': 0.588, 'pos': 0.412, 'compound': 0.743}"
130,2021-12-24 01:00:00+00:00,"My nose and eyes are streaming right now. My joints ache. That's possibly Omicron. LFT is negative but I'm isolating to protect others.
BTW, being vaxed means you have a greater chance of being an asymptomatic carrier.","{'neg': 0.092, 'neu': 0.706, 'pos': 0.202, 'compound': 0.7184}"
131,2021-12-24 01:00:00+00:00,"US Supreme Court to Take Up Biden Vaccine Mandate Cases 
https://t.co/ayGmt11j7c","{'neg': 0.0, 'neu': 0.735, 'pos': 0.265, 'compound': 0.5574}"
132,2021-12-24 01:00:00+00:00,"This #Christmas, 50 million more people in the #AsiaPacific will go hungry due to the #pandemic. On #ChristmasEve, let us check in with our communities &amp; raise awareness of the role we can play assisting the vulnerable. This is the true #spiritofChristmas.
https://t.co/RCgkdLkABD","{'neg': 0.04, 'neu': 0.849, 'pos': 0.11, 'compound': 0.5106}"
133,2021-12-24 01:00:00+00:00,RT Most people are surprised that N95/KN95/KF94 can be used more than 8 hrs. Actually the N95 spec requires that these masks mai...,"{'neg': 0.0, 'neu': 0.91, 'pos': 0.09, 'compound': 0.2878}"
134,2021-12-24 01:00:00+00:00,RT Why are healthcare workers still in surgical masks? CDC should recommended all HCW wear N95 caliber m...,"{'neg': 0.0, 'neu': 0.904, 'pos': 0.096, 'compound': 0.2023}"
135,2021-12-24 01:00:00+00:00,"Covid-19 has forced two of Australia's major airlines to cancel dozens of flights, throwing Christmas plans into disarray.

https://t.co/nvLMJgI4tn","{'neg': 0.236, 'neu': 0.764, 'pos': 0.0, 'compound': -0.6444}"
136,2021-12-24 01:00:00+00:00,"COVID-19 weekly news: Mayo Clinic expert discusses the latest on #omicron variant, one year of #COVID19 vaccines at Mayo Clinic, and predictive modeling for COVID in preparation for the holiday travel season.

https://t.co/FTJBBaLyiZ","{'neg': 0.0, 'neu': 0.922, 'pos': 0.078, 'compound': 0.4019}"
137,2021-12-24 01:00:00+00:00,"Massage brand targets at-home workers amid pandemic

https://t.co/6BSarp3ptO","{'neg': 0.0, 'neu': 1.0, 'pos': 0.0, 'compound': 0.0}"
138,2021-12-24 01:00:00+00:00,RT Always worth another watch...,"{'neg': 0.0, 'neu': 0.678, 'pos': 0.322, 'compound': 0.2263}"
139,2021-12-24 01:00:00+00:00,United Airlines cancels more than 100 flights Friday due to nationwide spike in omicron cases #7News,"{'neg': 0.102, 'neu': 0.749, 'pos': 0.15, 'compound': 0.2263}"
140,2021-12-24 01:00:00+00:00,"#ICYMI #Delmicron isn't a new variant of #COVID19 , but as Dr Shashank Joshi, member of Maharashtra's task force on COVID-19 explains, it is the combination of the twin spikes of Delta and #Omicron, which has run over Europe and the US

https://t.co/Qv0y0h2JDl","{'neg': 0.0, 'neu': 1.0, 'pos': 0.0, 'compound': 0.0}"
141,2021-12-24 01:00:00+00:00,These SA scientists were the first to detect the #BetaVariant. Less than 48 hours later the country had increased its #lockdown restrictions. What part did genomic sequencing play? Find out. #COVID19inSA,"{'neg': 0.0, 'neu': 0.866, 'pos': 0.134, 'compound': 0.5423}"
142,2021-12-24 01:00:00+00:00,"Another one, with that pre-pandemic glow!
Wish the world gets back to norm soon~

#trans #transgirl #tsgirl #tg #transwoman #transgender #TS #mtf #transmodel #girlslikeus #transisbeautiful #niyuhahu","{'neg': 0.0, 'neu': 0.893, 'pos': 0.107, 'compound': 0.4574}"
143,2021-12-24 01:00:00+00:00,"(Source in screen-grab) Wales Public Health -- 625 of 748 hospitalized COVID patients were double vaxxed. This ""majority of hospitalized are vaxxed"" trend (opinion YMMV) seems to be prevalent in many hospitals, &amp; goes against Biden WH's ""winter of pain for un-vaxxed"" narrative","{'neg': 0.073, 'neu': 0.927, 'pos': 0.0, 'compound': -0.5106}"
144,2021-12-24 01:00:00+00:00,"You are to Woke for me. I got the JNJ back in March. Thank God, I did not have any side effects. Just so you know Pfizer Moderna and FDA are working together, they are so confident about this vaccine they don't want you to know what's it, till 2075 WTF,Zombie","{'neg': 0.021, 'neu': 0.825, 'pos': 0.153, 'compound': 0.8173}"
145,2021-12-24 01:00:00+00:00,"Who cares about what Boris Johnson and Sir Keir Starmer have to say?

These two clowns have taken British politics to new depths

The Tories are getting away with whatever they want because Labour is no longer an effective opposition","{'neg': 0.048, 'neu': 0.789, 'pos': 0.162, 'compound': 0.6369}"
146,2021-12-24 01:00:00+00:00,"After two years of cancellation, Filipino Canadians attended Christmas celebrations hosted by the Philippine Consulate General in Vancouver. The activities took place before Covid-19 restrictions were reintroduced. Rowena Papasin reports. #TFCNews

WATCH:","{'neg': 0.0, 'neu': 1.0, 'pos': 0.0, 'compound': 0.0}"
147,2021-12-24 01:00:00+00:00,RT I am begging a single Canadian mainstream media outlet to interview a worker on how they're being impacted by Omicron in...,"{'neg': 0.0, 'neu': 1.0, 'pos': 0.0, 'compound': 0.0}"
148,2021-12-24 01:00:00+00:00,"RT Why the fuck didn't anyone tell me that the Moderna vaccine was made by a furry???? 

I've been able to cope...","{'neg': 0.175, 'neu': 0.825, 'pos': 0.0, 'compound': -0.6662}"
149,2021-12-24 01:00:00+00:00,"RT Hanna lives in New York.

New York reported more than 38,000 cases today. 

New York has a lower population than Flori...","{'neg': 0.095, 'neu': 0.905, 'pos': 0.0, 'compound': -0.296}"
150,2021-12-24 01:00:01+00:00,RT Hey Meghan-- did you know that the overwhelming majority of people dying and/or being hospitalized  from Covid-19 are clin...,"{'neg': 0.0, 'neu': 1.0, 'pos': 0.0, 'compound': 0.0}"
151,2021-12-24 01:00:01+00:00,Todays the day every person in the UK has got the moron variant according to daily double predictions.,"{'neg': 0.158, 'neu': 0.842, 'pos': 0.0, 'compound': -0.4939}"
152,2021-12-24 01:00:01+00:00,"Cleveland Browns center JC Tretter, the NFL Players Association president who has been pushing the league for daily COVID-19 testing all season, tested positive for the virus on Thursday.","{'neg': 0.0, 'neu': 0.886, 'pos': 0.114, 'compound': 0.5574}"
153,2021-12-24 01:00:01+00:00,"Is that COVID-19 mask you're wearing good enough amid Omicron? Here's what the experts say

By Steve McKinley (@smckinley1)
#Canada","{'neg': 0.0, 'neu': 0.868, 'pos': 0.132, 'compound': 0.4404}"
154,2021-12-24 01:00:01+00:00,"RT It's insane how we still have to buy tiny toothpaste and take our shoes off to board a plane 20 years after 9/11,  but 80...","{'neg': 0.069, 'neu': 0.931, 'pos': 0.0, 'compound': -0.2144}"
155,2021-12-24 01:00:01+00:00,"What's college life like during COVID year two? We talked to students about it, and their answers may actually surprise you.","{'neg': 0.0, 'neu': 0.805, 'pos': 0.195, 'compound': 0.5574}"
156,2021-12-24 01:00:01+00:00,"Which COVID-19 test should you use? The answer depends. A pathologist explains the advantages and limitations of the available COVID-19 tests.
https://t.co/uqqjy3tuum","{'neg': 0.0, 'neu': 0.894, 'pos': 0.106, 'compound': 0.3612}"
157,2021-12-24 01:00:01+00:00,"The infusion center uses a prioritization method for treatment for the most vulnerable patients as supplies remain limited.
https://t.co/tXR7QD9V9S","{'neg': 0.194, 'neu': 0.806, 'pos': 0.0, 'compound': -0.4754}"
158,2021-12-24 01:00:01+00:00,"Health Minister Greg Hunt today confirmed that wait times would be brought forward in the country ""out of an abundance of caution."" #COVID19 
https://t.co/qkBHHGORFU","{'neg': 0.0, 'neu': 1.0, 'pos': 0.0, 'compound': 0.0}"
