,created_at,full_text,sentiment_score
123,2021-12-16 08:00:00+00:00,"COVID-19: Global community boost poorest countries' recovery with $93bn package - Premium Times

https://t.co/yDGka5Rw9b","{'neg': 0.192, 'neu': 0.659, 'pos': 0.148, 'compound': -0.2023}"
124,2021-12-16 08:00:00+00:00,"New Zealand's director general of health has confirmed the country's first case of the Omicron variant of COVID-19.

More via","{'neg': 0.0, 'neu': 1.0, 'pos': 0.0, 'compound': 0.0}"
125,2021-12-16 08:00:01+00:00,"Happy Amy-day to myself.
This year, I had new idols, new games, and a new love.
Hope can meet all my friends after COVID finish.
AND KEEP HAPPY. GanbAmy!","{'neg': 0.0, 'neu': 0.563, 'pos': 0.437, 'compound': 0.9619}"
126,2021-12-16 08:00:01+00:00,"RT Lockdown was a really dark period for so many women.
It was as if women were locked up with animals.

These are the issu...","{'neg': 0.0, 'neu': 1.0, 'pos': 0.0, 'compound': 0.0}"
127,2021-12-16 08:00:01+00:00," Businesses are being hit hard with no-show bookings because of concerns surrounding Omicron.

 Welsh jobs will be at risk if much-needed cash is lost because of cancelled bookings.

 Labour must announce a 'cancellation compensation fund' to save the industry.","{'neg': 0.173, 'neu': 0.756, 'pos': 0.071, 'compound': -0.3818}"
128,2021-12-16 08:00:01+00:00,"RT I'm fully vaccinated and I  have had my booster. No, I don't know ""what's in it"". Neither this vaccine or the ones I ha...","{'neg': 0.0, 'neu': 1.0, 'pos': 0.0, 'compound': 0.0}"
129,2021-12-16 08:00:01+00:00,New service for people suffering COVID-19 after-effects - Bournemouth Echo,"{'neg': 0.256, 'neu': 0.744, 'pos': 0.0, 'compound': -0.4767}"
130,2021-12-16 08:00:01+00:00,Have you struggled to get one?,"{'neg': 0.324, 'neu': 0.676, 'pos': 0.0, 'compound': -0.34}"
131,2021-12-16 08:00:01+00:00,RT MPs who oppose restrictions are going to discover that people will lock themselves down as numbers spike. Their oppositio...,"{'neg': 0.0, 'neu': 1.0, 'pos': 0.0, 'compound': 0.0}"
132,2021-12-16 08:00:01+00:00,"289 NEW COVID-19 CASES

JUST IN: The DOH recorded 289 additional COVID-19 infections on Thursday, bringing the country's total number of cases up to 2,837,016. #CoronavirusPH #COVID19PH

Real-time updates on COVID-19 here:","{'neg': 0.0, 'neu': 0.951, 'pos': 0.049, 'compound': 0.1513}"
133,2021-12-16 08:00:01+00:00, A number of countries have banned Scots travellers as Omicron cases continue to rise.,"{'neg': 0.184, 'neu': 0.736, 'pos': 0.08, 'compound': -0.4019}"
134,2021-12-16 08:00:01+00:00,DELTA OMICRON is also an anagram for MEDIA CONTROL. What are the chances? ,"{'neg': 0.0, 'neu': 0.87, 'pos': 0.13, 'compound': 0.2023}"
135,2021-12-16 08:00:01+00:00,"The exclusive event continues... SOUTH PARK: POST COVID: THE RETURN OF COVID, is now streaming in the US and Canada exclusively on #ParamountPlus. Use Promo Code SOUTHPARK for a 1 month free trial. #SouthPark","{'neg': 0.0, 'neu': 0.87, 'pos': 0.13, 'compound': 0.5859}"
136,2021-12-16 08:00:01+00:00,"Current Conditions for #Sayre PA
Temp: 47.5F
Wind Chill: 47.1F
Humidity: 87%
Dew Point: 43.8F 
Barometer: 30.175 inHg
Wind: 2 mph from the SSE
Corona Virus Weekly Stats:
Cases: 304.000000
Deaths: 4.000000
Survival: 98.000000
#weewx #nepa #bradfordcounty","{'neg': 0.0, 'neu': 1.0, 'pos': 0.0, 'compound': 0.0}"
137,2021-12-16 08:00:01+00:00,#GreenBonds for climate resilience can offer a diversified source of funding for public sector investment grade issuers to mainstream resilience in COVID-19 recovery efforts. Learn more in this paper from and,"{'neg': 0.0, 'neu': 1.0, 'pos': 0.0, 'compound': 0.0}"
138,2021-12-16 08:00:01+00:00,"RT Look I'm sorry to have to say this to a panel of international medical+science+health experts, but Australia's Prime Ministe...","{'neg': 0.057, 'neu': 0.943, 'pos': 0.0, 'compound': -0.0387}"
139,2021-12-16 08:00:01+00:00,"RT The Govt has been seduced by the blinking lights of the machines in ICUs. Yes, they are impo...","{'neg': 0.113, 'neu': 0.766, 'pos': 0.122, 'compound': 0.0516}"
140,2021-12-16 08:00:01+00:00,"RT Lets flip this Anti-vaxxer status thing!
If you have been tripple juiced and Still think the unvaxxed will make you sick,...","{'neg': 0.146, 'neu': 0.854, 'pos': 0.0, 'compound': -0.5562}"
141,2021-12-16 08:00:01+00:00,"""We need to do everything we can do avoid school closures""

On this week's #PlanetNormal podcast, Trade Minister tells and why keeping children home to stem Covid would be ""the worst possible outcome""

https://t.co/EBw3EoaB15","{'neg': 0.164, 'neu': 0.836, 'pos': 0.0, 'compound': -0.743}"
142,2021-12-16 08:00:01+00:00,RT Guys my friend just sent me a video he got attacked in tescos earlier because he wouldn't wear a mask,"{'neg': 0.119, 'neu': 0.754, 'pos': 0.127, 'compound': 0.0516}"
143,2021-12-16 08:00:01+00:00,"Not me spotting my fam in this pic
@Wachira_Maleh unaona our brother somewhere?","{'neg': 0.0, 'neu': 1.0, 'pos': 0.0, 'compound': 0.0}"
144,2021-12-16 08:00:02+00:00,"289 NEW COVID-19 CASES

BREAKING: The Department of Health reported 289 additional cases of COVID-19 on Thursday, December 16, 2021, bringing the total number of cases in the Philippines to 2,837,016. #COVID19PH","{'neg': 0.0, 'neu': 0.951, 'pos': 0.049, 'compound': 0.1513}"
145,2021-12-16 08:00:02+00:00,"RT 'We are throwing everything at it'

Except sick pay, reformed test and trace, ventilation in schools, circuit breaking me...","{'neg': 0.207, 'neu': 0.793, 'pos': 0.0, 'compound': -0.5719}"
146,2021-12-16 08:00:02+00:00,"Ryanair sees Omicron hit to December, January capacity ","{'neg': 0.0, 'neu': 1.0, 'pos': 0.0, 'compound': 0.0}"
147,2021-12-16 08:00:02+00:00,Well I'm yet to hear of babies who got their polio shots and then went on to get the disease that right there is the definition of an effective vaccine this one not so much,"{'neg': 0.0, 'neu': 0.864, 'pos': 0.136, 'compound': 0.6369}"
148,2021-12-16 08:00:02+00:00,"RT 'We are throwing everything at it'

Except sick pay, reformed test and trace, ventilation in schools, circuit breaking me...","{'neg': 0.207, 'neu': 0.793, 'pos': 0.0, 'compound': -0.5719}"
149,2021-12-16 08:00:02+00:00,RT Fully fed people bado wanapata njaa and you're telling me niendelee kula. To hell with Big Njaa profit strategy.,"{'neg': 0.18, 'neu': 0.706, 'pos': 0.114, 'compound': -0.4019}"
