,created_at,full_text,sentiment_score
0,2021-12-20 18:59:54+00:00,"Fentanyl has killed 30,000 more people in the 18-45 cage category than COVID19 has, yet continue to allow our border to remain wide open as opioid deaths this century near 1,000,000. The radical leftist Democrat Party are killing our children #WalkAway","{'neg': 0.176, 'neu': 0.733, 'pos': 0.091, 'compound': -0.743}"
1,2021-12-20 18:59:54+00:00,"RT It's fucking ridiculous that medical providers have to actually beg people who can get vaccinated to do so. ""Christmas in the I...","{'neg': 0.113, 'neu': 0.887, 'pos': 0.0, 'compound': -0.4201}"
2,2021-12-20 18:59:55+00:00,"RT there have been 32 school shootings in 2021, 24 of them since August 1.","{'neg': 0.0, 'neu': 1.0, 'pos': 0.0, 'compound': 0.0}"
3,2021-12-20 18:59:55+00:00,No I'm not. I've had Covid &amp; I reacted to T cell test over 140 academic studies show I'm immune.  But I've been working like crazy to protect my children &amp; grandchildren from this dangerous jab. You clearly haven't read the science &amp; you put your child at risk.,"{'neg': 0.189, 'neu': 0.63, 'pos': 0.181, 'compound': -0.1249}"
4,2021-12-20 18:59:55+00:00,"L, played defensively, while Spurs, who had an upper hand in numbers, played aggressively for the remaining 10 minutes, but there were no goals and the match ended in a 2-2 draw.

For Liverpool, it was very disappointing to miss the three midfielders due to illness or COVID-19.","{'neg': 0.269, 'neu': 0.641, 'pos': 0.09, 'compound': -0.8965}"
5,2021-12-20 18:59:55+00:00,RT He's not helping himself tbh,"{'neg': 0.274, 'neu': 0.726, 'pos': 0.0, 'compound': -0.2235}"
6,2021-12-20 18:59:55+00:00,RT Moderna said that a booster dose of its COVID-19 vaccine appeared to be protective against the fast-spreading Omicron variant...,"{'neg': 0.0, 'neu': 1.0, 'pos': 0.0, 'compound': 0.0}"
7,2021-12-20 18:59:55+00:00,I swear they gave sorority girls covid naming privileges fr ,"{'neg': 0.102, 'neu': 0.678, 'pos': 0.22, 'compound': 0.34}"
8,2021-12-20 18:59:55+00:00,"RT I recently went to two Christmas parties. Not a single person was wearing a mask.

And it was okay, because there's no epide...","{'neg': 0.079, 'neu': 0.755, 'pos': 0.165, 'compound': 0.34}"
9,2021-12-20 18:59:55+00:00,"I got covid in the beginning of the whole pandemic, like in the first months or smth, even though I did all my precautions. It was kinda hard ","{'neg': 0.037, 'neu': 0.878, 'pos': 0.084, 'compound': 0.3384}"
10,2021-12-20 18:59:55+00:00,RT Why are triple vaxxed Democrat politicians suddenly getting COVID right before Turnip Brain's big doom and gloom speech?,"{'neg': 0.27, 'neu': 0.73, 'pos': 0.0, 'compound': -0.743}"
11,2021-12-20 18:59:55+00:00,"RT Very mixed feelings about the first 3 episodes. And yes, it's weird watching a series about covid on steroids. But Danielle De...","{'neg': 0.056, 'neu': 0.868, 'pos': 0.076, 'compound': 0.128}"
12,2021-12-20 18:59:55+00:00,"RT The COVID landscape is changing, and that means it's time to up your mask game | CBC News Whil...","{'neg': 0.0, 'neu': 1.0, 'pos': 0.0, 'compound': 0.0}"
13,2021-12-20 18:59:55+00:00,RT PLEASE READ &amp; RT: new COVID-19 exposure has been detected in the community. If you think you or someone you know is at ri...,"{'neg': 0.0, 'neu': 0.888, 'pos': 0.112, 'compound': 0.4648}"
14,2021-12-20 18:59:55+00:00,Time to triple mask sheep!!,"{'neg': 0.0, 'neu': 1.0, 'pos': 0.0, 'compound': 0.0}"
15,2021-12-20 18:59:55+00:00,"NEW EPISODE! Due to one of us getting COVID, we delved into our archives to find this unreleased episode where we take turns at reviewing the first recordings from our first ever bands. It's bloody funny, too! Want us to review your demo? Tweet us!","{'neg': 0.058, 'neu': 0.84, 'pos': 0.102, 'compound': 0.2905}"
16,2021-12-20 18:59:55+00:00,"RT Eric Swalwell wants to ban the unvaccinated from flying (something which Canada has already done).

I wonder, was this i...","{'neg': 0.153, 'neu': 0.847, 'pos': 0.0, 'compound': -0.5574}"
17,2021-12-20 18:59:56+00:00,"RT Amidst all the chaos, we can at least be comforted that the top 1%--formerly regarded as greedy sociopaths corrupted by...","{'neg': 0.217, 'neu': 0.616, 'pos': 0.167, 'compound': -0.34}"
18,2021-12-20 18:59:56+00:00,RT We're in a pandemic of bad ideas.,"{'neg': 0.333, 'neu': 0.667, 'pos': 0.0, 'compound': -0.5423}"
19,2021-12-20 18:59:56+00:00,"RT Remember the London Olympic game ceremonies? 
Check out Barcelona 1992 
https://t.co/5EA2UptntC","{'neg': 0.0, 'neu': 1.0, 'pos': 0.0, 'compound': 0.0}"
20,2021-12-20 18:59:56+00:00,RT Covid raising integrity issues in Fantasy football,"{'neg': 0.0, 'neu': 0.729, 'pos': 0.271, 'compound': 0.3818}"
21,2021-12-20 18:59:56+00:00,Bryant dealing with a COVID outbreak. Wednesday's game against Eastern Kentucky has been canceled. #keb1,"{'neg': 0.0, 'neu': 1.0, 'pos': 0.0, 'compound': 0.0}"
22,2021-12-20 18:59:56+00:00,RT Why is the world in total panic over the release of what all data so far suggests is a harmless live-attenuated version of...,"{'neg': 0.13, 'neu': 0.797, 'pos': 0.072, 'compound': -0.3804}"
23,2021-12-20 18:59:56+00:00,"RT Cases are skyrocketing again in Ontario, nearly three months into vaccine passports and with mask mandates and 86% of everyone...","{'neg': 0.0, 'neu': 1.0, 'pos': 0.0, 'compound': 0.0}"
24,2021-12-20 18:59:56+00:00,RT Ukraine: The Department continues to advise US citizens not to travel to Ukraine due to COVID-19 and to reconsider travel du...,"{'neg': 0.0, 'neu': 1.0, 'pos': 0.0, 'compound': 0.0}"
25,2021-12-20 18:59:56+00:00,"RT The Queen cancels her traditional Christmas at Sandringham in Norfolk, as a precaution against rising levels of the Omicron va...","{'neg': 0.087, 'neu': 0.913, 'pos': 0.0, 'compound': -0.2263}"
26,2021-12-20 18:59:56+00:00,"RT Our amazing foster carers give dogs the TLC &amp; home comforts they need, however long their stay 
Major adores his foster hom...","{'neg': 0.0, 'neu': 0.671, 'pos': 0.329, 'compound': 0.8687}"
27,2021-12-20 18:59:56+00:00,"Bad advice. She already has covid. Lifetime immunity. Besides, the shot in no way prevents or cures anyone from covid.","{'neg': 0.289, 'neu': 0.711, 'pos': 0.0, 'compound': -0.7115}"
28,2021-12-20 18:59:56+00:00,RT NHS on verge of burnout 'implosion' in 'never-ending Covid marathon' - interview with and why the NHS still needs...,"{'neg': 0.0, 'neu': 1.0, 'pos': 0.0, 'compound': 0.0}"
29,2021-12-20 18:59:56+00:00,RT As I left church today the pastor was standing at the door handing out Covid rapid tests. He encouraged everyone to take...,"{'neg': 0.0, 'neu': 0.898, 'pos': 0.102, 'compound': 0.3612}"
30,2021-12-20 18:59:56+00:00,RT As of today the cumulative number of #COVID19 cases identified in SA is 3 316 585 with 8 515 new cases reported. Today 105 de...,"{'neg': 0.0, 'neu': 0.951, 'pos': 0.049, 'compound': 0.0772}"
31,2021-12-20 18:59:56+00:00,"Trump supporters are killing themselves, this has always been a Republican/MAGA pandemic.","{'neg': 0.254, 'neu': 0.578, 'pos': 0.168, 'compound': -0.3612}"
32,2021-12-20 18:59:56+00:00,WILBURTWT LOCKDOWN,"{'neg': 0.0, 'neu': 1.0, 'pos': 0.0, 'compound': 0.0}"
33,2021-12-20 18:59:56+00:00,RT Why are y'all thanking her for doing the job that she failed at?? Remember she removed the mask mandate when everyone includi...,"{'neg': 0.143, 'neu': 0.857, 'pos': 0.0, 'compound': -0.5661}"
34,2021-12-20 18:59:56+00:00,"RT Drop points and Liverpool and Chelsea can't compete against the 'most expensively assembled squad ever'.
Get 3 points and...","{'neg': 0.1, 'neu': 0.9, 'pos': 0.0, 'compound': -0.2732}"
35,2021-12-20 18:59:56+00:00,"RT Our highfalutin journalists, SAGE wonks and pompous politicians have absolutely no idea what a real lockdown looks like...","{'neg': 0.113, 'neu': 0.773, 'pos': 0.114, 'compound': 0.0018}"
36,2021-12-20 18:59:56+00:00,"RT My health insurance premiums should not go up to cover the willful acts &amp; effects/results of the unvaccinated.
Bill them...","{'neg': 0.0, 'neu': 1.0, 'pos': 0.0, 'compound': 0.0}"
37,2021-12-20 18:59:56+00:00,"RT Covid testing kits are hard to find b/c when Covid waned, companies slowed their manufacture b/c they didn't want to be...","{'neg': 0.116, 'neu': 0.884, 'pos': 0.0, 'compound': -0.1586}"
38,2021-12-20 18:59:56+00:00,5 days to try and dodge Covid..... I can do it ,"{'neg': 0.0, 'neu': 1.0, 'pos': 0.0, 'compound': 0.0}"
39,2021-12-20 18:59:56+00:00,"I hate how people think talking other mitigation strategies and the vaccine have to mutually exclusive. You can promote overall wellness ( exercise, diet etc ) while still saying we have this vaccine that will serve as another, very effective tool to keep your ass from dying","{'neg': 0.123, 'neu': 0.7, 'pos': 0.177, 'compound': 0.2944}"
40,2021-12-20 18:59:56+00:00,Hilarious essay on what it will mean to go back to the office in 2022 by,"{'neg': 0.0, 'neu': 0.847, 'pos': 0.153, 'compound': 0.4019}"
41,2021-12-20 18:59:56+00:00,It's crazy how they preached for this vaccine &amp; every professional league is still being dismantled with cases.,"{'neg': 0.124, 'neu': 0.876, 'pos': 0.0, 'compound': -0.34}"
42,2021-12-20 18:59:56+00:00,"RT Vaxxed, double mask, two boosters people still getting COVID. At what point we accepting this thing is here to stay? Eat clea...","{'neg': 0.0, 'neu': 0.894, 'pos': 0.106, 'compound': 0.3818}"
43,2021-12-20 18:59:56+00:00,"Covid19 vaccine zealot &amp; evangelist, Maryland Gov Larry Hogan (completely 100% fully vaccinated), tests positive for the Yuhan Lab Chinese corona virus.

Hogan says people need to stop being foolish and take the vaccine to prevent covid infection.
https://t.co/QkYSUjADJs","{'neg': 0.156, 'neu': 0.737, 'pos': 0.108, 'compound': -0.3041}"
44,2021-12-20 18:59:56+00:00,"RT 800k in 2 years / this is literally THEE pandemic of our lifetimes, &amp; I don't think a lot of ppl get the gravitas of wha...","{'neg': 0.0, 'neu': 1.0, 'pos': 0.0, 'compound': 0.0}"
45,2021-12-20 18:59:56+00:00,"Wow. So when are us J&amp;J people going to be offered extra boosters? Seems like it should be prioritized. 

https://t.co/G2xgIIHGxQ","{'neg': 0.0, 'neu': 0.741, 'pos': 0.259, 'compound': 0.743}"
46,2021-12-20 18:59:56+00:00,"5 vaccine shots in 12 months!

Average of 1 every 2 1/2 months.

And for multiple weeks after the shot the immune system is weakened reacting to the vaccine and a person is MORE vulnerable to getting sick!","{'neg': 0.201, 'neu': 0.75, 'pos': 0.049, 'compound': -0.7851}"
47,2021-12-20 18:59:56+00:00,Bullshit. It's a death shot. All cause mortality is much higher this year over last. Vaccine is killing and injuring so many more.,"{'neg': 0.377, 'neu': 0.623, 'pos': 0.0, 'compound': -0.9201}"
48,2021-12-20 18:59:56+00:00,RT #hamiltonmusical and #Aladdin join a growing list of #Broadway shows cancelling performances through Christmas due to the surg...,"{'neg': 0.083, 'neu': 0.737, 'pos': 0.18, 'compound': 0.2732}"
49,2021-12-20 18:59:56+00:00,RT Don't you dare come after our kids with a vaccine mandate for school.,"{'neg': 0.0, 'neu': 1.0, 'pos': 0.0, 'compound': 0.0}"
50,2021-12-20 18:59:57+00:00,"RT This cannot be said enough. Not getting a vaccine is not a ""personal choice"". This isn't personal. Not wearing sunscree...","{'neg': 0.0, 'neu': 1.0, 'pos': 0.0, 'compound': 0.0}"
51,2021-12-20 18:59:57+00:00,The best part about having sinus/respiratory issues during the pandemic is thinking you have COVID every time your chronic shit pops off.,"{'neg': 0.129, 'neu': 0.719, 'pos': 0.151, 'compound': 0.1531}"
52,2021-12-20 18:59:57+00:00,"RT UK Prime Minister Boris Johnson ""reserves possibility"" of further Covid measures in England, but says there are ""still som...","{'neg': 0.0, 'neu': 1.0, 'pos': 0.0, 'compound': 0.0}"
53,2021-12-20 18:59:57+00:00,RT 91743 COVID-19 cases in the UK today. When is the prime minister going to start protecting all frontline health and socia...,"{'neg': 0.0, 'neu': 1.0, 'pos': 0.0, 'compound': 0.0}"
54,2021-12-20 18:59:57+00:00,"RT On the left is leisurely garden party (I refuse to class this as working) with wine, attended by Boris &amp; Carrie Johnson...","{'neg': 0.085, 'neu': 0.811, 'pos': 0.104, 'compound': 0.128}"
55,2021-12-20 18:59:57+00:00,RT Important news for some folks who still haven't gotten vaccinated and/or boostered:,"{'neg': 0.0, 'neu': 0.87, 'pos': 0.13, 'compound': 0.2023}"
56,2021-12-20 18:59:57+00:00,"RT Premier League statement: ""The League can today confirm that between Monday 13 December and Sunday 19 December, a record 12...","{'neg': 0.0, 'neu': 1.0, 'pos': 0.0, 'compound': 0.0}"
57,2021-12-20 18:59:57+00:00,"RT We have. In September SAGE said that if we didn't urgently introduce new restrictions, hospitalisations could be running at...","{'neg': 0.0, 'neu': 1.0, 'pos': 0.0, 'compound': 0.0}"
58,2021-12-20 18:59:57+00:00,"RT Guys Joe Rogan is NOT a scientist! Don't take what he says seriously. 

Coming up next, the Jonas brothers and big bird remindi...","{'neg': 0.08, 'neu': 0.92, 'pos': 0.0, 'compound': -0.2481}"
59,2021-12-20 18:59:57+00:00,"The obesity ""epidemic"" really is the MVP here","{'neg': 0.0, 'neu': 1.0, 'pos': 0.0, 'compound': 0.0}"
60,2021-12-20 18:59:57+00:00,"my brother: all of my friends have covid 
my 69 year old parents: come home son  ","{'neg': 0.0, 'neu': 0.829, 'pos': 0.171, 'compound': 0.4767}"
61,2021-12-20 18:59:57+00:00,"RT The conspiracy theorists who warned you of:

- Vaccine mandates 
- Vaccine passports 
- Perpetual Lockdowns
- Rampant Inflation...","{'neg': 0.234, 'neu': 0.766, 'pos': 0.0, 'compound': -0.6705}"
62,2021-12-20 18:59:57+00:00,RT they could have stopped covid,"{'neg': 0.275, 'neu': 0.725, 'pos': 0.0, 'compound': -0.2263}"
63,2021-12-20 18:59:57+00:00,Really? No MRNA VACCINE Is safe #COVIDIOTS,"{'neg': 0.24, 'neu': 0.481, 'pos': 0.279, 'compound': 0.1045}"
64,2021-12-20 18:59:57+00:00,"RT #aktuonlineexamlekrrheNge
@GopilKotwal
@AKTU_Lucknow than a 100...","{'neg': 0.0, 'neu': 1.0, 'pos': 0.0, 'compound': 0.0}"
65,2021-12-20 18:59:57+00:00,"RT Everything was going good sports,
academics,Virat getting centuries etc...life was so smooth and then covid mf arrived to r...","{'neg': 0.0, 'neu': 0.868, 'pos': 0.132, 'compound': 0.4404}"
66,2021-12-20 18:59:57+00:00,RT Just a reminder that 1) a lot of children can't get vaccinated yet and 2) the US government needs to do more than provide...,"{'neg': 0.0, 'neu': 1.0, 'pos': 0.0, 'compound': 0.0}"
67,2021-12-20 18:59:58+00:00,"RT This is good messaging from Trump which will encourage more people to get vaccinated, the media will not show you this...","{'neg': 0.0, 'neu': 0.763, 'pos': 0.237, 'compound': 0.7351}"
68,2021-12-20 18:59:58+00:00,"RT Lo and behold, o non-Arabs and Arabs! You are certainly aware of what you are experiencing of the cosmic and covidious (COVID...","{'neg': 0.0, 'neu': 0.891, 'pos': 0.109, 'compound': 0.4003}"
69,2021-12-20 18:59:58+00:00,"RT Canada: Unvaccinated people banned from going to church in Quebec.

Italy: People without a covid passport banned fro...","{'neg': 0.261, 'neu': 0.739, 'pos': 0.0, 'compound': -0.7184}"
70,2021-12-20 18:59:58+00:00,"RT ""We are all going to make mistakes"" is a funny way of saying his office lied about where he was while he went surfing in To...","{'neg': 0.159, 'neu': 0.75, 'pos': 0.091, 'compound': -0.296}"
71,2021-12-20 18:59:58+00:00,"27th lockdown won't be for a while, yet. I think this is only the third or fourth.","{'neg': 0.0, 'neu': 1.0, 'pos': 0.0, 'compound': 0.0}"
72,2021-12-20 18:59:58+00:00,"We did during the MERS and Swine Flu outbreaks. Also, no one has been able to pinpoint a large outbreak from flying. YES, planes distribute ppl point to point, but if you're that concerned about it, then shut the airlines down.","{'neg': 0.078, 'neu': 0.871, 'pos': 0.051, 'compound': -0.0473}"
73,2021-12-20 18:59:58+00:00,DEATH.,"{'neg': 1.0, 'neu': 0.0, 'pos': 0.0, 'compound': -0.5994}"
74,2021-12-20 18:59:58+00:00,RT Of course he's boosted. And so is probably nearly everyone at Fox News. And that's a good thing. Now if only they promoted i...,"{'neg': 0.0, 'neu': 0.728, 'pos': 0.272, 'compound': 0.802}"
75,2021-12-20 18:59:58+00:00,"RT NZ govt acknowledges myocarditis death of a 26 yr old linked to Pfizer vaxx. They're still ""investigating"" same deaths...","{'neg': 0.17, 'neu': 0.83, 'pos': 0.0, 'compound': -0.5994}"
76,2021-12-20 18:59:58+00:00,"RT Add the gift of protection against COVID to your Christmas list! Before gathering with friends and family, everyone who i...","{'neg': 0.0, 'neu': 0.751, 'pos': 0.249, 'compound': 0.7424}"
77,2021-12-20 18:59:58+00:00,"RT Dominic Raab defended this picture because they were ""having a drink after the formal business has been done"".

In tha...","{'neg': 0.0, 'neu': 1.0, 'pos': 0.0, 'compound': 0.0}"
78,2021-12-20 18:59:58+00:00,"The white house could have better mask production and distribution, better social distancing and vaccine mandates, continue housing and food supports, and have a real lockdown.  They aren't doing anything but scolding antivaxxers.  It's infuriating.","{'neg': 0.112, 'neu': 0.752, 'pos': 0.137, 'compound': -0.2382}"
79,2021-12-20 18:59:58+00:00,Most of the World's Vaccines Likely Won't Prevent Infection From Omicron,"{'neg': 0.097, 'neu': 0.903, 'pos': 0.0, 'compound': -0.0191}"
80,2021-12-20 18:59:58+00:00,Nope nothing came here but due to the lockdown its crazy busy with the posties as everybody is ordering online,"{'neg': 0.14, 'neu': 0.86, 'pos': 0.0, 'compound': -0.4767}"
81,2021-12-20 18:59:58+00:00,"RT Terrorists, illegal migrants &amp; narcotics infiltrating India from all sides not to mention our power hungry politicians faci...","{'neg': 0.312, 'neu': 0.688, 'pos': 0.0, 'compound': -0.8271}"
82,2021-12-20 18:59:58+00:00,RT Getting Covid is not a moral failure! Tell everyone you've been around in the past week if you test positive! Thanks!,"{'neg': 0.0, 'neu': 0.653, 'pos': 0.347, 'compound': 0.8773}"
83,2021-12-20 18:59:58+00:00,"RT Hamza, without the vaccine, Covid deaths would surpass deaths from hunger. You get that, right?","{'neg': 0.118, 'neu': 0.882, 'pos': 0.0, 'compound': -0.25}"
84,2021-12-20 18:59:58+00:00,RT Data presented this morning,"{'neg': 0.0, 'neu': 1.0, 'pos': 0.0, 'compound': 0.0}"
85,2021-12-20 18:59:58+00:00,"Covid year has really taken toll Billiam, those hairplugs not gonna help anymore.","{'neg': 0.158, 'neu': 0.842, 'pos': 0.0, 'compound': -0.3089}"
86,2021-12-20 18:59:58+00:00,"When everyone else in one's family dies because they refused to get vaccinated and stay home, there isn't any social interaction anymore.","{'neg': 0.095, 'neu': 0.905, 'pos': 0.0, 'compound': -0.296}"
87,2021-12-20 18:59:59+00:00,RT Let's provide alternative to Johnson's dithering. 1.Circuit breaker lockdown 2.Furlough &amp; business support 3.Sick Pay...,"{'neg': 0.156, 'neu': 0.699, 'pos': 0.145, 'compound': 0.2023}"
88,2021-12-20 18:59:59+00:00,RT 0.08% of the population lost their lives to COVID and the remaining 99.92% had their lives taken from them by governme...,"{'neg': 0.099, 'neu': 0.901, 'pos': 0.0, 'compound': -0.3182}"
89,2021-12-20 18:59:59+00:00,RT BREAKING: Trump reveals he got COVID vaccine booster shot,"{'neg': 0.0, 'neu': 1.0, 'pos': 0.0, 'compound': 0.0}"
90,2021-12-20 18:59:59+00:00,"Shhhh, Bonnie Henry is *trying* to have a quiet long weekend!

https://t.co/L48a7S6eLG","{'neg': 0.0, 'neu': 1.0, 'pos': 0.0, 'compound': 0.0}"
91,2021-12-20 18:59:59+00:00,"If these people are really experts, why are they rejecting all the medical research? No reduction in infection rates compared to unmasked populations and ""serious health risks,"" such as bronchitis, pneumonia, heart attacks and strokes. Even the CDC's studies condemn masks.","{'neg': 0.27, 'neu': 0.65, 'pos': 0.08, 'compound': -0.7845}"
92,2021-12-20 18:59:59+00:00,But the messaging out of MSM cables like this makes it about identity.,"{'neg': 0.0, 'neu': 0.787, 'pos': 0.213, 'compound': 0.5023}"
93,2021-12-20 18:59:59+00:00,"RT Our highfalutin journalists, SAGE wonks and pompous politicians have absolutely no idea what a real lockdown looks like...","{'neg': 0.113, 'neu': 0.773, 'pos': 0.114, 'compound': 0.0018}"
94,2021-12-20 18:59:59+00:00,"RT Is it just me or is that a dummy in the ICU bed?  Prime Time also showed this clip 

https://t.co/E7sTgA6HnP","{'neg': 0.0, 'neu': 1.0, 'pos': 0.0, 'compound': 0.0}"
95,2021-12-20 18:59:59+00:00,RT 0.08% of the population lost their lives to COVID and the remaining 99.92% had their lives taken from them by governme...,"{'neg': 0.099, 'neu': 0.901, 'pos': 0.0, 'compound': -0.3182}"
96,2021-12-20 18:59:59+00:00,"Cop yourselves on, stop doing this to people.","{'neg': 0.239, 'neu': 0.761, 'pos': 0.0, 'compound': -0.296}"
97,2021-12-20 18:59:59+00:00,"RT The vaccine is an excellent tool, but a more effective approach includes wearing premium masks &amp; addressing v...","{'neg': 0.0, 'neu': 0.71, 'pos': 0.29, 'compound': 0.7869}"
98,2021-12-20 18:59:59+00:00,"RT You're going to get COVID. Get the Vax, so that you reduce your odds of dying by 95%, so that you live to vote the libs out o...","{'neg': 0.0, 'neu': 1.0, 'pos': 0.0, 'compound': 0.0}"
99,2021-12-20 18:59:59+00:00,#NEW: Minnesota Nurses Association holding a press conference to discuss what's happening inside several local hospitals. This comes as healthcare systems say #COVID19 pandemic continuing to cause strain.,"{'neg': 0.043, 'neu': 0.957, 'pos': 0.0, 'compound': -0.0516}"
100,2021-12-20 18:59:59+00:00,"RT #Omicron is spreading fast. WHAT CAN YOU DO?
Great new animation from","{'neg': 0.0, 'neu': 0.745, 'pos': 0.255, 'compound': 0.6249}"
101,2021-12-20 18:59:59+00:00,"While Omi spreads &amp; COVID rages, it's understandable to be nervous about travel

Would be better if  &amp;  were consistent in req for vax to fly, made a show to check &amp; verify and mandate N95s for fliers

Glad to have a neg test to be able to return home to  for ","{'neg': 0.088, 'neu': 0.812, 'pos': 0.1, 'compound': 0.1779}"
102,2021-12-20 18:59:59+00:00,Are you wondering how to make grabbing CDC data simple? Learn how Ascend streamlines the process to just a few clicks:,"{'neg': 0.0, 'neu': 1.0, 'pos': 0.0, 'compound': 0.0}"
103,2021-12-20 18:59:59+00:00,"Thankfully I've only had to contend with the one lockdown. I doubt it'll happen here again, even if it should. The first one really sucked though. For so many reasons ","{'neg': 0.162, 'neu': 0.726, 'pos': 0.112, 'compound': -0.4201}"
104,2021-12-20 18:59:59+00:00,"RT 3FM News: Close contacts of Omicron will no longer need to isolate 

#news #iom","{'neg': 0.235, 'neu': 0.765, 'pos': 0.0, 'compound': -0.4588}"
105,2021-12-20 18:59:59+00:00,"RT Illness is not a moral failing. And SARS-CoV-2 is not a moral actor, it can't be reasoned with - it exists to infect.","{'neg': 0.099, 'neu': 0.803, 'pos': 0.099, 'compound': 0.0005}"
106,2021-12-20 18:59:59+00:00,"""It's unclear why the group is drinking the chemical potion, as many believe the coronavirus, which has killed over 800,000 people in the U.S. and millions worldwide so far, is a government fabrication."" 
^^
This is the part that has been confusing to me thru the whole pandemic!","{'neg': 0.162, 'neu': 0.838, 'pos': 0.0, 'compound': -0.8268}"
107,2021-12-20 18:59:59+00:00,"RT ""We are all going to make mistakes"" is a funny way of saying his office lied about where he was while he went surfing in To...","{'neg': 0.159, 'neu': 0.75, 'pos': 0.091, 'compound': -0.296}"
108,2021-12-20 18:59:59+00:00,"RT I am vaccinated and boosted and regularly tested for COVID-19, and I just tested positive. 

I'm feeling fine and so grate...","{'neg': 0.0, 'neu': 0.657, 'pos': 0.343, 'compound': 0.8126}"
109,2021-12-20 18:59:59+00:00,RT time to play everyone's favorite game show Covid Or Slept With The Heat On And Now Your Throat Is Dry,"{'neg': 0.0, 'neu': 0.779, 'pos': 0.221, 'compound': 0.6597}"
110,2021-12-20 18:59:59+00:00,What happened to Covid-19   ???,"{'neg': 0.0, 'neu': 1.0, 'pos': 0.0, 'compound': 0.0}"
111,2021-12-20 18:59:59+00:00,RT Truly sad to see seniors wait in line for hours in the cold for a #COVID19 booster dose in Freelton #HamOnt this mornin...,"{'neg': 0.111, 'neu': 0.786, 'pos': 0.104, 'compound': -0.0516}"
112,2021-12-20 18:59:59+00:00,"RT It's Monday, December 20, 2021. This is Five Minute News.

 Joe Manchin chooses right wing network to announce refusal to...","{'neg': 0.0, 'neu': 1.0, 'pos': 0.0, 'compound': 0.0}"
113,2021-12-20 18:59:59+00:00,RT Of course he's boosted. And so is probably nearly everyone at Fox News. And that's a good thing. Now if only they promoted i...,"{'neg': 0.0, 'neu': 0.728, 'pos': 0.272, 'compound': 0.802}"
114,2021-12-20 19:00:00+00:00,RT A balanced and generally encouraging analysis from the excellent,"{'neg': 0.0, 'neu': 0.53, 'pos': 0.47, 'compound': 0.7964}"
115,2021-12-20 19:00:00+00:00,Nope,"{'neg': 0.0, 'neu': 1.0, 'pos': 0.0, 'compound': 0.0}"
116,2021-12-20 19:00:00+00:00,"RT Israel bans travel to U.S., Canada, several other nations due to Omicron COVID-19 surges","{'neg': 0.0, 'neu': 1.0, 'pos': 0.0, 'compound': 0.0}"
117,2021-12-20 19:00:00+00:00,RT ontario booster booking link: can also try checking pharmacies (even calling independent ones)...,"{'neg': 0.0, 'neu': 1.0, 'pos': 0.0, 'compound': 0.0}"
118,2021-12-20 19:00:00+00:00,"RT Latest CDC data by vaccine status:

Unvaccinated: 451 cases per 100k
Vaccinated: 134 cases per 100k
Boosted: 48 cases per 1...","{'neg': 0.0, 'neu': 0.894, 'pos': 0.106, 'compound': 0.3612}"
119,2021-12-20 19:00:00+00:00,"Ah, this is the graph that made me think of it","{'neg': 0.0, 'neu': 1.0, 'pos': 0.0, 'compound': 0.0}"
120,2021-12-20 19:00:00+00:00,RT Cabinet on covid restrictions is *still* going - now hit the two hour mark and counting,"{'neg': 0.0, 'neu': 1.0, 'pos': 0.0, 'compound': 0.0}"
121,2021-12-20 19:00:00+00:00,RT covid 19 does not interest me. im ignoring it.,"{'neg': 0.393, 'neu': 0.607, 'pos': 0.0, 'compound': -0.6346}"
