,created_at,full_text,sentiment_score
0,2021-12-24 00:59:54+00:00,"RT Sajid Javid has said he cannot rule out the possibility of people aged over-65, without a Covid booster jab, one day being...","{'neg': 0.0, 'neu': 1.0, 'pos': 0.0, 'compound': 0.0}"
1,2021-12-24 00:59:54+00:00,RT guy doing my covid test called me a good girl as he put the swab in... i can't do this anymore,"{'neg': 0.0, 'neu': 0.879, 'pos': 0.121, 'compound': 0.4404}"
2,2021-12-24 00:59:54+00:00,"RT BREAKING: Washington D.C. announces that vaccine proof will be required to enter into every restaurant, bar, nightclub...","{'neg': 0.0, 'neu': 1.0, 'pos': 0.0, 'compound': 0.0}"
3,2021-12-24 00:59:55+00:00,"#FDA Docs: 40K Serious Adverse Reactions, 1.2K Deaths Associated with #Pfizer Jab in First 2.5 Months of Its Use
The ""mainstream  media"" will never report this: we know why
This is why you should never take the #Covid19 #vaccine.
Not safe &amp; Not effective 
https://t.co/EevY8O56tr","{'neg': 0.176, 'neu': 0.824, 'pos': 0.0, 'compound': -0.7757}"
4,2021-12-24 00:59:55+00:00,OMGEEEEE COVID TWINS! this sucks.,"{'neg': 0.442, 'neu': 0.558, 'pos': 0.0, 'compound': -0.4883}"
5,2021-12-24 00:59:55+00:00,"RT Can we agree the vaccines: 1) Do not stop transmission, 2) Do reduce the time one is infectious, which helps protect ot...","{'neg': 0.0, 'neu': 0.665, 'pos': 0.335, 'compound': 0.8219}"
6,2021-12-24 00:59:55+00:00,RT Yeah.   More worried about chronic illnesses (long term Cv) than survival.  And this really was a...,"{'neg': 0.26, 'neu': 0.639, 'pos': 0.1, 'compound': -0.5413}"
7,2021-12-24 00:59:55+00:00,RT There is no reason why every individual caught illegally crossing our border should not be required to take a COVID test imm...,"{'neg': 0.091, 'neu': 0.909, 'pos': 0.0, 'compound': -0.296}"
8,2021-12-24 00:59:55+00:00,Just hit 4 pharmacies cuz my son has sniffles. No covid tests anywhere. Our president said he saved Christmas but I guess he forgot about testing. CVS said the entire company is out.,"{'neg': 0.046, 'neu': 0.899, 'pos': 0.055, 'compound': 0.0772}"
9,2021-12-24 00:59:55+00:00,RT In the last 72 hrs my phone has exploded with calls/texts/emails of people who have tested positive and are asking for a...,"{'neg': 0.0, 'neu': 0.859, 'pos': 0.141, 'compound': 0.5574}"
10,2021-12-24 00:59:55+00:00,RT i miss life before covid,"{'neg': 0.242, 'neu': 0.758, 'pos': 0.0, 'compound': -0.1531}"
11,2021-12-24 00:59:55+00:00,RT Also their willingness to give a platform to those politicians who spread disinformation. Let's be real here.,"{'neg': 0.0, 'neu': 0.89, 'pos': 0.11, 'compound': 0.2732}"
12,2021-12-24 00:59:55+00:00,"Can't go to my Mother in law's house because of Covid, but I'll to see; if we can have FaceTime with them? Either way we will still have a nice relaxing Christmas  We're gonna have ham for Xmas dinner ","{'neg': 0.0, 'neu': 0.822, 'pos': 0.178, 'compound': 0.8402}"
13,2021-12-24 00:59:55+00:00,"RT At even some of the pediatric beds are filling up with adult patients, Dr. Prekker said. If a rural child had t...","{'neg': 0.0, 'neu': 1.0, 'pos': 0.0, 'compound': 0.0}"
14,2021-12-24 00:59:55+00:00,"RT If you were to analyze the ""pandemic recovery plan"" of every understaffed &amp; overwhelmed hospital system in this country r...","{'neg': 0.0, 'neu': 0.943, 'pos': 0.057, 'compound': 0.0516}"
15,2021-12-24 00:59:55+00:00,"How about this one? Makes sense you are a Habs fan though.

https://t.co/tqAdqar4OB","{'neg': 0.0, 'neu': 0.839, 'pos': 0.161, 'compound': 0.3182}"
16,2021-12-24 00:59:55+00:00,"RT Update on cousin: was moved to another hospital last week. Two amputations b/c COVID clots: left foot, right leg sounds like...","{'neg': 0.0, 'neu': 0.894, 'pos': 0.106, 'compound': 0.3612}"
17,2021-12-24 00:59:55+00:00,RT Hilarious.,"{'neg': 0.0, 'neu': 0.27, 'pos': 0.73, 'compound': 0.4019}"
18,2021-12-24 00:59:55+00:00,"RT New CDC guidance for health care workers:
 
* Workers with COVID who are asymptomatic can return to work after 7 days wit...","{'neg': 0.0, 'neu': 0.873, 'pos': 0.127, 'compound': 0.4939}"
19,2021-12-24 00:59:55+00:00,"RT Holy moly.

This study shows that after three months the vaccine effectiveness of Pfizer &amp; Moderna against Omicron is actua...","{'neg': 0.0, 'neu': 1.0, 'pos': 0.0, 'compound': 0.0}"
20,2021-12-24 00:59:55+00:00,RT He could've stopped covid,"{'neg': 0.322, 'neu': 0.678, 'pos': 0.0, 'compound': -0.2263}"
21,2021-12-24 00:59:55+00:00,"RT Marjorie Taylor Greene owns stock in three vaccine producers.

Rep. Greene is happy to attack science and profit at the...","{'neg': 0.112, 'neu': 0.65, 'pos': 0.238, 'compound': 0.5423}"
22,2021-12-24 00:59:55+00:00,RT The biggest crime of vaccine cards is that they aren't wallet-sized.,"{'neg': 0.241, 'neu': 0.759, 'pos': 0.0, 'compound': -0.5423}"
23,2021-12-24 00:59:56+00:00,RT Limit gatherings.  Open windows.  Wear a mask.  Rapid test.  Get vaccinated.,"{'neg': 0.0, 'neu': 1.0, 'pos': 0.0, 'compound': 0.0}"
24,2021-12-24 00:59:56+00:00,"For more than a year now, scientists with HRSD have been testing sewage weekly in order to track COVID-19 and its presence in the community.

Ahead of the holidays, preliminary data shows case numbers are going to continue to go up.

https://t.co/pCBcH6XPP0","{'neg': 0.0, 'neu': 0.94, 'pos': 0.06, 'compound': 0.3818}"
25,2021-12-24 00:59:56+00:00,RT DEVELOPING: United Airlines is canceling more than 100 Christmas Eve flights citing the Omicron variant's impact on flight...,"{'neg': 0.0, 'neu': 0.865, 'pos': 0.135, 'compound': 0.4215}"
26,2021-12-24 00:59:56+00:00,RT I never thought I'd see Trump debunk Candace Owens' vaccine misinfo in real-time. Y'all know where I stand on Trump. I spen...,"{'neg': 0.0, 'neu': 1.0, 'pos': 0.0, 'compound': 0.0}"
27,2021-12-24 00:59:56+00:00,"Seems like a lot of people need to come to grips with the fact that ""end the pandemic"" is not the same as ""eliminate Covid.""","{'neg': 0.0, 'neu': 0.906, 'pos': 0.094, 'compound': 0.3612}"
28,2021-12-24 00:59:56+00:00,RT A very helpful thread - a shorter generation time for omicron may explain some of the transmission dynamics we've seen in...,"{'neg': 0.0, 'neu': 0.794, 'pos': 0.206, 'compound': 0.6361}"
29,2021-12-24 00:59:56+00:00,"RT Paxlovid contains protease inhibitors, a class of drugs that wouldn't exist without the tireless efforts of ACT UP in...","{'neg': 0.095, 'neu': 0.905, 'pos': 0.0, 'compound': -0.25}"
30,2021-12-24 00:59:56+00:00,RT a new variant means I should be getting a new stimulus check,"{'neg': 0.0, 'neu': 1.0, 'pos': 0.0, 'compound': 0.0}"
31,2021-12-24 00:59:56+00:00,"RT Well, NSW leading Australia out of the pandemic worked well, didn't it","{'neg': 0.0, 'neu': 0.724, 'pos': 0.276, 'compound': 0.4939}"
32,2021-12-24 00:59:56+00:00,RT BREAKING: Ecuador says COVID-19 vaccination is mandatory for all citizens over the age 5,"{'neg': 0.0, 'neu': 0.915, 'pos': 0.085, 'compound': 0.0772}"
33,2021-12-24 00:59:56+00:00,"RT Trump said it. COVID vaccines work at reducing serious illness and keep you protected. 

He's vaccinated. Are you?","{'neg': 0.175, 'neu': 0.699, 'pos': 0.127, 'compound': -0.0258}"
34,2021-12-24 00:59:56+00:00,"RT Instead of n95 and kn95, they should have fun names like  ""boyfriend mask"" and ""bootcut""","{'neg': 0.0, 'neu': 0.707, 'pos': 0.293, 'compound': 0.7003}"
35,2021-12-24 00:59:56+00:00,RT Looks like Omicron causes more of a flash flood than a wave. Still unknown: What will happen to hospitals in the US as ca...,"{'neg': 0.0, 'neu': 0.906, 'pos': 0.094, 'compound': 0.3612}"
36,2021-12-24 00:59:56+00:00,"RT They keep telling us ""OMICRON"" just surfaced. It is a bold-faced lie and needs to be challenged.","{'neg': 0.076, 'neu': 0.924, 'pos': 0.0, 'compound': -0.1027}"
37,2021-12-24 00:59:56+00:00,RT Keep yourself and your familia safer this holiday season. Visit to find a COVID-19 vaccine or b...,"{'neg': 0.0, 'neu': 0.73, 'pos': 0.27, 'compound': 0.7118}"
38,2021-12-24 00:59:56+00:00,RT Urgent care chain CityMD announced it is temporarily closing more than a dozen of its 150 locations in New York and New J...,"{'neg': 0.0, 'neu': 0.815, 'pos': 0.185, 'compound': 0.6124}"
39,2021-12-24 00:59:56+00:00,RT Another Christmas ruined by covid fear mongering.  I'm just taking the fucking tree down,"{'neg': 0.403, 'neu': 0.597, 'pos': 0.0, 'compound': -0.7964}"
40,2021-12-24 00:59:56+00:00,"RT Biden administration was briefed in October on a 10-page plan for a ""Testing Surge to Prevent Holiday COVID Surge"" and...","{'neg': 0.0, 'neu': 0.833, 'pos': 0.167, 'compound': 0.4215}"
41,2021-12-24 00:59:56+00:00,"ONE CHANCE, BAAANG !!!","{'neg': 0.0, 'neu': 0.454, 'pos': 0.546, 'compound': 0.5587}"
42,2021-12-24 00:59:56+00:00,"I had Covid, I didn't need to be intubated.  Didn't die either.","{'neg': 0.0, 'neu': 0.778, 'pos': 0.222, 'compound': 0.4847}"
43,2021-12-24 00:59:56+00:00,RT Based off convos with medical experts it's likely 1-2% of Covid deaths are from people who were healthy with no comorbidities....,"{'neg': 0.088, 'neu': 0.803, 'pos': 0.108, 'compound': 0.128}"
44,2021-12-24 00:59:56+00:00,RT Got covid. I'm afraid I might survive.,"{'neg': 0.0, 'neu': 1.0, 'pos': 0.0, 'compound': 0.0}"
45,2021-12-24 00:59:56+00:00,His vaccine sucks!,"{'neg': 0.583, 'neu': 0.417, 'pos': 0.0, 'compound': -0.4199}"
46,2021-12-24 00:59:56+00:00,RT People 'microdosing' on psychedelics to improve wellbeing during pandemic ,"{'neg': 0.0, 'neu': 0.756, 'pos': 0.244, 'compound': 0.4404}"
47,2021-12-24 00:59:56+00:00,"RT Some people are legitimately disappointed that 'Omicron' just isn't that deadly. 

DISAPPOINTED.

They want this charade and...","{'neg': 0.138, 'neu': 0.667, 'pos': 0.195, 'compound': 0.0763}"
48,2021-12-24 00:59:56+00:00,"I'm sure that a few months from now - or maybe a couple of years - the CDC will declare the pandemic over and we can all go back to the way things were. But given that decision is inevitable, why not make it now ?","{'neg': 0.0, 'neu': 0.965, 'pos': 0.035, 'compound': 0.1655}"
49,2021-12-24 00:59:57+00:00,"RT Some people are legitimately disappointed that 'Omicron' just isn't that deadly. 

DISAPPOINTED.

They want this charade and...","{'neg': 0.138, 'neu': 0.667, 'pos': 0.195, 'compound': 0.0763}"
50,2021-12-24 00:59:57+00:00,RT A reminder that the shortage of Covid tests was completely manufactured for profit.,"{'neg': 0.117, 'neu': 0.699, 'pos': 0.184, 'compound': 0.2878}"
51,2021-12-24 00:59:57+00:00,RT Hilarious.,"{'neg': 0.0, 'neu': 0.27, 'pos': 0.73, 'compound': 0.4019}"
52,2021-12-24 00:59:57+00:00,RT More info on Covid pneumonia ,"{'neg': 0.0, 'neu': 1.0, 'pos': 0.0, 'compound': 0.0}"
53,2021-12-24 00:59:57+00:00,RT Pro-Trump anti-vaccers showed up at Trump Grill in NYC today after he said he was against vaccine mandates. They were d...,"{'neg': 0.0, 'neu': 1.0, 'pos': 0.0, 'compound': 0.0}"
54,2021-12-24 00:59:57+00:00,"RT Has anyone else noticed that the triple vaccinated, double mask crowd, are the ones most terrified of each new variant?","{'neg': 0.177, 'neu': 0.823, 'pos': 0.0, 'compound': -0.6478}"
55,2021-12-24 00:59:57+00:00,"RT Why isn't the CDC or WH talking about this? 
https://t.co/C9dG6HiZhi","{'neg': 0.0, 'neu': 1.0, 'pos': 0.0, 'compound': 0.0}"
56,2021-12-24 00:59:57+00:00,RT BREAKING: A North Carolina police chief is placed on two weeks unpaid leave and six months probation for telling his o...,"{'neg': 0.054, 'neu': 0.946, 'pos': 0.0, 'compound': -0.0516}"
57,2021-12-24 00:59:57+00:00,"What is the etiquette is it rude not to comment on everyone's Covid Reveals with a ""feel better!""","{'neg': 0.148, 'neu': 0.721, 'pos': 0.131, 'compound': -0.1007}"
58,2021-12-24 00:59:57+00:00,"So sorry you're not feeling, hope it's not Covid. I'm waiting on my test results to see if I'm positive for Covid. I don't know what can stop the dizzy  feeling, hope you get better soon.","{'neg': 0.2, 'neu': 0.57, 'pos': 0.23, 'compound': 0.5316}"
59,2021-12-24 00:59:57+00:00,Not going to say I told you so but.......... I did!!!,"{'neg': 0.0, 'neu': 1.0, 'pos': 0.0, 'compound': 0.0}"
60,2021-12-24 00:59:57+00:00,I'm actually here. We're on a lockdown currently. The shooter is in custody. Four people injured is the reports.,"{'neg': 0.13, 'neu': 0.87, 'pos': 0.0, 'compound': -0.4019}"
61,2021-12-24 00:59:57+00:00,RT Coronavirus cases reach new highs again in D.C. area heading into Christmas holiday,"{'neg': 0.0, 'neu': 0.759, 'pos': 0.241, 'compound': 0.4215}"
62,2021-12-24 00:59:57+00:00,"RT BREAKING REPORT: California's Oakdale Joint Unified School District DEFIES Newsom, Announces They Will Simply NOT ENFORC...","{'neg': 0.0, 'neu': 0.86, 'pos': 0.14, 'compound': 0.3818}"
63,2021-12-24 00:59:57+00:00,"1/The major technical issues was that prior to Delta (remember the Kent variant?), it WAS TRUE that the jab helped reduce transmission by 50-70%. So the ""don't kill granny"" argument was scientifically robust. Everything changed in Delta, with UK providing first evidence that","{'neg': 0.0, 'neu': 0.764, 'pos': 0.236, 'compound': 0.901}"
64,2021-12-24 00:59:57+00:00,"Just be really careful if you stay at home. Being sick is one thing,but covid is another.","{'neg': 0.163, 'neu': 0.743, 'pos': 0.094, 'compound': -0.3415}"
65,2021-12-24 00:59:57+00:00,"RT Friendly reminder that the US Senate, under Chuck Schumer, has exempted itself and its staff from all Covid mask, testi...","{'neg': 0.0, 'neu': 0.862, 'pos': 0.138, 'compound': 0.4939}"
66,2021-12-24 00:59:57+00:00,RT guy doing my covid test called me a good girl as he put the swab in... i can't do this anymore,"{'neg': 0.0, 'neu': 0.879, 'pos': 0.121, 'compound': 0.4404}"
67,2021-12-24 00:59:57+00:00,"C'mon Twitter Bud, don't be a Grinch , especially since the real criminals are the ""leaders"" that chose to *mis*lead When They Knew Better 

*rump
DeSantis
Abbott
Carlson
Paul
.
.
.
#COVID19 #DutyOfCare #ClassAction #WrongfulDeath

Will  Santa come through for US","{'neg': 0.079, 'neu': 0.858, 'pos': 0.062, 'compound': -0.2023}"
68,2021-12-24 00:59:57+00:00,RT It dont feel like Christmas because we sad bro. Loved ones dying. White people voting against their own self interest fucking...,"{'neg': 0.173, 'neu': 0.598, 'pos': 0.229, 'compound': 0.3999}"
69,2021-12-24 00:59:57+00:00,"CDC shortens COVID isolation period for health care workers as Omicron cases surge 
https://t.co/V1ll7dN9Na","{'neg': 0.151, 'neu': 0.67, 'pos': 0.179, 'compound': 0.128}"
70,2021-12-24 00:59:57+00:00,"Be funny if 10 yrs down the line you sae an infomercial that said ""Did you or a loved one take the Covid vaccine, if so you may be entitled to..."" I would marinate in your suffering. ","{'neg': 0.069, 'neu': 0.733, 'pos': 0.198, 'compound': 0.7003}"
71,2021-12-24 00:59:57+00:00,RT Massachusetts sets new one-day Covid-19 case record; Deer Island data suggest more to come,"{'neg': 0.0, 'neu': 1.0, 'pos': 0.0, 'compound': 0.0}"
72,2021-12-24 00:59:58+00:00,United Airlines cancels over 100 Christmas Eve flights due to COVID,"{'neg': 0.139, 'neu': 0.657, 'pos': 0.204, 'compound': 0.2263}"
73,2021-12-24 00:59:58+00:00,"RT I knew we were fuckin doomed as a country when the FIRST survival tactic of the pandemic was to buy toilet paper. 

Toi...","{'neg': 0.163, 'neu': 0.837, 'pos': 0.0, 'compound': -0.6697}"
74,2021-12-24 00:59:58+00:00,"I understand, and it is horrible, it's also I think not you. Not what you would do.","{'neg': 0.179, 'neu': 0.821, 'pos': 0.0, 'compound': -0.5423}"
75,2021-12-24 00:59:58+00:00,"Nobody should ever take a vaccine for any other reason than personal choice. There are many risks involved with these mRNA vaccines, as the short term data shows and no long term safety data. Vaxpass is a digital ID through the back door. Everyone should boycott it.","{'neg': 0.126, 'neu': 0.821, 'pos': 0.053, 'compound': -0.4215}"
76,2021-12-24 00:59:58+00:00,Its no for while and I swear if I still have covid by then ill be losing it!,"{'neg': 0.394, 'neu': 0.606, 'pos': 0.0, 'compound': -0.7959}"
77,2021-12-24 00:59:58+00:00,RT when does the government vaccine start controlling my mind? i am tired of making decisions,"{'neg': 0.162, 'neu': 0.838, 'pos': 0.0, 'compound': -0.4404}"
78,2021-12-24 00:59:58+00:00,RT This administration's COVID response and messaging is abysmal.  ,"{'neg': 0.0, 'neu': 1.0, 'pos': 0.0, 'compound': 0.0}"
79,2021-12-24 00:59:58+00:00,"RT BREAKING: According to the CDC: 

""Unvaxxinated people are like... A BILLION TIMES more likely to die from C0VID! And,...","{'neg': 0.179, 'neu': 0.721, 'pos': 0.1, 'compound': -0.4508}"
80,2021-12-24 00:59:58+00:00,"Russell Safirstein, Partner in charge of Anchin Digital Risk Solutions and President of Redpoint Cybersecurity, shares tips on how to optimize your in-house processes. Make sure your business is running efficiently as possible to deal with #COVID19.","{'neg': 0.046, 'neu': 0.686, 'pos': 0.268, 'compound': 0.8402}"
81,2021-12-24 00:59:58+00:00,RT Biden administration REJECTED plan for 732M tests a month in October to cope with the holiday COVID surge: Psaki attempts...,"{'neg': 0.157, 'neu': 0.738, 'pos': 0.105, 'compound': -0.3254}"
82,2021-12-24 00:59:58+00:00,RT The CDC recommends bringing me soup and giving me a little kiss to make sure I get better,"{'neg': 0.0, 'neu': 0.538, 'pos': 0.462, 'compound': 0.8752}"
83,2021-12-24 00:59:58+00:00,Trump now aboard vaccine bandwagon,"{'neg': 0.0, 'neu': 0.784, 'pos': 0.216, 'compound': 0.0258}"
84,2021-12-24 00:59:58+00:00,"RT all these ""they could've stopped covid"" tweets flying around but not a single one mentions HER","{'neg': 0.083, 'neu': 0.917, 'pos': 0.0, 'compound': -0.1154}"
85,2021-12-24 00:59:58+00:00,RT Just heard on 610: there is optimism the Chiefs will have a wave of players come off the COVID list on Saturday.,"{'neg': 0.0, 'neu': 0.863, 'pos': 0.137, 'compound': 0.5423}"
86,2021-12-24 00:59:58+00:00,"RT #URGENT: Numerous people shot following active shooter situation at Oak Brook Mall in Illinois

#OakBrook l #IL
EM...","{'neg': 0.0, 'neu': 0.66, 'pos': 0.34, 'compound': 0.8038}"
87,2021-12-24 00:59:58+00:00,RT Just listened to Hinshaw #Alberta will continue along the path of a #Mockdown nothing new will be done to slow the spre...,"{'neg': 0.0, 'neu': 1.0, 'pos': 0.0, 'compound': 0.0}"
88,2021-12-24 00:59:58+00:00,This!! 100% this!!,"{'neg': 0.0, 'neu': 1.0, 'pos': 0.0, 'compound': 0.0}"
89,2021-12-24 00:59:58+00:00,"couldn't visit my dying oldest brother in a hospice facility because Covid cases were soaring in GA at the time. He died, not surrounded by his family, but with the medical staff holding his hand. So, spare me.","{'neg': 0.054, 'neu': 0.845, 'pos': 0.101, 'compound': 0.4588}"
90,2021-12-24 00:59:58+00:00,RT England has become the only part of the UK to follow the data and science and not politicise the Covid response,"{'neg': 0.0, 'neu': 1.0, 'pos': 0.0, 'compound': 0.0}"
91,2021-12-24 00:59:58+00:00,RT Covid testing should be free. #M4A would cover this and more.,"{'neg': 0.0, 'neu': 0.769, 'pos': 0.231, 'compound': 0.5106}"
92,2021-12-24 00:59:58+00:00,RT Just going to echo former President Trump here on the safety and efficacy of the vaccines.  Merry Christmas eve eve. go get b...,"{'neg': 0.0, 'neu': 0.777, 'pos': 0.223, 'compound': 0.743}"
93,2021-12-24 00:59:58+00:00,The only guy that can beat omicron-19!,"{'neg': 0.0, 'neu': 1.0, 'pos': 0.0, 'compound': 0.0}"
94,2021-12-24 00:59:59+00:00,"RT ""Respirators, which includes masks known as N95, FFP2 and others, should especially be worn in care settings where ventilation is...","{'neg': 0.1, 'neu': 0.77, 'pos': 0.13, 'compound': 0.1832}"
95,2021-12-24 00:59:59+00:00,"RT Holy moly.

This study shows that after three months the vaccine effectiveness of Pfizer &amp; Moderna against Omicron is actua...","{'neg': 0.0, 'neu': 1.0, 'pos': 0.0, 'compound': 0.0}"
96,2021-12-24 00:59:59+00:00,"RT Anthropologist take: as a society, we looked the other way when college educated yoga moms in affluent blue communities no...","{'neg': 0.0, 'neu': 1.0, 'pos': 0.0, 'compound': 0.0}"
97,2021-12-24 00:59:59+00:00,"RT BREAKING: U.S. reports more than 250,000 new coronavirus cases, with several states yet to report","{'neg': 0.0, 'neu': 1.0, 'pos': 0.0, 'compound': 0.0}"
98,2021-12-24 00:59:59+00:00,RT BREAKING: A North Carolina police chief is placed on two weeks unpaid leave and six months probation for telling his o...,"{'neg': 0.054, 'neu': 0.946, 'pos': 0.0, 'compound': -0.0516}"
99,2021-12-24 00:59:59+00:00,"RT The Competition Commission and South Africa's three largest private pathology groups, Pathcare, Lancet and Ampath, have agreed...","{'neg': 0.0, 'neu': 0.89, 'pos': 0.11, 'compound': 0.2732}"
100,2021-12-24 00:59:59+00:00,"RT 'Trump is a fraud!' Disillusioned supporters rage after being denied service at Trump Grill over vax mandate

https://t.co/W4...","{'neg': 0.444, 'neu': 0.461, 'pos': 0.095, 'compound': -0.8908}"
101,2021-12-24 00:59:59+00:00,Rare things happen. We're all going to die eventually but you can minimize the chance that it will be from a preventable cause with your lifestyle. Many people know someone who has been injured by the vaccine. That in isolation means nothing.,"{'neg': 0.191, 'neu': 0.759, 'pos': 0.05, 'compound': -0.7935}"
102,2021-12-24 00:59:59+00:00,"RT Covid symptoms have been lingering much longer than I expected. 

I just managed to get my Christmas special done befor...","{'neg': 0.0, 'neu': 0.881, 'pos': 0.119, 'compound': 0.4019}"
103,2021-12-24 00:59:59+00:00,"RT If you believe COVID 19 is AIRBORNE and the indoor public air is a sewer, you wear a mask  most importantly above the nose y...","{'neg': 0.0, 'neu': 0.906, 'pos': 0.094, 'compound': 0.3804}"
104,2021-12-24 00:59:59+00:00,Wake up!!,"{'neg': 0.0, 'neu': 1.0, 'pos': 0.0, 'compound': 0.0}"
105,2021-12-24 00:59:59+00:00,RT Please for the love of god just read the room Sweden,"{'neg': 0.0, 'neu': 0.511, 'pos': 0.489, 'compound': 0.8225}"
106,2021-12-24 00:59:59+00:00,"RT During the pandemic: 

* UK Billionaire wealth grew 35%
* UK Foodbank use grew 33%","{'neg': 0.0, 'neu': 0.824, 'pos': 0.176, 'compound': 0.4939}"
107,2021-12-24 00:59:59+00:00,RT My heart goes out to all those families with children in hospital tonight.,"{'neg': 0.0, 'neu': 0.756, 'pos': 0.244, 'compound': 0.6369}"
108,2021-12-24 00:59:59+00:00,RT Follow up #1: In tweets 6 and 7 I use estimate of 7.5% of London with reported Omicron and multiply by assumed under-reporting t...,"{'neg': 0.0, 'neu': 1.0, 'pos': 0.0, 'compound': 0.0}"
109,2021-12-24 00:59:59+00:00,"I promise not to judge or shame you when you get your breakthrough COVID infection, even silently in my heart.","{'neg': 0.117, 'neu': 0.639, 'pos': 0.244, 'compound': 0.5267}"
110,2021-12-24 00:59:59+00:00,RT guy doing my covid test called me a good girl as he put the swab in... i can't do this anymore,"{'neg': 0.0, 'neu': 0.879, 'pos': 0.121, 'compound': 0.4404}"
111,2021-12-24 00:59:59+00:00,"RT People are though...
Mostly from heart issues that they didn't have until they got the jab","{'neg': 0.0, 'neu': 0.792, 'pos': 0.208, 'compound': 0.6369}"
112,2021-12-24 00:59:59+00:00,"RT Over the next 3 to 5 yrs. you're going to see cancer and heart attack deaths skyrocket.
The corporate media will go on th...","{'neg': 0.223, 'neu': 0.653, 'pos': 0.125, 'compound': -0.5106}"
113,2021-12-24 00:59:59+00:00,"RT weird take not only because this was talked about, but because bougie suburban democrats, despite all their many other pro...","{'neg': 0.063, 'neu': 0.937, 'pos': 0.0, 'compound': -0.09}"
114,2021-12-24 00:59:59+00:00,Not really happy with this year's holidays festivities. Not because of the pandemic but the amount of time I had to get into the holiday spirit.  I usually need a week to transition from work mode to Christmas mode. I turned in grades Monday. I can't get in the spirit in 4 days,"{'neg': 0.035, 'neu': 0.775, 'pos': 0.19, 'compound': 0.8122}"
115,2021-12-24 00:59:59+00:00,you get more ridiculous by the hour. you know nothing about the vaccine. you just spew crap to get a rise out of your ignorant base.,"{'neg': 0.246, 'neu': 0.754, 'pos': 0.0, 'compound': -0.7574}"
116,2021-12-24 01:00:00+00:00,"RT #reviseGIPSAwages
#plsdontbeLiar pls do not ignore GIPSA corona warriors who rebuilt nation's economy.","{'neg': 0.0, 'neu': 0.779, 'pos': 0.221, 'compound': 0.3421}"
117,2021-12-24 01:00:00+00:00,Cultist bot. Very angry no more unvaxxed will die of omicron.,"{'neg': 0.561, 'neu': 0.439, 'pos': 0.0, 'compound': -0.8816}"
118,2021-12-24 01:00:00+00:00,"RT BREAKING: U.S. reports more than 250,000 new coronavirus cases, with several states yet to report","{'neg': 0.0, 'neu': 1.0, 'pos': 0.0, 'compound': 0.0}"
119,2021-12-24 01:00:00+00:00,RT He bragged about delaying the vaccine. This is same guy who wants to put the unvaccinated into camps. Literally he stopped t...,"{'neg': 0.079, 'neu': 0.921, 'pos': 0.0, 'compound': -0.2263}"
120,2021-12-24 01:00:00+00:00,RT a new variant means I should be getting a new stimulus check,"{'neg': 0.0, 'neu': 1.0, 'pos': 0.0, 'compound': 0.0}"
121,2021-12-24 01:00:00+00:00,RT A reminder that viral load reduction effectiveness declines with time after vaccination. If you are positive you can trans...,"{'neg': 0.0, 'neu': 0.841, 'pos': 0.159, 'compound': 0.5574}"
122,2021-12-24 01:00:00+00:00,RT I've somehow remained Covid free during this entire pandemic but I'm definitely starting to get nervous now.,"{'neg': 0.113, 'neu': 0.642, 'pos': 0.244, 'compound': 0.4678}"
123,2021-12-24 01:00:00+00:00,"situation, the fact that no country has ready made or even purpose built facilities to handle the numbers hoping to return home, given the ever changing of Delta and the NZ outbreak it has since caused and the sheer logistics of bringing so many","{'neg': 0.045, 'neu': 0.845, 'pos': 0.109, 'compound': 0.4767}"
