,created_at,full_text,sentiment_score
0,2021-12-08 10:59:54+00:00,"RT Covid is a major threat to us, they said. You might kill granny if you don't follow our instructions, they said. You mustn'...","{'neg': 0.276, 'neu': 0.724, 'pos': 0.0, 'compound': -0.8553}"
1,2021-12-08 10:59:54+00:00,RT Yes it is good. It's just that it's not good for Pfizer.,"{'neg': 0.134, 'neu': 0.555, 'pos': 0.311, 'compound': 0.4929}"
2,2021-12-08 10:59:54+00:00,RT It's so chilling what a high % of people took the vaccine or gave it to their kids not because THEY felt there was a me...,"{'neg': 0.054, 'neu': 0.946, 'pos': 0.0, 'compound': -0.1258}"
3,2021-12-08 10:59:54+00:00,If we were being told the truth there wouldn't be any need for further Covid measures,"{'neg': 0.0, 'neu': 0.867, 'pos': 0.133, 'compound': 0.3182}"
4,2021-12-08 10:59:55+00:00,"Knowing how terrible this country is, these expired doses might still be administered to people.","{'neg': 0.181, 'neu': 0.819, 'pos': 0.0, 'compound': -0.4767}"
5,2021-12-08 10:59:55+00:00,Judge blocks Biden vaccine mandate for federal contractors in all states,"{'neg': 0.16, 'neu': 0.84, 'pos': 0.0, 'compound': -0.2263}"
6,2021-12-08 10:59:55+00:00,"RT France has had its highest Covid case rate since April, yet mask mandates and vaccine passports are widespread.

These...","{'neg': 0.0, 'neu': 1.0, 'pos': 0.0, 'compound': 0.0}"
7,2021-12-08 10:59:55+00:00,RT Do you guys remember this video from lockdown? This video still kills me to this day ,"{'neg': 0.179, 'neu': 0.821, 'pos': 0.0, 'compound': -0.5423}"
8,2021-12-08 10:59:55+00:00,"Yeah sorry about that.

It's just that people sharing antivax misinformation are responsible for this.
https://t.co/TLjQFLU2EX","{'neg': 0.164, 'neu': 0.502, 'pos': 0.333, 'compound': 0.5719}"
9,2021-12-08 10:59:55+00:00,"Please think twice before saying covid was there for all students. The consequence of covid was not same for all!!
Please consider our request!!
#JEEAdvancedExtraAttempt

@dpradhanbjp ","{'neg': 0.0, 'neu': 0.806, 'pos': 0.194, 'compound': 0.6973}"
10,2021-12-08 10:59:55+00:00,RT What a shame. The 10-day quarantine regulations imposed by on international travelers to Zimbabwe are as knee...,"{'neg': 0.216, 'neu': 0.784, 'pos': 0.0, 'compound': -0.5267}"
11,2021-12-08 10:59:55+00:00,"RT : they gave me ten ten vitamins after i got the vaccine
: the nurse gave them to me too!!! 

@TXT_members","{'neg': 0.0, 'neu': 1.0, 'pos': 0.0, 'compound': 0.0}"
12,2021-12-08 10:59:55+00:00,"at THAT Christmas party, calling it a party, confirming the attendees are breaking social distancing rules and joking that the police wouldn't be investigating it in a year's time!","{'neg': 0.0, 'neu': 0.774, 'pos': 0.226, 'compound': 0.7644}"
13,2021-12-08 10:59:55+00:00,Well done you bunch of Cunt's fuck the lot of you do gooding bastards.,"{'neg': 0.364, 'neu': 0.534, 'pos': 0.102, 'compound': -0.7506}"
14,2021-12-08 10:59:55+00:00,Lol. I'd take you up on that but all my $$$ are on standby for the BTS world tour...if they come anywhere near the Southern Hemisphere...hoping Sydney on the PTD signpost is part of the plan...just need to wipe out Covid and were good to go!,"{'neg': 0.0, 'neu': 0.879, 'pos': 0.121, 'compound': 0.722}"
15,2021-12-08 10:59:55+00:00,RT The same people furious at Boris and the government for flagrantly violating lockdown rules will gleefully comply when Bo...,"{'neg': 0.286, 'neu': 0.714, 'pos': 0.0, 'compound': -0.802}"
16,2021-12-08 10:59:55+00:00,"RT As people stop fearing Covid, politicians start fearing people.","{'neg': 0.578, 'neu': 0.422, 'pos': 0.0, 'compound': -0.8625}"
17,2021-12-08 10:59:55+00:00,RT I'd rather catch COVID every year than have a federal government,"{'neg': 0.0, 'neu': 1.0, 'pos': 0.0, 'compound': 0.0}"
18,2021-12-08 10:59:55+00:00,"RT Lockdowns for ""new variants."" Who decides when a variant is sufficiently new to impose a lockdown? ","{'neg': 0.121, 'neu': 0.879, 'pos': 0.0, 'compound': -0.296}"
19,2021-12-08 10:59:55+00:00,"RT Just one #lockdown 
Just until we have the jab
Just one more lockdown 
Just the 2. shot 
Only the unvaccinated 
Just th...","{'neg': 0.0, 'neu': 1.0, 'pos': 0.0, 'compound': 0.0}"
20,2021-12-08 10:59:55+00:00,"RT Covid is a major threat to us, they said. You might kill granny if you don't follow our instructions, they said. You mustn'...","{'neg': 0.276, 'neu': 0.724, 'pos': 0.0, 'compound': -0.8553}"
21,2021-12-08 10:59:55+00:00,"RT So health agency in Bekasi said that they've found Omicron variant in four Indonesians returning from overseas, but Health M...","{'neg': 0.0, 'neu': 1.0, 'pos': 0.0, 'compound': 0.0}"
22,2021-12-08 10:59:55+00:00,"RT Before I get accused of being cynical, all the guidance from No 10 was that they probably wouldn't know enough about the o...","{'neg': 0.25, 'neu': 0.75, 'pos': 0.0, 'compound': -0.7184}"
23,2021-12-08 10:59:55+00:00,RT The head office of food delivery application Wolt has urged 'all couriers to follow local covid guidelines' in a Twitter re...,"{'neg': 0.0, 'neu': 1.0, 'pos': 0.0, 'compound': 0.0}"
24,2021-12-08 10:59:55+00:00,People in this country don't understand only violence wins you your freedom that's why he can take the piss like this ,"{'neg': 0.083, 'neu': 0.494, 'pos': 0.423, 'compound': 0.8999}"
25,2021-12-08 10:59:56+00:00,"RT your reminder that almost 2,000 people have been prosecuted at Westminster magistrates court for ignoring lockdowns, attendi...","{'neg': 0.249, 'neu': 0.751, 'pos': 0.0, 'compound': -0.6486}"
26,2021-12-08 10:59:56+00:00,"RT I wonder what the Queen, who sat alone on a church pew at her husband's funeral to show the country she was strictly obs...","{'neg': 0.164, 'neu': 0.836, 'pos': 0.0, 'compound': -0.5423}"
27,2021-12-08 10:59:56+00:00,"RT UPDATE: says  it's permanently replacing most of 1,400 workers who went on strike over a new system that cuts...","{'neg': 0.171, 'neu': 0.829, 'pos': 0.0, 'compound': -0.4019}"
28,2021-12-08 10:59:56+00:00,"RT ""There was no Christmas party. Covid rules have been followed at all times."" No.10","{'neg': 0.255, 'neu': 0.745, 'pos': 0.0, 'compound': -0.5358}"
29,2021-12-08 10:59:56+00:00,"RT Breaking News: A preliminary study offered a first glimpse at how vaccinated people might fare against Omicron, suggesting bre...","{'neg': 0.0, 'neu': 1.0, 'pos': 0.0, 'compound': 0.0}"
30,2021-12-08 10:59:56+00:00,"RT Pandemic disruptions have had real impacts on mental health, particularly the mental well-being of our children.  

Sadly, D...","{'neg': 0.234, 'neu': 0.766, 'pos': 0.0, 'compound': -0.6369}"
31,2021-12-08 10:59:56+00:00,"Here comes #Omicron...just in time for the #holidays. If the uncertainty is making you stress, you're not alone.   Can't wait to join on to talk abt how we can preserve our #mentalhealth as we face this new wave. #resilience #psychology #pandemic #covid19","{'neg': 0.146, 'neu': 0.764, 'pos': 0.09, 'compound': -0.4114}"
32,2021-12-08 10:59:56+00:00,RT What we need is for a few smug Tory smiles to be wiped off the faces of these ministers and MPs with a good nasty dose of Cov...,"{'neg': 0.099, 'neu': 0.687, 'pos': 0.214, 'compound': 0.4939}"
33,2021-12-08 10:59:56+00:00,"I mean if you're up for ultimate fairness without considering the nature of the vaccine, sure. CC Dischem and let em know.","{'neg': 0.0, 'neu': 0.901, 'pos': 0.099, 'compound': 0.3182}"
34,2021-12-08 10:59:56+00:00,"RT Despite supply chain snarls, Covid variants, and the pushback against remote work, I still think the 2020s are going to be...","{'neg': 0.0, 'neu': 1.0, 'pos': 0.0, 'compound': 0.0}"
35,2021-12-08 10:59:56+00:00,Wonder where the Pro-pandemic Zealots are being accommodated in Wellington?,"{'neg': 0.167, 'neu': 0.833, 'pos': 0.0, 'compound': -0.2023}"
36,2021-12-08 10:59:56+00:00,"I did follow the rules because I had covid, however I had fully intended to visit my parents at Christmas otherwise","{'neg': 0.0, 'neu': 1.0, 'pos': 0.0, 'compound': 0.0}"
37,2021-12-08 10:59:56+00:00,"RT #PS40 addressed issues related to intercommunal conflicts, floods &amp; #COVID19 pandemic, health &amp; nutrition, Fo...","{'neg': 0.148, 'neu': 0.852, 'pos': 0.0, 'compound': -0.3818}"
38,2021-12-08 10:59:56+00:00,RT Are you scared of Omicron or your Government ?,"{'neg': 0.244, 'neu': 0.756, 'pos': 0.0, 'compound': -0.4404}"
39,2021-12-08 10:59:56+00:00,"RT Israel will soon require a FOURTH ""covid vaccine"" shot in order to be ""fully vaccinated."" Some of y'all are going to be lin...","{'neg': 0.0, 'neu': 1.0, 'pos': 0.0, 'compound': 0.0}"
40,2021-12-08 10:59:56+00:00,"RT Is IIT really for rich people who can afford costly coaching and study peacefully during covid?
Is it really fair for those...","{'neg': 0.046, 'neu': 0.628, 'pos': 0.326, 'compound': 0.8581}"
41,2021-12-08 10:59:56+00:00,"RT Johnson will be sitting in No 10 blaming everyone else, finding someone to sack, and tossing a coin between tougher Cov...","{'neg': 0.086, 'neu': 0.744, 'pos': 0.17, 'compound': 0.2796}"
42,2021-12-08 10:59:57+00:00,"RT I haven't seen my parents for almost two years. I have worked through it all as a nurse, despite getting...","{'neg': 0.0, 'neu': 1.0, 'pos': 0.0, 'compound': 0.0}"
43,2021-12-08 10:59:57+00:00,"RT When Sajid Javid said: 'A lot more' will be known about Omicron variant in two weeks, what he really meant was... we are work...","{'neg': 0.0, 'neu': 1.0, 'pos': 0.0, 'compound': 0.0}"
44,2021-12-08 10:59:57+00:00,"RT #pynshn_brwqt_d_khrw
The pension system was created by the British government so that when a man spends his whole life in...","{'neg': 0.0, 'neu': 0.909, 'pos': 0.091, 'compound': 0.25}"
45,2021-12-08 10:59:57+00:00,RT Switzerland (here the parliament) also hasn't learned that the main mode of transmission is airborne (https://t.co/r3yOy2U...,"{'neg': 0.0, 'neu': 1.0, 'pos': 0.0, 'compound': 0.0}"
46,2021-12-08 10:59:57+00:00,"RT Antibodies from the Pfizer vaccine may be up to 40 times less effective against Omicron than the original COVID strain, the fi...","{'neg': 0.046, 'neu': 0.76, 'pos': 0.194, 'compound': 0.6003}"
47,2021-12-08 10:59:57+00:00,"RT NO Govt minister was available for 
Strange that

No Govt minister was available to supervise the rescue of A...","{'neg': 0.264, 'neu': 0.61, 'pos': 0.126, 'compound': -0.3885}"
48,2021-12-08 10:59:57+00:00,Unbelievable.,"{'neg': 0.0, 'neu': 0.0, 'pos': 1.0, 'compound': 0.2023}"
49,2021-12-08 10:59:57+00:00,RT sorry we can't afford to mail everyone covid tests we're giving the Pentagon $768 billion tomorrow ,"{'neg': 0.07, 'neu': 0.802, 'pos': 0.128, 'compound': 0.2732}"
50,2021-12-08 10:59:57+00:00,RT Going to be near impossible for them to impose new restrictions after this (if we need them with omicron on the rise). Wond...,"{'neg': 0.087, 'neu': 0.913, 'pos': 0.0, 'compound': -0.296}"
51,2021-12-08 10:59:57+00:00,"RT  Join and for the launch of the first global mapping of #COVID19 vaccinations in prisons.
With","{'neg': 0.0, 'neu': 0.879, 'pos': 0.121, 'compound': 0.296}"
52,2021-12-08 10:59:57+00:00,"RT Video has emerged of Commons leader Jacob Rees-Mogg joking about a Christmas party reportedly held at No 10 last year, despite...","{'neg': 0.085, 'neu': 0.736, 'pos': 0.178, 'compound': 0.34}"
53,2021-12-08 10:59:57+00:00,"RT URGENT, please retweet to help Tyson find a PERMANENT FOSTER HOME  #Pembrokeshire #WALES  #dogs #dogsoftwitter  #pets...","{'neg': 0.0, 'neu': 0.65, 'pos': 0.35, 'compound': 0.7603}"
54,2021-12-08 10:59:57+00:00,Ram it,"{'neg': 0.0, 'neu': 1.0, 'pos': 0.0, 'compound': 0.0}"
55,2021-12-08 10:59:57+00:00,What a joke.,"{'neg': 0.0, 'neu': 0.476, 'pos': 0.524, 'compound': 0.296}"
56,2021-12-08 10:59:57+00:00,No one actually gives a fuck no more,"{'neg': 0.612, 'neu': 0.388, 'pos': 0.0, 'compound': -0.7845}"
57,2021-12-08 10:59:57+00:00,"RT We have completed our first experiments on neutralization of Omicron by Pfizer BNT162b2 vaccination elicited immunity

Manusc...","{'neg': 0.0, 'neu': 1.0, 'pos': 0.0, 'compound': 0.0}"
58,2021-12-08 10:59:57+00:00,RT '@GMB is turning out to be a nasty little outfit - running a poll asking about #VaccineMandate &amp; then deleting it when it...,"{'neg': 0.135, 'neu': 0.865, 'pos': 0.0, 'compound': -0.5574}"
59,2021-12-08 10:59:57+00:00,Lol Health care workers are taking Boosters now. Lol it means Those Vaccines doesn't work musi. ,"{'neg': 0.0, 'neu': 0.596, 'pos': 0.404, 'compound': 0.8316}"
60,2021-12-08 10:59:58+00:00,The *literal* political definition of ...,"{'neg': 0.0, 'neu': 1.0, 'pos': 0.0, 'compound': 0.0}"
61,2021-12-08 10:59:58+00:00,RT I'll reiterate. No. No. No. And fuck no. Get this trending right now. #NoVaccinePassports Write to your MP. #together Fig...,"{'neg': 0.149, 'neu': 0.851, 'pos': 0.0, 'compound': -0.5423}"
62,2021-12-08 10:59:58+00:00,"RT an engene said, ""Enhypen is my vaccine.""

#JAKE:","{'neg': 0.0, 'neu': 1.0, 'pos': 0.0, 'compound': 0.0}"
63,2021-12-08 10:59:58+00:00," ""The real damage in children that we see at the moment is caused by lack of socialization and lockdown. An increase in mental disorders is observed in all age groups: anorexia, bulimia, self-harm>>  #italy #mostshared","{'neg': 0.138, 'neu': 0.804, 'pos': 0.058, 'compound': -0.4939}"
64,2021-12-08 10:59:58+00:00,RT Scientists find 'stealth' version of Omicron that may be harder to track #Version #Om...,"{'neg': 0.085, 'neu': 0.915, 'pos': 0.0, 'compound': -0.0772}"
65,2021-12-08 10:59:58+00:00,"RT The U.S. finally hits 60%:

60%: The share of all Americans who are fully vaccinated, according to the CDC.
 
71.5%: The...","{'neg': 0.0, 'neu': 0.905, 'pos': 0.095, 'compound': 0.296}"
66,2021-12-08 10:59:58+00:00,"RT 120 fully vaccinated people attended a Christmas party in heavily vaccinated Norway. As many as 100 caught Covid. 

Do...","{'neg': 0.0, 'neu': 0.876, 'pos': 0.124, 'compound': 0.4019}"
67,2021-12-08 10:59:58+00:00,RT Or Windrush or not feeding starving children in the holidays or lying about Brexit or Grenfell or cuts to the NHS and so...,"{'neg': 0.183, 'neu': 0.655, 'pos': 0.162, 'compound': -0.17}"
68,2021-12-08 10:59:58+00:00,"RT ""I want to say thank to whoever found their moral compass""

On #BBCBreakfast Dr Saleyha Ashan, from Covid-19 Bereaved Fam...","{'neg': 0.124, 'neu': 0.723, 'pos': 0.153, 'compound': -0.0772}"
69,2021-12-08 10:59:58+00:00,"RT Bill Gates' Gavi Vaccine Alliance in 2018 published a paper on its INFUSE program.

It said.

""Digital child health card...","{'neg': 0.0, 'neu': 1.0, 'pos': 0.0, 'compound': 0.0}"
70,2021-12-08 10:59:58+00:00,"JUST IN - UK set to announce ""Plan B"" #COVID19 restrictions (FT)","{'neg': 0.0, 'neu': 1.0, 'pos': 0.0, 'compound': 0.0}"
71,2021-12-08 10:59:58+00:00,"RT So, again, current take home messages for Omicron immunity: Get vaccinated. Get boosted. Hybrid immunity is good.
end/n","{'neg': 0.0, 'neu': 0.759, 'pos': 0.241, 'compound': 0.6597}"
72,2021-12-08 10:59:58+00:00,"@foxandfriends On 9/5/2021 #60minutes did a segment titled ""The Last Pandemic"" in which researchers drew blood from 100 yr olds' &amp; found #antibodies to the #1912flu virus. Why then do govt policy makers &amp; #MSM DENY natural antibodies to #COVID ?","{'neg': 0.07, 'neu': 0.874, 'pos': 0.056, 'compound': -0.1613}"
73,2021-12-08 10:59:58+00:00,"RT U.S. COVID update:

- New cases: 192,220
- Average: 117,769
- In hospital: 59,580 (+1,158)
- In ICU: 14,405 (+247)
- New death...","{'neg': 0.145, 'neu': 0.855, 'pos': 0.0, 'compound': -0.5994}"
74,2021-12-08 10:59:58+00:00,"No data on severe disease when this is the most relevant data needed.

It's almost as if the purpose of the study was to promote the sale of more vaccines regardless of whether Omicron is no more dangerous than flu.","{'neg': 0.2, 'neu': 0.69, 'pos': 0.11, 'compound': -0.5294}"
75,2021-12-08 10:59:58+00:00,"RT Johnson will be sitting in No 10 blaming everyone else, finding someone to sack, and tossing a coin between tougher Cov...","{'neg': 0.086, 'neu': 0.744, 'pos': 0.17, 'compound': 0.2796}"
76,2021-12-08 10:59:58+00:00,RT I bet Caligula had parties less morally bankrupt than the Tories' Christmas events during a fucking pandemic,"{'neg': 0.151, 'neu': 0.727, 'pos': 0.123, 'compound': -0.1585}"
77,2021-12-08 10:59:58+00:00,"And... we're off again! 

Hot, cold, hot, cold, yes, no, maybe, no, yes, hot, cold etc. 

Standard psychological technique to wear down victim.
And we are the victim.","{'neg': 0.124, 'neu': 0.708, 'pos': 0.168, 'compound': 0.3595}"
78,2021-12-08 10:59:58+00:00,Fool !!! Lmao . U should not go anywhere stay home !,"{'neg': 0.161, 'neu': 0.557, 'pos': 0.282, 'compound': 0.4885}"
79,2021-12-08 10:59:58+00:00,"RT Last year was a huge struggle for business owners like me when the lockdown happened due to COVID 19, it's December al...","{'neg': 0.085, 'neu': 0.738, 'pos': 0.177, 'compound': 0.3612}"
80,2021-12-08 10:59:58+00:00,"#Breakingkenyanews    India, South Africa relaunch vaccine patent waiver campaign","{'neg': 0.0, 'neu': 1.0, 'pos': 0.0, 'compound': 0.0}"
81,2021-12-08 10:59:58+00:00,"RT Last year was a huge struggle for business owners like me when the lockdown happened due to COVID 19, it's December al...","{'neg': 0.085, 'neu': 0.738, 'pos': 0.177, 'compound': 0.3612}"
82,2021-12-08 10:59:58+00:00,"Maybe not so exciting anymore.
I have been watching not big scores been scored","{'neg': 0.203, 'neu': 0.797, 'pos': 0.0, 'compound': -0.5116}"
83,2021-12-08 10:59:58+00:00,RT If this Tory government thinks they can force us to work from home this Christmas after they've broken all their own qua...,"{'neg': 0.124, 'neu': 0.876, 'pos': 0.0, 'compound': -0.4767}"
84,2021-12-08 10:59:58+00:00,RT Ahead of Drakefords announcement Friday on possible further restrictions let's get this video to 1M views. Dear comms team f...,"{'neg': 0.0, 'neu': 0.885, 'pos': 0.115, 'compound': 0.3818}"
85,2021-12-08 10:59:59+00:00,"Honestly, if Omicron means they cancel Glastonbury again I'm going to lose the tiny bit of sanity I have left","{'neg': 0.19, 'neu': 0.688, 'pos': 0.121, 'compound': -0.1779}"
86,2021-12-08 10:59:59+00:00,"RT Nearly 150,000 people have died from Covid in the UK.
Hundreds of local businesses have been forced to close.
Children ha...","{'neg': 0.248, 'neu': 0.752, 'pos': 0.0, 'compound': -0.765}"
87,2021-12-08 10:59:59+00:00,RT But finally I have tested positive. Please do not take Covid for granted and don't try to be as stubborn as myself always....,"{'neg': 0.105, 'neu': 0.59, 'pos': 0.305, 'compound': 0.7783}"
88,2021-12-08 10:59:59+00:00,RT Go subscribe for only $8. I have 600 posts with more multiple times a week  #COVIDIOTS #porn #hotmom #hotwife #milf #fet...,"{'neg': 0.0, 'neu': 1.0, 'pos': 0.0, 'compound': 0.0}"
89,2021-12-08 10:59:59+00:00,"RT What we really need of course is a calm, considered, authoritative media briefing with Whitty and Vallance updating us on Om...","{'neg': 0.0, 'neu': 0.901, 'pos': 0.099, 'compound': 0.3182}"
90,2021-12-08 10:59:59+00:00,"RT Whilst NHS staff were holding the hands of dying COVID patients up and down the country, this was happening. Is this sheer...","{'neg': 0.0, 'neu': 1.0, 'pos': 0.0, 'compound': 0.0}"
91,2021-12-08 10:59:59+00:00,"RT More than twice as much myocarditis in German 16-39 yr olds in May to Sept 2021 compared to May to Sept 2020.

If it's...","{'neg': 0.0, 'neu': 1.0, 'pos': 0.0, 'compound': 0.0}"
92,2021-12-08 10:59:59+00:00,"The latest Steam Boiler, Thermic Fluid Heater, Co-Generation System and Other Boiler Auxiliary Equipment! Thanks to #aryankhan #covid19","{'neg': 0.0, 'neu': 0.842, 'pos': 0.158, 'compound': 0.4926}"
93,2021-12-08 10:59:59+00:00,RT EXCLUSIVE: Former Education Secretary Gavin Williamson broke Covid rules by holding a festive party at work in the run up...,"{'neg': 0.101, 'neu': 0.613, 'pos': 0.286, 'compound': 0.6289}"
94,2021-12-08 10:59:59+00:00,"You might be able to get hold of a ""COVID-19 Green Certificate"" - depending on if you have been vaccinated and with which vaccine and if COVID-19 Green Certificate are being issued in the UK.","{'neg': 0.0, 'neu': 1.0, 'pos': 0.0, 'compound': 0.0}"
95,2021-12-08 10:59:59+00:00,RT Don't fall for it . He said in 3 weeks he would assess and know this variants impact! It's not 3 weeks . Why today ??,"{'neg': 0.0, 'neu': 1.0, 'pos': 0.0, 'compound': 0.0}"
96,2021-12-08 10:59:59+00:00,RT Jen Psaki somewhat mockingly asks reporter at the White House Daily Press Briefing if the US should be sending out rapid #CO...,"{'neg': 0.0, 'neu': 1.0, 'pos': 0.0, 'compound': 0.0}"
97,2021-12-08 10:59:59+00:00,"A sad day. However if this is what it takes to get people riled up enough to put their feet down and their middle fingers up, so be it. #DoNotComply","{'neg': 0.097, 'neu': 0.903, 'pos': 0.0, 'compound': -0.4767}"
98,2021-12-08 10:59:59+00:00,"RT your reminder that almost 2,000 people have been prosecuted at Westminster magistrates court for ignoring lockdowns, attendi...","{'neg': 0.249, 'neu': 0.751, 'pos': 0.0, 'compound': -0.6486}"
99,2021-12-08 10:59:59+00:00,RT BREAKING REPORT:  Judge BLOCKS Biden's Vaccine Mandate For Federal Contractors Nationwide...,"{'neg': 0.193, 'neu': 0.807, 'pos': 0.0, 'compound': -0.3885}"
100,2021-12-08 10:59:59+00:00,Who's even going to follow these restrictions after the recent revelations? It's one rule for us and another for them.,"{'neg': 0.0, 'neu': 1.0, 'pos': 0.0, 'compound': 0.0}"
101,2021-12-08 11:00:00+00:00,RT This immune system hase ya ko oriental. It's the real makhoya,"{'neg': 0.0, 'neu': 0.833, 'pos': 0.167, 'compound': 0.296}"
102,2021-12-08 11:00:00+00:00,"#SouthKorea will consider expanding home treatment of #COVID19 patients, a health official said on Wednesday, as both new daily infections and severe cases hit record highs, putting hospital capacity under strain

#Seoul 
https://t.co/GjXcxkVipm","{'neg': 0.109, 'neu': 0.891, 'pos': 0.0, 'compound': -0.4215}"
103,2021-12-08 11:00:00+00:00,"People aged 40 and over in England can now book their booster jab for three months after their second dose.

https://t.co/fM6nft0Q3s

#COVID19 #BoosterVaccinations","{'neg': 0.0, 'neu': 1.0, 'pos': 0.0, 'compound': 0.0}"
104,2021-12-08 11:00:00+00:00,"""The media pressure that mounted on us, it was something extraordinary. Extraordinary to listen to media lie and spread panic and hysteria"". 

@ECR_Newswatch | #Rage | #BallitoRage | #COVID","{'neg': 0.324, 'neu': 0.676, 'pos': 0.0, 'compound': -0.9001}"
105,2021-12-08 11:00:00+00:00,RT The Indian Navy played a critical role in the repatriation of Indian citizens during COVID-19 and rescue operations du...,"{'neg': 0.092, 'neu': 0.68, 'pos': 0.228, 'compound': 0.5267}"
106,2021-12-08 11:00:00+00:00,"Children in Ireland aged between five and 11 are to receive the Pfizer #COVID19 vaccine under new Government plans  It will first apply to those:

- with an underlying condition

- living with a younger child with complex medical needs

- living with an immunocompromised adult","{'neg': 0.0, 'neu': 1.0, 'pos': 0.0, 'compound': 0.0}"
107,2021-12-08 11:00:00+00:00,My word,"{'neg': 0.0, 'neu': 1.0, 'pos': 0.0, 'compound': 0.0}"
108,2021-12-08 11:00:00+00:00,"Discover how Saudi Arabia forged a path to vaccine self-sufficiency through innovation and determination. 

https://t.co/bhe5gk1MnF 

#vaccines
#lifesciences
#biotechnology","{'neg': 0.0, 'neu': 0.751, 'pos': 0.249, 'compound': 0.6486}"
109,2021-12-08 11:00:00+00:00,"COMING UP ON New cases and COVID-19 death tolls on the rise -- we're live with the latest on the spread of the #omicron variant.

LIVE UPDATES:","{'neg': 0.13, 'neu': 0.87, 'pos': 0.0, 'compound': -0.5994}"
110,2021-12-08 11:00:00+00:00,RT Don't fall for it . He said in 3 weeks he would assess and know this variants impact! It's not 3 weeks . Why today ??,"{'neg': 0.0, 'neu': 1.0, 'pos': 0.0, 'compound': 0.0}"
111,2021-12-08 11:00:00+00:00,"Covid-19 anniversary: Over 100 million jabs given in last twelve months

4.7M here in the North East.

https://t.co/Nd1q2eywMz","{'neg': 0.0, 'neu': 1.0, 'pos': 0.0, 'compound': 0.0}"
112,2021-12-08 11:00:00+00:00,".@krispnews and others provided the world with crucial #COVID data, but their hands have now been chopped off. Read why says developed countries have punished them for their ability to identify the new variant - fast.","{'neg': 0.098, 'neu': 0.83, 'pos': 0.072, 'compound': -0.2617}"
113,2021-12-08 11:00:00+00:00,RT Me and have had a second look at the Downing Street Christmas party,"{'neg': 0.0, 'neu': 0.828, 'pos': 0.172, 'compound': 0.4019}"
114,2021-12-08 11:00:00+00:00,"Free COVID-19 TESTING
TODAY, December 8, 9am-4pm
Greater Valley Community Services
300 Holland Ave
Pre-registration link: is a walkup site, not a drive-thru
Insurance not required but please bring insurance card if available
Test provided at no cost","{'neg': 0.122, 'neu': 0.788, 'pos': 0.09, 'compound': -0.3276}"
115,2021-12-08 11:00:00+00:00,Pandemic 'radically altered the #business landscape': what does #Newmarket need to prosper? #jobs,"{'neg': 0.0, 'neu': 1.0, 'pos': 0.0, 'compound': 0.0}"
116,2021-12-08 11:00:00+00:00,"RT Dear people,

I was so, so disappointed to not be able to finish the rest of the shows. I caught the dreaded Covid so tha...","{'neg': 0.231, 'neu': 0.691, 'pos': 0.078, 'compound': -0.7262}"
117,2021-12-08 11:00:00+00:00,"RT Is IIT really for rich people who can afford costly coaching and study peacefully during covid?
Is it really fair for those...","{'neg': 0.046, 'neu': 0.628, 'pos': 0.326, 'compound': 0.8581}"
118,2021-12-08 11:00:00+00:00,"A high school teacher grows food in a vacant lot next to his house to augment their family income after losing his summer side jobs amid the pandemic. #agriculture #pandemicgardening 
https://t.co/MvueSlMUcw","{'neg': 0.08, 'neu': 0.92, 'pos': 0.0, 'compound': -0.3818}"
119,2021-12-08 11:00:00+00:00,Keir.... KEIR!!!! You have the perfect opportunity... USE IT,"{'neg': 0.0, 'neu': 0.477, 'pos': 0.523, 'compound': 0.8257}"
