,created_at,full_text,sentiment_score
120,2021-12-10 17:59:59+00:00,"RT last yr Xmas cancelled. Covid raging, no vax, families couldn't gather 

this yr Xmas booming; malls are filled, massive...","{'neg': 0.309, 'neu': 0.691, 'pos': 0.0, 'compound': -0.765}"
121,2021-12-10 17:59:59+00:00,"RT This is a brilliant advert for your Vaccine Passports 

Utter lunacy, no scientific evidence support...","{'neg': 0.113, 'neu': 0.591, 'pos': 0.296, 'compound': 0.6151}"
122,2021-12-10 17:59:59+00:00,RT Almost half the British public are unlikely to follow any tighter Covid rules in the wake of the scandal over alleged Christ...,"{'neg': 0.116, 'neu': 0.884, 'pos': 0.0, 'compound': -0.4404}"
123,2021-12-10 17:59:59+00:00,RT Ladies are buying cars and houses in Ramapussy's economy and in a pandemic ? Please i have no choice but to stan. Plea...,"{'neg': 0.063, 'neu': 0.871, 'pos': 0.065, 'compound': 0.0129}"
124,2021-12-10 17:59:59+00:00,RT So wearing a piece of cloth over your face during a raging pandemic is government overreach but FORCING a woman to car...,"{'neg': 0.091, 'neu': 0.909, 'pos': 0.0, 'compound': -0.296}"
125,2021-12-10 17:59:59+00:00,What you need to know about the Omnicron Varient #DrNandi #Doctor #covid19 #variant,"{'neg': 0.0, 'neu': 1.0, 'pos': 0.0, 'compound': 0.0}"
126,2021-12-10 17:59:59+00:00,"RT Oh, another U-turn?
Draghistan - Clinical leads' rep calls for the end of the ""no jab, no job"" policy for healthcare professio...","{'neg': 0.091, 'neu': 0.909, 'pos': 0.0, 'compound': -0.296}"
127,2021-12-10 17:59:59+00:00,"The old Fear Porno. Now they are screaming: ""The Hospitals are full"". We have to ask ourself: ""Full of what""? Covid patients or Vaccin Adverse events? Omicron could be used to cover up for old Vaccin injuries.
According to this nurse it's the vaccines
https://t.co/1MuKTeviPx","{'neg': 0.171, 'neu': 0.829, 'pos': 0.0, 'compound': -0.8253}"
128,2021-12-10 17:59:59+00:00,"RT All #WannaOne Members Test Negative For COVID-19 + #2021MAMA Pre-Recording Rescheduled
https://t.co/N9O9fUce33","{'neg': 0.236, 'neu': 0.764, 'pos': 0.0, 'compound': -0.5719}"
129,2021-12-10 17:59:59+00:00,#NoVaccinePassports they don't work stopping transmission. All they do is segregate people and hurt businesses,"{'neg': 0.191, 'neu': 0.729, 'pos': 0.081, 'compound': -0.4508}"
130,2021-12-10 17:59:59+00:00,"RT She publicly denied the rumours of her sharing anti-vaxx rhetoric on set, and she is currently recovering from an on-set inju...","{'neg': 0.113, 'neu': 0.778, 'pos': 0.109, 'compound': -0.0258}"
131,2021-12-10 18:00:00+00:00,Damn.,"{'neg': 1.0, 'neu': 0.0, 'pos': 0.0, 'compound': -0.4019}"
132,2021-12-10 18:00:00+00:00,RT Vaccine passports won't control a virus.. they will only control you. Why is this so hard for people to see?,"{'neg': 0.085, 'neu': 0.915, 'pos': 0.0, 'compound': -0.2183}"
133,2021-12-10 18:00:00+00:00,"RT It's happening.

A court in Belgium ruled that the covid passports were illegal.","{'neg': 0.217, 'neu': 0.783, 'pos': 0.0, 'compound': -0.5574}"
134,2021-12-10 18:00:00+00:00,"RT So Johnson says he only became aware that Lord Brownlow had paid the bill on his DS flat.
But can somebody explain why L...","{'neg': 0.0, 'neu': 1.0, 'pos': 0.0, 'compound': 0.0}"
135,2021-12-10 18:00:00+00:00,"Everything to know about Bulls' COVID-19 situation: Who is in protocols, who is available and how the team has been affected

https://t.co/HD49ftsgd5","{'neg': 0.071, 'neu': 0.929, 'pos': 0.0, 'compound': -0.1531}"
136,2021-12-10 18:00:00+00:00,"I'm a stay-at-home parent, my home was taken by a tornado, and I'm here to have my own Vegas show! YEAH!","{'neg': 0.0, 'neu': 0.85, 'pos': 0.15, 'compound': 0.5449}"
137,2021-12-10 18:00:00+00:00,"The government pushing the booster jabs like:

#AliExpress #Booster #vaccine #CountdowntoChristmas","{'neg': 0.0, 'neu': 0.8, 'pos': 0.2, 'compound': 0.3612}"
138,2021-12-10 18:00:00+00:00,"In a special coronavirus podcast, discusses his leaked video scoop and examines the political fallout and what impact recent events will have in Westminster and beyond.

Listen here:","{'neg': 0.073, 'neu': 0.791, 'pos': 0.136, 'compound': 0.25}"
139,2021-12-10 18:00:00+00:00,"Here are York County's latest #COVID numbers from the Pennsylvania Department of Health.
https://t.co/8m3tTRRXzi","{'neg': 0.0, 'neu': 1.0, 'pos': 0.0, 'compound': 0.0}"
140,2021-12-10 18:00:00+00:00,"The continuing search for answers has inflamed tensions between the U.S. and China, which has accused the U.S. of making it the scapegoat for the disaster.
https://t.co/sbwPkpl7ad","{'neg': 0.391, 'neu': 0.609, 'pos': 0.0, 'compound': -0.9201}"
141,2021-12-10 18:00:00+00:00,"RT Zhang Zhan, initially travelled to Wuhan in February 2020 after reading an online post by a resident about life in the c...","{'neg': 0.0, 'neu': 1.0, 'pos': 0.0, 'compound': 0.0}"
142,2021-12-10 18:00:00+00:00,RT Time to stand up ,"{'neg': 0.0, 'neu': 1.0, 'pos': 0.0, 'compound': 0.0}"
143,2021-12-10 18:00:00+00:00,"Every one of us working with America's children has the chance to help mitigate the mental health impacts of the pandemic and address mental health challenges that existed long before. 

Read the #YouthMentalHealth advisory to learn how:","{'neg': 0.0, 'neu': 0.85, 'pos': 0.15, 'compound': 0.6124}"
144,2021-12-10 18:00:00+00:00,RT Remember the concern previously when the R number went above 1? Current estimated R for Omicron in the U.K. is 3.3-4.2....,"{'neg': 0.0, 'neu': 0.942, 'pos': 0.058, 'compound': 0.0772}"
145,2021-12-10 18:00:00+00:00,Why are scientists saying that the Omicron COVID-19 variant is a reason to get a booster? #humanbiology,"{'neg': 0.0, 'neu': 1.0, 'pos': 0.0, 'compound': 0.0}"
146,2021-12-10 18:00:00+00:00,"RT Biden said inflation was transitory, but it isn't. He said illegal immigration was seasonal, but it's not. He said he'd g...","{'neg': 0.0, 'neu': 0.844, 'pos': 0.156, 'compound': 0.5975}"
147,2021-12-10 18:00:00+00:00,Data on deaths and hospitalizations in Minnesota since vaccines became widely available show how stark the gap is between vaccinated and unvaccinated when it comes to COVID-19's most severe effects. by,"{'neg': 0.088, 'neu': 0.912, 'pos': 0.0, 'compound': -0.4391}"
148,2021-12-10 18:00:00+00:00,"Many families are concerned about staying safe during #COVID19. Doctors and clinics are taking extra precautions to make sure you and your family remain safe during your visit. Call your doctor to schedule your visit and stay up to date with lead tests, vaccinations, and more!","{'neg': 0.0, 'neu': 0.837, 'pos': 0.163, 'compound': 0.8122}"
149,2021-12-10 18:00:00+00:00,This systematic review found that few clinical practice guidelines for pharmacologic treatment of hospitalized patients with #COVID19 met the National Academy of Medicine standards for trustworthy guidelines.,"{'neg': 0.0, 'neu': 0.878, 'pos': 0.122, 'compound': 0.5574}"
150,2021-12-10 18:00:00+00:00,"Great to see this shout-out for which is located on our Alewife Route A-South.

Even during our quietest ridership periods, biotech workers have continued to depend on GRID services to get to their labs &amp; offices.

See ALW-A-South service info:","{'neg': 0.0, 'neu': 0.905, 'pos': 0.095, 'compound': 0.6249}"
151,2021-12-10 18:00:00+00:00,"For the latest #COVID19 recommendations, clinical resources, and guidance, check out our dedicated COVID-19 resource hub to help you navigate the pandemic and how it affects your community and practice. Read more:","{'neg': 0.0, 'neu': 0.84, 'pos': 0.16, 'compound': 0.6908}"
152,2021-12-10 18:00:00+00:00,Supply chains took one of the hardest hits during #COVID19. Learn more about the #business challenges they face as a result of the #pandemic.,"{'neg': 0.0, 'neu': 0.947, 'pos': 0.053, 'compound': 0.0772}"
153,2021-12-10 18:00:00+00:00,"Editorial: Right-wing Sen. Ron Johnson's claim that gargling with mouthwash can prevent COVID-19 infections and halt the spread of the coronavirus was misleading, irresponsible and appalling, but it wasn't the least bit surprising.
https://t.co/9YUGWc0p88","{'neg': 0.145, 'neu': 0.758, 'pos': 0.097, 'compound': -0.2144}"
154,2021-12-10 18:00:00+00:00," Flag Poll: 2022 Generic Congressional Vote
Democrats 34, Republicans 44
Spread: Republicans +10

Date: Friday, December 10
Source: CNBC
Link:","{'neg': 0.0, 'neu': 1.0, 'pos': 0.0, 'compound': 0.0}"
155,2021-12-10 18:00:00+00:00,"Public view on Biden's handling of Covid and the economy takes another hit, ....This Guy is a F*CK'N IDIOT!!","{'neg': 0.204, 'neu': 0.796, 'pos': 0.0, 'compound': -0.6825}"
156,2021-12-10 18:00:00+00:00,"Opinion: Comparing vaccine passports to the Holocaust is absurd and dangerous.

https://t.co/vAd3guDV1X","{'neg': 0.22, 'neu': 0.78, 'pos': 0.0, 'compound': -0.4767}"
157,2021-12-10 18:00:00+00:00,"Wherever you are, and whatever you do, be in #LOVE.  

#JoyTrain #Joy #Kindness #Quote #COVID19 #MentalHealth #Mindfulness #GoldenHearts #IAM #IAMChoosingLove #FamilyTrain #FF #FridayFeeling #FridayMorning #FridayThoughts #FridayMotivation","{'neg': 0.0, 'neu': 0.662, 'pos': 0.338, 'compound': 0.9141}"
158,2021-12-10 18:00:00+00:00,The latest The CDC INFO Career News! Thanks to #career #management,"{'neg': 0.0, 'neu': 0.758, 'pos': 0.242, 'compound': 0.4926}"
159,2021-12-10 18:00:00+00:00,BBI Member talks #Omicron in,"{'neg': 0.0, 'neu': 1.0, 'pos': 0.0, 'compound': 0.0}"
160,2021-12-10 18:00:00+00:00,The Department of Health has announced that the first recipients of the Pfizer COVID-19 vaccine booster shot will likely get it in January #Booster #VaccineRolloutSA #vaccine,"{'neg': 0.0, 'neu': 1.0, 'pos': 0.0, 'compound': 0.0}"
161,2021-12-10 18:00:00+00:00,and unvaccinated tax payers have funded the vaccine roll out,"{'neg': 0.0, 'neu': 1.0, 'pos': 0.0, 'compound': 0.0}"
162,2021-12-10 18:00:00+00:00,Personal Observations While Traveling During COVID Times from Numeric Citizen Blog,"{'neg': 0.0, 'neu': 1.0, 'pos': 0.0, 'compound': 0.0}"
163,2021-12-10 18:00:00+00:00,"Don't miss us tomorrow! Join us in the SouthWest Plaza from 12pm to 2pm for an exciting afternoon of holiday cheer . 

 Spend $50 or more for a chance to win amazing prizes or discounts just in time for Christmas!

NOTE: COVID-19 protocols will be observed and enforced .","{'neg': 0.0, 'neu': 0.603, 'pos': 0.397, 'compound': 0.9758}"
