,created_at,full_text,sentiment_score
0,2021-12-16 07:59:54+00:00,But they have taken four jabs already? This vaccine saga will never end,"{'neg': 0.0, 'neu': 1.0, 'pos': 0.0, 'compound': 0.0}"
1,2021-12-16 07:59:54+00:00,RT There's overcrowding in our prisons. We are in the midst of a deadly 4th wave pandemic. Best chance for President Rama...,"{'neg': 0.0, 'neu': 0.763, 'pos': 0.237, 'compound': 0.7351}"
2,2021-12-16 07:59:54+00:00,"RT I'm fully vaccinated and I  have had my booster. No, I don't know ""what's in it"". Neither this vaccine or the ones I ha...","{'neg': 0.0, 'neu': 1.0, 'pos': 0.0, 'compound': 0.0}"
3,2021-12-16 07:59:54+00:00,"RT Very interesting analyses about the virology of #Omicron, which may explain the faster spread of this variant.

According to...","{'neg': 0.0, 'neu': 0.864, 'pos': 0.136, 'compound': 0.4576}"
4,2021-12-16 07:59:55+00:00,"RT 5) Now that aerosol transmission of the coronavirus is established, we need to disperse aerosols quickly. Key is ventilatio...","{'neg': 0.0, 'neu': 1.0, 'pos': 0.0, 'compound': 0.0}"
5,2021-12-16 07:59:55+00:00,Yep. No exceptions.,"{'neg': 0.407, 'neu': 0.185, 'pos': 0.407, 'compound': 0.0}"
6,2021-12-16 07:59:55+00:00,"I'm glad you're okay after your three shot. Others are dying from the vaccine

Why mandate Sth that can cause death?","{'neg': 0.146, 'neu': 0.672, 'pos': 0.183, 'compound': 0.0}"
7,2021-12-16 07:59:55+00:00,RT Is the vaccine the bioweapon?,"{'neg': 0.0, 'neu': 1.0, 'pos': 0.0, 'compound': 0.0}"
8,2021-12-16 07:59:55+00:00,Epidemic spreading in populations of mobile agents with adaptive behavioral response. (arXiv:2112.07829v1 [physics.soc-ph]),"{'neg': 0.0, 'neu': 1.0, 'pos': 0.0, 'compound': 0.0}"
9,2021-12-16 07:59:55+00:00,This all feels horribly familiar. Sending love to all the casts and crew currently on show suspensions or in isolation. ,"{'neg': 0.223, 'neu': 0.623, 'pos': 0.154, 'compound': -0.2263}"
10,2021-12-16 07:59:55+00:00,RT remember when we thought covid was gonna last three months? now look at us .... about to enter our third year with it. htt...,"{'neg': 0.0, 'neu': 1.0, 'pos': 0.0, 'compound': 0.0}"
11,2021-12-16 07:59:55+00:00,RT farta do covid,"{'neg': 0.0, 'neu': 1.0, 'pos': 0.0, 'compound': 0.0}"
12,2021-12-16 07:59:55+00:00,"RT The laughing, jeering and hectoring from the Tory benches as questions the Prime Minister is hard to sto...","{'neg': 0.065, 'neu': 0.787, 'pos': 0.148, 'compound': 0.4215}"
13,2021-12-16 07:59:55+00:00,RT The coronavirus is airborne. Very airborne. Even if you don't see anyone--doesn't mean the aerosols aren't in the air. WATC...,"{'neg': 0.0, 'neu': 1.0, 'pos': 0.0, 'compound': 0.0}"
14,2021-12-16 07:59:56+00:00,RT The most sustainable solution for ensuring vaccine equity is through sharing of the innovation and technology! TRIPs waiver is...,"{'neg': 0.0, 'neu': 0.607, 'pos': 0.393, 'compound': 0.8545}"
15,2021-12-16 07:59:56+00:00,"RT With record cases reported, a responsible leader would mandate a short lockdown to help protect the NHS.

Instead we have...","{'neg': 0.0, 'neu': 0.703, 'pos': 0.297, 'compound': 0.765}"
16,2021-12-16 07:59:56+00:00,"RT The UK will remove 11 African countries from a ""red list"" after restricting travel due to Omicron.

The U.S. and Europe used th...","{'neg': 0.102, 'neu': 0.898, 'pos': 0.0, 'compound': -0.3818}"
17,2021-12-16 07:59:56+00:00,RT Covid in Scotland: Nicola Sturgeon says Treasury funds leave Scots worse off. Stop spending so much on referendum matters and...,"{'neg': 0.256, 'neu': 0.63, 'pos': 0.114, 'compound': -0.5574}"
18,2021-12-16 07:59:56+00:00,"So this is a thing I just did. I'm going to blame it on Covid and not the fact that I'm an old Midwestern mom who hasn't worn real shoes in three years (spent the second half 2019, and then some, pregnant).","{'neg': 0.054, 'neu': 0.903, 'pos': 0.043, 'compound': -0.1311}"
19,2021-12-16 07:59:56+00:00,"RT ""once covid ends"" startin to sound a lot like ""once gta 6 drop""","{'neg': 0.127, 'neu': 0.723, 'pos': 0.151, 'compound': 0.1027}"
20,2021-12-16 07:59:56+00:00,RT I'm honored to become Professor of Crisis Governance at my long time academic home: I started here as a stu...,"{'neg': 0.152, 'neu': 0.706, 'pos': 0.141, 'compound': -0.0772}"
21,2021-12-16 07:59:56+00:00,RT The economic impact shouldn't be underestimated of a 'voluntary lockdown' which hits businesses hard with no financial saf...,"{'neg': 0.168, 'neu': 0.747, 'pos': 0.085, 'compound': -0.1989}"
22,2021-12-16 07:59:56+00:00,"RT Over the next few days, I'll share my annual list of favorite books, music, and movies. Art always sustains and nourishes...","{'neg': 0.0, 'neu': 0.794, 'pos': 0.206, 'compound': 0.6369}"
23,2021-12-16 07:59:56+00:00,"RT UK  is about to hit a testing capacity issue. PCR testing slots now often unavailable -- again, with exponentially rising...","{'neg': 0.0, 'neu': 1.0, 'pos': 0.0, 'compound': 0.0}"
24,2021-12-16 07:59:56+00:00,"Granted, we can't stop you being exposed to the #SARSCoV2 but the triple Vax dramatically reduces the chances of it becoming #Covid19. The Diabetes risk doesn't affect that protection","{'neg': 0.115, 'neu': 0.729, 'pos': 0.156, 'compound': 0.0885}"
25,2021-12-16 07:59:56+00:00,RT This pandemic is never ending.,"{'neg': 0.0, 'neu': 1.0, 'pos': 0.0, 'compound': 0.0}"
26,2021-12-16 07:59:56+00:00,"RT Nightclub owner on the news: ""What are we meant to do if people don't have a COVID pass? Just not let them in and alienate them?""...","{'neg': 0.0, 'neu': 1.0, 'pos': 0.0, 'compound': 0.0}"
27,2021-12-16 07:59:56+00:00,RT This is why fast bowlers should never be captains. The risk of them having to miss Tests due to being identified as a close...,"{'neg': 0.139, 'neu': 0.861, 'pos': 0.0, 'compound': -0.4019}"
28,2021-12-16 07:59:56+00:00,Now we have to sit longer in a #cinema with #covid. What a mess.,"{'neg': 0.161, 'neu': 0.839, 'pos': 0.0, 'compound': -0.3612}"
29,2021-12-16 07:59:56+00:00,"Viral fatigue, stop renaming things as of they only came into being with covid.","{'neg': 0.259, 'neu': 0.741, 'pos': 0.0, 'compound': -0.4939}"
30,2021-12-16 07:59:56+00:00,"RT BREAKING: Comedian Jethro has died at the age of 73 after contracting Covid-19, his manager has said.","{'neg': 0.162, 'neu': 0.721, 'pos': 0.117, 'compound': -0.25}"
31,2021-12-16 07:59:56+00:00,"RT Australians have had a gutful of scott morrison 
and politicians  stupidity
the ruby princess a...","{'neg': 0.162, 'neu': 0.838, 'pos': 0.0, 'compound': -0.4404}"
32,2021-12-16 07:59:56+00:00,"RT Due to the rapid spread of Omicron variant in the UK, we have added a new measure where all arrivals from the UK must self-te...","{'neg': 0.0, 'neu': 1.0, 'pos': 0.0, 'compound': 0.0}"
33,2021-12-16 07:59:56+00:00,RT It was an honour to be invited by Prof. Thomas Bosch to give a talk about our work &amp; answer some career-related ques...,"{'neg': 0.0, 'neu': 0.861, 'pos': 0.139, 'compound': 0.5719}"
34,2021-12-16 07:59:56+00:00,RT The CDC agrees!,"{'neg': 0.0, 'neu': 0.589, 'pos': 0.411, 'compound': 0.2714}"
35,2021-12-16 07:59:57+00:00,The regional growth picture doesn't look good although UK might be a bright spot. #BOO blames pandemic but isn't real issue not having US/EU warehouse in place?,"{'neg': 0.117, 'neu': 0.759, 'pos': 0.124, 'compound': 0.0508}"
36,2021-12-16 07:59:57+00:00,By knowing the genomic sequence of each variant,"{'neg': 0.0, 'neu': 1.0, 'pos': 0.0, 'compound': 0.0}"
37,2021-12-16 07:59:57+00:00,RT Gutted to miss this Test but really excited to see Neser finally get his chance in the baggy green. He has done the hard...,"{'neg': 0.097, 'neu': 0.701, 'pos': 0.202, 'compound': 0.6297}"
38,2021-12-16 07:59:57+00:00,been staying away from niggas before covid hit !,"{'neg': 0.252, 'neu': 0.748, 'pos': 0.0, 'compound': -0.4003}"
39,2021-12-16 07:59:57+00:00,"Still too early to say for sure, but more potentially good news about Omicron severity:","{'neg': 0.0, 'neu': 0.687, 'pos': 0.313, 'compound': 0.7111}"
40,2021-12-16 07:59:57+00:00,"RT Yesterday my sister died of Coronavirus. She was 62 years old, she had her jags, didn't smoke or drink, wore her mask, w...","{'neg': 0.135, 'neu': 0.865, 'pos': 0.0, 'compound': -0.5574}"
41,2021-12-16 07:59:57+00:00,RT 2 years on many care homes residents continue to be denied there families why? That's the only true evidence during thi...,"{'neg': 0.104, 'neu': 0.681, 'pos': 0.215, 'compound': 0.4767}"
42,2021-12-16 07:59:57+00:00,RT i literally hate the coronavirus I just don't think it was that good of an idea to have that happen,"{'neg': 0.145, 'neu': 0.742, 'pos': 0.113, 'compound': -0.2023}"
43,2021-12-16 07:59:57+00:00,"University of Legon ampa. 

U ppl they just waste monies on you to go to school kwa. Do you people even learn or read wide at all? Do you know whether or not your friend has an underlying problem he didn't tell you? So because he took vaccine nti, all of a sudden that killed him?","{'neg': 0.202, 'neu': 0.798, 'pos': 0.0, 'compound': -0.9212}"
44,2021-12-16 07:59:57+00:00,RT The much heralded 'freedom day' was the precursor to this Christmas #covid chaos and the #shapeshifter is fiddling while the...,"{'neg': 0.138, 'neu': 0.706, 'pos': 0.156, 'compound': 0.128}"
45,2021-12-16 07:59:57+00:00,"Terrible sense that people will wait till the hospitalisations happen before they change their behaviour. I've seen a real uptick in ""Omicron is a cold"" denialism. Heartbreaking to think of the deaths which could be avoided","{'neg': 0.205, 'neu': 0.795, 'pos': 0.0, 'compound': -0.8176}"
46,2021-12-16 07:59:57+00:00,RT The only state in AUS still committed to supporting its Premier to maintain elimination of #COVID19 is Western Australia. It...,"{'neg': 0.0, 'neu': 0.792, 'pos': 0.208, 'compound': 0.6124}"
47,2021-12-16 07:59:57+00:00,"RT Herh, Sammy Gyamfi has really researched and prepared for this. FDA has not even approved the vaccine but the government wa...","{'neg': 0.072, 'neu': 0.86, 'pos': 0.068, 'compound': -0.0217}"
48,2021-12-16 07:59:57+00:00,RT Good thread on #omicron up and down,"{'neg': 0.0, 'neu': 0.707, 'pos': 0.293, 'compound': 0.4404}"
49,2021-12-16 07:59:57+00:00,RT EXCLUSIVE: Extraordinary image of raucous Christmas party thrown by Tory aides at party HQ during coronavirus restrictions...,"{'neg': 0.0, 'neu': 0.663, 'pos': 0.337, 'compound': 0.7672}"
50,2021-12-16 07:59:57+00:00,"RT Poonawalla family donates Rs 500 crore to Oxford University to build new vaccine research centre.

Bharat buys the vac...","{'neg': 0.0, 'neu': 1.0, 'pos': 0.0, 'compound': 0.0}"
51,2021-12-16 07:59:57+00:00,RT 'I want to talk directly to those who accuse us of scaremongering. I've spent 45 years doing this kind of work &amp; my who...,"{'neg': 0.069, 'neu': 0.881, 'pos': 0.05, 'compound': -0.128}"
52,2021-12-16 07:59:57+00:00,RT The economic impact shouldn't be underestimated of a 'voluntary lockdown' which hits businesses hard with no financial saf...,"{'neg': 0.168, 'neu': 0.747, 'pos': 0.085, 'compound': -0.1989}"
53,2021-12-16 07:59:57+00:00,Yessss stay safeeee,"{'neg': 0.0, 'neu': 1.0, 'pos': 0.0, 'compound': 0.0}"
54,2021-12-16 07:59:57+00:00,Absolutely. They have not been accurate at all. #Scaremongering,"{'neg': 0.0, 'neu': 1.0, 'pos': 0.0, 'compound': 0.0}"
55,2021-12-16 07:59:57+00:00,"RT #AKTU students oppose offline UG-PG examinations scheduled in December-January, cite threat posed by Covid and Omicron. A...","{'neg': 0.234, 'neu': 0.766, 'pos': 0.0, 'compound': -0.5994}"
56,2021-12-16 07:59:58+00:00,me holding in my 10th cough of the class so my teacher dont think i got covid,"{'neg': 0.0, 'neu': 1.0, 'pos': 0.0, 'compound': 0.0}"
57,2021-12-16 07:59:58+00:00,"RT Yep! ""The real purpose behind the historic, unprecedented push to vaccinate the very young, even against diseases like...","{'neg': 0.0, 'neu': 0.773, 'pos': 0.227, 'compound': 0.6114}"
58,2021-12-16 07:59:58+00:00,RT People who are vaccinated can still spread Covid. Please retweet. Will Twitter ban us all?,"{'neg': 0.181, 'neu': 0.704, 'pos': 0.116, 'compound': -0.3182}"
59,2021-12-16 07:59:58+00:00,"RT Batman : Killing Time will be my next cover project with DC, I'll be working on all 6 variant covers for this mini series from...","{'neg': 0.15, 'neu': 0.85, 'pos': 0.0, 'compound': -0.6597}"
60,2021-12-16 07:59:58+00:00,so COVID won't let me go to London for New Year's Eve ? fuck covid all day,"{'neg': 0.179, 'neu': 0.821, 'pos': 0.0, 'compound': -0.5423}"
61,2021-12-16 07:59:58+00:00,They have clearly said that they don't investigate covid breaches retrospectively. What is the problem?,"{'neg': 0.147, 'neu': 0.707, 'pos': 0.147, 'compound': 0.0}"
62,2021-12-16 07:59:58+00:00,It's a spy app.,"{'neg': 0.0, 'neu': 1.0, 'pos': 0.0, 'compound': 0.0}"
63,2021-12-16 07:59:58+00:00,"I'm going to be completely honest. With the surge in cases I said to Hannah that we shouldn't go to the cinema last night. I can't really turn around and go to the rugby until we get this variant under some sort of control. 

In other news... I'm getting my booster in 2hrs ","{'neg': 0.0, 'neu': 0.935, 'pos': 0.065, 'compound': 0.5563}"
64,2021-12-16 07:59:58+00:00,"RT At my university vaccine mandates are being regulated by the Equity, Diversity, and Inclusion office

You cannot make thi...","{'neg': 0.0, 'neu': 1.0, 'pos': 0.0, 'compound': 0.0}"
65,2021-12-16 07:59:58+00:00,"RT Today's Playbook

Unofficial lockdown

https://t.co/8q9CEXoLvz","{'neg': 0.0, 'neu': 1.0, 'pos': 0.0, 'compound': 0.0}"
66,2021-12-16 07:59:58+00:00,"RT  211216
[4:54pm KST]

""Be careful of Corona, be careful of the flu, be careful of the cold""

""Weather-nim ah, pay attent...","{'neg': 0.155, 'neu': 0.659, 'pos': 0.186, 'compound': -0.0516}"
67,2021-12-16 07:59:58+00:00,RT Mad ting.,"{'neg': 0.615, 'neu': 0.385, 'pos': 0.0, 'compound': -0.4939}"
68,2021-12-16 07:59:58+00:00,"RT Just had my request to defer Jury service in January denied. 

Apparently being a GP in global pandemic during a workforce c...","{'neg': 0.195, 'neu': 0.805, 'pos': 0.0, 'compound': -0.6249}"
69,2021-12-16 07:59:59+00:00,"RT By all means get vaccinated.

But u know how else u can reduce your risk from severe effects of covid? By improving your m...","{'neg': 0.191, 'neu': 0.693, 'pos': 0.117, 'compound': -0.3291}"
70,2021-12-16 07:59:59+00:00,"There's actually an Influenza outbreak in the country, so it might not be Covid. But still get tested and isolate if you have any of those symptoms","{'neg': 0.078, 'neu': 0.922, 'pos': 0.0, 'compound': -0.296}"
71,2021-12-16 07:59:59+00:00,"RT  211216
[4:52pm KST]

""Be careful of corona.....!!!""

""kkkkkkk A sudden development""

""But its just I suddenly thought of...","{'neg': 0.0, 'neu': 0.892, 'pos': 0.108, 'compound': 0.2905}"
72,2021-12-16 07:59:59+00:00,RT The highest number of weekly deaths for 15 to 19 year old males was reported for week ending 3rd December since Jan 202...,"{'neg': 0.0, 'neu': 0.947, 'pos': 0.053, 'compound': 0.0772}"
73,2021-12-16 07:59:59+00:00,"RT Boris Johnson's ebullience and posturing led to a re-run of the pantomime politics that so offend the electorate, even m...","{'neg': 0.125, 'neu': 0.875, 'pos': 0.0, 'compound': -0.4341}"
74,2021-12-16 07:59:59+00:00,RT we didn't overcome a pandemic. we are IN a pandemic.,"{'neg': 0.0, 'neu': 1.0, 'pos': 0.0, 'compound': 0.0}"
75,2021-12-16 07:59:59+00:00,"RT From Our Daily Fail, less than six months ago. 

'Far-right conspiracy theorists' rubbished this story ... and have, sadly...","{'neg': 0.363, 'neu': 0.637, 'pos': 0.0, 'compound': -0.8658}"
76,2021-12-16 07:59:59+00:00,"RT NEWS: 60 NBA players have entered H&amp;S protocols this season, including 43 in the past two weeks and 13 Tuesday, a new single-da...","{'neg': 0.0, 'neu': 1.0, 'pos': 0.0, 'compound': 0.0}"
77,2021-12-16 07:59:59+00:00,RT Furlough must be extended to all affected by the omicron wave.,"{'neg': 0.127, 'neu': 0.873, 'pos': 0.0, 'compound': -0.1531}"
78,2021-12-16 07:59:59+00:00,RT Delays in decisions cost lives. Actions taking when advised on Dec 18 2020 instead delayed to...,"{'neg': 0.106, 'neu': 0.894, 'pos': 0.0, 'compound': -0.2263}"
79,2021-12-16 07:59:59+00:00,"RT ""Talking about Omicron (or any variant) resulting in 'milder' illness is careless...It neglects to reflect on #LongCOVI...","{'neg': 0.269, 'neu': 0.731, 'pos': 0.0, 'compound': -0.7096}"
80,2021-12-16 07:59:59+00:00,"RT One word: Omicron. 

Masks in retail are needed. 

Vic govt has made a good call...","{'neg': 0.0, 'neu': 0.838, 'pos': 0.162, 'compound': 0.4404}"
81,2021-12-16 07:59:59+00:00,"RT 3) Anyone who touts ""Omicron is milder"" (not proven) also doesn't understand epidemiology and exponential math. Even if it...","{'neg': 0.055, 'neu': 0.945, 'pos': 0.0, 'compound': -0.0258}"
82,2021-12-16 07:59:59+00:00,RT Covid in Scotland: What is guidance and what is the law?,"{'neg': 0.0, 'neu': 1.0, 'pos': 0.0, 'compound': 0.0}"
83,2021-12-16 07:59:59+00:00,RT There won't be another lockdown because Sunak doesn't want one (&amp; that's why he's hiding in California).,"{'neg': 0.176, 'neu': 0.824, 'pos': 0.0, 'compound': -0.3447}"
84,2021-12-16 08:00:00+00:00,RT Mad ting.,"{'neg': 0.615, 'neu': 0.385, 'pos': 0.0, 'compound': -0.4939}"
85,2021-12-16 08:00:00+00:00,Updates,"{'neg': 0.0, 'neu': 1.0, 'pos': 0.0, 'compound': 0.0}"
86,2021-12-16 08:00:00+00:00,RT  Premier League players and staff will now have to take a lateral flow test every day to be allowed into training gro...,"{'neg': 0.0, 'neu': 1.0, 'pos': 0.0, 'compound': 0.0}"
87,2021-12-16 08:00:00+00:00,"#TBT is taking us back to the captivating and gorgeous Swan Lake 
Back in January 2020, when Corona was just a choice of beverage....

https://t.co/3gxI3yY6DU

#ThrowbackThursday","{'neg': 0.0, 'neu': 0.862, 'pos': 0.138, 'compound': 0.6124}"
88,2021-12-16 08:00:00+00:00,RT We're in a time where politicians want their policies implemented with little regard for the checks &amp; balances within ou...,"{'neg': 0.0, 'neu': 0.939, 'pos': 0.061, 'compound': 0.0772}"
89,2021-12-16 08:00:00+00:00,"In 2020, SANAD disbursed more than USD 161 million to support the ability of local financial infrastructure to help #MSMEs confront the #COVID-19 pandemic. 

Explore stories, figures and more:","{'neg': 0.049, 'neu': 0.727, 'pos': 0.224, 'compound': 0.7184}"
90,2021-12-16 08:00:00+00:00,The number of Covid-19 cases in South Africa now stands at 3 231 031.,"{'neg': 0.0, 'neu': 0.909, 'pos': 0.091, 'compound': 0.0772}"
91,2021-12-16 08:00:00+00:00,RT Thanks Adam Carrel for translating Morrison's 'shake and bake' slogan. Aha instant pancake mix. Oh that's how you...,"{'neg': 0.079, 'neu': 0.787, 'pos': 0.134, 'compound': 0.296}"
92,2021-12-16 08:00:00+00:00,"RT 800,000 dead Americans: who needs a mask or vaccine?

16 instances of alleged voter fraud in 2020: let's pass 500 new voter...","{'neg': 0.278, 'neu': 0.722, 'pos': 0.0, 'compound': -0.8442}"
93,2021-12-16 08:00:00+00:00,"To reinvigorate the local tourism industry hit by the coronavirus pandemic, the Kalibo International Airport has reopened to Boracay Island-bound tourists.

https://t.co/JFqKehd6zz","{'neg': 0.0, 'neu': 0.864, 'pos': 0.136, 'compound': 0.5106}"
94,2021-12-16 08:00:00+00:00,"RT As South Korea battles an epidemic of spy cam pornography, wherein men profit financially from streaming footage of wom...","{'neg': 0.111, 'neu': 0.766, 'pos': 0.123, 'compound': 0.0772}"
95,2021-12-16 08:00:00+00:00,"Preliminary research from South Africa and the University of California, Santa Cruz, suggest that mRNA vaccines provide much less protection against Omicron than previous SARS-CoV-2 variants.","{'neg': 0.0, 'neu': 1.0, 'pos': 0.0, 'compound': 0.0}"
96,2021-12-16 08:00:00+00:00,RT Let's cancel Christmas for the common cold. In fact just to be on the safe side let's lockdown every winter when people ge...,"{'neg': 0.074, 'neu': 0.818, 'pos': 0.108, 'compound': 0.2263}"
97,2021-12-16 08:00:00+00:00,It is with great sadness we have just received the news that RX France has decided to no longer organize the Midem events due to the lasting pandemic. We want to thank all the people at Midem who helped us get the artists heard.,"{'neg': 0.098, 'neu': 0.75, 'pos': 0.152, 'compound': 0.4215}"
98,2021-12-16 08:00:00+00:00,"RT Scotland can't do this due to the inefficiency of ""two governments"" .. streamlined independent Norway shows the way.","{'neg': 0.0, 'neu': 1.0, 'pos': 0.0, 'compound': 0.0}"
99,2021-12-16 08:00:00+00:00,me dodging this omicron wave to get to christmas,"{'neg': 0.149, 'neu': 0.851, 'pos': 0.0, 'compound': -0.1027}"
100,2021-12-16 08:00:00+00:00,RT Grieving relatives left furious after St Basil's managers refuse to speak at inquest into deadly outbreak,"{'neg': 0.397, 'neu': 0.603, 'pos': 0.0, 'compound': -0.8481}"
101,2021-12-16 08:00:00+00:00,"This is not good
https://t.co/xrFY8HfHoH","{'neg': 0.376, 'neu': 0.624, 'pos': 0.0, 'compound': -0.3412}"
102,2021-12-16 08:00:00+00:00,"RT PRC and abolition of CPS were promises in several public meetings by YSJ.

If govt is facing issues coz of CoVid, YSJ...","{'neg': 0.0, 'neu': 0.894, 'pos': 0.106, 'compound': 0.3818}"
103,2021-12-16 08:00:00+00:00,"The pandemic brought forth great innovations in the entertainment industry. Learn more about the evolution of Park and Chill, Park and Tune as well as the re-birth of Drive-In cinema here #KCBVenture","{'neg': 0.0, 'neu': 0.763, 'pos': 0.237, 'compound': 0.8402}"
104,2021-12-16 08:00:00+00:00,"RT Just spoke to wife. #Hospital on red status, #Covid ward full. Drs saying NSW Govt has gone too early &amp; ignored Omicron impa...","{'neg': 0.091, 'neu': 0.909, 'pos': 0.0, 'compound': -0.3182}"
105,2021-12-16 08:00:00+00:00,RT Yesterday's No10 press conference just showed how important it is to have journalists scrutinise those in charge of Covid st...,"{'neg': 0.0, 'neu': 0.917, 'pos': 0.083, 'compound': 0.2023}"
106,2021-12-16 08:00:00+00:00,"With great power comes great responsibility -- and so Spider-Man is being called upon to save Hollywood and movie theaters once again, with analysts eyeing the pandemic era's first potential billion-dollar-grossing film. |","{'neg': 0.0, 'neu': 0.725, 'pos': 0.275, 'compound': 0.9081}"
107,2021-12-16 08:00:00+00:00,RT It's not OK. Our research has highlighted how often poorly managed safe care home visitation  is during...,"{'neg': 0.0, 'neu': 0.724, 'pos': 0.276, 'compound': 0.7269}"
108,2021-12-16 08:00:00+00:00,"- PL tell #THFC no wiggle room to move match for Rennes 

- Rodgers feels #LCFC ""100%"" disadvantaged as PL decide their COVID-19 outbreak is under control

- Conte fears COVID after-effects

#LEITOT - a match neither side wants to play. w","{'neg': 0.16, 'neu': 0.79, 'pos': 0.05, 'compound': -0.6486}"
109,2021-12-16 08:00:00+00:00,"RT Once again, masks don't work. We know this.","{'neg': 0.0, 'neu': 1.0, 'pos': 0.0, 'compound': 0.0}"
110,2021-12-16 08:00:00+00:00,"#AbuDhabi introduces new land border checks to control the spread of #COVID19.

https://t.co/aPRBF6bdil","{'neg': 0.0, 'neu': 1.0, 'pos': 0.0, 'compound': 0.0}"
111,2021-12-16 08:00:00+00:00,"Antonio Conte has work to do at Tottenham, ahead of Christmas Day.

https://t.co/0trCKy0cIH","{'neg': 0.0, 'neu': 1.0, 'pos': 0.0, 'compound': 0.0}"
112,2021-12-16 08:00:00+00:00,#Opinion The wide range of new Chinese initiatives will accelerate trade and investment flows and boost #ASEAN economic recovery from the global pandemic.,"{'neg': 0.0, 'neu': 0.891, 'pos': 0.109, 'compound': 0.4019}"
113,2021-12-16 08:00:00+00:00,"Don't believe a word Johnson days either. However we don't need to be all in or all out. This isn't about sides. My uncle (dad's twin brother) died of COVID, it's absolutely made up","{'neg': 0.098, 'neu': 0.902, 'pos': 0.0, 'compound': -0.5574}"
114,2021-12-16 08:00:00+00:00,"A snapshot of latest growth forecasts
* So far we assume Omicron variant will *not* derail economic recovery in remainder of 2021 and 2022
* All G20 countries (except ) will have recovered to pre-coronavirus GDP levels in 2022","{'neg': 0.0, 'neu': 0.892, 'pos': 0.108, 'compound': 0.5405}"
115,2021-12-16 08:00:00+00:00,"If you're heading out to watch #Liverpool or #Everton tonight, here's what you need to know about the latest #covid rules...

https://t.co/JDjBkj7qsX","{'neg': 0.0, 'neu': 1.0, 'pos': 0.0, 'compound': 0.0}"
116,2021-12-16 08:00:00+00:00,"New restrictions on hospital visiting
https://t.co/cP7obHhoTX","{'neg': 0.0, 'neu': 1.0, 'pos': 0.0, 'compound': 0.0}"
117,2021-12-16 08:00:00+00:00,"RT This winter you can #protectyourself #protectothers and #protectInverclyde by doing a LFD test before mixing with others, t...","{'neg': 0.0, 'neu': 1.0, 'pos': 0.0, 'compound': 0.0}"
118,2021-12-16 08:00:00+00:00,"Nothing to do with Brexit, 100% to do with Governments shutting everything down","{'neg': 0.0, 'neu': 1.0, 'pos': 0.0, 'compound': 0.0}"
119,2021-12-16 08:00:00+00:00,"RT If you are vaccinated but still worried about the new variant, get your booster. 
If you aren't vaccinated, go get that first...","{'neg': 0.113, 'neu': 0.887, 'pos': 0.0, 'compound': -0.4215}"
120,2021-12-16 08:00:00+00:00,"Chillin' in Silliman campus, shared by DJ Rivera [ IG: ]. Be safe, wear your face mask, and observe social distancing, Dumaguetnon! Magpa-bakuna na! There will be better days. #DumaGetMe","{'neg': 0.0, 'neu': 0.755, 'pos': 0.245, 'compound': 0.8309}"
121,2021-12-16 08:00:00+00:00,In pictures: Thousands protest Covid-19 rules in New Zealand's capital Wellington as the country reaches 90% full vaccination milestone,"{'neg': 0.099, 'neu': 0.842, 'pos': 0.059, 'compound': -0.2023}"
122,2021-12-16 08:00:00+00:00,"#ThursdayMotivation Day 16 of our #charity #Christmas #AdventCalendar supporting people #living with #heart conditions #CardioTwitter #chd #COVID19 
https://t.co/OmwcjNqjM8","{'neg': 0.0, 'neu': 0.602, 'pos': 0.398, 'compound': 0.872}"
