,created_at,full_text,sentiment_score
0,2021-12-10 17:59:54+00:00,RT Anyone with half a brain cell knows that calling for a full national lockdown is flipping RIDICULOUS.,"{'neg': 0.172, 'neu': 0.828, 'pos': 0.0, 'compound': -0.5463}"
1,2021-12-10 17:59:54+00:00,"RT It's happening.

A court in Belgium ruled that the covid passports were illegal.","{'neg': 0.217, 'neu': 0.783, 'pos': 0.0, 'compound': -0.5574}"
2,2021-12-10 17:59:55+00:00,"TFG has another state govt disinfo casualty.

""..local Michigan Republican official .. William Hartmann, 63, succumbed to the coronavirus on Nov. 30 in a hospital in Wyandotte, Michigan.""

 COVID Kills Anti-Vax GOPer Who Denied Election Certification","{'neg': 0.229, 'neu': 0.771, 'pos': 0.0, 'compound': -0.8689}"
3,2021-12-10 17:59:55+00:00,"To Arabs and Non-Arabs... The Planet of Torment Has Approached
Imam Mahdi Nasser Mohammad Al-Yamani
08 - Rabi Awwal - 1443 AH
14 - October - 2021 AD
08:58 am
https://t.co/XIqfnaSgvu
3
#Planet_X_Has_Approached
 Omicron
gdbzrT","{'neg': 0.0, 'neu': 1.0, 'pos': 0.0, 'compound': 0.0}"
4,2021-12-10 17:59:55+00:00,"RT #COVID19 has driven a spike in violence against forcibly displaced women and girls.
 
UNHCR is responding to survivors' needs...","{'neg': 0.177, 'neu': 0.823, 'pos': 0.0, 'compound': -0.6249}"
5,2021-12-10 17:59:55+00:00,RT Pleased that all Council Leaders agreed to support Labour's motion today criticising the Scottish Government's settlement...,"{'neg': 0.115, 'neu': 0.556, 'pos': 0.329, 'compound': 0.6124}"
6,2021-12-10 17:59:55+00:00,Very clever. I am pro flying out the animals though.,"{'neg': 0.0, 'neu': 0.732, 'pos': 0.268, 'compound': 0.5095}"
7,2021-12-10 17:59:55+00:00,"RT Boris is trying to tackle the big issues of the day while there's a pandemic on. It's not easy.

Brexit, Immigration, La...","{'neg': 0.099, 'neu': 0.901, 'pos': 0.0, 'compound': -0.3412}"
8,2021-12-10 17:59:55+00:00,"RT If Vaccine Passports worked, they wouldn't be seeing huge spikes of infections in France, Germany, Ireland and the closure of...","{'neg': 0.089, 'neu': 0.911, 'pos': 0.0, 'compound': -0.2411}"
9,2021-12-10 17:59:55+00:00,"RT God help me  
(We have similar situations in Israel as well)","{'neg': 0.0, 'neu': 0.566, 'pos': 0.434, 'compound': 0.7096}"
10,2021-12-10 17:59:55+00:00,RT tucker associating weakness and getting ill with femininity is hilarious. yes all men who get sick are now women.,"{'neg': 0.304, 'neu': 0.512, 'pos': 0.184, 'compound': -0.5423}"
11,2021-12-10 17:59:55+00:00,"RT For me covid it's like a Vampire movie, they (vampires) exist on  TV but in reality they don't, same as covid...","{'neg': 0.0, 'neu': 0.923, 'pos': 0.077, 'compound': 0.1901}"
12,2021-12-10 17:59:55+00:00,Hopefully COVID-free.,"{'neg': 0.0, 'neu': 0.27, 'pos': 0.73, 'compound': 0.4019}"
13,2021-12-10 17:59:55+00:00,"RT Vaccine, you don't want
Testing, you don't want
Lockdown, you don't want

What is it that you ppl want?","{'neg': 0.175, 'neu': 0.763, 'pos': 0.062, 'compound': -0.0941}"
14,2021-12-10 17:59:55+00:00,THEY are panicking  over a more mild variant. ,"{'neg': 0.293, 'neu': 0.707, 'pos': 0.0, 'compound': -0.4404}"
15,2021-12-10 17:59:55+00:00,"Point still stands though. If you want to get a booster you can. I agree its harder than it needs to be, but you could legit be walking past a vaccine centre and just pop in. As long as the timeframe fits they'll give you it","{'neg': 0.0, 'neu': 0.938, 'pos': 0.062, 'compound': 0.2263}"
16,2021-12-10 17:59:55+00:00,Stop talking about covid it's being spread u r dopes and murderers,"{'neg': 0.394, 'neu': 0.606, 'pos': 0.0, 'compound': -0.7579}"
17,2021-12-10 17:59:55+00:00,RT This is worrying.,"{'neg': 0.444, 'neu': 0.556, 'pos': 0.0, 'compound': -0.34}"
18,2021-12-10 17:59:55+00:00,"Pre covid!!!
#YR #teriah","{'neg': 0.0, 'neu': 1.0, 'pos': 0.0, 'compound': 0.0}"
19,2021-12-10 17:59:55+00:00,"With rising flu cases in Pennsylvania, make sure to get your flu shot!","{'neg': 0.309, 'neu': 0.562, 'pos': 0.129, 'compound': -0.4926}"
20,2021-12-10 17:59:55+00:00,RT We are repeatedly told that we are in a DEADLY PANDEMIC and that restrictions and loss of human rights are for our own go...,"{'neg': 0.087, 'neu': 0.913, 'pos': 0.0, 'compound': -0.3182}"
21,2021-12-10 17:59:55+00:00,I'm tired of Covid ok lol ,"{'neg': 0.266, 'neu': 0.275, 'pos': 0.459, 'compound': 0.2732}"
22,2021-12-10 17:59:55+00:00,RT My brother's triple-jabbed - the third one was Pfizer 3-4 wks ago. He's just got covid &amp; feels 'rough' &amp; is isolating. H...,"{'neg': 0.0, 'neu': 1.0, 'pos': 0.0, 'compound': 0.0}"
23,2021-12-10 17:59:55+00:00,Truth!,"{'neg': 0.0, 'neu': 0.0, 'pos': 1.0, 'compound': 0.3802}"
24,2021-12-10 17:59:55+00:00,Clusterfuckery. Love it ,"{'neg': 0.0, 'neu': 0.323, 'pos': 0.677, 'compound': 0.6369}"
25,2021-12-10 17:59:55+00:00,"RT If the COVID cases don't spike, they'll say it's because of the restrictions they imposed.

If they do spike, they'll say...","{'neg': 0.058, 'neu': 0.942, 'pos': 0.0, 'compound': -0.0772}"
26,2021-12-10 17:59:55+00:00,RT These people are still dying because they believe the lies ,"{'neg': 0.219, 'neu': 0.781, 'pos': 0.0, 'compound': -0.4215}"
27,2021-12-10 17:59:56+00:00,"Today, Dec 10 is day 37 of tyranny where a person in LA can't go to a theater to watch a movie, eat in a restaurant, go to a gym or get a haircut without revealing their medical condition. LA mandates all customers of these businesses be vaxxed #VaxMandates #Covid #GovtOverreach","{'neg': 0.0, 'neu': 1.0, 'pos': 0.0, 'compound': 0.0}"
28,2021-12-10 17:59:56+00:00,RT #BrainStimConf #brainstim How did the pandemic change TMS outcomes in a TRD clinic? Visit my poster and learn about changi...,"{'neg': 0.0, 'neu': 1.0, 'pos': 0.0, 'compound': 0.0}"
29,2021-12-10 17:59:56+00:00,"RT There's that one uncle that volunteers to stay by the grill during most family parties, cookouts and BBQ's. He inhales a...","{'neg': 0.0, 'neu': 0.876, 'pos': 0.124, 'compound': 0.4549}"
30,2021-12-10 17:59:56+00:00,RT I feel like if HILLARY hadn't been railroaded &amp; she would've been PRESIDENT we wouldn't be in this ECONOMY MESS!BIDEN see...,"{'neg': 0.0, 'neu': 0.883, 'pos': 0.117, 'compound': 0.4199}"
31,2021-12-10 17:59:56+00:00,"RT It's here, at vaccine clinics, that we'll finish the fight against COVID-19. To all of the kids and parents who were at...","{'neg': 0.106, 'neu': 0.894, 'pos': 0.0, 'compound': -0.3818}"
32,2021-12-10 17:59:56+00:00,RT My brother's triple-jabbed - the third one was Pfizer 3-4 wks ago. He's just got covid &amp; feels 'rough' &amp; is isolating. H...,"{'neg': 0.0, 'neu': 1.0, 'pos': 0.0, 'compound': 0.0}"
33,2021-12-10 17:59:56+00:00,And yet they still bring in vaccine passports its madness,"{'neg': 0.244, 'neu': 0.756, 'pos': 0.0, 'compound': -0.4404}"
34,2021-12-10 17:59:56+00:00,"Made two transfers in my FPL this week, both of them are missing due to COVID. Tears","{'neg': 0.215, 'neu': 0.785, 'pos': 0.0, 'compound': -0.4767}"
35,2021-12-10 17:59:56+00:00,"RT With all the talk about getting vaccinated for Covid (which is really important), dont forget your flu shot. Unfortunately,...","{'neg': 0.098, 'neu': 0.65, 'pos': 0.252, 'compound': 0.4228}"
36,2021-12-10 17:59:56+00:00,"RT If the COVID cases don't spike, they'll say it's because of the restrictions they imposed.

If they do spike, they'll say...","{'neg': 0.058, 'neu': 0.942, 'pos': 0.0, 'compound': -0.0772}"
37,2021-12-10 17:59:56+00:00,"I am a Totnes constituent. Rates in Devon are extremely high, and Omicron doubling rate is likely to be every 2 days. How can you defend this position? What measures will you be recommending to keep us safe, and our NHS able to respond to emergencies? Totally reprehensible.","{'neg': 0.0, 'neu': 0.935, 'pos': 0.065, 'compound': 0.504}"
38,2021-12-10 17:59:56+00:00,Ee rra we are home ,"{'neg': 0.0, 'neu': 1.0, 'pos': 0.0, 'compound': 0.0}"
39,2021-12-10 17:59:56+00:00,"Now that the ""Spider-Man : No Way Home"" is round the corner for a WW release, Which is I'm totally hyped for, Wondering that, Whether this movie will top Raimi's  ""Spider-man 2"" in my list, or is it gonna stay the best spiderman film like it used to. Welp, I say bring it on...","{'neg': 0.036, 'neu': 0.824, 'pos': 0.14, 'compound': 0.743}"
40,2021-12-10 17:59:56+00:00,RT Remember the concern previously when the R number went above 1? Current estimated R for Omicron in the U.K. is 3.3-4.2....,"{'neg': 0.0, 'neu': 0.942, 'pos': 0.058, 'compound': 0.0772}"
41,2021-12-10 17:59:56+00:00,RT I don't think so. I don't know who is worse...Eric Schmitt or Mike Parson. Neither one of them care...,"{'neg': 0.0, 'neu': 0.856, 'pos': 0.144, 'compound': 0.4939}"
42,2021-12-10 17:59:56+00:00,"I agree with his first statement, but not the second one. #AbolishVaccineMandates #COVID19 #CovidVaccines #coronavirus #DefiantLs","{'neg': 0.0, 'neu': 0.896, 'pos': 0.104, 'compound': 0.1901}"
43,2021-12-10 17:59:56+00:00,"RT It's happening.

A court in Belgium ruled that the covid passports were illegal.","{'neg': 0.217, 'neu': 0.783, 'pos': 0.0, 'compound': -0.5574}"
44,2021-12-10 17:59:56+00:00,"RT Covid does not get an address book every time it infects someone, with certain names circled in red and marked ""do not t...","{'neg': 0.0, 'neu': 0.916, 'pos': 0.084, 'compound': 0.2732}"
45,2021-12-10 17:59:56+00:00,"As long they keep coming Arizona COVID will never fall

45% of the people crossing our border are COVID positive or have unknown symptoms of COVID","{'neg': 0.0, 'neu': 0.874, 'pos': 0.126, 'compound': 0.5574}"
46,2021-12-10 17:59:56+00:00,"Omicron has been mild so far, and mostly found in the vaccinated from all reports I have seen. In economic terms that is great, because if it causes economic decline coupled with our record high inflation we would have Stagnation.","{'neg': 0.0, 'neu': 0.905, 'pos': 0.095, 'compound': 0.6249}"
47,2021-12-10 17:59:56+00:00,"RT As yet the science isn't in, so we don't know if the govt are  scaremongering or not. If they're not, why are children go...","{'neg': 0.0, 'neu': 1.0, 'pos': 0.0, 'compound': 0.0}"
48,2021-12-10 17:59:56+00:00,"""I don't believe that COVID is a big deal, therefore it is a violation of my conscience to obey government mandates."" This was not a layperson. It was a pastor.","{'neg': 0.099, 'neu': 0.901, 'pos': 0.0, 'compound': -0.4939}"
49,2021-12-10 17:59:56+00:00,"RT I don't know who could have seen this coming, but the CEO of Pfizer is now saying that people might now need FOUR Covid shots i...","{'neg': 0.0, 'neu': 1.0, 'pos': 0.0, 'compound': 0.0}"
50,2021-12-10 17:59:56+00:00,This is horrific.,"{'neg': 0.688, 'neu': 0.312, 'pos': 0.0, 'compound': -0.6597}"
51,2021-12-10 17:59:56+00:00,RT Kutti is meantime using her Instagram platform to discourage Black people from getting covid vaccinatio...,"{'neg': 0.157, 'neu': 0.843, 'pos': 0.0, 'compound': -0.4215}"
52,2021-12-10 17:59:56+00:00,"You will be vaccinated upon arrival in Ghana. 

clown shit","{'neg': 0.286, 'neu': 0.714, 'pos': 0.0, 'compound': -0.5574}"
53,2021-12-10 17:59:56+00:00,RT Omicron is projected to become the dominant variant in the UK by mid-December ,"{'neg': 0.0, 'neu': 1.0, 'pos': 0.0, 'compound': 0.0}"
54,2021-12-10 17:59:56+00:00,"The main point of the Q4 code will be to make sure people get their 3rd, 4th and 5th doses. To reduce cases they would need to close schools and return to lockdown but that is not politically popular. Europe and Israel is a preview of what is coming here next month.","{'neg': 0.055, 'neu': 0.915, 'pos': 0.03, 'compound': -0.3287}"
55,2021-12-10 17:59:56+00:00,"I have five neighbours who have all had the covid vaccine yet all have had blood clots, some straight away &amp;  others 6 to 8 months later. Found to be by vaccines.","{'neg': 0.0, 'neu': 0.942, 'pos': 0.058, 'compound': 0.2263}"
56,2021-12-10 17:59:56+00:00,RT Disgusting. Profiting off a pandemic. #BoycottShoppersDrugMart #ShoppersDougMart,"{'neg': 0.283, 'neu': 0.5, 'pos': 0.217, 'compound': -0.2023}"
57,2021-12-10 17:59:57+00:00,"RT Don't miss this powerful interview with talking about his new lawsuit vs #Pelosi #January6th Cmte, responding t...","{'neg': 0.088, 'neu': 0.695, 'pos': 0.217, 'compound': 0.4203}"
58,2021-12-10 17:59:57+00:00,RT Letitia Wright will go down in history as one of the all-time greatest bag fumblers.,"{'neg': 0.0, 'neu': 0.781, 'pos': 0.219, 'compound': 0.6369}"
59,2021-12-10 17:59:57+00:00,"From what scientist are saying omicron is good news as it's basically killing covid 19 or Delta , basically it's replacing it for a virus that's not even as severe as a cold. What's all the panic about this is good news. No ones died of this. No more jabs for the sheep","{'neg': 0.178, 'neu': 0.662, 'pos': 0.16, 'compound': -0.2942}"
60,2021-12-10 17:59:57+00:00,"We're heading to 24 months /104 weeks since  Covid 19  spread. The message 'test, test, test, trace' is still in vogue but we're disconnected with safe measures in education.  I'm almost in mourning for children &amp; families. Long covid affects pupils extent of DAMAGE UNKNOWN","{'neg': 0.162, 'neu': 0.768, 'pos': 0.07, 'compound': -0.7168}"
61,2021-12-10 17:59:57+00:00,"RT I'm an E.R. Doctor in Michigan, Where Unvaccinated People Are Filling Hospital Beds 

Losing a...","{'neg': 0.148, 'neu': 0.852, 'pos': 0.0, 'compound': -0.3818}"
62,2021-12-10 17:59:57+00:00,"RT Grinding some ranked. Covid is getting the best of me...
#apexlegends
#smallstreamersconnect
#supportsmallstreamers
#gami...","{'neg': 0.0, 'neu': 0.769, 'pos': 0.231, 'compound': 0.6369}"
63,2021-12-10 17:59:57+00:00,"RT Thursday just in: +1.70M doses reported admin over yesterday's total, including 381K newly vaccinated and 1M boosters....","{'neg': 0.0, 'neu': 1.0, 'pos': 0.0, 'compound': 0.0}"
64,2021-12-10 17:59:57+00:00,"It's not true though
https://t.co/fy8drkrBpw","{'neg': 0.368, 'neu': 0.632, 'pos': 0.0, 'compound': -0.3252}"
65,2021-12-10 17:59:57+00:00,"An Audio Statement in English, titled:
To Non-Arabs and Arabs... The Planet of Torment Has Approached
Imam Mahdi Nasser Mohammad Al-Yamani
08 - Rabi Awwal - 1443 AH
14 - October - 2021 AD
08:58 am
https://t.co/JxFWHQMHtw
7
#They_Say_A_Shelter_Is_Needed
 Omicron
Q19I8B","{'neg': 0.0, 'neu': 1.0, 'pos': 0.0, 'compound': 0.0}"
66,2021-12-10 17:59:57+00:00,"The dictator is foaming at the mouth, she cannot wait to lock down!","{'neg': 0.0, 'neu': 1.0, 'pos': 0.0, 'compound': 0.0}"
67,2021-12-10 17:59:57+00:00,"RT There's an outbreak of an ""unknown respiratory illness"" in my 96-year old grandfather's retirement home so they're implem...","{'neg': 0.13, 'neu': 0.87, 'pos': 0.0, 'compound': -0.4019}"
68,2021-12-10 17:59:57+00:00,"1251 deaths reported in USA  on Dec 9,2021
1 in 5 deaths are in USA  #COVID19
#covidisairborne","{'neg': 0.0, 'neu': 1.0, 'pos': 0.0, 'compound': 0.0}"
69,2021-12-10 17:59:57+00:00,Akeela to replace her,"{'neg': 0.0, 'neu': 1.0, 'pos': 0.0, 'compound': 0.0}"
70,2021-12-10 17:59:57+00:00,RT So wearing a piece of cloth over your face during a raging pandemic is government overreach but FORCING a woman to car...,"{'neg': 0.091, 'neu': 0.909, 'pos': 0.0, 'compound': -0.296}"
71,2021-12-10 17:59:57+00:00,"RT ""In a pandemic that has so far killed 146,000 of the Britons who these people are supposed to be in politics to serve,...","{'neg': 0.172, 'neu': 0.828, 'pos': 0.0, 'compound': -0.6983}"
72,2021-12-10 17:59:57+00:00,RT I don't think making kids wear masks inside at school is child abuse but I do think making your kid do this might be.,"{'neg': 0.098, 'neu': 0.902, 'pos': 0.0, 'compound': -0.3818}"
73,2021-12-10 17:59:57+00:00,"RT NEW: Omicron Variant report from UKHSA

Technical Briefing 31 - Omicron Variant (VOC-21NOV-01)","{'neg': 0.0, 'neu': 1.0, 'pos': 0.0, 'compound': 0.0}"
74,2021-12-10 17:59:57+00:00,RT Asking students to leave a residential environment where they're surrounded by other young people to return to homes with old...,"{'neg': 0.057, 'neu': 0.943, 'pos': 0.0, 'compound': -0.0516}"
75,2021-12-10 17:59:57+00:00,"RT For anyone in the media who thinks it's bad we're going after this government for trivial stuff like parties, remember th...","{'neg': 0.165, 'neu': 0.647, 'pos': 0.187, 'compound': 0.1531}"
76,2021-12-10 17:59:57+00:00,RT Doubling time shorter than 3 days. What are we waiting for?,"{'neg': 0.0, 'neu': 1.0, 'pos': 0.0, 'compound': 0.0}"
77,2021-12-10 17:59:58+00:00,"#CBJ fans, send well wishes to Hedge! this is definitely not how i envisioned my first NHL road trip would play out, but i'm super excited for the opportunity and to see places i've never been before. hit me with your seattle/vancouver/edmonton/calgary recs ","{'neg': 0.0, 'neu': 0.656, 'pos': 0.344, 'compound': 0.9505}"
78,2021-12-10 17:59:58+00:00,"And these days, realistic people stay home alone.","{'neg': 0.222, 'neu': 0.778, 'pos': 0.0, 'compound': -0.25}"
79,2021-12-10 17:59:58+00:00,"November up .9%. Liar.

Corporate profits rise to higher than EVER.

In a pandemic.

You cannot possibly believe in hell.","{'neg': 0.284, 'neu': 0.612, 'pos': 0.104, 'compound': -0.7184}"
80,2021-12-10 17:59:58+00:00,RT You're telling me that beautiful women who play valorant from all over the world are gonna be in ONE place ,"{'neg': 0.0, 'neu': 0.751, 'pos': 0.249, 'compound': 0.743}"
81,2021-12-10 17:59:58+00:00,"This well polished DARPA/US Biodefense Clique ""clarity"" is not something UK politicians will fall for.

Because they have no skin in the ill fated US global virus ""collection"" program run by DTRA, DARPA, USAID &amp; cut-outs like EHA, Metabiota, UCD which was exposed by the pandemic.","{'neg': 0.118, 'neu': 0.746, 'pos': 0.136, 'compound': 0.25}"
82,2021-12-10 17:59:58+00:00,RT Just inform the patron of the establishment that they can have your vaccine status or your money. But  they...,"{'neg': 0.0, 'neu': 1.0, 'pos': 0.0, 'compound': 0.0}"
83,2021-12-10 17:59:58+00:00,"RT From tomorrow in Scotland, you will have to self-isolate if you've been in contact with a Covid case, regardless of vaccinat...","{'neg': 0.0, 'neu': 1.0, 'pos': 0.0, 'compound': 0.0}"
84,2021-12-10 17:59:58+00:00,"RT And so Omicron would have to be very much milder than Delta, in order to avoid an increase in hospitalisations and deaths....","{'neg': 0.086, 'neu': 0.824, 'pos': 0.09, 'compound': 0.0258}"
85,2021-12-10 17:59:58+00:00,"RT It's happening.

A court in Belgium ruled that the covid passports were illegal.","{'neg': 0.217, 'neu': 0.783, 'pos': 0.0, 'compound': -0.5574}"
86,2021-12-10 17:59:58+00:00,RT Letitia Wright will go down in history as one of the all-time greatest bag fumblers.,"{'neg': 0.0, 'neu': 0.781, 'pos': 0.219, 'compound': 0.6369}"
87,2021-12-10 17:59:58+00:00,"RT Aisha Nanono, a Women Leader in Bugolobi Market, shall star as a Panelist at the upcoming Digital &amp; Financial In...","{'neg': 0.0, 'neu': 1.0, 'pos': 0.0, 'compound': 0.0}"
88,2021-12-10 17:59:58+00:00,RT  We are expecting to issue proceedings against the Met in relation to its refusal to investigate the parties at Number...,"{'neg': 0.0, 'neu': 0.826, 'pos': 0.174, 'compound': 0.4588}"
89,2021-12-10 17:59:58+00:00,RT Add me to the list.,"{'neg': 0.0, 'neu': 1.0, 'pos': 0.0, 'compound': 0.0}"
90,2021-12-10 17:59:58+00:00,"RT The Omnicron variant, first identified in Santry.","{'neg': 0.0, 'neu': 1.0, 'pos': 0.0, 'compound': 0.0}"
91,2021-12-10 17:59:58+00:00,"RT NEW: Omicron Variant report from UKHSA

Technical Briefing 31 - Omicron Variant (VOC-21NOV-01)","{'neg': 0.0, 'neu': 1.0, 'pos': 0.0, 'compound': 0.0}"
92,2021-12-10 17:59:58+00:00,will you be joining ? anybody with an ounce of integrity honestly intelligence cannot remain at BBC Propaganda Ministry.,"{'neg': 0.078, 'neu': 0.584, 'pos': 0.339, 'compound': 0.7717}"
93,2021-12-10 17:59:58+00:00,"Today MSDH is reporting 445 more cases of COVID-19 in Mississippi, nine deaths, and 37 ongoing outbreaks in long-term care facilities. State #covid19 totals: 519,115 cases, 10,326 deaths, and 1,427,368 persons fully vaccinated. Full information:","{'neg': 0.0, 'neu': 0.914, 'pos': 0.086, 'compound': 0.4939}"
94,2021-12-10 17:59:58+00:00,"RT Covid is a VIRUS. It doesn't love anyone, not even itself. It doesn't want. It's a little biological machine and it does...","{'neg': 0.179, 'neu': 0.821, 'pos': 0.0, 'compound': -0.5559}"
95,2021-12-10 17:59:58+00:00,"Not everything - remember 5G causing covid? Trust me mate, I know it's been a hard last couple of years but please do not get stuck in this rabbit hole - there is no global reset or elite conspiracy. Please open your eyes. It's another 2012 Mayan world ending conspiracy.","{'neg': 0.202, 'neu': 0.643, 'pos': 0.155, 'compound': -0.6174}"
96,2021-12-10 17:59:58+00:00,"RT Uttar Pradesh population: 231 million inhabitants; C19 active cases: 134!  Guys, this is 0.000058% of the population! Could...","{'neg': 0.0, 'neu': 0.846, 'pos': 0.154, 'compound': 0.508}"
97,2021-12-10 17:59:58+00:00,"RT It's happening.

A court in Belgium ruled that the covid passports were illegal.","{'neg': 0.217, 'neu': 0.783, 'pos': 0.0, 'compound': -0.5574}"
98,2021-12-10 17:59:58+00:00,RT New York governor orders masks indoors for businesses without COVID-19 vaccine requirement,"{'neg': 0.0, 'neu': 1.0, 'pos': 0.0, 'compound': 0.0}"
99,2021-12-10 17:59:58+00:00,Australia: maybe if we just lock down a little harder we will have zero COVID.,"{'neg': 0.0, 'neu': 1.0, 'pos': 0.0, 'compound': 0.0}"
100,2021-12-10 17:59:58+00:00,"RT Covid doesn't spread for the 40 hours a week you spend with everyone at work but as soon as you have a party with them,...","{'neg': 0.0, 'neu': 0.876, 'pos': 0.124, 'compound': 0.5499}"
101,2021-12-10 17:59:59+00:00,RT Vaccine passports to go clubbing ? Yh I'll club at home,"{'neg': 0.0, 'neu': 1.0, 'pos': 0.0, 'compound': 0.0}"
102,2021-12-10 17:59:59+00:00,RT Local Michigan Republican official who refused to certify Biden's win in his county and who vehemently opposed vaccines...,"{'neg': 0.096, 'neu': 0.739, 'pos': 0.165, 'compound': 0.3818}"
103,2021-12-10 17:59:59+00:00,"So Michael, what kind of cookies are you going to bake next?","{'neg': 0.0, 'neu': 1.0, 'pos': 0.0, 'compound': 0.0}"
104,2021-12-10 17:59:59+00:00,"RT Had a 6 y/o come in to the 5-11 vaccine clinic, tear his shirt off, sit down, look at the RN, and say ""do it"". Pretty bad as...","{'neg': 0.104, 'neu': 0.801, 'pos': 0.095, 'compound': -0.0772}"
105,2021-12-10 17:59:59+00:00,"RT What if the greatest acts of evil are committed by ordinary people?

PREMIERING tonight, 8:00 EST:

LOCKDOWN: The Line Dividi...","{'neg': 0.153, 'neu': 0.627, 'pos': 0.22, 'compound': 0.2263}"
106,2021-12-10 17:59:59+00:00,RT Details on Letitia Wright Allegedly Done With MCU and Black Panther: Wakanda Forever Because of Vaccine Mandates (Video),"{'neg': 0.0, 'neu': 1.0, 'pos': 0.0, 'compound': 0.0}"
107,2021-12-10 17:59:59+00:00,"RT Covid proved this beyond doubt:

""Some ideas are so stupid that only intellectuals believe them.""
--George Orwell","{'neg': 0.281, 'neu': 0.613, 'pos': 0.106, 'compound': -0.6447}"
108,2021-12-10 17:59:59+00:00,Took my stupid vaccine yesterday and now my arm is killing me ,"{'neg': 0.438, 'neu': 0.562, 'pos': 0.0, 'compound': -0.8316}"
109,2021-12-10 17:59:59+00:00,"I don't care if you don't want to take the vaccine, but stop complaining about consequences. You made your choice, so deal with it. You can't refuse to follow rules then get online and cry about the repercussions. Start your own business or find a better suited job.","{'neg': 0.204, 'neu': 0.692, 'pos': 0.104, 'compound': -0.5984}"
110,2021-12-10 17:59:59+00:00,"RT If the COVID cases don't spike, they'll say it's because of the restrictions they imposed.

If they do spike, they'll say...","{'neg': 0.058, 'neu': 0.942, 'pos': 0.0, 'compound': -0.0772}"
111,2021-12-10 17:59:59+00:00,"Two doses of Covid vaccines don't give adequate levels of protection against the Omicron variant.
But booster doses 'significantly' increase protection - scientists advise maximising coverage of 3rd doses. 
https://t.co/curq6wikeb","{'neg': 0.041, 'neu': 0.867, 'pos': 0.091, 'compound': 0.3853}"
112,2021-12-10 17:59:59+00:00,"RT World Health Organization: 

""Preliminary data indicates hospitalizations in South Africa remain Low &amp; emerging data indicates...","{'neg': 0.116, 'neu': 0.884, 'pos': 0.0, 'compound': -0.2732}"
113,2021-12-10 17:59:59+00:00,It's been a while since we've had a proper Tory Civil War,"{'neg': 0.262, 'neu': 0.738, 'pos': 0.0, 'compound': -0.5994}"
114,2021-12-10 17:59:59+00:00,RT That's odd. Members of Congress are on a NO DAY workweek.,"{'neg': 0.344, 'neu': 0.656, 'pos': 0.0, 'compound': -0.6408}"
115,2021-12-10 17:59:59+00:00,"#NOWPLAYING : 
Rezz, Grabbitz, PEEKABOO - Someone Else - PEEKABOO Remix  

LISTEN HERE    

#quoradio #qcradio #hiphop #rnb #pop #rock #top40 #radio #eclectic #onlineradio #listen #listening #hhm #QuarantineLife #trap #internetradio","{'neg': 0.076, 'neu': 0.924, 'pos': 0.0, 'compound': -0.3182}"
116,2021-12-10 17:59:59+00:00,"RT CBC about Ontario: ""The government is dropping its tentative plan to end the provincial vaccine passport program in mi...","{'neg': 0.0, 'neu': 1.0, 'pos': 0.0, 'compound': 0.0}"
117,2021-12-10 17:59:59+00:00,I will never talk to you again for being such a big weirdo,"{'neg': 0.189, 'neu': 0.811, 'pos': 0.0, 'compound': -0.4215}"
118,2021-12-10 17:59:59+00:00,"RT Over 58k new cases just reported - the highest number since early Jan.

Please:

 Wear a mask
 Open windows 
 Minimis...","{'neg': 0.0, 'neu': 0.841, 'pos': 0.159, 'compound': 0.3818}"
119,2021-12-10 17:59:59+00:00,"RT ""One shouldn't be afraid of the truth.
One should be afraid of people who gloss over the situation and sweep it under the c...","{'neg': 0.0, 'neu': 0.913, 'pos': 0.087, 'compound': 0.3182}"
