,created_at,full_text,sentiment_score
0,2020-11-11 09:59:55+00:00,cdc new guideline issue everyone adopt mask wear policy we would significantly reduce trumpvirus infecti,0.2556818181818182
1,2020-11-11 09:59:55+00:00,mankind virus,0.0
2,2020-11-11 09:59:55+00:00,indias vaccination manufacturing distribution supply chain source clsa,0.0
3,2020-11-11 09:59:55+00:00,what s keep suhana khan busy lockdown photoshoot course,0.1
4,2020-11-11 09:59:55+00:00,i d prefer honestly,0.6
5,2020-11-11 09:59:55+00:00,sure would survive lockdown without dog fluffy ball unconditional love amp endless cuddle,0.16875
6,2020-11-11 09:59:55+00:00,medium elect president sleepy fraud realdonaldtrump come russia interference wonterrorism,0.8
7,2020-11-11 09:59:55+00:00,lockdown amp festive season fast approach important ever brand present world thoughtsmarkete billboard outdooradvertise,0.20000000000000004
8,2020-11-11 09:59:55+00:00,covid suck bro,0.0
9,2020-11-11 09:59:55+00:00,anyone miss minidoc brand survive keepbusyprod,0.0
10,2020-11-11 09:59:55+00:00,wear ur mask ppl smh,0.0
11,2020-11-11 09:59:55+00:00,please trump supporter plan march street block highway across us securitywarrior spend day report violent threat relate march many armed amp want confrontation stayhome staysafe,-0.15000000000000002
12,2020-11-11 09:59:55+00:00,can not cut something have not exist month,0.0
13,2020-11-11 09:59:56+00:00,pandemic be not,0.0
14,2020-11-11 09:59:56+00:00,deputy chief medical officer jonathan vantam lead new downing street coronavirus data briefing follow liv,0.06818181818181818
15,2020-11-11 09:59:56+00:00,one look guy profile agent I m sure source would want listen much here layman description mrna new type vaccine,0.27878787878787875
16,2020-11-11 09:59:56+00:00,yesterday pfizer announce initial result phase vaccine trial effectiveness r,0.0
17,2020-11-11 09:59:56+00:00,socialdistancing year choir perform ivowtotheemycountry appropriate choice remembrancesunday footage film recent government advice singing school,0.25
18,2020-11-11 09:59:56+00:00,I m midwife currently work I m qualified administer I m injection I m happy volunteer administer covid vaccine set might go start randomly email gp surgery vaccination,0.10000000000000002
19,2020-11-11 09:59:56+00:00,happy birthday soph hope you re good day lockdown,0.75
20,2020-11-11 09:59:56+00:00,grass root team age powys play fixture since first lockdown march,0.25
21,2020-11-11 09:59:56+00:00,spot pandemicswedish allcause mortality extremely low per capita take,0.0
22,2020-11-11 09:59:56+00:00,change urban transportplanne region new objective process p,0.04545454545454545
23,2020-11-11 09:59:56+00:00,monkey run zoo government consider change anticovid tier system via,-0.05
24,2020-11-11 09:59:56+00:00,linux use spare lockdown time learn kali linux hackingtestdrive kali os undercover mode pc tablet kali os notebook,0.0
25,2020-11-11 09:59:56+00:00,launch new business grant scheme support business affect second covid lockdown,0.06818181818181818
26,2020-11-11 09:59:56+00:00,china use rest world preoccupation huge health economic amp social problem cause covid virus clamp long value personal liberty hong kong warn se asian nation true nature ccp dragon australia beware,0.13333333333333333
27,2020-11-11 09:59:56+00:00,way bicol deal bad severe tropical storm category typhoon world strong,-0.13333333333333328
28,2020-11-11 09:59:57+00:00,believe strong country work together solve problem healt,0.4333333333333333
29,2020-11-11 09:59:57+00:00,chloroxylenol also know parachlorometaxylenol pcmx active ingredient kill covid surface stop spread human consume ingest,-0.06666666666666667
30,2020-11-11 09:59:57+00:00,disturb story tonight cbc edmonton think could not would not happen tragica,0.0
31,2020-11-11 09:59:57+00:00,join we tuesday november facebook live premiere thedebunkshowthis fact check show exclusi,0.13636363636363635
32,2020-11-11 09:59:57+00:00,watch live coronavirus datum briefing november speakers prof jonathan vantam deputy chief medical,0.06818181818181818
33,2020-11-11 09:59:57+00:00,really proud know incredibly nervous do not get full story across,0.6833333333333335
34,2020-11-11 09:59:57+00:00,look forward work new administration leader side congress get surge pandemic,0.13636363636363635
35,2020-11-11 09:59:57+00:00,mongolia record first local coronavirus transmission,0.125
36,2020-11-11 09:59:57+00:00,covidsafe app keep covid free coronavirus covidsafeapp,0.4
37,2020-11-11 09:59:57+00:00,disgrace epidemic corruption,0.0
38,2020-11-11 09:59:57+00:00,multan positivity rate november high city country,0.16
39,2020-11-11 09:59:57+00:00,I m guess answer give contract tory donor assure we binbag topquality,0.0
40,2020-11-11 09:59:57+00:00,today remember nurse lose life due war conflict also remember nur,-0.125
41,2020-11-11 09:59:57+00:00,headline get start morning carroll county courthouse close due exposure boiler,-0.125
42,2020-11-11 09:59:57+00:00,cho daily,0.0
43,2020-11-11 09:59:57+00:00,university college across pakistan esp coronavirus hotspot like lahore amp karachi hundred cas,0.0
44,2020-11-11 09:59:58+00:00,come almost constituent already dead unfortunately we little people covid,-0.19375
45,2020-11-11 09:59:58+00:00,you all love amp you ve follow awhile know nursedriven anxiety radar week ahead,0.5
46,2020-11-11 09:59:58+00:00,travel dubai thomascookindia make arrangement get covid test dubai return back india click link book dubaitourism vacation travel holiday visitdubai diwali,0.0
47,2020-11-11 09:59:58+00:00,watch live coronavirus datum briefing november speakers prof jonathan vantam deputy chief medical,0.06818181818181818
48,2020-11-11 09:59:58+00:00,thank billywe be not get lockdown blue,0.0
49,2020-11-11 09:59:58+00:00,dr bannons blog flu jab year yes good idea,0.7
50,2020-11-11 09:59:58+00:00,week ago bad boy ask international community mind business he s beg vacci,-0.3499999999999999
51,2020-11-11 09:59:58+00:00,husbandandwife team behind lead vaccine solve,-0.4
52,2020-11-11 09:59:58+00:00,trump want us streetsi beg stay home,0.0
53,2020-11-11 09:59:58+00:00,can not cut something have not exist month,0.0
54,2020-11-11 09:59:59+00:00,instant viewrussia say sputnik v vaccine effective,0.3
55,2020-11-11 09:59:59+00:00,reason pick copy guardian wednesdayborderclosure dangote videooftheday vi,0.0
56,2020-11-11 09:59:59+00:00,partner amp discover lesson learn apply cyber risk modeling understanding pandemic model evolve insurance datafind,0.0
57,2020-11-11 09:59:59+00:00,paris enter fresh lockdown oct see nonessential store shutter second time seven month ht,0.15
58,2020-11-11 09:59:59+00:00,year old age group achieve dramatic reduction incidence per per,-0.16666666666666663
59,2020-11-11 09:59:59+00:00,can not cut something have not exist month,0.0
60,2020-11-11 09:59:59+00:00,good hear carehome resident england receive visit covidsecure way visitingpod,0.7
61,2020-11-11 09:59:59+00:00,try apply job pandemic,0.0
62,2020-11-11 09:59:59+00:00,pandemic long I ve get amp shape time,-0.05
63,2020-11-11 09:59:59+00:00,be not new zealand suffer third outbreak,-0.03409090909090909
64,2020-11-11 09:59:59+00:00,I m guess answer give contract tory donor assure we binbag topquality,0.0
65,2020-11-11 09:59:59+00:00,coronaviruswe know operate special circumstance ec need job dr lawrencia agyepong head communications department gijasaasebreakfastshow,0.35714285714285715
66,2020-11-11 09:59:59+00:00,republican govs charlie baker massachusetts larry hogan maryland separately criticize president trump stalling,0.0
67,2020-11-11 09:59:59+00:00,force many company sublease office space cre sublease office tenanttip,0.5
68,2020-11-11 09:59:59+00:00,book fabulous christmas show sit dec celebrate christmas style we heaven secure booking guarantee show cancel due govt restriction full refund issue,0.25625
69,2020-11-11 09:59:59+00:00,half trump supporter still believe covid plandemic,-0.16666666666666666
70,2020-11-11 09:59:59+00:00,needtoknow premium recommerce storytelling side advertising internship baby boomer pandemic inspire product exploration,0.0
71,2020-11-11 09:59:59+00:00,us election biden say deny result help trump legacy live update,0.13636363636363635
72,2020-11-11 10:00:00+00:00,cambridgebase biobot test wastewater massachusetts water resource authority deer island look early indication rise coronavirus case,0.1
73,2020-11-11 10:00:00+00:00,people,0.0
74,2020-11-11 10:00:00+00:00,even dark day people derbyshire forget indeed never forget brave people give life,0.325
75,2020-11-11 10:00:00+00:00,global pandemic put pressure food supply chain citizendriven innovation offer radical solution need upcoming webinar nov turn people power inspiration join we part eathome,0.0
76,2020-11-11 10:00:00+00:00,bob shellard wedding anniversary come coronavirus social distancing restriction celebrate anniversary,0.03333333333333333
77,2020-11-11 10:00:00+00:00,conservative mps sign covid recovery groupit plan fight extension lockdown past dec,-0.25
78,2020-11-11 10:00:00+00:00,speaker announcement chief content officer moderate salttalk pandemic venture investment series tomorrow november est istregister partnership,0.0
79,2020-11-11 10:00:00+00:00,school peterborough close covid concern number choose home,0.0
80,2020-11-11 10:00:00+00:00,second lockdown uk might seem like totally scary situation do not partnership we ve produce series explainer video community language stay informed stay connect stay safe,0.0
81,2020-11-11 10:00:00+00:00,ravage countless livelihood entrepreneur gillian kobusingye sharon rutega kick start new venture diva taxi offer woman opportunity supplement income use vehicle ferry passenger feehttpstcorckyyzgsmm,0.06818181818181818
82,2020-11-11 10:00:00+00:00,record time ten month germanybase biotech company biontech us company pfizer develop vaccine coronavirushere two turk behind,-0.2
83,2020-11-11 10:00:00+00:00,sad hear lower nursepatient ratio icu nhs patientsafety compromise would happy work international study area child amp adult amp prof fiona coyer,0.1
84,2020-11-11 10:00:00+00:00,keep date library service,0.0
85,2020-11-11 10:00:00+00:00,great initiative deploy gigabit wireless communication fwa fast low cost fiber wire infrastructure significantly change nature business education healthcare public safety community submit hero,0.275
86,2020-11-11 10:00:00+00:00,bengal patient recover day another record covidbengal httpstcoutxxcgyddk,0.0
87,2020-11-11 10:00:00+00:00,american regardless political view help disruptive transition power,0.0
88,2020-11-11 10:00:00+00:00,domesticviolence make violence home frequent severe,0.1
89,2020-11-11 10:00:00+00:00,would sell kidney right good meal I ve life le gavroche lockdown prevent celebrate meal make,0.4928571428571428
90,2020-11-11 10:00:00+00:00,please see tph notice late information vehicle licensing,-0.3
91,2020-11-11 10:00:00+00:00,new glimerresearch blogthe quarantine ship experience practice isolate migrant amp donatella loprieno italian,0.06818181818181818
92,2020-11-11 10:00:00+00:00,many thousand volunteer deliver shopping prescription keep touch alone vulnerable else volunteer help make ahealthierwale,0.0
93,2020-11-11 10:00:00+00:00,stepstozerohunger get veggie garden cook healthy give yummy recipe neigbour cook participate community talk healthy future mariatu thousand family malawiirlembmalawi,0.3333333333333333
94,2020-11-11 10:00:00+00:00,srilaajiat special promotion price amp copy today see srilaaji really unforgettable protagonist romance wednesdaymotivation wednesdaywisdom woman lockdown,0.5785714285714286
95,2020-11-11 10:00:00+00:00,school peterborough close covid concern number choose home,0.0
96,2020-11-11 10:00:00+00:00,line rule royal british legion encourage people still take part moment remembrance observe minute silence doorstep today november armistice day mark year since end war,0.0
97,2020-11-11 10:00:00+00:00,testing date time add,0.0
98,2020-11-11 10:00:00+00:00,despite lockdown still come together honour service sacrifice serve armed force join us nation twominutesilence doorstep morning,0.0
99,2020-11-11 10:00:00+00:00,dubaibased mbc group operate television station say unlikely employee travel often pandemic end they ve prove do not need tohttpstcobneacfbggq,-0.5
100,2020-11-11 10:00:00+00:00,almost eight month suspension due pandemic suburban railway service resume operation,-0.0625
101,2020-11-11 10:00:00+00:00,new retrospective observational study find highintensity pharmacological thromboprophylaxis critically unwell patient may reduce thrombotic event without increase bleed,0.06818181818181818
102,2020-11-11 10:00:00+00:00,pupil must attend school symptom coronaviru arrange test high temperature new continuous cough losschange sense smelltastebook test tel,0.1481818181818182
103,2020-11-11 10:00:00+00:00,labuan verge recovery outbeak flatten curve last two day trend expect continue next,0.0
104,2020-11-11 10:00:00+00:00,make rule lockdownalicettimes absolutely money todaycoronavirusuk,0.2
105,2020-11-11 10:00:00+00:00,selfemployed amp receive pandemic unemployment paymentdidyouknow earn per month retain paymentall need keep record income future,0.0
106,2020-11-11 10:00:00+00:00,leadership lockdown date nov organiser pro developmentthis online session provide technique lead authentically amp compassionately mean leader team,-0.3125
107,2020-11-11 10:00:00+00:00,total nonsensethese health consequence unchecked spread covid,0.0
108,2020-11-11 10:00:00+00:00,effect eap sector research behalf baleap thank everyone put forward proposal httpstcovligrdnufkwatch space invitation take part drop soon tleap,0.0
109,2020-11-11 10:00:00+00:00,lockdown effect,0.0
110,2020-11-11 10:00:00+00:00,russia say sputnik v vaccine effective base check phase iii trial volunteer also dur,-0.10000000000000003
111,2020-11-11 10:00:00+00:00,interesting read learn high low pandemic,0.22
112,2020-11-11 10:00:00+00:00,covid case india cases test india bot,0.0
113,2020-11-11 10:00:00+00:00,another positive test hit ireland squad niall quinn give verdict international football,0.11363636363636363
114,2020-11-11 10:00:00+00:00,start discuss collective response coronavirus pandemic learn initiative create sustainable world join,0.0
115,2020-11-11 10:00:00+00:00,survey fiscal measure adopt country april consistent maintain status quo regard greenhouse gas emission reduce emission increase themwe need greenrecovery,0.25
116,2020-11-11 10:00:00+00:00,career trash pandemic can not afford separatevictoriaspratt speak couple force stay together,0.0
117,2020-11-11 10:00:01+00:00,write song lockdown entry song yorkshire open november songforyorkshire,0.0
118,2020-11-11 10:00:01+00:00,passionately believe people get stay active difficult winter help we cope despite restriction still run walk cycling outside work home free online tool find website,-0.056666666666666664
119,2020-11-11 10:00:01+00:00,eu commission biontech vaccine contract ready late news germany newsde stayathome vaccine pfizer biontech,-0.04999999999999999
120,2020-11-11 10:00:01+00:00,fundraising really could booklet help think new way bring supporter forefront pandemicread case study let mind flow,0.16818181818181818
121,2020-11-11 10:00:01+00:00,hk residents guangdong province macao allow return home everyday start nov need quarantine new scheme allow hk resident return city present negative test result gba,-0.09090909090909091
122,2020-11-11 10:00:01+00:00,would like hear haringey resident coronavirus pandemic impact amp community feedback help we develop right health amp care service go forward please complete survey,0.19285714285714284
123,2020-11-11 10:00:01+00:00,pandemic affect we many way never think incredibly impactful live future travel utilization ais will not,0.38409090909090904
124,2020-11-11 10:00:01+00:00,blood boil,0.0
125,2020-11-11 10:00:01+00:00,result police scotland investigation going announce pete instruct vi,0.0
126,2020-11-11 10:00:01+00:00,eviction amp homelessness never use tool immigration control record immoral amp pandemic make we unsafe we ve campaign stopasylumeviction amp speak govt plan target rough sleeper,-0.1
127,2020-11-11 10:00:01+00:00,do not miss tranquil podcast escape beachcombe birdwatch menai straits north wales pure lockdown escapism cast curlews oystercatcher,0.21428571428571427
128,2020-11-11 10:00:01+00:00,distancing handwashing will not stop spread covid school jennifer dowd,0.0
129,2020-11-11 10:00:01+00:00,repurpose bin bag send gp practice official ppethank sha,0.0
130,2020-11-11 10:00:01+00:00,imagine move house three young child pandemic well steele family use part exchange service they re love life earls colne development audleychase,0.3
131,2020-11-11 10:00:01+00:00,rapid summary explore evidence inform development safe delivery mass vaccination campaign develop country order maximise uptake minimise risk,0.5
132,2020-11-11 10:00:01+00:00,return train travel lockdown wales do not forget face cover unless,0.0
133,2020-11-11 10:00:01+00:00,continue receive great feedback client one client say extremely impressed ease communication speed accuracy service receive especially covid,0.6
134,2020-11-11 10:00:01+00:00,pfizers ceo cash stock day company unveil result vaccine tria,0.0
135,2020-11-11 10:00:01+00:00,crave zaman tak ada covid,0.0
136,2020-11-11 10:00:01+00:00,continue artsmark journey despite commit broad amp creative curriculum lawnswood celebrateartsmark,0.28125
137,2020-11-11 10:00:01+00:00,today media consultant pandemic impact us tv ad market accelerate shift streaming exec balazs szabo firm central european channel deal crisis listen,-0.06666666666666667
138,2020-11-11 10:00:01+00:00,nice see uk supermarket online store perform well far lockdown,0.35
139,2020-11-11 10:00:01+00:00,gold firm soft dollar concern rise virus case forexnews forex forexupdate forextip invest,-0.05
