,created_at,full_text,sentiment_score
0,2020-11-08 09:59:54+00:00,love watch cnn come visit canada pandemic well watch bill,0.5
1,2020-11-08 09:59:55+00:00,mother texte virus go need address covid,0.0
2,2020-11-08 09:59:55+00:00,everyone talk today wanted know could help georgia former colleague woman work,0.0
3,2020-11-08 09:59:55+00:00,epidemiologist hard sleepwhile online hate mail troll call sheepwatching pandemic lie awake,-0.5458333333333334
4,2020-11-08 09:59:55+00:00,weird shit ur refer covid pandemic shit party bernie know dnc would throw kitchen sink tell we show en masse reach critical mass do not game that s politic,-0.13999999999999999
5,2020-11-08 09:59:55+00:00,book week ocean grove week angleseacome summer holiday,0.0
6,2020-11-08 09:59:55+00:00,fordnation right thing leader like joe need listen disabled community forget,0.042857142857142844
7,2020-11-08 09:59:55+00:00,kpop girl group release album trmp get covid go viral biden ice cream edit,0.0
8,2020-11-08 09:59:55+00:00,could win huge christmas hamper amp enjoy goody lockdown amp help support charit,0.5333333333333333
9,2020-11-08 09:59:55+00:00,school mosques shopping center park etc close ac area ensure arrangement,-0.1
10,2020-11-08 09:59:55+00:00,atomskssanakan explain compare apple orange come swedenon top major misconception,0.28125
11,2020-11-08 09:59:55+00:00,new survey find response speed adoption digital technology several ye,0.04545454545454545
12,2020-11-08 09:59:55+00:00,even mercys get to relieve stress especially pandemic gfycat,0.0
13,2020-11-08 09:59:55+00:00,thank anand point congratulation many life elderly could save pm,0.5
14,2020-11-08 09:59:55+00:00,prepare late lockdown grocery new throw pillow holiday hand towel hand washing upgrade kid computer new computer monitor kid wellthe century everything change torchwood ready,0.04318181818181818
15,2020-11-08 09:59:55+00:00,wonderful view,1.0
16,2020-11-08 09:59:56+00:00,congratulation presidentelect amp vice presidentelect colleague look forward,0.0
17,2020-11-08 09:59:56+00:00,englands seven emergency hospital cost treat covid patient may stay empty,-0.1
18,2020-11-08 09:59:56+00:00,mnashika watu group close contact room bila ventilation pack like sardines kwa gari ya polisi,0.0
19,2020-11-08 09:59:56+00:00,report case frozen food packaging test positive tianjin find frozen pig el,0.22727272727272727
20,2020-11-08 09:59:56+00:00,seem corona virus come stay hmmmm,0.0
21,2020-11-08 09:59:56+00:00,lokesh thank kamal sir agree shoot vikram title teaser covid,0.0
22,2020-11-08 09:59:56+00:00,can not wait january medical community need start work biden task force trumpisirrelevant sciencematter,0.0
23,2020-11-08 09:59:57+00:00,top healthtech lead twitter mention bigdata analytic datascience ai machinelearning io,0.5
24,2020-11-08 09:59:57+00:00,nope pot see pic video firsthand account poll watcher present pa keep ft away due covid keep believe bullshit though sad,-0.20833333333333334
25,2020-11-08 09:59:57+00:00,well write graciousminus bit trump fail alaska like every state run rampant dead preventable virus protection strip alaskan land oil drilling etc good riddance glad you re willing unite,0.15
26,2020-11-08 09:59:57+00:00,dr shikhah gupta executive director get we ppe physicianfounded nonprofit aim provide ppe worker say group prepare worstone big trend see people really ready pretend pandemic say gupta,0.1
27,2020-11-08 09:59:57+00:00,trip europe height pandemic highly suspect,0.16
28,2020-11-08 09:59:57+00:00,every indian stand behind suddenly impose de monetisation lock due corona pandemic feeling betray pollution thick smog mixed corona request fold hand something,-0.165
29,2020-11-08 09:59:57+00:00,I ve point way duncan bell I m try find free worry online payment online yoga suitable mum lockdown she s sceptical there ll anything online help,0.47500000000000003
30,2020-11-08 09:59:57+00:00,entire college stadium storm field notre dame one care election day pass,0.0
31,2020-11-08 09:59:57+00:00,work begin get covid controlwhat great way start new presidency let get back,0.31212121212121213
32,2020-11-08 09:59:57+00:00,thank anand point congratulation many life elderly could save pm,0.5
33,2020-11-08 09:59:57+00:00,hotspot presidentelect take blessing,0.0
34,2020-11-08 09:59:58+00:00,world save life end pandemic together chief,0.0
35,2020-11-08 09:59:58+00:00,leave er shift hit healthcare provider respect tirelessly work save life,0.0
36,2020-11-08 09:59:58+00:00,look perfect logo design businessvisit bidenkamala followme followforfollow teamfollowback followher followbackteam,1.0
37,2020-11-08 09:59:58+00:00,crisis cause second pandemic shadowpandemicthis brief provide late available research,0.02500000000000001
38,2020-11-08 09:59:58+00:00,trump accuse covid someone tell meansardern total shutdown goddess modi tot,0.0
39,2020-11-08 09:59:58+00:00,go pandemic,0.0
40,2020-11-08 09:59:58+00:00,remember lekkimassacre water run away eyesthe second wave endsar lead total lockdownwere,0.0
41,2020-11-08 09:59:59+00:00,help slow spread identify risk case soon selfreporte symptom daily even fee,-0.15000000000000002
42,2020-11-08 09:59:59+00:00,celebration biden they re chant hey hey ho ho donald trump got go bidenharri,0.0
43,2020-11-08 09:59:59+00:00,people die enough hospital bed grandfather amp gr grandfather raise fund,0.0
44,2020-11-08 09:59:59+00:00,see balcony man childwife near three maskedhe take mask sneeze hand put mask cleaning hand suchladie gentleman one reason still middle pandemic,0.05
45,2020-11-08 09:59:59+00:00,similarly london second wave smaller large first wave probably evidence depletion,0.09285714285714286
46,2020-11-08 09:59:59+00:00,know case klselangor show sign decline be not well stay homemaybe starbucks tu kt dapur rumah dia je basically dia tak keluar rumah,0.0
47,2020-11-08 09:59:59+00:00,trump strong demo marry woman make significant gain every demographic except white man,0.26944444444444443
48,2020-11-08 09:59:59+00:00,late datum admission death english hospitalsat national level hospital admission remain flat,-0.10833333333333334
49,2020-11-08 10:00:00+00:00,yes yes yes scientist physician reach trump pence good faith early optimisticw,0.39999999999999997
50,2020-11-08 10:00:00+00:00,may rupert murdoch superspreader ignorance coronavirus write fintan otoole,0.0
51,2020-11-08 10:00:00+00:00,radiology innovation role coronavirus pandemic learn real case technology significantly help radiologist overcome challenge encounter pandemic,0.2875
52,2020-11-08 10:00:00+00:00,health authority uganda report new case saturday bring national tally,0.13636363636363635
53,2020-11-08 10:00:00+00:00,remember life covid mass shooting every week thank god covid something lock murderous wh,0.0
54,2020-11-08 10:00:00+00:00,survey extend please consider take part andor share short survey well understand impact live mnd uk result help enable service optimise give good care support,0.27878787878787875
55,2020-11-08 10:00:00+00:00,domestic violence group call national action plan case rise pandemic domesticviolence officerinvolveddomesticviolence oidv policemisconduct policeviolence policeoversight,0.05
56,2020-11-08 10:00:00+00:00,protest break germany second national lockdown amid coronavirus pandemic city leipzig see separate demonstration,0.0
57,2020-11-08 10:00:00+00:00,year increase universal credit childless people big change last fifty year despite earning doubledpjtheeconomist amp rob joyce compare uk benefit country recent podcasthttpstcoqprzpwdrab,0.0
58,2020-11-08 10:00:00+00:00,new home new normal here achieve stay safe amidst threatwe worry less contactless workplaceunioilexquadracontactlessworkplace,0.15121212121212121
59,2020-11-08 10:00:00+00:00,brockhall undergo deep clean rover look alleviate covid issue club,0.18333333333333335
60,2020-11-08 10:00:00+00:00,even lockdown stop cadet remember cadet lance corporal lead way ready join minute silence today remembrancesunday lestweforget wewillrememberthem,0.2
61,2020-11-08 10:00:00+00:00,promising solution tackle crisis submit idea win usd look social environmental solution context see everything need know apply clicking link shareub,0.3444444444444445
62,2020-11-08 10:00:00+00:00,think time open templesdiwali,0.0
63,2020-11-08 10:00:00+00:00,veterinary team play key role national push build back green pandemic learn step team take greenteamvet journey tuesday november pm,-0.06666666666666667
64,2020-11-08 10:00:00+00:00,lockdown use park green space important ever time ask everyone help we keep park litter free help we keep green space clean tidy enjoyable everyone,0.26666666666666666
65,2020-11-08 10:00:00+00:00,coronaviru local testing experience covid symptom local testing available monday amp tuesday november regent centre book,0.13333333333333333
66,2020-11-08 10:00:00+00:00,sc add case,0.0
67,2020-11-08 10:00:00+00:00,personally hate restriction lockdown hit low income hardesthttpstcotqkqancrx,-0.4
68,2020-11-08 10:00:00+00:00,download alert sa app zero rate improve contact trace alert user close contact user test positive past day staysafe,-0.011363636363636367
69,2020-11-08 10:00:00+00:00,accelerate online sale around world do not get leave behind provide lawful fair transparent cost effective way sell bloodstock global audience enter online onlinesale bloodstock integrity transparency integritymatters staysafe,0.18
70,2020-11-08 10:00:00+00:00,good morning lovely friend everyone great sunday wonderful weekend fantastic new week bless daysunday,0.5893939393939394
71,2020-11-08 10:00:00+00:00,calming sound spiritraise tune jodie two hour music prepare we enter lockdown two sound many dab,0.43333333333333335
72,2020-11-08 10:00:00+00:00,total cole county report,0.0
73,2020-11-08 10:00:00+00:00,pandemic may keep we lock break free bottled emotion struggle always remember alone voice feeling valid deserve heardthank join we journey k th r,0.4
74,2020-11-08 10:00:00+00:00,boy oh boy take life grant covid,0.0
75,2020-11-08 10:00:00+00:00,remembrance commemoration go limited social distancing lockdown measure year still observe minute silence honour fall wherever donate online lestweforget,-0.019047619047619046
76,2020-11-08 10:00:00+00:00,case miss could miss ithttpstcohaqjsywcyt,0.0
77,2020-11-08 10:00:00+00:00,remembrance sunday today write go visit lockdown poignant today get plan future lest forget mbv lifeinlockdown getthroughthistogether,0.0
78,2020-11-08 10:00:00+00:00,here get essential,0.0
79,2020-11-08 10:00:00+00:00,early week release late update follow national lockdown announcement detail yourdmufuture,-0.09999999999999999
80,2020-11-08 10:00:00+00:00,performance testing software market statistic research analysis release late industry report,-0.3
81,2020-11-08 10:00:00+00:00,here get essential,0.0
82,2020-11-08 10:00:00+00:00,few people say would take vaccine month ago via,-0.2
83,2020-11-08 10:00:00+00:00,pollution add death say scientistsexpert link around death worldwide directly comorbiditie cause exposure high level air pollution figure high south,0.14
84,2020-11-08 10:00:00+00:00,australias second populous state epicentre countrys outbreak relax restriction record ninth consecutive day infection state victoria premier daniel andrews say sunday,0.0
85,2020-11-08 10:00:00+00:00,day lockdown genuinely think week today plz go quick,0.3666666666666667
86,2020-11-08 10:00:00+00:00,sundayeye pandemic see steep rise domestic violence country survivor find sanctuary old refuge write,0.05
87,2020-11-08 10:00:00+00:00,across trafford morning remembrance sunday although parade still visible around local cenotaph please respect social distancing stay safe lestweforget,0.07083333333333333
88,2020-11-08 10:00:01+00:00,covid case india cases test india bot,0.0
89,2020-11-08 10:00:01+00:00,restriction force cancellation annual ceremony remembrancewe invite watch video we sunday,0.0
90,2020-11-08 10:00:01+00:00,icymi affect wild meat consumption rural cameroon gt series interviews resident cameroon dja faunal reserve uncover influence wild meat hunt buy sell eat,0.06666666666666667
91,2020-11-08 10:00:01+00:00,new case study add nursing midwifery catalogue change demonstrate critical role profession responsehave case study share contact,0.06818181818181818
92,2020-11-08 10:00:01+00:00,pandemic hit automotive industry hard,-0.2916666666666667
93,2020-11-08 10:00:01+00:00,back pain turn cancer one girlalex newman support besttocheck campaign make sure young people do not ignore symptom get help pandemic,0.19999999999999998
94,2020-11-08 10:00:01+00:00,national restriction place england must stay home limited set exemptionsread httpstcohacanezawf,-0.07142857142857142
95,2020-11-08 10:00:01+00:00,purchase herbal turmeric coffee heavens heart percentage go support operation blessing campaign help brave frontliner battle coronaviru available,0.6000000000000001
96,2020-11-08 10:00:01+00:00,pandemic show we essential role sanitation amp hygiene play stop spread diseaseit essential make sanitation amp hygiene reality home school health november,0.0
97,2020-11-08 10:00:01+00:00,every remembrance sunday thousand people gather across north linc remember fall hero due covid year service scunthorpe cancelledplease stay we today pause remember brave service man,0.3375
98,2020-11-08 10:00:01+00:00,second lockdown begin thursday long remembrance service today however four wreath lay two minute silence mark stream facebook page please remain home private remembrance,-0.016666666666666666
99,2020-11-08 10:00:01+00:00,uk government keep grassroots children rugby go lockdown sign petition via,0.0
100,2020-11-08 10:00:01+00:00,thank anand point congratulation many life elderly could save pm,0.5
101,2020-11-08 10:00:01+00:00,trillion indomeannni know covid project would christmas day many guy do not add,0.5
102,2020-11-08 10:00:01+00:00,current condition sayre patemp chill point barometer inhgwind mph nacorona virus weekly statscase nepa bradfordcounty,0.0
103,2020-11-08 10:00:01+00:00,state ban firecracker strongly support decision toxic gas directly impact lung impact air pollution anyways high,0.23111111111111113
104,2020-11-08 10:00:02+00:00,nick appear man word could use explain thinking covid disappear something cite evidence would really usefulill wait,0.2
105,2020-11-08 10:00:02+00:00,send friend people reenact painting covid absolutely love love love thissanditon sanditonp,0.5
106,2020-11-08 10:00:02+00:00,otherwise healthy brother die home age say old amp would go soonthey talk life overtoday yr old man joe biden became presidentelectstop write people agestop play covid,0.2333333333333333
107,2020-11-08 10:00:02+00:00,student staff community member able receive test result minute uwwhitewater campus start week,0.5
108,2020-11-08 10:00:02+00:00,city council monday consider two measure help business offer outdoor dining winter coronavirus pandemic rage,0.0
109,2020-11-08 10:00:02+00:00,give trump entire experience get covid amp unemployed,0.0
110,2020-11-08 10:00:02+00:00,italy increasingly defy illegal lockdown,-0.5
111,2020-11-08 10:00:02+00:00,new album prospect story complex feeling stem external situation pandemi,-0.05454545454545454
112,2020-11-08 10:00:02+00:00,icymi medical advance cut mortality rate provide sliver optimism despite fade hope swift vaccine discovery lethal disease,0.0
113,2020-11-08 10:00:02+00:00,biden celebration perfectly fine,0.4166666666666667
114,2020-11-08 10:00:02+00:00,guy people book wrong four season run response covid,-0.5
115,2020-11-08 10:00:02+00:00,solihull remembrancesunday commemoration stream online year line current local lockdown rule,0.0
116,2020-11-08 10:00:02+00:00,i d never grocery shop online advent foodanddrink,0.0
117,2020-11-08 10:00:02+00:00,current study show woman amp man respond differently covid research suggest,0.0
118,2020-11-08 10:00:03+00:00,despite high death rate america navajo nation increase turnout go bidenye,0.16
119,2020-11-08 10:00:03+00:00,think bank enough help people crisisour future banking amp capital market times explore topic impact banking covid open banking brexit pick copy read online,0.0
120,2020-11-08 10:00:03+00:00,world tenterhook wait news coronavirus vaccine development find history infectious disease vaccination vaccination old new cafe,0.11818181818181818
121,2020-11-08 10:00:03+00:00,orange county report three death due,-0.125
122,2020-11-08 10:00:03+00:00,thank concerned official news state something else,0.0
123,2020-11-08 10:00:03+00:00,walgreen transform customer experience era colin wright microsoft,0.0
124,2020-11-08 10:00:03+00:00,hope navy trwler get pcr,0.0
125,2020-11-08 10:00:03+00:00,middle pandemic people bankrupt health expenditure money build hospital p,0.0
