,created_at,full_text,sentiment_score
0,2020-11-03 19:59:54+00:00,hello love you all ok need another person say please vote biden presidency start ban,0.5
1,2020-11-03 19:59:54+00:00,I m furious people say we ve survive four year trump survive four I ve know lot people,0.0
2,2020-11-03 19:59:54+00:00,michigan have not vote yet get vote bidenharris beloved son patrick mcnamee can not vote bec,0.7
3,2020-11-03 19:59:54+00:00,beric hospital right covid relate I m I m immunocompromise could use good vibe,0.4928571428571428
4,2020-11-03 19:59:54+00:00,south carolina kyle mccarthy myrtle beach die august keep say mom I m go,0.0
5,2020-11-03 19:59:55+00:00,news surprise treelined location discover favour defacation destination grizzly mammal,0.0
6,2020-11-03 19:59:55+00:00,that s go nfl covid situation feel like nba be not get enough credit pull,0.0
7,2020-11-03 19:59:55+00:00,trump win he s promise make nhs pay medicinesjust uk need,0.8
8,2020-11-03 19:59:55+00:00,make angry idiot might replace good man like doug jones he s democrat make even angry racist like mo brooks run unopposed wonder thing might look like without pandemic dnc dscc invest al,-0.275
9,2020-11-03 19:59:55+00:00,well long get good grade white bomb manual be not issue suppose make sense,0.21666666666666665
10,2020-11-03 19:59:55+00:00,trump always get fundamentally american part wrong what s important eligible voter able vo,0.1
11,2020-11-03 19:59:55+00:00,look nicely describe terrorist,0.6
12,2020-11-03 19:59:55+00:00,ohio bad evereverybody careful,-0.3999999999999999
13,2020-11-03 19:59:55+00:00,socialist perspective us election coronaviru change everything,0.0
14,2020-11-03 19:59:55+00:00,election million vote already castthat total vote hawaii neva,0.0
15,2020-11-03 19:59:55+00:00,feeloff election anxiety fact do not sleep last night overcaffeination covid,0.0
16,2020-11-03 19:59:55+00:00,break sad anyone else notice defend obama say trump go around spread covid,-0.5
17,2020-11-03 19:59:55+00:00,stay smart stay safe report today november new case amp death detail michigans total case amp death find late data amp news maskupmichigan,0.11012987012987012
18,2020-11-03 19:59:55+00:00,defend social security,0.03333333333333333
19,2020-11-03 19:59:55+00:00,good point gov polis handle covid well local government task recognize local government right handle matter come responsibility result case portland pay rebuild,0.2464285714285714
20,2020-11-03 19:59:55+00:00,intend come post pandemic brazil,0.0
21,2020-11-03 19:59:55+00:00,trump school open they re go fundedtrump extort school across th,0.0
22,2020-11-03 19:59:55+00:00,united kingdom daily coronavirus report tuesday new case people positive report,0.12121212121212122
23,2020-11-03 19:59:55+00:00,ontario introduce new tiere system help handle,0.13636363636363635
24,2020-11-03 19:59:55+00:00,next time government minister demand crossparty support covid plan show thiscondescende arro,0.0
25,2020-11-03 19:59:55+00:00,say loud people back,0.05
26,2020-11-03 19:59:56+00:00,student you all well utilize rate professor yearlet everyone know treat student th,0.0
27,2020-11-03 19:59:56+00:00,department health say people die people test posi,0.0
28,2020-11-03 19:59:56+00:00,okay that s good think covid symptom,0.6
29,2020-11-03 19:59:56+00:00,prepare go another lockdown holocaust survivor like great grandma going stick home r,0.8
30,2020-11-03 19:59:56+00:00,first nation people die real life lose among zillion thing include try strip millions healthcare aca please vote blue ballot,0.15
31,2020-11-03 19:59:56+00:00,I m furious people say we ve survive four year trump survive four I ve know lot people,0.0
32,2020-11-03 19:59:56+00:00,honor support gale amp beautiful family incredible generosity thousand fellow citizen,0.875
33,2020-11-03 19:59:56+00:00,administration literally leave white house playbook would show respond,0.0
34,2020-11-03 19:59:56+00:00,whole sacrifice economy thing covid make obvious be not way newthe big reason ment,0.06666666666666667
35,2020-11-03 19:59:57+00:00,ill give number million case amp death,-0.5
36,2020-11-03 19:59:57+00:00,totally even people get covid will not let we,0.0
37,2020-11-03 19:59:57+00:00,death nursing home alone would not case patient carry virus,0.0
38,2020-11-03 19:59:57+00:00,fire trump keep fauci wear mask end war science vote vote vote,0.0
39,2020-11-03 19:59:57+00:00,wisconsin football program cancel game purdue schedule weekend three player,-0.4
40,2020-11-03 19:59:57+00:00,I m furious people say we ve survive four year trump survive four I ve know lot people,0.0
41,2020-11-03 19:59:57+00:00,would not refreshing see entire white house staff model irresponsible behavior pandemic rage,-0.08333333333333333
42,2020-11-03 19:59:57+00:00,petebuttigieg you re watch home google itpete tell fox trump economy bad obamas truth,-0.6999999999999998
43,2020-11-03 19:59:57+00:00,even covid droplet,0.0
44,2020-11-03 19:59:57+00:00,need vaccine real fix vexing vulnerability afflict we there s va,0.2
45,2020-11-03 19:59:57+00:00,pandemic hour accord president,0.0
46,2020-11-03 19:59:57+00:00,joe happen social distancing going think someone buy neighborhood gift card bribe,0.03333333333333333
47,2020-11-03 19:59:57+00:00,sudden forget rhetoric social distancing middle crowd,0.011111111111111112
48,2020-11-03 19:59:57+00:00,student you all well utilize rate professor yearlet everyone know treat student th,0.0
49,2020-11-03 19:59:57+00:00,I m volunteer bidenforfl need help final push flip florida blue elect leadership get we pandemic register voter yet cast ballot find polling place,0.26666666666666666
50,2020-11-03 19:59:57+00:00,evening solihullhourany lockdown deserve fantastic virtual event winejoin phil innes saturday james bond tastinga fun homage sean connery stunning bond themed winesto book info,0.39999999999999997
51,2020-11-03 19:59:57+00:00,psychology professor say suspect we presidential race cause canadians anxiety level rise like,0.0
52,2020-11-03 19:59:57+00:00,dang poll worker amazing thank,0.6000000000000001
53,2020-11-03 19:59:57+00:00,good reminder,0.7
54,2020-11-03 19:59:58+00:00,that s agree england strategy reactive one will action death rate amongst covid amp noncovid patient alike would soar completely unforgiveable level witness directly I m pathologist private amp contract nhs,0.07500000000000001
55,2020-11-03 19:59:58+00:00,study estimate million new yorker,0.13636363636363635
56,2020-11-03 19:59:58+00:00,pandemic r normal time way birthday party go let b,0.15
57,2020-11-03 19:59:58+00:00,lead panel discussion stay socially connect global organization,0.016666666666666666
58,2020-11-03 19:59:58+00:00,vote swamp real,0.2
59,2020-11-03 19:59:58+00:00,genuinely serious state able mentally hack another lockdown,0.022222222222222227
60,2020-11-03 19:59:58+00:00,maybe trump actually do job downplay pandemic might option stop diva loser,0.0
61,2020-11-03 19:59:58+00:00,arkansas pass mark battle pandemic state official announce tuesday confirm probable death state hit report death seven week ago sept,0.0
62,2020-11-03 19:59:58+00:00,new death people age link maple care home residen,0.13636363636363635
63,2020-11-03 19:59:58+00:00,effect social social medium cause asuu strike social medium cause social medium cause endsar protesti love country notosocialmediabillendpolicebrutality,0.12666666666666665
64,2020-11-03 19:59:58+00:00,see pandemic early stagesi see dead people,-0.05
65,2020-11-03 19:59:58+00:00,gosh detail insanea typical virus replace software cell infect ab,-0.16666666666666666
66,2020-11-03 19:59:58+00:00,melania trump show new coronavirus personal protection method way vote call pagean,0.06818181818181818
67,2020-11-03 19:59:58+00:00,lockdown aggressive balanced approach implement say intern,0.0
68,2020-11-03 19:59:58+00:00,we fda warn false positive result antigen test,-0.0863636363636364
69,2020-11-03 19:59:58+00:00,empty bed pan covid ward ppe,-0.1
70,2020-11-03 19:59:59+00:00,child we diagnose last week week pandemic,0.0
71,2020-11-03 19:59:59+00:00,rich always escape hatch work people always leave suffer obscene ineffective freedomcrushing,0.375
72,2020-11-03 19:59:59+00:00,disturbing development addition robocall voter flint michigan getting threaten live call,-0.18181818181818182
73,2020-11-03 19:59:59+00:00,hello chronically ill vulnerable person remind lockdown never end disabled peop,-0.39999999999999997
74,2020-11-03 19:59:59+00:00,something look forward eh darren,0.0
75,2020-11-03 19:59:59+00:00,plenty woman scare go walk run night well pandemic advise,0.0
76,2020-11-03 19:59:59+00:00,student you all well utilize rate professor yearlet everyone know treat student th,0.0
77,2020-11-03 19:59:59+00:00,here roundup thing streetsforvote,0.0
78,2020-11-03 19:59:59+00:00,toronto ask little time province roll new restriction guideline star,-0.025568181818181823
79,2020-11-03 19:59:59+00:00,since start covid retailer look way improve customer loyalty satisfaction retailer go beyond learn business beauty fashion,0.0
80,2020-11-03 19:59:59+00:00,call display many many people answer phone do not recognise number blame scammer telemarketer past bad experience fact everyone call display hope bcs contacttracer least leave voicemail,-0.04999999999999997
81,2020-11-03 19:59:59+00:00,fyi still trump healthcare plan tax mexico do not pay wall,0.0
82,2020-11-03 19:59:59+00:00,trump school open they re go fundedtrump extort school across th,0.0
83,2020-11-03 19:59:59+00:00,kill coworke office model cre newnormal coworke newnormal tenanttip corporaterealestate,0.0
84,2020-11-03 19:59:59+00:00,youth opportunity fully active contribute post pandemic recovery plan great way engage include youth develop decision policy make skill youthemerge,0.33333333333333337
85,2020-11-03 19:59:59+00:00,st louisarea hospital report record admission,0.0
86,2020-11-03 19:59:59+00:00,genpact win deal develop aisystem detect amp learn high volume safety signal vaccine vaccine healthcare million,0.48000000000000004
87,2020-11-03 19:59:59+00:00,go lose right march protestcan someone please tell be not head towards total con,0.14285714285714285
88,2020-11-03 19:59:59+00:00,dad big thing he s upset die alone dumb fuck refuse wear mask federal mandate people fine wear one could slow could love one time need like,-0.026388888888888906
89,2020-11-03 19:59:59+00:00,never forget global pandemic recession million lose job health insurance home dem,0.0
90,2020-11-03 19:59:59+00:00,vote person today please safe wear mask stay line remember vote change world also big pal also vote presidential election year everyone vote,0.25
91,2020-11-03 19:59:59+00:00,long ago sage deride suggest death could rise day number long since reach,-0.05
92,2020-11-03 19:59:59+00:00,look conservative party business tomorrow clear want even midst pa,0.10000000000000002
93,2020-11-03 19:59:59+00:00,incredible standing ovation poll worker,0.9
94,2020-11-03 20:00:00+00:00,traveler say would travel within month restriction lift learn evolve traveler journey global webinar series,0.0
95,2020-11-03 20:00:00+00:00,administration literally leave white house playbook would show respond,0.0
96,2020-11-03 20:00:00+00:00,sometimes wonder many few death would country trump fight prevent spread ha,0.15
97,2020-11-03 20:00:00+00:00,south koreas death per people united states still national testing contact trace strategy federal level death per people,0.0
98,2020-11-03 20:00:00+00:00,whether wait line vote watch result home stay engage hamilton ragtime,0.0
99,2020-11-03 20:00:00+00:00,malacanang defend president dutertes appointment carlito galvez former chief staff armed force philippines coronavirus vaccine czar amid criticism someone medical background choose instead,0.0
100,2020-11-03 20:00:00+00:00,covid something take personal responsibility do not look government save youone myrtlebeach voter do not let keep vote trump update httpstcoptwljpkrzp,0.0
101,2020-11-03 20:00:00+00:00,health hacking crisis network hhcrisisnetwork name winner storybook contest,0.0
102,2020-11-03 20:00:00+00:00,I m give talk understand digital racism covid venerable oxford internet institute go,0.0
103,2020-11-03 20:00:00+00:00,pandemic continue flu season,0.0
104,2020-11-03 20:00:00+00:00,international symposium collateral brain entitle virtually normal collateral stroke global pandemic amp occur speaker include drs radoslav raychev fabien scalzo jason hinman amp david liebeskind info,0.049999999999999996
105,2020-11-03 20:00:00+00:00,great british bake matt lucas little britain confession expose amid prime minister boris johnson rowbakeoff,0.2041666666666667
106,2020-11-03 20:00:00+00:00,jackson county public health report recordhigh number new case today report new case bring total report case county,0.06818181818181818
107,2020-11-03 20:00:00+00:00,make lasting change business hear stuart mills want find sign attend,0.0
108,2020-11-03 20:00:00+00:00,hour leave til poll close get line pm i d ready practice social distancing wear mask,0.11666666666666667
109,2020-11-03 20:00:00+00:00,dido harding admit underperform serco test trace operation need take big leap forward help cou,0.0
110,2020-11-03 20:00:00+00:00,show creativity relief grant public art work fund,0.0
111,2020-11-03 20:00:00+00:00,impact market smarthome check late webinar learn recent change vertical along relevant technology solution,0.03333333333333335
112,2020-11-03 20:00:00+00:00,year old juan martinez make decision teenager face,0.1
113,2020-11-03 20:00:00+00:00,webinar what s next telehealth sustain expand access,0.0
114,2020-11-03 20:00:00+00:00,join we pm federal court practice court cle seminar program provide participant late procedure guidance next united states district court case register today,-0.15
115,2020-11-03 20:00:00+00:00,semilockdown halve order fall,0.0
116,2020-11-03 20:00:00+00:00,coronavirus symptom please do not turn testing site without appointment turn away isolate home book test leave home appointment visit call book test playyourpart,0.0
117,2020-11-03 20:00:00+00:00,hospital could close noncovid patient christmas uk infections hithttpstcopjvcxjbudr,0.0
118,2020-11-03 20:00:00+00:00,do not care rich buy many sheep,0.4375
119,2020-11-03 20:00:00+00:00,dwyer football go opener cancel win pahokee span hour stand week ranking,0.8
120,2020-11-03 20:00:00+00:00,thursday national lockdown restrictionsthi mean meet indoors people household support bubble exercise visit outdoor public place people live support bubble one person another household,-0.058712121212121215
121,2020-11-03 20:00:00+00:00,islamic extremist armed automatic rifle fake explosive vest rampage vienna nightlife district hour ahead coronavirus lockdown fatally shoot four people kill police,-0.5
122,2020-11-03 20:00:00+00:00,hospital healthcare system stay afloat help patient pandemic financial health impact member population employer healthcare finance got rundown late,-0.09999999999999999
123,2020-11-03 20:00:00+00:00,well metric percentage ltc resident die,0.0
124,2020-11-03 20:00:00+00:00,game cancellation due cause chaos coach,-0.2625
125,2020-11-03 20:00:00+00:00,talk everything need stop climate crisis much happen fast enough pandemic show we drastic measure take save livesban fossil fuel use serious,0.016666666666666677
126,2020-11-03 20:00:00+00:00,dwyer football go opener cancel win pahokee span hour stand week ranking,0.8
127,2020-11-03 20:00:00+00:00,bloomington pourhouse cafe close last week due coronavirus pandemic people work cafe reflect time,-0.0625
128,2020-11-03 20:00:00+00:00,canadians bring number keep school workplace open form personal habit limit viral spread stick say chief public health officer dr theresa tamhttpstcoaqadvdavod,0.0
129,2020-11-03 20:00:00+00:00,superintendent scott mcwilliams say capacity issue concern middle high school district can not ensure six foot social distancing student faculty student attendance,0.06444444444444444
130,2020-11-03 20:00:01+00:00,get interview soon look tip get job birmingham staffordshire shropshire derby leicester nottingham warwickshire telford worcester westmidlands wfhleadership learn tuesdayfeele tuesdaymotivation tuesdaythought,0.0
131,2020-11-03 20:00:01+00:00,textured velvet fabric delicate embroidery perfect sewing show wuhan jerry decos profession textile please contact we detailsclick watch detail replay jinhan fair online,0.4666666666666666
132,2020-11-03 20:00:01+00:00,call we houseclean janitorial clean carpet upholstery airduct arearug dryervent tile grout carpetstretch carpetrepair vinylfloor coronaviru,0.3666666666666667
133,2020-11-03 20:00:01+00:00,black business need support ever see help keep black business alive pandemic,-0.07777777777777777
134,2020-11-03 20:00:01+00:00,icymi dr bill lydiatt cmo methodist hospital methodist womens hospital join area cmos yesterday discuss step reduce hospital capacity health system work together fight watch,0.0
135,2020-11-03 20:00:01+00:00,lockdown loom make sure know,0.5
