,full_text
0,break report vaccine prevent transmission disease us district judge rule coul
1,honestly respect btss ability stay kind open industry fill people hold nothing bitterness
2,south africa report new coronavirus case sharp increase compare week prior omicron
3,cdc many mask day
4,already prove maybe check tweet
5,gain lose speculate trust big pharma do not depend vaccine exist thrive well covid individual amp thank exposure medical field understand vaccine benefit
6,nephew year old diagnose covid toe real thing
7,I m run remove rino french hill especially vaccine database vote also vote
8,make vaccine mandatoryat least make mandatory govt employeeshealthcare workerscompaniesofficesprivate amp govtretailersanyone enter amp work public space covidvaccine makevaccinesmandatory covid omicronvarient
9,solar system incapable resist planet great catastrophe planet saqar socalle
10,australian hayley hodgson place covid internment camp despite test negative virus confine
11,pandemic roller coaster uncertainty likely feel particularly acute navigate dea
12,head another winter surge thanksgiving holidaythis be not omicronthis ongoing tr
13,say yesterday
14,mandatory order close border stop war american energy
15,screw walker dude lot dead people family wish would ve actual lockdown instead force work get sick die never actual lockdown
16,kid hospitalizationsthe highly transmissible omicron variant put disproportionately large number child
17,psaki blame covid circle back psaki blame rise smashandgrab incident looter be not rea
18,dey buy dewormer trotro dey fear vaccine
19,pray amp remember daily pandemic die uk may rest peace also fo
20,look like omicron could already case ukif proportion double every week could domi
21,abbott feel sense duty people he s suppose serve never would ve lose life covid amp co
22,nhs staff ask police investigate down street lockdown christmas partythe open letter call event insu
23,anybody go one monoclonal antibody center florida experience much cost insurance cover cure covid youmonoclonalantibody
24,new case covid uk second day run nothing say apart push chri
25,break falls number confirm patient hospital england long per
26,wonderful can not wait read
27,nhs amp care staff sign letter last hour call upon dame cressida dick
28,wish complain party hold downingst london last christmas whole uk lockdown people fine break lockdown rule one be not want investigate please
29,matt hancock neighbour deny nhs cronyism claim bbc newsalex bourne deny allegation work whatsapp message health add highlightshttpstcoqqdbjpkomh uk politic
30,scary new variant lose roe mention week bbb much go that s scary alec baldwin top story obsession beat bad people side
31,note selfdo panic buy kase may mas murang seal album tuwe ld event
32,naturalimmunity good protection covidvaccine
33,must bring ordinance neetpg counselingordinanceforneetpgomicron
34,india confirm tour south africa schedulehope go plan indvssa indiancricketteam
35,autism affect we child cdc data suggest foxnews
36,hope see today could really use help try catch work week covid power cut rent past due please anything help truly
37,weapon covid virus strain exist still come full vaccination double mask
38,high court judgement rule favour dr sam white able return work gp
39,hmm hmmm moot right professional actively tell face support receive fake
40,joe rogan hack beat covid people feel well hour time media big mad bec
41,think devastation brexit amp death covid blistering mismanagement policy begin look
42,listen guest dan yorke show debate perpetual state emergency governor vaccine passport
43,break south africa report new coronavirus case last week
44,do not know never occur covid could put yellow tape ground tell people do not like can not cross
45,social distancing thing anymore anyways walk close stand look phone give dirty look what s tl that s
46,new risk die red state high blue state since vaccine become widely available accor
47,v never really wear mask live bts x squid game mashup
48,congratulation finalist healthcare article digitalhealth populationhealth clinicaldocumentation medicine clinicaltrial medicaltranslation research biotech
49,covid jab yesterday feel weather today
50,judicial watch judicial watch sue record biden administration community corps program target min
51,solution inflationyou problem fiscal update stop list
52,health expert investigate reason concern increase case hospital admission among pr
53,experience violence home amp need leave hurry identify friend neighbour relative shelter
54,scotland coronavirus friday december case positivity rate new test
55,nhs amp care staff sign letter last hour call upon dame cressida dick
56,painful see whale trap rope turtle cover moss epidemic must participate marine protection association
57,honestly dfcapb campusespredominantly healthfocuse campus problem people vaxxe student should not go varsity
58,boost quick easy process whether booster dose sign free vaccine
59,interstate international arrivalsonly fully vaccinate people territory resident people unable vaccinate child year able enter northern
60,eu country put place new restriction try keep omicron control mean pcr test even fo
61,call nhs amp care staff today commissioner dame cressida dick tell need letter co
62,fully vaxxe dana white contract lose sense taste smell call joe rogan treatment protocol
63,garbage vaccine do not work accomplish tyrannical mandate head
64,fully vaccinate kaizer chiefs player test positive china virusthey need booster
65,hand intensity climatic disaster unprecedentedly increase since till hence global warm
66,break report vaccine prevent transmission disease us district judge rule coul
67,tonight vote democrats continue resolution bill fund president biden illegal unconstitutiona
68,please bring safe world choice monopoly place scottish make old tec valneva vaccine tech polio likely future proof deactivate virus spike protein mrna make cancel favour mrna monolpoly
69,worried cull wild animal stay quiet cull human being via covid vaccination
70,plumber find bag cash hide bathroom wall joel osteen megachurch year report burgl
71,must bring ordinance neetpg counselingordinanceforneetpgomicron
72,look second lockdown lot acid reevaluate life choice like thing I m somewhat less douche
73,rachel maddow national treasure full fucking stop catch segment new alternative treatmentprevention
74,logic say need mask tesco wetherspoon mabye covid transmissible due myrrh
75,hear ask vaccine animal style put little thousand island dressing
76,joon like enough covid
77,hear gb news arlenes briefing poll say german people support mandatory vaccine that s
78,new job last month canada economy grow canada job p
79,young woman care future family want havethere evidence vaccine
80,
81,new covid measure biden announce europes nothing package come
82,suspect case omicron maharashtra arrival international traveller highrisk country
83,vaccine mandate passport el salvador mask mandate testing requirement enter country
84,absolutely brilliant show two part first life foreigner britainbrit love wwii etc second new it ll come wash material focusse lot covid brexitgot meet afterwards toothearcher
85,honestly variant controller diamond button layout like regular controller lr amp zlzr button mapping swap default amp right stick exactly like leave one would amazing traditional fighting game amp shooter
86,know reckless
87,expert keep try reframe drug poisoning crisis addiction crisis far I ve read two
88,peer review paper recently got accept publication prestigious journal infection suspect reinfect
89,want report illegal rave down street tier lockdown december confirm date
90,evil politician virus pandemic season
91,cathedral riverside really fabulous think centre hit hard pandemic still nice look around beamish museum well worth visit
92,iceland majority covid infection occur population vaccinatedpandemic
93,down street party report subsequent friday night gathering third lockdown far serious
94,omicron variant may evolve rat one theory say
95,wife own nail body beauty hair salon shopping centre getting harass centre manageman
96,case omicron unvaxxe
97,new one six people infect vaccinate far none require hospitalizationnebraska
98,omicron data dec european centre disease prevention country case available information either asymptomatic mild death report far hold
99,school close due omicron corona virus pandemic college take exam center
100,recent national study explore pandemic change women shopping behavior ceo johnson amp britta cleveland meredith corporation explain retailer use busy shopping week ahead
101,european equivalent cdc case omicron available information severity w
102,mismanagement multiply ten fold bjp give compensation people face covid pandemic
103,first time give trump credit vaccine however still falsely accuse logistic place fact thousand shot day already give
104,kid hospitalizationsthe highly transmissible omicron variant put disproportionately large number child
105,hayley hodgson release detention howard springs quarantine facility australiaon
106,we ve probably contribute society month actually going spend small business live instead cowarde away etc stop division believe vaccine believe work let believe immune system
107,joe biden say president trump remain president we surpass covid deathsthe us ha
108,must bring ordinance neetpg counselingordinanceforneetpgomicron
109,psa you re sick think cold do not go someones house amp tell late
110,disastrous collision covid hiv may cause omicron variant omicron hiv covid
111,pick arbitrary rule table number people go long stay none eviden
112,gathering illegal amp police raid home break covid regulationsthe public
113,either cte alabamas education bad maybe
114,stat canada blame covid decade irresponsible policy
115,laaaaadie amp gentleman el famoso factchecking
116,cdc tryna stop omicron variant get america
117,honestly respect btss ability stay kind open industry fill people hold nothing bitterness
118,billboard evil spirited interview like genuinely disrespectful question I ve ever see
119,osha suspend enforcement vaccine rule here employer know employmentlaw
120,five six parent say kid experience learn loss regression slow expect progress toward goal emergence lead school closure remote learning httpstcokamcaorptk
121,florida lowest covid positivity country
122,two study provide evidence cdc still overcounte death undercounte vaccine death
123,like serina betta stay home ya
124,else back uk vaccine task force
125,international team scientist include researcher believe may find molecular mechanism behind extremely rare bloodclot link adenovirus vaccine
126,due league protocol affect game tonight syracuse saturday vs charlotte postpone makeup date tbd
127,november child age across ontario eligible vaccinesit okay question learn vaccine child youth
128,hello america I m stayathome parent lose home extremely large bird I m prove parent wrong oneup sible oneup sibling win new car
129,want quick shout thank everyone support we past year since start we ve navigate rocky water since pandemic start tho yet see retweet support hella awesome
130,snapshot impact hospital system dashboard update every week monday wednesdays fridays amfor late information visit
131,call nhs amp care staff today commissioner dame cressida dick tell need letter co
132,datum suggest majority infect individual develop robust longlasting cell immunity
133,hayley hodgson release detention howard springs quarantine facility australiaon
134,weigh agree white house pandemic root cause smash grab crime
135,break warn people visit downtown toronto cafe piccolo caffe e vino john st
136,todays free entry pm et vanguard hpsnd pm et halo variant pm et vanguard snd console
137,week learn network school leader sheri mcpartlin chief nurse clark county school district las vegas discuss district central call line positive case response amp build exist ehr studentsincovidout
138,let go much mean ella alkhalil coyle reflect upon importance holiday last year christmas restriction
139,see report omicronrelate death yet spokesperson
140,what s fox believe see eyesnurse state icu covid patient either unhealthy bmi serious health issuesthe people catch covid twice jabbedgo enjoy life turn tv
141,pandemic move conversation around flexible work forward year say expert go find article feature ukgs weareukg
142,join solve ceo ove amitay conversation ceo dr immunebased prediction long covi
143,medium involve antivaccine propaganda need sue liquidate bankruptcy asset
144,omicron really widespread canada doctor say right delta variant concern
145,must wear face cover public transport shop unless exempt httpstcoxbneyjvomf
146,stop hang around take test visit family friend order prevent spread
147,watch get weekly update city hall regina mayor sandra masters join ywca frost regina agenda
148,pandemic fuel technological adoption also breed new generation cyberthreat know protect system application amp datum dataprise manage cybersecurity cyberprogram vulnerabilitymanagement
149,adagiotx announce experimental antibody likely effective omicron variant coronavirus previous variant antibody afford year protection biotech adgilearn
150,new hampshire vermont ask test deer
151,since vaccine become widely available average risk die covid high state vote trump state vote president biden
152,eu nevada strongertogether euinnevada
153,break report vaccine prevent transmission disease us district judge rule coul
154,get depot tonight kick weekend show tonight require negative test result within hour event proof vaccination entry nomi health onsite testing
155,peace village teach child art compassion love kindness humanityplease help retweet peace love vegan music art bts jimin exo news tiktok bitcoin
156,ok really important previously infect need vaccine vaxxe already
157,kid hospitalizationsthe highly transmissible omicron variant put disproportionately large number child
158,trial datum pfizer finally lie safe effective brainwashing folk suspend
