,full_text
0,tale two study can not rightcdc study say vaccine time well natural immunityhttpst
1,request govt cm yogi state government take step think student live al
2,strong political every country rich poorcan build strong equitable health system leave one behind
3,million child age vaccinate we without myocarditis case many dose va
4,well omicron get australiaonly double jabbed people allow
5,national news president ramaphosa test positive read
6,darwin theory base natural selection vaccine take
7,add covid pass onto apple wallet amid new restriction
8,seem thing deepstateglobalist traitor understand illinois rep pull nonsense unvacksd bill receive
9,de end de day covid you all think swear put room people covid ill come covid free
10,pandemic response guide try distract lie lawbreaking scandal
11,president ramaphosa test positive president receive treatment mild symp
12,well well go start send mb patient province do not get sick hurt friend there s room stefanson inn mbpoli
13,job save live vaccine job
14,pandemic change sex work industry
15,oklahoma admit defeat leadership oklahoma national guard acknowledge fight federal go
16,one congress ever miss paycheck covid shutdown do not forget
17,vaccine one size fit people must give choice
18,join we virtual town hall meeting slate monday december eat panelist discuss
19,sorry hear test postive brother wish swift recovery stay strong
20,lockdown advocate guilty guilty sleep well
21,tracking omicronvariant uk amp world total case far total cas
22,rest world reel atmomicron arrive front doorcaution well part valournzs response covid exemplary
23,request govt cm yogi state government take step think student live al
24,ghana health service say vaccination card mark ghana vaccination
25,they re wait get long grass
26,national news president ramaphosa test positive read
27,kevin would punish people make legitimate decision vaccineretire paediatrician dr ros
28,even case require hospitalization omicron still end disaster uk ar
29,johnson do not announce new restriction even tho say current trend nhs could overwhelmed
30,vaccinated neighbor kick church someone out vaccine status c
31,thank everyone got vaccinate test yesterdayour thought hospital family peop
32,lowkey really want we go lock
33,day johnson going tell we lockdown january
34,come gmb million booster jab day enough save we postchristmas lockdown join we king castle studio cause chaos tune
35,holy I ve hour straight bad idea get covid booster sleep deprive
36,week heavy lockdown
37,healthcare workers energy another wave pandemic please retweet you re keep we
38,mahapostresult declarefinallistrecruitment process india post pmmgmts direct recruitment maharashtra cir
39,kentucky gov andy beshear wish understand we ve gotten hit pandemic historic ice storm flood w
40,natural immunity seem work fine patient covid month ago treat icu survive
41,sorry good enough idiot hold ferry full people almost hour charge public mischief something can not say ok ill wear mask travel hour disruption
42,fine want take vaccine problem
43,canary do not really understand well say vaccine dose still store yet people visit health center bounce back without expect dose
44,I m like thisa month old child pass brain spongiosis autopsy httpstcom
45,argument tired find colouring book willing read
46,ya let shut
47,national news president ramaphosa test positive read
48,I m sorry congregation do not approve I m glad follow god plan must know hundred thousand we welcome congregation worship god
49,wish well president ramaphosa need need healthy
50,johnson plan hype threat omicron win tue vote plan b sit dec announce plan c parl
51,lets stop covid lock unvaccinated shit do not work lock vaccinate shit do not work get v
52,south african president cyril ramaphosa test positive
53,
54,idm collaborate speak trust expert dispel vaccine misinformation dr nyaradzo chigorimbotsikiwa base idm say vaccine provide well immune response get infect vaccination much low viral load
55,every adult get booster jab end year country face tidal wave omicron say boris johnson
56,hi I m stayathome parent home take herd elephant I m next masterchef
57,obey national socialdistancing measure
58,virtual peering series africa hold august touch fear peer post pandemic future handshake peeringif miss event want relive watch virtualpeering ixp
59,worker night shift mayfield consumer products middle holiday rush crank candle tornado close factory word go duck
60,please note line government issue vaccine mandate member guest participant enter park harness racing club must fully vaccinate present vaccine passport upon entry friday december
61,namyangjus kpop artist hoshi receive award contribution revitalize donation culture always think
62,covid malaysias adult population fully vaccinate httpstcobyjouaelcgmalaysia ncip pick tmrphoto
63,concern scale pace booster programme nhs already beyond full
64,journal migration healths editor helena legidoquigley select top article read openaccess investigate resilience refugee camp case rohingya settlements bangladesh online
65,ministry health uganda result test do december confirm new case cumulative confirm case staysafeug
66,school creche give million grant hepa filter measure reduce spread
67,many we state coronavirus incidence increase thanksgiving holiday publichealth healthcare illness vaccine via httpstcowiimneetfh
68,diplomatic failure pandemic prompt unprecedented selfisolation food shortage north korea little indication crisis ease
69,brexit show everything true colour msm blatant eu people blatant brexit msm should ve move back neutral pandemic govt bash relentless youth brainwash globalist education amp medium
70,manchester united record small number positive case among player staff follow saturday premier league match norwichmufc
71,intl community allow man ec member tplfterroristgroup record cover cholera
72,gm variant winning
73,love actual gpwho involve initial covid vaccination programme tune
74,mask important face mask preventive measure whenever possible carry extra mask eventuality learn measure put place fly we website nowtravelready atozoftravel
75,treasure coast citizen well equip fight omicron
76,concern scale pace booster programme nhs already beyond full
77,katherine declare exposure site new testing mandate put place
78,routemap comic survival thriller take audience memory lane recollect initial lockdown experience director sooraj sukumar talk upcoming malayalam
79,americans view health equity race fundamentally change throughout pandemic
80,breakdown pm say last
81,vital protect nhs say man will not fund pay staff properly could not even bother wear
82,president last two week west africa yesterday attend memorial fw de klerk darrenkerisky ramaphosa
83,middaynew another omicron case maharashtra tally
84,player staff nrlw indigenous star camp force biosecurity protocol player return positive covid test full detailshttpstcohxcgppzmkv
85,heres daily covid people test positive day indias infection tally rise active case decline new fatalitiesomicron coronavirusupdate covidudpatehttpstcokfyqfwnouz
86,nvax approval novavax vaccine help booster make easy people hesitant al
87,sant shri asharamji bapu veteran innocent constant health problem bapuji suffer post covid co
88,homeless die coronavirus try see do not social distance do not wear mask
89,evidence regularly rinse nose saline protect people infection staysafe
90,tell story impact life tune workzone elana tuesday december share story inspire survivor ichoosevaccination conversation power gauteng government
91,national news president ramaphosa test positive read
92,great flick see afraid theater due covid really movie make million open weekend assure one theater stop excuse beautiful movie gorgeous worth price ticket seeit
93,request govt cm yogi state government take step think student live al
94,nativity take mask sing indoor go shop pubbing club effective mask supply
95,current condition sayre patemp chill point barometer inhgwind mph sswcorona virus weekly statscase nepa bradfordcounty
96,asian development bank adb approve million loan help philippine government secure additional coronavirus disease vaccine supply boost health security filipinos ensure safe steady economic recovery
97,uhcday pandemic emphasize exacerbate health inequity around call government donor
98,muuuuuch well still covid positive symptom anymore
99,fact guy still alive functional ought enough proof vaccine safe
100,invest wix today per share stock price rebound back prepandemic price investment would worth that s growth profit see ibte hfro hcr aset vvi
101,health alert december health identify new exposure location south australiaif attend exposure location require follow relevant health advicemore information available
102,jesus come back tomorrow news return would immediately ban twitter facebook youtube f
103,people stop fear covid politician start fear people
104,caruso dodge covid protocol bull lockeroom
105,another pandemic
106,contradiction america juxtapose headlinesthere bed local hospital divert patient cov
107,nota benea mild fast virus often kill amp harm people virus slow amp severe even
108,can not wait every sport record break progress look like
109,fake picture people drop street china cause mass panic virus live picture fit young athlet
110,global vaccine gap persist one year rollout
111,menominee historical society quiet covid hold first annual meeting several year wednesday
112,break news president cyril ramaphosa tests positive presidency say ramaphosa treat mi
113,covidpeople die aampe bed cut staff nurse doctor short
114,fight pandemic compliance relate relief gst taxpayer extension due date filing form economyrise aatmanirbharforgrowth reformsforgrowthamritmahotsav
115,people could care less legislative agenda time end andys fake covid emergency
116,pentagon consider death first time month
117,healthcare workers energy another wave pandemic please retweet you re keep we
118,uhcday pandemic emphasize exacerbate health inequity around call government donor
119,must tighten restriction corruption
120,key point increase immunity mrna booster shoot top prior infection prior mrna vaccination confer
121,nhs leave weaken low pay cut amp closure privatisation despite heroic effort nhs staff f
122,national news president ramaphosa test positive read
123,overcome lockdown one beer timebest giftfunny beer life
124,indonesia start vaccinate child age
125,average new covid casesnew york city vaccine passport restriction
126,covid warn major uk omicron wave booster england
127,day fox doctor push vaccine kid number cite child die covid worldwide boy heart problem die
128,dollar steady trader wait central bank pound inch low covid fear
129,johnson plan hype threat omicron win tue vote plan b sit dec announce plan c parl
130,sail away superyacht industry boom covid pandemic
131,webinars first lockdown think important continue talk issue partner face light pandemic series free weekly webinar season wedohope
132,research publish reveal high dietary intake fruit vegetable vitamin c folate vitamin k fiber associate low susceptibility infection
133,neon star shine ontheair listen streaming epidemic sound ondemand podcast channel
134,official pingxiang city china establish checkpoint prevent illegal entry country vietnamese hanoi report infection thursday zerocovid china
135,number patient hospital uk largely steady decline since start november
136,sail away superyacht industry boom covid pandemic
137,take note aucklandersonly nasty fecal matter like trevett work regard
138,workfromhome plan hit gautrain bombela say rebound hinge vaccine returntowork development money government cover shortfall cap
139,sail away superyacht industry boom covid pandemic
140,decline vaccine effectiveness vs omicron simplified ci summary pfizer vaccine vs delta booster
141,simple get together finally year pandemic zalcarl
142,exploit tragedy jews humiliate marked yellow star isolate starved deh
143,national news president ramaphosa test positive read
144,huge demonstration argentina force vaccination covid restriction
145,someone post online community op receive naeun negative result confuse many netizen
146,email gm training get complaint do not check vaccine passport today job job tra
147,seventeen hoshi say much love public always think repay amp give back want hel
148,tonight bedtime year old say can not remember covid childhood
149,ghana health service say vaccination card mark ghana vaccination
