,created_at,full_text,sentiment_score
120,2020-11-21 16:59:59+00:00,"1) most of his legal team has quit

2) there's no evidence to suggest fraud other than you not liking the outcome

3) 2000 Americans died yesterday due to covid, do they not matter?","{'neg': 0.303, 'neu': 0.656, 'pos': 0.041, 'compound': -0.8798}"
121,2020-11-21 16:59:59+00:00,RT Why is the West still not learning from Asia's Covid-19 success? via,"{'neg': 0.0, 'neu': 0.764, 'pos': 0.236, 'compound': 0.5719}"
122,2020-11-21 16:59:59+00:00,"RT If you can't wear a mask due to ""health reasons"", shouldn't you be the LAST one out and about?","{'neg': 0.0, 'neu': 1.0, 'pos': 0.0, 'compound': 0.0}"
123,2020-11-21 16:59:59+00:00,RT The lockdown house of cards is built on the idea that asymptomatic people are likely to spread infection. But is there A...,"{'neg': 0.0, 'neu': 1.0, 'pos': 0.0, 'compound': 0.0}"
124,2020-11-21 16:59:59+00:00,RT Welp I guess we're about to find out if cocaine cures COVID.,"{'neg': 0.0, 'neu': 1.0, 'pos': 0.0, 'compound': 0.0}"
125,2020-11-21 16:59:59+00:00,RT Please think about the health of those working hard to make sure you have what you need and the health of their loved o...,"{'neg': 0.045, 'neu': 0.68, 'pos': 0.275, 'compound': 0.7964}"
126,2020-11-21 16:59:59+00:00,"RT It may be a little early, but Thanksgiving wouldn't be the same without Wanda &amp; Jamal.

In 2016 they went viral when she...","{'neg': 0.0, 'neu': 1.0, 'pos': 0.0, 'compound': 0.0}"
127,2020-11-21 16:59:59+00:00,"It ain't as if all the news on earth migrated from TV, radio and papers after Twitter arrived.

Stop rationalizing stupidity. Stay home.","{'neg': 0.195, 'neu': 0.805, 'pos': 0.0, 'compound': -0.6249}"
128,2020-11-21 17:00:00+00:00,"RT  England local authorities by highest number of COVID-19 positives per 100k population.

7-day rolling rate by s...","{'neg': 0.0, 'neu': 0.773, 'pos': 0.227, 'compound': 0.5719}"
129,2020-11-21 17:00:00+00:00,"Hearing about trouble that family members are having getting tested with possible exposure and/or symptoms, I wonder why isn't curtailing testing for travel-related purposes, in order to assist those more likely to have the virus.

Stay home, folks. Please.","{'neg': 0.064, 'neu': 0.881, 'pos': 0.055, 'compound': -0.1027}"
130,2020-11-21 17:00:00+00:00,RT has entered into interstate commerce pacts with this turf and a host of other Democrat governors buying PPE a...,"{'neg': 0.0, 'neu': 1.0, 'pos': 0.0, 'compound': 0.0}"
131,2020-11-21 17:00:00+00:00,RT I see today's the day that journalists and celebrities who clearly don't know how universities work or have been affected by t...,"{'neg': 0.063, 'neu': 0.83, 'pos': 0.107, 'compound': 0.2732}"
132,2020-11-21 17:00:00+00:00,"If you're planning on traveling #Thanksgiving2020, please don't. Maintain social distancing for your loved ones, for your own safety and for all our sakes.","{'neg': 0.0, 'neu': 0.7, 'pos': 0.3, 'compound': 0.8402}"
133,2020-11-21 17:00:00+00:00,Do you support this?,"{'neg': 0.0, 'neu': 0.526, 'pos': 0.474, 'compound': 0.4019}"
134,2020-11-21 17:00:00+00:00,"Thank you Boris for the lockdown, my liver is now repairing itself and my Bank Manager has sent me an email saying ""well done you're no longer in the red"" I'm now seriously boring and can't wait till the 4th December #covid #lockdown #covid19 #money #alcohol #jobs #jobsinlondon","{'neg': 0.115, 'neu': 0.799, 'pos': 0.086, 'compound': -0.1531}"
135,2020-11-21 17:00:00+00:00,"Expert: Pandemic holiday #Travel safety, risks
#AskAnExpert

https://t.co/fxbieni0KU","{'neg': 0.167, 'neu': 0.397, 'pos': 0.437, 'compound': 0.5267}"
136,2020-11-21 17:00:00+00:00,"As of November 19, there are almost 40,000 pregnant women with COVID-19 in the United States. 

Learn more:","{'neg': 0.0, 'neu': 0.859, 'pos': 0.141, 'compound': 0.4215}"
137,2020-11-21 17:00:00+00:00,"RT I have to believe that some of the current horrific surge in COVID cases--2,000 dying each day--traces back to Trump's cha...","{'neg': 0.173, 'neu': 0.827, 'pos': 0.0, 'compound': -0.6597}"
138,2020-11-21 17:00:00+00:00,RT he has santibodies,"{'neg': 0.0, 'neu': 1.0, 'pos': 0.0, 'compound': 0.0}"
139,2020-11-21 17:00:00+00:00,"With recent announcements by pharmaceutical companies Moderna and Pfizer, two potential COVID-19 vaccines have arrived on the scene. 
https://t.co/LITS7mNjW5","{'neg': 0.0, 'neu': 1.0, 'pos': 0.0, 'compound': 0.0}"
140,2020-11-21 17:00:00+00:00,"#AMAY| Doctor's union says 203 Egyptian doctors died from coronavirus so far
https://t.co/wizFlZy0Dq","{'neg': 0.231, 'neu': 0.769, 'pos': 0.0, 'compound': -0.5574}"
141,2020-11-21 17:00:00+00:00,"Staying healthy to remain mission-ready. An airman receives a nasal swab during pre-deployment #COVID19 testing at Joint Base Langley-Eustis, Va.","{'neg': 0.0, 'neu': 0.876, 'pos': 0.124, 'compound': 0.4019}"
142,2020-11-21 17:00:00+00:00,"RT After meeting w/ Pres. Trump, Michigan Republicans--including Speaker down the Trump Hotel bar last...","{'neg': 0.0, 'neu': 1.0, 'pos': 0.0, 'compound': 0.0}"
143,2020-11-21 17:00:00+00:00,"South Dakota and Kim Reynolds keep their pandemic focus on ""personal responsibility"".

How has that worked out so far?

https://t.co/iIGgOBBv88","{'neg': 0.0, 'neu': 1.0, 'pos': 0.0, 'compound': 0.0}"
144,2020-11-21 17:00:00+00:00,"While leaders around the world are meeting to discuss a raging global pandemic, the 'leader' of the USA is.....(drumroll) golfing. Don't even try to suggest he gives a damn!","{'neg': 0.191, 'neu': 0.809, 'pos': 0.0, 'compound': -0.75}"
145,2020-11-21 17:00:00+00:00,"I keep asking myself that question too. But as soon as Covid hit, I knew it would lead to tRump's undoing.","{'neg': 0.0, 'neu': 1.0, 'pos': 0.0, 'compound': 0.0}"
146,2020-11-21 17:00:00+00:00,"Due to COVID-19, pivoted to online education, yoga, and meditation programs. The Columbia Community Service 74th Annual Appeal launched last week to support them and all the other invaluable organizations keeping our neighborhood going.","{'neg': 0.0, 'neu': 0.884, 'pos': 0.116, 'compound': 0.4939}"
147,2020-11-21 17:00:00+00:00,"If Covid-19's put you off battery farming, try Quorn Turkey Roast. Available at a Whole Food Store, though I couldn't find it online. Many people wouldn't notice the difference, even the post thanks giving turkey sandwiches!

https://t.co/TXunSj2lV0","{'neg': 0.0, 'neu': 0.862, 'pos': 0.138, 'compound': 0.68}"
148,2020-11-21 17:00:00+00:00,"The Provider Relief Fund is distributing $175 billion to eligible healthcare providers in response to the pandemic.
https://t.co/LYceUA5LPD","{'neg': 0.0, 'neu': 0.846, 'pos': 0.154, 'compound': 0.4767}"
149,2020-11-21 17:00:00+00:00,Calling on parents of 17-21 year olds! Covid cases in this age group in Slough are extremely high and still rising. Talk to your young adults about keeping themselves and your family covid safe when out and about. Hands. Face. Space. Help Slough fight covid. #Sloughfightscovid,"{'neg': 0.05, 'neu': 0.835, 'pos': 0.114, 'compound': 0.5093}"
150,2020-11-21 17:00:00+00:00,"""It's when you're running away from yourself, you're literally running away from everything else in your life.""
@thelolapickett 
https://t.co/8HHdrEyOnZ","{'neg': 0.0, 'neu': 1.0, 'pos': 0.0, 'compound': 0.0}"
151,2020-11-21 17:00:00+00:00,"study reveals concerns over food safety, #environment and pandemic #ConsciousConsumer","{'neg': 0.0, 'neu': 0.763, 'pos': 0.237, 'compound': 0.4215}"
152,2020-11-21 17:00:00+00:00,"Claremont reports an additional resident death due to COVID-19 Friday

https://t.co/MuZDQP0jMB","{'neg': 0.281, 'neu': 0.719, 'pos': 0.0, 'compound': -0.5994}"
153,2020-11-21 17:00:00+00:00,Maybe someone should talk to #MoscowMitchMcTraitor cause nothing you do in the House with get done without the #MoscowMitch blessing. He seems stuck on judges and not Americans #covid relief  maybe embrace working across the aisle rather than a whiney little bitch,"{'neg': 0.253, 'neu': 0.702, 'pos': 0.045, 'compound': -0.8654}"
154,2020-11-21 17:00:00+00:00,".@jdubspear explains how the system of production for profit diverts our resources away from the things society urgently needs, specifically covid relief and fighting climate change.

support the podcast here: episode here:","{'neg': 0.064, 'neu': 0.714, 'pos': 0.222, 'compound': 0.7351}"
155,2020-11-21 17:00:00+00:00,COVID19 is spreading across California at a pace we haven't seen since the start of this pandemic. Please make the effort to help all of us by limiting your exposure to public places and if you do need to go out take all necessary precautions. Your actions can help #StopTheSurge!,"{'neg': 0.0, 'neu': 0.855, 'pos': 0.145, 'compound': 0.7901}"
156,2020-11-21 17:00:00+00:00,"*Problem-Reaction-Solution* 

AKA ""Never let a crisis go to waste"" (create one if needed) 

1) Created Problem = #COVID19

2) Designed Reaction = Economic Collapse &amp; Civil Unrest

3) Predetermined Solution = Remove Trump, #TheGreatReset &amp; Global Governance (#BuildBackBetter)","{'neg': 0.176, 'neu': 0.628, 'pos': 0.196, 'compound': -0.0015}"
157,2020-11-21 17:00:00+00:00,"DEADLINE EXTENDED TO 4TH DECEMBER

Need an activity for your young ones?

Check out our multimedia competition for young people!

PS50 or a PS100 online gift card up for grabs

Express thoughts &amp; feelings on diversity, policing or #Covid19

For more info:","{'neg': 0.0, 'neu': 0.928, 'pos': 0.072, 'compound': 0.4926}"
158,2020-11-21 17:00:00+00:00,"OPINION: The second wave of COVID-19 is here, so it's time to hunker down once more. The summer reprieve is over writes Gordon Cameron. #HamOnt #Ancaster #Dundas #HamiltonMountain #StoneyCreek #COVID19

https://t.co/OM1ghrLvD7","{'neg': 0.0, 'neu': 1.0, 'pos': 0.0, 'compound': 0.0}"
159,2020-11-21 17:00:00+00:00,"Take a look at state-wise status of schools reopening across the country here

#COVID19 

https://t.co/Fnc6z1DIO2","{'neg': 0.0, 'neu': 1.0, 'pos': 0.0, 'compound': 0.0}"
160,2020-11-21 17:00:00+00:00,"A third of the way through the year, here are a few observations, based on interviews with leaders in five suburban school districts.","{'neg': 0.0, 'neu': 1.0, 'pos': 0.0, 'compound': 0.0}"
161,2020-11-21 17:00:00+00:00,"Young female entrepreneurs in Windsor-Essex use quarantine downtime to launch businesses

https://t.co/b19oti9GhY","{'neg': 0.0, 'neu': 1.0, 'pos': 0.0, 'compound': 0.0}"
162,2020-11-21 17:00:00+00:00,"Cloud adoption  increased exponentially this year as many companies shifted to #remotework. explores how the pandemic ""validated cloud's value proposition"":","{'neg': 0.0, 'neu': 0.726, 'pos': 0.274, 'compound': 0.6597}"
163,2020-11-21 17:00:00+00:00,"RT What if there was a candlelight vigil, silent, socially distanced, at &amp; C Street NE townho...","{'neg': 0.0, 'neu': 1.0, 'pos': 0.0, 'compound': 0.0}"
164,2020-11-21 17:00:00+00:00,Still waiting for your Coronavirus stimulus check? The deadline to request payment is Saturday at 3pm,"{'neg': 0.0, 'neu': 1.0, 'pos': 0.0, 'compound': 0.0}"
165,2020-11-21 17:00:00+00:00,"Moderna announced on Monday that its vaccine was 94.5% effective at preventing #Covid19, according to interim results. 

https://t.co/ZUg6Ep5tnV","{'neg': 0.054, 'neu': 0.792, 'pos': 0.153, 'compound': 0.4588}"
166,2020-11-21 17:00:01+00:00,An update from the district,"{'neg': 0.0, 'neu': 1.0, 'pos': 0.0, 'compound': 0.0}"
167,2020-11-21 17:00:01+00:00,Both are hopeful to compete at the U.S. Women's Open next month. ,"{'neg': 0.0, 'neu': 0.769, 'pos': 0.231, 'compound': 0.5106}"
168,2020-11-21 17:00:01+00:00,"Alys Tomlinson's portraits highlight the impact of the summer lockdown, capturing teenagers who were unable to attend prom or sit exams due to Covid-19.

On view in the windows of London's Hacklebury Fine Art.","{'neg': 0.0, 'neu': 0.884, 'pos': 0.116, 'compound': 0.4939}"
169,2020-11-21 17:00:01+00:00,"If you have any coronavirus symptoms, you should self-isolate and get a test. You Can book a test through the NHS COVID-19 app or go to  You must book your test in advance to secure a slot. #NorthantsTogether","{'neg': 0.0, 'neu': 0.939, 'pos': 0.061, 'compound': 0.34}"
170,2020-11-21 17:00:01+00:00,"Can we draw parallels between #COVID19 and #cyberattacks? Yes! In both cases, the objective is to stop the virus from spreading. Discover what else they have in common and also some valuable ideas for people managing these crises in our #Blog1Min ","{'neg': 0.048, 'neu': 0.821, 'pos': 0.132, 'compound': 0.5983}"
171,2020-11-21 17:00:01+00:00,"""We are in this together, to the end, no matter what."" Despite delays due to the pandemic, Ms. Carter-Anderson stayed the course &amp; is looking forward to becoming a #foreverfamily with the addition of 4 siblings &amp; filling their home with memories &amp; love. #NationalAdoptionDay","{'neg': 0.022, 'neu': 0.891, 'pos': 0.087, 'compound': 0.6281}"
172,2020-11-21 17:00:01+00:00,"Help prevent the spread of germs and viruses:  
>Catch it  
>Bin it  
>Kill it  

Wash your hands regularly for at least 20 seconds with soap and water. 

For advice, visit","{'neg': 0.132, 'neu': 0.761, 'pos': 0.107, 'compound': -0.4404}"
