,created_at,full_text,sentiment_score
0,2020-11-06 15:59:54+00:00,"Accidental #art in the time of #Coronavirus

While disinfecting some items with sanitizer spray, this happened to the receipt ","{'neg': 0.067, 'neu': 0.933, 'pos': 0.0, 'compound': -0.0772}"
1,2020-11-06 15:59:54+00:00,"Absolutely, and neither Trump nor the PA Republicans cared whether their supporters caught COVID-45 as they dutifully stood in line to cast their in person votes!","{'neg': 0.0, 'neu': 0.8, 'pos': 0.2, 'compound': 0.7177}"
2,2020-11-06 15:59:54+00:00,RT Oh and folks don't forget there's a pandemic happening. I live in a rural area where the case counts are increasing and com...,"{'neg': 0.0, 'neu': 0.932, 'pos': 0.068, 'compound': 0.1695}"
3,2020-11-06 15:59:54+00:00,RT Shamima Begum was a grade A student at 15. No one mentioned her grades when she was groomed online.,"{'neg': 0.104, 'neu': 0.896, 'pos': 0.0, 'compound': -0.296}"
4,2020-11-06 15:59:54+00:00,This is magical!!! ,"{'neg': 0.0, 'neu': 1.0, 'pos': 0.0, 'compound': 0.0}"
5,2020-11-06 15:59:55+00:00,"RT For the MAGA who thought Covid19 was political.  Um, it is getting worse.  That's all for now.","{'neg': 0.154, 'neu': 0.846, 'pos': 0.0, 'compound': -0.4767}"
6,2020-11-06 15:59:55+00:00,"RT Joe Biden is President... call it today, so we can relax all weekend.

Also 113K CoViD cases we documented yesterday.","{'neg': 0.0, 'neu': 0.863, 'pos': 0.137, 'compound': 0.4877}"
7,2020-11-06 15:59:55+00:00,"RT Happy Friday! Turns out the pandemic doesn't just ~stop~ because of the election. So, I took some time yesterday to put...","{'neg': 0.0, 'neu': 0.773, 'pos': 0.227, 'compound': 0.7077}"
8,2020-11-06 15:59:55+00:00,"RT Some things Biden/Harris can do before we have a senate majority:

Deal with the concentration camps at the border and...","{'neg': 0.0, 'neu': 1.0, 'pos': 0.0, 'compound': 0.0}"
9,2020-11-06 15:59:55+00:00,RT We gave Trump the entire 2020 experience. He got COVID &amp; now he is unemployed!,"{'neg': 0.0, 'neu': 1.0, 'pos': 0.0, 'compound': 0.0}"
10,2020-11-06 15:59:55+00:00, - So what's the rules about lockdown?  Do Happy Hippos count as a necessity? ,"{'neg': 0.0, 'neu': 0.762, 'pos': 0.238, 'compound': 0.6199}"
11,2020-11-06 15:59:55+00:00,"RT Dear Yoongi, I wish you a good post-surgery recovery. I look forward to seeing you playing your guitar again but you...","{'neg': 0.0, 'neu': 0.72, 'pos': 0.28, 'compound': 0.6124}"
12,2020-11-06 15:59:55+00:00,Good baseline for every discussion we might wanna have over the next couple of weeks.,"{'neg': 0.0, 'neu': 0.828, 'pos': 0.172, 'compound': 0.4404}"
13,2020-11-06 15:59:55+00:00,"RT Arvind Kejriwal 

Blamed ""festive season"" for spike in COVID cases &amp; poor air quality

Banned Firecrackers in Delhi as...","{'neg': 0.326, 'neu': 0.567, 'pos': 0.106, 'compound': -0.7351}"
14,2020-11-06 15:59:55+00:00,"RT Canadians are proud of the COVID19 response, because they're comparing it the the US.

South Korea has a larger populat...","{'neg': 0.0, 'neu': 0.866, 'pos': 0.134, 'compound': 0.4767}"
15,2020-11-06 15:59:55+00:00,RT Don't believe for a second that the guy who lowered everyone's taxes and built the strongest economy in recent history coul...,"{'neg': 0.061, 'neu': 0.82, 'pos': 0.119, 'compound': 0.34}"
16,2020-11-06 15:59:55+00:00,"RT 125,000 new cases of COVID in America today, by the way.

Little trivia for you there.","{'neg': 0.0, 'neu': 1.0, 'pos': 0.0, 'compound': 0.0}"
17,2020-11-06 15:59:55+00:00,"RT PHILADELPHIA: We need you to urge City Council to pass the Emergency Housing Protection Act, sponsored by","{'neg': 0.133, 'neu': 0.867, 'pos': 0.0, 'compound': -0.3818}"
18,2020-11-06 15:59:55+00:00,"There is so much in this life that is uncertain...Presidential races, COVID outcome, fragmented society. 

It's maddening, the world is constantly shifting and it's hard. 

Now is the time to do something for you...ask God in your life. He is constant, unfaltering &amp; pure love","{'neg': 0.089, 'neu': 0.79, 'pos': 0.121, 'compound': 0.4019}"
19,2020-11-06 15:59:55+00:00,"Bihar's health system is in bad shape, patients in hospitals are in bad condition.

During the epidemic that left Bihar to die, the 15-year-old misrule government in Bihar was in a bad state of health.
#bdlaav_ko_taiyaar_bihaar","{'neg': 0.31, 'neu': 0.69, 'pos': 0.0, 'compound': -0.9371}"
20,2020-11-06 15:59:55+00:00,"Biden ahead / YouTube/FB/Twitter stopping lies, fake news and hate speech / Covid vaccine to potentially kick off early 2021 / Rumours about Putin's resignation in 2021. What a freaking rollercoaster of a week.","{'neg': 0.367, 'neu': 0.633, 'pos': 0.0, 'compound': -0.9349}"
21,2020-11-06 15:59:55+00:00,"You see it only appears I was mocking people with Covid-19, but that's on you and I'm sorry you feel that way.","{'neg': 0.142, 'neu': 0.858, 'pos': 0.0, 'compound': -0.3182}"
22,2020-11-06 15:59:55+00:00,"The ol 99% survival rate pandemic forced mail-in voting swing state delayed counting fraudulent votes of dead people trick

The oldest trick in the book","{'neg': 0.438, 'neu': 0.562, 'pos': 0.0, 'compound': -0.9153}"
23,2020-11-06 15:59:55+00:00,"RT The weekly #COVID19 positivity rate for Fraser Health is now above 7%.

It has continued rising day after day for days now....","{'neg': 0.0, 'neu': 0.87, 'pos': 0.13, 'compound': 0.5106}"
24,2020-11-06 15:59:55+00:00,"RT 18 deaths, 1,300 new COVID-19 cases, and 123 delayed test results by the State are being reported this morning for a cumul...","{'neg': 0.079, 'neu': 0.921, 'pos': 0.0, 'compound': -0.2263}"
25,2020-11-06 15:59:55+00:00,"Pelosi is on tv right now calling Biden President-Elect.. WTF.. 
Does this Bates asshole expect him to leave today? He's still POTUS until January.. 
Now Pelosi wants to pass the Covid relief bill ..unreal.","{'neg': 0.144, 'neu': 0.778, 'pos': 0.078, 'compound': -0.3885}"
26,2020-11-06 15:59:55+00:00,"RT Ford's only plan is to announce big spending numbers with next to no details, timeline, or measures of success. But they c...","{'neg': 0.064, 'neu': 0.842, 'pos': 0.094, 'compound': 0.1901}"
27,2020-11-06 15:59:55+00:00,TODAY (06-11-20) TAMIL NADU  COVID-19 AFFECTED DISTRICT WISE LIST..#tirucci #tmilllnaattu #trichy #tamilnadu #TNCoronaUpdates #tn #COVID19 #Chennai,"{'neg': 0.116, 'neu': 0.694, 'pos': 0.19, 'compound': 0.3612}"
28,2020-11-06 15:59:56+00:00,"RT Dear Yoongi, I wish you a good post-surgery recovery. I look forward to seeing you playing your guitar again but you...","{'neg': 0.0, 'neu': 0.72, 'pos': 0.28, 'compound': 0.6124}"
29,2020-11-06 15:59:56+00:00,RT We gave Trump the entire 2020 experience. He got COVID &amp; now is unemployed!,"{'neg': 0.0, 'neu': 1.0, 'pos': 0.0, 'compound': 0.0}"
30,2020-11-06 15:59:56+00:00,RT Exclusive: 'Covid graphs were wrong in suggesting daily deaths would soon surpass first wave' Th...,"{'neg': 0.167, 'neu': 0.753, 'pos': 0.081, 'compound': -0.3818}"
31,2020-11-06 15:59:56+00:00,"RT Thinking about #Volunteering activity during the November 2020 lockdown?

Please see below for a fantastic decision making...","{'neg': 0.0, 'neu': 0.731, 'pos': 0.269, 'compound': 0.7096}"
32,2020-11-06 15:59:56+00:00,"RT Even if we ignore his blatant dirty factionalism, including unlawfully suspending Jeremy Corbyn despite no Labour Party rules...","{'neg': 0.223, 'neu': 0.619, 'pos': 0.158, 'compound': -0.378}"
33,2020-11-06 15:59:56+00:00,"RT Dear Yoongi, I wish you a good post-surgery recovery. I look forward to seeing you playing your guitar again but you...","{'neg': 0.0, 'neu': 0.72, 'pos': 0.28, 'compound': 0.6124}"
34,2020-11-06 15:59:56+00:00,Need Help! Holiday cancelled due to Covid in Feb/Mar! Vendor can't refund as waiting on refund from airline. Travel Insurance declined - saying go to vendor/bank. Can't do s75 as not a CC purchase! can't do chargeback as over 120 days! What to do? #desperate,"{'neg': 0.083, 'neu': 0.79, 'pos': 0.127, 'compound': 0.5053}"
35,2020-11-06 15:59:56+00:00,"RT You don't stand with veterans b/c if you did, you would have done more for Long Term Care Homes where many veterans di...","{'neg': 0.0, 'neu': 0.878, 'pos': 0.122, 'compound': 0.4939}"
36,2020-11-06 15:59:56+00:00,"RT I really hate that I like  Read this thread, her points are solid","{'neg': 0.209, 'neu': 0.576, 'pos': 0.215, 'compound': -0.2247}"
37,2020-11-06 15:59:56+00:00,"Honestly. Truly. 
God Bless Black Women. ","{'neg': 0.0, 'neu': 0.156, 'pos': 0.844, 'compound': 0.8689}"
38,2020-11-06 15:59:56+00:00,RT Leeds' performing arts sector has come together and issued a joint statement of solidarity and hope for the people of th...,"{'neg': 0.0, 'neu': 0.797, 'pos': 0.203, 'compound': 0.6249}"
39,2020-11-06 15:59:56+00:00,"RT Mini's are notorious for rear brakes nipping up, the disc retaining screws are almost guaranteed to...","{'neg': 0.246, 'neu': 0.754, 'pos': 0.0, 'compound': -0.5994}"
40,2020-11-06 15:59:56+00:00,Climate change will finally matter again :) higher taxes on the rich :) no more racist :) coronavirus will actually be handled properly and actions to control it will be dealt with seriously :),"{'neg': 0.079, 'neu': 0.506, 'pos': 0.415, 'compound': 0.9485}"
41,2020-11-06 15:59:56+00:00,RT We know that the rate of new infections had peaked *before* the imposition of the lockdown in March. And it now seems cl...,"{'neg': 0.0, 'neu': 1.0, 'pos': 0.0, 'compound': 0.0}"
42,2020-11-06 15:59:56+00:00,Yes there is.  Critical treatments continued in the main.  Some treatments can be delayed with a lower risk than catching covid. Many of the cancellations were follow up appointments to discuss blood results.  Some were 'belt and braces' chemo.,"{'neg': 0.188, 'neu': 0.752, 'pos': 0.06, 'compound': -0.5859}"
43,2020-11-06 15:59:56+00:00,RT Imagine there was no mail-in voting. And there were 150 millions americans swarming the voting booths... in a pandemic...,"{'neg': 0.104, 'neu': 0.896, 'pos': 0.0, 'compound': -0.296}"
44,2020-11-06 15:59:56+00:00,"RT Dear Yoongi, I wish you a good post-surgery recovery. I look forward to seeing you playing your guitar again but you...","{'neg': 0.0, 'neu': 0.72, 'pos': 0.28, 'compound': 0.6124}"
45,2020-11-06 15:59:56+00:00,"she wanted to meet us so badly through her concerts but sadly because of the ongoing pandemic, she can't. and now, she's here giving us new contents whenever she can. i love the way that she loves us ","{'neg': 0.117, 'neu': 0.621, 'pos': 0.262, 'compound': 0.8675}"
46,2020-11-06 15:59:56+00:00,"RT There are folks running around on TV blaming progressivism for Dem underperformance.

I was curious, so I decided to open the hood...","{'neg': 0.121, 'neu': 0.792, 'pos': 0.087, 'compound': -0.2263}"
47,2020-11-06 15:59:56+00:00,"RT Teachers went into this school year w/ a chaotic, underfunded return to school plan from the Ont govt.  As we see COVID ent...","{'neg': 0.122, 'neu': 0.878, 'pos': 0.0, 'compound': -0.4939}"
48,2020-11-06 15:59:56+00:00,She's not entirely wrong ,"{'neg': 0.0, 'neu': 0.52, 'pos': 0.48, 'compound': 0.4158}"
49,2020-11-06 15:59:56+00:00,"RT Man. AOC out here responding to left-punching with ""be more good at politics, whiners."" You honestly love to see it. h...","{'neg': 0.053, 'neu': 0.6, 'pos': 0.347, 'compound': 0.8687}"
50,2020-11-06 15:59:56+00:00,"If total deaths are unchanged or less than 2019 where are the ""Covid"" deaths ? They're not in addition to normal deaths, so...they're recategorized deaths that were destined to occur anyway. Nothing says pandemic, nothing.","{'neg': 0.0, 'neu': 1.0, 'pos': 0.0, 'compound': 0.0}"
51,2020-11-06 15:59:56+00:00,"Thank you for worrying about Yoongi's health, health is very important so please let's all take care of the disease , stay healthy and follow the health measures","{'neg': 0.063, 'neu': 0.576, 'pos': 0.361, 'compound': 0.8863}"
52,2020-11-06 15:59:57+00:00,"RT Denmark reports 214 cases of mink-related coronavirus 
#Mutation
#Coronavirus","{'neg': 0.0, 'neu': 1.0, 'pos': 0.0, 'compound': 0.0}"
53,2020-11-06 15:59:57+00:00,"""I can never forgive myself for not breaking the rules to see more of my dad during his final weeks. The GP insisted on writing Covid on the death certificate. However, not only had my father not been tested for Covid, he also never had any symptoms""
https://t.co/QY0KrHFPiJ","{'neg': 0.11, 'neu': 0.89, 'pos': 0.0, 'compound': -0.6921}"
54,2020-11-06 15:59:57+00:00,RT We gave Trump the entire 2020 experience. He got COVID &amp; now is unemployed!,"{'neg': 0.0, 'neu': 1.0, 'pos': 0.0, 'compound': 0.0}"
55,2020-11-06 15:59:57+00:00,"RT My boyfriends dad has recently started his own dog walking business, due to losing his job to covid! He has experience wi...","{'neg': 0.116, 'neu': 0.884, 'pos': 0.0, 'compound': -0.4389}"
56,2020-11-06 15:59:57+00:00,"RT Please don't leave Native Americans out the Arizona vote, especially after everything they went through with COV...","{'neg': 0.0, 'neu': 0.823, 'pos': 0.177, 'compound': 0.3502}"
57,2020-11-06 15:59:57+00:00,Really looking forward to this ,"{'neg': 0.0, 'neu': 1.0, 'pos': 0.0, 'compound': 0.0}"
58,2020-11-06 15:59:57+00:00,RT There is only one organisation that can bring it all together and make it run properly and that is NHS England. They k...,"{'neg': 0.0, 'neu': 1.0, 'pos': 0.0, 'compound': 0.0}"
59,2020-11-06 15:59:57+00:00,"If we  go back into another lockdown or shut down due to COVID-19. Let's all thank those who don't practice social distancing, those having gathering and those who refuse to wear face coverings. At some point accountability starts within first and foremost.","{'neg': 0.049, 'neu': 0.895, 'pos': 0.056, 'compound': 0.0772}"
60,2020-11-06 15:59:57+00:00,"RT Check out this free webinar, ""Skippyjon No: Confronting Mis- and Under-representation of BIPOC Identities in Children's L...","{'neg': 0.075, 'neu': 0.745, 'pos': 0.18, 'compound': 0.5065}"
61,2020-11-06 15:59:57+00:00,"RT There are folks running around on TV blaming progressivism for Dem underperformance.

I was curious, so I decided to open the hood...","{'neg': 0.121, 'neu': 0.792, 'pos': 0.087, 'compound': -0.2263}"
62,2020-11-06 15:59:57+00:00,"Nancy Pelosi is struggling to breath , but at least she's not spewing COVID-19. Just division and lies.","{'neg': 0.259, 'neu': 0.741, 'pos': 0.0, 'compound': -0.6808}"
63,2020-11-06 15:59:57+00:00,RT Trump is doing more to stop ballots than he did to stop Covid,"{'neg': 0.281, 'neu': 0.719, 'pos': 0.0, 'compound': -0.5688}"
64,2020-11-06 15:59:57+00:00,"RT Lots of ""haha Nevada is slow!"" takes, but at the end of the day Nevada legislators ensured every eligible voter could cast a...","{'neg': 0.0, 'neu': 0.909, 'pos': 0.091, 'compound': 0.3164}"
65,2020-11-06 15:59:57+00:00,"RT DR. MOHAMMAD JAWED, 59, of Corbin, Kentucky died of COVID-19 on October 31. 

Born in Pakistan, he was a physician workin...","{'neg': 0.146, 'neu': 0.854, 'pos': 0.0, 'compound': -0.5574}"
66,2020-11-06 15:59:57+00:00,we gave Trump the entire 2020 experience. He got COVID &amp; now is unemployed!,"{'neg': 0.0, 'neu': 1.0, 'pos': 0.0, 'compound': 0.0}"
67,2020-11-06 15:59:58+00:00,"RT LAYNE ADAMS, 49 of Texas died of COVID in October. 

A farmer, he died ""before harvesting his cotton crops so, local farm...","{'neg': 0.255, 'neu': 0.745, 'pos': 0.0, 'compound': -0.802}"
68,2020-11-06 15:59:58+00:00,Some Friday Fun!   Here is the Panther Pandemic Playlist!  #upbsb #9clap #PantherPandemicPlaylist,"{'neg': 0.0, 'neu': 0.739, 'pos': 0.261, 'compound': 0.5972}"
69,2020-11-06 15:59:58+00:00,The lockdown we about to go under in January. WHEW lol,"{'neg': 0.0, 'neu': 0.781, 'pos': 0.219, 'compound': 0.4215}"
70,2020-11-06 15:59:58+00:00,"Quarantine: At home video take one. 
.
.
#THESKINTIQUE 
#quarantinelife 
#spalife 
#newenglandestie 
#waxspecialist 
#facialspecialist","{'neg': 0.0, 'neu': 1.0, 'pos': 0.0, 'compound': 0.0}"
71,2020-11-06 15:59:58+00:00,RT #SRHR and #HIV must not be relegated to the background even as we continue to battle the #Covid_19 pandemic-,"{'neg': 0.12, 'neu': 0.88, 'pos': 0.0, 'compound': -0.3818}"
72,2020-11-06 15:59:58+00:00,RT Big thanks to for the referral and doing all the leg work. This case highlights some of the issues with immi...,"{'neg': 0.0, 'neu': 0.879, 'pos': 0.121, 'compound': 0.4404}"
73,2020-11-06 15:59:58+00:00,"RT There are folks running around on TV blaming progressivism for Dem underperformance.

I was curious, so I decided to open the hood...","{'neg': 0.121, 'neu': 0.792, 'pos': 0.087, 'compound': -0.2263}"
74,2020-11-06 15:59:58+00:00,"Hope we continue with some blended remote/face to face conference and training opportunities post COVID. 

Levels up for people less able to leave home due to disability and/or caring and reduces the North/South divide. 
 
CYPF20 ","{'neg': 0.0, 'neu': 0.76, 'pos': 0.24, 'compound': 0.83}"
75,2020-11-06 15:59:58+00:00,RT We gave Trump the entire 2020 experience. He got COVID &amp; now is unemployed!,"{'neg': 0.0, 'neu': 1.0, 'pos': 0.0, 'compound': 0.0}"
76,2020-11-06 15:59:58+00:00,RT If you are in a vaccine trial please don't do this. #novavax,"{'neg': 0.0, 'neu': 0.839, 'pos': 0.161, 'compound': 0.3182}"
77,2020-11-06 15:59:58+00:00,"RT While the U.S. is focused on the election, the pandemic is not on hold. The country has now crossed another threshold: over 100,00...","{'neg': 0.0, 'neu': 0.898, 'pos': 0.102, 'compound': 0.3818}"
78,2020-11-06 15:59:58+00:00,me and my mom watched my old video dancing as a snowflake told me she's going to enroll me again in ballet after the pandemic.. so guess who's excited,"{'neg': 0.0, 'neu': 0.913, 'pos': 0.087, 'compound': 0.3947}"
79,2020-11-06 15:59:58+00:00,RT Day 2 of Lockdown via the medium of #gardencricket ,"{'neg': 0.0, 'neu': 1.0, 'pos': 0.0, 'compound': 0.0}"
80,2020-11-06 15:59:58+00:00,RT Democrats gladly sacrificed 100's of thousands of Americans to the Chinese virus so they could try to steal this election...,"{'neg': 0.13, 'neu': 0.772, 'pos': 0.098, 'compound': -0.2023}"
81,2020-11-06 15:59:58+00:00,Important thread.,"{'neg': 0.0, 'neu': 0.357, 'pos': 0.643, 'compound': 0.2023}"
82,2020-11-06 15:59:58+00:00," If you missed our webinar yesterday on #AI, #COVID19 and Latin-America and the Caribbean, you can watch the full discussion here 

https://t.co/rPIkUpaq9Z 

#OECDAI","{'neg': 0.091, 'neu': 0.909, 'pos': 0.0, 'compound': -0.296}"
83,2020-11-06 15:59:58+00:00,Wow all of a sudden Pelosi wants to do the coronavirus relief bill. What a witch,"{'neg': 0.112, 'neu': 0.58, 'pos': 0.308, 'compound': 0.6597}"
84,2020-11-06 15:59:58+00:00,"RT LAYNE ADAMS, 49 of Texas died of COVID in October. 

A farmer, he died ""before harvesting his cotton crops so, local farm...","{'neg': 0.255, 'neu': 0.745, 'pos': 0.0, 'compound': -0.802}"
85,2020-11-06 15:59:58+00:00,"Great advice, thank you Mark...","{'neg': 0.0, 'neu': 0.312, 'pos': 0.688, 'compound': 0.765}"
86,2020-11-06 15:59:58+00:00,"In America lucha new, Nebraska's Super Tribi is recovering from Covid","{'neg': 0.0, 'neu': 0.719, 'pos': 0.281, 'compound': 0.5994}"
87,2020-11-06 15:59:58+00:00,RT It's unacceptable and dangerous. I am in disbelief at the Ford government's incompetence and blatant neglect towards our m...,"{'neg': 0.437, 'neu': 0.563, 'pos': 0.0, 'compound': -0.9081}"
88,2020-11-06 15:59:58+00:00,"RT We are soooo happy to say #Confetti is out now 
We can't thank you enough for all the love you've shown us this year. From...","{'neg': 0.064, 'neu': 0.697, 'pos': 0.239, 'compound': 0.7776}"
89,2020-11-06 15:59:58+00:00,RT The House Oversight Committee/intel should immediately open and investigation into whether anyone in the Administration or...,"{'neg': 0.0, 'neu': 1.0, 'pos': 0.0, 'compound': 0.0}"
90,2020-11-06 15:59:58+00:00,RT So I made a 4pm appointment for my Covid test which was confirmed so a big mad rush to get from work to appointment only to...,"{'neg': 0.118, 'neu': 0.882, 'pos': 0.0, 'compound': -0.5367}"
91,2020-11-06 15:59:58+00:00,RT We gave Trump the entire 2020 experience. He got COVID &amp; now is unemployed!,"{'neg': 0.0, 'neu': 1.0, 'pos': 0.0, 'compound': 0.0}"
92,2020-11-06 15:59:58+00:00,"RT even after his disastrous covid  mishandling, trump has gotten more votes than Obama did in 2008. if you think the republi...","{'neg': 0.157, 'neu': 0.843, 'pos': 0.0, 'compound': -0.5994}"
93,2020-11-06 15:59:59+00:00,Bizarre during a pandemic. C'mon man you're not that dumb. You just have terrible political instincts and no regard for the law. Take the L and go find work at OAN or something.,"{'neg': 0.181, 'neu': 0.666, 'pos': 0.153, 'compound': -0.0426}"
94,2020-11-06 15:59:59+00:00,RT Trump said he had evidence Obama wasn't born in the U.S. It never came. Trump said he had the largest inauguration crowd...,"{'neg': 0.0, 'neu': 1.0, 'pos': 0.0, 'compound': 0.0}"
95,2020-11-06 15:59:59+00:00,This is an excellent thread on Dems progressive-blaming.,"{'neg': 0.0, 'neu': 0.654, 'pos': 0.346, 'compound': 0.5719}"
96,2020-11-06 15:59:59+00:00,"RT Dear Yoongi, I wish you a good post-surgery recovery. I look forward to seeing you playing your guitar again but you...","{'neg': 0.0, 'neu': 0.72, 'pos': 0.28, 'compound': 0.6124}"
97,2020-11-06 15:59:59+00:00,"Drawing some different art today. Not a Superheroes but an illustrator who has a biggest dream to become an comicbook artist. Stay at home, drawing  on this november rain. 
#art #ArtistOnTwitter #artwork #illustrationart #yantoliongart","{'neg': 0.0, 'neu': 0.93, 'pos': 0.07, 'compound': 0.3612}"
98,2020-11-06 15:59:59+00:00,"#RT People have come up with many ways to keep themselves busy since travel and social functions have largely been cancelled. We were curious to learn how our team was navigating this COVID ""free"" time. Enjoy our fun Friday video!  #B...","{'neg': 0.04, 'neu': 0.714, 'pos': 0.246, 'compound': 0.8858}"
99,2020-11-06 15:59:59+00:00,"Before his inauguration the battle cry was ""not my President"". Impeach the m'er f'er was the cry in 2018 from the new House members. Not one day spent on helping race relations or pandemic preparedness, not one day of unifying.","{'neg': 0.187, 'neu': 0.766, 'pos': 0.047, 'compound': -0.765}"
100,2020-11-06 15:59:59+00:00,"RT If you have concerns about accessing food or medicines you can call us on 0113 3760330.
For more information on how the n...","{'neg': 0.0, 'neu': 1.0, 'pos': 0.0, 'compound': 0.0}"
101,2020-11-06 15:59:59+00:00,Mardi Gras COVID-19 recommendations include limiting alcohol consumption and stationary floats,"{'neg': 0.0, 'neu': 1.0, 'pos': 0.0, 'compound': 0.0}"
102,2020-11-06 15:59:59+00:00,"Italy Reports Daily New Coronavirus Cases Up 9.5% Day-Over-Day To Record High Of 37,809; Reports 446 Deaths Over Last 24 Hours","{'neg': 0.0, 'neu': 1.0, 'pos': 0.0, 'compound': 0.0}"
103,2020-11-06 15:59:59+00:00,"With last night's game as a guide, the NFL is intent on playing through.  Business of sports over abundance of caution.","{'neg': 0.0, 'neu': 0.917, 'pos': 0.083, 'compound': 0.2023}"
104,2020-11-06 15:59:59+00:00,"Hindi ako makatulog. Grabe 

This pandemic is somehow a blessing in disguise for her. She is so Blessed that God gave them time to be with each other everyday in the last 7 months. That is so fulfilling on her part. Na makasama at mapagsilbihan ang nanay mo hanggang sa huli.","{'neg': 0.034, 'neu': 0.789, 'pos': 0.177, 'compound': 0.8609}"
105,2020-11-06 15:59:59+00:00,"RT BREAKING--U.S. sets a new utterly insane record of 120,048 #COVID19 cases today.

We have never even passed 110,000 threshol...","{'neg': 0.136, 'neu': 0.864, 'pos': 0.0, 'compound': -0.4576}"
106,2020-11-06 15:59:59+00:00,Absolutely,"{'neg': 0.0, 'neu': 1.0, 'pos': 0.0, 'compound': 0.0}"
107,2020-11-06 15:59:59+00:00,"RT The insanity of Trump is also the banality of Trump:

Institutions slashed &amp; burned b/c he's can't admit Russia helped hi...","{'neg': 0.275, 'neu': 0.725, 'pos': 0.0, 'compound': -0.7345}"
108,2020-11-06 15:59:59+00:00,Just because he doesn't concede doesn't mean his butt won't be out of The WH in January. Just like when he said no one will be talking about Covid after November 4th doesn't mean it went away.,"{'neg': 0.055, 'neu': 0.882, 'pos': 0.063, 'compound': 0.0772}"
109,2020-11-06 15:59:59+00:00,"Inaugural committee ought not be thinking about attendance at all. Pandemic? Unrest? Important work to do. Hoping for somber, visual, highly symbolic ceremony w/o super spreader crowds.","{'neg': 0.081, 'neu': 0.664, 'pos': 0.256, 'compound': 0.7236}"
110,2020-11-06 15:59:59+00:00,RT We gave Trump the entire 2020 experience. He got COVID &amp; now is unemployed!,"{'neg': 0.0, 'neu': 1.0, 'pos': 0.0, 'compound': 0.0}"
111,2020-11-06 15:59:59+00:00, Unbedingt lesen liebe MS Community #multiplesklerose #MultipleSclerosis,"{'neg': 0.0, 'neu': 1.0, 'pos': 0.0, 'compound': 0.0}"
112,2020-11-06 15:59:59+00:00,"RT even after his disastrous covid  mishandling, trump has gotten more votes than Obama did in 2008. if you think the republi...","{'neg': 0.157, 'neu': 0.843, 'pos': 0.0, 'compound': -0.5994}"
113,2020-11-06 15:59:59+00:00,RT Is the adherence of Trump supporters a mental health issue?  I will not shy away from saying it is!  But some characteristi...,"{'neg': 0.0, 'neu': 0.853, 'pos': 0.147, 'compound': 0.3843}"
114,2020-11-06 15:59:59+00:00,No cap,"{'neg': 0.688, 'neu': 0.312, 'pos': 0.0, 'compound': -0.296}"
115,2020-11-06 15:59:59+00:00,"RT Dear Yoongi, I wish you a good post-surgery recovery. I look forward to seeing you playing your guitar again but you...","{'neg': 0.0, 'neu': 0.72, 'pos': 0.28, 'compound': 0.6124}"
116,2020-11-06 15:59:59+00:00,"Welp, I'm never going to chipotle again. 5 team members sitting down not wearing masks and coughing and laughing at the table...THERES A PANDEMIC!! #chipotle","{'neg': 0.0, 'neu': 0.864, 'pos': 0.136, 'compound': 0.5837}"
