,created_at,full_text,sentiment_score
0,2020-11-06 18:59:54+00:00,"RT How can you spend more on palliatives than education, heath and agriculture

ASUU only asked for N110bn and FG said ""No m...","{'neg': 0.0, 'neu': 1.0, 'pos': 0.0, 'compound': 0.0}"
1,2020-11-06 18:59:54+00:00,"RT There are folks running around on TV blaming progressivism for Dem underperformance.

I was curious, so I decided to open the hood...","{'neg': 0.121, 'neu': 0.792, 'pos': 0.087, 'compound': -0.2263}"
2,2020-11-06 18:59:54+00:00,"RT This is horrendous. We need sane leadership, not a president who threatens slyly that he'll fire Tony Fauci after the electio...","{'neg': 0.317, 'neu': 0.683, 'pos': 0.0, 'compound': -0.8316}"
3,2020-11-06 18:59:54+00:00,"Do you want to become a Girl Scout? Here is how to sign up amid the COVID-19 pandemic. 

https://t.co/EpQyS5DBNY","{'neg': 0.0, 'neu': 0.933, 'pos': 0.067, 'compound': 0.0772}"
4,2020-11-06 18:59:55+00:00,and yes they are,"{'neg': 0.0, 'neu': 0.526, 'pos': 0.474, 'compound': 0.4019}"
5,2020-11-06 18:59:55+00:00,"RT 5.   Indeed, that is the real purpose of, among other things, mail-in voting, which Nancy Pelosi and the Democrats have...","{'neg': 0.0, 'neu': 1.0, 'pos': 0.0, 'compound': 0.0}"
6,2020-11-06 18:59:55+00:00,"Our podcast with is live now on all streaming services! Discussing lockdown 2, working with Noel G and what the future holds, it's a great watch!

https://t.co/pFO3hP4lLM","{'neg': 0.0, 'neu': 0.847, 'pos': 0.153, 'compound': 0.6892}"
7,2020-11-06 18:59:55+00:00,"M. TRUMP, it's look like election results, but it's the #Covid Map.
@JoeBiden for President.","{'neg': 0.0, 'neu': 0.889, 'pos': 0.111, 'compound': 0.1901}"
8,2020-11-06 18:59:55+00:00,RT Random reminder that the White House response to a deadly pandemic is currently being helmed by a radiologist whose Fox hits...,"{'neg': 0.0, 'neu': 1.0, 'pos': 0.0, 'compound': 0.0}"
9,2020-11-06 18:59:55+00:00,Testing times in Liverpool - why Merseyside trial might be key to lockdown exit -,"{'neg': 0.0, 'neu': 1.0, 'pos': 0.0, 'compound': 0.0}"
10,2020-11-06 18:59:55+00:00,"Honest &amp; frank assessment. Loved it. You come out of 8 months of Lockdown and expect them to perform 2 times in less than 24 hrs, not fair.

Time to have atleast a 4 team double round robin Women's IPL 2021 onwards. It's time!","{'neg': 0.039, 'neu': 0.813, 'pos': 0.148, 'compound': 0.7601}"
11,2020-11-06 18:59:55+00:00,"Stressed out stay-at-home mom, overworked nursery worker, despairing single parent: in all of your mundane daily tasks of childcare, you are having a real interaction with the living God.
Mark 9:37","{'neg': 0.159, 'neu': 0.782, 'pos': 0.059, 'compound': -0.5574}"
12,2020-11-06 18:59:55+00:00,"RT JUST IN: 14 deaths reported from covid-19, highest death toll in a single day(5th November) reported by","{'neg': 0.187, 'neu': 0.813, 'pos': 0.0, 'compound': -0.5994}"
13,2020-11-06 18:59:55+00:00,RT Just want take a moment today to mention that Donald Trump knew how deadly and infectious COVID-19 is. He told Bob Woodward...,"{'neg': 0.0, 'neu': 0.944, 'pos': 0.056, 'compound': 0.0772}"
14,2020-11-06 18:59:55+00:00,"RT Editor: As we are in lockdown, we have taken the difficult decision to publish this latest issue online only in November in t...","{'neg': 0.098, 'neu': 0.902, 'pos': 0.0, 'compound': -0.3612}"
15,2020-11-06 18:59:55+00:00,"RT Good Grief he just goes on and on Grandstanding. Saying and doing absolutely nothing useful.We need a better plan.
#GSMF...","{'neg': 0.119, 'neu': 0.667, 'pos': 0.215, 'compound': 0.3818}"
16,2020-11-06 18:59:55+00:00,moving back in with family at 27 (due to a deadly pandemic decimating your industry) is really fun because you can do shit like this and not get in trouble for it,"{'neg': 0.09, 'neu': 0.701, 'pos': 0.209, 'compound': 0.5791}"
17,2020-11-06 18:59:55+00:00,"RT Just spoke to a friend who works at Athens airport, he told me that domestic flights are booked to almost full capacity as...","{'neg': 0.0, 'neu': 0.878, 'pos': 0.122, 'compound': 0.4939}"
18,2020-11-06 18:59:55+00:00,"RT Canada getting prepared to distribute #COVID19 vaccines:

""...wants a company that can begin work in mid-December in order...","{'neg': 0.0, 'neu': 0.905, 'pos': 0.095, 'compound': 0.2263}"
19,2020-11-06 18:59:55+00:00,RT If corona ruins my 18th next year i'll genuinely be so sad ,"{'neg': 0.385, 'neu': 0.615, 'pos': 0.0, 'compound': -0.784}"
20,2020-11-06 18:59:55+00:00,RT Perfect time for everyone that wants a small intimate wedding to get married! Just invite your closest 1000!,"{'neg': 0.0, 'neu': 0.743, 'pos': 0.257, 'compound': 0.7081}"
21,2020-11-06 18:59:55+00:00,Comment: M&amp;S can sell clothing in lockdown- but should it? -,"{'neg': 0.0, 'neu': 1.0, 'pos': 0.0, 'compound': 0.0}"
22,2020-11-06 18:59:55+00:00,"Most deaths are not Covid.  Most infections are not Covid.  The boob-toob won't tell you this.  A huge amount of Covid news is being censored or lightly covered, news that contradicts the official narrative.","{'neg': 0.107, 'neu': 0.831, 'pos': 0.062, 'compound': -0.1779}"
23,2020-11-06 18:59:55+00:00,"RT One more note. In May and June, when Dem voter registration had bottomed out due to the pandemic and GOPs were outregistering...","{'neg': 0.0, 'neu': 1.0, 'pos': 0.0, 'compound': 0.0}"
24,2020-11-06 18:59:55+00:00,"The U.S. Air Force and U.S. Army, you say? Anybody else know how they can assist the republic in a time like this?","{'neg': 0.0, 'neu': 0.885, 'pos': 0.115, 'compound': 0.4329}"
25,2020-11-06 18:59:55+00:00,"The cases of coronavirus are seriously rising again , stay safe .","{'neg': 0.116, 'neu': 0.685, 'pos': 0.199, 'compound': 0.296}"
26,2020-11-06 18:59:55+00:00,"RT Google mobility data in U.S. slowly declining, probably as people react to growing epidemics and reduce activity. Effe...","{'neg': 0.0, 'neu': 0.914, 'pos': 0.086, 'compound': 0.1779}"
27,2020-11-06 18:59:55+00:00,"RT UK study to probe aspirin's potential as coronavirus drug ~

https://t.co/7ElHhpisV8 ~","{'neg': 0.0, 'neu': 1.0, 'pos': 0.0, 'compound': 0.0}"
28,2020-11-06 18:59:55+00:00,"Covid-19 Reveals How Obesity Harms The Body In Real Time, Not Just Over A Lifetime: The COVID-19 pandemic has thrust the obesity epidemic once again into the spotlight, revealing that obesity is no longer a disease that harms just in the long run but one","{'neg': 0.121, 'neu': 0.879, 'pos': 0.0, 'compound': -0.5859}"
29,2020-11-06 18:59:56+00:00,First Lockdown things changed weekly.... This 2nd one is daily lol,"{'neg': 0.0, 'neu': 0.781, 'pos': 0.219, 'compound': 0.4215}"
30,2020-11-06 18:59:56+00:00,"RT Not to be a COVID-19 cop, but cases are back at record highs and a lot of people I fucking love are doing big parties...","{'neg': 0.0, 'neu': 0.71, 'pos': 0.29, 'compound': 0.8954}"
31,2020-11-06 18:59:56+00:00,"RT United Kingdom Daily Coronavirus (COVID-19) Report * Friday 6th November.

23,287 new cases (people positive) reported,...","{'neg': 0.0, 'neu': 0.701, 'pos': 0.299, 'compound': 0.7506}"
32,2020-11-06 18:59:56+00:00,"RT Google mobility data in U.S. slowly declining, probably as people react to growing epidemics and reduce activity. Effe...","{'neg': 0.0, 'neu': 0.914, 'pos': 0.086, 'compound': 0.1779}"
33,2020-11-06 18:59:56+00:00,"It's not a lie lol, it's also lockdown so I won't be seeing anyone ","{'neg': 0.152, 'neu': 0.848, 'pos': 0.0, 'compound': -0.3252}"
34,2020-11-06 18:59:56+00:00,RT We gave Trump the entire 2020 experience. He got COVID &amp; now is unemployed!,"{'neg': 0.0, 'neu': 1.0, 'pos': 0.0, 'compound': 0.0}"
35,2020-11-06 18:59:56+00:00,It always was going to go to court lol this is why the should've never done mail in voting. Fauci and cdc said it's safe to vote in person lol,"{'neg': 0.0, 'neu': 0.761, 'pos': 0.239, 'compound': 0.8176}"
36,2020-11-06 18:59:56+00:00,"RT Earlier this year when the FG introduced lockdown, one of the faces of posted a tweet that she was looking...","{'neg': 0.0, 'neu': 1.0, 'pos': 0.0, 'compound': 0.0}"
37,2020-11-06 18:59:56+00:00,"RT I know there's a lot of focus on the election, but we cannot forget the virus. Yesterday we had more than 121,000 new Co...","{'neg': 0.0, 'neu': 0.923, 'pos': 0.077, 'compound': 0.2498}"
38,2020-11-06 18:59:56+00:00,"Never forget that Republicans elected a dead Republican official for a seat.

https://t.co/DaxLuNveKw","{'neg': 0.253, 'neu': 0.648, 'pos': 0.098, 'compound': -0.5624}"
39,2020-11-06 18:59:56+00:00,"RT Since so many cases are asymptomatic, it's expected. And many sick are never tested because they are not seen medically. h...","{'neg': 0.136, 'neu': 0.864, 'pos': 0.0, 'compound': -0.5106}"
40,2020-11-06 18:59:56+00:00,Great partnership  and equally great beer   #Grow2Row #loxless,"{'neg': 0.0, 'neu': 0.423, 'pos': 0.577, 'compound': 0.8481}"
41,2020-11-06 18:59:56+00:00,RT Trump is fighting harder to stop the count than he did to stop the spread of COVID.,"{'neg': 0.315, 'neu': 0.685, 'pos': 0.0, 'compound': -0.7096}"
42,2020-11-06 18:59:56+00:00,"RT Accountability isn't tribal politics, it's honest politics. Spread that on your scones.","{'neg': 0.0, 'neu': 0.784, 'pos': 0.216, 'compound': 0.5106}"
43,2020-11-06 18:59:56+00:00,RT Did he feel sorry for the children when he was putting them in cages.. Did he feel sorry for so many lives...,"{'neg': 0.11, 'neu': 0.89, 'pos': 0.0, 'compound': -0.1531}"
44,2020-11-06 18:59:56+00:00,"RT One more note. In May and June, when Dem voter registration had bottomed out due to the pandemic and GOPs were outregistering...","{'neg': 0.0, 'neu': 1.0, 'pos': 0.0, 'compound': 0.0}"
45,2020-11-06 18:59:56+00:00,RT We gave Trump the entire 2020 experience. He got COVID &amp; now is unemployed!,"{'neg': 0.0, 'neu': 1.0, 'pos': 0.0, 'compound': 0.0}"
46,2020-11-06 18:59:57+00:00,"Useful Information-- Important, Interesting Study: #COVID-19 ""super-spreading"" events play outsized role in overall disease transmission | MIT News | Massachusetts Institute of Technology","{'neg': 0.0, 'neu': 0.66, 'pos': 0.34, 'compound': 0.8316}"
47,2020-11-06 18:59:57+00:00,RT We gave Trump the entire 2020 experience. He got COVID &amp; now is unemployed!,"{'neg': 0.0, 'neu': 1.0, 'pos': 0.0, 'compound': 0.0}"
48,2020-11-06 18:59:57+00:00,RT  Reggie is a great state rep and runs an amazing group that turned out the vote!,"{'neg': 0.0, 'neu': 0.647, 'pos': 0.353, 'compound': 0.8478}"
49,2020-11-06 18:59:57+00:00,There's gonna be a lockdown this month after election,"{'neg': 0.0, 'neu': 1.0, 'pos': 0.0, 'compound': 0.0}"
50,2020-11-06 18:59:57+00:00,"U.S. smashes day-old daily Covid-19 record with more than 120,000 new infections
https://t.co/Lt5YFeJarr By","{'neg': 0.0, 'neu': 1.0, 'pos': 0.0, 'compound': 0.0}"
51,2020-11-06 18:59:57+00:00,"RT Trump: ""We'll release the voter fraud proof with the Coronavirus vaccine and my taxes, in about 2 weeks"".","{'neg': 0.174, 'neu': 0.826, 'pos': 0.0, 'compound': -0.5859}"
52,2020-11-06 18:59:57+00:00,"RT Even as America has been riveted by the election drama, doctors, nurses, orderlies, paramedics, and all the others on the me...","{'neg': 0.0, 'neu': 1.0, 'pos': 0.0, 'compound': 0.0}"
53,2020-11-06 18:59:57+00:00,"RT Where's the coronavirus stimulus bill. 

#TrumpDeathToll236K and rising.","{'neg': 0.0, 'neu': 1.0, 'pos': 0.0, 'compound': 0.0}"
54,2020-11-06 18:59:57+00:00,"RT Where's the coronavirus stimulus bill. 

#TrumpDeathToll236K and rising.","{'neg': 0.0, 'neu': 1.0, 'pos': 0.0, 'compound': 0.0}"
55,2020-11-06 18:59:57+00:00,"RT One more note. In May and June, when Dem voter registration had bottomed out due to the pandemic and GOPs were outregistering...","{'neg': 0.0, 'neu': 1.0, 'pos': 0.0, 'compound': 0.0}"
56,2020-11-06 18:59:57+00:00,"RT Dear Yoongi, I wish you a good post-surgery recovery. I look forward to seeing you playing your guitar again but you...","{'neg': 0.0, 'neu': 0.72, 'pos': 0.28, 'compound': 0.6124}"
57,2020-11-06 18:59:57+00:00,"RT Student Paramedics check out the below, great opportunities to network and have a direct input to the topical presentati...","{'neg': 0.0, 'neu': 0.729, 'pos': 0.271, 'compound': 0.7717}"
58,2020-11-06 18:59:57+00:00,"RT Trump: ""We'll release the voter fraud proof with the Coronavirus vaccine and my taxes, in about 2 weeks"".","{'neg': 0.174, 'neu': 0.826, 'pos': 0.0, 'compound': -0.5859}"
59,2020-11-06 18:59:57+00:00,"Nov 6, covid-19 research and policy briefing","{'neg': 0.0, 'neu': 1.0, 'pos': 0.0, 'compound': 0.0}"
60,2020-11-06 18:59:57+00:00,"RT Trump: ""We'll release the voter fraud proof with the Coronavirus vaccine and my taxes, in about 2 weeks"".","{'neg': 0.174, 'neu': 0.826, 'pos': 0.0, 'compound': -0.5859}"
61,2020-11-06 18:59:57+00:00,RT Forget the rhetoric &amp; just look at the net effect of the corporate-owned duopoly since the pandemic started: There was qui...,"{'neg': 0.083, 'neu': 0.917, 'pos': 0.0, 'compound': -0.2263}"
62,2020-11-06 18:59:57+00:00,"Taking a swing at Whole Foods for their ill thought out poppy policy is a really great way for Doug to show he's actually being tough on something.

Now do COVID.","{'neg': 0.117, 'neu': 0.763, 'pos': 0.12, 'compound': 0.2716}"
63,2020-11-06 18:59:57+00:00,"Attention, please!","{'neg': 0.0, 'neu': 0.278, 'pos': 0.722, 'compound': 0.3802}"
64,2020-11-06 18:59:57+00:00,Telling my grandkids how I survived the pandemic,"{'neg': 0.0, 'neu': 0.68, 'pos': 0.32, 'compound': 0.5106}"
65,2020-11-06 18:59:57+00:00,RT When you're stuck in lockdown but  the urge to rave is far too strong ,"{'neg': 0.079, 'neu': 0.686, 'pos': 0.235, 'compound': 0.6059}"
66,2020-11-06 18:59:57+00:00,RT Democrats have spent the last two days blaming the very folks who saved the party.,"{'neg': 0.146, 'neu': 0.592, 'pos': 0.262, 'compound': 0.3744}"
67,2020-11-06 18:59:57+00:00,They are just the real deal.,"{'neg': 0.0, 'neu': 1.0, 'pos': 0.0, 'compound': 0.0}"
68,2020-11-06 18:59:57+00:00,"RT How can you spend more on palliatives than education, heath and agriculture

ASUU only asked for N110bn and FG said ""No m...","{'neg': 0.0, 'neu': 1.0, 'pos': 0.0, 'compound': 0.0}"
69,2020-11-06 18:59:58+00:00,RT It's good for the Terror Belli . Automated social distancing with ghastly olfactory  implications.,"{'neg': 0.176, 'neu': 0.674, 'pos': 0.15, 'compound': -0.128}"
70,2020-11-06 18:59:58+00:00,"RT Today's case numbers, combined with the staffing and capacity issues hospitals are currently facing, is terrifying to me and...","{'neg': 0.163, 'neu': 0.837, 'pos': 0.0, 'compound': -0.5719}"
71,2020-11-06 18:59:58+00:00,COVID,"{'neg': 0.0, 'neu': 1.0, 'pos': 0.0, 'compound': 0.0}"
72,2020-11-06 18:59:58+00:00,"RT A temperature, new continuous cough, or a loss or change to sense of smell or taste could be Coronavirus. If you have any of the...","{'neg': 0.084, 'neu': 0.916, 'pos': 0.0, 'compound': -0.3182}"
73,2020-11-06 18:59:58+00:00,"RT Despite my many many many many misgivings about Biden as a politician and as a person, I cannot begin to express my reli...","{'neg': 0.0, 'neu': 1.0, 'pos': 0.0, 'compound': 0.0}"
74,2020-11-06 18:59:58+00:00,RT People who don't wear facemasks in this pandemic and people who don't wear condoms with new sexual partners are in the s...,"{'neg': 0.0, 'neu': 1.0, 'pos': 0.0, 'compound': 0.0}"
75,2020-11-06 18:59:58+00:00," Lockdown with me 

For all of November my OF is 50% off ($5)!

 No PPV and fully explicit solo, b/g and anal content is included! 

 Also, sub with this deal and message me for FREE access to my private snap  

 ","{'neg': 0.049, 'neu': 0.848, 'pos': 0.103, 'compound': 0.5294}"
76,2020-11-06 18:59:58+00:00,"Well, I'm pretty sure what I have is a cold. The flu would give me a sore throat, which I don't have, and I'm cognizant, so it isn't COVID-19. It's all sinus pressure and nose-blowing.

Colds suck, I'll get over this. Streaming with a cold isn't a good thing.","{'neg': 0.206, 'neu': 0.67, 'pos': 0.124, 'compound': -0.6131}"
77,2020-11-06 18:59:58+00:00,"Change the record, you can't excuse everything because of Covid 19.","{'neg': 0.109, 'neu': 0.891, 'pos': 0.0, 'compound': -0.0572}"
78,2020-11-06 18:59:58+00:00,RT Mayor Hancock says we are on the verge of another Stay at Home Order if we don't act urgently.,"{'neg': 0.0, 'neu': 1.0, 'pos': 0.0, 'compound': 0.0}"
79,2020-11-06 18:59:58+00:00,I don't want to laugh but LMAO,"{'neg': 0.227, 'neu': 0.296, 'pos': 0.477, 'compound': 0.7489}"
80,2020-11-06 18:59:58+00:00,"Love it when my government says ""C'mon bro, why"" ... very similar to how they are handling the pandemic...","{'neg': 0.0, 'neu': 0.811, 'pos': 0.189, 'compound': 0.6369}"
81,2020-11-06 18:59:58+00:00,So while Lindsay and Ted are trying to deliver another 4 years of death and destruction anybody in the GOP know that Covid is spreading like wildfire. Anybody? Your maniac has rallied us to worst case scenario. 126k infected yesterday. They're likely your people not mine.,"{'neg': 0.298, 'neu': 0.661, 'pos': 0.041, 'compound': -0.9477}"
82,2020-11-06 18:59:58+00:00,RT We've launched a GoFundMe to raise money for our law suit against Ofcom to get it to withdraw its censorious 'coronavirus...,"{'neg': 0.0, 'neu': 0.933, 'pos': 0.067, 'compound': 0.128}"
83,2020-11-06 18:59:58+00:00,RT We gave Trump the entire 2020 experience. He got COVID &amp; now is unemployed!,"{'neg': 0.0, 'neu': 1.0, 'pos': 0.0, 'compound': 0.0}"
84,2020-11-06 18:59:58+00:00,"RT In this country, as across much of Europe, the virus is spreading even faster than the reasonable worst case scenario of...","{'neg': 0.163, 'neu': 0.837, 'pos': 0.0, 'compound': -0.6249}"
85,2020-11-06 18:59:58+00:00,"COVID is not going away. True, it's just a mild flu, but the globalists will use this to take down the whole world. The laptop? It's going in the trash","{'neg': 0.11, 'neu': 0.89, 'pos': 0.0, 'compound': -0.354}"
86,2020-11-06 18:59:58+00:00,"RT  You can find our latest coronavirus guidance on our website  

Plus, you can find official...","{'neg': 0.0, 'neu': 1.0, 'pos': 0.0, 'compound': 0.0}"
87,2020-11-06 18:59:58+00:00,"RT BREAKING:  More than 17,000 Florida residents have reportedly died from COVID-19","{'neg': 0.247, 'neu': 0.753, 'pos': 0.0, 'compound': -0.5574}"
88,2020-11-06 18:59:58+00:00,"RT BREAKING--U.S. sets a new utterly insane record of 120,048 #COVID19 cases today.

We have never even passed 110,000 threshol...","{'neg': 0.136, 'neu': 0.864, 'pos': 0.0, 'compound': -0.4576}"
89,2020-11-06 18:59:59+00:00,"RT I'll just leave this here...
https://t.co/HGAnSU5P2F","{'neg': 0.167, 'neu': 0.833, 'pos': 0.0, 'compound': -0.0516}"
90,2020-11-06 18:59:59+00:00,"It's too bad he doesn't have any other work to keep him busy and take his mind off things, like maybe fighting a pandemic or providing economic relief to individuals and small businesses.","{'neg': 0.148, 'neu': 0.714, 'pos': 0.138, 'compound': -0.1027}"
91,2020-11-06 18:59:59+00:00,RT Our economy is tanking &amp; we're in a spiraling public health crisis because Republicans have refused to do what is nece...,"{'neg': 0.24, 'neu': 0.76, 'pos': 0.0, 'compound': -0.743}"
92,2020-11-06 18:59:59+00:00,"RT Nov. 6, 1918 Daily Colonist reported on the Spanish flu-postponed Vancouver annual meeting of the Pacific Coast Hockey...","{'neg': 0.0, 'neu': 1.0, 'pos': 0.0, 'compound': 0.0}"
93,2020-11-06 18:59:59+00:00,RT QN5. 27%of casual workers say the #coronavirus is directly responsible for the loss of their income. With #COVID19 numbers...,"{'neg': 0.098, 'neu': 0.726, 'pos': 0.175, 'compound': 0.2023}"
94,2020-11-06 18:59:59+00:00,"RT How is it that more 90-year-olds registered to vote in one year, during a pandemic, than at any point in Pennsylvania hi...","{'neg': 0.0, 'neu': 1.0, 'pos': 0.0, 'compound': 0.0}"
95,2020-11-06 18:59:59+00:00,"I've been back in England since February, as much as I love my country, I so desperately miss my beautiful home and friends in San Francisco. When will this pandemic end  ","{'neg': 0.124, 'neu': 0.613, 'pos': 0.264, 'compound': 0.7879}"
96,2020-11-06 18:59:59+00:00,"Croatia COVID-19 Update November 6: 2,890 New Cases, 15,567 Active via #Croatia recorded 2,890 #COVID19 cases, 15,567 active cases, 1,307 hospitalized, 135 on ventilators, 34 died, 2,645 recovered, 33,467 in self-isolation and 9,317 tested.","{'neg': 0.09, 'neu': 0.775, 'pos': 0.135, 'compound': 0.2023}"
97,2020-11-06 18:59:59+00:00,You equated crowd size with support. You also talked about fraud. I've seen claims without any evidence. Kinda like people claiming Bigfoot is real.. Covid? Yes they have. Yesterday set a record for new cases in the US. Saw that on CNN. Thanks for playing.,"{'neg': 0.069, 'neu': 0.708, 'pos': 0.223, 'compound': 0.7584}"
98,2020-11-06 18:59:59+00:00,"RT So after #Denmark cull 17 million #Mink, that will be 85,000 dead mink per person infected. Sound policy decisions.","{'neg': 0.294, 'neu': 0.706, 'pos': 0.0, 'compound': -0.8176}"
99,2020-11-06 18:59:59+00:00,RT Brilliant this,"{'neg': 0.0, 'neu': 0.345, 'pos': 0.655, 'compound': 0.5859}"
100,2020-11-06 18:59:59+00:00,"I'm a Vietnamese and it's ridiculous that you blame your incumbent president for the deaths of covid-19. Look at yourself first before finding someone to blame. Americans protested to stop the quarantine, they are so angry about mask,... and now you blame Trump.","{'neg': 0.329, 'neu': 0.671, 'pos': 0.0, 'compound': -0.9397}"
101,2020-11-06 18:59:59+00:00,One poll worker in Missouri just died of COVID-19.,"{'neg': 0.31, 'neu': 0.69, 'pos': 0.0, 'compound': -0.5574}"
102,2020-11-06 18:59:59+00:00,"RT France reports record 60,000 new coronavirus cases, more than 800 new deaths

- New cases: 60,486
- Positivity rate: N/A
- In...","{'neg': 0.0, 'neu': 0.87, 'pos': 0.13, 'compound': 0.5106}"
103,2020-11-06 18:59:59+00:00,"RT How is it that more 90-year-olds registered to vote in one year, during a pandemic, than at any point in Pennsylvania hi...","{'neg': 0.0, 'neu': 1.0, 'pos': 0.0, 'compound': 0.0}"
104,2020-11-06 18:59:59+00:00,"RT A lot of the people hate him too.

He has had a long career as a criminal, abused his power in office, let a pande...","{'neg': 0.311, 'neu': 0.689, 'pos': 0.0, 'compound': -0.886}"
105,2020-11-06 18:59:59+00:00,"RT One more note. In May and June, when Dem voter registration had bottomed out due to the pandemic and GOPs were outregistering...","{'neg': 0.0, 'neu': 1.0, 'pos': 0.0, 'compound': 0.0}"
106,2020-11-06 18:59:59+00:00,"RT There are folks running around on TV blaming progressivism for Dem underperformance.

I was curious, so I decided to open the hood...","{'neg': 0.121, 'neu': 0.792, 'pos': 0.087, 'compound': -0.2263}"
107,2020-11-06 18:59:59+00:00,Here are 5 principles leaders should follow in order to overcome challenges during the pandemic.,"{'neg': 0.0, 'neu': 0.915, 'pos': 0.085, 'compound': 0.0772}"
108,2020-11-06 18:59:59+00:00,You think that China and the Dems conspired to have Covid ravage this country to own Trump.  Have you considered the logistics and minute detail that would take to accomplish?,"{'neg': 0.0, 'neu': 0.912, 'pos': 0.088, 'compound': 0.4215}"
109,2020-11-06 18:59:59+00:00,RT Here's another report. Shameful.,"{'neg': 0.444, 'neu': 0.556, 'pos': 0.0, 'compound': -0.4939}"
110,2020-11-06 18:59:59+00:00,"Lebanon lists 17 COVID-19 fatalities, 2,142 infections 
https://t.co/6gji4xACyK 
#KUNA","{'neg': 0.328, 'neu': 0.672, 'pos': 0.0, 'compound': -0.5994}"
111,2020-11-06 18:59:59+00:00,"RT Even as America has been riveted by the election drama, doctors, nurses, orderlies, paramedics, and all the others on the me...","{'neg': 0.0, 'neu': 1.0, 'pos': 0.0, 'compound': 0.0}"
112,2020-11-06 19:00:00+00:00,"RT There are folks running around on TV blaming progressivism for Dem underperformance.

I was curious, so I decided to open the hood...","{'neg': 0.121, 'neu': 0.792, 'pos': 0.087, 'compound': -0.2263}"
113,2020-11-06 19:00:00+00:00,"RT How is it that more 90-year-olds registered to vote in one year, during a pandemic, than at any point in Pennsylvania hi...","{'neg': 0.0, 'neu': 1.0, 'pos': 0.0, 'compound': 0.0}"
114,2020-11-06 19:00:00+00:00,RT We gave Trump the entire 2020 experience. He got COVID &amp; now is unemployed!,"{'neg': 0.0, 'neu': 1.0, 'pos': 0.0, 'compound': 0.0}"
115,2020-11-06 19:00:00+00:00,"RT How is it that more 90-year-olds registered to vote in one year, during a pandemic, than at any point in Pennsylvania hi...","{'neg': 0.0, 'neu': 1.0, 'pos': 0.0, 'compound': 0.0}"
116,2020-11-06 19:00:00+00:00,"RT On his blog, explains a new study that models how if everyone wore a #mask, more than 130,000 #COVID19 deaths coul...","{'neg': 0.0, 'neu': 1.0, 'pos': 0.0, 'compound': 0.0}"
117,2020-11-06 19:00:00+00:00,RT ONE YEAR AGO TODAY 8 doctors in Wuhan were arrested for spreading rumors about a novel coronavirus outbreak ,"{'neg': 0.138, 'neu': 0.759, 'pos': 0.103, 'compound': -0.2023}"
118,2020-11-06 19:00:00+00:00,Lockdown(s) absolutely suck but I'm a much better/more adventurous chef than I was before,"{'neg': 0.122, 'neu': 0.698, 'pos': 0.18, 'compound': 0.2508}"
119,2020-11-06 19:00:00+00:00,"#COVID19 has changed the U.S. healthcare system in ways that many experts say are here to stay. Telemedicine and a movement towards more comprehensive coverage are just the beginning.

Learn more from and Debra Gordon:","{'neg': 0.0, 'neu': 0.937, 'pos': 0.063, 'compound': 0.3167}"
120,2020-11-06 19:00:00+00:00,"In the latest episode of APA's PayTalk podcast, find out the COVID-19 impact on year-end processes, why reconciliations are important and who requires them, and more. #payroll","{'neg': 0.0, 'neu': 0.935, 'pos': 0.065, 'compound': 0.2023}"
121,2020-11-06 19:00:00+00:00,Covid-19 new patients &amp; new deaths confirmed on Friday via,"{'neg': 0.0, 'neu': 1.0, 'pos': 0.0, 'compound': 0.0}"
122,2020-11-06 19:00:00+00:00,"RT Today's case numbers, combined with the staffing and capacity issues hospitals are currently facing, is terrifying to me and...","{'neg': 0.163, 'neu': 0.837, 'pos': 0.0, 'compound': -0.5719}"
