,created_at,full_text,sentiment_score
0,2020-11-21 16:59:54+00:00,What happens is these guy get reelected time after time by people who will never even taste Dom Perignon but are desperate to protect their imagined white privilege. Every picture tells a story. There's your white privilege.,"{'neg': 0.064, 'neu': 0.72, 'pos': 0.216, 'compound': 0.7876}"
1,2020-11-21 16:59:54+00:00,"RT More than 250,000 Americans have died from COVID-19.

To the families who have lost loved ones -- our thoughts are with yo...","{'neg': 0.198, 'neu': 0.671, 'pos': 0.131, 'compound': -0.25}"
2,2020-11-21 16:59:54+00:00,eerie legacy but seems to be on the money,"{'neg': 0.179, 'neu': 0.821, 'pos': 0.0, 'compound': -0.1901}"
3,2020-11-21 16:59:54+00:00,"RT I'm told that many Germans are stockpiling cheese and sausages in anticipation of a COVID lockdown -- planning, in other w...","{'neg': 0.0, 'neu': 0.938, 'pos': 0.062, 'compound': 0.1027}"
4,2020-11-21 16:59:54+00:00,We have had a solid start to the season before the 2nd covid break kicked in! Still a long way to go and against some very good sides. Stay safe everyone and can't wait to get back playing again ,"{'neg': 0.0, 'neu': 0.782, 'pos': 0.218, 'compound': 0.831}"
5,2020-11-21 16:59:54+00:00,NBC News: U.S. records over 12 million cases of coronavirus... ,"{'neg': 0.0, 'neu': 1.0, 'pos': 0.0, 'compound': 0.0}"
6,2020-11-21 16:59:54+00:00,"RT While the world is following the 3 ""W's""

Wash your hands
Watch your distance
Wear a mask

Born Again Believers are :...","{'neg': 0.0, 'neu': 1.0, 'pos': 0.0, 'compound': 0.0}"
7,2020-11-21 16:59:54+00:00,"RT May I take this moment to note in the run up to Election Day, Donald did 14 rallies in 8 states. Now the country is on fire...","{'neg': 0.082, 'neu': 0.918, 'pos': 0.0, 'compound': -0.34}"
8,2020-11-21 16:59:55+00:00,"RT ""It is impossible for us to succeed in the fight against the pandemic without cooperation and solidarity""","{'neg': 0.198, 'neu': 0.661, 'pos': 0.141, 'compound': -0.0742}"
9,2020-11-21 16:59:55+00:00,RT Had a very fruitful discussion with G20 leaders. Coordinated efforts by the largest economies of the world will surely le...,"{'neg': 0.0, 'neu': 0.873, 'pos': 0.127, 'compound': 0.4404}"
10,2020-11-21 16:59:55+00:00,RT Kids are not falling behind. They are surviving a pandemic.,"{'neg': 0.0, 'neu': 0.712, 'pos': 0.288, 'compound': 0.3907}"
11,2020-11-21 16:59:55+00:00,"RT #Eritrea: Announcement from Ministry of Health 
*Twenty four patients diagnosed positive for COVID-19 at Q/Centers in Southern...","{'neg': 0.0, 'neu': 0.825, 'pos': 0.175, 'compound': 0.5574}"
12,2020-11-21 16:59:55+00:00,"RT ""President Trump was following my condition and cleared me for the monoclonal antibody therapy that he had previously rece...","{'neg': 0.0, 'neu': 0.931, 'pos': 0.069, 'compound': 0.1027}"
13,2020-11-21 16:59:55+00:00,"The new strain of covid 19 proves to be more dangerous to young people and children
#Shutdownallinstitutions","{'neg': 0.234, 'neu': 0.766, 'pos': 0.0, 'compound': -0.5563}"
14,2020-11-21 16:59:55+00:00,see you after this pandemic  hang in there exo-ls,"{'neg': 0.0, 'neu': 1.0, 'pos': 0.0, 'compound': 0.0}"
15,2020-11-21 16:59:55+00:00,"GoLocalProv | News | New Record: 1,280 New Coronavirus Cases in One Day, Dr. Fine Says Disease is Out of Control in RI","{'neg': 0.0, 'neu': 0.924, 'pos': 0.076, 'compound': 0.2023}"
16,2020-11-21 16:59:55+00:00,"RT Kids, this comic is for you.

""You've been living through this pandemic for months, &amp; you might be feeling sad, frustrat...","{'neg': 0.126, 'neu': 0.813, 'pos': 0.061, 'compound': -0.3818}"
17,2020-11-21 16:59:55+00:00,"Insanity no one wants to listen!! Bill Gates we better never ever see you without a mask on, anytime any where. In your home out and about. Never take it off. Let your #followthemoney gang #crushinglivesalongtheway know! Thanks","{'neg': 0.145, 'neu': 0.73, 'pos': 0.125, 'compound': -0.2444}"
18,2020-11-21 16:59:55+00:00,RT Never forget the constant lies and bullshit that impeded a strong public health message that could save lives.,"{'neg': 0.229, 'neu': 0.487, 'pos': 0.284, 'compound': 0.1446}"
19,2020-11-21 16:59:55+00:00,"Schools and COVID-19, Health Care Resources, Leaving Afghanistan: RAND Weekly Recap via","{'neg': 0.0, 'neu': 0.775, 'pos': 0.225, 'compound': 0.4939}"
20,2020-11-21 16:59:55+00:00,"RT The governor born with a platinum spoon in his mouth, and independent restaurant owners losing everything, their dreams, the...","{'neg': 0.112, 'neu': 0.773, 'pos': 0.116, 'compound': 0.0258}"
21,2020-11-21 16:59:55+00:00,"RT Part 1-2. Collusion and Motives behind LANCET letter-Top scientists-CCP:
Lab-origin of COVID-19 is requested to be condem...","{'neg': 0.0, 'neu': 1.0, 'pos': 0.0, 'compound': 0.0}"
22,2020-11-21 16:59:55+00:00,RT New York Gov. Andrew Cuomo is set to soon receive an International Emmy award for his once-daily televised briefings on the coronav...,"{'neg': 0.0, 'neu': 0.863, 'pos': 0.137, 'compound': 0.5423}"
23,2020-11-21 16:59:55+00:00,"RT Wish I could send a genuine ""get well soon"" message. but like millions of others Americans--he's perfectly...","{'neg': 0.0, 'neu': 0.529, 'pos': 0.471, 'compound': 0.9091}"
24,2020-11-21 16:59:55+00:00,"RT COVID-19 has impacted all our lives, but there is support there for LGBTI people when its needed. 

Check out our #LGBTI...","{'neg': 0.0, 'neu': 0.855, 'pos': 0.145, 'compound': 0.5499}"
25,2020-11-21 16:59:55+00:00,"No, that's really not how it works.","{'neg': 0.0, 'neu': 1.0, 'pos': 0.0, 'compound': 0.0}"
26,2020-11-21 16:59:55+00:00,RT Love seeing this every year,"{'neg': 0.0, 'neu': 0.543, 'pos': 0.457, 'compound': 0.6369}"
27,2020-11-21 16:59:56+00:00,"I called on leaders to:
-ensure #COVID19 vaccines are allocated fairly as global public goods
-fully implement the International Health Regulations
-address the vulnerabilities &amp; inequalities at the root of the pandemic
-help fill the ACT-Accelerator's financing gaps","{'neg': 0.038, 'neu': 0.835, 'pos': 0.126, 'compound': 0.5719}"
28,2020-11-21 16:59:56+00:00,"RT After meeting w/ Pres. Trump, Michigan Republicans--including Speaker down the Trump Hotel bar last...","{'neg': 0.0, 'neu': 1.0, 'pos': 0.0, 'compound': 0.0}"
29,2020-11-21 16:59:56+00:00,"I see you aren't wearing a mask in your profile pic. What a terrible example. There is no constitutional law requiring anyone to wear a mask, and science, which I'm supposed to believe, shows that masks are for control, not prevention. You are a loser.","{'neg': 0.172, 'neu': 0.828, 'pos': 0.0, 'compound': -0.8271}"
30,2020-11-21 16:59:56+00:00,RT the severity here seems to add to the evidence that someone likely would've died from this WH outbreak if they didn't get...,"{'neg': 0.141, 'neu': 0.859, 'pos': 0.0, 'compound': -0.5574}"
31,2020-11-21 16:59:56+00:00,"RT Because the right has failed at creating or maintaining cultural institutions, we aren't able to credential and reward...","{'neg': 0.131, 'neu': 0.635, 'pos': 0.234, 'compound': 0.3818}"
32,2020-11-21 16:59:56+00:00,"3,000 dead on 9/11 meant everything. 200,000 dead of Covid-19 means nothing. Here's why. by","{'neg': 0.398, 'neu': 0.602, 'pos': 0.0, 'compound': -0.8625}"
33,2020-11-21 16:59:56+00:00,RT People not taking covid serious enough,"{'neg': 0.0, 'neu': 0.831, 'pos': 0.169, 'compound': 0.0572}"
34,2020-11-21 16:59:56+00:00,"No one it too keen to tell you about the possible down sides of a CoronaVirus vaccine. Every medicine ever produced has down sides, so why are we not hearing about them?","{'neg': 0.063, 'neu': 0.865, 'pos': 0.072, 'compound': 0.0772}"
35,2020-11-21 16:59:56+00:00,"RT [gisa] Review: On pandemic album 'Be,' #BTS longs for better times, then dances through the tears
https://t.co/j4G0IzAucn","{'neg': 0.091, 'neu': 0.769, 'pos': 0.139, 'compound': 0.25}"
36,2020-11-21 16:59:56+00:00,RT Trapping Conman is easier than trapping Gudhugudhu. (Ask your Luo neighbours to interpret for you if you are...,"{'neg': 0.0, 'neu': 0.865, 'pos': 0.135, 'compound': 0.4215}"
37,2020-11-21 16:59:56+00:00,These thugs should be in jail!!! What are they on???!!!!!,"{'neg': 0.0, 'neu': 1.0, 'pos': 0.0, 'compound': 0.0}"
38,2020-11-21 16:59:56+00:00,"RT It may be a little early, but Thanksgiving wouldn't be the same without Wanda &amp; Jamal.

In 2016 they went viral when she...","{'neg': 0.0, 'neu': 1.0, 'pos': 0.0, 'compound': 0.0}"
39,2020-11-21 16:59:56+00:00,"RT [gisa] #BTS - 'BE (Deluxe Edition)' review: a sensitive, stunning document of pandemic life
https://t.co/4afIKhcOQC","{'neg': 0.0, 'neu': 0.852, 'pos': 0.148, 'compound': 0.3818}"
40,2020-11-21 16:59:56+00:00,RT You can't lockdown without giving people money to pay the bills! This is obvious. I'd argue it's also one of the main rea...,"{'neg': 0.152, 'neu': 0.782, 'pos': 0.066, 'compound': -0.3238}"
41,2020-11-21 16:59:56+00:00,"I lived in Oxfordshire for 4 years...  I don't think they are ignorantly, selfish like people in the States...  #WearAMask","{'neg': 0.226, 'neu': 0.675, 'pos': 0.099, 'compound': -0.4939}"
42,2020-11-21 16:59:56+00:00,"RT It's absolutely FREE to retweet a black author trying to achieve 200k book sales during the pandemic. Self love, love, b...","{'neg': 0.0, 'neu': 0.599, 'pos': 0.401, 'compound': 0.929}"
43,2020-11-21 16:59:56+00:00,RT .@Kevinliptakcnn reports: The G20 is virtual this year; a meeting on pandemic preparedness is going on w remarks from the l...,"{'neg': 0.0, 'neu': 1.0, 'pos': 0.0, 'compound': 0.0}"
44,2020-11-21 16:59:56+00:00,Could We be anymore shameful???????????,"{'neg': 0.51, 'neu': 0.49, 'pos': 0.0, 'compound': -0.6322}"
45,2020-11-21 16:59:56+00:00,To some degree he has. He delegated corona virus response to the Governors of each state. So really it's the Governors who have failed. Just playing devil's advocate here really.,"{'neg': 0.1, 'neu': 0.846, 'pos': 0.054, 'compound': -0.3612}"
46,2020-11-21 16:59:56+00:00,"RT After meeting w/ Pres. Trump, Michigan Republicans--including Speaker down the Trump Hotel bar last...","{'neg': 0.0, 'neu': 1.0, 'pos': 0.0, 'compound': 0.0}"
47,2020-11-21 16:59:56+00:00,Me too!,"{'neg': 0.0, 'neu': 1.0, 'pos': 0.0, 'compound': 0.0}"
48,2020-11-21 16:59:56+00:00,RT Whoa! Donald is president for life. And Black people in Detroit and Philadelphia and Atlanta can't figure out where to vote!...,"{'neg': 0.0, 'neu': 1.0, 'pos': 0.0, 'compound': 0.0}"
49,2020-11-21 16:59:56+00:00,"RT If you can't wear a mask due to ""health reasons"", shouldn't you be the LAST one out and about?","{'neg': 0.0, 'neu': 1.0, 'pos': 0.0, 'compound': 0.0}"
50,2020-11-21 16:59:56+00:00,"RT It's World Antimicrobial Awareness Week

The / of #AntimicrobialResistance is a  threat.
It can affect anyone,
of any age,
in an...","{'neg': 0.139, 'neu': 0.861, 'pos': 0.0, 'compound': -0.5267}"
51,2020-11-21 16:59:56+00:00,It's so sad how some ppl think the 2020 and having this pandemic was blessing for them.,"{'neg': 0.157, 'neu': 0.695, 'pos': 0.148, 'compound': -0.0498}"
52,2020-11-21 16:59:56+00:00,"The most pressing task of the moment is to shore up global public health system&amp;contain #COVID19. We need to enhance the role of #WHO, improve pandemic preparedness&amp;response, forge a strong shield for human health&amp;safety, and build a global community of health for all.(8/10)","{'neg': 0.0, 'neu': 0.869, 'pos': 0.131, 'compound': 0.7351}"
53,2020-11-21 16:59:56+00:00,RT this is literally going to kill people as well as plonk us straight into yet another lengthy lockdown throughout the most mis...,"{'neg': 0.164, 'neu': 0.697, 'pos': 0.139, 'compound': -0.4019}"
54,2020-11-21 16:59:57+00:00,"RT ""Frequent-flying ""'super emitters"" who represent just 1% of the world's population caused half of aviation's carbon emis...","{'neg': 0.0, 'neu': 0.813, 'pos': 0.187, 'compound': 0.5994}"
55,2020-11-21 16:59:57+00:00,"My mom is not in the financial position to help. me with money for at least 2 or 3 others months. I'm living on my student loans, that is going to run off soon and that I gotta start paying back in september 2021, in a freaking pandemic economy where there is no job","{'neg': 0.085, 'neu': 0.869, 'pos': 0.046, 'compound': -0.3182}"
56,2020-11-21 16:59:57+00:00,"Obviously not every town is this fortunate but everyone can implement this ""local"" currency which supports small business/farmers. Thanks ! #buylocal","{'neg': 0.0, 'neu': 0.653, 'pos': 0.347, 'compound': 0.8618}"
57,2020-11-21 16:59:57+00:00,"what hurts a child more, missing school or contracting COVID at school and dying?","{'neg': 0.318, 'neu': 0.682, 'pos': 0.0, 'compound': -0.6801}"
58,2020-11-21 16:59:57+00:00,"RT Trump is at his golf course again, according to the pool report.

Meanwhile, NBC News reports that the U.S. just hit 12 m...","{'neg': 0.0, 'neu': 1.0, 'pos': 0.0, 'compound': 0.0}"
59,2020-11-21 16:59:57+00:00,"When you compare Sweden to it's Nordic neighbours who did lockdown, it fared much worse.

Let's look at countries that have had much better  outcomes and copy these.","{'neg': 0.097, 'neu': 0.812, 'pos': 0.091, 'compound': -0.0516}"
60,2020-11-21 16:59:57+00:00,RT Is this the new 'tucking',"{'neg': 0.0, 'neu': 1.0, 'pos': 0.0, 'compound': 0.0}"
61,2020-11-21 16:59:57+00:00,Check out my Gig make amazing children book cover,"{'neg': 0.0, 'neu': 0.678, 'pos': 0.322, 'compound': 0.5859}"
62,2020-11-21 16:59:57+00:00,"RT More than 250,000 Americans have died from COVID-19.

To the families who have lost loved ones -- our thoughts are with yo...","{'neg': 0.198, 'neu': 0.671, 'pos': 0.131, 'compound': -0.25}"
63,2020-11-21 16:59:57+00:00,RT Kids are not falling behind. They are surviving a pandemic.,"{'neg': 0.0, 'neu': 0.712, 'pos': 0.288, 'compound': 0.3907}"
64,2020-11-21 16:59:57+00:00,"2,885 new cases of Coronavirus reported in Maryland today, 16 new deaths. 278 Marylanders are currently in ICU beds. What's our Governor doing today?","{'neg': 0.0, 'neu': 1.0, 'pos': 0.0, 'compound': 0.0}"
65,2020-11-21 16:59:57+00:00,RT Kids are not falling behind. They are surviving a pandemic.,"{'neg': 0.0, 'neu': 0.712, 'pos': 0.288, 'compound': 0.3907}"
66,2020-11-21 16:59:57+00:00,"RT After meeting w/ Pres. Trump, Michigan Republicans--including Speaker down the Trump Hotel bar last...","{'neg': 0.0, 'neu': 1.0, 'pos': 0.0, 'compound': 0.0}"
67,2020-11-21 16:59:57+00:00,"RT these neck gaiters don't do shit, wear a real mask ","{'neg': 0.0, 'neu': 0.774, 'pos': 0.226, 'compound': 0.4449}"
68,2020-11-21 16:59:57+00:00,"RT So according to reports, Clemson:

*Traveled to Tallahassee
*Passed Covid protocols
*ACC said it was safe for both teams...","{'neg': 0.0, 'neu': 0.868, 'pos': 0.132, 'compound': 0.4404}"
69,2020-11-21 16:59:57+00:00,"RT Trump is at his golf course again, according to the pool report.

Meanwhile, NBC News reports that the U.S. just hit 12 m...","{'neg': 0.0, 'neu': 1.0, 'pos': 0.0, 'compound': 0.0}"
70,2020-11-21 16:59:57+00:00,"RT Burglars rejoice as police target peaceful protesters for breach of covid-fascist regulations in Basildon, Essex.
#covid19...","{'neg': 0.086, 'neu': 0.636, 'pos': 0.277, 'compound': 0.6369}"
71,2020-11-21 16:59:57+00:00,"26th December, I better be allowed to go out.","{'neg': 0.0, 'neu': 0.734, 'pos': 0.266, 'compound': 0.4404}"
72,2020-11-21 16:59:57+00:00,Are you kidding me!,"{'neg': 0.0, 'neu': 0.639, 'pos': 0.361, 'compound': 0.1759}"
73,2020-11-21 16:59:57+00:00,These are questions that need to be answered. Michigan deserves to know.,"{'neg': 0.0, 'neu': 1.0, 'pos': 0.0, 'compound': 0.0}"
74,2020-11-21 16:59:57+00:00,Wouldn't be dying if not for covid.,"{'neg': 0.0, 'neu': 1.0, 'pos': 0.0, 'compound': 0.0}"
75,2020-11-21 16:59:57+00:00,"There's scaremongering, and then there is listening to the scientific data that proves that Drug did not help much at all with COVID.","{'neg': 0.093, 'neu': 0.907, 'pos': 0.0, 'compound': -0.3089}"
76,2020-11-21 16:59:57+00:00,"At the beginning of Covid, my TTS discord was all about people building protos. Now it's all about scripting. Do you feel this push to learn and add tons of boardgame scripting is useful effort for something (eventually) going back to the physical realm?","{'neg': 0.057, 'neu': 0.882, 'pos': 0.061, 'compound': 0.0516}"
77,2020-11-21 16:59:57+00:00,RT Donald Trump has quarantined more strictly in response to losing the election than in response to getting Covid.,"{'neg': 0.126, 'neu': 0.874, 'pos': 0.0, 'compound': -0.3818}"
78,2020-11-21 16:59:57+00:00,RT PDM is a punctured rubber boat that requires air pumping from public meetings (jalsas) to keep it afloat. Peshawar jalsa...,"{'neg': 0.0, 'neu': 1.0, 'pos': 0.0, 'compound': 0.0}"
79,2020-11-21 16:59:57+00:00,Who the hell would the people that are familiar in other words anybody off the street never believe anything in Bloomberg so called news there a joke just like the all the other  in the main stream media NEWSMAX TV  OAN,"{'neg': 0.097, 'neu': 0.803, 'pos': 0.099, 'compound': -0.2263}"
80,2020-11-21 16:59:58+00:00,"Update from Stars v Stripes 

Preparing a National team for 2021 was always going to be a mammoth undertaking, wishing the players well as they isolate and recover.","{'neg': 0.058, 'neu': 0.812, 'pos': 0.13, 'compound': 0.296}"
81,2020-11-21 16:59:58+00:00,RT Condolences to all previous Emmy Award winners for this dramatic devaluation of Emmy Awards significance ,"{'neg': 0.0, 'neu': 0.506, 'pos': 0.494, 'compound': 0.8934}"
82,2020-11-21 16:59:58+00:00,"RT On being discharged from mental health services in the pandemic. By me, for","{'neg': 0.0, 'neu': 1.0, 'pos': 0.0, 'compound': 0.0}"
83,2020-11-21 16:59:58+00:00,"RT If you can't wear a mask due to ""health reasons"", shouldn't you be the LAST one out and about?","{'neg': 0.0, 'neu': 1.0, 'pos': 0.0, 'compound': 0.0}"
84,2020-11-21 16:59:58+00:00,"RT Make the vaccine free for every person in this country, no excuses or exceptions.","{'neg': 0.119, 'neu': 0.703, 'pos': 0.178, 'compound': 0.2732}"
85,2020-11-21 16:59:58+00:00,Lmao people are dying in the fucking streets. What do you mean award??? For what?,"{'neg': 0.0, 'neu': 0.609, 'pos': 0.391, 'compound': 0.8541}"
86,2020-11-21 16:59:58+00:00,RT The US is a joke,"{'neg': 0.0, 'neu': 0.694, 'pos': 0.306, 'compound': 0.296}"
87,2020-11-21 16:59:58+00:00," You mention you have the most first responders but conveniently forgot to mention your boro is the white racist capital of the 5 boros.  Seem to be an overlap with white racists, Trump supporters and covid numbers but that might be too real for your article.","{'neg': 0.18, 'neu': 0.753, 'pos': 0.067, 'compound': -0.8126}"
88,2020-11-21 16:59:58+00:00,RT .@Kevinliptakcnn reports: The G20 is virtual this year; a meeting on pandemic preparedness is going on w remarks from the l...,"{'neg': 0.0, 'neu': 1.0, 'pos': 0.0, 'compound': 0.0}"
89,2020-11-21 16:59:58+00:00,"There's an argument for not getting caught in the honey trap. Just because the districts were Trump +15% doesn't mean they will stay that way. Right now GOP has seven solid seats, this gerrymader could mean 5 solid seats and 3 tenuous seats if new Trump voters stay home.","{'neg': 0.091, 'neu': 0.849, 'pos': 0.06, 'compound': -0.3818}"
90,2020-11-21 16:59:58+00:00,"RT More than 250,000 Americans have died from COVID-19.

To the families who have lost loved ones -- our thoughts are with yo...","{'neg': 0.198, 'neu': 0.671, 'pos': 0.131, 'compound': -0.25}"
91,2020-11-21 16:59:58+00:00,RT Welp I guess we're about to find out if cocaine cures COVID.,"{'neg': 0.0, 'neu': 1.0, 'pos': 0.0, 'compound': 0.0}"
92,2020-11-21 16:59:58+00:00,'Endangering Lives by withholding transition resources...',"{'neg': 0.0, 'neu': 1.0, 'pos': 0.0, 'compound': 0.0}"
93,2020-11-21 16:59:58+00:00,"RT #CloseFoundationUniCovid19 
Take action please","{'neg': 0.0, 'neu': 0.635, 'pos': 0.365, 'compound': 0.3182}"
94,2020-11-21 16:59:58+00:00,You sound absolutely ignorant especially considering you're a congressman. How many dead Americans will take for you to wake up and take this pandemic seriously ? Try to not be so arrogant and listen to the real medical experts rather than a schmuck like radiologist Atlas,"{'neg': 0.223, 'neu': 0.732, 'pos': 0.045, 'compound': -0.8753}"
95,2020-11-21 16:59:58+00:00,"RT Make the vaccine free for every person in this country, no excuses or exceptions.","{'neg': 0.119, 'neu': 0.703, 'pos': 0.178, 'compound': 0.2732}"
96,2020-11-21 16:59:58+00:00,"RT It may be a little early, but Thanksgiving wouldn't be the same without Wanda &amp; Jamal.

In 2016 they went viral when she...","{'neg': 0.0, 'neu': 1.0, 'pos': 0.0, 'compound': 0.0}"
97,2020-11-21 16:59:58+00:00,"RT JUST IN: Donald Trump Jr., President Trump's eldest son, has tested positive for coronavirus","{'neg': 0.0, 'neu': 0.795, 'pos': 0.205, 'compound': 0.5574}"
98,2020-11-21 16:59:58+00:00,"RT Apparently, Trump is taking his revenge on the people for his loss. #Republicans","{'neg': 0.322, 'neu': 0.678, 'pos': 0.0, 'compound': -0.6908}"
99,2020-11-21 16:59:58+00:00,RT Soooo now that I have a new car. Odeezy trip when Covid settles her ass down or what?! ,"{'neg': 0.174, 'neu': 0.826, 'pos': 0.0, 'compound': -0.5848}"
100,2020-11-21 16:59:58+00:00,"RT If Republicans think the voting machines are rigged in Georgia, why would they vote in the Runoff election? 

Shouldn't th...","{'neg': 0.111, 'neu': 0.889, 'pos': 0.0, 'compound': -0.3612}"
101,2020-11-21 16:59:58+00:00,RT California's new stay-at-home order now in effect: What you need to know,"{'neg': 0.0, 'neu': 1.0, 'pos': 0.0, 'compound': 0.0}"
102,2020-11-21 16:59:58+00:00,"RT If you can't wear a mask due to ""health reasons"", shouldn't you be the LAST one out and about?","{'neg': 0.0, 'neu': 1.0, 'pos': 0.0, 'compound': 0.0}"
103,2020-11-21 16:59:58+00:00,"RT Media is always talking about Covid deaths, but doesn't mention how many have died attempting to short Tesla!","{'neg': 0.224, 'neu': 0.776, 'pos': 0.0, 'compound': -0.7345}"
104,2020-11-21 16:59:58+00:00,RT I sure as hell hope someone is monitoring this dude's expense vouchers because Michigan taxpayers should not pay for politi...,"{'neg': 0.164, 'neu': 0.605, 'pos': 0.231, 'compound': -0.0268}"
105,2020-11-21 16:59:58+00:00,Healthcare workers should get hazard pay and safety benefits for working through the pandemic,"{'neg': 0.079, 'neu': 0.618, 'pos': 0.303, 'compound': 0.6124}"
106,2020-11-21 16:59:58+00:00,RT Trump appears to be skipping a side-event at the G20 virtual summit focused on pandemic preparedness. The President has just ar...,"{'neg': 0.0, 'neu': 0.89, 'pos': 0.11, 'compound': 0.3818}"
107,2020-11-21 16:59:58+00:00,"RT My dad died today in a nursing home. 

He was tested for Covid 3 times over the last 3 weeks. 

He was negative every tim...","{'neg': 0.233, 'neu': 0.767, 'pos': 0.0, 'compound': -0.8074}"
108,2020-11-21 16:59:59+00:00,"RT So I'm supposed to believe that Michigan Republicans, who have never cared about covid before, spent an hour discussin...","{'neg': 0.109, 'neu': 0.891, 'pos': 0.0, 'compound': -0.3252}"
109,2020-11-21 16:59:59+00:00,RT .@Kevinliptakcnn reports: The G20 is virtual this year; a meeting on pandemic preparedness is going on w remarks from the l...,"{'neg': 0.0, 'neu': 1.0, 'pos': 0.0, 'compound': 0.0}"
110,2020-11-21 16:59:59+00:00,"RT We often look at raw numbers of COVID deaths. We need context.

North Dakota recently reported 31 deaths in one day. Per ca...","{'neg': 0.0, 'neu': 1.0, 'pos': 0.0, 'compound': 0.0}"
111,2020-11-21 16:59:59+00:00,RT Donald Trump has quarantined more strictly in response to losing the election than in response to getting Covid.,"{'neg': 0.126, 'neu': 0.874, 'pos': 0.0, 'compound': -0.3818}"
112,2020-11-21 16:59:59+00:00,"Having a vaccine is only one facet in the complicated fight to contain #COVID19.
 
Key: globally coordinated distribution systems (equivalent of 8,000 Boeing 747 cargo aircraft for a single shot worldwide!) and health campaigns.
 
@sanofi CEO Paul Hudson
https://t.co/mm5CN8o2dm","{'neg': 0.071, 'neu': 0.929, 'pos': 0.0, 'compound': -0.4389}"
113,2020-11-21 16:59:59+00:00,"I was just talking about this the other day with someone. Any other year, I get it. Ppl in store will impulse buy. Right now they should be assisting in people staying home/safe. At least do online/curbside","{'neg': 0.0, 'neu': 1.0, 'pos': 0.0, 'compound': 0.0}"
114,2020-11-21 16:59:59+00:00,RT Trump appears to be skipping a side-event at the G20 virtual summit focused on pandemic preparedness. The President has just ar...,"{'neg': 0.0, 'neu': 0.89, 'pos': 0.11, 'compound': 0.3818}"
115,2020-11-21 16:59:59+00:00,"RT 'When we don't act, people who look like me die' -- Rep.-elect Cori Bush calls on Joe Biden and Democrats to uphold progres...","{'neg': 0.137, 'neu': 0.775, 'pos': 0.088, 'compound': -0.34}"
116,2020-11-21 16:59:59+00:00,"Postmenopausal women who suffer tooth loss are at higher risk of hypertension

https://t.co/CP41z9BwaW

#Health #inshape #LifeStyle #Keto #weightloss #Covid19","{'neg': 0.331, 'neu': 0.669, 'pos': 0.0, 'compound': -0.7845}"
117,2020-11-21 16:59:59+00:00,Why we need to take #leadership on #COVID because will only take care of his own. Never mind the rest of us #Americans he is suppose to represent but clearly does not care for. ,"{'neg': 0.086, 'neu': 0.773, 'pos': 0.141, 'compound': 0.2978}"
118,2020-11-21 16:59:59+00:00,"RT As a veteran business spokesperson and lobbyist, I'm trained to keep my composure. But every day for 8 straight months, I've spok...","{'neg': 0.0, 'neu': 0.903, 'pos': 0.097, 'compound': 0.3291}"
119,2020-11-21 16:59:59+00:00,"Noting that 'Work from Anywhere' is a new normal in the post-COVID world, PM also suggested creation of a G20 Virtual Secretariat as a follow up and documentation repository: MEA press note on PM's remarks at #G20RiyadhSummit","{'neg': 0.0, 'neu': 0.945, 'pos': 0.055, 'compound': 0.2732}"
