,created_at,full_text,sentiment_score
117,2020-11-06 15:59:59+00:00,"RT Dear Yoongi, I wish you a good post-surgery recovery. I look forward to seeing you playing your guitar again but you...","{'neg': 0.0, 'neu': 0.72, 'pos': 0.28, 'compound': 0.6124}"
118,2020-11-06 15:59:59+00:00,"RT even after his disastrous covid  mishandling, trump has gotten more votes than Obama did in 2008. if you think the republi...","{'neg': 0.157, 'neu': 0.843, 'pos': 0.0, 'compound': -0.5994}"
119,2020-11-06 15:59:59+00:00,"RT even after his disastrous covid  mishandling, trump has gotten more votes than Obama did in 2008. if you think the republi...","{'neg': 0.157, 'neu': 0.843, 'pos': 0.0, 'compound': -0.5994}"
120,2020-11-06 15:59:59+00:00,so your argument is that the pandemic still exists so the situation here is not better? ok.,"{'neg': 0.257, 'neu': 0.743, 'pos': 0.0, 'compound': -0.6351}"
121,2020-11-06 15:59:59+00:00,"Did you notice that when the election votes were still being counted, President elect Biden went to a corona-virus meeting to get updates. Nice try loser!","{'neg': 0.121, 'neu': 0.787, 'pos': 0.092, 'compound': -0.2244}"
122,2020-11-06 16:00:00+00:00,RT ONE YEAR AGO TODAY 8 doctors in Wuhan were arrested for spreading rumors about a novel coronavirus outbreak ,"{'neg': 0.138, 'neu': 0.759, 'pos': 0.103, 'compound': -0.2023}"
123,2020-11-06 16:00:00+00:00,Coronavirus in Europe [ UPDATED DAILY] -,"{'neg': 0.0, 'neu': 1.0, 'pos': 0.0, 'compound': 0.0}"
124,2020-11-06 16:00:00+00:00,"[FREE Webinar] Join us for a Deep Dive Into Physician Telehealth Adoption Practices next Thurs, Nov 12. Learn more about the implications of Covid-19 Telehealth on the future of healthcare. Register Now:","{'neg': 0.0, 'neu': 0.828, 'pos': 0.172, 'compound': 0.7378}"
125,2020-11-06 16:00:00+00:00,"RT Our lawyer Tatiana Lujan said: ""Even before the Covid-19 pandemic, gvts across Europe were dragging their feet on the impl...","{'neg': 0.0, 'neu': 1.0, 'pos': 0.0, 'compound': 0.0}"
126,2020-11-06 16:00:00+00:00,I think ima go with that. Now I need a theme . Someone said covid,"{'neg': 0.0, 'neu': 1.0, 'pos': 0.0, 'compound': 0.0}"
127,2020-11-06 16:00:00+00:00,RT This is what happens when ballots are counted. We've been telling ppl for months that due to high volume of mail-in bal...,"{'neg': 0.0, 'neu': 1.0, 'pos': 0.0, 'compound': 0.0}"
128,2020-11-06 16:00:00+00:00,Bidens group are the ones making it bigger than it needs to be. I firmly believe if Biden wins Covid will be over.,"{'neg': 0.0, 'neu': 0.856, 'pos': 0.144, 'compound': 0.5719}"
129,2020-11-06 16:00:00+00:00,"Relationship stress and COVID among military families, the state of our unions, and more Friday Five via","{'neg': 0.149, 'neu': 0.851, 'pos': 0.0, 'compound': -0.4215}"
130,2020-11-06 16:00:00+00:00,"RT Dear Asian Americans are the fastest increasing group in US &amp; are 4.7% of the electorate in GA, 4% in PA, 11...","{'neg': 0.0, 'neu': 0.894, 'pos': 0.106, 'compound': 0.3818}"
131,2020-11-06 16:00:00+00:00,"Today on Micro Queers, we're discussing 2020 POSSESSED, a macabre musical short about a woman who becomes a little obsessed (er, possessed) with her Peloton instructor during the COVID-19 pandemic.
https://t.co/rfAeDahZgX","{'neg': 0.045, 'neu': 0.955, 'pos': 0.0, 'compound': -0.1045}"
132,2020-11-06 16:00:00+00:00,"RT ` don't forget to wear a mask everyone ~ 

 #igot7selcaday #ig7sd #ahgaselcaday ","{'neg': 0.0, 'neu': 0.878, 'pos': 0.122, 'compound': 0.1695}"
133,2020-11-06 16:00:00+00:00,"HUGE WIN for New Jersey workers! Thanks to the Protect NJ Workers Coalition, signed EO with #COVID19 protections","{'neg': 0.0, 'neu': 0.512, 'pos': 0.488, 'compound': 0.924}"
134,2020-11-06 16:00:00+00:00,"First-years share their thoughts on life in Woodlawn Residential Commons, which opened this fall amidst the COVID-19 pandemic.

https://t.co/mDvhaQfcxi","{'neg': 0.0, 'neu': 0.891, 'pos': 0.109, 'compound': 0.296}"
135,2020-11-06 16:00:00+00:00,"Lockdown look-back #2
October 2018 and a pair of elderly B7TLs are pictured in Norfolk. Both since withdrawn - 32212 at Hopton on 1A Lowestoft to Martham, 32058 at James Paget Hospital on 8 from Caister. 32212 was new as VNL1212 to Centrewest, 32058 as 218 to Leicester.","{'neg': 0.0, 'neu': 1.0, 'pos': 0.0, 'compound': 0.0}"
136,2020-11-06 16:00:00+00:00,"Keeping apart. Keeps us safe.
Social distancing is still important for all of us. #StayAlert","{'neg': 0.0, 'neu': 0.734, 'pos': 0.266, 'compound': 0.5719}"
137,2020-11-06 16:00:00+00:00,"Join #NIMHD &amp; to learn about #RuralHealth challenges in the era of #COVID19 and share ideas for improving rural health outcomes on Nov. 19, 1-5 p.m. ET at the 2020 Rural Health Seminar! Tune in at #NIH Videocast. Learn more &amp; register:","{'neg': 0.0, 'neu': 0.812, 'pos': 0.188, 'compound': 0.7777}"
138,2020-11-06 16:00:00+00:00,"Know the signs before it's too late

#health #fitness #healthylifestyle #wellness #motivation #healthy #workout #love #lifestyle #gym #fit #training #fitnessmotivation #covid #life #nutrition #cardiostudy #fitfam #healthyfood #healthyliving #selfcare","{'neg': 0.0, 'neu': 0.567, 'pos': 0.433, 'compound': 0.9413}"
139,2020-11-06 16:00:00+00:00,"Hear how implemented a COVID-19 management process &amp; a tightly aligned mobile screening tool that helped triage patients &amp; provided a customized call to action for next steps. Nov. 17, 2:50PM ET #HCIC20 #hcmktg #HCICatHome","{'neg': 0.0, 'neu': 1.0, 'pos': 0.0, 'compound': 0.0}"
140,2020-11-06 16:00:00+00:00,"Japan's Prime Minister Yoshihide warned Friday that the country is ""seeing signs"" of a resurgence of #coronavirus infections. 

https://t.co/p6U029EmFs","{'neg': 0.104, 'neu': 0.896, 'pos': 0.0, 'compound': -0.2732}"
141,2020-11-06 16:00:00+00:00,"Suggestion in UK to pay individuals to get #vaccine fro #COVID19 when ready raises many #ethical issues. Certainly opens a debate, even if unlikely to occur.","{'neg': 0.044, 'neu': 0.696, 'pos': 0.259, 'compound': 0.7783}"
142,2020-11-06 16:00:00+00:00,Prof.Xu Bing's team have found that an intensive 8-wk intervention targeting the reduction of local transmissibility and international travel is efficient and effective in optimizing the emergency response of #COVID19 For more:,"{'neg': 0.066, 'neu': 0.709, 'pos': 0.225, 'compound': 0.743}"
143,2020-11-06 16:00:00+00:00,"#ACA #OPENENROLLMENT IS HERE! Enrollment is Nov 1 - Dec 15, 2020. Enroll ONLINE, by PHONE or at AOI Office! (AOI adheres to CDC Covid Guidelines) Call TODAY, we are here to HELP! 321-676-4118","{'neg': 0.0, 'neu': 0.885, 'pos': 0.115, 'compound': 0.6496}"
144,2020-11-06 16:00:00+00:00,RT Thread on Sweden and their somewhat baffling response to COVID-19. ,"{'neg': 0.0, 'neu': 1.0, 'pos': 0.0, 'compound': 0.0}"
145,2020-11-06 16:00:00+00:00,"The exhibition area for food and agricultural products in the 3rd #CIIE draws over 1,000 companies from nearly 100 countries and regions. Increased epidemic prevention and control measures concerning food safety will be taken during the event. Check it out!","{'neg': 0.0, 'neu': 0.88, 'pos': 0.12, 'compound': 0.636}"
146,2020-11-06 16:00:00+00:00,"RT NBC News confirms: The U.S. reported 120,048 new coronavirus cases today.

It is the first time it has crossed the 120,00...","{'neg': 0.0, 'neu': 1.0, 'pos': 0.0, 'compound': 0.0}"
147,2020-11-06 16:00:00+00:00,"Politics, economics &amp; public health collide in Peel's new COVID messaging 

https://t.co/Ds6qrG2iy4","{'neg': 0.106, 'neu': 0.894, 'pos': 0.0, 'compound': -0.0772}"
148,2020-11-06 16:00:00+00:00,A Redbridge family have been donating meals to staff at the Richard House Children's Hospice since the beginning of the pandemic.,"{'neg': 0.0, 'neu': 1.0, 'pos': 0.0, 'compound': 0.0}"
149,2020-11-06 16:00:00+00:00,"Miriam, 
You and I both know that as long as we have prayed to the most high above, we have never seen a presidential election so messy with a pandemic, conjectures, lies and hypocrisy. No president has thrown 1 let alone 5 lawsuits on states for alleged voting fraud.","{'neg': 0.267, 'neu': 0.733, 'pos': 0.0, 'compound': -0.9279}"
150,2020-11-06 16:00:00+00:00,Flu Fact: Everyone who is in frequent contact with individuals with disabilities can plan an important role in reducing risk of serious flu and covid-19 symptoms by getting their flu shot. Get yours today: #FightFlu #FluFriday #FluFactFriday #SleeveUp,"{'neg': 0.249, 'neu': 0.711, 'pos': 0.04, 'compound': -0.8126}"
151,2020-11-06 16:00:00+00:00,"Keeping apart. Keeps us safe.
Social distancing is still important for all of us. #StayAlert","{'neg': 0.0, 'neu': 0.734, 'pos': 0.266, 'compound': 0.5719}"
152,2020-11-06 16:00:00+00:00,"A video shared on Twitter claiming to show Kenya's President Uhuru Kenyatta dancing in a crowd without a face mask in spite of Covid-19 restrictions is  FALSE.

 The video is from 2017, well before the pandemic:","{'neg': 0.083, 'neu': 0.807, 'pos': 0.11, 'compound': 0.0258}"
153,2020-11-06 16:00:00+00:00,"South Korea will maintain Level 1 social distancing regulations under a revised 5-tier scheme as the average daily number of new cases remains below 100 this week, said Friday, reports","{'neg': 0.0, 'neu': 0.957, 'pos': 0.043, 'compound': 0.0772}"
154,2020-11-06 16:00:00+00:00,"When Corky's owner Jimmy Stovall started rehiring, he thought he'd get ""the cream of the crop"" of workers after so many lost their jobs. Instead, he's struggled to get any applicants at all. ","{'neg': 0.138, 'neu': 0.862, 'pos': 0.0, 'compound': -0.6096}"
155,2020-11-06 16:00:00+00:00,"As of Thursday afternoon, the center has 58 active cases among patients and staff. ","{'neg': 0.0, 'neu': 0.828, 'pos': 0.172, 'compound': 0.4019}"
156,2020-11-06 16:00:00+00:00,"Our research paints a consistent picture across the income/age spectrum &amp; across small businesses-cash buffers are key to weathering volatility. #JPMCInstitute UI research cited in article. 

https://t.co/Vxpm4BtLTa","{'neg': 0.0, 'neu': 1.0, 'pos': 0.0, 'compound': 0.0}"
157,2020-11-06 16:00:00+00:00,RT We received many suggestions after we proposed a ban on firecrackers this #Diwali. People should celebrate in a simple manner cons...,"{'neg': 0.132, 'neu': 0.733, 'pos': 0.136, 'compound': 0.0258}"
158,2020-11-06 16:00:00+00:00,"RT There are folks running around on TV blaming progressivism for Dem underperformance.

I was curious, so I decided to open the hood...","{'neg': 0.121, 'neu': 0.792, 'pos': 0.087, 'compound': -0.2263}"
159,2020-11-06 16:00:00+00:00,"COCAP's ""COVID-19 Biweekly"" covers the incidents related to COVID19 and gender-based violence (GBV) from October 1 - 15, 2020 is out. Read more here","{'neg': 0.151, 'neu': 0.849, 'pos': 0.0, 'compound': -0.6249}"
160,2020-11-06 16:00:00+00:00,"The upcoming Printing SA webinar will feature insights on the importance of employees' mental and physical well-being.
https://t.co/Y0XjAy5vj5","{'neg': 0.0, 'neu': 0.872, 'pos': 0.128, 'compound': 0.3612}"
161,2020-11-06 16:00:00+00:00,This Alberta woman just beat COVID-19 ... in time to celebrate her 109th birthday. |,"{'neg': 0.0, 'neu': 0.791, 'pos': 0.209, 'compound': 0.5719}"
