,created_at,full_text,sentiment_score
0,2020-11-03 11:59:54+00:00,"Planning for the future is important for anyone, regardless of age or health.  Book a 30 min 1to1 session with a solicitor and have your questions answered.Sessions available on 5 November. For more info #futureplanning #legaladvice #cancersupport #COVID19","{'neg': 0.0, 'neu': 0.954, 'pos': 0.046, 'compound': 0.2023}"
1,2020-11-03 11:59:54+00:00,COVID sweet COVID do your thing.,"{'neg': 0.0, 'neu': 0.625, 'pos': 0.375, 'compound': 0.4588}"
2,2020-11-03 11:59:54+00:00,"RT Okay nak bercerita jap. 

i went to ikea last week and my ticket fee was rm7. I only had rm5 in my pocket. I couldnt pay f...","{'neg': 0.0, 'neu': 0.891, 'pos': 0.109, 'compound': 0.2951}"
3,2020-11-03 11:59:54+00:00,RT Would indeed be ironic if Donald Trump lost the presidential election by a margin of votes equal to the number of his suppor...,"{'neg': 0.146, 'neu': 0.805, 'pos': 0.05, 'compound': -0.3612}"
4,2020-11-03 11:59:55+00:00,"RT Judge Rules CA Gov Overstepped His Authority with Covid Order, Issues Permanent Injunction Restraining Newsom From Further Is...","{'neg': 0.0, 'neu': 0.933, 'pos': 0.067, 'compound': 0.0772}"
5,2020-11-03 11:59:55+00:00,Activity Alliance response to new lockdown announcement | News | Activity Alliance,"{'neg': 0.0, 'neu': 1.0, 'pos': 0.0, 'compound': 0.0}"
6,2020-11-03 11:59:55+00:00,RT Our administration literally left this White House a playbook that would have shown them how to respond before COVID-19 re...,"{'neg': 0.0, 'neu': 1.0, 'pos': 0.0, 'compound': 0.0}"
7,2020-11-03 11:59:55+00:00,RT Nearly a quarter of a million covid-19 deaths and still no pandemic strategy,"{'neg': 0.145, 'neu': 0.855, 'pos': 0.0, 'compound': -0.296}"
8,2020-11-03 11:59:55+00:00,RT Our administration literally left this White House a playbook that would have shown them how to respond before COVID-19 re...,"{'neg': 0.0, 'neu': 1.0, 'pos': 0.0, 'compound': 0.0}"
9,2020-11-03 11:59:55+00:00,"To all my #American #USA friends; Stay safe, stay at home &amp; stack sats.

#ElectionDay #Elections2020 #Bitcoin","{'neg': 0.0, 'neu': 0.714, 'pos': 0.286, 'compound': 0.7184}"
10,2020-11-03 11:59:55+00:00,"RT Whitty &amp; Vallance face Science &amp; Technology Committee at 2.30pm today to explain alarmist graphs from Saturday, why the...","{'neg': 0.0, 'neu': 1.0, 'pos': 0.0, 'compound': 0.0}"
11,2020-11-03 11:59:55+00:00,Have you ever thought of all the horrors we would have avoided if did impeached Trump when they had the chance? The number of Covid deaths that could have been avoided? GOP is as much in this failure as Trump himself. May this day be of justice and reckoning for all victims.,"{'neg': 0.229, 'neu': 0.669, 'pos': 0.102, 'compound': -0.8532}"
12,2020-11-03 11:59:55+00:00,Oh even amidst a Covid-19-stricken era?,"{'neg': 0.0, 'neu': 1.0, 'pos': 0.0, 'compound': 0.0}"
13,2020-11-03 11:59:55+00:00,I'm gonna put all this down to some kind of covid fever and assume everyone will go back to their normal next year.,"{'neg': 0.0, 'neu': 1.0, 'pos': 0.0, 'compound': 0.0}"
14,2020-11-03 11:59:55+00:00,Don't forget other outdoor sports :- open water swimming and kayaking if you are confident you are kayaking within your skill set!,"{'neg': 0.0, 'neu': 0.795, 'pos': 0.205, 'compound': 0.6319}"
15,2020-11-03 11:59:55+00:00,RT Ballot Dropboxes remain in D2 City Hall thru tomorrow 8pm. Like other uncertain times in his...,"{'neg': 0.112, 'neu': 0.761, 'pos': 0.127, 'compound': 0.0772}"
16,2020-11-03 11:59:55+00:00,"RT Soooo we are going into another lockdown, back open for Christmas so that we all spend money on presents and Christmas part...","{'neg': 0.0, 'neu': 1.0, 'pos': 0.0, 'compound': 0.0}"
17,2020-11-03 11:59:55+00:00,"RT Solskjaer: ""Alex [Telles] needs to be negative on his next [coronavirus] test, so let's hope we can get him back as soon as p...","{'neg': 0.124, 'neu': 0.77, 'pos': 0.106, 'compound': -0.1335}"
18,2020-11-03 11:59:55+00:00,most countries have had their low period but are having peaks now due to 'pandemic fatigue' and quite frankly some stupid ideas like opening up clubs and pubs (that's what's happening in south africa). the US never had that resting period.,"{'neg': 0.183, 'neu': 0.751, 'pos': 0.066, 'compound': -0.6999}"
19,2020-11-03 11:59:55+00:00,"RT CAMRA has blasted the proposed ban on pubs and brewers selling takeaway beer during the impending lockdown in England,...","{'neg': 0.159, 'neu': 0.841, 'pos': 0.0, 'compound': -0.5574}"
20,2020-11-03 11:59:55+00:00,"I have to say that as far as members are concerned 1/2 term is the worse time for partial closures. After a 1/2 term of masks, and Covid regulations its the last thing we'd expect ! Certainly my husband was looking forward as a teacher of 11-18 yr olds to the visit","{'neg': 0.061, 'neu': 0.896, 'pos': 0.043, 'compound': -0.2481}"
21,2020-11-03 11:59:55+00:00,"RT As rich countries hoard potential coronavirus vaccine doses, rest of world could go without","{'neg': 0.0, 'neu': 0.795, 'pos': 0.205, 'compound': 0.5574}"
22,2020-11-03 11:59:55+00:00,"We're thrilled to bring you a conversation with Ryan Weber, VP of Talent Activation and Chief Learning Officer, about growing your team in the age of Covid. Register today for insight into bringing in new team members or developing the team you already have!","{'neg': 0.0, 'neu': 0.842, 'pos': 0.158, 'compound': 0.7712}"
23,2020-11-03 11:59:55+00:00,"RT  As a result of the government's new national COVID-19 restrictions, The FA have issued an update regarding their impact...","{'neg': 0.0, 'neu': 1.0, 'pos': 0.0, 'compound': 0.0}"
24,2020-11-03 11:59:55+00:00,"RT Whitty &amp; Vallance face Science &amp; Technology Committee at 2.30pm today to explain alarmist graphs from Saturday, why the...","{'neg': 0.0, 'neu': 1.0, 'pos': 0.0, 'compound': 0.0}"
25,2020-11-03 11:59:55+00:00,"#stockmarket today
#Nifty #NSEUPDATE #BSE #sensex #RBIPolicy #goldrate #NASDAQ #SP500 #COVID19 #financialeducation","{'neg': 0.0, 'neu': 0.803, 'pos': 0.197, 'compound': 0.4019}"
26,2020-11-03 11:59:56+00:00,Beat Covid and swamp over and over. He's a strong fighter for .,"{'neg': 0.0, 'neu': 0.692, 'pos': 0.308, 'compound': 0.5994}"
27,2020-11-03 11:59:56+00:00,"Your Cinema Podcast: Ep.2 - Ft Shaq B. Grant - Networking through read-throughs, acting during COVID &amp; More! | LISTEN NOW
https://t.co/cPwFKvAnDu","{'neg': 0.0, 'neu': 0.883, 'pos': 0.117, 'compound': 0.4199}"
28,2020-11-03 11:59:56+00:00,RT Yesterday I met about campaign to ensure care homes are not banned from allowing family visits during lo...,"{'neg': 0.0, 'neu': 0.659, 'pos': 0.341, 'compound': 0.8063}"
29,2020-11-03 11:59:56+00:00,"RT Okay nak bercerita jap. 

i went to ikea last week and my ticket fee was rm7. I only had rm5 in my pocket. I couldnt pay f...","{'neg': 0.0, 'neu': 0.891, 'pos': 0.109, 'compound': 0.2951}"
30,2020-11-03 11:59:56+00:00,"Listen up shitdicks! If any US citizens need a green card after today, I'm single. Politics aren't great here either and covid is still on a rampage but you won't get shot and there's a lot less racist rightwingers. Plus, there's great healthcare.","{'neg': 0.141, 'neu': 0.753, 'pos': 0.106, 'compound': -0.2142}"
31,2020-11-03 11:59:56+00:00,.@aimi_walton found that socially distanced face-to-face interviews (with practitioners) went well; but her plans to do more of these have been paused by lockdown 2.0,"{'neg': 0.0, 'neu': 0.939, 'pos': 0.061, 'compound': 0.1406}"
32,2020-11-03 11:59:56+00:00,RT (3/3) As of Nov. 21 it will be mandatory for travellers to Canada to use #ArriveCAN or call 1-833-641-0343 toll-free  wit...,"{'neg': 0.0, 'neu': 0.942, 'pos': 0.058, 'compound': 0.0772}"
33,2020-11-03 11:59:56+00:00,"RT For many, initial lockdown anger and anxiety moves to resigned acceptance. Don't let the difficult weeks ahead be in v...","{'neg': 0.26, 'neu': 0.561, 'pos': 0.179, 'compound': -0.316}"
34,2020-11-03 11:59:56+00:00,RT I have 3 friends who have tested positive for corona in less than 2 weeks  the symptoms they are having is more than j...,"{'neg': 0.0, 'neu': 0.774, 'pos': 0.226, 'compound': 0.7717}"
35,2020-11-03 11:59:56+00:00,"RT Women, youth and persons living with disabilities require our special attention, especially now when we are battling the...","{'neg': 0.096, 'neu': 0.78, 'pos': 0.124, 'compound': 0.1531}"
36,2020-11-03 11:59:56+00:00,"RT Update

As a support group, we're able to welcome participants of less than 15. So our EnJOY Seated Dance can go ahead, wi...","{'neg': 0.0, 'neu': 0.696, 'pos': 0.304, 'compound': 0.8473}"
37,2020-11-03 11:59:56+00:00,"RT Apparently, police in Wales are patrolling custard purchases as part of the lockdown. Fucking ridiculous.","{'neg': 0.157, 'neu': 0.843, 'pos': 0.0, 'compound': -0.4201}"
38,2020-11-03 11:59:56+00:00,Sir please help me sir covid19 lock down very money problems sir please help me my   phonepay number 7989872209 ,"{'neg': 0.109, 'neu': 0.477, 'pos': 0.414, 'compound': 0.7447}"
39,2020-11-03 11:59:56+00:00,"#ElectionDay I really think that something really bad could happen under Biden's administration... but then again, Covid 19 happened under Trump's.","{'neg': 0.107, 'neu': 0.893, 'pos': 0.0, 'compound': -0.3392}"
40,2020-11-03 11:59:56+00:00,"RT After 11 Lakh humans died of a virus, China has stopped all the inquries on how the virus spread. WHO is its accomplice...","{'neg': 0.2, 'neu': 0.8, 'pos': 0.0, 'compound': -0.6705}"
41,2020-11-03 11:59:56+00:00,Great news for all those who want to grab a coffee with a healthy outdoors walk during lockdown,"{'neg': 0.0, 'neu': 0.649, 'pos': 0.351, 'compound': 0.7964}"
42,2020-11-03 11:59:56+00:00,RT Our administration literally left this White House a playbook that would have shown them how to respond before COVID-19 re...,"{'neg': 0.0, 'neu': 1.0, 'pos': 0.0, 'compound': 0.0}"
43,2020-11-03 11:59:56+00:00,RT Q1. Have you or any of your senior goverment officials been to a grassroots game since lockdown ? Do you have any idea w...,"{'neg': 0.0, 'neu': 1.0, 'pos': 0.0, 'compound': 0.0}"
44,2020-11-03 11:59:56+00:00,"RT There needs to be a perspective shift from individual want to collective responsibility, and if you're not considering vu...","{'neg': 0.0, 'neu': 0.936, 'pos': 0.064, 'compound': 0.0772}"
45,2020-11-03 11:59:56+00:00,"RT The numbers are still higher than the Scottish average 

https://t.co/FVoCXGeAke","{'neg': 0.0, 'neu': 1.0, 'pos': 0.0, 'compound': 0.0}"
46,2020-11-03 11:59:56+00:00,"RT A healthy young man died today. He had covid 19 and apparently no other co morbidity.

This wasn't ""just"" loss of taste l...","{'neg': 0.19, 'neu': 0.657, 'pos': 0.153, 'compound': -0.2819}"
47,2020-11-03 11:59:56+00:00,"RT Cristiano Ronaldo got the corona virus, came back, played just 35 minutes and still managed to score more league goals t...","{'neg': 0.0, 'neu': 0.897, 'pos': 0.103, 'compound': 0.34}"
48,2020-11-03 11:59:56+00:00,"Congrats USA 100,00  cases in one day! Dark winter ahead! Vote safely! #VoteResponsibly","{'neg': 0.0, 'neu': 0.595, 'pos': 0.405, 'compound': 0.8164}"
49,2020-11-03 11:59:57+00:00,RT Found a source -,"{'neg': 0.0, 'neu': 1.0, 'pos': 0.0, 'compound': 0.0}"
50,2020-11-03 11:59:57+00:00,"Ya, GOP okay with Covid patients receiving life-or-death treatment in tents, but, god forbid, one could keep a ballot secure in one.

How ever do they manage to run entire wars full of secure communications from tents in the desert?

...Gonna be a lonnng day.","{'neg': 0.137, 'neu': 0.682, 'pos': 0.18, 'compound': 0.1154}"
51,2020-11-03 11:59:57+00:00,RT I've been COVID free this whole pandemic! Thank you God for keeping me covered!,"{'neg': 0.0, 'neu': 0.586, 'pos': 0.414, 'compound': 0.8168}"
52,2020-11-03 11:59:57+00:00,"RT so wild how fox news is pretending like ""dark winter"" was a biden campaign promise about his general vision of the country,...","{'neg': 0.0, 'neu': 0.699, 'pos': 0.301, 'compound': 0.7351}"
53,2020-11-03 11:59:57+00:00,i'd also like to add due to a weird isolated childhoodi have no idea how to host/entertain guests and as nothing will be open she'll just be hanging out at our gaff and i think that fills me with more anxiety than covid lmaoooooo,"{'neg': 0.165, 'neu': 0.785, 'pos': 0.05, 'compound': -0.5709}"
54,2020-11-03 11:59:57+00:00,RT Happy Last Day of COVID!!! ,"{'neg': 0.0, 'neu': 0.522, 'pos': 0.478, 'compound': 0.6784}"
55,2020-11-03 11:59:57+00:00,"RT Double promotion and salary increase in the middle of a pandemic and chaos.
God ","{'neg': 0.184, 'neu': 0.597, 'pos': 0.219, 'compound': -0.0772}"
56,2020-11-03 11:59:57+00:00,RT Please wear a mask for your and others safety.,"{'neg': 0.0, 'neu': 0.611, 'pos': 0.389, 'compound': 0.6249}"
57,2020-11-03 11:59:57+00:00,"Look how much our lives have changed in 4 yrs:
4 yrs ago we didn't have a poorly run pandemic, we didn't have daily scandals, we had some faith in our government, we weren't the laughing stock of the world, we didn't get gaslighted constantly. 

#MakeAmericaSaneAgain #vote","{'neg': 0.05, 'neu': 0.845, 'pos': 0.104, 'compound': 0.4215}"
58,2020-11-03 11:59:57+00:00,"Dear Mr. , I am so glad that Amazon's profit is tripled during the Corona pandemy. But if you don't mind, could you raise our wage a bit? Thank you so much if you have spared some time to read my tweet.","{'neg': 0.0, 'neu': 0.801, 'pos': 0.199, 'compound': 0.8143}"
59,2020-11-03 11:59:57+00:00,RT 1) The age group that's reporting the most dramatic increase in #COVID19 infections in Montreal -- as well as the highest...,"{'neg': 0.0, 'neu': 0.81, 'pos': 0.19, 'compound': 0.5688}"
60,2020-11-03 11:59:57+00:00,"This is what real Voter suppression looks like in PA. Do not let them stop you from voting fellow Pennsylvanians. 

Using a pandemic to suppress votes. These people are sick. 

VOTE STRAIGHT TICKET PA. #RedWave2020 #DrainTheSwamp #RedTsunami2020","{'neg': 0.076, 'neu': 0.762, 'pos': 0.162, 'compound': 0.4061}"
61,2020-11-03 11:59:57+00:00,RT,"{'neg': 0.0, 'neu': 1.0, 'pos': 0.0, 'compound': 0.0}"
62,2020-11-03 11:59:57+00:00,"RT Roughly 80 COVID-19 beds in Delhi's RML Hospital, 140 in Safdarjung Hospital, over 1,200 beds in AIIMS still vacant: Health M...","{'neg': 0.0, 'neu': 1.0, 'pos': 0.0, 'compound': 0.0}"
63,2020-11-03 11:59:58+00:00,"RT You do not need to be an epidemiologist to know this lockdown is wrong. 

My friend and colleague, Ewen Stewart, explains he...","{'neg': 0.114, 'neu': 0.769, 'pos': 0.117, 'compound': 0.0258}"
64,2020-11-03 11:59:58+00:00,"RT It's strange how the virus attacks Trump rallies and lockdown protesters... but not Black Lives Matter protesters.

In fact,...","{'neg': 0.355, 'neu': 0.645, 'pos': 0.0, 'compound': -0.6441}"
65,2020-11-03 11:59:58+00:00,"RT So the Trump sycophant who just today claimed, without a shred of evidence, that there is voter fraud in Ph...","{'neg': 0.16, 'neu': 0.84, 'pos': 0.0, 'compound': -0.5859}"
66,2020-11-03 11:59:58+00:00,RT Wow: Prince William secretly battled #COVID19 and **even struggled to breathe**--but kept his April ordeal a secret because...,"{'neg': 0.189, 'neu': 0.656, 'pos': 0.156, 'compound': 0.0516}"
67,2020-11-03 11:59:58+00:00,Are Republicans or Democrats better for the stock market?,"{'neg': 0.0, 'neu': 0.734, 'pos': 0.266, 'compound': 0.4404}"
68,2020-11-03 11:59:58+00:00,RT Super-spreader rallies in the middle of a pandemic,"{'neg': 0.0, 'neu': 1.0, 'pos': 0.0, 'compound': 0.0}"
69,2020-11-03 11:59:58+00:00,RT UK Prime Minister Boris Johnson announced a month-long lockdown for England after weeks of sharply rising Covid-19 cases h...,"{'neg': 0.0, 'neu': 1.0, 'pos': 0.0, 'compound': 0.0}"
70,2020-11-03 11:59:58+00:00,"RT Our elected officials have left us to starve and die during a global pandemic. On every level, on both sides, those we have...","{'neg': 0.236, 'neu': 0.764, 'pos': 0.0, 'compound': -0.7783}"
71,2020-11-03 11:59:58+00:00,"RT How does Trump have the energy for this many scandals?

@roywoodjr counts down Trump's top 25 most tremendous scandals fr...","{'neg': 0.25, 'neu': 0.61, 'pos': 0.14, 'compound': -0.6214}"
72,2020-11-03 11:59:58+00:00,"'We need to be learning to live with COVID, to coexist with COVID, with caution."" 
Ottawa's Medical Officer of Health,  Dr. Vera Etches, says it is time to learn to live with COVID-19  #cdnpoli","{'neg': 0.0, 'neu': 1.0, 'pos': 0.0, 'compound': 0.0}"
73,2020-11-03 11:59:58+00:00,"RT I'm furious at people saying ""we've survived four years of Trump, we can survive four more"" -- I've known a lot of people who...","{'neg': 0.123, 'neu': 0.767, 'pos': 0.11, 'compound': -0.1027}"
74,2020-11-03 11:59:58+00:00,"RT Primark sees demand for pyjamas grow and suit sales fall, reflecting shift in life since Covid","{'neg': 0.086, 'neu': 0.914, 'pos': 0.0, 'compound': -0.128}"
75,2020-11-03 11:59:58+00:00,RT Army mass testing (with people paid PS500 to isolate of 'positive') is designed to make sure 'cases' go up again to justify...,"{'neg': 0.065, 'neu': 0.722, 'pos': 0.213, 'compound': 0.6249}"
76,2020-11-03 11:59:58+00:00,"RT Today we can elect Christina Finello to Congress in #PA01! 

She will:

 Protect a Woman's Right To Choose.
Improve the ACA an...","{'neg': 0.0, 'neu': 0.784, 'pos': 0.216, 'compound': 0.6996}"
77,2020-11-03 11:59:58+00:00,"And he's SORT of a stay-at-home dad!! Because he works from home, and when A-Yuan isn't in school, they're together, doing arts and crafts and learning to read and count and drawing pictures of when WWX comes home to new masterpieces for the fridge (and the walls; and the floor)","{'neg': 0.0, 'neu': 0.923, 'pos': 0.077, 'compound': 0.6229}"
78,2020-11-03 11:59:58+00:00,RT Wandsworth Council is launching a new Wandsworth-based case tracing system this week for people who test positive for #COVID19...,"{'neg': 0.0, 'neu': 0.841, 'pos': 0.159, 'compound': 0.5574}"
79,2020-11-03 11:59:58+00:00,"RT #COVID19 update (02 Nov):

Subject to a vote in Parliament, England will move into national lockdown this Thursday. That m...","{'neg': 0.0, 'neu': 1.0, 'pos': 0.0, 'compound': 0.0}"
80,2020-11-03 11:59:58+00:00,"RT At 102 years old, my great aunt, born the year of our last great #pandemic, made her way to the ballot box to cast her...","{'neg': 0.0, 'neu': 0.745, 'pos': 0.255, 'compound': 0.8481}"
81,2020-11-03 11:59:58+00:00,"RT Some folks are downplaying this as too little too late, but a memo from the coordinator of the task force directly cont...","{'neg': 0.0, 'neu': 1.0, 'pos': 0.0, 'compound': 0.0}"
82,2020-11-03 11:59:58+00:00,RT Trump can't fire or cancel Dr. Fauci... because he belongs to America and the world. Suck it #COVID19 htt...,"{'neg': 0.122, 'neu': 0.718, 'pos': 0.159, 'compound': -0.032}"
83,2020-11-03 11:59:58+00:00,I'm a mech engr n lost my job during this pandemic and since then feeding v been a very big issue for me. Pls am nt begging for food though I won't still reject if given but my major need now is a job evn if it's a casual job or driving.pls help me out. Am dying of depression. RT,"{'neg': 0.097, 'neu': 0.78, 'pos': 0.123, 'compound': -0.0441}"
84,2020-11-03 11:59:58+00:00,"RT Second: how the government bypassed not only the NHS, but all reasonable standards of accountability and transparency in...","{'neg': 0.0, 'neu': 1.0, 'pos': 0.0, 'compound': 0.0}"
85,2020-11-03 11:59:58+00:00, sir pls support the students of Telangana. Promote the students based on internal exams without exams in this covid tym #KTRSpeakOnStudentIssues,"{'neg': 0.0, 'neu': 0.732, 'pos': 0.268, 'compound': 0.6808}"
86,2020-11-03 11:59:58+00:00,RT Yes we are fully stocked. Thank you all for being reasonable humans  doing your regular shopping. We'll be open throu...,"{'neg': 0.0, 'neu': 0.776, 'pos': 0.224, 'compound': 0.6682}"
87,2020-11-03 11:59:58+00:00,RT How No10's experts manipulated data to terrify England into lockdown via,"{'neg': 0.371, 'neu': 0.629, 'pos': 0.0, 'compound': -0.7096}"
88,2020-11-03 11:59:59+00:00,account is temporarily unavailable because it violates the Twitter Media Policy. Learn more.,"{'neg': 0.216, 'neu': 0.784, 'pos': 0.0, 'compound': -0.5106}"
89,2020-11-03 11:59:59+00:00,"201103
I think it's winter right after I skipped autumn, I don't think I enjoyed the 4 seasons, it's unfair Everyone, the daily temperature range is huge. Be careful not to catch a cold!
(This is the shop, I always wear a mask)

(#/ProductPresentation)","{'neg': 0.122, 'neu': 0.8, 'pos': 0.078, 'compound': -0.4929}"
90,2020-11-03 11:59:59+00:00,"Row 31: #LOTI  and are coordinating efforts for London local authorities to share data, and enable the provision of free school meal vouchers across authority boundaries.

More info: #Covid19","{'neg': 0.0, 'neu': 0.793, 'pos': 0.207, 'compound': 0.7003}"
91,2020-11-03 11:59:59+00:00,"RT As a result of the government's new national COVID-19 restrictions, we've issued an update regarding their impact on 'non-elite' fo...","{'neg': 0.0, 'neu': 1.0, 'pos': 0.0, 'compound': 0.0}"
92,2020-11-03 11:59:59+00:00,"RT Top White House adviser Deborah Birx bluntly contradicts Trump on coronavirus threat, urging all-out response","{'neg': 0.282, 'neu': 0.631, 'pos': 0.087, 'compound': -0.6124}"
93,2020-11-03 11:59:59+00:00,"RT Breaking:  More than 61,000 children got Covid-19 last week.  It's appalling the Trump and Fox are spreading lies that chi...","{'neg': 0.218, 'neu': 0.782, 'pos': 0.0, 'compound': -0.6486}"
94,2020-11-03 11:59:59+00:00,"RT Fully funded PhD studentship in population mental health!  Health inequalities, syndemics, smoking, COVID and #SevereMent...","{'neg': 0.0, 'neu': 1.0, 'pos': 0.0, 'compound': 0.0}"
95,2020-11-03 11:59:59+00:00,RT Buhari is worse than COVID-19!,"{'neg': 0.404, 'neu': 0.596, 'pos': 0.0, 'compound': -0.5255}"
96,2020-11-03 11:59:59+00:00,RT I think the morning shows have an obligation to voters to relay this critical information before they cast their ballots tomor...,"{'neg': 0.111, 'neu': 0.889, 'pos': 0.0, 'compound': -0.3869}"
97,2020-11-03 11:59:59+00:00,"RT Despite being evicted from the BBNaija lockdown show, Erica Nlewedim has a strong twitter family that has her back even mo...","{'neg': 0.0, 'neu': 0.864, 'pos': 0.136, 'compound': 0.5106}"
98,2020-11-03 11:59:59+00:00,"RT DR. BIRX: ""We are entering the most concerning and most deadly phase of this pandemic...leading to increasing mortality. This...","{'neg': 0.0, 'neu': 1.0, 'pos': 0.0, 'compound': 0.0}"
99,2020-11-03 11:59:59+00:00,"Honestly, ""Bringing down the Hammer"" and forcing people on a totalitarian scale to take off from work (a.k.a. ""Lockdown"") is precisely the political platform I interpreted #COVID to be advocating for...I said that last Spring, and I'll say it on Election Day.","{'neg': 0.067, 'neu': 0.868, 'pos': 0.065, 'compound': -0.0258}"
100,2020-11-03 12:00:00+00:00,RT Pleased to see some Republicans who are Asian American now fully understand how racist is. When uses t...,"{'neg': 0.176, 'neu': 0.704, 'pos': 0.12, 'compound': -0.3321}"
101,2020-11-03 12:00:00+00:00,"So, the Job Retention Scheme has been extended in light of Lockdown 2.0. 

We decided to pop everything you need to know in a blog. Check it out. 

https://t.co/884bSmo0k9

#jobretentionscheme #covid19 #lockdown2.0 #businessnews #accounting","{'neg': 0.0, 'neu': 1.0, 'pos': 0.0, 'compound': 0.0}"
102,2020-11-03 12:00:00+00:00,"RT 7 months on, Marcus Rashford has ""made the contribution"" of helping to feed thousands of hungry children across the UK whilst...","{'neg': 0.0, 'neu': 0.905, 'pos': 0.095, 'compound': 0.296}"
103,2020-11-03 12:00:00+00:00,"Of course. The SNP are all about that 'independence', until cash is involved, then it's all Oliver Twist 'can we have some more?'.","{'neg': 0.0, 'neu': 1.0, 'pos': 0.0, 'compound': 0.0}"
104,2020-11-03 12:00:00+00:00,Polls are open until 8pm! Check out for resources. And remember - some polling locations had to be changed because of #COVID19 - check for updated information to make sure you go to the right place! #VOTE #GOTV #2020Election #mapoli,"{'neg': 0.0, 'neu': 0.931, 'pos': 0.069, 'compound': 0.4374}"
105,2020-11-03 12:00:00+00:00,"Cumbria's director of public health warns national Covid-19 lockdown 'not an excuse to party'.

Story:","{'neg': 0.151, 'neu': 0.693, 'pos': 0.156, 'compound': 0.2681}"
106,2020-11-03 12:00:00+00:00,RT Parents don't ignore signs of #type1diabetes because of COVID-19. Children can develop #type1diabetes at any time - if...,"{'neg': 0.0, 'neu': 0.895, 'pos': 0.105, 'compound': 0.2755}"
107,2020-11-03 12:00:00+00:00,"RT First lady Melania Trump gave her fourth solo campaign speech on Monday afternoon in Huntersville, North Carolina. She slammed Dem...","{'neg': 0.0, 'neu': 1.0, 'pos': 0.0, 'compound': 0.0}"
108,2020-11-03 12:00:00+00:00,"Wokingham Today's editorial was written before national lockdown measures were announced, but the message remains the same: 

Do not panic, be kind and calm, and continue to think of our community. 

https://t.co/nn5TF343Fu

#woky #wokytoday #wokingham #wokinghamtoday #reading","{'neg': 0.083, 'neu': 0.77, 'pos': 0.147, 'compound': 0.4289}"
109,2020-11-03 12:00:00+00:00,"most authoritative scientific research center has concluded that the laboratory hypothesis ""is not a conspiracy theory"" but a real possibility

#French","{'neg': 0.0, 'neu': 0.914, 'pos': 0.086, 'compound': 0.2235}"
110,2020-11-03 12:00:00+00:00,"Feature: takes a look at the return of women's sport since the national lockdown and how improvements can be achieved in the new season. 

https://t.co/tf5Te3vMpX","{'neg': 0.0, 'neu': 0.913, 'pos': 0.087, 'compound': 0.3182}"
111,2020-11-03 12:00:00+00:00,Check this out. Facts and Justice Matter.,"{'neg': 0.0, 'neu': 0.526, 'pos': 0.474, 'compound': 0.5423}"
112,2020-11-03 12:00:00+00:00,"'During lockdown, I have been working as a volunteer for ...' 
Great to see featured in latest Annual Review. 

To read more about Amy's story 
@ehucareers","{'neg': 0.0, 'neu': 0.859, 'pos': 0.141, 'compound': 0.6249}"
