,created_at,full_text,sentiment_score
124,2020-11-13 17:59:59+00:00,I knew I saw  in DC this morning. Now it makes sense.,"{'neg': 0.0, 'neu': 1.0, 'pos': 0.0, 'compound': 0.0}"
125,2020-11-13 17:59:59+00:00,Wow Donald must be nice to sit around watching the Masters and tweeting.  Why don't you do your job and figure out how the hell you can enact policy to help alleviate the rise in Covid.  Quite clear you don't care,"{'neg': 0.133, 'neu': 0.643, 'pos': 0.224, 'compound': 0.6079}"
126,2020-11-13 17:59:59+00:00,RT Is she talking about the same human beings that have been throwing parties with no mask? Flying to other ci...,"{'neg': 0.092, 'neu': 0.795, 'pos': 0.113, 'compound': 0.128}"
127,2020-11-13 17:59:59+00:00,"RT Well said by Justice Alito:

""The pandemic has resulted in previous unimaginable restrictions on individual liberty... T...","{'neg': 0.0, 'neu': 0.628, 'pos': 0.372, 'compound': 0.836}"
128,2020-11-13 17:59:59+00:00,That's good your grades good as they always been but I completely understand It could be hard to really focus with the covid shit still goin on gotta take this school shit day by day you gone get through it ,"{'neg': 0.227, 'neu': 0.696, 'pos': 0.078, 'compound': -0.8591}"
129,2020-11-13 17:59:59+00:00,"RT [NEW]We've updated the weekly #COVID19 alert map using data aligned to safety protocols.
We are awa...","{'neg': 0.0, 'neu': 0.75, 'pos': 0.25, 'compound': 0.6124}"
130,2020-11-13 17:59:59+00:00,"Suicide figures are up 200% since lockdown. Could 2 friends please copy and re-post this tweet? We're trying to demonstrate that someone is always listening. 

Call 1-800-273-8255 (USA hotline)

Just two. Any two. Copy, not retweet.","{'neg': 0.105, 'neu': 0.769, 'pos': 0.126, 'compound': -0.0258}"
131,2020-11-13 18:00:00+00:00,RT Wash Post: More than 130 Secret Service officers are said to be infected with coronavirus or quarantining in wake of Tr...,"{'neg': 0.132, 'neu': 0.868, 'pos': 0.0, 'compound': -0.4939}"
132,2020-11-13 18:00:00+00:00,"The Oldest Man in Congress Mocked COVID, and Now He Has It

https://t.co/UkiCsNrTTP","{'neg': 0.161, 'neu': 0.839, 'pos': 0.0, 'compound': -0.3182}"
133,2020-11-13 18:00:00+00:00,RT Corona Virus explained in craft terms: you and 9 friends are crafting. 1 is using glitter. How many projects have glitt...,"{'neg': 0.0, 'neu': 0.871, 'pos': 0.129, 'compound': 0.4767}"
134,2020-11-13 18:00:00+00:00,"RT Rishi, how about Fly Out to Help Out? Give us discounts on plane tickets sha. We've eaten enough ","{'neg': 0.0, 'neu': 0.87, 'pos': 0.13, 'compound': 0.4019}"
135,2020-11-13 18:00:00+00:00,Liverpool forward Salah tests positive for coronavirus,"{'neg': 0.0, 'neu': 0.625, 'pos': 0.375, 'compound': 0.5574}"
136,2020-11-13 18:00:00+00:00,"RT Question for anyone who's had COVID. (Yes, I know there's a slight survivorship bias).

How did you feel 6 weeks after yo...","{'neg': 0.045, 'neu': 0.846, 'pos': 0.109, 'compound': 0.3774}"
137,2020-11-13 18:00:00+00:00,RT Staying at home to self-isolate is crucial to stopping the spread of Coronavirus. Support is available. Call the Contact C...,"{'neg': 0.069, 'neu': 0.815, 'pos': 0.116, 'compound': 0.2732}"
138,2020-11-13 18:00:00+00:00,"are you feeling okay otherwise? i know a few people our age that had covid and their only symptoms were extreme fatigue and mild allergy-ish symptoms ...a basic cough, itchy nose and throat","{'neg': 0.119, 'neu': 0.788, 'pos': 0.092, 'compound': -0.2484}"
139,2020-11-13 18:00:00+00:00,Biden coronavirus adviser suggests locking down U.S. for 4 to 6 weeks via,"{'neg': 0.0, 'neu': 1.0, 'pos': 0.0, 'compound': 0.0}"
140,2020-11-13 18:00:00+00:00,"""Why do the West call it misinformation? It's disinformation. 
It is meant to manipulate you"".

@mariaressa in conversation with discuss digital disinformation campaigns amid the pandemic.","{'neg': 0.084, 'neu': 0.916, 'pos': 0.0, 'compound': -0.3182}"
141,2020-11-13 18:00:00+00:00,"JUDITH WHEATON, 77, of Milford, MA died of COVID on Nov. 6. 

She was a retired nurse.

""My mother passed away last Friday...Due to lockdown protocols, we were unable to visit her until she had started hospice care and was on sedatives and pain medications, and unresponsive.""","{'neg': 0.128, 'neu': 0.813, 'pos': 0.059, 'compound': -0.5719}"
142,2020-11-13 18:00:00+00:00,"Choosing to earn a living from home once the pandemic ends is a privilege and should be taxed, according to strategists from Deutsche Bank. #OfficeSpace #WorkFromHome #COVID19 
https://t.co/W60lfChnRj","{'neg': 0.0, 'neu': 0.915, 'pos': 0.085, 'compound': 0.3612}"
143,2020-11-13 18:00:00+00:00,It might be that Biden's crowd will be small. Not because he doesn't have support but due to COVID.,"{'neg': 0.083, 'neu': 0.917, 'pos': 0.0, 'compound': -0.1603}"
144,2020-11-13 18:00:00+00:00,"Thank you to the generous group from Prior Lake who previously donated over 4,200 masks to multiple organizations, including Children's Minnesota! We are so grateful for all the donations we've received during COVID-19.

More:","{'neg': 0.0, 'neu': 0.757, 'pos': 0.243, 'compound': 0.8738}"
145,2020-11-13 18:00:00+00:00,"Christmas lunch for golden oldies

Forty Hanover Park seniors got to spend some time together for the first time since the Covid-19 lockdown started in March.
https://t.co/cW4PKLuGlT
Story:","{'neg': 0.0, 'neu': 1.0, 'pos': 0.0, 'compound': 0.0}"
146,2020-11-13 18:00:00+00:00,"Lockdown ni tak sihat ye sebab

Queens gambit, doctor john, holidate, rich in love, rogue city, anna, dash and lily, hospital playlists","{'neg': 0.0, 'neu': 0.719, 'pos': 0.281, 'compound': 0.8316}"
147,2020-11-13 18:00:00+00:00,"We'd like to hear from Kentuckians who have already recovered from COVID-19 but continue to live with long-term symptoms such as brain fog and memory loss. This group is sometimes called long haulers. If this is you, please contact at aacquisto@herald-leader.com.","{'neg': 0.065, 'neu': 0.832, 'pos': 0.103, 'compound': 0.1901}"
148,2020-11-13 18:00:00+00:00,"The 2021 National #CowboyPoetryGathering was cancelled due to the COVID-19 pandemic, so the Center instead is offering its members an online ""Rodear Year"" gathering Jan. 30. Details and WFC membership info here: #cowboys","{'neg': 0.059, 'neu': 0.941, 'pos': 0.0, 'compound': -0.25}"
149,2020-11-13 18:00:00+00:00,"Black &amp; Brown voters have spoken! Now it's time for a just recovery from COVID &amp; just transition from dirty oil that serve our communities. At ECCEJ Committee meeting on oil drilling today, can lead by moving a 2500ft buffer. #NoDrillingWhereWereLiving!","{'neg': 0.08, 'neu': 0.92, 'pos': 0.0, 'compound': -0.5399}"
150,2020-11-13 18:00:00+00:00,"Watch Chris Stapleton Celebrate a 'Very COVID Christmas' With These Socially Distanced Carols
https://t.co/gA7bnqgqFr
Presented by","{'neg': 0.0, 'neu': 0.802, 'pos': 0.198, 'compound': 0.5719}"
151,2020-11-13 18:00:00+00:00,"Watch Chris Stapleton Celebrate a 'Very COVID Christmas' With These Socially Distanced Carols
https://t.co/sJdoKY0t9c
Presented by","{'neg': 0.0, 'neu': 0.802, 'pos': 0.198, 'compound': 0.5719}"
152,2020-11-13 18:00:00+00:00,Don't forget how mfs treated you when they got all that pandemic money,"{'neg': 0.0, 'neu': 0.878, 'pos': 0.122, 'compound': 0.1695}"
153,2020-11-13 18:00:00+00:00,"We filed a lawsuit in June for information on roughly $600 billion in loans to small businesses affected by the pandemic, including the names of recipients and loan amounts. And a federal judge ruled in our favor.","{'neg': 0.087, 'neu': 0.846, 'pos': 0.067, 'compound': 0.0516}"
154,2020-11-13 18:00:00+00:00,"With coronavirus cases climbing across the country, Gov. Gavin Newsom has joined with Oregon Governor Kate Brown and Washington Governor Jay Inslee, to issue travel advisories.

https://t.co/6kWJV9WU5n","{'neg': 0.0, 'neu': 1.0, 'pos': 0.0, 'compound': 0.0}"
155,2020-11-13 18:00:00+00:00,"Testing will be held November 16, 17, 18, 19, and 20 at the Williamson County Expo Center.  All testing will begin at 9:00 a.m. and run through 2:00 p.m., or until supplies run out.
https://t.co/xcEt7877uH","{'neg': 0.0, 'neu': 1.0, 'pos': 0.0, 'compound': 0.0}"
156,2020-11-13 18:00:00+00:00,"RT Government is now telling us how many people we can have in our homes for dinner. 

But will let you protest if you support...","{'neg': 0.086, 'neu': 0.792, 'pos': 0.122, 'compound': 0.2617}"
157,2020-11-13 18:00:00+00:00,"The CCP appears to have modeled its lockdown fraud on Event 201, so Gates, Hopkins, and the WEF would play into their hands [@MichaelPSenger]
https://t.co/eQYIzBLv8u

.@Presa_Diretta on SARS2 origins","{'neg': 0.114, 'neu': 0.813, 'pos': 0.072, 'compound': -0.34}"
158,2020-11-13 18:00:00+00:00,"RT Well said by Justice Alito:

""The pandemic has resulted in previous unimaginable restrictions on individual liberty... T...","{'neg': 0.0, 'neu': 0.628, 'pos': 0.372, 'compound': 0.836}"
159,2020-11-13 18:00:00+00:00,"Hear discuss how to keep supporting Canadians through a #COVID19 second wave--in ways that will also promote an inclusive, green recovery. #cdnmuni #cdnpoli","{'neg': 0.0, 'neu': 0.792, 'pos': 0.208, 'compound': 0.6705}"
160,2020-11-13 18:00:00+00:00,"If your current housing situation has changed due to COVID-19, please take a look at this flyer about housing assistance:","{'neg': 0.0, 'neu': 0.892, 'pos': 0.108, 'compound': 0.3182}"
161,2020-11-13 18:00:00+00:00,RT Stop worshipping billionaires. Elon Musk predicted the coronavirus would be gone 7 months ago. These people don't know what th...,"{'neg': 0.092, 'neu': 0.798, 'pos': 0.109, 'compound': 0.1027}"
162,2020-11-13 18:00:00+00:00,Here Gary Zank et al. investigate the origin of switchbacks in the solar corona #SolarPapers,"{'neg': 0.0, 'neu': 1.0, 'pos': 0.0, 'compound': 0.0}"
163,2020-11-13 18:00:01+00:00,"Stay safe. Continue to wear a mask, wash your hands, and practice social distancing to prevent the spread of COVID-19.
 
 Resources &gt;&gt;","{'neg': 0.0, 'neu': 0.833, 'pos': 0.167, 'compound': 0.4588}"
164,2020-11-13 18:00:01+00:00,"Are you a faculty member feeling challenged w/ incorporating #CommunityEngagement into your virtual course in the time of #COVID19? 

Join us NEXT THURSDAY, 11/19 for an interactive workshop w/ on transitioning to #DistanceLearning. 

https://t.co/tugNaLhG0l","{'neg': 0.039, 'neu': 0.859, 'pos': 0.102, 'compound': 0.3182}"
165,2020-11-13 18:00:01+00:00,"Think about what we should do, rather than what we can do. We can meet up to four people outdoors, and in regulated settings such as cafes, pubs and restaurants.

Follow the guidance and together, we can #KeepWalesSafe 
https://t.co/hsye4DKYe5","{'neg': 0.0, 'neu': 1.0, 'pos': 0.0, 'compound': 0.0}"
166,2020-11-13 18:00:01+00:00,"Covid negative report must for Karnataka colleges

#Covid19Outbreak Live updates:","{'neg': 0.291, 'neu': 0.709, 'pos': 0.0, 'compound': -0.5719}"
167,2020-11-13 18:00:01+00:00,RT With the announcement of several promising vaccines we can begin to see the light at the end of the tunnel. That doesn't m...,"{'neg': 0.0, 'neu': 0.895, 'pos': 0.105, 'compound': 0.4019}"
168,2020-11-13 18:00:01+00:00,"Overwhelmed! Pandemic fatigue! Family caregivers already deal w/ a lot of stress, but it's increasing with #CaregivingInCrisis. Now's a time to focus on your own self-care more than ever. A great first step is to reach out to CAN's Caregiver Help Desk!","{'neg': 0.066, 'neu': 0.697, 'pos': 0.237, 'compound': 0.8698}"
169,2020-11-13 18:00:01+00:00,Guess it really should be called the Trump virus!,"{'neg': 0.0, 'neu': 1.0, 'pos': 0.0, 'compound': 0.0}"
170,2020-11-13 18:00:01+00:00,$RLFTF long. #Covid19 can frig right  the hell off,"{'neg': 0.365, 'neu': 0.635, 'pos': 0.0, 'compound': -0.6808}"
171,2020-11-13 18:00:01+00:00,"FREE #COVID19 PCR Testing- 

WHEN: Fri, Nov 13 9A-2P
WHERE: 8651 Colorado Blvd

To pregister - or 
https://t.co/3IYHpXp4Rb. Call 303-538-7420 with ?'s.

**Rapid testing has been suspended until further notice**

@CDPHE","{'neg': 0.086, 'neu': 0.803, 'pos': 0.112, 'compound': 0.2342}"
172,2020-11-13 18:00:01+00:00,"Australia will reopen state and territory borders by Christmas, with the exception of Western Australia. #9News
https://t.co/FAkML8uYK5","{'neg': 0.0, 'neu': 1.0, 'pos': 0.0, 'compound': 0.0}"
173,2020-11-13 18:00:01+00:00,Please consider donating personal protective equipment to help us stop the spread of COVID-19: #COVIDToronto #PPE,"{'neg': 0.109, 'neu': 0.644, 'pos': 0.248, 'compound': 0.4215}"
174,2020-11-13 18:00:01+00:00,"From ""The Future of Money?,"" a Deep Dive episode of the Pandemic Economics podcast. Listen now and hear insights from Luigi and Eric Budish.","{'neg': 0.0, 'neu': 1.0, 'pos': 0.0, 'compound': 0.0}"
175,2020-11-13 18:00:01+00:00,"In the wake of COVID outbreak, migrant worker wins important ruling in Ontario","{'neg': 0.0, 'neu': 0.667, 'pos': 0.333, 'compound': 0.6705}"
176,2020-11-13 18:00:01+00:00,RT Why would China try to silence Taiwan at the meeting?  Maybe because Taiwan has been successful at containing COV...,"{'neg': 0.0, 'neu': 0.833, 'pos': 0.167, 'compound': 0.5859}"
177,2020-11-13 18:00:01+00:00,"RT Incredible, and certainly not a stat to be proud of. 

More than 130 Secret Service agents have been placed in quaranti...","{'neg': 0.0, 'neu': 0.776, 'pos': 0.224, 'compound': 0.6983}"
178,2020-11-13 18:00:01+00:00,"Aggies on the Front Lines with COVID-19 Feature
Caitlin Harris
Professional Title: Chemistry teacher
Location: Charlotte, NC

https://t.co/f80dbk9EZl 

#AggiesOnTheFrontLines #EducationEdition #NCAT #AggiesDO #AggiePride #NCATAlumni","{'neg': 0.0, 'neu': 1.0, 'pos': 0.0, 'compound': 0.0}"
179,2020-11-13 18:00:01+00:00,CDC: 26.4 percent of U.S. adults with #diabetes meet ABCS goals,"{'neg': 0.0, 'neu': 1.0, 'pos': 0.0, 'compound': 0.0}"
