,created_at,full_text,sentiment_score
0,2020-11-07 04:59:54+00:00,"RT The longer we delay this the more people will die from #COVID19

The longer we delay this the more people will die from #CO...","{'neg': 0.381, 'neu': 0.619, 'pos': 0.0, 'compound': -0.9174}"
1,2020-11-07 04:59:54+00:00,"RT I held my first Morning Dialogue on ""Action for the Most Vulnerable"". We had an honest &amp; enriching exchange. While all countrie...","{'neg': 0.083, 'neu': 0.793, 'pos': 0.125, 'compound': 0.2748}"
2,2020-11-07 04:59:54+00:00,"RT How To Spread Covid, 101
1. No mask
2. No distance
3. Indoors
4. Big Crowd","{'neg': 0.227, 'neu': 0.773, 'pos': 0.0, 'compound': -0.5267}"
3,2020-11-07 04:59:54+00:00,"RT JUST IN: President Donald Trump's chief of staff Mark Meadows has been infected by coronavirus, sources say","{'neg': 0.158, 'neu': 0.842, 'pos': 0.0, 'compound': -0.4939}"
4,2020-11-07 04:59:55+00:00,RT #SuperJunior's #Heechul Tests Negative For COVID-19 After Precautionary Self-Quarantine,"{'neg': 0.291, 'neu': 0.709, 'pos': 0.0, 'compound': -0.5719}"
5,2020-11-07 04:59:55+00:00,"RT NEWS: Along with Trump chief of staff Mark Meadows, at least FOUR other White House aides currently have coronavirus,...","{'neg': 0.0, 'neu': 1.0, 'pos': 0.0, 'compound': 0.0}"
6,2020-11-07 04:59:55+00:00,"RT Whoever becomes president will inherit a world mostly at peace, an economy that is raging back, and a probable end of c...","{'neg': 0.122, 'neu': 0.753, 'pos': 0.125, 'compound': 0.0258}"
7,2020-11-07 04:59:55+00:00,RT Reminder that Trump's closing campaign message was that everybody would stop talking about the coronavirus on November 4,"{'neg': 0.109, 'neu': 0.891, 'pos': 0.0, 'compound': -0.296}"
8,2020-11-07 04:59:55+00:00,"RT NEWS: Along with Trump chief of staff Mark Meadows, at least FOUR other White House aides currently have coronavirus,...","{'neg': 0.0, 'neu': 1.0, 'pos': 0.0, 'compound': 0.0}"
9,2020-11-07 04:59:55+00:00,"RT NEWS: Along with Trump chief of staff Mark Meadows, at least FOUR other White House aides currently have coronavirus,...","{'neg': 0.0, 'neu': 1.0, 'pos': 0.0, 'compound': 0.0}"
10,2020-11-07 04:59:55+00:00,"there you go; i knew somone would catch it: they are determined to TAKE IT, like a true tyranny. they will do ANYTHING and EVERYTHING: if i were President i would lock it down, process criminal charges against the rioters, process ballot crimes, treason charges against officials","{'neg': 0.18, 'neu': 0.687, 'pos': 0.132, 'compound': -0.4215}"
11,2020-11-07 04:59:55+00:00,"Don't hold your breath, Covid breath asshole. You are the BIGgest LOSER EVER in the HISTORY of the world! In the history! I'm laughing now, biggly!","{'neg': 0.156, 'neu': 0.745, 'pos': 0.099, 'compound': -0.4232}"
12,2020-11-07 04:59:55+00:00,RT MeDe Vision Goa &amp; ABVP Goa in collaboration with Arogya Bharati &amp; Vidhyarthi Nidhi Goa organized Niswarth Seva program towards...,"{'neg': 0.0, 'neu': 0.909, 'pos': 0.091, 'compound': 0.25}"
13,2020-11-07 04:59:55+00:00,RT We gave Trump the entire 2020 experience. He got COVID &amp; now is unemployed!,"{'neg': 0.0, 'neu': 1.0, 'pos': 0.0, 'compound': 0.0}"
14,2020-11-07 04:59:55+00:00,"theres a pandemic, how else are our bravest americans supposed to train..","{'neg': 0.0, 'neu': 0.769, 'pos': 0.231, 'compound': 0.5106}"
15,2020-11-07 04:59:55+00:00,"RT Numbers not discussed this week:

US passed 235,000 coronavirus deaths

US had 121,000+ cases yesterday, a record total

US une...","{'neg': 0.0, 'neu': 1.0, 'pos': 0.0, 'compound': 0.0}"
16,2020-11-07 04:59:55+00:00,"Me, when my child is virtual learning  on his zoom classroom meeting. #JoshShapiro #zoommeeting #virtuallearning #COVID19 #SocialDistancing #bidenharis2020 #anxiety #GoogleClassroom","{'neg': 0.082, 'neu': 0.918, 'pos': 0.0, 'compound': -0.1779}"
17,2020-11-07 04:59:55+00:00,"RT Mark Meadows, the genius WH Chief of Staff who refused to wear a freaking mask, tested positive for COVID-19.

So shocking.","{'neg': 0.282, 'neu': 0.598, 'pos': 0.12, 'compound': -0.5982}"
18,2020-11-07 04:59:55+00:00,Has heard that you can get reinfected with coronavirus? Maybe a good thing to know.,"{'neg': 0.0, 'neu': 0.828, 'pos': 0.172, 'compound': 0.4404}"
19,2020-11-07 04:59:55+00:00,"RT Trump on 10/27: ""Until November 4th., Fake News Media is going full on Covid, Covid, Covid. We are rounding the turn. 99.9%""...","{'neg': 0.124, 'neu': 0.876, 'pos': 0.0, 'compound': -0.4767}"
20,2020-11-07 04:59:55+00:00,I will. ,"{'neg': 0.0, 'neu': 1.0, 'pos': 0.0, 'compound': 0.0}"
21,2020-11-07 04:59:55+00:00,"RT That seal said ""IN A PANDEMIC!!??""","{'neg': 0.0, 'neu': 1.0, 'pos': 0.0, 'compound': 0.0}"
22,2020-11-07 04:59:55+00:00,RT A man of his word ,"{'neg': 0.0, 'neu': 1.0, 'pos': 0.0, 'compound': 0.0}"
23,2020-11-07 04:59:55+00:00,"RT NEWS: Along with Trump chief of staff Mark Meadows, at least FOUR other White House aides currently have coronavirus,...","{'neg': 0.0, 'neu': 1.0, 'pos': 0.0, 'compound': 0.0}"
24,2020-11-07 04:59:55+00:00,You do realize that the CDC admitted that there tests were at least 33% inaccurate.  You ghoul! ,"{'neg': 0.0, 'neu': 0.904, 'pos': 0.096, 'compound': 0.1759}"
25,2020-11-07 04:59:55+00:00,Tapping in for that she promised. ,"{'neg': 0.0, 'neu': 0.667, 'pos': 0.333, 'compound': 0.3612}"
26,2020-11-07 04:59:55+00:00,"RT Loeffler and her husband are about to become national figures, drawing attention way beyond being a US Senator and spouse. T...","{'neg': 0.0, 'neu': 1.0, 'pos': 0.0, 'compound': 0.0}"
27,2020-11-07 04:59:55+00:00,"Lockdown is like ""Go to your room and don't come out until I tell you to.""","{'neg': 0.0, 'neu': 0.857, 'pos': 0.143, 'compound': 0.3612}"
28,2020-11-07 04:59:55+00:00,RT It's not just Mark Meadows testing positive. reports Trump campaign aide Nick Trainer has tested positive for...,"{'neg': 0.0, 'neu': 0.69, 'pos': 0.31, 'compound': 0.802}"
29,2020-11-07 04:59:56+00:00,RT 3) It was Ds who for months prior to Election Day worked overtime to get courts/officials to override legislatures and cha...,"{'neg': 0.0, 'neu': 1.0, 'pos': 0.0, 'compound': 0.0}"
30,2020-11-07 04:59:56+00:00,"RT #BREAKING 

3rd White House outbreak grows to 5 coronavirus cases -- and they tried to hide it from the public: report 
https...","{'neg': 0.072, 'neu': 0.928, 'pos': 0.0, 'compound': -0.1779}"
31,2020-11-07 04:59:56+00:00,"RT NEWS: Along with Trump chief of staff Mark Meadows, at least FOUR other White House aides currently have coronavirus,...","{'neg': 0.0, 'neu': 1.0, 'pos': 0.0, 'compound': 0.0}"
32,2020-11-07 04:59:56+00:00,"As the US surpasses 10,000,000 #COVID19 cases, WH Chief of Staff and shameless Trump sycophant, tests positive for the illness. Of special note, Meadows often refused to wear a mask in close WH gatherings. It is unknown how many others he, himself, has infected.","{'neg': 0.192, 'neu': 0.693, 'pos': 0.115, 'compound': -0.4939}"
33,2020-11-07 04:59:56+00:00,RT Televangelist who blamed COVID-19 on premarital sex dies from virus via,"{'neg': 0.22, 'neu': 0.78, 'pos': 0.0, 'compound': -0.4767}"
34,2020-11-07 04:59:56+00:00,RT They didn't feel the need to tell anyone because Trump assured everyone #COVID19 would go away the day after t...,"{'neg': 0.0, 'neu': 0.889, 'pos': 0.111, 'compound': 0.3612}"
35,2020-11-07 04:59:56+00:00,RT IRGC Unveils New Ballistic Missiles Amid #Iran's Worsening Covid-19 Crisis #DisbandIRGC #IranProt...,"{'neg': 0.392, 'neu': 0.608, 'pos': 0.0, 'compound': -0.7964}"
36,2020-11-07 04:59:56+00:00,"RT Call the writer's room. How about an ending where Meadows gets COVID, and then Trump gets reinfected, because the experimental...","{'neg': 0.0, 'neu': 1.0, 'pos': 0.0, 'compound': 0.0}"
37,2020-11-07 04:59:56+00:00,"RT ^^^ 

So to summarize.....

The last four years of chaos, burned allies, international embarrassment, kids in cages, etc etc...","{'neg': 0.268, 'neu': 0.732, 'pos': 0.0, 'compound': -0.765}"
38,2020-11-07 04:59:56+00:00,"RT In 48 hours the #UnitedStates has had almost a quarter of a million new documented cases of #COVID19 

The exponential...","{'neg': 0.0, 'neu': 1.0, 'pos': 0.0, 'compound': 0.0}"
39,2020-11-07 04:59:56+00:00,RT This is not the first time the White House has tried to keep a coronavirus outbreak a secret from people who work in the W...,"{'neg': 0.0, 'neu': 1.0, 'pos': 0.0, 'compound': 0.0}"
40,2020-11-07 04:59:56+00:00,"RT NEWS: Along with Trump chief of staff Mark Meadows, at least FOUR other White House aides currently have coronavirus,...","{'neg': 0.0, 'neu': 1.0, 'pos': 0.0, 'compound': 0.0}"
41,2020-11-07 04:59:56+00:00,"Not likely.  Glib tweets and political speak sound bits don't erase how your campaign and sneering elitist MSM, celebrities etc have attacked Trump supporters as racist and misogynistic.  The nation wil not come together.  You barely won. But for covid-19 you wouldn't have.","{'neg': 0.094, 'neu': 0.818, 'pos': 0.087, 'compound': -0.0891}"
42,2020-11-07 04:59:56+00:00,"RT COVID19 Deaths. 

Alberta: 352 
Taiwan : 7

Population. 

Alberta:  4.37 million 
Taiwan: 23.78 million 

Any questions...","{'neg': 0.0, 'neu': 1.0, 'pos': 0.0, 'compound': 0.0}"
43,2020-11-07 04:59:56+00:00,"I voted in person for BIDEN in fulton. Mr. Trump, let Ga go. You lost Georgia. The very African Americans you put in danger with covid, supporting white nationalists, and neo-nazis are the same ones that cost you this state. Biden is our next President. Concede now, its over.","{'neg': 0.104, 'neu': 0.842, 'pos': 0.053, 'compound': -0.4215}"
44,2020-11-07 04:59:56+00:00,"That's the problem w/ testing only. A (-) test does not mean a person does not have COVID. It simply means they don't have enough virus to turn the test (+), but they can still be contagious. The incubation period is 5-14 days.","{'neg': 0.108, 'neu': 0.892, 'pos': 0.0, 'compound': -0.6059}"
45,2020-11-07 04:59:56+00:00,"RT For doctors who think Trump fumbled the pandemic, the tight election is seen as an insult 
@GovA...","{'neg': 0.163, 'neu': 0.837, 'pos': 0.0, 'compound': -0.5106}"
46,2020-11-07 04:59:56+00:00,RT This is a man who's labeled peaceful protestors as terrorists.Celebrated murderers.Mocked the coronavirus thereby pissing...,"{'neg': 0.136, 'neu': 0.704, 'pos': 0.161, 'compound': 0.128}"
47,2020-11-07 04:59:56+00:00,RT The list goes on and on and on. Election workers and officials shepherded an election through the worst days - so far - o...,"{'neg': 0.146, 'neu': 0.854, 'pos': 0.0, 'compound': -0.6249}"
48,2020-11-07 04:59:56+00:00,RT The autoantibodies found in the COVID-19 patients are the same ones doctors find in patients with an autoimmune disease called...,"{'neg': 0.0, 'neu': 1.0, 'pos': 0.0, 'compound': 0.0}"
49,2020-11-07 04:59:56+00:00,"RT Breaking News: The U.S. reported over 1,000 Covid-19 deaths for the fourth straight day, a first since August. It also set ano...","{'neg': 0.0, 'neu': 0.921, 'pos': 0.079, 'compound': 0.2263}"
50,2020-11-07 04:59:56+00:00,"RT NEWS: Along with Trump chief of staff Mark Meadows, at least FOUR other White House aides currently have coronavirus,...","{'neg': 0.0, 'neu': 1.0, 'pos': 0.0, 'compound': 0.0}"
51,2020-11-07 04:59:56+00:00,"So he was right about us not controlling the pandemic. I'm sure the vaccine will be here any minute, too.","{'neg': 0.0, 'neu': 0.892, 'pos': 0.108, 'compound': 0.3182}"
52,2020-11-07 04:59:56+00:00,RT I will go to GA to help win these Senate seats. I will get a Covid test every day. I will live at Tyler Perry's movie stu...,"{'neg': 0.0, 'neu': 0.8, 'pos': 0.2, 'compound': 0.7579}"
53,2020-11-07 04:59:56+00:00,"RT The longer we delay this the more people will die from #COVID19

The longer we delay this the more people will die from #CO...","{'neg': 0.381, 'neu': 0.619, 'pos': 0.0, 'compound': -0.9174}"
54,2020-11-07 04:59:56+00:00,"RT NEWS: Along with Trump chief of staff Mark Meadows, at least FOUR other White House aides currently have coronavirus,...","{'neg': 0.0, 'neu': 1.0, 'pos': 0.0, 'compound': 0.0}"
55,2020-11-07 04:59:56+00:00,Block your date and time,"{'neg': 0.42, 'neu': 0.58, 'pos': 0.0, 'compound': -0.4404}"
56,2020-11-07 04:59:56+00:00,"RT Here's a maskless Mark Meadows, White House Chief of Staff now confirmed to have tested positive for COVID, at Trump Campai...","{'neg': 0.0, 'neu': 0.854, 'pos': 0.146, 'compound': 0.5574}"
57,2020-11-07 04:59:56+00:00,"RT Dear Yoongi, I wish you a good post-surgery recovery. I look forward to seeing you playing your guitar again but you...","{'neg': 0.0, 'neu': 0.72, 'pos': 0.28, 'compound': 0.6124}"
58,2020-11-07 04:59:57+00:00,"RT NEWS: Along with Trump chief of staff Mark Meadows, at least FOUR other White House aides currently have coronavirus,...","{'neg': 0.0, 'neu': 1.0, 'pos': 0.0, 'compound': 0.0}"
59,2020-11-07 04:59:57+00:00,But of course,"{'neg': 0.0, 'neu': 1.0, 'pos': 0.0, 'compound': 0.0}"
60,2020-11-07 04:59:57+00:00,RT god these guys are really having a grand finale that just combines every fuckup trump has ever had into one week huh htt...,"{'neg': 0.0, 'neu': 0.804, 'pos': 0.196, 'compound': 0.6557}"
61,2020-11-07 04:59:57+00:00,"RT Mark Meadows entered the East Room early Wednesday morning, election night, with the Trump children just before the President...","{'neg': 0.0, 'neu': 1.0, 'pos': 0.0, 'compound': 0.0}"
62,2020-11-07 04:59:57+00:00,RT A man of his word ,"{'neg': 0.0, 'neu': 1.0, 'pos': 0.0, 'compound': 0.0}"
63,2020-11-07 04:59:57+00:00,"Personally, I think the bigger threat is the 450,000+ (at least 1200 per day) children that go missing in the USA each year that the 60 Covid daily deaths (1000x 6%).","{'neg': 0.162, 'neu': 0.838, 'pos': 0.0, 'compound': -0.6808}"
64,2020-11-07 04:59:57+00:00,"RT BREAKING: White House Chief of Staff Mark Meadows tests positive for the coronavirus.

God is just spiking the ball at t...","{'neg': 0.0, 'neu': 0.778, 'pos': 0.222, 'compound': 0.6908}"
65,2020-11-07 04:59:57+00:00,RT Mark Meadows tested positive for the Coronavirus. Maybe he gave it to Trump. Trump's trip to Walter Read was all an ac...,"{'neg': 0.0, 'neu': 0.859, 'pos': 0.141, 'compound': 0.5574}"
66,2020-11-07 04:59:57+00:00,RT We gave Trump the entire 2020 experience. He got COVID &amp; now is unemployed!,"{'neg': 0.0, 'neu': 1.0, 'pos': 0.0, 'compound': 0.0}"
67,2020-11-07 04:59:57+00:00,Agree. It should be called.,"{'neg': 0.0, 'neu': 0.615, 'pos': 0.385, 'compound': 0.3612}"
68,2020-11-07 04:59:57+00:00,"RT NEWS: Along with Trump chief of staff Mark Meadows, at least FOUR other White House aides currently have coronavirus,...","{'neg': 0.0, 'neu': 1.0, 'pos': 0.0, 'compound': 0.0}"
69,2020-11-07 04:59:57+00:00,"Ok, this is almost true and it's sad. The vote counters must endeavor to work faster than covid spreads through the WH. Not sure they can do it though.","{'neg': 0.151, 'neu': 0.775, 'pos': 0.075, 'compound': -0.3726}"
70,2020-11-07 04:59:57+00:00,"RT NEWS: Meadows told a few people after Election Day that he has coronavirus, I'm told. 

A Trump campaign aide, Nick Tr...","{'neg': 0.0, 'neu': 1.0, 'pos': 0.0, 'compound': 0.0}"
71,2020-11-07 04:59:57+00:00,"RT Is Trump about to get COVID again, and be the highest profile case of no long-lasting immunity, crushing the entire dum...","{'neg': 0.19, 'neu': 0.81, 'pos': 0.0, 'compound': -0.5719}"
72,2020-11-07 04:59:57+00:00,"RT Wait, Mark Meadows has COVID? Good lord. 70+ million people voted for this bumbling crew of fascist idiocrats.","{'neg': 0.153, 'neu': 0.723, 'pos': 0.123, 'compound': -0.1779}"
73,2020-11-07 04:59:57+00:00,"RT NEWS: Along with Trump chief of staff Mark Meadows, at least FOUR other White House aides currently have coronavirus,...","{'neg': 0.0, 'neu': 1.0, 'pos': 0.0, 'compound': 0.0}"
74,2020-11-07 04:59:57+00:00,RT The White House has already had two COVID-19 outbreaks in the past month.,"{'neg': 0.0, 'neu': 1.0, 'pos': 0.0, 'compound': 0.0}"
75,2020-11-07 04:59:57+00:00,I think Covid did a number on Kay-liar.,"{'neg': 0.0, 'neu': 0.843, 'pos': 0.157, 'compound': 0.0772}"
76,2020-11-07 04:59:57+00:00,3 others also ,"{'neg': 0.0, 'neu': 1.0, 'pos': 0.0, 'compound': 0.0}"
77,2020-11-07 04:59:57+00:00,"RT Mark Meadows, the genius WH Chief of Staff who refused to wear a freaking mask, tested positive for COVID-19.

So shocking.","{'neg': 0.282, 'neu': 0.598, 'pos': 0.12, 'compound': -0.5982}"
78,2020-11-07 04:59:57+00:00,"Yeah, pretty good but my all time favourites are with covid - the blue light and drink disinfectant but the most bizarre award goes to when he thought shooting a missile may stop the hurricane. Ya can't even write this folks - comedy for the cost of a mere 230,000 American lives","{'neg': 0.095, 'neu': 0.69, 'pos': 0.216, 'compound': 0.7832}"
79,2020-11-07 04:59:57+00:00,"RT NEWS: Meadows told a few people after Election Day that he has coronavirus, I'm told. 

A Trump campaign aide, Nick Tr...","{'neg': 0.0, 'neu': 1.0, 'pos': 0.0, 'compound': 0.0}"
80,2020-11-07 04:59:57+00:00,An island. Plus rises of cases really doesn't mean much. Define the cases. How many are asymptomatic? What Ct value do they have? Are they actually infectious or an old infection or a false positive? Too many questions to use cases as much of a case for a growing epidemic.,"{'neg': 0.0, 'neu': 0.851, 'pos': 0.149, 'compound': 0.8042}"
81,2020-11-07 04:59:57+00:00,the fact that chris christie survived covid......doesn't sit right with me,"{'neg': 0.0, 'neu': 0.752, 'pos': 0.248, 'compound': 0.5106}"
82,2020-11-07 04:59:57+00:00,Alberta Schools ... after a Premier Jason Kenney's incompetent leadership.,"{'neg': 0.256, 'neu': 0.744, 'pos': 0.0, 'compound': -0.4767}"
83,2020-11-07 04:59:57+00:00,RT Biden and his staff are getting daily updates on the coronavirus while Trump and his staff are just getting the coronaviru...,"{'neg': 0.0, 'neu': 1.0, 'pos': 0.0, 'compound': 0.0}"
84,2020-11-07 04:59:57+00:00,RT People out here thinking Covid gonna be magically gone when 2021 comes,"{'neg': 0.0, 'neu': 1.0, 'pos': 0.0, 'compound': 0.0}"
85,2020-11-07 04:59:58+00:00,"RT Mark Meadows, the genius WH Chief of Staff who refused to wear a freaking mask, tested positive for COVID-19.

So shocking.","{'neg': 0.282, 'neu': 0.598, 'pos': 0.12, 'compound': -0.5982}"
86,2020-11-07 04:59:58+00:00,"RT NEWS: Along with Trump chief of staff Mark Meadows, at least FOUR other White House aides currently have coronavirus,...","{'neg': 0.0, 'neu': 1.0, 'pos': 0.0, 'compound': 0.0}"
87,2020-11-07 04:59:58+00:00,"RT NEWS: Along with Trump chief of staff Mark Meadows, at least FOUR other White House aides currently have coronavirus,...","{'neg': 0.0, 'neu': 1.0, 'pos': 0.0, 'compound': 0.0}"
88,2020-11-07 04:59:58+00:00,RT $ATVI #ATVI Still very bullish on this within 6-8 months. Could see this at $90+ especially with everyone back at home a...,"{'neg': 0.0, 'neu': 1.0, 'pos': 0.0, 'compound': 0.0}"
89,2020-11-07 04:59:58+00:00,"make it a mandatory diplomatic policy that the UN apologize TO THE WORLD for their covid crime and the destructions that ensued as a result of it: AND THEY WOULD 
APOLOGIZE.","{'neg': 0.181, 'neu': 0.691, 'pos': 0.128, 'compound': -0.6081}"
90,2020-11-07 04:59:58+00:00,RT me going shopping during lockdown,"{'neg': 0.0, 'neu': 1.0, 'pos': 0.0, 'compound': 0.0}"
91,2020-11-07 04:59:58+00:00,"Dear WSJ,  No doubt the election results is on everyone's mind. However, there's a sinister change of events playing out at FCI Fort Dix. Prisoners are being neglected and infected with covid-19.","{'neg': 0.305, 'neu': 0.552, 'pos': 0.144, 'compound': -0.8515}"
92,2020-11-07 04:59:58+00:00,"RT ""Senators Richard Burr (R-N.C.) and Kelly Loeffler (R-Ga.), possibly among others, took advantage of confidential briefings abo...","{'neg': 0.0, 'neu': 0.895, 'pos': 0.105, 'compound': 0.25}"
93,2020-11-07 04:59:58+00:00,RT Powerwash the People's House with detergent before President Biden moves in.,"{'neg': 0.0, 'neu': 1.0, 'pos': 0.0, 'compound': 0.0}"
94,2020-11-07 04:59:58+00:00,3rd White House outbreak grows to 5 coronavirus cases -- and they tried to hide it from the public: report -,"{'neg': 0.078, 'neu': 0.922, 'pos': 0.0, 'compound': -0.1779}"
95,2020-11-07 04:59:58+00:00,"RT Along with at least FOUR other WH aides now have #coronavirus.

""Pains were taken to keep Meadows' illnes...","{'neg': 0.135, 'neu': 0.865, 'pos': 0.0, 'compound': -0.4215}"
96,2020-11-07 04:59:58+00:00,Wow. That's not sensible during a pandemic.,"{'neg': 0.0, 'neu': 0.612, 'pos': 0.388, 'compound': 0.5859}"
97,2020-11-07 04:59:58+00:00,"RT Mark Meadows, the genius WH Chief of Staff who refused to wear a freaking mask, tested positive for COVID-19.

So shocking.","{'neg': 0.282, 'neu': 0.598, 'pos': 0.12, 'compound': -0.5982}"
98,2020-11-07 04:59:58+00:00,"RT Mark Meadows has Covid.

also Mark Meadows:","{'neg': 0.0, 'neu': 1.0, 'pos': 0.0, 'compound': 0.0}"
99,2020-11-07 04:59:58+00:00,"RT Along with at least FOUR other WH aides now have #coronavirus.

""Pains were taken to keep Meadows' illnes...","{'neg': 0.135, 'neu': 0.865, 'pos': 0.0, 'compound': -0.4215}"
100,2020-11-07 04:59:58+00:00,"4. The longer we delay, the more people die of Covid","{'neg': 0.419, 'neu': 0.581, 'pos': 0.0, 'compound': -0.7564}"
101,2020-11-07 04:59:58+00:00,"Covid covid covid, and then it's all gone.","{'neg': 0.0, 'neu': 1.0, 'pos': 0.0, 'compound': 0.0}"
102,2020-11-07 04:59:58+00:00,"RT Meadows at the election night party at the White House, where people were gathered closely together with almost no masks. At...","{'neg': 0.077, 'neu': 0.813, 'pos': 0.11, 'compound': 0.2006}"
103,2020-11-07 04:59:58+00:00,"RT Meadows tried to keep information about the Pence team outbreak from becoming public a few weeks ago. This news, broken by","{'neg': 0.129, 'neu': 0.871, 'pos': 0.0, 'compound': -0.4767}"
104,2020-11-07 04:59:58+00:00,"Even better, check this innovative system out 
 
#Apollo for health, safety and security. Personnel protected from covid19 through #AI mask recognition . Also guarantees security of premises from intruders.","{'neg': 0.0, 'neu': 0.585, 'pos': 0.415, 'compound': 0.936}"
105,2020-11-07 04:59:58+00:00,"RT UPDATE:

1. Donald Trump lost.

2. Joe Biden won.

3. Mark Meadows has #COVID19 (*They can't even protect themselves, much...","{'neg': 0.171, 'neu': 0.687, 'pos': 0.141, 'compound': 0.0557}"
106,2020-11-07 04:59:58+00:00,RT More Americans died from coronavirus in the last three days since Tuesday's election than died on 9/11 or in Hurricane Kat...,"{'neg': 0.272, 'neu': 0.728, 'pos': 0.0, 'compound': -0.8166}"
107,2020-11-07 04:59:58+00:00,RT A man of his word ,"{'neg': 0.0, 'neu': 1.0, 'pos': 0.0, 'compound': 0.0}"
108,2020-11-07 04:59:58+00:00,"Is there already a thread for peak and off seasons for cities' clubs? New Orleans is for sure slow in Summer and December/early January (pre-COVID tho, so I wonder if these will still matter now/after the pandemic) What're yours?","{'neg': 0.0, 'neu': 0.908, 'pos': 0.092, 'compound': 0.4137}"
109,2020-11-07 04:59:58+00:00,RT It's not just Mark Meadows testing positive. reports Trump campaign aide Nick Trainer has tested positive for...,"{'neg': 0.0, 'neu': 0.69, 'pos': 0.31, 'compound': 0.802}"
110,2020-11-07 04:59:58+00:00,"RT MY LATEST COLUMNA: In Orange County, pretending coronavirus is fake news wins you elections. RT, porfas!","{'neg': 0.138, 'neu': 0.622, 'pos': 0.24, 'compound': 0.3164}"
111,2020-11-07 04:59:59+00:00,"RT I know there's a lot of focus on the election, but we cannot forget the virus. Yesterday we had more than 121,000 new Co...","{'neg': 0.0, 'neu': 0.923, 'pos': 0.077, 'compound': 0.2498}"
112,2020-11-07 04:59:59+00:00,DONT CALL IT A COMEBACK,"{'neg': 0.0, 'neu': 1.0, 'pos': 0.0, 'compound': 0.0}"
113,2020-11-07 04:59:59+00:00,"RT Meadows at the election night party at the White House, where people were gathered closely together with almost no masks. At...","{'neg': 0.077, 'neu': 0.813, 'pos': 0.11, 'compound': 0.2006}"
114,2020-11-07 04:59:59+00:00,"RT NEWS: Along with Trump chief of staff Mark Meadows, at least FOUR other White House aides currently have coronavirus,...","{'neg': 0.0, 'neu': 1.0, 'pos': 0.0, 'compound': 0.0}"
115,2020-11-07 04:59:59+00:00,"RT NEWS: Along with Trump chief of staff Mark Meadows, at least FOUR other White House aides currently have coronavirus,...","{'neg': 0.0, 'neu': 1.0, 'pos': 0.0, 'compound': 0.0}"
116,2020-11-07 04:59:59+00:00,"RT The longer we delay this the more people will die from #COVID19

The longer we delay this the more people will die from #CO...","{'neg': 0.381, 'neu': 0.619, 'pos': 0.0, 'compound': -0.9174}"
117,2020-11-07 04:59:59+00:00,"RT What is becoming clearer each hour is that record numbers of Americans -- from all races, faiths, regions -- chose change over...","{'neg': 0.0, 'neu': 0.887, 'pos': 0.113, 'compound': 0.4215}"
118,2020-11-07 04:59:59+00:00,RT Whoa...,"{'neg': 0.0, 'neu': 1.0, 'pos': 0.0, 'compound': 0.0}"
119,2020-11-07 04:59:59+00:00,Trump's chief of staff Mark Meadows infected with Covid-19,"{'neg': 0.286, 'neu': 0.714, 'pos': 0.0, 'compound': -0.4939}"
120,2020-11-07 04:59:59+00:00,"RT I know it's late Friday evening, but yes, there at five (count them, 5) people in the White House sphere just diagnosed with...","{'neg': 0.0, 'neu': 0.866, 'pos': 0.134, 'compound': 0.5499}"
121,2020-11-07 04:59:59+00:00,Yay I'm glad your ok,"{'neg': 0.0, 'neu': 0.189, 'pos': 0.811, 'compound': 0.8225}"
122,2020-11-07 04:59:59+00:00,Just keeps getting better,"{'neg': 0.0, 'neu': 0.508, 'pos': 0.492, 'compound': 0.4404}"
123,2020-11-07 04:59:59+00:00,"#ElectionDay was also a national holiday this year because ~everyone is home due to #COVID 

Basically, this is closer to the kind of turnout we may expect to see when we finally make election day a holiday","{'neg': 0.0, 'neu': 0.866, 'pos': 0.134, 'compound': 0.6597}"
124,2020-11-07 04:59:59+00:00,"RT BREAKING: Trump's chief of staff, Mark Meadows, has the coronavirus. Meadows informed a close circle of advisers after...","{'neg': 0.0, 'neu': 1.0, 'pos': 0.0, 'compound': 0.0}"
