,created_at,full_text,sentiment_score
0,2020-11-13 17:59:54+00:00,"RT If #SteveBannon were British, and MUCH smarter, he would be #DominicCummings -- the mastermind behind #Brexit.
Now that...","{'neg': 0.0, 'neu': 0.857, 'pos': 0.143, 'compound': 0.4588}"
1,2020-11-13 17:59:54+00:00,"""What's fascinating to me is that people are extremely articulate when it comes to very small footwork, tendus, that sort of thing... I was like, 'You guys!' And they were like, 'Yes, because this is all we could work on at home!'""

","{'neg': 0.0, 'neu': 0.763, 'pos': 0.237, 'compound': 0.8953}"
2,2020-11-13 17:59:54+00:00,RT To our friends across the country: You can help us mobilize voters and raise the resources we need from where you are. As...,"{'neg': 0.0, 'neu': 0.791, 'pos': 0.209, 'compound': 0.7003}"
3,2020-11-13 17:59:54+00:00,RT stay-at-home orders are completely pointless without rent relief and universal income. people have to leave their homes to...,"{'neg': 0.181, 'neu': 0.819, 'pos': 0.0, 'compound': -0.4125}"
4,2020-11-13 17:59:54+00:00,RT Rand Paul: We have 11 million people in our country who have already had COVID. We should tell them to celebrate. We should tell...,"{'neg': 0.0, 'neu': 0.866, 'pos': 0.134, 'compound': 0.5719}"
5,2020-11-13 17:59:54+00:00,"RT Most of the time when a fatal car crash involves a drunk driver, the drunk driver isn't the one who dies. It's usually t...","{'neg': 0.344, 'neu': 0.656, 'pos': 0.0, 'compound': -0.875}"
6,2020-11-13 17:59:54+00:00,RT US Marine Corps Veteran speaks out about the 130 Secret Service officers who are said to be infected with cor...,"{'neg': 0.138, 'neu': 0.862, 'pos': 0.0, 'compound': -0.4939}"
7,2020-11-13 17:59:54+00:00,"RT The ""Chinese Flu"" is looking very American.","{'neg': 0.271, 'neu': 0.729, 'pos': 0.0, 'compound': -0.3818}"
8,2020-11-13 17:59:54+00:00,"RT I wrote about what health-care workers are going through, how exhausted &amp; scared they are, and what this 3rd pandemic surge...","{'neg': 0.213, 'neu': 0.787, 'pos': 0.0, 'compound': -0.6597}"
9,2020-11-13 17:59:55+00:00,"On October 24th, I was alarmed that our COVID positivity rate was 9.5%. Today, we're at 24%. I feel like a kid going up a huge incline on a roller coaster, panicked, screaming ""I don't want to do this!""","{'neg': 0.192, 'neu': 0.645, 'pos': 0.163, 'compound': -0.1063}"
10,2020-11-13 17:59:55+00:00,"As you said Muslims do everything in the name of Islam. So, this Muslim couple are going to save humanity from a pandemic in the name of Islam. Btw, you have to say Allahu Akbar 3 times before the vaccine works remember to say it.","{'neg': 0.0, 'neu': 0.932, 'pos': 0.068, 'compound': 0.4939}"
11,2020-11-13 17:59:55+00:00,"RT This can be seen in the context of Arizona, where restrictions placed at the end of June/early July saw a 75% decrease in cas...","{'neg': 0.0, 'neu': 1.0, 'pos': 0.0, 'compound': 0.0}"
12,2020-11-13 17:59:55+00:00,"RT If only #DominicGoing was sacked by #BorisHasFailedTheNation soon after the 
#BarnardCastle episode. 

#COVID19 lockdown wo...","{'neg': 0.0, 'neu': 1.0, 'pos': 0.0, 'compound': 0.0}"
13,2020-11-13 17:59:55+00:00,"I don't give a fuck about Fox. I do care about what our sitting President spends his time on, considering an election result is in the balance, and Covid is resurging across the nation. People are perfectly capable of taking care of Fox on their own.","{'neg': 0.0, 'neu': 0.719, 'pos': 0.281, 'compound': 0.9437}"
14,2020-11-13 17:59:55+00:00,RT The president spent October pretending that covid-19 was defeated. We're now seeing the consequences of that in lots of pl...,"{'neg': 0.132, 'neu': 0.809, 'pos': 0.06, 'compound': -0.4019}"
15,2020-11-13 17:59:55+00:00,"RT BREAKING - Dinner parties, game nights, get-togethers watching NFL, NCAA football or other sporting events, indoor dining &amp;...","{'neg': 0.0, 'neu': 0.87, 'pos': 0.13, 'compound': 0.4019}"
16,2020-11-13 17:59:55+00:00,RT Y'all more scared of a lockdown and not the actual pandemic.,"{'neg': 0.225, 'neu': 0.775, 'pos': 0.0, 'compound': -0.4927}"
17,2020-11-13 17:59:55+00:00,RT He cares about no one. Not a soul.,"{'neg': 0.18, 'neu': 0.574, 'pos': 0.246, 'compound': 0.2023}"
18,2020-11-13 17:59:55+00:00,"RT The White House election strategy is like their covid strategy. They think the results are going to disappear, like a miracle.","{'neg': 0.066, 'neu': 0.627, 'pos': 0.307, 'compound': 0.7845}"
19,2020-11-13 17:59:55+00:00,"RT Imma need ""COVID 19 semester"" in bold red lettering on my transcript ","{'neg': 0.0, 'neu': 0.822, 'pos': 0.178, 'compound': 0.3818}"
20,2020-11-13 17:59:55+00:00,RT Supreme Court Justice Samuel Alito gave alarmingly political remarks criticizing many states' science-based COVID-19 r...,"{'neg': 0.243, 'neu': 0.478, 'pos': 0.279, 'compound': 0.2263}"
21,2020-11-13 17:59:55+00:00,sign  a waiver that you will not burden the health system when you get Covid and you will stay home and let your personal freedom cure you of the virus,"{'neg': 0.0, 'neu': 0.809, 'pos': 0.191, 'compound': 0.7654}"
22,2020-11-13 17:59:55+00:00,"RT ""None of the persons who were hospitalized or died had attended the event.""","{'neg': 0.217, 'neu': 0.783, 'pos': 0.0, 'compound': -0.5574}"
23,2020-11-13 17:59:55+00:00,"RT Canada is leading the world in vaccination readiness
https://t.co/ai7PiHsKgc","{'neg': 0.0, 'neu': 0.818, 'pos': 0.182, 'compound': 0.25}"
24,2020-11-13 17:59:55+00:00,"Imagine being this dumb about masks and COVID.

More so being an elected official flaunting the idea that masks are ""oppressive"" while actually being the way we can help curb the rampant rise in COVID cases.","{'neg': 0.156, 'neu': 0.781, 'pos': 0.064, 'compound': -0.596}"
25,2020-11-13 17:59:55+00:00,"RT Motherfuckers using ""my body my choice"" to talk about wearing masks are even dumber than they sound. MASKS PROTECT OTHER...","{'neg': 0.101, 'neu': 0.765, 'pos': 0.134, 'compound': 0.2103}"
26,2020-11-13 17:59:55+00:00,"RT Everything you're dying for is a combination of plastic, iron and glass. PS5. iPhone 12 Pro. Xbox. OLED TV. Benz. If there's a...","{'neg': 0.0, 'neu': 1.0, 'pos': 0.0, 'compound': 0.0}"
27,2020-11-13 17:59:55+00:00,"RT Actual Headline: ""Covid-19 Vaccine May Have Unpleasant Side Effects. That Will Mean It's Working.""","{'neg': 0.181, 'neu': 0.819, 'pos': 0.0, 'compound': -0.4767}"
28,2020-11-13 17:59:55+00:00,"RT It's hard to know how we'll cope without the genius who led us to the highest Covid death rate in Europe, the biggest e...","{'neg': 0.187, 'neu': 0.813, 'pos': 0.0, 'compound': -0.6486}"
29,2020-11-13 17:59:55+00:00,RT come work in the COVID unit and find out,"{'neg': 0.0, 'neu': 1.0, 'pos': 0.0, 'compound': 0.0}"
30,2020-11-13 17:59:56+00:00,RT You can all call me a bitch if you want. If you have plans to get together with family or friends this holiday season. Th...,"{'neg': 0.114, 'neu': 0.66, 'pos': 0.226, 'compound': 0.4069}"
31,2020-11-13 17:59:56+00:00,RT Suicide figures are up 200% since lockdown. Could 2 friends please copy and re-post this tweet? We're trying to demonstrate t...,"{'neg': 0.156, 'neu': 0.657, 'pos': 0.187, 'compound': -0.0258}"
32,2020-11-13 17:59:56+00:00,"There's still this: Study says Trump superspreader events lead to over 700 deaths

https://t.co/zu0tO3ocxD","{'neg': 0.0, 'neu': 1.0, 'pos': 0.0, 'compound': 0.0}"
33,2020-11-13 17:59:56+00:00,RT Georgia running not one but two Senators guilty of insider trading. They should be prosecuted not re-elected.,"{'neg': 0.307, 'neu': 0.693, 'pos': 0.0, 'compound': -0.7964}"
34,2020-11-13 17:59:56+00:00,"it actually blows my mind that other countries are going about their lives free of strict covid restrictions but Americans and our dumb ass white supremacist, capitalistic government can't lock down and provide for the goddamn citizens.","{'neg': 0.271, 'neu': 0.65, 'pos': 0.079, 'compound': -0.9091}"
35,2020-11-13 17:59:56+00:00,"RT The White House election strategy is like their covid strategy. They think the results are going to disappear, like a miracle.","{'neg': 0.066, 'neu': 0.627, 'pos': 0.307, 'compound': 0.7845}"
36,2020-11-13 17:59:56+00:00,"And Kelly is an unelected inside trader, earning money off the Americans dying and suffering from COVID. We suffer and struggle to feed our families, pay our rent, while Kelly makes money. Do you really think she knows what you are going through? #VoteRevWarnock","{'neg': 0.205, 'neu': 0.795, 'pos': 0.0, 'compound': -0.8519}"
37,2020-11-13 17:59:56+00:00,RT This marks Louisiana's highest single-day jump since the pandemic began. #lagov #lalege,"{'neg': 0.0, 'neu': 1.0, 'pos': 0.0, 'compound': 0.0}"
38,2020-11-13 17:59:56+00:00,RT Such a beautiful event.  to Wilson Miranda for his leadership... #RemembranceDay2020  #RehabLegend,"{'neg': 0.0, 'neu': 0.755, 'pos': 0.245, 'compound': 0.5994}"
39,2020-11-13 17:59:56+00:00,Probably got the dodgy photos and a list of the Tory Covid contracts given to his mates. Time to collect.,"{'neg': 0.091, 'neu': 0.909, 'pos': 0.0, 'compound': -0.2263}"
40,2020-11-13 17:59:56+00:00,RT New York City to close schools if positivity rate reaches 3%. Ontario's positivity rate is currently 4.5%. We are not advo...,"{'neg': 0.0, 'neu': 0.709, 'pos': 0.291, 'compound': 0.7783}"
41,2020-11-13 17:59:56+00:00,RT REUTERS: Supreme Court Justice Samuel Alito says pandemic has led to unimaginable curbs on liberty,"{'neg': 0.0, 'neu': 0.556, 'pos': 0.444, 'compound': 0.886}"
42,2020-11-13 17:59:56+00:00,RT Marketplace tested over 20 different masks. Here's what will best protect you and others during the pandemic | CBC News htt...,"{'neg': 0.0, 'neu': 0.746, 'pos': 0.254, 'compound': 0.7783}"
43,2020-11-13 17:59:56+00:00,"RT Hear me out, this with consistent stimulus and rent cancellations? Done deal","{'neg': 0.0, 'neu': 1.0, 'pos': 0.0, 'compound': 0.0}"
44,2020-11-13 17:59:56+00:00,"RT ""None of the persons who were hospitalized or died had attended the event.""","{'neg': 0.217, 'neu': 0.783, 'pos': 0.0, 'compound': -0.5574}"
45,2020-11-13 17:59:56+00:00,RT Y'all more scared of a lockdown and not the actual pandemic.,"{'neg': 0.225, 'neu': 0.775, 'pos': 0.0, 'compound': -0.4927}"
46,2020-11-13 17:59:56+00:00,Shout out to my bro who has kindly donated me over 100kgs of gym equipment including bench/rack to keep me going during lockdown  such a humble guy please follow the great work he is doing on insta raising awareness on our motherland  #brotherhood #SavingPunjab,"{'neg': 0.0, 'neu': 0.81, 'pos': 0.19, 'compound': 0.8625}"
47,2020-11-13 17:59:56+00:00,RT Corona Virus explained in craft terms: you and 9 friends are crafting. 1 is using glitter. How many projects have glitt...,"{'neg': 0.0, 'neu': 0.871, 'pos': 0.129, 'compound': 0.4767}"
48,2020-11-13 17:59:56+00:00,"RT Americans killed in World War I: Over 116,000

Americans killed in Vietnam War: Over 58,000

Americans killed in Korean...","{'neg': 0.587, 'neu': 0.413, 'pos': 0.0, 'compound': -0.9729}"
49,2020-11-13 17:59:56+00:00,WATCH: #Arkansas Gov. to make COVID-19 related announcement #arnews ,"{'neg': 0.0, 'neu': 1.0, 'pos': 0.0, 'compound': 0.0}"
50,2020-11-13 17:59:56+00:00,"RT Siena has paused basketball activities following two positive COVID-19 tests, per release.","{'neg': 0.0, 'neu': 0.769, 'pos': 0.231, 'compound': 0.5574}"
51,2020-11-13 17:59:56+00:00,"RT Together WH1 and WH2 belong to clade 20C and lineage B.1.26, which place them squarely within the genetic diversity of viruses c...","{'neg': 0.0, 'neu': 1.0, 'pos': 0.0, 'compound': 0.0}"
52,2020-11-13 17:59:56+00:00,"RT Americans killed in World War I: Over 116,000

Americans killed in Vietnam War: Over 58,000

Americans killed in Korean...","{'neg': 0.587, 'neu': 0.413, 'pos': 0.0, 'compound': -0.9729}"
53,2020-11-13 17:59:56+00:00,"RT Tesla and SpaceX CEO Elon Musk claimed that ""something extremely bogus is going on"" after 4 rapid antigen Covid-19 tests he too...","{'neg': 0.0, 'neu': 1.0, 'pos': 0.0, 'compound': 0.0}"
54,2020-11-13 17:59:56+00:00,RT You can't be pro-life and believe we should give up fighting the pandemic.,"{'neg': 0.161, 'neu': 0.839, 'pos': 0.0, 'compound': -0.3612}"
55,2020-11-13 17:59:56+00:00,RT Please read this from my friend and colleague and when you do know that he is not an alarmist. He is a scie...,"{'neg': 0.0, 'neu': 0.8, 'pos': 0.2, 'compound': 0.6705}"
56,2020-11-13 17:59:56+00:00,"RT 5) 21 Swedish experts denounced ""herd"" policy: ""The strategy has led to death, grief, &amp; suffering--no indications that the S...","{'neg': 0.272, 'neu': 0.728, 'pos': 0.0, 'compound': -0.7964}"
57,2020-11-13 17:59:56+00:00,RT Some of Biden's COVID-19 task force appointees have stirred controversy in the past | Just The News,"{'neg': 0.0, 'neu': 1.0, 'pos': 0.0, 'compound': 0.0}"
58,2020-11-13 17:59:57+00:00,"RT Shop small, shop local, and support small businesses like our local during this lockdown! Their Instagram...","{'neg': 0.0, 'neu': 0.732, 'pos': 0.268, 'compound': 0.6696}"
59,2020-11-13 17:59:57+00:00,RT Elon Musk says he took four rapid COVID-19 tests with split results,"{'neg': 0.0, 'neu': 1.0, 'pos': 0.0, 'compound': 0.0}"
60,2020-11-13 17:59:57+00:00,"And another Covid idiot doesn't get it. 

Take away the Covid &amp; the high probability is they would still be alive. Unless you think multi organ failure or sepsis is linked to Diabetes or hypertension etc","{'neg': 0.156, 'neu': 0.782, 'pos': 0.062, 'compound': -0.6124}"
61,2020-11-13 17:59:57+00:00,"RT .@mtgreenee your comments on wearing a mask highlights what's wrong with America.

It's not about ""your body"" it'...","{'neg': 0.147, 'neu': 0.853, 'pos': 0.0, 'compound': -0.4767}"
62,2020-11-13 17:59:57+00:00,"RT One study found your risk of developing a severe case of, and dying from, COVID-19 virtually disappears once your vitami...","{'neg': 0.283, 'neu': 0.717, 'pos': 0.0, 'compound': -0.7269}"
63,2020-11-13 17:59:57+00:00,Coach. Players. Officials. Pitch. Minister. NFF. Covid 19. Nigerians. President. Whose Fault?,"{'neg': 0.197, 'neu': 0.803, 'pos': 0.0, 'compound': -0.4019}"
64,2020-11-13 17:59:57+00:00,RT 1/ A fascinating paper today offers yet more proof that the PCR testing scheme vastly overstates the number...,"{'neg': 0.0, 'neu': 0.78, 'pos': 0.22, 'compound': 0.5859}"
65,2020-11-13 17:59:57+00:00,All the love. Stay safe and wear a mask.,"{'neg': 0.0, 'neu': 0.496, 'pos': 0.504, 'compound': 0.7964}"
66,2020-11-13 17:59:57+00:00,Truth is. Covid is a scam.,"{'neg': 0.37, 'neu': 0.4, 'pos': 0.23, 'compound': -0.34}"
67,2020-11-13 17:59:57+00:00,I have never in my life listened to that song,"{'neg': 0.0, 'neu': 1.0, 'pos': 0.0, 'compound': 0.0}"
68,2020-11-13 17:59:57+00:00,"RT America's coronavirus response, summed up in a photo","{'neg': 0.0, 'neu': 1.0, 'pos': 0.0, 'compound': 0.0}"
69,2020-11-13 17:59:57+00:00,RT The scientists who developed the Pfizer/BioNTech Covid-19 vaccine are a Turkish-German power couple,"{'neg': 0.0, 'neu': 1.0, 'pos': 0.0, 'compound': 0.0}"
70,2020-11-13 17:59:57+00:00,"RT Well said by Justice Alito:

""The pandemic has resulted in previous unimaginable restrictions on individual liberty... T...","{'neg': 0.0, 'neu': 0.628, 'pos': 0.372, 'compound': 0.836}"
71,2020-11-13 17:59:57+00:00,RT if Trump is not going to allow Biden's team have access to federal info on dealing the Covid explosion and national sec...,"{'neg': 0.07, 'neu': 0.93, 'pos': 0.0, 'compound': -0.1695}"
72,2020-11-13 17:59:57+00:00,"RT Something extremely bogus is going on. Was tested for covid four times today. Two tests came back negative, two came back pos...","{'neg': 0.144, 'neu': 0.856, 'pos': 0.0, 'compound': -0.5719}"
73,2020-11-13 17:59:57+00:00,To right I am!,"{'neg': 0.0, 'neu': 1.0, 'pos': 0.0, 'compound': 0.0}"
74,2020-11-13 17:59:57+00:00,Some glimmer of light,"{'neg': 0.0, 'neu': 1.0, 'pos': 0.0, 'compound': 0.0}"
75,2020-11-13 17:59:57+00:00,RT Y'all more scared of a lockdown and not the actual pandemic.,"{'neg': 0.225, 'neu': 0.775, 'pos': 0.0, 'compound': -0.4927}"
76,2020-11-13 17:59:57+00:00,RT Because it came from China,"{'neg': 0.0, 'neu': 1.0, 'pos': 0.0, 'compound': 0.0}"
77,2020-11-13 17:59:57+00:00,RT Corona Virus explained in craft terms: you and 9 friends are crafting. 1 is using glitter. How many projects have glitt...,"{'neg': 0.0, 'neu': 0.871, 'pos': 0.129, 'compound': 0.4767}"
78,2020-11-13 17:59:57+00:00,"RT As coronavirus cases and hospitalizations hit record highs, the president hasn't publicly said a word about the pandemic in 10...","{'neg': 0.0, 'neu': 1.0, 'pos': 0.0, 'compound': 0.0}"
79,2020-11-13 17:59:57+00:00,RT We mustn't let inequalities slip past our gaze when we look back on this pandemic,"{'neg': 0.0, 'neu': 1.0, 'pos': 0.0, 'compound': 0.0}"
80,2020-11-13 17:59:58+00:00,"130 Secret Service officers are infected with coronavirus or quarantining in wake of Trump's campaign travel.
The dramatic impact on the presidential protection unit comes as growing numbers of prominent Trump allies and White House officials have fallen ill.
#TrumpVirus","{'neg': 0.179, 'neu': 0.737, 'pos': 0.084, 'compound': -0.6705}"
81,2020-11-13 17:59:58+00:00,"H - town is adding rock rose in y'all's city. Wonder bar, 77 degrees and jack and gingers pub bar. Mayne going to have come visit after the pandemic. Right now y'all move like it's 2018. Can't do it.","{'neg': 0.0, 'neu': 0.938, 'pos': 0.062, 'compound': 0.3612}"
82,2020-11-13 17:59:58+00:00,RT Corona Virus explained in craft terms: you and 9 friends are crafting. 1 is using glitter. How many projects have glitt...,"{'neg': 0.0, 'neu': 0.871, 'pos': 0.129, 'compound': 0.4767}"
83,2020-11-13 17:59:58+00:00,"Stay home everybody, let them to do their thing - it's not worth!!!!","{'neg': 0.191, 'neu': 0.809, 'pos': 0.0, 'compound': -0.428}"
84,2020-11-13 17:59:58+00:00,Sen. Kim LaSata of St. Joseph reportedly tested positive for COVID-19.,"{'neg': 0.0, 'neu': 0.735, 'pos': 0.265, 'compound': 0.5574}"
85,2020-11-13 17:59:58+00:00,RT He... Doesn't... Care...,"{'neg': 0.467, 'neu': 0.533, 'pos': 0.0, 'compound': -0.3875}"
86,2020-11-13 17:59:58+00:00,RT That didn't take long.....,"{'neg': 0.0, 'neu': 1.0, 'pos': 0.0, 'compound': 0.0}"
87,2020-11-13 17:59:58+00:00,Whoa ,"{'neg': 0.0, 'neu': 1.0, 'pos': 0.0, 'compound': 0.0}"
88,2020-11-13 17:59:58+00:00,"RT In metro Atlanta this week, Republican Sen. had this to say about why he wears masks: ""You want me to wear a mas...","{'neg': 0.0, 'neu': 0.947, 'pos': 0.053, 'compound': 0.0772}"
89,2020-11-13 17:59:58+00:00,RT These brave men and women are willing to take a bullet for the President but he won't wear a mask for them.,"{'neg': 0.0, 'neu': 0.909, 'pos': 0.091, 'compound': 0.296}"
90,2020-11-13 17:59:58+00:00,RT Worcester's DCU Center to reopen as COVID field hospital as Massachusetts sees second surge,"{'neg': 0.0, 'neu': 1.0, 'pos': 0.0, 'compound': 0.0}"
91,2020-11-13 17:59:58+00:00,"RT Artificial intelligence in #healthcare can be deployed across these usecase 
@MikeQuindazzi 
#healthtec...","{'neg': 0.0, 'neu': 0.795, 'pos': 0.205, 'compound': 0.4767}"
92,2020-11-13 17:59:58+00:00,RT 130 Secret Service agents are infected with COVID-19 because trump is a selfish asshole who unnecessarily put them all in h...,"{'neg': 0.24, 'neu': 0.76, 'pos': 0.0, 'compound': -0.743}"
93,2020-11-13 17:59:58+00:00,"Biden transition official says the transition team doesn't want to fight with the GSA: ""We just want to get access to intelligence information, to threat assessments, to the ongoing work on COVID, so that we can prepare to govern.""","{'neg': 0.102, 'neu': 0.752, 'pos': 0.146, 'compound': 0.2411}"
94,2020-11-13 17:59:58+00:00,RT He... Doesn't... Care...,"{'neg': 0.467, 'neu': 0.533, 'pos': 0.0, 'compound': -0.3875}"
95,2020-11-13 17:59:58+00:00,RT We absolutely cannot let this happen. We need to start putting the protocols and infrastructure in place now so that t...,"{'neg': 0.0, 'neu': 1.0, 'pos': 0.0, 'compound': 0.0}"
96,2020-11-13 17:59:58+00:00,Photos or it didn't happen. And #SpoilerAlert it didn't happen. But this did.,"{'neg': 0.0, 'neu': 1.0, 'pos': 0.0, 'compound': 0.0}"
97,2020-11-13 17:59:58+00:00,The overlords have small business by the b_lls. The control point is the front door of these businesses. We need to buy to live &amp; they need to sell to live. Massive class-action lawsuits are necessary to take down the mandates which are anti-science &amp; unconstitutional.,"{'neg': 0.034, 'neu': 0.966, 'pos': 0.0, 'compound': -0.1531}"
98,2020-11-13 17:59:58+00:00,Is this the first step in your #COVID19 vaccination distribution effort?,"{'neg': 0.0, 'neu': 1.0, 'pos': 0.0, 'compound': 0.0}"
99,2020-11-13 17:59:58+00:00,"RT The ""Chinese Flu"" is looking very American.","{'neg': 0.271, 'neu': 0.729, 'pos': 0.0, 'compound': -0.3818}"
100,2020-11-13 17:59:58+00:00,RT Just death and vibes ,"{'neg': 0.494, 'neu': 0.506, 'pos': 0.0, 'compound': -0.5994}"
101,2020-11-13 17:59:58+00:00,"RT In the 68 days until Biden-Harris take over running the nation, more than 100,000 Americans will die from COVID19 while Tru...","{'neg': 0.157, 'neu': 0.843, 'pos': 0.0, 'compound': -0.5994}"
102,2020-11-13 17:59:58+00:00,Here we go again...,"{'neg': 0.0, 'neu': 1.0, 'pos': 0.0, 'compound': 0.0}"
103,2020-11-13 17:59:58+00:00,"RT On COVID testing in LA, ""At Dodger Stadium, they have a good process going. Cars are pulling up through li...","{'neg': 0.0, 'neu': 0.873, 'pos': 0.127, 'compound': 0.4404}"
104,2020-11-13 17:59:58+00:00,"Rapidly ageing Poland during the pandemic of covid-19, profound recession, collapsing health care system, pedophile scandals involving clergy and depopulation.

Like in Russia this kind of propaganda is completely out of touch with reality. It's simply because young women say no.","{'neg': 0.205, 'neu': 0.684, 'pos': 0.111, 'compound': -0.5849}"
105,2020-11-13 17:59:58+00:00,RT This is why state and local leaders are pleading with Illinois residents to #StayHome #MaskUp #WashUp and #SleeveUp.  He...,"{'neg': 0.0, 'neu': 1.0, 'pos': 0.0, 'compound': 0.0}"
106,2020-11-13 17:59:59+00:00,"Due to strict adherence to WIAA guidelines and the pending result of a covid test, the varsity football game at Marshfield has been cancelled for tonight 11/13.","{'neg': 0.071, 'neu': 0.929, 'pos': 0.0, 'compound': -0.25}"
107,2020-11-13 17:59:59+00:00,RT stay-at-home orders are completely pointless without rent relief and universal income. people have to leave their homes to...,"{'neg': 0.181, 'neu': 0.819, 'pos': 0.0, 'compound': -0.4125}"
108,2020-11-13 17:59:59+00:00,RT This is pathetic. People are dying of COVID-19. We are crashing out of the EC with no agreement in sight. Families are h...,"{'neg': 0.223, 'neu': 0.777, 'pos': 0.0, 'compound': -0.7452}"
109,2020-11-13 17:59:59+00:00,"American and Europeans are more severe than underdeveloped countries The virus attack puts the world under lock down thus China becomes the sole supply chain of the world. It wants to invade India, Taiwan, and Vietnam.","{'neg': 0.15, 'neu': 0.85, 'pos': 0.0, 'compound': -0.7178}"
110,2020-11-13 17:59:59+00:00,"RT Since the last time President Trump spoke publicly, 8 days ago (11/5):

947,319 new COVID-19 infections.

7,507 America...","{'neg': 0.0, 'neu': 1.0, 'pos': 0.0, 'compound': 0.0}"
111,2020-11-13 17:59:59+00:00,The covid experience is a fraud therefore a lie. They turned a small population into major authoritarians.,"{'neg': 0.192, 'neu': 0.808, 'pos': 0.0, 'compound': -0.5859}"
112,2020-11-13 17:59:59+00:00,RT Georgia running not one but two Senators guilty of insider trading. They should be prosecuted not re-elected.,"{'neg': 0.307, 'neu': 0.693, 'pos': 0.0, 'compound': -0.7964}"
113,2020-11-13 17:59:59+00:00,"RT Americans killed in World War I: Over 116,000

Americans killed in Vietnam War: Over 58,000

Americans killed in Korean...","{'neg': 0.587, 'neu': 0.413, 'pos': 0.0, 'compound': -0.9729}"
114,2020-11-13 17:59:59+00:00,RT Murkomen do you know a hospital called kocholwa? In Elgeyo? I thought you should know that when I visited it had one drun...,"{'neg': 0.0, 'neu': 1.0, 'pos': 0.0, 'compound': 0.0}"
115,2020-11-13 17:59:59+00:00,"RT COVID is sadness. Profound sadness. It is suffering, and sacrifice. It is perhaps the greatest abdication of presidential re...","{'neg': 0.306, 'neu': 0.55, 'pos': 0.144, 'compound': -0.5719}"
116,2020-11-13 17:59:59+00:00,"RT Shame on you, @realDonaldTrump and your family. You put those sworn to protect you at risk with your reckless, danger...","{'neg': 0.378, 'neu': 0.535, 'pos': 0.087, 'compound': -0.8271}"
117,2020-11-13 17:59:59+00:00,RT He... Doesn't... Care...,"{'neg': 0.467, 'neu': 0.533, 'pos': 0.0, 'compound': -0.3875}"
118,2020-11-13 17:59:59+00:00,The blessing in disguise with this pandemic situation is im finally able to go on a date without having to reveal my repulsive face since its obviously covered with a mask,"{'neg': 0.058, 'neu': 0.848, 'pos': 0.094, 'compound': 0.296}"
119,2020-11-13 17:59:59+00:00,"RT Something extremely bogus is going on. Was tested for covid four times today. Two tests came back negative, two came back pos...","{'neg': 0.144, 'neu': 0.856, 'pos': 0.0, 'compound': -0.5719}"
120,2020-11-13 17:59:59+00:00,RT Y'all more scared of a lockdown and not the actual pandemic.,"{'neg': 0.225, 'neu': 0.775, 'pos': 0.0, 'compound': -0.4927}"
121,2020-11-13 17:59:59+00:00,THIS!,"{'neg': 0.0, 'neu': 1.0, 'pos': 0.0, 'compound': 0.0}"
122,2020-11-13 17:59:59+00:00,"Your administration caused this. #WearAMask you've been endangering the entire country  with your denials, ignorance and lack of empathy #timetoconcede #ByeTrumps","{'neg': 0.202, 'neu': 0.798, 'pos': 0.0, 'compound': -0.5859}"
123,2020-11-13 17:59:59+00:00,pov gen z storm white house now racism is gone and covid is cured then an imagine dragons song plays,"{'neg': 0.17, 'neu': 0.747, 'pos': 0.083, 'compound': -0.4767}"
