,created_at,full_text,sentiment_score
0,2020-11-12 10:59:54+00:00,"""#FordIncompetence Some form of lockdown 'inevitable' in Ontario as new COVID-19 cases surpass 1,400, expert says","{'neg': 0.0, 'neu': 1.0, 'pos': 0.0, 'compound': 0.0}"
1,2020-11-12 10:59:54+00:00,RT Craving zaman tak ada Covid,"{'neg': 0.0, 'neu': 1.0, 'pos': 0.0, 'compound': 0.0}"
2,2020-11-12 10:59:55+00:00,Playing  friendlies in a pandemic ffs,"{'neg': 0.322, 'neu': 0.254, 'pos': 0.424, 'compound': 0.0516}"
3,2020-11-12 10:59:55+00:00,"RT Please ensure that you wear a facial covering at all times on arrival on our terminals 
>","{'neg': 0.0, 'neu': 0.766, 'pos': 0.234, 'compound': 0.5994}"
4,2020-11-12 10:59:55+00:00,RT Cuz. Masks. Don't. Protect. Anyone.,"{'neg': 0.304, 'neu': 0.696, 'pos': 0.0, 'compound': -0.2924}"
5,2020-11-12 10:59:55+00:00,"RT After months of claims &amp; predictions about escalating suicide rates caused by lockdown, our findings are reassuring. But...","{'neg': 0.127, 'neu': 0.787, 'pos': 0.086, 'compound': -0.2263}"
6,2020-11-12 10:59:55+00:00,We should meet soon !! (After lockdown ),"{'neg': 0.0, 'neu': 1.0, 'pos': 0.0, 'compound': 0.0}"
7,2020-11-12 10:59:55+00:00,"RT So Anti Maskers &amp; Those Nutters Who Say Covid Doesn't Exist, It Could Be You, Death Numbers Rising!","{'neg': 0.285, 'neu': 0.715, 'pos': 0.0, 'compound': -0.7773}"
8,2020-11-12 10:59:55+00:00,We have to continue to prevent #COVID19 by ensuring we follow the preventive guidelines.,"{'neg': 0.0, 'neu': 0.789, 'pos': 0.211, 'compound': 0.296}"
9,2020-11-12 10:59:55+00:00,"RT A further 595 coronavirus deaths yesterday meant the UK became the first European country to surpass a death toll of 50,000.
https...","{'neg': 0.151, 'neu': 0.849, 'pos': 0.0, 'compound': -0.5994}"
10,2020-11-12 10:59:55+00:00,RT A swathe of top investment banks and funds are piling into emerging market assets on a double-lift in confidence after U.S. Pr...,"{'neg': 0.0, 'neu': 0.746, 'pos': 0.254, 'compound': 0.7003}"
11,2020-11-12 10:59:55+00:00,"We all have had a hugely stressful and at times crisis laden year , we are all ,and I include myself obeying the Covid Advice , we do need at a minimum a December where we can go for a meal or a beer ,lGyms swim play tennis or golf , we have got the numbers down,so we need a rest","{'neg': 0.113, 'neu': 0.852, 'pos': 0.035, 'compound': -0.7425}"
12,2020-11-12 10:59:55+00:00,RT Highlight: Malaysia ready to receive successfully developed COVID-19 vaccines -- PM Muhyiddin - Bernama,"{'neg': 0.0, 'neu': 0.597, 'pos': 0.403, 'compound': 0.7964}"
13,2020-11-12 10:59:55+00:00,RT #ALP_ki_kali_diwali  respected sir plz release new schedule for training with increase capacity . It's seem to be only R...,"{'neg': 0.0, 'neu': 0.717, 'pos': 0.283, 'compound': 0.6908}"
14,2020-11-12 10:59:55+00:00,"RT The FA asking for travel exemption so Iceland can play England..

There's a global pandemic you silly cunts. It's not...","{'neg': 0.152, 'neu': 0.701, 'pos': 0.147, 'compound': -0.2815}"
15,2020-11-12 10:59:56+00:00,Well done ! Himachal did well.,"{'neg': 0.0, 'neu': 0.471, 'pos': 0.529, 'compound': 0.5411}"
16,2020-11-12 10:59:56+00:00,RT We just did a million cases in TEN days. Y'all can't love hookah and well drinks this much.,"{'neg': 0.15, 'neu': 0.757, 'pos': 0.093, 'compound': -0.3111}"
17,2020-11-12 10:59:56+00:00,RT NEW: Leaked emails reveal Government blocked a Public Health England report showing that one million antibody tests the...,"{'neg': 0.206, 'neu': 0.794, 'pos': 0.0, 'compound': -0.5267}"
18,2020-11-12 10:59:56+00:00,"#WHO's Global Strategy and Plan of Action on Public Health, Innovation and Intellectual Property couldn't be more important against the backdrop of #COVID19, for which there's no effective response in sight. Read HAI's statement on this at the #WHA73:","{'neg': 0.096, 'neu': 0.773, 'pos': 0.13, 'compound': 0.3689}"
19,2020-11-12 10:59:56+00:00,RT Want to go to a sporting event in 2021?. Then pay a PS5 to get a 'Covid-19 test' first- if the UK govt gets its way (after...,"{'neg': 0.049, 'neu': 0.906, 'pos': 0.045, 'compound': -0.0258}"
20,2020-11-12 10:59:56+00:00,"RT Stay-at-Home Cupsleeve Event for thank you and .. Happy birthday Dara 

#EverydayI...","{'neg': 0.0, 'neu': 0.64, 'pos': 0.36, 'compound': 0.7351}"
21,2020-11-12 10:59:56+00:00,RT Trying to apply for jobs during this pandemic,"{'neg': 0.0, 'neu': 1.0, 'pos': 0.0, 'compound': 0.0}"
22,2020-11-12 10:59:56+00:00,"RT If the coronavirus regulations expire tonight, the Covid restrictions support scheme for businesses that was introduced to...","{'neg': 0.0, 'neu': 0.863, 'pos': 0.137, 'compound': 0.4019}"
23,2020-11-12 10:59:56+00:00,"RT As said yesterday, we are facing a dark winter if we don't get coronavirus under control. Please wear a mask to...","{'neg': 0.0, 'neu': 0.901, 'pos': 0.099, 'compound': 0.3182}"
24,2020-11-12 10:59:56+00:00,"TERS-FUNDING/UIF: SURVEY 12 November 2020 (June, July, Aug and Sep)
https://t.co/DBe01dwg4P","{'neg': 0.0, 'neu': 1.0, 'pos': 0.0, 'compound': 0.0}"
25,2020-11-12 10:59:56+00:00,RT still don't know how covid started by someone eating a bat and not the era where people used to get their feet munched b...,"{'neg': 0.0, 'neu': 1.0, 'pos': 0.0, 'compound': 0.0}"
26,2020-11-12 10:59:56+00:00,RT #WorkFromHome tomorrow in #Akl,"{'neg': 0.0, 'neu': 1.0, 'pos': 0.0, 'compound': 0.0}"
27,2020-11-12 10:59:56+00:00,Holistic home: how to stay consistent with your #homedecor,"{'neg': 0.0, 'neu': 1.0, 'pos': 0.0, 'compound': 0.0}"
28,2020-11-12 10:59:56+00:00,"Ingatan nawa po ang lahat! If we are still safe and sound, have a nice connection and have electricity. Join us, as we hear the doctrines of our Lord Jesus Christ

These calamaties and pandemic has a message for us. Let's turn back to our Creator

#PureDoctrinesOfChrist","{'neg': 0.066, 'neu': 0.785, 'pos': 0.15, 'compound': 0.5562}"
29,2020-11-12 10:59:56+00:00,RT MN households can order up to 5 COVID tests to be delivered to their homes for free. it comes with free shipping to send it...,"{'neg': 0.0, 'neu': 0.784, 'pos': 0.216, 'compound': 0.765}"
30,2020-11-12 10:59:57+00:00,RT Valentino Rossi tests positive for COVID-19 again,"{'neg': 0.0, 'neu': 0.66, 'pos': 0.34, 'compound': 0.5574}"
31,2020-11-12 10:59:57+00:00,"RT With new provincial modelling expected to come out today, WR is on pace to surpass 900 new COVID-19 infections this month. A...","{'neg': 0.0, 'neu': 1.0, 'pos': 0.0, 'compound': 0.0}"
32,2020-11-12 10:59:57+00:00,RT Seems sensible: the National Audit Office is 'looking into Government procurement activity during the COVID-19 pandemic...,"{'neg': 0.0, 'neu': 1.0, 'pos': 0.0, 'compound': 0.0}"
33,2020-11-12 10:59:57+00:00," Our weekly newsletter is out: green bonds, tax relief when working from home, market update and effect of the pandemic on the property market. -","{'neg': 0.0, 'neu': 0.886, 'pos': 0.114, 'compound': 0.4767}"
34,2020-11-12 10:59:57+00:00,"RT Young, healthy people who contract the coronavirus are often asymptomatic, rarely need hospital care and can transmit the viru...","{'neg': 0.113, 'neu': 0.772, 'pos': 0.116, 'compound': 0.0186}"
35,2020-11-12 10:59:57+00:00,RT Suicide figures are up 200% since lockdown. Could 2 friends please copy and re-post this tweet? We're trying to demonstrate...,"{'neg': 0.161, 'neu': 0.645, 'pos': 0.194, 'compound': -0.0258}"
36,2020-11-12 10:59:57+00:00,Emirates turns to Dubai to see it through crisis after $3.4bln loss - - Emirates said on Thursday that Dubai would help it through the coronavirus crisis after losses of $3.4 billion tipped the airline's holding company into its first half-year loss,"{'neg': 0.286, 'neu': 0.664, 'pos': 0.05, 'compound': -0.9153}"
37,2020-11-12 10:59:57+00:00,"RT from taal, covid, lockdown, quarantine, political dispute and karon multiple typhoon is racking our nation. Grabe 2020 we...","{'neg': 0.13, 'neu': 0.87, 'pos': 0.0, 'compound': -0.4019}"
38,2020-11-12 10:59:57+00:00,"RT from taal, covid, lockdown, quarantine, political dispute and karon multiple typhoon is racking our nation. Grabe 2020 we...","{'neg': 0.13, 'neu': 0.87, 'pos': 0.0, 'compound': -0.4019}"
39,2020-11-12 10:59:57+00:00,Please be careful and safe. This is not a line you want to be in.,"{'neg': 0.0, 'neu': 0.576, 'pos': 0.424, 'compound': 0.7269}"
40,2020-11-12 10:59:57+00:00,How much oxygen do LMICs need to treat #COVID19 patients? 8.56M cubic meters on #WorldPneumoniaDay alone! Explore new Oxygen Tracker UPDATED DAILY: #ACTogether #InvestinOxygen #EveryBreathCounts,"{'neg': 0.071, 'neu': 0.822, 'pos': 0.107, 'compound': 0.2481}"
41,2020-11-12 10:59:57+00:00,"RT Hi, i have several degrees and yeah i teach medicine at a Top Dog Hospital so listen close as I tell you a covid contr...","{'neg': 0.0, 'neu': 0.857, 'pos': 0.143, 'compound': 0.4588}"
42,2020-11-12 10:59:57+00:00,"RT And there it is folks...the surveillance state now owns you.

https://t.co/VKcfpuRfPQ","{'neg': 0.0, 'neu': 1.0, 'pos': 0.0, 'compound': 0.0}"
43,2020-11-12 10:59:57+00:00,RT Ontario to release updated modelling today forecasting course of 2nd wave of COVID-19.,"{'neg': 0.0, 'neu': 1.0, 'pos': 0.0, 'compound': 0.0}"
44,2020-11-12 10:59:57+00:00,RT You can't be pro-life and believe we should give up fighting the pandemic.,"{'neg': 0.161, 'neu': 0.839, 'pos': 0.0, 'compound': -0.3612}"
45,2020-11-12 10:59:57+00:00,"RT How did people this stupid ever take power in this country?

Trump White House election party becomes super-spreader even...","{'neg': 0.162, 'neu': 0.729, 'pos': 0.109, 'compound': -0.3182}"
46,2020-11-12 10:59:57+00:00,RT Black people found to be twice as likely to catch coronavirus as their white counterparts in larg...,"{'neg': 0.0, 'neu': 1.0, 'pos': 0.0, 'compound': 0.0}"
47,2020-11-12 10:59:57+00:00,"Right folks, this island has the most deaths from covid 19 in Europe,the Westminster elite doesn't want an enquiry into it's handling of the the pandemic, no shit!!! It's time for the leaders of the Scotland,Wales  and unfortunately Boris to be on the same strategy,","{'neg': 0.091, 'neu': 0.85, 'pos': 0.059, 'compound': 0.291}"
48,2020-11-12 10:59:57+00:00,"RT BJP's ""masterstrokes"" like demonetisation, GST &amp; lockdown did after all achieve something ""historic!"": the historic devastati...","{'neg': 0.0, 'neu': 0.851, 'pos': 0.149, 'compound': 0.4199}"
49,2020-11-12 10:59:57+00:00,RT Report finds people with learning disabilities &amp; autistic people were 4 times more likely to die with COVID-19 than ot...,"{'neg': 0.172, 'neu': 0.828, 'pos': 0.0, 'compound': -0.6326}"
50,2020-11-12 10:59:57+00:00,RT Wow. Just wow.,"{'neg': 0.0, 'neu': 0.208, 'pos': 0.792, 'compound': 0.8225}"
51,2020-11-12 10:59:58+00:00,Social Media-Based Trafficking in Women and Girls on the Rise During Coronavirus Pandemic,"{'neg': 0.0, 'neu': 1.0, 'pos': 0.0, 'compound': 0.0}"
52,2020-11-12 10:59:58+00:00,"RT Jan- Taal volcano eruption
Feb- Global spread of Covid-19 
Mar- Covid-19 case increases
Apr- Enhance Comm. Quarantine
May-...","{'neg': 0.0, 'neu': 1.0, 'pos': 0.0, 'compound': 0.0}"
53,2020-11-12 10:59:58+00:00,".@_DanSeymour, Director of Strategic Partnerships will be speaking at our &amp; event tomorrow. He will be talking about the empowerment of women during crises like #COVID19, the role of private sector &amp; good practices. 
 Save the date: 13 Nov. 10am.","{'neg': 0.0, 'neu': 0.811, 'pos': 0.189, 'compound': 0.8225}"
54,2020-11-12 10:59:58+00:00,"RT Last paper --&gt; Wait at least a month to operate after Covid   

Now --&gt; wait for a negative SARS-Cov-2 swab before oper...","{'neg': 0.144, 'neu': 0.856, 'pos': 0.0, 'compound': -0.5719}"
55,2020-11-12 10:59:58+00:00,RT Matt Hancock on telling us that the Pfizer COVID vaccine will be manufactured in Belgium and needs to be transp...,"{'neg': 0.0, 'neu': 1.0, 'pos': 0.0, 'compound': 0.0}"
56,2020-11-12 10:59:58+00:00,"RT Sex education!!! 
(Not in a perverted way or anything) 
Here me out..
We are a conservative society, yes and parents ar...","{'neg': 0.0, 'neu': 0.757, 'pos': 0.243, 'compound': 0.7526}"
57,2020-11-12 10:59:58+00:00,"RT Or, you know, shut down tax haven use, get Amazon etc to pay tax and all the other actual causes.","{'neg': 0.063, 'neu': 0.86, 'pos': 0.077, 'compound': 0.0772}"
58,2020-11-12 10:59:58+00:00,RT Useful to look at longterm mortaility curves to see overall effect of the pandemic and add some balance to the discussions...,"{'neg': 0.0, 'neu': 0.879, 'pos': 0.121, 'compound': 0.4404}"
59,2020-11-12 10:59:58+00:00,"RT As we get into the final stretch of bidding farewell to our beloved Hon. Ken Mainya, MCA Kiamokama ward, I urge all his co...","{'neg': 0.0, 'neu': 0.879, 'pos': 0.121, 'compound': 0.5106}"
60,2020-11-12 10:59:58+00:00,So critical that Business leaders model exemplary behaviours #DoTheRightThing #HeroToZero #AllInThisTogether Pfizer chief sold $5.6m of shares on day of Covid vaccine announcement,"{'neg': 0.101, 'neu': 0.814, 'pos': 0.085, 'compound': -0.101}"
61,2020-11-12 10:59:59+00:00,"RT Thank you   the entire machinery is working to keep everyone safe. We need to follow only 3 things-
1) Wear a mask
2)...","{'neg': 0.0, 'neu': 0.803, 'pos': 0.197, 'compound': 0.6597}"
62,2020-11-12 10:59:59+00:00,RT Man spun the coupe on us ,"{'neg': 0.0, 'neu': 1.0, 'pos': 0.0, 'compound': 0.0}"
63,2020-11-12 10:59:59+00:00,Memo To Joe: COVID Is Skyrocketing In States That Already Have Mask Mandates - Issues &amp; Insights,"{'neg': 0.0, 'neu': 1.0, 'pos': 0.0, 'compound': 0.0}"
64,2020-11-12 10:59:59+00:00,RT How likely is it you'll encounter at least one person who is infected with the coronavirus if you go to a bar in Denver? What...,"{'neg': 0.113, 'neu': 0.887, 'pos': 0.0, 'compound': -0.4939}"
65,2020-11-12 10:59:59+00:00,Like the first time when the pandemic started in earnest in WC and the rest of the country followed about 2-3 weeks later. Similar pattern now with rise in cases in WC last two weeks and now WC starting to take off.,"{'neg': 0.0, 'neu': 0.873, 'pos': 0.127, 'compound': 0.7003}"
66,2020-11-12 10:59:59+00:00,I'm convinced these man are ill,"{'neg': 0.295, 'neu': 0.421, 'pos': 0.284, 'compound': -0.0258}"
67,2020-11-12 10:59:59+00:00,"RT He has compromising photos of the Coronavirus that he'll let slip if it doesn't do as he s... wait, no that can't be...","{'neg': 0.087, 'neu': 0.913, 'pos': 0.0, 'compound': -0.296}"
68,2020-11-12 10:59:59+00:00,Not black people worldwide you better put it as african american or maybe carribean people because down here in africa we can truly say that we are immune from this crap We are less dying from coronavirus than the rest of the world,"{'neg': 0.052, 'neu': 0.786, 'pos': 0.161, 'compound': 0.6597}"
69,2020-11-12 10:59:59+00:00,"Could Iceland's forensic-style contact tracing be the key to defeating Covid-19?

https://t.co/K4lhou5DKh","{'neg': 0.191, 'neu': 0.809, 'pos': 0.0, 'compound': -0.3818}"
70,2020-11-12 10:59:59+00:00,RT This should be getting more attention considering Muslims are often labeled as anti-science. This vaccine could potent...,"{'neg': 0.0, 'neu': 1.0, 'pos': 0.0, 'compound': 0.0}"
71,2020-11-12 10:59:59+00:00,"It's #WorldPneumoniaDay during a pandemic that's dramatically increasing #pneumonia deaths. Working in #HealthcareComms, we can play a role in raising awareness and advocating change, but has resources allowing everyone to do something","{'neg': 0.0, 'neu': 0.948, 'pos': 0.052, 'compound': 0.1779}"
72,2020-11-12 10:59:59+00:00,"RT For the second time this week, researchers have announced positive results for the final, human stages of a #coronavirus va...","{'neg': 0.0, 'neu': 0.847, 'pos': 0.153, 'compound': 0.5574}"
73,2020-11-12 10:59:59+00:00,"RT As our next president, will listen to experts and be honest with the American people about the pandemic. That's...","{'neg': 0.0, 'neu': 0.852, 'pos': 0.148, 'compound': 0.5106}"
74,2020-11-12 10:59:59+00:00,"Can the Coronavirus be the End of Coworking Space? #CRE #Coworking #COVID-19 
https://t.co/4XWrtyt2hW","{'neg': 0.0, 'neu': 1.0, 'pos': 0.0, 'compound': 0.0}"
75,2020-11-12 10:59:59+00:00,"RT 10 CARICOM Elections, 1 marathon US election &amp; an ongoing worldwide pandemic later - (as it stands) we have reached the e...","{'neg': 0.0, 'neu': 0.94, 'pos': 0.06, 'compound': 0.1027}"
76,2020-11-12 10:59:59+00:00,If you have suicidal thoughts reach out for help it's important you do or you can take advice from me I used to suffer the same way don't let Stress get to you and avoid all negative even if you have deactivate your account reaching out to love ones is priority,"{'neg': 0.202, 'neu': 0.596, 'pos': 0.202, 'compound': -0.453}"
77,2020-11-12 10:59:59+00:00,RT So what they're saying is the key workers who have managed to hold down their job and are still working and risking the...,"{'neg': 0.091, 'neu': 0.909, 'pos': 0.0, 'compound': -0.3182}"
78,2020-11-12 10:59:59+00:00,RT how will the future of our workspaces look? founder and CEO jeroen ter hoeven speculates post-pandemic possibilitie...,"{'neg': 0.0, 'neu': 1.0, 'pos': 0.0, 'compound': 0.0}"
79,2020-11-12 10:59:59+00:00,RT I  love presidents that wear a mask when they are honoring veterans during a pandemic that is threatening millions of Ameri...,"{'neg': 0.114, 'neu': 0.635, 'pos': 0.251, 'compound': 0.6249}"
80,2020-11-12 10:59:59+00:00,"RT LOOK AT THESE NUMBERS
144,000 Americans tested positive for #COVID19 in 24 hours.
More people are hospitalized in Ameri...","{'neg': 0.0, 'neu': 0.841, 'pos': 0.159, 'compound': 0.5574}"
81,2020-11-12 10:59:59+00:00,"Did you know (via @WSJ) that during the airplane deicing process, ""... aircraft manufacturers confirm the flow of air is reduced by as much as 50%...""  #travel #news ","{'neg': 0.0, 'neu': 1.0, 'pos': 0.0, 'compound': 0.0}"
82,2020-11-12 10:59:59+00:00,"I think we would have if this hadn't happened to be honest.  I actually saw what was trying to be achieved, sadly Covid got in way. But I for one won't be voting for them, if they go back to Tories of old.","{'neg': 0.042, 'neu': 0.91, 'pos': 0.048, 'compound': 0.0644}"
83,2020-11-12 10:59:59+00:00,"RT Stay home stay safe
#AngamizaCoronaUG","{'neg': 0.0, 'neu': 0.633, 'pos': 0.367, 'compound': 0.4404}"
84,2020-11-12 10:59:59+00:00,"RT Graduate school, a pandemic, and a Presidential election is not a combination i would recommend ","{'neg': 0.0, 'neu': 0.857, 'pos': 0.143, 'compound': 0.3612}"
85,2020-11-12 11:00:00+00:00,"PSNI told to phase out spit guards!!! 

In the midst of a global pandemic that can be spread by spitting they want to do away with spit guards!!!

That kind of thinking should be criminal.","{'neg': 0.118, 'neu': 0.849, 'pos': 0.033, 'compound': -0.6449}"
86,2020-11-12 11:00:00+00:00,"What opportunities are there for #entrepreneurs outside of Europe who are seeking a foothold in its markets, as well as local #business owners who want to adapt to a post-COVID-19 world?

Take a look at this report from 
@UBS to find out:","{'neg': 0.0, 'neu': 0.867, 'pos': 0.133, 'compound': 0.6124}"
87,2020-11-12 11:00:00+00:00,"  currently have 2 funds open 
- Women's Sector Resilience Fund for organisations with an income of PS250k - PS1million  
- Covid-19 Frontline Fund, for organisations with an income of less than PS250K. 
More info, &amp; how to apply here:","{'neg': 0.0, 'neu': 1.0, 'pos': 0.0, 'compound': 0.0}"
88,2020-11-12 11:00:00+00:00,"RT ""Other countries have social safety nets. The U.S. has women.""

I talked to about her research on women &amp; pa...","{'neg': 0.0, 'neu': 0.877, 'pos': 0.123, 'compound': 0.4215}"
89,2020-11-12 11:00:00+00:00,"Due to the ongoing failure to commission #abortion services in #NorthernIreland, some women are still forced to cross a sea to access healthcare in the middle of a #pandemic. 

Join the discussion on 14th Dec from 15.00 - 16.30. ","{'neg': 0.142, 'neu': 0.809, 'pos': 0.049, 'compound': -0.6249}"
90,2020-11-12 11:00:00+00:00,"Visitors to one of Shropshire's most popular markets will know June Beharrall well, as every Friday and Saturday the fundraiser would set up her chair and collect for the Severn Hospice.
https://t.co/6CWW29SayI","{'neg': 0.0, 'neu': 0.852, 'pos': 0.148, 'compound': 0.6361}"
91,2020-11-12 11:00:00+00:00,"RED ZONE: Cases are up 34% from last week, according to the White House report, and the state's test positivity rate ranks 11th highest in the U.S.","{'neg': 0.0, 'neu': 0.887, 'pos': 0.113, 'compound': 0.5106}"
92,2020-11-12 11:00:00+00:00,Please read the Nov. 9 letter to families regarding additional confirmed COVID-19 cases and a temporary closure of Huth Road Elementary School:,"{'neg': 0.0, 'neu': 0.901, 'pos': 0.099, 'compound': 0.3182}"
93,2020-11-12 11:00:00+00:00,RT What you need to know about the coronavirus right now,"{'neg': 0.0, 'neu': 1.0, 'pos': 0.0, 'compound': 0.0}"
94,2020-11-12 11:00:00+00:00,"#COVID19 Could Damage #Fertility of Up to 20% of Male Survivors, Scientist Claims","{'neg': 0.211, 'neu': 0.789, 'pos': 0.0, 'compound': -0.4939}"
95,2020-11-12 11:00:00+00:00,"RT MAAM,osmania university is conducting our previous semester main exams I.e for 2nd, 4th and 6th semeste...","{'neg': 0.0, 'neu': 1.0, 'pos': 0.0, 'compound': 0.0}"
96,2020-11-12 11:00:00+00:00,"919 new cases and 15 new deaths in Libya 

[11:00 GMT] #coronavirus #CoronaVirusUpdate #COVID19 #CoronavirusPandemic","{'neg': 0.0, 'neu': 1.0, 'pos': 0.0, 'compound': 0.0}"
97,2020-11-12 11:00:00+00:00,"Some big changes here as we prepare to exit Level 5
https://t.co/C9hCzphxJ6","{'neg': 0.0, 'neu': 1.0, 'pos': 0.0, 'compound': 0.0}"
98,2020-11-12 11:00:00+00:00,"After Pfizer announced that its vaccine showed 90 percent effectiveness, Russia claimed Sputnik V is better and they are planning for mass vaccination

#coronavirus #COVID19
 
https://t.co/XftHfC1zsj","{'neg': 0.0, 'neu': 0.896, 'pos': 0.104, 'compound': 0.4404}"
99,2020-11-12 11:00:00+00:00,"Public transit ridership may have fallen off during the pandemic, but a new poll shows most Canadians support more government funding for transit. At 6:10, we'll speak w/ of which commissioned the research. #ldnont 

READ:","{'neg': 0.045, 'neu': 0.852, 'pos': 0.102, 'compound': 0.4969}"
100,2020-11-12 11:00:00+00:00,The pandemic has resulted in fewer people accessing NHS services for a range of conditions that are not related to coronavirus. It's important to assure older family and friends that they won't be a burden on the NHS and that their GP will be able to help them.,"{'neg': 0.0, 'neu': 0.776, 'pos': 0.224, 'compound': 0.8861}"
101,2020-11-12 11:00:00+00:00,"Athletes arriving in Tokyo for next year's Olympic Games, postponed from 2020 because of the #coronavirus pandemic, will be exempt from the 14-day isolation period
https://t.co/bkalbPHYIB","{'neg': 0.156, 'neu': 0.796, 'pos': 0.048, 'compound': -0.4767}"
102,2020-11-12 11:00:00+00:00,"Smell, Taste Changes Early Indicators of #COVID19 Community Spread, New Research Finds

https://t.co/1YcVV97Hpn

(: Xinhua/IANS)","{'neg': 0.0, 'neu': 0.814, 'pos': 0.186, 'compound': 0.4939}"
103,2020-11-12 11:00:00+00:00,"Yes 'Cor!', considering your track is Peter Green's Fleetwood Mac playing Albatross and he died in June. So, yes, 'Cor! What a year it's been'. It's ok, it wasn't from Covid.","{'neg': 0.094, 'neu': 0.703, 'pos': 0.203, 'compound': 0.4912}"
104,2020-11-12 11:00:00+00:00,"Birmingham City women have got an injury crisis going into the derby with Aston Villa. Awaiting results on a scan for Sarah Mayling today. As it stands, Carla Ward has just 10 players available for selection. Currently can't call on academy players due to Covid protocols. #BCFC","{'neg': 0.133, 'neu': 0.867, 'pos': 0.0, 'compound': -0.7845}"
105,2020-11-12 11:00:00+00:00,"Kindly contact the following helpline for #COVID19 testing issue: 
# CMO District Bargarh: 06646 231763
# #COVID Helpline: 06646 232112

#COVID_19 #COVID__19 #COVID19 #COVID19India #Corona #coronavirus #CoronavirusIndia #CoronavirusPandemic","{'neg': 0.0, 'neu': 0.894, 'pos': 0.106, 'compound': 0.4939}"
106,2020-11-12 11:00:00+00:00,RT Have a good day.. it's almost weekend!! #ThursdayThoughts #dogsoftwitter #staysafe #lockdown,"{'neg': 0.0, 'neu': 0.759, 'pos': 0.241, 'compound': 0.5399}"
107,2020-11-12 11:00:00+00:00,"RT ""What I'm hearing from our members is cautious optimism.
Everybody is really looking at the logistics of this &amp; really reall...","{'neg': 0.056, 'neu': 0.803, 'pos': 0.141, 'compound': 0.4767}"
108,2020-11-12 11:00:00+00:00,"This is brilliant. And has a great mondegreen in there too, which I'm sure is deliberate. 
#WearAMask","{'neg': 0.0, 'neu': 0.579, 'pos': 0.421, 'compound': 0.8807}"
109,2020-11-12 11:00:00+00:00,"#COVID19, as of 11/12, 6am:

>Global cases: 52,178,723
>Global [deaths]: 1,285,379
>US: 10,400,943
>US [deaths]: 239,683 [+2117]
>TN: 293,381 [3761]
>GA: 377,694 [8333]
>NC: 300,561 [4698]
>AL: 208,637 [3201]
>Local cases:","{'neg': 0.0, 'neu': 1.0, 'pos': 0.0, 'compound': 0.0}"
110,2020-11-12 11:00:00+00:00,"Remember, if you get any symptoms of coronavirus, you and your household need to self isolate straight away. This is so you don't spread the disease to others, and to protect your local community.

BSL version 
https://t.co/GxqdOV0A2U","{'neg': 0.045, 'neu': 0.844, 'pos': 0.112, 'compound': 0.4019}"
111,2020-11-12 11:00:00+00:00,"RT from taal, covid, lockdown, quarantine, political dispute and karon multiple typhoon is racking our nation. Grabe 2020 we...","{'neg': 0.13, 'neu': 0.87, 'pos': 0.0, 'compound': -0.4019}"
112,2020-11-12 11:00:00+00:00,#InThisTogether: and agencies from local and federal governments in Guam  recently completed a vital project to accommodate those affected by #COVID19. #KnowYourMil,"{'neg': 0.067, 'neu': 0.84, 'pos': 0.092, 'compound': 0.1531}"
113,2020-11-12 11:00:00+00:00,RT Why is playing vox pops with random members of the public speculating that the Covid vaccine might be unsafe?...,"{'neg': 0.0, 'neu': 0.913, 'pos': 0.087, 'compound': 0.2023}"
