,full_text
0,wish normalcy classroom much want grasp normalcy
1,omicron euphoria high
2,omicron euphoria high
3,local hospital follow scienceyou also see recent announcement news lifti
4,canada long convoy world trucker make way withsupporter line way cheer bridge
5,pandemic happened still face hardship perform grammy stop cb stage work hard show sit hour get pay army u even think tweet
6,omicron generate antibody effective variant concern adolescent adult icmr study india news
7,barca able fill entire camp nou fans game atletico madrid measure slo
8,reiner fullmich amp lawyer vaccine design kill depopulate
9,reminder lockdown birthday party happen rural location wellhunt master suspend ride
10,french academy medicine urge vaccination strong term highlight safety efficacy vaccine
11,dear boris
12,death covid last hour learn live like flu say death third
13,can not get vaccination exemption california penalty doctor write exemption
14,government line rule be not important minor thing breach extraordinarily r
15,cultural institution venue close since country enter national lockdown december respon
16,limited effectiveness locally develop vaccine force mainland china maintain tight restriction travel th
17,politican really care pakistan impose lockdown day see difference covid chartsmany people die got covid include student question pti risk live
18,play monopoly bill gate reveal deep structural inequality access medicine globally root cause ip sustain dominate industrys interest cost
19,inappropriate bus pass legitimate reason ask question unethical coercive manipulation research compromise due incentive manipulation ethnic question covid vaccine
20,trudeau hold get trucker vaccinate we lift vaccine mandate trucker
21,take second sign get free covid test kit take four day receive via usps
22,news media full run story omicron mild however reality hospital fill people sick die
23,you re home stay please
24,
25,today govt pass tradeuniontax make trade union pay regulationit trade union worke
26,be not real issue partygate afraid catch spread contrary communicate down street know
27,good read miss lecture kindly read jsagyepong
28,sound like news spending time try make covid response disaster adern incompetent corrupt oh uk usa think owner main new paper example try get murchoch
29,world bank economic monitor expect burmas economy grow year september whilst also suggest
30,treasure teume pls stop seek validation
31,folk sick back tooth hear word covid forget boris johnson govt ac
32,reason still vaccine pharmaceutical company want immunity pro
33,stay home do not enough big boy living be not compulsory
34,he s run
35,among many triviality serious point appalling johnson friend believe worth undermine
36,man odd succeed pull audience india theatre covid time
37,omicron mutation allow
38,young kid young baby age seem even high risk quite shocking da
39,unfortunately like alot people class antivaccine likely anti vaccine mandate completely different antivax people can not seem get head around though
40,omicron euphoria high
41,vaccine deadly virus
42,bnsf strategically implement barbaric attendance policy supply chain crisis prevent strike bnsf have not change attendance policy nearly year pandemic change twice pandemic make restrictive
43,study say risk die covid percent high red state should not big story
44,north india net pushpatherise imagine pushpa good promotion
45,phd position infection research
46,omicron euphoria high
47,omicron euphoria high
48,official death covid rather covid medium misguidedly push ho
49,lol military vaccinate friend got covid practically die yet still never get bit sick still hung vaccine work make sense vaccine do not work get covid symptom
50,wbasiapacific expect myanmar economy grow year amp say situation amp outlook people myanmar c
51,hey yallim kathleen brown running congress texas trump old coviddenying doctor ronny jackson
52,sageyou know full well people do not die last dayyou know full well tuesday data dum
53,omicron euphoria high
54,educational institute pimg gwalior asst prof amp prof testing covid stil govt
55,happy identity hide asylum seeker reach week ago home office deny
56,hear wine amp cheese party nightingale hospital never use inflation mortality
57,finallycase definition include multiple infection episode january january ukhsa move case report england new episodebase definition include possible reinfection
58,known case force test recent sewage testing report covid already spread everywhere
59,covid positive do not mean negative sir get well soon sir take care family god
60,stay home save livesnow go side planet sacrifice warthe people charg
61,death covid last hour learn live like flu say death third
62,vibrator motor market forecast potential impact despite pandemic find fmi
63,covid deathsgreat economic hit abandon die care fail test amp trac
64,govt provide toilet people less year first look number covid case bless nation nation able provide good health facility people
65,sad people tv watch whilst grow hero turn bunch author
66,covid dead daywe get kid hospitalise weekget back normalsold
67,hear wine amp cheese party nightingale hospital never use inflation mortality
68,thing malaysia letter supportno evidence need present refer study foreig
69,case mount china ease testing standard beijing olympics
70,news still astonish government will not cut vat fuel take poorest
71,get unexpected call clinical lead I ve spend huge number hour past two week comms
72,new report omicron impact emergency room hospitalization httpstcomedybywsti
73,parent know question kid amp covid do not rely toolkit spread small fringe group
74,home covid rule emphatically break people understand life depend upon b
75,late dfe data show bad situation kid cos covid jan bad primary school kid
76,want look reason poor vaccine uptake adolescent look member jcvi
77,france report new coronavirus case become second country world reach half million case day
78,sixtime world championship medallist fully vaccinatedand diedput headline scumbag
79,peerreviewed po yung study regard omicron offer crossantigenicity delta
80,two year we fully vaccinate well we boost willing take chance we ve lose job house friend etc let say hit serious live die covid boost meh
81,record work permit issue refugee jordan last year jordan rebuild pandemic unhcr
82,first lockdown completely different person
83,omicron euphoria high
84,woman work animal protectionthe pandemic major impact animal well humansshe say
85,we prepare allow diplomat leave china strict covid rule
86,will not morrison express sadness condolence die covid race situation kid
87,covid positive
88,big good luck amp thank bon take memory nan bon say art help many people throughout pandemic include amp give gift art therapy child need invaluable therapy
89,year old get vaccine week navigation walk wakefield find date time go walkin appointment available please book possible avoid wait
90,people cancer family might feel especially worried virus information support amp guidance contact cancer covidvaccine support
91,weibowednesday response qs omicronspecific vaccine would available weibo vaccine influencer zhuang shi li say despite relative ease developer might willing make due uncertainty long omicron last major variant
92,anyone would think tories mate involve covidfraud
93,turkeys health ministry report thousand new case death last hour
94,getbooste bude booster dose available people age old sunday january
95,even do not fly conference eg due legitimate carbon footprint concern look like plane fly without ushttpstcokiminstdni
96,started collect merch lockdown start due pandemic marchapril time fund transfer fee waive transact easy additional fee pay bank buy online gradually learn like leap faith
97,ministry health kenya recently announce plan manufacture facility capital city nairobi support production host vaccinesrread
98,accord recent study essential ventilate home minimum minute day covid also eliminate condensation cause health issuesreminder wedocare wellness ventilation
99,leisure hospitality business across rotherham apply omicron hospitality leisure grant online do not delay check eligibility apply
100,atp california country respectable
101,today parentsday day many we reflect matter new life bring world
102,help team work safely amp efficiently possible covid range shop essential keep work life move facemask disinfectant hand sanitiser amp personal ppe kit wellbee productivity january
103,do not want son part giant experiment public attitude towards vaccine
104,vaccineif fully protect book appointment attend dropin centre
105,business support grant repay department enterprise report taaffem
106,beautiful heartbreaking
107,mukesh hisariya social worker patna do exceptional work pandemic include cremate hundred covid patientsfrontlinewarrior onlymyhealth
108,there s womenonly covid vaccination clinic today femaleonly staff hand support answer question forest rec vaccination centre we d amp booster jab need book queue speak staff arrivaltakecarenottingham
109,china amp cambodia tues sign agreement dispatch team traditional chinese medicine expert help cambodia fight medical team train qualified medical professional amp provide prevention treatment amp rehabilitation service
110,despite vaccinated boost elton john contract postpone two farewell concert date
111,individual test positive federal capital today past one week high number
112,lot opportunity getbooste vaccine clinic week info
113,legendary rocker neil young reportedly tell management team want music pull spotify vaccine misinformation share joe rogan popular podcast
114,doctor fragile ask come back duty blunderousaccorde dr aviral mathur worsen mental health healthcare worker across hospital become grow epidemicsupritidavid
115,restore neuro service disrupt one priority come month set neurology disabilitytwitter
116,indepth analysis impact global automatic clay brick making machine
117,indias tally rise wednesday new case register past hour across south asian country accord federal health ministrys late dataindia
118,siu find steal covid fund
119,home covid rule emphatically break people understand life depend upon b
120,nternational sos release annual risk outlook report predict top threat high list negative productivity factor top mental health natural disaster transport concern security civil unrest
121,ipri infographic graph visualize growth rate pakistan economy due pandemic extreme downward trend note country jump back drastically soon
122,claim true natural immunity effective vaccine immunity one specific example use hospital staffing shortage rehire staff prior covid
123,pandemic accelerate trend towards mobile adoption digitalization discover main challenge every company face
124,kenyas rate drop test
125,pfizer amp biontech launch research omicron vaccine w initial result expect half year
126,scientist think may stay vaccine mask physical distancing ventilation key keep safe get back normal life
127,see yes pretty strict restriction unvaccinated people join public life therefore protest magnitude pandemic incomprehensible also much get term think I m self choose lockdown minimize risk
128,week like every week hear family woman murder pandemic one woman say
129,experience
130,do not wait take vaccine consequence pregnant potentially devastating have not vaccine recommend get first two dose soon possible book vaccine
131,there s evidence booster dose reduce person likelihood infect super li
132,show anti vaccine people raft datum vary measure support opinion theory eff thick drink urine bleach chaser whilst deprive horse worm treatment
133,join next eventenvironmental psychologist join share finding recent research project moment change relate netzero societal change pandemic feb
134,imf predict uk economy grow slowly expect year recover covid pandemic forecast uk growth cut imfs late world economic outlook although good figure
135,shout good book help we make pandemic
136,current condition sayre patemp chill point barometer inhgwind mph nacorona virus weekly statscase nepa bradfordcounty
137,also good degree one good university thing get bad people
138,tragedy another covid relate death today south australia sicken around country politic
139,safe working practice vital workplace adjust late omicron wave covid unite rep access work voice pay checklist white heavy check markwhite heavy check mark
140,industry chief say britain finally get back business next month fullyvaccinate traveller arrive overseas england long take covid via businesstravel scottpawley
