,full_text
0,reschedule wedding due covid case number high original date
1,thank najlepsa hvala slovenian presidency do much move european agenda forwa
2,one could excuse believe scott morrison put mate first australians health last unacceptable covid
3,occur virtually everyone get covid suffer sort permanent damage hisher bodybrain
4,cutieeeee
5,exactly variant would say
6,nhs dentist tell meet activity level pre covid otherwise face financial penaltiescould lose sur
7,first month stock food chain disrupt enough whatever need survive mont
8,wonder many gay people antivaxxer reason think get close vaccine aids question would take refuse ground turn mouse something equally bizarre
9,die line duty actually die covid
10,want able track one activity
11,reminder mild case omicron may mild people spread
12,seem come blue someone warn we
13,covid wait inhale you all tonight
14,month least stimulus check hazard pay federally mandate pay time weekly mask test
15,disabled australian I m learn live covid much learn die covid comp
16,aoc picture dining maskless miami beach omicron case soar
17,psa covid vaccine never suppose prevent get covid still get covidthe
18,six shot two bourbon three pfizer one slug doc never bother fish
19,russia million excess death since march high report death
20,odisha postpone reopen primary school std student schoolreopen
21,wa record one new local case vaccinate hotel quarantine security
22,lot people antivax fact hundred thousand wait traditional vaccine like covaxin
23,italians india behind vicious antidiwali firecracker campaign
24,indians understand tradition trust use abstain burst firework diwali reason fume hurt one single covid patient struggle breathe would tradition worth follow
25,life can not understand bar restaurant still open inperson dining school go
26,ms sturgeon discover current lockdown policy be not enjoy public trust confidence might hope
27,wolves manager bruno lage ruben neves future ruben feel second home another thing convi
28,people hospitalize san antonio covid unvaxxe pathetic
29,triple vaccination work really welli do not die get ventilate intensive care unit even get really unwelli h
30,ill always remember bright spot pandemic jimin jin yoongi suga
31,texas attorney general ken paxton announce friday federal judge texas block federal mask vaccine mandate I m
32,doctor inform morrison will not force isolate follow covid contact there s zero risk see public
33,dfe recommend face mask secondary classroom omicron continue surge
34,interessant lireben shapiro eviscerate covid cult authoritarian lockdown nonsense that s
35,you re protest pfizer covid vaccine still pop viagra make pfizer make hypocrite happ
36,break scientific basis isolation periodtaiwan track import omicron day
37,sometimes forget england fair share stupid
38,wow do not see one tweet omicron covid today must go hallelujah hallelujah
39,silamabarasantrs fan meet schedule jan postpone due omicron spreadmaanaadu str
40,russia million excess death since march high report death
41,grammy call ems morning bc covid you all bitch reason spread bad like first couple time
42,six week ago program invite ted cruz senates top insurrectionist spread misinformation election
43,tough covid loss week fully vaccinatedbooste pt age young kid immunosuppressed due
44,finally admit good enough need stop mandate
45,ill tell else joyless watching love one die covid especially government lack gut l
46,every politician force coerce mandate people get vaccine threat job loss
47,among new law voter statewide election regardless whether sign absentee voting receiv
48,happen twice vic happen state testimony extraordinary cruelty andre
49,covid result still pende giveaway follower
50,vote dems tell black hate racist trump push vaccine development tell black they re victim
51,fine covid know whether infect old onesalso fortunately
52,torture people ethiopia africa corona virus destroy thousand hospital university school churchesmosque kill animal amhara afar regionsnomore handsoffethiopia handsoffafrica
53,also percentage people adverse reaction tiny fraction who ve issue stem covid oh even need use word comorbiditie anticovid crowd cling vaccine
54,rage club metaverse nightclub jan covid restriction pcr test host
55,risk child realteen young adult drive record covid case we health official
56,welcome arc definitive edition
57,mumbai report fresh case asymptomatic recovery one death ani
58,vote dems tell black hate racist trump push vaccine development tell black they re victim
59,bad bad enoughthe mental toll see crisis crisis hospital step see maskl
60,silamabarasantrs fan meet schedule jan postpone due omicron spreadmaanaadu str
61,need panic act responsibly kejriwal urge delhi resident medleynew india news health arvindkejriwal delhifightscorona coronavirusupdate coronavirus pandemic vaccination oxygenbed medicaloxygen
62,might can not think three medical doctor would agree lunch ay espec
63,tell exactly vote utterly incompetent snp clown would not last five minute real
64,looks head towards another full lockdown start feb
65,pretty close give one two day
66,almost every single patient I ve take care need admit covid unvaccinatede
67,penn state systematic review long covid half survivor sequelae month exposure mental heal
68,toronto walk close eye gps city homeafter year immigration limb
69,else think manifest omicron exact moment
70,sobering glimpse control mind people walk corridor state
71,optic change covid regulation immediately pull top champion pretty damning
72,mayor naples italy ban firework second consecutive new year cite covid heres go
73,activeduty marine receive least dose reserve havethose fail recognize nati
74,psa covid vaccine never suppose prevent get covid still get covidthe
75,white house lie child hospitalization amid omicron surgethey lie keep worker workthey lie keep child
76,dr malone greatreset they re proud do not hide vision fullon globalist
77,shame concerned movie health movie goer still idiot
78,I m definitely wrong person ask guess omicron wave go last big wave result immunityvaccination end get covid behave like seasonal cold virus
79,omicron rip america especially redpurple state refuse masksvaccineslockdown become
80,travel consult measure place concern condition travel france united
81,happy new year cace family although covid still play unwanted role life enter another year we cace continue keep connect old people community offering range activity service read fb page
82,go stay marjorie webb tring road aylesbury context see
83,reminder pose extra risk dialysis dialysis patient increase risk acquire infection immune system compromise due primary
84,respect pandemic emergency service worker
85,grandma could not come concert covid always ask young sister play fancam kkk yuyu h
86,yes please stop medium induce hysteria
87,stay top late travel update relate entry restriction visit
88,dr robert malone expose government response lawless completely disreg
89,leedsbased red letter want theatre reach wide audience they ve make film
90,new casesbreake department health report additional case sunday january bring total number case philippine
91,covid number high kid vaxxe sure bet they ll catch school parent reluctant vax kid sure mild they ll bring home well good luck thatdanielandrewsmp mandate do not fuck around
92,face mask violation register last day even country witness surge case total infection report last night manama
93,open eight day lockdown hit
94,ok omicron deadly delta great delta begin last year
95,training ground close like five day get back try gaffer try much get fitness back say different playing game ricardo santos tell difficulty covid break
96,guy body image anxiety depression mentalhealth therapy healing wellness mindfulness motivation recovery meditation lifestyle health fitness energy vegan love covid sundaythought sundayvibe sundaymood
97,good thread one first I ve see focus statistical perspective many people could end disab
98,list include nurse school governor serve community
99,game afcb tomorrow
100,lincolnshire mum thanks nhs angel viagra save covid comahttpstcorudhkmzumf
101,secondary school student across cumbria ask wear mask classroom help tackle rise omicron coronavirus
102,newyearsresolution share people covid inquiry finding misconduct public
103,prime minister sheikhhasina direct education ministry continue online learning programme rise infection ensure one infected none remain beyond vaccination coverage add
104,record coronavirus incidence report australia infection illness disease virus pandemic via httpstcocvudsjnkfy
105,pandemic reveal prevail global
106,witness death misery million healthcare system bourgeois order current pandemic we health political choice read dossier base demand healthcare worker union movementshttpstcotutnzcqemy
107,healthy old son advise gp jab one unspeakable ha
108,premier league buckle amid covid surge
109,hospital start increase bed allocation patient preparation possible surge case amid grow concern omicron variant official department health doh
110,idea covid spread do not lockdown mandate contact trace mitigate enough farcical n
111,erlr day post wa grp emergencycasualty walk in wth covid initiate concern case vaxdprior infctncase asymptomatic testing veandcovid case detect stay hospitalization cause hospitalisation
112,justin amidst exponential jump covid case del cm draw parallel betn n april covi
113,maharashtra impose lockdown amid fear omicron heres state health minister
114,government say covid outbreak fine nurse doctor ring alarm bell two
115,qatar global experience everyone explainedqatar doha mentalhealth
116,adult book booster jab help fight new omicron variant please book appointment online call nwwinterready
117,gameday balmoor stadium ko league sell note due covid restriction game sell please travel game ticket thank
118,everyone realize even omicron stay mild probably talk billion case long covid worl
119,glad see mannequin recover covid
120,maidstone see big jump infection week
121,israel weigh whether approve fourth covid vaccine dose scientist warn many shot might actually harm
122,jail prison brace another winter surge staff quit drove system already infamous abuse neglect spiral
123,consider many covid case canada do not think anyone go tour least summer
124,current condition sayre patemp chill point barometer inhgwind mph wnwcorona virus weekly statscase nepa bradfordcounty
125,drive inclusive recovery postcovid asia work industry leader empower community improve access tech
126,life can not understand bar restaurant still open inperson dining school go
127,project amazingi happy participate projectthis projector lot attraction hopefully project well future cryptocurency
128,girl team test positive covid go home early yesterday get to go take damn test surei always mask last week have not break room except check schedule work closely week
129,there s chance get covid you ll suffer long covid may able make stair one go due
130,coronavirus support section provide information advice guidance family autistic child young peopledownload resource coronavirus vaccine mean autistic child young people
131,cdc say okay reopen souplantation california
132,learn live covid another language trick learn live institutional response covid
133,people mockingcriticize effort make high filtration respirator standard care public du
134,hey medium think need understand covid statistics nsw become meaningless ref
135,hell shyster continue get away manipulate covid figuresreinfection count kno
136,wonder escape one event omicronolympic year
137,londoner find there s newyearseve firework show despite tell month ahead medium will not one due covidlondoneye
138,think school should not open end january do not think anything open th
