,full_text
0,guy get mad deny hook beginning pandemic post story child j
1,possibly favourite social medium exchange whole pandemic
2,do not come pandemic anticapitalist pls reflect
3,new secret stockpile million covid test ron desantis do not distribute leave expire floridians ha
4,every single job offer covid leave pay idc
5,massive increase productivity number come next
6,vaccination stop spread omicron prevent hospitalization death particularly eld
7,we drop pcr test alternatenews feedly
8,plan security lapse assassinate ji thanks spg safe conspirator hide behind covid travel schedule
9,britain call military help hospital covid staffing crunch
10,depend bit normal level generally need call someone medical
11,plus ocugen covaxin
12,virtually impossible spread covid outside must huddle group min that s
13,india reach historic milestone administer crore vaccination today pm
14,covid face cover exemption rare
15,congrat complete covid recoverybtsfanart
16,rudy gobert covid math correct mean world shut well receive video dozen
17,yeah let talk right shall head authoritarianism btw vaccine stop transmission keen force people vaccine really support argument mandatory vax eh
18,personnel make available support nhs across londonbwallacemp armed force stepp
19,hey there s shame covid highly contagious virus shame covid tell th
20,perrottet open good thing economy bad thing economy sp
21,instead get real research long covid oor like idk bother remember long covid exist di
22,vaccination stop spread omicron prevent hospitalization death particularly eld
23,pleased report federal judge reject fdas request produce pfizer covid vaccine datum page pe
24,recent study investigate impact individual multimorbidity indirect effect care result important improve healthcare outcome primary care managementthe study access
25,mask social distancing zoom make we safe pandemic measure complicate liv
26,do not know people think student safe education minister get co
27,average age death covid virus extremely high survivability rateherd immunity way stop mean everyone eventually get
28,thirdwave soft lockdown delhi due increase omicron case trader question neta kaidensha
29,possibly favourite social medium exchange whole pandemic
30,member book mon jan please note experience covidrelate staff shortage call make booking please patient respond quickly possible query relate booking please email infobenslowmusicorg thank
31,absolute banger far sick fun covidsuck yep test positive covid second time
32,britain call military help hospital covid staffing crunch unitedkingdom
33,there s evidence wuhan coronavirus vaccine affect reproductive healthme there s evidence
34,got kid absolute embarrassment australia one way end th
35,vs pandemic
36,dangerous people pandemic anything pretend everything fine ignore mass infecti
37,india crore vaccine dose bravepmmodi
38,covid kill youthe vaccine kill youobesity kill youoversimplification foolish
39,marcus rashford use success fight child poverty give every child chance start charity raise
40,icu recordscovid minimizer claim hospitalization decouple omicron case truenew jersey maryl
41,club pospone game due covid signing player newcastle guy idiot
42,happy highlight tough omicron wavethe enthusiasm teenager getting vaccinate nea
43,case help
44,amid omicron scare several state govts either extend announce new propertytax intervention new year help sustain residential sale help realestate sectorhere expert say
45,yes mean let everyone get covid well see still stand end
46,many get sick reminder need bayanihan ekonsulta accessible
47,false logic target blame towards group fellow canadians president call ethic
48,vaccination stop spread omicron prevent hospitalization death particularly eld
49,point number people know covid direct proportion number people do not yet hope everyone ride crazy tidal wave safely
50,govt lead pm jis security net msme pandemicemergency credit line guarantee scheme
51,west virginia request federal permission administer fourth vaccine dose fall right
52,overwhelm omicron surge us hospital delay surgery news
53,exactly activism push country invest aids research develop treatment bring price arvs take community bring we hope endingaid community front people centre
54,new mustreadpeople would ve fine get sick eventually people would h
55,cdc wash groceriescdc cough someones mouth boss say okay
56,good see pm have not lose sense humour doctor nurse work double shift business lie staff
57,mean hospital already accommodate unvaccinated be not enough erin cdnpoli
58,likely see chaos western government lose control people covid next weeksif
59,lot important datum report publish base clinical audit hospital admission record
60,obviously never happen accord youhttpstcouhtdfksgoo
61,request govt take exam online case corona increase day day ofline exam conduct
62,strange see journos surprise country go economic meltdown due uncontrolled covid spread
63,whatever happen unfold completely novak djokovic fault get vaccine fir
64,valimai postpone amidst rise covid case ajithkumar boneykapoor hvinoth
65,thank bobby feel like bad cold moment hopefully stay way cos I m triple jab eddie negative moment he s get shopping bit think I d get eventually least seem mild omicron one xx
66,pre covid vs bv
67,break biden white house usps finalize plan ship million coronavirus test kit house
68,uber eat announce end activity brazil march announcement come day enacte
69,thailand indefinitely suspend quarantinefree visa program vaccinate visitor orders ban sale alcohol
70,reminder promise plan b would go soon know omicron less dangerous deltayet be not hear muc
71,bbc spin nhscrisisblame pandemic waiting list ignore decade defunde bed cut amp staff vac
72,vaccination stop spread omicron prevent hospitalization death particularly eld
73,hand
74,aussie government know do not vaccine issue visa issue wait till he s australia revoke publicity stunt
75,vaccination stop spread omicron prevent hospitalization death particularly eld
76,new year fresh start travel greenland omicronvarient omicronvirus omicronvariant
77,three australia open player allow entry vaccine exemption novak djokovic independent
78,infection surge due omicron variant physician urge people ditch cloth face mask instead r
79,criminal
80,scumrat stop stop
81,many get sick reminder need bayanihan ekonsulta accessible
82,notice go tonight vicgovt say covid test take dec long suitable result pr
83,iwk top doctor say risk kid less concern flu
84,know guy get vax died never mind covid
85,hospital covid ward unit covid positive pregnant postnatal lady scary staff adequately correct ppe
86,bit that s never discuss even omicron low intrinsic severity delta likely
87,reminder threevaccine regimen highly protective hospitalization whereas high quality mask
88,good study show eclgs save lakh msme amp crore job pandemic continue
89,neurological problem establish element large syndrome know long covid include least symptom
90,vs pandemic
91,nutritional guideline covid put together basic nutritional guideline need know
92,moderate covid symptom city goverment manila hand molnupiravir anti covid viral capsule anyone
93,people claim vaccine kill young people drove compute excess mortality france people
94,biden finally enough defeatedformerpresident gopcoupattempt covid
95,congratulation india crore vaccine dose administeredbravepmmodi bravepmmodi
96,get booster today thread er doctor nyc make happy
97,endeth todays lesson regard pandemic
98,insurance company report increase premature noncovid death insurance exec rate extraordinarily high deat
99,good study show eclgs save lakh msme amp crore job pandemic continue
100,request h east ward look crowd evening market shastri nagar road behind kalina church santacruz east mumbai corona happen crowded place place watch
101,late surge take toll hospital school business meanwhile guidance around infection
102,wonderful vaccinehttpstcocmeginrwvi
103,rapid communicationvaccine effectiveness severe acute respiratory infection sari hospitalisation estimate realworld surveillance data october covidvaccine vaccineeffectivenesspucciami
104,pandemic use pretext fasttrack imposition biometric digital ids western government
105,kerala report new case death amp recovery today active case death tally
106,second year row spend christmas new year period isolate family friend much previous two year lockdown victoria nswaustralia
107,nfl list atampt stadium possible replacement venue super bowl lvi amid
108,year ago human civilization face pandemic plague kill somewhere million million peoplebut secondary disaster also massive death toll modern society would well take heed
109,situation lincolnshire care home difficult ever staff work manage spread omicron variant
110,clinical trial herd immunity long covid glossary break new buzz word patient know
111,do not come pandemic anticapitalist pls reflect
112,year ago team scramble move core business function cloud find cloudmigration still beneficial organization wake covid
113,invest ghg today per share stock price rebound back prepandemic price investment would worth that s growth profit see ctlt frch neu myov cal
114,one reason covid test kit can not find biden falsely promise make available early
115,update indiacentre revise guideline international arrivalsall traveller undergo home qu
116,daily novel coronavirus case confirm japan exceed friday first time since sept last
117,hamilton liberal mp filomena tassi reveal test positive hamont ancaster
118,surpass disruption bring pandemic continue lead time change microsoft cloud manufacturing explore innovation enable stack high value manufacture scenario
119,surpass disruption bring pandemic continue lead time change microsoft cloud manufacturing explore innovation enable stack high value manufacture scenario
120,surpass disruption bring pandemic continue lead time change microsoft cloud manufacturing explore innovation enable stack high value manufacture scenario
121,annual career institute january empower veteran career mental health counseling midst covidthis virtual event bring together professional graduate student around state
122,let keep fight go let montevistamedical health healthcare vaccination getvaccienate getvaxe healthylive healthylifestyle doctor doctorsoffice familydoctor familyhealthcare medicalpractice
123,vaccination good way protect know risk pregnancy woman baby include admission woman intensive care premature birth baby rcog
124,need large vaccination booth staff visitor business custom cut frame print offering mount clamp stand protective screen testing display safety backtowork
125,update young people age eligible pfizer booster additionally immunocompromised child age eligible receive additional primary dose vaccinefind vaccine site near
126,new year new plan buildforwardbetter towards globalgoalsa begin onlytogether overcome challenge like climate change rise inequality moreexplore key moment watch year ahead
127,test difficult get suppose know covid go emergency room question well put windsor native epidemiolist dr fahad razak
128,surpass disruption bring pandemic continue lead time change microsoft cloud manufacturing explore innovation enable stack high value manufacture scenario
129,sofia andres remind public wear mask drink vitamin recover
130,surpass disruption bring pandemic continue lead time change microsoft cloud manufacturing explore innovation enable stack high value manufacture scenario
131,americans frustrate amp disapprove handle pandemic amp economy uspresidentbiden record high disapprov
