,full_text
0,french pres macron million fellow unvaccinated citizen noncitizen canadian pm trudeau unvaxxe
1,mint part rage club nightlife scene metaverse open soon
2,ty covid
3,nate silver say school temporarily close rage pandemic bad perhaps bad invasion iraq
4,teacher sick covid isolate provide online tuition they re sick period
5,there s lot heighten anxiety covid number climb supply shortage kick inremember go walk
6,classaction lawsuit bring staten island real estate broker file wednesday challenge new york citys sweeping
7,delhi hc dismiss petition immediately postpone conduct civilservice main examination schedule
8,think good food past xmas lunch caz taste bud go due covid like teja
9,cdc say go ass pussy fine one
10,maskless private jet party slap face justin agreedbut maskless cocktail party
11,morrisons watchcovid test near people force urinate defecate outside due long linesauspo
12,rafael nadal full answer novak djokovic situation nadal clearly think djokovic create hi
13,be not gov assure we ut would not lastwell areamp people uk long covid year via
14,thing reusable facemask would possible someone manufacture
15,hear right sky news people england think covid
16,chicago mayor lori lightfoot claim school actually safe place student right
17,real let collectively fight good way stay vaccinate stay
18,notice husbandstreat wife love againhotel restaurant close anytime notice ladiestreat husband love againthe maid stop come work anytime omicron
19,channi say didt receive pm get touch covid infect skip election rally
20,drama diversion topic like china bullibai app fail economy raise price increas
21,variant body
22,nothing delhi hospital bed ask prashant bhushan allow case umar lie relief camp violence promote majoritarianism ford moneyi write
23,mais toza na covid tss
24,teambuilder germany use sheep goat form shape vaccine syringe monday food
25,first lockdown spend morning day convince twinge sore throat accept imagination much well come lockdown usually get something like race heart nausea real fun luckily be not covid symptom
26,canada approve covaxin one group people traveler logically people safe enter country good canadian citizen know nothing make sense since pandemic health money
27,dear covid vaccine design prevent infection design prevent severe illnessdeath
28,late american medical association nations large association physician criticize cdcs new quarantine
29,covid confirm messi goat allow play
30,we handle covidtsu
31,think family week nhi hoga bcoz covid n also live indiatejran
32,personally know someone covid right
33,rule rulestennis star novak djokovic face deportation australia visa cancel fail
34,I ve never covid cuz main character look like
35,pfizer announce today expect pandemic last submit pandemic right nowre
36,covid case triple two week axiosthe number new covid case triple past two week shatter record add coronavirus
37,covid shit overcovid shit
38,covid get strain weed point
39,like cnn admit cloth mask stop covid turn
40,people minimise covid tell we let rip lockdown do not work need lea
41,morningjoe paulgosar fox news maga omicron red wildfire spread rondesantis marcorubio kevinmccarthy violation amendment go wash handskristinoem capitolriot lindseygraham madisoncawthorn mobrooks florida covid unvaccinated purge tedcruz cnn
42,never pandemicjust
43,expect sort pro would party know could get covid
44,arre bhai noida medium fail establish lie time people time livelihood amp
45,baby year old hospitalize ontario right heart weep tuck
46,nbc news we exceed million covid case since start pandemicone million new case
47,counting day
48,pt go jail james comey obstructiontrump go jail sexual assaultrape alle
49,late steam boiler thermic fluid heater cogeneration system boiler auxiliary equipment omicron aryankhan
50,interesting thread omicon scariant fraudulent p c r test might explain away five gee might actually culprit sickness
51,india record first death link omicron variant
52,dey can not get wc due corona scare dey r extend due dat new show time slowly dey evict wc bichukle n rakhi be not calld
53,whoopi goldberg stun test positive covid I ve do everything suppose
54,child do not like remote learning that s give every one coronavirus love
55,plant become b e n since start pandemicsong obsession
56,payment access isolate covid
57,please stop misinformation fine hybrid virus combination influenza
58,system break already catch covid natural immunity effective th
59,new ad campaign help prevent death hospitalization
60,month labour supporter castigate boriss omicron management they re suddenly say
61,good morning youive dayim fly highbecause get double doseof moderna vaccineand finally get shingrix vaccinewhat load mindhappydaywaytooearly
62,feel sort symptom isolate immediately willfully ignorant symptom middle
63,hello unroll psa be not cold be not respiratory virus
64,listen freeland talk lockdown support business magical endless supply money comi
65,roger federer may yes vaccinate get pfizer vaccine do mostly other do not
66,uk hospital doctor per people low europe also bed per peop
67,sound like class action lawsuita vaccinate contracting spread covid
68,child hospitalization england last hour bad figure begin
69,let real do not want another lockdown matter many ppl sick die saw happen
70,see block carry do not like something say drive mental I ve keep daughter today one brother long covid amp do not want getting covid amp poss end like he s get inhaler constant pain
71,effectiveness available vaccine child adolescent include variant concern read
72,pierreemerick aubameyang test positive covid upon upon arrival cameroon see
73,thread meal service covid patient amplify
74,munawar faruquis show hyderabad cancel restriction cite bjp leader warn widespread protest
75,new covid case
76,male personal trainer like bo male bestie pandemic tell
77,omicron induce sense deja vu close year look back key way understanding move forward
78,please postpone kvpy exam covid case rise yet vaccinate kvpy golden opportunity admission iisc do not want miss opportunityalso olympiad postpone kvpyiiscbangalore postponekvpykvpypostpone
79,lol covid pass ho kya
80,white house double order new covid pill fight omicro
81,warn food shortagesguess stupid conspir acy theor ist though hey
82,stillbirth covid placentitis
83,man act die st vincents hospital receive two dose vaccine kn
84,lets see omicron cold pandemic almost fair comparison bad thing
85,absolutely terrifying
86,safe vaccinate mistakenly treat safe without p
87,covid negative result
88,original pfizer study see divergence graph bw vaccine control day b
89,pre pandemic issue hit home pandemic blame lot thing emergency care system uk w
90,day turkey report high number daily coronavirus case health minister fahrettin koca announce quarantine period positive case reduce day day
91,wisconsin council church recommend member church return virtual service amid spread omicron variant
92,protect simply boost immune system go beyond combat virus bacteria protect love one well read full blog dashlabsai labautomationhealthcareinnovation pcrtest
93,prediction school try get shut freeze window wide open child strugglin
94,vax do not stop covid
95,plenty site get
96,testing location winstonsalem open mondayfriday appointment make appointment online instead go emergency
97,omicron surge lead high demand
98,study immune system response omicron variant reportedly show individual cell often find recover virus receive vaccine carry protection new variant
99,seem do not use fund upgrade ventilation school direct covid fund sport
100,fda say need year release pfizer vaccine datum public
101,hindustan times india covid case massive infection surge hourshttpstconyvvzx
102,government set control room keep close watch function supply chain part effort handhold business amid rise case coronavirus infection
103,travel leisure share surge belief omicron turmoil waningrecord infection across westinvestor focus lo
104,mange pas de viandes ne pollue pas eteint ta vie social covid great reset
105,qantas pilot make mistake return long break cause pandemic australian memo
106,perfect storm finally arrive truly alarm old disabled people family pay huge price pay total policy failure
107,amid rise case haryana authority order closure cinema hall multiplex sport complex six district till january
108,year grammy award ceremony honor top performance music postpone indefinitely rapid spr
109,pandemic pandemic card need get medical test australia medicare card
110,new vaccine develop researcher texas childrens hospital amp baylor offer patentfree
111,luxury product exceptionally well china amid pandemic say logistic firm
112,newswatch digest thursday january
113,patient number treble since christmas day
114,I m tea chocolate rn tell okay bc covid rlly take excuse get run bahaha
115,unvaccinated couple marry year die covid hospital two day apart
116,state government announce defer vibrant gujarat global summit ahmedabad municipal corporation announce
117,yesthere several common winter weed like henbit thistle chickweed allow run wild stifle grass create problem next spring do not skip preemergent see outbreak call we apply postemergent herbicide
