,created_at,full_text,sentiment_score
0,2021-01-08 18:59:54+00:00,"Everyone reacts differently to stressful situations like #COVID19. You may feel anxiousness, anger, sadness, or overwhelmed. If you or a loved one is feeling overwhelmed, get support 24/7 by calling or texting 1-800-985-5990. Learn more:","{'neg': 0.238, 'neu': 0.501, 'pos': 0.261, 'compound': -0.2263}"
1,2021-01-08 18:59:54+00:00,"RT This week, the Alliance has attended meetings with several government contacts to press for further guidance &amp; information...","{'neg': 0.0, 'neu': 1.0, 'pos': 0.0, 'compound': 0.0}"
2,2021-01-08 18:59:54+00:00,"The failure to enforce mandatory quarantine on arrivals into this country is the biggest failure of the government's Covid-19 ""strategy""","{'neg': 0.265, 'neu': 0.683, 'pos': 0.052, 'compound': -0.743}"
3,2021-01-08 18:59:55+00:00,"RT Lockdown might struggle to contain Covid, esp in regions where new variant is higher. Schools are fuller than before, nurse...","{'neg': 0.103, 'neu': 0.897, 'pos': 0.0, 'compound': -0.3182}"
4,2021-01-08 18:59:55+00:00,"RT As we work to contain the pandemic and open our economy responsibly, we must also build back better to lift up all Americ...","{'neg': 0.0, 'neu': 0.888, 'pos': 0.112, 'compound': 0.4404}"
5,2021-01-08 18:59:55+00:00,"Pro tip: if a library closes for just a day and then reopens the next with no explanation, it's deep cleaning for COVID exposure. And yes, they expect us back to work the next day","{'neg': 0.058, 'neu': 0.871, 'pos': 0.071, 'compound': 0.128}"
6,2021-01-08 18:59:55+00:00,"#Newham collaboration avoids delays to Covid-19 testing
https://t.co/i7Y9l3QnJg","{'neg': 0.195, 'neu': 0.805, 'pos': 0.0, 'compound': -0.1779}"
7,2021-01-08 18:59:55+00:00,"Close the schools, that will help, since kids aparently transmit covid! ","{'neg': 0.0, 'neu': 0.77, 'pos': 0.23, 'compound': 0.4574}"
8,2021-01-08 18:59:55+00:00,"RT remember this: 

Top Trump health appointee Michael Caputo warns of armed insurrection after election","{'neg': 0.085, 'neu': 0.793, 'pos': 0.122, 'compound': 0.1531}"
9,2021-01-08 18:59:55+00:00,SAVE A LIFE in 90 England Journal of Medicine study concluded: vulnerable covid19 patients receiving convalescent plasma in the first three days of symptoms experienced nearly a 50% reduction  of risk for developing severe disease.,"{'neg': 0.159, 'neu': 0.746, 'pos': 0.095, 'compound': -0.1697}"
10,2021-01-08 18:59:55+00:00,UPDATE: I do not have COVID and I do not have strep!,"{'neg': 0.0, 'neu': 1.0, 'pos': 0.0, 'compound': 0.0}"
11,2021-01-08 18:59:55+00:00,"RT I'm fucking furious at this 

Refused to wear a mask, showed nothing but contempt for the rules and amazingly* finds himself...","{'neg': 0.151, 'neu': 0.698, 'pos': 0.151, 'compound': 0.2527}"
12,2021-01-08 18:59:55+00:00,"RT 1,325 more deaths. In a single day. The highest daily total since the pandemic began. 1,325 mothers, fathers, grandparents &amp;...","{'neg': 0.0, 'neu': 1.0, 'pos': 0.0, 'compound': 0.0}"
13,2021-01-08 18:59:55+00:00,"RT FREE #COVID19 Respiratory Therapy Update Session 

Saturday 9th January 09:00 - 16:30

For Newly Qualified Physios/ Students...","{'neg': 0.0, 'neu': 0.808, 'pos': 0.192, 'compound': 0.6166}"
14,2021-01-08 18:59:55+00:00,"RT The first review for Dr. Towers is ""Incredible Doctor. She enlightened our family on t...","{'neg': 0.0, 'neu': 0.812, 'pos': 0.188, 'compound': 0.5367}"
15,2021-01-08 18:59:55+00:00,No shirt swapping. Lol. Perhaps just ban any player flouting the lockdown rules for 12 months with no pay. And stop them gobbing all over the pitch.,"{'neg': 0.235, 'neu': 0.645, 'pos': 0.12, 'compound': -0.5999}"
16,2021-01-08 18:59:55+00:00,"Maintain the appropriate safeguards. 

Also, there was a tremendous financial investment mare by the US and other gov'ts which made the whole process possible.

Tens of thousands of people were in the covid19 vaccine trials, many more than trials of earlier vaccines./2","{'neg': 0.0, 'neu': 0.945, 'pos': 0.055, 'compound': 0.34}"
17,2021-01-08 18:59:55+00:00,"RT Devastating news. Another 1162 deaths from Covid.

The unimaginable - and, at least in part, unnecessary - suffering beh...","{'neg': 0.291, 'neu': 0.709, 'pos': 0.0, 'compound': -0.8126}"
18,2021-01-08 18:59:55+00:00,RT I'm quoted in this piece for on links between the now-ritualized pro-Trump protests at statehouses around...,"{'neg': 0.106, 'neu': 0.894, 'pos': 0.0, 'compound': -0.2263}"
19,2021-01-08 18:59:55+00:00,RT Thankyou for showing so powerfully what the impact has been of Covid-19 so far,"{'neg': 0.0, 'neu': 1.0, 'pos': 0.0, 'compound': 0.0}"
20,2021-01-08 18:59:55+00:00,"RT Joe Manchin is worth an estimated $7 million. At least 70% of WV households would qualify for $2,000 checks. 40% of West...","{'neg': 0.0, 'neu': 0.921, 'pos': 0.079, 'compound': 0.2263}"
21,2021-01-08 18:59:55+00:00,"Twitter removes Iran supreme leader's 'misleading' tweet on US COVID-19 vaccines, in line with new policy -","{'neg': 0.127, 'neu': 0.704, 'pos': 0.169, 'compound': 0.2263}"
22,2021-01-08 18:59:55+00:00,"RT Coronavirus: 9,535 daily cases, 318 hospitalizations reported in Ohio","{'neg': 0.0, 'neu': 1.0, 'pos': 0.0, 'compound': 0.0}"
23,2021-01-08 18:59:55+00:00,Show the exact stats of those who got COVID who ended up in hospital who smoked and those who didn't. I call bullshit! ,"{'neg': 0.0, 'neu': 0.867, 'pos': 0.133, 'compound': 0.521}"
24,2021-01-08 18:59:55+00:00,So you would rather get Corona Virus?,"{'neg': 0.0, 'neu': 1.0, 'pos': 0.0, 'compound': 0.0}"
25,2021-01-08 18:59:55+00:00,They're hungry we in the middle of a pandemic. Cheza chini.,"{'neg': 0.0, 'neu': 1.0, 'pos': 0.0, 'compound': 0.0}"
26,2021-01-08 18:59:55+00:00,"We were all shocked to hear that the government has decided to close the Shuls, and Botei Medrashim, due to the COVID19 pandemic.","{'neg': 0.095, 'neu': 0.905, 'pos': 0.0, 'compound': -0.3182}"
27,2021-01-08 18:59:55+00:00,"RT A Forest Gate church is helping those experiencing mental illness to stay connected from home.

@emmanuelfgate's Stepp...","{'neg': 0.129, 'neu': 0.766, 'pos': 0.105, 'compound': -0.128}"
28,2021-01-08 18:59:56+00:00,"Fraudsters are cold calling and sending fake texts, posing as the NHS claiming your eligibility to receive a COVID vaccine. 

The vaccine is free and the NHS will never ask for any bank details to confirm your identity. If you receive a similar message please delete it. #TakeFive","{'neg': 0.116, 'neu': 0.784, 'pos': 0.1, 'compound': -0.2263}"
29,2021-01-08 18:59:56+00:00,RT One of the biggest inequalities in this pandemic is who gets to work from home.,"{'neg': 0.0, 'neu': 1.0, 'pos': 0.0, 'compound': 0.0}"
30,2021-01-08 18:59:56+00:00,RT STIIIZY Moreno Valley - We're fully stocked and ready!!! Opening at 9am tomorrow... Don't miss out on huge grand opening deals...,"{'neg': 0.0, 'neu': 0.634, 'pos': 0.366, 'compound': 0.855}"
31,2021-01-08 18:59:56+00:00,Moderna CEO says company's COVID-19 vaccine may last years,"{'neg': 0.0, 'neu': 1.0, 'pos': 0.0, 'compound': 0.0}"
32,2021-01-08 18:59:56+00:00,"RT Everyone must have a home in this crisis.

This inhumane approach will cost lives.
https://t.co/uM82Pg4ifG","{'neg': 0.245, 'neu': 0.755, 'pos': 0.0, 'compound': -0.7073}"
33,2021-01-08 18:59:56+00:00,"RT Often in the news we use terminology with technical/specific meanings but which sounds conversational (many may say ""surel...","{'neg': 0.0, 'neu': 1.0, 'pos': 0.0, 'compound': 0.0}"
34,2021-01-08 18:59:56+00:00,RT What would it take to get a law passed regarding Covid like we have for HIV? People should be criminally...,"{'neg': 0.0, 'neu': 0.889, 'pos': 0.111, 'compound': 0.3612}"
35,2021-01-08 18:59:56+00:00,"RT I don't know about you guys, but I'm still scared of Covid ","{'neg': 0.243, 'neu': 0.757, 'pos': 0.0, 'compound': -0.5927}"
36,2021-01-08 18:59:56+00:00,"The time to remove him with impeachment was last year during impeachment.

The time to remove him with the 25th Amendment was when, on live television, he looked at medical experts &amp; suggested ""injections of disinfectant"" for treatment during a pandemic.

His removal is overdue.","{'neg': 0.0, 'neu': 1.0, 'pos': 0.0, 'compound': 0.0}"
37,2021-01-08 18:59:56+00:00,"RT #BREAKING: U.S. loses 140,000 jobs in December, 9.8 million jobs that were lost in March &amp; April have not returned.

A...","{'neg': 0.187, 'neu': 0.813, 'pos': 0.0, 'compound': -0.5574}"
38,2021-01-08 18:59:56+00:00,RT Ontario finance minister took holiday trip outside Canada as health officials urge people to stay home,"{'neg': 0.0, 'neu': 0.856, 'pos': 0.144, 'compound': 0.4019}"
39,2021-01-08 18:59:56+00:00,"RT ""I try to work out if one of my patients isn't answering my questions because she is delirious, because she doesn't speak...","{'neg': 0.0, 'neu': 1.0, 'pos': 0.0, 'compound': 0.0}"
40,2021-01-08 18:59:56+00:00,RT Please watch Planet Lockdown film by Catherine Austin Fits... this video covers the entire Covid scam. #plandemic,"{'neg': 0.168, 'neu': 0.727, 'pos': 0.105, 'compound': -0.34}"
41,2021-01-08 18:59:56+00:00,"RT Just as the morning dew falls from the heavens to refresh the earth , so too each token of grace from God's throne to...","{'neg': 0.0, 'neu': 0.807, 'pos': 0.193, 'compound': 0.6705}"
42,2021-01-08 18:59:56+00:00,"RT This lockdown, government must remember emergency measures are not solutions. What happens after ""everyone in""? After eviction...","{'neg': 0.322, 'neu': 0.678, 'pos': 0.0, 'compound': -0.7284}"
43,2021-01-08 18:59:56+00:00,"RT Helpful post. 

Covid safety for staff and customers - Priority actions to take!
What businesses need to do to protect staff...","{'neg': 0.0, 'neu': 0.691, 'pos': 0.309, 'compound': 0.8172}"
44,2021-01-08 18:59:56+00:00,Wathoni remains the most stylish BBN 2020 lockdown female housemate....,"{'neg': 0.0, 'neu': 1.0, 'pos': 0.0, 'compound': 0.0}"
45,2021-01-08 18:59:56+00:00,"RT Oops, another &gt; 9/11 worth of deaths yesterday -- or as we call it in the Trump era, ""Thursday."" ","{'neg': 0.0, 'neu': 0.909, 'pos': 0.091, 'compound': 0.2263}"
46,2021-01-08 18:59:56+00:00,"RT 50k for covid test and they don't even give you refreshments, let's be serious pls","{'neg': 0.078, 'neu': 0.843, 'pos': 0.078, 'compound': 0.0}"
47,2021-01-08 18:59:57+00:00,"First responders, teachers still waiting for #COVID19 vaccination plans | CBC News","{'neg': 0.0, 'neu': 1.0, 'pos': 0.0, 'compound': 0.0}"
48,2021-01-08 18:59:57+00:00,What's your favourite lockdown takeaway? Asking as I'm still waiting for my Nandos. Wish delivered to me  #Wagamama,"{'neg': 0.0, 'neu': 0.863, 'pos': 0.137, 'compound': 0.4019}"
49,2021-01-08 18:59:57+00:00,RT It would be nice for Canadians to remember that every province is going to go through phases of this pandemic at slight...,"{'neg': 0.0, 'neu': 0.887, 'pos': 0.113, 'compound': 0.4215}"
50,2021-01-08 18:59:57+00:00,"RT Just a reminder, as provinces run low on vaccines, PM put murderers ahead of grannie in the nursing home ag...","{'neg': 0.252, 'neu': 0.748, 'pos': 0.0, 'compound': -0.7506}"
51,2021-01-08 18:59:57+00:00,"RT LONG THREAD: Digging into UK Covid numbers &amp; what they mean &amp; what's in store... 

TLDR: everything is bad and getting wors...","{'neg': 0.137, 'neu': 0.863, 'pos': 0.0, 'compound': -0.5423}"
52,2021-01-08 18:59:57+00:00,"RT Threads for week ending Jan. 9:

#covid19Canada #COVID19Ontario #covid19qc #COVID19toronto #covid19ottawa #COVID19 htt...","{'neg': 0.0, 'neu': 1.0, 'pos': 0.0, 'compound': 0.0}"
53,2021-01-08 18:59:57+00:00,Very proud boyf!,"{'neg': 0.0, 'neu': 0.352, 'pos': 0.648, 'compound': 0.5697}"
54,2021-01-08 18:59:57+00:00,RT Please retweet for the attention of any teachers you may know. Government may have put a wall but were just walking around it...,"{'neg': 0.0, 'neu': 0.933, 'pos': 0.067, 'compound': 0.1655}"
55,2021-01-08 18:59:57+00:00,"They must a solution to production issues or we'll find ourselves in bad trouble.

https://t.co/oYPP9nNMKh","{'neg': 0.302, 'neu': 0.585, 'pos': 0.112, 'compound': -0.5994}"
56,2021-01-08 18:59:57+00:00,Ok... Ok... We need policy ideas... How about a Covid carnival to celebrate the NHS?,"{'neg': 0.0, 'neu': 0.791, 'pos': 0.209, 'compound': 0.5719}"
57,2021-01-08 18:59:57+00:00,RT Warning: a person claiming to be working for the NhS gave a 92 year old a fake covid19 vaccination at her home and charg...,"{'neg': 0.193, 'neu': 0.807, 'pos': 0.0, 'compound': -0.6705}"
58,2021-01-08 18:59:57+00:00,"Every vaccine in the past for the diseases were/are nothing but the virus itself, not any medicine. The idea is to create immunity against the corresponding virus.
Then why the globalists show too much build-up for covid vaccine research ?","{'neg': 0.0, 'neu': 0.936, 'pos': 0.064, 'compound': 0.3919}"
59,2021-01-08 18:59:57+00:00,Almost 12k dead from covid in 3 days.. y'all still talking bout a failed coup when we a failed state,"{'neg': 0.385, 'neu': 0.615, 'pos': 0.0, 'compound': -0.8915}"
60,2021-01-08 18:59:57+00:00,"So you're saying everyone over 82 deserves to die because they are above the life expectancy age? I think it's fair to say 99.9% of those died from covid, many people would have many more years left if it wasn't for selfish people like yourself who think like this. Thanks.","{'neg': 0.118, 'neu': 0.675, 'pos': 0.208, 'compound': 0.576}"
61,2021-01-08 18:59:57+00:00,"RT Seen my neighbour this morning out walking his dog as normal. 

Was telling me he tested positive on Tuesday for Covid...","{'neg': 0.0, 'neu': 0.854, 'pos': 0.146, 'compound': 0.5574}"
62,2021-01-08 18:59:57+00:00,"RT Joe Manchin is worth an estimated $7 million. At least 70% of WV households would qualify for $2,000 checks. 40% of West...","{'neg': 0.0, 'neu': 0.921, 'pos': 0.079, 'compound': 0.2263}"
63,2021-01-08 18:59:57+00:00,"RT In the last year, the US has endured an impeachment, a pandemic, widespread recession, a flood of state sponsored violence fue...","{'neg': 0.257, 'neu': 0.743, 'pos': 0.0, 'compound': -0.7845}"
64,2021-01-08 18:59:57+00:00,Yes Yes  yes  booya booya booya and yes  that's because they were part of the swamp,"{'neg': 0.0, 'neu': 0.526, 'pos': 0.474, 'compound': 0.8689}"
65,2021-01-08 18:59:57+00:00,RT Lockdown 3.0 outfit ,"{'neg': 0.0, 'neu': 1.0, 'pos': 0.0, 'compound': 0.0}"
66,2021-01-08 18:59:57+00:00,RT Why is she letting this man lay on top of her baby like that ,"{'neg': 0.0, 'neu': 0.751, 'pos': 0.249, 'compound': 0.5106}"
67,2021-01-08 18:59:57+00:00,'We work hard for a living' fuck off creepy  two of them walking towards the boy to intimidate him. Bully victims man,"{'neg': 0.418, 'neu': 0.582, 'pos': 0.0, 'compound': -0.8807}"
68,2021-01-08 18:59:57+00:00,RT Why is he roaming around when UK is in Tier 4 lockdown - what urgent business did he have ?Healthcare workers like so many darl...,"{'neg': 0.0, 'neu': 0.848, 'pos': 0.152, 'compound': 0.5106}"
69,2021-01-08 18:59:58+00:00,"RT Seen my neighbour this morning out walking his dog as normal. 

Was telling me he tested positive on Tuesday for Covid...","{'neg': 0.0, 'neu': 0.854, 'pos': 0.146, 'compound': 0.5574}"
70,2021-01-08 18:59:58+00:00,'Senate Being Locked Down': Inside a Harrowing Day at the Capitol,"{'neg': 0.0, 'neu': 1.0, 'pos': 0.0, 'compound': 0.0}"
71,2021-01-08 18:59:58+00:00,"#AdulterousWomen 
#SelfishWomen 
#ShameOnU 
#SelfishMother 

World is watching, how women &amp; u r trying to criminalise women and making is legal for them.
@PMOIndia","{'neg': 0.0, 'neu': 0.936, 'pos': 0.064, 'compound': 0.128}"
72,2021-01-08 18:59:58+00:00,"Another one of my colleagues tested positive for covid today.
Anyone who thinks our job isn't putting us in harms way, is a fool.
We do our job to protect one of countries most important infrastructures and keep things moving.
Now my colleagues and friends are getting sick","{'neg': 0.152, 'neu': 0.664, 'pos': 0.184, 'compound': 0.2484}"
73,2021-01-08 18:59:58+00:00,Who is guiding Boebert right now?  Her tweets are not helping her current situation because of her past snarky tweets.  Somebody reach out to her advisors.  Another bad look.,"{'neg': 0.166, 'neu': 0.8, 'pos': 0.034, 'compound': -0.6472}"
74,2021-01-08 18:59:58+00:00,"Johnson's COVID 'press conferences' have degenerated into Tory propaganda &amp; LIES. The pseudo-competitive attitude is embarrassing &amp; childish. No-one believes Johnson's ""British is best"" rhetoric - it's all lies. Why does the media waste everyone's time by giving him a microphone?","{'neg': 0.287, 'neu': 0.594, 'pos': 0.119, 'compound': -0.8091}"
75,2021-01-08 18:59:58+00:00,"RT Did you really think all the measures has put in place in the past year to flatten the curve, including vacc...","{'neg': 0.0, 'neu': 1.0, 'pos': 0.0, 'compound': 0.0}"
76,2021-01-08 18:59:58+00:00,"RT Joe Manchin is worth an estimated $7 million. At least 70% of WV households would qualify for $2,000 checks. 40% of West...","{'neg': 0.0, 'neu': 0.921, 'pos': 0.079, 'compound': 0.2263}"
77,2021-01-08 18:59:58+00:00,London declares emergency over 'out of control' coronavirus,"{'neg': 0.271, 'neu': 0.729, 'pos': 0.0, 'compound': -0.3818}"
78,2021-01-08 18:59:58+00:00,Am I only catching on? Boris does the stay home protect the nhs but in NI it's stay home protect the health service......am I missing something?,"{'neg': 0.089, 'neu': 0.733, 'pos': 0.177, 'compound': 0.4137}"
79,2021-01-08 18:59:58+00:00,"RT Lockdown III begins, however our sporting challenges returns!!!","{'neg': 0.0, 'neu': 0.786, 'pos': 0.214, 'compound': 0.2905}"
80,2021-01-08 18:59:58+00:00,RT Just a reminder that before Trump's COVID diagnosis- Melania was on tape swearing and complaining about Christmas and the...,"{'neg': 0.174, 'neu': 0.826, 'pos': 0.0, 'compound': -0.4215}"
81,2021-01-08 18:59:58+00:00,"The 11-week-old son of Jessie Cave (Lavender Brown in 'Harry Potter') tests positive for COVID-19.
The third son of the actress, Abraham, was born prematurely and has now had to return to the hospital after testing positive for coronavirus.","{'neg': 0.0, 'neu': 0.837, 'pos': 0.163, 'compound': 0.802}"
82,2021-01-08 18:59:58+00:00,"RT Welcome to Turku, hometown of Paavo Nurmi 
Turku has been included in a list compiled by The New York Times of cities...","{'neg': 0.0, 'neu': 0.88, 'pos': 0.12, 'compound': 0.4588}"
83,2021-01-08 18:59:58+00:00,Her inlaws died from covid over the holidays :(,"{'neg': 0.43, 'neu': 0.397, 'pos': 0.172, 'compound': -0.5994}"
84,2021-01-08 18:59:58+00:00,"Let me get this right...in this pandemic,you want to fill the united states with countless millions of undocumented south americans?","{'neg': 0.0, 'neu': 0.814, 'pos': 0.186, 'compound': 0.4767}"
85,2021-01-08 18:59:58+00:00,RT Absolutely no scientific evidence to support curfews. None. This is tyranny: violation of our basic constitutional freedoms....,"{'neg': 0.231, 'neu': 0.569, 'pos': 0.199, 'compound': -0.2006}"
86,2021-01-08 18:59:58+00:00,"RT Trump's ""legacy"" is dismal! 

* one term
* impeached
* lost popular vote twice
* 350,000...","{'neg': 0.282, 'neu': 0.598, 'pos': 0.12, 'compound': -0.5848}"
87,2021-01-08 18:59:58+00:00,"RT Our world-renowned creative sector needs more support to get through the pandemic.

A Government-backed insurance scheme...","{'neg': 0.0, 'neu': 0.718, 'pos': 0.282, 'compound': 0.7089}"
88,2021-01-08 18:59:58+00:00,"RT I didn't realize that Make America Great Again meant returning to the social unrest of 1968, the economic...","{'neg': 0.0, 'neu': 0.814, 'pos': 0.186, 'compound': 0.6249}"
89,2021-01-08 18:59:58+00:00,"#Mizzou's Saturday game versus LSU has been postponed due to COVID-19 issues within MU's program, per source.","{'neg': 0.101, 'neu': 0.899, 'pos': 0.0, 'compound': -0.2023}"
90,2021-01-08 18:59:58+00:00,RT Lockdown is boring. #whitesox #gay #mirrorselfie #gaycum #dick #cock #dickfordays #teambigdick #teambigcock #cum #gayessex #ess...,"{'neg': 0.356, 'neu': 0.644, 'pos': 0.0, 'compound': -0.7351}"
91,2021-01-08 18:59:59+00:00,RT Consider this in conducting your assessment:,"{'neg': 0.0, 'neu': 1.0, 'pos': 0.0, 'compound': 0.0}"
92,2021-01-08 18:59:59+00:00,"RT SA in the middle of the pack, as is often the case - ie far better than the cynics at home would have you believe, but...","{'neg': 0.041, 'neu': 0.89, 'pos': 0.069, 'compound': 0.2023}"
93,2021-01-08 18:59:59+00:00,genuinely believe those two could have stopped Covid in 16/17 and 17/18,"{'neg': 0.147, 'neu': 0.853, 'pos': 0.0, 'compound': -0.2263}"
94,2021-01-08 18:59:59+00:00,Ah thanks man didn't hear about him I'm guessing it's because De Ligt got Corona so juve wants back up hope he's good man never heard of him,"{'neg': 0.0, 'neu': 0.742, 'pos': 0.258, 'compound': 0.8271}"
95,2021-01-08 18:59:59+00:00,"In light of Supreme Leader's speech today strictly forbidding US and UK #vaccines in Iran, I wonder if will seek advice on how to stop the spread of #Corona from his buddy, the Tehran mayor again","{'neg': 0.122, 'neu': 0.791, 'pos': 0.086, 'compound': -0.128}"
96,2021-01-08 18:59:59+00:00,"I understand virtual eds challenges for PWDs but sending our most vulnerable children into circumstances unfit for non-compromised kids makes no sense. Start making divisive calls, because this is a dangerous decision. Grades can be made up, poor COVID-19 outcomes cant #ontpoli","{'neg': 0.267, 'neu': 0.711, 'pos': 0.022, 'compound': -0.9292}"
97,2021-01-08 18:59:59+00:00,"RT Please start serious invitation roundsfor OFFSHORE, you can invite us later after pandemic,We are losing our age point...","{'neg': 0.171, 'neu': 0.658, 'pos': 0.171, 'compound': 0.0}"
98,2021-01-08 18:59:59+00:00,"RT Germany secured 30 million doses of the BioNTech/Pfizer coronavirus vaccine in September.

But in doing so, it may have...","{'neg': 0.0, 'neu': 0.911, 'pos': 0.089, 'compound': 0.2144}"
99,2021-01-08 18:59:59+00:00,Throwing out vaccines while there are people who need them is like apartments sitting empty while people sleep on the street OH WAIT,"{'neg': 0.071, 'neu': 0.83, 'pos': 0.099, 'compound': 0.1779}"
100,2021-01-08 18:59:59+00:00,Officials in the U.K. and elsewhere are waiting to administer second shots. Here's what we know and don't know about what that means for fighting off the virus.,"{'neg': 0.085, 'neu': 0.915, 'pos': 0.0, 'compound': -0.3612}"
101,2021-01-08 18:59:59+00:00,"COVID-19 Stimulus, Round Two: What Should You Know? Discover more here:","{'neg': 0.0, 'neu': 1.0, 'pos': 0.0, 'compound': 0.0}"
102,2021-01-08 18:59:59+00:00,"COVID-19 Stimulus, Round Two: What Should You Know?Learn more here:","{'neg': 0.0, 'neu': 1.0, 'pos': 0.0, 'compound': 0.0}"
103,2021-01-08 18:59:59+00:00,Online overstimulation as a whole (esp in the last year due to the pandemic) has made everyone more reactive to everything unfortunately. There's literally scientific studies that have come out on this. Sad that people resort to being so aggressive rather than civil discourse.,"{'neg': 0.166, 'neu': 0.834, 'pos': 0.0, 'compound': -0.7987}"
104,2021-01-08 18:59:59+00:00,in the lab  lockdown is a perfect time to make #music,"{'neg': 0.0, 'neu': 0.73, 'pos': 0.27, 'compound': 0.5719}"
105,2021-01-08 18:59:59+00:00,"RT Joe Manchin is worth an estimated $7 million. At least 70% of WV households would qualify for $2,000 checks. 40% of West...","{'neg': 0.0, 'neu': 0.921, 'pos': 0.079, 'compound': 0.2263}"
106,2021-01-08 18:59:59+00:00,ATL sounds good  well minus how they're handling covid lol,"{'neg': 0.0, 'neu': 0.473, 'pos': 0.527, 'compound': 0.7783}"
107,2021-01-08 19:00:00+00:00,RT America surpassed 4k Covid-19 deaths per day and I don't think people are computing the fact that it's basically a whole tow...,"{'neg': 0.0, 'neu': 1.0, 'pos': 0.0, 'compound': 0.0}"
108,2021-01-08 19:00:00+00:00,"*sigh*

Conspiracy theorists share schematic for ""5G chip"" they claim is implanted in COVID-19 vaccines - only it's actually for the Boss Metal Zone | Guitar World","{'neg': 0.111, 'neu': 0.782, 'pos': 0.107, 'compound': -0.2732}"
109,2021-01-08 19:00:00+00:00,Remember when football returning was the only thing that kept us sane during the madness of Covid?,"{'neg': 0.153, 'neu': 0.847, 'pos': 0.0, 'compound': -0.4404}"
110,2021-01-08 19:00:00+00:00,Coronavirus Healing Frequency - iRadeo:,"{'neg': 0.0, 'neu': 1.0, 'pos': 0.0, 'compound': 0.0}"
111,2021-01-08 19:00:00+00:00,"S. Heiranomous

c. 1900

Nevada Brewery at North Bloomfield in Nevada County.

#FridayFeeling 
#COVID19","{'neg': 0.0, 'neu': 1.0, 'pos': 0.0, 'compound': 0.0}"
112,2021-01-08 19:00:00+00:00,Scientific experts answer: What are potential benefits and drawbacks of administering a second vaccine dose from a different brand than the first?,"{'neg': 0.0, 'neu': 0.89, 'pos': 0.11, 'compound': 0.3818}"
113,2021-01-08 19:00:00+00:00,"#Denmark limits travel from all countries to try to check virus

#Covid19 

https://t.co/Uk4SRfcdwB","{'neg': 0.0, 'neu': 1.0, 'pos': 0.0, 'compound': 0.0}"
114,2021-01-08 19:00:00+00:00,"35/1 FOR LIVERPOOL TO BEAT ASTON VILLA RESERVES

Win PS35 in free bets if #LFC beat #AVFC in the #FACup tonight.

Villa are playing a reserve team after a COVID outbreak in the squad!

(T&amp;Cs apply. 18+. New customers only. Begambleaware)

CLAIM
https://t.co/ObyWJl6ICR","{'neg': 0.0, 'neu': 0.813, 'pos': 0.187, 'compound': 0.8478}"
115,2021-01-08 19:00:00+00:00,"NEW from The 2021 Tennessee Sandhill Crane Festival has been cancelled due to COVID-19 concerns. The festival committee has decided to host an online ""Celebration of Cranes."" This virtual event is scheduled Jan. 11-16. 

https://t.co/Ji3YwuwDno","{'neg': 0.05, 'neu': 0.792, 'pos': 0.158, 'compound': 0.6597}"
116,2021-01-08 19:00:00+00:00,RT only will vote patriots in the future,"{'neg': 0.0, 'neu': 1.0, 'pos': 0.0, 'compound': 0.0}"
117,2021-01-08 19:00:00+00:00,"More sad news today
https://t.co/bG4lVA6FWR","{'neg': 0.459, 'neu': 0.541, 'pos': 0.0, 'compound': -0.5256}"
