,created_at,full_text,sentiment_score
111,2021-01-14 07:00:00+00:00,"Stefan Oschmann, CEO of joined to discuss the rapid scientific progress driven by the pandemic, our contributions to vaccine &amp; diagnostic development &amp; the potential of mRNA technology. Watch the interview here:","{'neg': 0.0, 'neu': 0.917, 'pos': 0.083, 'compound': 0.4215}"
112,2021-01-14 07:00:01+00:00,". has received more than PS1m as it develops a Covid-19 detection system

https://t.co/UVQoVgC9uI #coronavirusuk","{'neg': 0.0, 'neu': 1.0, 'pos': 0.0, 'compound': 0.0}"
113,2021-01-14 07:00:01+00:00,"New: 

* How CapVest built Valeo into a EUR1.2 billion food giant

* The future of trade unions in a post-Covid, post-gig economy world

* A force to be reckoned with: when the Barclays met McKillen

* Having raised $1.5m, Frankie Health wants to help tackle mental health issues","{'neg': 0.0, 'neu': 0.947, 'pos': 0.053, 'compound': 0.4019}"
114,2021-01-14 07:00:01+00:00,"Gaming consoles had seen a massive uptake during 2020 with 22.4% of respondents* buying their first console amidst the pandemic  #gaming

*","{'neg': 0.0, 'neu': 1.0, 'pos': 0.0, 'compound': 0.0}"
115,2021-01-14 07:00:01+00:00,"""Yes, I am willing to vaccinate (Chinese) #vaccines when necessary. I have no problem. Chinese #COVID19 vaccines are developed by using traditional techniques... the security is guaranteed"", said Peruvian President, Francisco Sagasti in an interview with Peru's ""Business Daily"".","{'neg': 0.0, 'neu': 0.83, 'pos': 0.17, 'compound': 0.7475}"
116,2021-01-14 07:00:01+00:00,it's #thankyouthursday so #Thank to for helping us to spread the word about staying #healthy through this #pandemic. if any other #radiostations would love to hear more i'd be happy to offer my knowledge!  #midlands,"{'neg': 0.0, 'neu': 0.644, 'pos': 0.356, 'compound': 0.9485}"
117,2021-01-14 07:00:01+00:00,"RT Archie hanging at the beach. pre-pandemic, of course 

#bara #baraart #baraartist #fanart #beefy #pokemon","{'neg': 0.0, 'neu': 1.0, 'pos': 0.0, 'compound': 0.0}"
118,2021-01-14 07:00:01+00:00,"RT Having scrubbed clean all possible evidence of where and how the Covid outbreak began, China finally admits a WHO team. This...","{'neg': 0.0, 'neu': 0.803, 'pos': 0.197, 'compound': 0.5994}"
119,2021-01-14 07:00:01+00:00,"They didn t take him back! He is doing a solo tour performing ,,slave"" album. Skid Row will do the same, they announced it last year but dates havent been released due to covid and uncertainty when gigs can start again. So both, Bach and Skid Row will do a Slave tour in 2021.","{'neg': 0.06, 'neu': 0.94, 'pos': 0.0, 'compound': -0.5255}"
120,2021-01-14 07:00:01+00:00,"RT This is happening today. If you haven't already, please retweet and contact your MP. Across the parties, 300 MPs are now...","{'neg': 0.08, 'neu': 0.811, 'pos': 0.109, 'compound': 0.1872}"
121,2021-01-14 07:00:01+00:00,"""The world is a book and those who do not travel read only a page.""
@incredibleindia and kashmir","{'neg': 0.0, 'neu': 1.0, 'pos': 0.0, 'compound': 0.0}"
122,2021-01-14 07:00:02+00:00,RT The Philosopher Yuk Hui connects the East-West-divide in Covid-responses to deep-rooted conceptions o...,"{'neg': 0.0, 'neu': 1.0, 'pos': 0.0, 'compound': 0.0}"
123,2021-01-14 07:00:02+00:00,"Yeah your right,  Crenshaw should have showed up with Covid like the DEMS did.  So Sad America Died on January 8, 2021. If your RED, you now Dead, so we must now form our own  America.  PS. Pelosi must be impeached for Inciting people when she said punch them in the face","{'neg': 0.19, 'neu': 0.736, 'pos': 0.074, 'compound': -0.8575}"
124,2021-01-14 07:00:02+00:00,RT #Shafqatmehmood Please close all the educational institutions as situation is not under control. Corona is getting worse...,"{'neg': 0.145, 'neu': 0.748, 'pos': 0.107, 'compound': -0.2023}"
125,2021-01-14 07:00:02+00:00,Also a year too late but better late than never,"{'neg': 0.0, 'neu': 0.7, 'pos': 0.3, 'compound': 0.5927}"
126,2021-01-14 07:00:02+00:00,"RT With AZ leading U.S. for COVID case rate, top docs want meeting w as hospitals prepare to ration care.","{'neg': 0.0, 'neu': 0.73, 'pos': 0.27, 'compound': 0.6486}"
127,2021-01-14 07:00:02+00:00,RT Do you want to know how I avoided getting covid from my positive symptomatic roommate with whom I share a bathroom? Bec...,"{'neg': 0.084, 'neu': 0.667, 'pos': 0.249, 'compound': 0.5719}"
128,2021-01-14 07:00:02+00:00,RT Ohio researchers discover new strain of COVID-19,"{'neg': 0.146, 'neu': 0.854, 'pos': 0.0, 'compound': -0.0516}"
129,2021-01-14 07:00:02+00:00,"RT Clad in the traditional attire of the Tatra mountains and flanked by supporters carrying flaming torches, a group of Polish bu...","{'neg': 0.0, 'neu': 0.879, 'pos': 0.121, 'compound': 0.4404}"
130,2021-01-14 07:00:02+00:00,RT fuck this pandemic i can't keep buying things online just to have something to look forward to,"{'neg': 0.171, 'neu': 0.829, 'pos': 0.0, 'compound': -0.5423}"
131,2021-01-14 07:00:02+00:00,"Planning for one visit from a media team on a covid is manageable. 

Planning for multiple visitors a day for every patient is not manageable or safe.","{'neg': 0.085, 'neu': 0.915, 'pos': 0.0, 'compound': -0.3412}"
132,2021-01-14 07:00:02+00:00,RT Family member tested positive for COVID-19 10 days ago and we haven't heard a peep from test and trace. We are obviously...,"{'neg': 0.0, 'neu': 0.859, 'pos': 0.141, 'compound': 0.5574}"
133,2021-01-14 07:00:03+00:00,RT Congresswoman Lauren Boebert has an arrest history &amp; refuses top go through a metal detector.  She was allowed into Congr...,"{'neg': 0.103, 'neu': 0.819, 'pos': 0.078, 'compound': -0.1531}"
134,2021-01-14 07:00:03+00:00,"Time: 07:00 * Temp: 5.8degC * Wind: NNW 0.0 to 5.0mph * Pressure: 1009.9hPa * Rain: 10.2mm * Hum: 99% * ET: 0.0mm * Solar: 0.0W/m2 * UV Index: 0.0 * Sunrise: 08:37 * Sunset: 16:27 * Cloudbase: 160ft * #conlig, #bangor * #stayathome *","{'neg': 0.048, 'neu': 0.952, 'pos': 0.0, 'compound': -0.296}"
135,2021-01-14 07:00:03+00:00,"Our personalities are shaped by our experiences and social interactions, so how might the months spent isolated from friends, family and colleagues have altered us?
How lockdown may have changed your personality, via #psychology","{'neg': 0.061, 'neu': 0.856, 'pos': 0.083, 'compound': 0.2023}"
136,2021-01-14 07:00:03+00:00,RT One of India's misfortune is that most of its so called celebrities are extremely ignorant. Like this guy here is not bot...,"{'neg': 0.091, 'neu': 0.802, 'pos': 0.106, 'compound': 0.099}"
137,2021-01-14 07:00:03+00:00,RT May pregnancy tests and covid tests be negative all 2021. Amen.,"{'neg': 0.252, 'neu': 0.748, 'pos': 0.0, 'compound': -0.5719}"
138,2021-01-14 07:00:03+00:00,RT RHOC was just horrible this season. the privilege during covid was just tooooo much to watch in these unprecedented time...,"{'neg': 0.14, 'neu': 0.76, 'pos': 0.1, 'compound': -0.25}"
139,2021-01-14 07:00:03+00:00,"THREAD:
Not sure this is the wisest article to publish?
1) the full stats are: recovering from Covid = 83% protection against reinfection for at least *20 weeks*
2) BUT nowhere in the article does it mention the ""length of immunity conferred by the vaccine""

1/","{'neg': 0.031, 'neu': 0.926, 'pos': 0.043, 'compound': 0.1454}"
140,2021-01-14 07:00:03+00:00,"Total COVID-19 tests performed in Bahrain: 2,507,245. 96,470 cases, of those 0 today; 356 deaths, of those 0 today.","{'neg': 0.0, 'neu': 1.0, 'pos': 0.0, 'compound': 0.0}"
