,created_at,full_text,sentiment_score
126,2021-01-22 05:00:00+00:00,"Shanghai's central Huangpu district, where major luxury retail destinations and premium offices are located, became the first place in southern China to raise its COVID-19 alert level from low to medium.

https://t.co/v7Z4nrSTCF","{'neg': 0.061, 'neu': 0.875, 'pos': 0.064, 'compound': 0.0258}"
127,2021-01-22 05:00:00+00:00,"Biden's $1.9 trillion coronavirus spending plan could pop the stock market bubble, says David Neuhauser, managing director of Livermore Partners","{'neg': 0.0, 'neu': 1.0, 'pos': 0.0, 'compound': 0.0}"
128,2021-01-22 05:00:00+00:00,"What is the effect of Covid-19 for consumers of flowers and plants?
https://t.co/psyds198I3","{'neg': 0.0, 'neu': 1.0, 'pos': 0.0, 'compound': 0.0}"
129,2021-01-22 05:00:00+00:00,"RT Reuters:  JAPAN GOVT HAS PRIVATELY CONCLUDED TOKYO OLYMPICS WILL HAVE TO BE CANCELLED BECAUSE OF CORONAVIRUS - THE TIMES, CIT...","{'neg': 0.12, 'neu': 0.88, 'pos': 0.0, 'compound': -0.4084}"
130,2021-01-22 05:00:00+00:00,"RT No, we need to focus on small and local businesses that are struggling. We have a responsibility to support the growth of lo...","{'neg': 0.096, 'neu': 0.722, 'pos': 0.182, 'compound': 0.3612}"
131,2021-01-22 05:00:00+00:00,"He did more in one day than president Tweety did in 1 year.

Thank you President Biden.","{'neg': 0.0, 'neu': 0.865, 'pos': 0.135, 'compound': 0.3612}"
132,2021-01-22 05:00:00+00:00,RT Less than 4% of Tennesseans who have received the COVID-19 vaccine identify as African American and less than 2% identi...,"{'neg': 0.0, 'neu': 1.0, 'pos': 0.0, 'compound': 0.0}"
133,2021-01-22 05:00:00+00:00,"RT 4/ On Tuesday, the Dallas County Commissioners Court voted to prioritize vaccines at its Fair Park distribution center fo...","{'neg': 0.0, 'neu': 0.892, 'pos': 0.108, 'compound': 0.3182}"
134,2021-01-22 05:00:00+00:00,"The Philippines will not be able to recover swiftly from the pandemic-induced recession this year due to uncertainties particularly on the vaccination program, an economist of the University of Asia and the Pacific (UA&amp;P) said.","{'neg': 0.132, 'neu': 0.812, 'pos': 0.056, 'compound': -0.4588}"
135,2021-01-22 05:00:01+00:00,"RT What's the official Biden COVID death count? 
I don't know because CNN removed their daily tracker","{'neg': 0.196, 'neu': 0.804, 'pos': 0.0, 'compound': -0.5994}"
136,2021-01-22 05:00:01+00:00,What's the matter bruh! Excluding covid things?,"{'neg': 0.0, 'neu': 0.812, 'pos': 0.188, 'compound': 0.1007}"
137,2021-01-22 05:00:01+00:00,"The latest Making Strides For Autism, Inc.! #covid19 #autism","{'neg': 0.0, 'neu': 1.0, 'pos': 0.0, 'compound': 0.0}"
138,2021-01-22 05:00:01+00:00,Pfizer slashes in half the volume of #COVID19 vaccines it will deliver to some #EU countries this week.,"{'neg': 0.096, 'neu': 0.904, 'pos': 0.0, 'compound': -0.2023}"
139,2021-01-22 05:00:01+00:00,Coronavirus: How these small businesses are surviving the pandemic,"{'neg': 0.0, 'neu': 0.784, 'pos': 0.216, 'compound': 0.296}"
140,2021-01-22 05:00:02+00:00,No Time To Die: Daniel Craig's bond film delayed again as Covid cases continue to skyrocket,"{'neg': 0.381, 'neu': 0.619, 'pos': 0.0, 'compound': -0.7906}"
141,2021-01-22 05:00:02+00:00,"RT New York: While the Biden administration gets to work to tackle this pandemic, we've got to do our part too.
 
Be smart...","{'neg': 0.0, 'neu': 0.891, 'pos': 0.109, 'compound': 0.4019}"
142,2021-01-22 05:00:02+00:00,RT You are such a go-getter. I want to keep motivating you during our fight to go get our goals in this pandemic. Did you...,"{'neg': 0.089, 'neu': 0.756, 'pos': 0.155, 'compound': 0.2263}"
143,2021-01-22 05:00:02+00:00,Still gonna hide in your Office and pretend that our children are just fine,"{'neg': 0.195, 'neu': 0.692, 'pos': 0.113, 'compound': -0.0772}"
144,2021-01-22 05:00:02+00:00,"Current Conditions for #Sayre PA
Temp: 32.3F
Wind Chill: 32.3F
Humidity: 98%
Dew Point: 31.8F 
Barometer: 29.661 inHg
Wind: 0 mph from the N/A
Corona Virus Weekly Stats:
Cases: 156.000000
Deaths: 1.000000
Survival: 98.000000
#weewx #nepa #bradfordcounty","{'neg': 0.0, 'neu': 1.0, 'pos': 0.0, 'compound': 0.0}"
145,2021-01-22 05:00:02+00:00,"RT More than 1,800 longshoremen/laborers at the Ports of Los Angeles and Long Beach are on leave.

The workers are exhaust...","{'neg': 0.152, 'neu': 0.848, 'pos': 0.0, 'compound': -0.34}"
146,2021-01-22 05:00:02+00:00,"RT The first executive order Joe Biden signed was on fighting COVID.

""It's requiring, as I said all along, where I have aut...","{'neg': 0.102, 'neu': 0.898, 'pos': 0.0, 'compound': -0.3612}"
147,2021-01-22 05:00:02+00:00,"RT WSJ columnist blames Obama administration for Trump's disastrous Covid response 

it's gonna be long 4 yrs for these clow...","{'neg': 0.268, 'neu': 0.732, 'pos': 0.0, 'compound': -0.765}"
148,2021-01-22 05:00:02+00:00,"RT Daryl Dixon: Sometimes I think we're just survivin' one fight to the next.

#TheWalkingDead
Season 10
Lines We Cross
0...","{'neg': 0.115, 'neu': 0.885, 'pos': 0.0, 'compound': -0.3818}"
149,2021-01-22 05:00:02+00:00,This wins for worst thing on the internet right now.,"{'neg': 0.259, 'neu': 0.506, 'pos': 0.234, 'compound': -0.1027}"
150,2021-01-22 05:00:02+00:00,"RT In Limpopo a province near Zimbabwe, five relatives died of Covid-19 related illnesses, one after another, we warned t...","{'neg': 0.344, 'neu': 0.656, 'pos': 0.0, 'compound': -0.836}"
151,2021-01-22 05:00:02+00:00,"#COVID19 is likely to have changed our attitude to #infection for good. 

Experts have said: 'Early intervention to prevent serious illness will have to go hand-in-hand with more intensive #disinfection in workplaces and public spaces'. Read the article:","{'neg': 0.095, 'neu': 0.81, 'pos': 0.095, 'compound': 0.0}"
152,2021-01-22 05:00:02+00:00,"EASTON -- Despite COVID-19 challenges related to in-person meetings with clients, Easton-based Decorating Den Interiors' franchises rebounded in the second half of the year and produced six consecutive months of record-setting sales, which produced a...","{'neg': 0.035, 'neu': 0.965, 'pos': 0.0, 'compound': -0.0572}"
153,2021-01-22 05:00:02+00:00,RT Thank you PM India remains committed to assist the people of Nepal in fighting the Covid-19 pandemic. The v...,"{'neg': 0.104, 'neu': 0.705, 'pos': 0.191, 'compound': 0.2732}"
154,2021-01-22 05:00:02+00:00,"RT How it's going now.    How it started then.  

#Fauci #COVID19","{'neg': 0.0, 'neu': 1.0, 'pos': 0.0, 'compound': 0.0}"
155,2021-01-22 05:00:02+00:00,RT Biden sleeps in luxury while just minutes down the road hundreds of soldiers are left to defend themselves against a worsen...,"{'neg': 0.136, 'neu': 0.864, 'pos': 0.0, 'compound': -0.5106}"
156,2021-01-22 05:00:02+00:00,"RT ""Shameful"": In less than 12 months, the death toll caused by Trump's recklessness and remorselessness is equivalent to wi...","{'neg': 0.391, 'neu': 0.609, 'pos': 0.0, 'compound': -0.8979}"
157,2021-01-22 05:00:02+00:00,"#TodayInHistory Inspiration 

Be what you are. This is the first step toward becoming better than you are. - Julius Charles Hare

#Zimbabwe consent, sleepover, #covid19 #Stayhome","{'neg': 0.0, 'neu': 0.737, 'pos': 0.263, 'compound': 0.802}"
158,2021-01-22 05:00:03+00:00,"RT We all need to do our part. If you are a #nurse please be a volunteer vaccinator or a community educator. Wear a mask, wa...","{'neg': 0.0, 'neu': 0.916, 'pos': 0.084, 'compound': 0.3182}"
159,2021-01-22 05:00:03+00:00,"RT I stopped using instacart completely well over a year ago. 

It's definitely time to delete my account and make it clear wh...","{'neg': 0.066, 'neu': 0.664, 'pos': 0.269, 'compound': 0.6997}"
160,2021-01-22 05:00:03+00:00,If you're a true Patriot then you will wear a mask to protect your fellow Americans. Freedom comes with responsibility. Be responsible.,"{'neg': 0.0, 'neu': 0.602, 'pos': 0.398, 'compound': 0.8979}"
161,2021-01-22 05:00:03+00:00,"RT Thank you, DBM Secretary Wendell Avisado for letting me realign funds of DFA to meet shortfalls. Yes, I absolutely do n...","{'neg': 0.0, 'neu': 0.794, 'pos': 0.206, 'compound': 0.6369}"
162,2021-01-22 05:00:03+00:00,"RT Officially tested positive for COVID. Y'all this is no joke. 

Fever. Entire body ache. My skin hurts to touch. Sinus, eye...","{'neg': 0.26, 'neu': 0.617, 'pos': 0.123, 'compound': -0.4567}"
163,2021-01-22 05:00:03+00:00,"RT Find and reach #Covid19 #Vaccination Centre! Check out #map location, directions, photos and reviews on por...","{'neg': 0.0, 'neu': 0.92, 'pos': 0.08, 'compound': 0.1007}"
164,2021-01-22 05:00:03+00:00,"Talking about the National Guard on CBS radio around 2  PM today, the segment host was talking about  #ChinaJoe to mobiilze them in every major city to "" assist""  people in getting #COVID19 vaccines.  Get ready, he's going to try and force you to get them! Segment is taped.","{'neg': 0.0, 'neu': 0.945, 'pos': 0.055, 'compound': 0.4199}"
