,created_at,full_text,sentiment_score
0,2021-01-22 04:59:55+00:00,"RT Alex Ovechkin's wife, Nastya, posted this on Instagram just now. She says Ovechkin and Dmitry Orlov have covid-19 antibo...","{'neg': 0.0, 'neu': 1.0, 'pos': 0.0, 'compound': 0.0}"
1,2021-01-22 04:59:55+00:00,RT Last year this time around we were in New Zealand. The year before in Europe. But now stuck at home for 1 yr due to Cov...,"{'neg': 0.088, 'neu': 0.912, 'pos': 0.0, 'compound': -0.3612}"
2,2021-01-22 04:59:55+00:00,It must be hell for people who can't wear a mask. As obviously they can't ride in a car with a windscreen in front of them too.,"{'neg': 0.15, 'neu': 0.85, 'pos': 0.0, 'compound': -0.6808}"
3,2021-01-22 04:59:55+00:00,"Remember #ProjectIsaac that we started in summer to engage students amid the pandemic? We are happy to announce that we are going to host a virtual celebration of the 'Project Isaac Showcase' on Jan 29, 6-7 pm. Join in using this link and invite others too","{'neg': 0.0, 'neu': 0.809, 'pos': 0.191, 'compound': 0.836}"
4,2021-01-22 04:59:55+00:00,"RT President Joe Biden knows we are all in this together. During World War II, factories across the country played a role i...","{'neg': 0.143, 'neu': 0.769, 'pos': 0.088, 'compound': -0.3612}"
5,2021-01-22 04:59:55+00:00,RT BREAKING: Hong Kong to lock down Yau Tsim Mong district in Kowloon in a bid to contain a worsening outbreak of the coronaviru...,"{'neg': 0.115, 'neu': 0.885, 'pos': 0.0, 'compound': -0.4588}"
6,2021-01-22 04:59:55+00:00,"RT 24 Karat Gold The Concert is now available on DVD &amp; Blu-Ray, so you can watch at home! I had a fantastic time on this tour...","{'neg': 0.0, 'neu': 0.87, 'pos': 0.13, 'compound': 0.5983}"
7,2021-01-22 04:59:55+00:00,"RT Nearly nine million people borrowed more money last year to cope with impact of coronavirus pandemic, government figures s...","{'neg': 0.0, 'neu': 1.0, 'pos': 0.0, 'compound': 0.0}"
8,2021-01-22 04:59:55+00:00,"RT Mexico sets new single-day covid record.
--22,339 cases
--1,803 deaths

Those figures represent *confirmed* cases and deaths...","{'neg': 0.0, 'neu': 1.0, 'pos': 0.0, 'compound': 0.0}"
9,2021-01-22 04:59:55+00:00,The latest on the coronavirus pandemic and vaccines,"{'neg': 0.0, 'neu': 1.0, 'pos': 0.0, 'compound': 0.0}"
10,2021-01-22 04:59:55+00:00,"When mams and moms go to work, and they baby boy stay at home with grandma #WeeBNK48 #FondBNK48 #wiif`nd","{'neg': 0.0, 'neu': 1.0, 'pos': 0.0, 'compound': 0.0}"
11,2021-01-22 04:59:55+00:00,"RT Lockdown till summer uno? I'll start doing cocaine, let's not play this game","{'neg': 0.135, 'neu': 0.865, 'pos': 0.0, 'compound': -0.2584}"
12,2021-01-22 04:59:55+00:00,"RT Companies like Microsoft, Apple, and Google are interested in vaccine or immunization passports to help reopen the economy. You m...","{'neg': 0.0, 'neu': 0.695, 'pos': 0.305, 'compound': 0.7845}"
13,2021-01-22 04:59:55+00:00,Exactly right. To treat those that have had Covid differently in the vaccine prioritization would be to admit that there really might be something to that crazy herd immunity idea...,"{'neg': 0.071, 'neu': 0.796, 'pos': 0.133, 'compound': 0.2732}"
14,2021-01-22 04:59:56+00:00,RT Hard to believe the guy who wasn't really a billionaire didn't really have a covid vaccination plan. Shocked.,"{'neg': 0.179, 'neu': 0.821, 'pos': 0.0, 'compound': -0.4019}"
15,2021-01-22 04:59:56+00:00,"No-one dies of Covid anymore, that's soooo 2020.","{'neg': 0.0, 'neu': 1.0, 'pos': 0.0, 'compound': 0.0}"
16,2021-01-22 04:59:56+00:00,RT Government-appointed lawyers informed Chen Mei's family that the Beijing Chaoyang District Court has postponed holding a tri...,"{'neg': 0.096, 'neu': 0.904, 'pos': 0.0, 'compound': -0.2023}"
17,2021-01-22 04:59:56+00:00,Yes! COVID 69 is still gone globally again and all Occuring,"{'neg': 0.0, 'neu': 0.77, 'pos': 0.23, 'compound': 0.4574}"
18,2021-01-22 04:59:56+00:00,"RT 5) Number of people who died from making Armageddon &amp; Deep Impact movies: 0

Number of people died from #COVID19 pandemic:...","{'neg': 0.259, 'neu': 0.647, 'pos': 0.094, 'compound': -0.765}"
19,2021-01-22 04:59:56+00:00,RT Impeach.,"{'neg': 0.0, 'neu': 1.0, 'pos': 0.0, 'compound': 0.0}"
20,2021-01-22 04:59:56+00:00,"RT ""Framing the conversation about distrust in Covid vaccines in terms of everyday racism rather than historical atrocities ma...","{'neg': 0.289, 'neu': 0.711, 'pos': 0.0, 'compound': -0.7845}"
21,2021-01-22 04:59:56+00:00,This is typical of viruses,"{'neg': 0.0, 'neu': 1.0, 'pos': 0.0, 'compound': 0.0}"
22,2021-01-22 04:59:56+00:00,RT We have had mandated mask wearing in Nova Scotia Canada since July and follow social distancing . We only have 23...,"{'neg': 0.0, 'neu': 1.0, 'pos': 0.0, 'compound': 0.0}"
23,2021-01-22 04:59:56+00:00,RT TMC cannot refrain from it's corruptive methods! Even something as sensitive as the COVID-19 'vaccination system' is b...,"{'neg': 0.0, 'neu': 1.0, 'pos': 0.0, 'compound': 0.0}"
24,2021-01-22 04:59:56+00:00,"RT Still Separated: COVID-19 Order Keeps Families Apart After Biden Lifts ""Muslim Ban""","{'neg': 0.231, 'neu': 0.769, 'pos': 0.0, 'compound': -0.5574}"
25,2021-01-22 04:59:56+00:00,RT Very troubled abt what appears to be an emerging trend here in NYC of ppl (typically white) coming from outside heavily impac...,"{'neg': 0.13, 'neu': 0.87, 'pos': 0.0, 'compound': -0.5095}"
26,2021-01-22 04:59:56+00:00,RT The horny pandemic is more serious,"{'neg': 0.21, 'neu': 0.79, 'pos': 0.0, 'compound': -0.1513}"
27,2021-01-22 04:59:56+00:00,"RT There is nothing in this article explaining how ""no distribution plan"" was able to distribute over 35 million doses of...","{'neg': 0.0, 'neu': 1.0, 'pos': 0.0, 'compound': 0.0}"
28,2021-01-22 04:59:56+00:00,RT we were going to have breakdancing in the olympics. this is what covid has taken from us.,"{'neg': 0.0, 'neu': 1.0, 'pos': 0.0, 'compound': 0.0}"
29,2021-01-22 04:59:56+00:00,RT I miss life before COVID,"{'neg': 0.242, 'neu': 0.758, 'pos': 0.0, 'compound': -0.1531}"
30,2021-01-22 04:59:56+00:00,"RT Covid19 still ravaging Uganda, as huge sums of money borrowed to fight it was opulently used to rent + force electoral s...","{'neg': 0.1, 'neu': 0.811, 'pos': 0.089, 'compound': -0.0772}"
31,2021-01-22 04:59:56+00:00,"Coronavirus update 
Covid-19 has infected more than 98 million people and killed over 2 million. Here are the virus updates for January 22:","{'neg': 0.268, 'neu': 0.732, 'pos': 0.0, 'compound': -0.8271}"
32,2021-01-22 04:59:56+00:00,"RT Biden made our troops sleep in a parking garage during a pandemic 

This is Day 1","{'neg': 0.0, 'neu': 1.0, 'pos': 0.0, 'compound': 0.0}"
33,2021-01-22 04:59:56+00:00,"RT NEW GOLDEN RULE--""One of the new things in this administration is that if you don't know the answer, don't guess. Just say y...","{'neg': 0.0, 'neu': 1.0, 'pos': 0.0, 'compound': 0.0}"
34,2021-01-22 04:59:56+00:00,RT wear a mask when going out (but not this kind),"{'neg': 0.302, 'neu': 0.698, 'pos': 0.0, 'compound': -0.652}"
35,2021-01-22 04:59:57+00:00,RT The World Health Organization failed to act quickly at the start of the pandemic. But instead of demanding leadership change...,"{'neg': 0.191, 'neu': 0.809, 'pos': 0.0, 'compound': -0.5423}"
36,2021-01-22 04:59:57+00:00,RT My comments with  ,"{'neg': 0.0, 'neu': 1.0, 'pos': 0.0, 'compound': 0.0}"
37,2021-01-22 04:59:57+00:00,"RT Lockdown the country, run the stimmys, forgive student loans.","{'neg': 0.0, 'neu': 0.811, 'pos': 0.189, 'compound': 0.2732}"
38,2021-01-22 04:59:57+00:00,"RT NEW JERSEY #COVID19 UPDATE:
4,095 new positive PCR tests
580,688 total positive PCR tests
1,184 new positive antigen t...","{'neg': 0.0, 'neu': 0.605, 'pos': 0.395, 'compound': 0.902}"
39,2021-01-22 04:59:57+00:00,RT We are in a pandemic?? And the capitol was attacked two weeks ago?? Like???,"{'neg': 0.203, 'neu': 0.668, 'pos': 0.128, 'compound': -0.3527}"
40,2021-01-22 04:59:57+00:00,What the??!!!,"{'neg': 0.0, 'neu': 1.0, 'pos': 0.0, 'compound': 0.0}"
41,2021-01-22 04:59:57+00:00,"Oh so now it's a bad thing our country is finally raising minimum wage, to help ppl who have been left to rot in poverty for years especially during a pandemic. Mfs can't get good jobs bc our country got a preference anyways, and supposed to survive off $9 lmao impossible","{'neg': 0.149, 'neu': 0.744, 'pos': 0.107, 'compound': -0.383}"
42,2021-01-22 04:59:57+00:00,RT When asked whether would welcome Wu Han residents to contact its expert team and offer clues which they think will help...,"{'neg': 0.0, 'neu': 0.778, 'pos': 0.222, 'compound': 0.6908}"
43,2021-01-22 04:59:57+00:00,"RT Killing jobs to become dependent again on Middle East oil, potentially sending more troops to Iraq, keeping some illegals he...","{'neg': 0.18, 'neu': 0.82, 'pos': 0.0, 'compound': -0.6597}"
44,2021-01-22 04:59:57+00:00,jus heard these two lovely guys were doin covid vaccines ,"{'neg': 0.0, 'neu': 0.703, 'pos': 0.297, 'compound': 0.5859}"
45,2021-01-22 04:59:57+00:00,"RT Today, I spoke by phone with Director-General Dr. Tedros Adhanom Ghebreyesus. We discussed how the United States will work as...","{'neg': 0.0, 'neu': 0.877, 'pos': 0.123, 'compound': 0.4215}"
46,2021-01-22 04:59:57+00:00,"A second coronavirus vaccine developed in India is set to enter phase three clinical trial 'very, very soon'","{'neg': 0.0, 'neu': 1.0, 'pos': 0.0, 'compound': 0.0}"
47,2021-01-22 04:59:57+00:00,"RT Love Rush's open. 

""Today over 100 people have died of the coronavirus - due to P. Biden's mishandling of the  disease""","{'neg': 0.129, 'neu': 0.719, 'pos': 0.151, 'compound': 0.1531}"
48,2021-01-22 04:59:57+00:00,"F CORONA, I WILL SEE THEM LIVE.","{'neg': 0.0, 'neu': 1.0, 'pos': 0.0, 'compound': 0.0}"
49,2021-01-22 04:59:57+00:00,RT Shardul Thakur has been in a different mood since the Gabba Test -,"{'neg': 0.0, 'neu': 1.0, 'pos': 0.0, 'compound': 0.0}"
50,2021-01-22 04:59:57+00:00,"RT 92 countries are approaching us for vaccine doses. But Raju, who is a mere show host in a channel and absolutely no relation...","{'neg': 0.123, 'neu': 0.877, 'pos': 0.0, 'compound': -0.5006}"
51,2021-01-22 04:59:57+00:00,"RT Yeah this is not okay.

My office is free this week to any service members who'd like to use it for a break or take nap on the cou...","{'neg': 0.047, 'neu': 0.729, 'pos': 0.224, 'compound': 0.7457}"
52,2021-01-22 04:59:57+00:00,ICYMI: Capitals' COVID-related fine serves as reminder for Penguins to follow protocols,"{'neg': 0.0, 'neu': 0.859, 'pos': 0.141, 'compound': 0.2023}"
53,2021-01-22 04:59:58+00:00,"RT Yeah this is not okay.

My office is free this week to any service members who'd like to use it for a break or take nap on the cou...","{'neg': 0.047, 'neu': 0.729, 'pos': 0.224, 'compound': 0.7457}"
54,2021-01-22 04:59:58+00:00,"RT ""I wish #COVID19 will come to an end soon.""
-@BTS_twt Yoongi 

Remember: #YoongiGetsWhatYoongiWants

#bangtansonyeondan #SUGA #syuga #8years...","{'neg': 0.0, 'neu': 0.863, 'pos': 0.137, 'compound': 0.4019}"
55,2021-01-22 04:59:58+00:00,RT We are in a pandemic?? And the capitol was attacked two weeks ago?? Like???,"{'neg': 0.203, 'neu': 0.668, 'pos': 0.128, 'compound': -0.3527}"
56,2021-01-22 04:59:58+00:00,RT can't believe Congress rushed thousands of troops somewhere with no plan for where they'll stay or an exit strategy,"{'neg': 0.104, 'neu': 0.896, 'pos': 0.0, 'compound': -0.296}"
57,2021-01-22 04:59:58+00:00,RT Gretchen Whitmer Travels To D.C. For Inauguration After Telling Michiganders To Stay Home,"{'neg': 0.0, 'neu': 1.0, 'pos': 0.0, 'compound': 0.0}"
58,2021-01-22 04:59:58+00:00,grabe maybe i need to upgrade my hoe life too  the way ion have anything going on w my life since the pandemic,"{'neg': 0.0, 'neu': 1.0, 'pos': 0.0, 'compound': 0.0}"
59,2021-01-22 04:59:58+00:00,"RICHARD LITTLEJOHN: Don't clean your teeth - save the NHS... a look forward to Covid Britain in 2024
via","{'neg': 0.101, 'neu': 0.757, 'pos': 0.142, 'compound': 0.2363}"
60,2021-01-22 04:59:58+00:00,"Calgary church, furniture store cited for COVID-19 violations #yyc #COVID19AB","{'neg': 0.274, 'neu': 0.726, 'pos': 0.0, 'compound': -0.5267}"
61,2021-01-22 04:59:58+00:00,"RT Kids and Covid
Test positivity in Ontario by health unit and age.  Red and orange are kids","{'neg': 0.0, 'neu': 0.837, 'pos': 0.163, 'compound': 0.5106}"
62,2021-01-22 04:59:58+00:00,"RT Are the lockdown policies being pushed by and working?

Since December 10, 2020, coronavirus cas...","{'neg': 0.0, 'neu': 1.0, 'pos': 0.0, 'compound': 0.0}"
63,2021-01-22 04:59:58+00:00,RT We are in a pandemic?? And the capitol was attacked two weeks ago?? Like???,"{'neg': 0.203, 'neu': 0.668, 'pos': 0.128, 'compound': -0.3527}"
64,2021-01-22 04:59:58+00:00,RT Instacart is firing every employee who voted to unionize,"{'neg': 0.211, 'neu': 0.789, 'pos': 0.0, 'compound': -0.34}"
65,2021-01-22 04:59:58+00:00,RT This is how we treat our troops protecting our capitol?!?! This is heinous and disgraceful and I want answers NOW!,"{'neg': 0.0, 'neu': 0.784, 'pos': 0.216, 'compound': 0.6412}"
66,2021-01-22 04:59:58+00:00,RT Impeach.,"{'neg': 0.0, 'neu': 1.0, 'pos': 0.0, 'compound': 0.0}"
67,2021-01-22 04:59:58+00:00,RT Ableism is prioritizing COVID vaccinations to people 65+ and not younger disabled and chronically ill folks. We're JUST as a...,"{'neg': 0.123, 'neu': 0.877, 'pos': 0.0, 'compound': -0.4215}"
68,2021-01-22 04:59:59+00:00,RT .@AyannaPressley get to work by #PressurePelosi with seriousness to put HR 1...,"{'neg': 0.091, 'neu': 0.909, 'pos': 0.0, 'compound': -0.0516}"
69,2021-01-22 04:59:59+00:00,RT Say it with us. Union busting is disgusting!,"{'neg': 0.316, 'neu': 0.684, 'pos': 0.0, 'compound': -0.5707}"
70,2021-01-22 04:59:59+00:00,RT Rajdeep Sardesai is the only TV anchor who is consistently shocked at the findings of his channel's own survey's 365 day...,"{'neg': 0.099, 'neu': 0.901, 'pos': 0.0, 'compound': -0.3182}"
71,2021-01-22 04:59:59+00:00,RT This is how we treat our troops protecting our capitol?!?! This is heinous and disgraceful and I want answers NOW!,"{'neg': 0.0, 'neu': 0.784, 'pos': 0.216, 'compound': 0.6412}"
72,2021-01-22 04:59:59+00:00,RT Today's executive actions represent our Administration's effort to aggressively change the course of COVID-19 by expanding...,"{'neg': 0.126, 'neu': 0.874, 'pos': 0.0, 'compound': -0.3182}"
73,2021-01-22 04:59:59+00:00,RT I'll be the one to say it: let's just do a 2X 7 inning doubleheader on one of the two dates that are still...,"{'neg': 0.0, 'neu': 1.0, 'pos': 0.0, 'compound': 0.0}"
74,2021-01-22 04:59:59+00:00," The answer 4 Museveni is in the mirror: Dude, have a gud look ur dumb-self in a mirror, u 2 old &amp; u gotta go now b4 Covid gets ur dumb ass....","{'neg': 0.185, 'neu': 0.815, 'pos': 0.0, 'compound': -0.7783}"
75,2021-01-22 04:59:59+00:00,"RT Today, I spoke by phone with Director-General Dr. Tedros Adhanom Ghebreyesus. We discussed how the United States will work as...","{'neg': 0.0, 'neu': 0.877, 'pos': 0.123, 'compound': 0.4215}"
76,2021-01-22 04:59:59+00:00,"RT #gujraat_aarogy_mhaasNgh_greddpe_lddt
The government is showering flowers on the Corona Warriors, the same Aro. The government...","{'neg': 0.0, 'neu': 1.0, 'pos': 0.0, 'compound': 0.0}"
77,2021-01-22 04:59:59+00:00,RT Impeach.,"{'neg': 0.0, 'neu': 1.0, 'pos': 0.0, 'compound': 0.0}"
78,2021-01-22 04:59:59+00:00,"RT 6) This topic is very personal to me, not just as an epidemiologist but also for what my family went through last year when...","{'neg': 0.0, 'neu': 1.0, 'pos': 0.0, 'compound': 0.0}"
79,2021-01-22 04:59:59+00:00,"RT The parent's lawyer asked the expert:
  
'Would there not be long-term, serious damage to a child if they went to school, go...","{'neg': 0.126, 'neu': 0.826, 'pos': 0.048, 'compound': -0.4548}"
80,2021-01-22 04:59:59+00:00,Bro nem living,"{'neg': 0.0, 'neu': 1.0, 'pos': 0.0, 'compound': 0.0}"
81,2021-01-22 04:59:59+00:00,"RT Lockdown the country, run the stimmys, forgive student loans.","{'neg': 0.0, 'neu': 0.811, 'pos': 0.189, 'compound': 0.2732}"
82,2021-01-22 04:59:59+00:00,China's Hotel Recovery Falls Off Rails Amid New Coronavirus Flare-Ups,"{'neg': 0.0, 'neu': 1.0, 'pos': 0.0, 'compound': 0.0}"
83,2021-01-22 04:59:59+00:00,tf this school letting students to meet up bcs of school work/s??????? i mean in the middle of pandemic?????,"{'neg': 0.0, 'neu': 1.0, 'pos': 0.0, 'compound': 0.0}"
84,2021-01-22 04:59:59+00:00,RT Covid-19 Claims the life of Bwalya Mwanza -,"{'neg': 0.0, 'neu': 1.0, 'pos': 0.0, 'compound': 0.0}"
85,2021-01-22 04:59:59+00:00,"RT We are building a partnership with the American people to confront COVID-19.
 
A partnership rooted in transparency an...","{'neg': 0.086, 'neu': 0.914, 'pos': 0.0, 'compound': -0.1779}"
86,2021-01-22 05:00:00+00:00,"RT Trump should open the Trump hotel in DC to the troops. 

cc:","{'neg': 0.0, 'neu': 1.0, 'pos': 0.0, 'compound': 0.0}"
87,2021-01-22 05:00:00+00:00,"RT More than 4,300 people died of covid today under Joe Biden's administration. There have been left wing riots every day s...","{'neg': 0.257, 'neu': 0.743, 'pos': 0.0, 'compound': -0.7845}"
88,2021-01-22 05:00:00+00:00,i hate covid i hate america,"{'neg': 0.649, 'neu': 0.351, 'pos': 0.0, 'compound': -0.8126}"
89,2021-01-22 05:00:00+00:00,"RT If I can wear a bra everyday for 19 years, ya'll can wear a mask for 100 days.","{'neg': 0.0, 'neu': 1.0, 'pos': 0.0, 'compound': 0.0}"
90,2021-01-22 05:00:00+00:00,"""Snake oil salesmen, such as this, who endanger consumers should take this arrest as a stern warning.""","{'neg': 0.256, 'neu': 0.744, 'pos': 0.0, 'compound': -0.631}"
91,2021-01-22 05:00:00+00:00,"Etihad Airways and Emirates Airline launch new COVID-19 travel pass

https://t.co/33sLFFzIC4","{'neg': 0.0, 'neu': 1.0, 'pos': 0.0, 'compound': 0.0}"
92,2021-01-22 05:00:00+00:00,RT Love Dave but what a crowd of jackasses,"{'neg': 0.351, 'neu': 0.473, 'pos': 0.176, 'compound': -0.5574}"
93,2021-01-22 05:00:00+00:00,"Biden: US COVID death toll 'likely' to top 500,000 next month via","{'neg': 0.248, 'neu': 0.637, 'pos': 0.115, 'compound': -0.4767}"
94,2021-01-22 05:00:00+00:00,RT After contracting COVID-19 and suffering a loss of taste I have decided to become a value investor and buy stocks tradin...,"{'neg': 0.201, 'neu': 0.709, 'pos': 0.09, 'compound': -0.4588}"
95,2021-01-22 05:00:00+00:00,Two Jordanian prisoners have been infected with the coronavirus.,"{'neg': 0.481, 'neu': 0.519, 'pos': 0.0, 'compound': -0.7579}"
96,2021-01-22 05:00:00+00:00,"Curious about the new #COVID19 strain in England? Listen as Gregory Armstrong, MD, shares all he knows so far about the new mutation. #MedEd #podcast","{'neg': 0.043, 'neu': 0.794, 'pos': 0.162, 'compound': 0.5106}"
97,2021-01-22 05:00:00+00:00,"The Iowa Department of Public Health didn't account for out-of-area employees when it came to COVID-19 vaccine distribution, according to the Johnson County Health Department.

https://t.co/1L7vxnAP1l","{'neg': 0.0, 'neu': 1.0, 'pos': 0.0, 'compound': 0.0}"
98,2021-01-22 05:00:00+00:00,"RT Yesterday, one year after COVID19 first affected Americans, more Americans have died of COVID19 than American Soldiers in WW...","{'neg': 0.233, 'neu': 0.767, 'pos': 0.0, 'compound': -0.6666}"
99,2021-01-22 05:00:00+00:00,"#Pune Police have launched a probe while the state and central intelligence agencies are closely monitoring the developments, considering the company's role in the country's Covid-19 response.

https://t.co/H5KpJcsaBC","{'neg': 0.0, 'neu': 0.85, 'pos': 0.15, 'compound': 0.5574}"
100,2021-01-22 05:00:00+00:00,"RT SCIENCE IS BACK! And not muzzled anymore! 

""That's why you're going to be hearing a lot more from Dr. Fauci again,""","{'neg': 0.0, 'neu': 1.0, 'pos': 0.0, 'compound': 0.0}"
101,2021-01-22 05:00:00+00:00,"While I may get a vaccine, I may still get infected, not produce disease, and spread the virus to others : Dr. Shahid Jameel
 
#VaccinationDrive #LargestVaccineDrive #COVID19 #COVISHIELD #pandemic #covaxin #FridayMotivation 

https://t.co/npkYxvzoMN","{'neg': 0.094, 'neu': 0.906, 'pos': 0.0, 'compound': -0.4939}"
102,2021-01-22 05:00:00+00:00,"Singapore Tightens Entry Rules.

From January 25, all incoming travelers will have to take a Covid-19 PCR test upon arrival.

https://t.co/S29twwEWIe

#Singapore #SG #Arrival #COVID19 #travel","{'neg': 0.0, 'neu': 1.0, 'pos': 0.0, 'compound': 0.0}"
103,2021-01-22 05:00:00+00:00,"How can you take care of your mental health amid coronavirus pandemic?

@WHO's Devora Kestel, Director of the Department of Mental Health, explains","{'neg': 0.0, 'neu': 0.873, 'pos': 0.127, 'compound': 0.4939}"
104,2021-01-22 05:00:00+00:00,Britain's Glastonbury music festival has fallen victim to the coronavirus pandemic for the second year in a row.,"{'neg': 0.202, 'neu': 0.658, 'pos': 0.14, 'compound': -0.1027}"
105,2021-01-22 05:00:00+00:00,"There are set safeguards and precautions in place to ensure that vaccines are brought to us safely. 

Read about these steps in the tweet below!","{'neg': 0.0, 'neu': 0.722, 'pos': 0.278, 'compound': 0.8172}"
106,2021-01-22 05:00:00+00:00,"One of the funniest memes which surfaced in my whatsapp today..

Reality of lockdown, what you always took for granted.

#lockdown #WFH #wfhlife #housework","{'neg': 0.0, 'neu': 0.797, 'pos': 0.203, 'compound': 0.6808}"
107,2021-01-22 05:00:00+00:00,"RT Please stop the disinformation: On average, 400 Norwegians living in nursing care/assisted living facilities pass away each...","{'neg': 0.107, 'neu': 0.78, 'pos': 0.112, 'compound': 0.0258}"
108,2021-01-22 05:00:00+00:00,"Africa's coronavirus case fatality rate stands at 2.5%, higher than the global level of 2.2%, a trend that is alarming experts, the head of the continent's disease control body said the Kool-Aid #COVID19
https://t.co/fwid23Akg8","{'neg': 0.158, 'neu': 0.842, 'pos': 0.0, 'compound': -0.7184}"
109,2021-01-22 05:00:00+00:00,"RT #cannabis #weed #marijuana The 7 Best Marijuana Stocks on the Markets Right Now 

Despite a global pandemic, many marijuana...","{'neg': 0.0, 'neu': 0.819, 'pos': 0.181, 'compound': 0.6369}"
110,2021-01-22 05:00:00+00:00,School and health officials say #Kamloops-area schools remain safe despite an increase in #COVID19 exposures after the winter break. #bced,"{'neg': 0.086, 'neu': 0.787, 'pos': 0.127, 'compound': 0.2354}"
111,2021-01-22 05:00:00+00:00,There are countless other Americans like Ashley Varol who have had life-altering side effects from the virus. ,"{'neg': 0.0, 'neu': 0.865, 'pos': 0.135, 'compound': 0.3612}"
112,2021-01-22 05:00:00+00:00,"RT More than 4,300 people died of covid today under Joe Biden's administration. There have been left wing riots every day s...","{'neg': 0.257, 'neu': 0.743, 'pos': 0.0, 'compound': -0.7845}"
113,2021-01-22 05:00:00+00:00,"Florida issues new Covid-19 vaccine residency rules to cut down on 'vaccine tourism'
https://t.co/Eyu6d4FU7h","{'neg': 0.139, 'neu': 0.861, 'pos': 0.0, 'compound': -0.2732}"
114,2021-01-22 05:00:00+00:00,"The COVID-19 vaccines rolling out in the United States, the United Kingdom and other parts of the world so far require two shots given a few weeks apart.","{'neg': 0.0, 'neu': 0.823, 'pos': 0.177, 'compound': 0.6808}"
115,2021-01-22 05:00:00+00:00,"With more people back at home or unemployed during the pandemic, food distribution organizations are seeing a steady rise in food insecurity.","{'neg': 0.118, 'neu': 0.882, 'pos': 0.0, 'compound': -0.4215}"
116,2021-01-22 05:00:00+00:00,Buy Rose Petals Powder | Order Natural Rose Petals Powder Online Now - #Natural #buy #groceryitems #groceryshopping #Andhragreens #Covid19 #VocalForLocal #Vocal4Local #GoLocal #StayHomeStaySafe #HorticultureAp,"{'neg': 0.0, 'neu': 0.815, 'pos': 0.185, 'compound': 0.6124}"
117,2021-01-22 05:00:00+00:00,"Drugmaker Eli Lilly said Thursday its antibody drug can prevent COVID-19 illness in residents and staff of nursing homes and other long-term care locations.
--&gt;&gt;","{'neg': 0.093, 'neu': 0.759, 'pos': 0.148, 'compound': 0.1531}"
118,2021-01-22 05:00:00+00:00,"State's COVID-19 transmission map shows 34 counties in red, 57 in orange after weekly update","{'neg': 0.0, 'neu': 1.0, 'pos': 0.0, 'compound': 0.0}"
119,2021-01-22 05:00:00+00:00,"The COVID-19 vaccines rolling out in the United States, the United Kingdom and other parts of the world so far require two shots given a few weeks apart.","{'neg': 0.0, 'neu': 0.823, 'pos': 0.177, 'compound': 0.6808}"
120,2021-01-22 05:00:00+00:00,RT it's a Thursday in a global pandemic....,"{'neg': 0.0, 'neu': 1.0, 'pos': 0.0, 'compound': 0.0}"
121,2021-01-22 05:00:00+00:00,"The on Thursday said it had approved a re-allocation of $34 million in funds to support Lebanon's vaccination efforts as it races to contain the #coronavirus pandemic, marking the first such outlay of funds by the Bank.

https://t.co/od1S2EnjVo","{'neg': 0.0, 'neu': 0.867, 'pos': 0.133, 'compound': 0.6705}"
122,2021-01-22 05:00:00+00:00,"According to the Department of Veterans Affairs, 291,557 Americans died in battle between 1941 and 1945, and another 113,842 members of the military died in service during the war.","{'neg': 0.354, 'neu': 0.646, 'pos': 0.0, 'compound': -0.9287}"
123,2021-01-22 05:00:00+00:00,"This was the moving tribute ANC deputy secretary-general Jessie Duarte paid to the late minister in the presidency on Thursday after the shocking news of his death from Covid-19 related complications.
https://t.co/2w602uri4j","{'neg': 0.18, 'neu': 0.82, 'pos': 0.0, 'compound': -0.765}"
124,2021-01-22 05:00:00+00:00,"Chief Rory Miller says doctors diagnosed him with Guillain-Barre Syndrome, which they believe was triggered by COVID.
https://t.co/fb7fwAxZPu","{'neg': 0.0, 'neu': 1.0, 'pos': 0.0, 'compound': 0.0}"
125,2021-01-22 05:00:00+00:00,"President Joe Biden announced on his first day in office that one of his top priorities is to change ""the course of the Covid crisis.""","{'neg': 0.142, 'neu': 0.796, 'pos': 0.062, 'compound': -0.5106}"
