,created_at,full_text,sentiment_score
0,2021-01-25 23:59:54+00:00,"RT The Biden Administration and the Trump Administration both implemented travel bans to combat #COVID19. 

But only the Trump...","{'neg': 0.086, 'neu': 0.914, 'pos': 0.0, 'compound': -0.1779}"
1,2021-01-25 23:59:54+00:00,Covid: Curfew riots hit Netherlands for third night - BBC News,"{'neg': 0.248, 'neu': 0.752, 'pos': 0.0, 'compound': -0.5106}"
2,2021-01-25 23:59:55+00:00,"RT my heart goes out to all of you that have lost anyone recently,i don't think there has been a time in my life when so ma...","{'neg': 0.073, 'neu': 0.794, 'pos': 0.133, 'compound': 0.4404}"
3,2021-01-25 23:59:55+00:00,Anyone feel they've been here before ? #DejaVu,"{'neg': 0.0, 'neu': 1.0, 'pos': 0.0, 'compound': 0.0}"
4,2021-01-25 23:59:55+00:00,"The Dems really showed their contempt for citizens. Lock them down, feed them hate for Trump. When he leaves, open the doors again.","{'neg': 0.27, 'neu': 0.73, 'pos': 0.0, 'compound': -0.83}"
5,2021-01-25 23:59:55+00:00,RT Yet another lie. I hope keep the tally of these lies. We know the MSM has decided they have n...,"{'neg': 0.113, 'neu': 0.769, 'pos': 0.117, 'compound': 0.0258}"
6,2021-01-25 23:59:55+00:00,RT hi good luck guys I hope you guys are safe from the virus please wear a mask and social distance! Thank you gl!,"{'neg': 0.0, 'neu': 0.513, 'pos': 0.487, 'compound': 0.944}"
7,2021-01-25 23:59:55+00:00,"RT I'd like to know if Steven Mnuchin will be investigated and charged with funneling $500B of PPP Covid relief loans, giv...","{'neg': 0.109, 'neu': 0.679, 'pos': 0.211, 'compound': 0.5719}"
8,2021-01-25 23:59:55+00:00,"Please pass Covid-19 relief bill first, before ye go after that corrupt tRump family. People need your help and the money from the stimulus checks now, as some don't have food on their tables. Thank you for all ye Democrats do for us. ","{'neg': 0.0, 'neu': 0.786, 'pos': 0.214, 'compound': 0.8625}"
9,2021-01-25 23:59:55+00:00,"RT Oh believe me, we know.","{'neg': 0.0, 'neu': 1.0, 'pos': 0.0, 'compound': 0.0}"
10,2021-01-25 23:59:55+00:00,"RT #Covid_19 :
If we can use the term ""British Variant"" and a ""South African Variant,"" then why are we reluctant to  refer to...","{'neg': 0.08, 'neu': 0.92, 'pos': 0.0, 'compound': -0.25}"
11,2021-01-25 23:59:55+00:00,"RT Here's where we stand with the race to get Americans fully #COVID19 vaccinated before ultra-contagious, possibly more d...","{'neg': 0.0, 'neu': 1.0, 'pos': 0.0, 'compound': 0.0}"
12,2021-01-25 23:59:55+00:00,RT It's called the City of Angels bc we are all going to die ,"{'neg': 0.231, 'neu': 0.769, 'pos': 0.0, 'compound': -0.5994}"
13,2021-01-25 23:59:55+00:00,Scary f-ing stuff.,"{'neg': 0.615, 'neu': 0.385, 'pos': 0.0, 'compound': -0.4939}"
14,2021-01-25 23:59:55+00:00,RT Day 1 of covid vaccine roll out. Well done to all involved  special thanks to and templemore staff. Approxim...,"{'neg': 0.0, 'neu': 0.688, 'pos': 0.312, 'compound': 0.7717}"
15,2021-01-25 23:59:55+00:00,RT These democratic tyrant governors and mayors now so excited to re-open... It's almost like they used the coronavirus pandemic...,"{'neg': 0.0, 'neu': 0.772, 'pos': 0.228, 'compound': 0.6512}"
16,2021-01-25 23:59:55+00:00,RT The 14-day change for new covid cases is down 17% in New York and 33% in the nation as a whole. Why isn't that on the eve...,"{'neg': 0.0, 'neu': 1.0, 'pos': 0.0, 'compound': 0.0}"
17,2021-01-25 23:59:55+00:00,RT White House: We can't guarantee COVID-19 relief by March - #OANN,"{'neg': 0.3, 'neu': 0.7, 'pos': 0.0, 'compound': -0.5096}"
18,2021-01-25 23:59:56+00:00,"RT I bet this is not going to be on our news at all! Oxford, AstraZeneca vaccine only applied recently to the EMA to be patent...","{'neg': 0.0, 'neu': 1.0, 'pos': 0.0, 'compound': 0.0}"
19,2021-01-25 23:59:56+00:00,"RT News story: Tom Brady's first year as Buccaneers QB began with his parents, Tom and Galynn, having tested positive for COVID...","{'neg': 0.0, 'neu': 0.854, 'pos': 0.146, 'compound': 0.5574}"
20,2021-01-25 23:59:56+00:00,"U.S. Senate confirms Janet Yellen as Treasury Secretary; first woman in history to hold the job. 

Her first task will be leading President Biden's effort to pass a $1.9 Trillion Covid relief package.","{'neg': 0.0, 'neu': 0.864, 'pos': 0.136, 'compound': 0.5994}"
21,2021-01-25 23:59:56+00:00,"Families: You can now download an app to track COVID data for FCPS. You can use the app to report cases as well. Stay up to date and download the free app by searching ""FCPS (KY) Matrix"".","{'neg': 0.0, 'neu': 0.866, 'pos': 0.134, 'compound': 0.6597}"
22,2021-01-25 23:59:56+00:00,RT Oh god. Here we go.,"{'neg': 0.0, 'neu': 0.704, 'pos': 0.296, 'compound': 0.2732}"
23,2021-01-25 23:59:56+00:00,"RT A group of psychologists in the UK accuse the government of utilizing tactics that ""amount[] to a strategic decision t...","{'neg': 0.083, 'neu': 0.917, 'pos': 0.0, 'compound': -0.2023}"
24,2021-01-25 23:59:56+00:00,"RT When I started writing this story about Tory links to the Invicta Academy, Tory MPs, councillors &amp; associates were described...","{'neg': 0.0, 'neu': 1.0, 'pos': 0.0, 'compound': 0.0}"
25,2021-01-25 23:59:56+00:00,Lots of emotion at the school board meeting tonight. Several speakers are pleading with the board to consider their educators when making decisions. One teacher (not pictured) says she recently resigned after 19 years because of safety concerns due to COVID-19.,"{'neg': 0.046, 'neu': 0.89, 'pos': 0.064, 'compound': 0.2023}"
26,2021-01-25 23:59:56+00:00,"RT Turn the machine off, save some electricity and give the ventilator to someone who deserves it and who isn't a murdering...","{'neg': 0.0, 'neu': 0.751, 'pos': 0.249, 'compound': 0.7678}"
27,2021-01-25 23:59:56+00:00,"RT WayV's Ten Falls And Yangyang Shoved After Being Mobbed By Fans--In A Pandemic

https://t.co/b7ESiRfyNP","{'neg': 0.0, 'neu': 1.0, 'pos': 0.0, 'compound': 0.0}"
28,2021-01-25 23:59:56+00:00,Great news praying they keep recovering and no affects later on. Let the healing begin for all your others there too... AMEN!! #COVID19  #Covid_19,"{'neg': 0.072, 'neu': 0.691, 'pos': 0.236, 'compound': 0.717}"
29,2021-01-25 23:59:56+00:00,"RT Wearing two masks instead of one is probably more effective to stop the spread of coronavirus, Dr. Anthony Fauci says
https://t...","{'neg': 0.095, 'neu': 0.773, 'pos': 0.131, 'compound': 0.2333}"
30,2021-01-25 23:59:56+00:00,RT California's Covid Strategy,"{'neg': 0.0, 'neu': 1.0, 'pos': 0.0, 'compound': 0.0}"
31,2021-01-25 23:59:56+00:00,RT Firm with Links to Matt Hancock's Family Awarded PS5.5 Million COVID Testing Deal - Byline Times,"{'neg': 0.0, 'neu': 0.856, 'pos': 0.144, 'compound': 0.4019}"
32,2021-01-25 23:59:56+00:00,RT My cousin just tested positive for covid. He lives with his senior citizen parents and a 4yo nephew. He got it from work....,"{'neg': 0.0, 'neu': 0.865, 'pos': 0.135, 'compound': 0.5574}"
33,2021-01-25 23:59:56+00:00,RT How odd that the Amazon/Bezos Washington Post won't call it the China Virus but will call it the UK variant.,"{'neg': 0.076, 'neu': 0.924, 'pos': 0.0, 'compound': -0.1655}"
34,2021-01-25 23:59:56+00:00,"RT What do COVID-19 vaccines mean for travel, and how will attitudes toward them affect the process of getting back on the r...","{'neg': 0.0, 'neu': 1.0, 'pos': 0.0, 'compound': 0.0}"
35,2021-01-25 23:59:56+00:00,"Another parent who spoke said two of her children's teachers left the district because of their concerns. Meanwhile, other speakers are asking the board to let students play sports. School officials called off the winter sports season due to COVID-19 safety concerns.","{'neg': 0.0, 'neu': 0.885, 'pos': 0.115, 'compound': 0.6369}"
36,2021-01-25 23:59:56+00:00,"RT Y'all are clearly more scared of the vaccine than Covid, and that truly has me flabbergasted.","{'neg': 0.14, 'neu': 0.614, 'pos': 0.246, 'compound': 0.3415}"
37,2021-01-25 23:59:56+00:00,so when are we killing this guy,"{'neg': 0.423, 'neu': 0.577, 'pos': 0.0, 'compound': -0.6597}"
38,2021-01-25 23:59:56+00:00,RT CONCERNING--Millions of doses of #COVID19 vaccine shipped by Trump WH/HHS are missing. Nobody knows why yet. Biden coronav...,"{'neg': 0.109, 'neu': 0.891, 'pos': 0.0, 'compound': -0.296}"
39,2021-01-25 23:59:56+00:00,"RT Moderna CMO: Currently Looking At Studying A Third Covid-19 Booster Shot 6 To 12 Months After Second Vaccine Shot, But Not...","{'neg': 0.0, 'neu': 1.0, 'pos': 0.0, 'compound': 0.0}"
40,2021-01-25 23:59:56+00:00,"RT Nunavut had gone nearly a month without a new case of COVID-19. Late last week, one case was discovered.

As of Monday, there...","{'neg': 0.0, 'neu': 1.0, 'pos': 0.0, 'compound': 0.0}"
41,2021-01-25 23:59:56+00:00,RT Seen it way too many times. The same people who criticise others for going out or socialising during lockdown are also the s...,"{'neg': 0.112, 'neu': 0.888, 'pos': 0.0, 'compound': -0.4404}"
42,2021-01-25 23:59:56+00:00,"RT Politifact is wrong too. They rate it ""mostly false"" while it is in fact COMPLETELY false because they misinterpret ""di...","{'neg': 0.134, 'neu': 0.866, 'pos': 0.0, 'compound': -0.4767}"
43,2021-01-25 23:59:56+00:00,Also whytf is Florida offering to host the olympics?! ITS A PANDEMIC. LEAVE ME OUT OF THE SUPER SPREADER EVENTS SHIT.,"{'neg': 0.225, 'neu': 0.617, 'pos': 0.159, 'compound': -0.2323}"
44,2021-01-25 23:59:56+00:00,RT Y'all see ppl in Atlanta clubbing &amp; think covid is magically gone. No.,"{'neg': 0.0, 'neu': 1.0, 'pos': 0.0, 'compound': 0.0}"
45,2021-01-25 23:59:56+00:00,"I just signed up. You can indicate your age and other details etc , if you are a healthcare worker..thank you for posting.","{'neg': 0.0, 'neu': 1.0, 'pos': 0.0, 'compound': 0.0}"
46,2021-01-25 23:59:57+00:00,"RT Michigan, Chicago, now California. 

It's almost as if the ""science"" changed, once Biden became president? How convenient...","{'neg': 0.0, 'neu': 1.0, 'pos': 0.0, 'compound': 0.0}"
47,2021-01-25 23:59:57+00:00,"The world's 10 richest billionaires could pay for everyone in the world to be vaccinated and still be more wealthy than they were at the start of the pandemic.
#VaccineStrategy #vaccines
https://t.co/csVFFahcsS","{'neg': 0.038, 'neu': 0.793, 'pos': 0.169, 'compound': 0.6997}"
48,2021-01-25 23:59:57+00:00,"RT Nobody is gonna have any patience, they wanna make up for lost time. First date questions will be ""do you love me?????????""","{'neg': 0.081, 'neu': 0.738, 'pos': 0.181, 'compound': 0.594}"
49,2021-01-25 23:59:57+00:00,"RT You have to be completely blind to not see what's going on here. Everyone, regardless of party, should be livid at wha...","{'neg': 0.222, 'neu': 0.685, 'pos': 0.092, 'compound': -0.5849}"
50,2021-01-25 23:59:57+00:00,RT Great Canadian Gaming CEO resigns after being charged in Yukon over attempt to get COVID-19 vaccine,"{'neg': 0.185, 'neu': 0.631, 'pos': 0.185, 'compound': 0.25}"
51,2021-01-25 23:59:57+00:00,"RT ""when covid is over"" is starting to sound a lot like ""we should hang out sometime!""","{'neg': 0.0, 'neu': 0.851, 'pos': 0.149, 'compound': 0.4199}"
52,2021-01-25 23:59:57+00:00,RT Call for Applications: is now accepting story pitches from Nigerian journalists keen to investigate the int...,"{'neg': 0.0, 'neu': 0.746, 'pos': 0.254, 'compound': 0.6249}"
53,2021-01-25 23:59:57+00:00,"RT Government is wasting time and prolonging lockdown by not implementing full mandatory quarantine and #ZeroCovid.

1 Mand...","{'neg': 0.197, 'neu': 0.803, 'pos': 0.0, 'compound': -0.4445}"
54,2021-01-25 23:59:57+00:00,Kinda wishing I was a Canadian rn,"{'neg': 0.0, 'neu': 0.789, 'pos': 0.211, 'compound': 0.1548}"
55,2021-01-25 23:59:57+00:00,RT Trey Songz's Physical Altercation with Cops Started After He Allegedly Refused to Wear a Mask,"{'neg': 0.128, 'neu': 0.872, 'pos': 0.0, 'compound': -0.296}"
56,2021-01-25 23:59:57+00:00,RT This is not going to be popular news as stated loosen restricrion following 4th #COVID19 peak in the US (with still crazy h...,"{'neg': 0.088, 'neu': 0.809, 'pos': 0.103, 'compound': 0.1027}"
57,2021-01-25 23:59:57+00:00,"RT #NowIsNotTheTime to travel! I get it, it's cold in #Canada; we've worked hard/missed much. Having plans foiled &amp; being ask...","{'neg': 0.0, 'neu': 1.0, 'pos': 0.0, 'compound': 0.0}"
58,2021-01-25 23:59:57+00:00,RT !! Study finds that uniform moratoria on evictions and utility shutoffs through November of last year could have saved *...,"{'neg': 0.0, 'neu': 0.855, 'pos': 0.145, 'compound': 0.5242}"
59,2021-01-25 23:59:57+00:00,"Hope to do the Solar Walk in the summer (COVID permitting). The nearby stone circle reminds us that fascination with the skies is ageless, but the constant light around us now has caused us to loose that intimacy, that close connection of the night sky to the patterns of our year","{'neg': 0.054, 'neu': 0.873, 'pos': 0.074, 'compound': 0.0258}"
60,2021-01-25 23:59:57+00:00,"RT Hey friends, with today's announcement that restaurants etc won't be open anytime soon, it's important we support local n...","{'neg': 0.0, 'neu': 0.691, 'pos': 0.309, 'compound': 0.765}"
61,2021-01-25 23:59:57+00:00,"RT Claire and Leo chatting like dear old chums having a bit of a catch up, as opposed the national broadcaster interrogating...","{'neg': 0.0, 'neu': 0.797, 'pos': 0.203, 'compound': 0.6249}"
62,2021-01-25 23:59:57+00:00,"RT I want Democrats to ram the COVID Relief Bill through like its name was ""Amy Coney Barrett""","{'neg': 0.0, 'neu': 0.685, 'pos': 0.315, 'compound': 0.7096}"
63,2021-01-25 23:59:57+00:00,"RT President Biden says anyone who wants a COVID vaccine will be able to get a COVID vaccine by ""this spring.""","{'neg': 0.0, 'neu': 1.0, 'pos': 0.0, 'compound': 0.0}"
64,2021-01-25 23:59:57+00:00,Lockdown to last until at least Good Friday as PM makes 'top secret' Easter plan,"{'neg': 0.0, 'neu': 0.734, 'pos': 0.266, 'compound': 0.5719}"
65,2021-01-25 23:59:57+00:00,"14 years in. Umpteen opposition leaders have come and gone. Huge amount of policy delivered, leadership shown &amp; NS voted most trusted politician in UK vis-a-vis Covid19 but it's the SNP trying deflection? Very good Jamie, the UK over those same 14 years had imploded. We see you.","{'neg': 0.0, 'neu': 0.847, 'pos': 0.153, 'compound': 0.7984}"
66,2021-01-25 23:59:57+00:00,I might not be doing great cause of covid but I'm glad how far I made it and the good people in my life that keeps me going,"{'neg': 0.061, 'neu': 0.714, 'pos': 0.224, 'compound': 0.7719}"
67,2021-01-25 23:59:57+00:00,"RT these two been on the Titanic, they would have thrown the children overboard to get seats in one...","{'neg': 0.0, 'neu': 1.0, 'pos': 0.0, 'compound': 0.0}"
68,2021-01-25 23:59:58+00:00,RT Go on. Look at Nikola Jokic. Out here still committed to social distancing. What an example.,"{'neg': 0.0, 'neu': 0.884, 'pos': 0.116, 'compound': 0.2732}"
69,2021-01-25 23:59:58+00:00,RT It is deeply concerning that a case of the COVID-19 variant from the UK has been identified in Alberta without links to i...,"{'neg': 0.0, 'neu': 1.0, 'pos': 0.0, 'compound': 0.0}"
70,2021-01-25 23:59:58+00:00,"RT California will END its stay-at-home orders today.

Chicago reopened indoor dining last week.

Michigan will allow restaur...","{'neg': 0.0, 'neu': 0.899, 'pos': 0.101, 'compound': 0.2263}"
71,2021-01-25 23:59:58+00:00,"RT I want Democrats to ram the COVID Relief Bill through like its name was ""Amy Coney Barrett""","{'neg': 0.0, 'neu': 0.685, 'pos': 0.315, 'compound': 0.7096}"
72,2021-01-25 23:59:58+00:00,"C'mon JC ! It came from ...... CHINA .... jesus christ . China unleashed hell on the world and your worried bout calling it ""china virus"" ? Sweet jesus !","{'neg': 0.198, 'neu': 0.722, 'pos': 0.08, 'compound': -0.658}"
73,2021-01-25 23:59:58+00:00,"RT Come on NBA, you don't need an All-Star game in the middle of a pandemic.","{'neg': 0.0, 'neu': 1.0, 'pos': 0.0, 'compound': 0.0}"
74,2021-01-25 23:59:58+00:00,Covid has  just shown us that being unpopular introverts is a winning lifestyle after all,"{'neg': 0.0, 'neu': 0.805, 'pos': 0.195, 'compound': 0.5267}"
75,2021-01-25 23:59:58+00:00,RT Wild that the mayor of the state's largest city says he heard about Newsom ending the stay-at-home order at the same time...,"{'neg': 0.0, 'neu': 1.0, 'pos': 0.0, 'compound': 0.0}"
76,2021-01-25 23:59:58+00:00,"RT So I think that is spiraling out of control. He's lacking in executive management skills, and has not surroun...","{'neg': 0.0, 'neu': 1.0, 'pos': 0.0, 'compound': 0.0}"
77,2021-01-25 23:59:58+00:00,"RT Don't tell me we can't afford the hospitals, schools &amp; communities we deserve.

Don't tell we can't afford the services chil...","{'neg': 0.0, 'neu': 1.0, 'pos': 0.0, 'compound': 0.0}"
78,2021-01-25 23:59:58+00:00,Jay we expect you in Brazil when the pandemic is over.  We love you ..,"{'neg': 0.0, 'neu': 0.769, 'pos': 0.231, 'compound': 0.6369}"
79,2021-01-25 23:59:58+00:00,"RT If EU blocks *any* exports to the UK of a vaccine the UK Govt helped fund, mainly for the benefit of dev...","{'neg': 0.073, 'neu': 0.811, 'pos': 0.116, 'compound': 0.2732}"
80,2021-01-25 23:59:58+00:00,"RT California will END its stay-at-home orders today.

Chicago reopened indoor dining last week.

Michigan will allow restaur...","{'neg': 0.0, 'neu': 0.899, 'pos': 0.101, 'compound': 0.2263}"
81,2021-01-25 23:59:58+00:00,"if I ask really nicely maybe the pandemic will disappear, just for me","{'neg': 0.118, 'neu': 0.684, 'pos': 0.198, 'compound': 0.3167}"
82,2021-01-25 23:59:58+00:00,"RT Picks up huge sign saying ""AEROSOL TRANSMISSION"".","{'neg': 0.0, 'neu': 0.753, 'pos': 0.247, 'compound': 0.3182}"
83,2021-01-25 23:59:58+00:00,"RT Obama era strategy redux: Promise something on the campaign trail, immediately propose a watered down version once elect...","{'neg': 0.0, 'neu': 0.887, 'pos': 0.113, 'compound': 0.3182}"
84,2021-01-25 23:59:58+00:00,"RT 308 days after New Zealand...

311 days after Australia...

360 days after the first UK Covid case...

The UK finally c...","{'neg': 0.0, 'neu': 1.0, 'pos': 0.0, 'compound': 0.0}"
85,2021-01-25 23:59:59+00:00,Why tf the stay at home order got lifted??!,"{'neg': 0.0, 'neu': 1.0, 'pos': 0.0, 'compound': 0.0}"
86,2021-01-25 23:59:59+00:00,"RT let's pass on the All-Star game this year, fellas... 

The NBA has the resources to provide support for HBCU's and...","{'neg': 0.0, 'neu': 0.881, 'pos': 0.119, 'compound': 0.4019}"
87,2021-01-25 23:59:59+00:00,RT 2020 is always going to be that year in our history when all humanity decided we can easily stop respirator...,"{'neg': 0.093, 'neu': 0.805, 'pos': 0.102, 'compound': 0.0516}"
88,2021-01-25 23:59:59+00:00,"Baby boom, baby bust, whatever. If Americans were speeding in the fast lane pedal to the floor mayne trying to get back to her love we'd be having Bust It Babies everywhere","{'neg': 0.0, 'neu': 0.881, 'pos': 0.119, 'compound': 0.6369}"
89,2021-01-25 23:59:59+00:00,RT Higher education will be a critical component of rebuilding a thriving business community post-pandemic. The MEC space is...,"{'neg': 0.113, 'neu': 0.887, 'pos': 0.0, 'compound': -0.3182}"
90,2021-01-25 23:59:59+00:00,love this wish for a day im able to protest along side my mob,"{'neg': 0.101, 'neu': 0.553, 'pos': 0.347, 'compound': 0.7096}"
91,2021-01-25 23:59:59+00:00,"RT Just voted to confirm as Treasury Secretary.

Continuing phone calls with Georgia public health and local gov lead...","{'neg': 0.0, 'neu': 0.909, 'pos': 0.091, 'compound': 0.2023}"
92,2021-01-25 23:59:59+00:00,"RT Put another way, if lockdowns made the world's richest ten people half a trillion dollars POORER does anyone seriously thi...","{'neg': 0.187, 'neu': 0.684, 'pos': 0.129, 'compound': -0.1363}"
93,2021-01-25 23:59:59+00:00,"If Hillary was president when the Pandemic hit 
Republican Governors would not have purposely closed their State's down to help win an election 
Republicans souls are not evil enough to do that 
And I would not have supported it","{'neg': 0.042, 'neu': 0.745, 'pos': 0.213, 'compound': 0.8424}"
94,2021-01-25 23:59:59+00:00,A corporation's primary focus in a post-pandemic world should be #SocialJustice #DavosAgenda Thank you,"{'neg': 0.0, 'neu': 0.839, 'pos': 0.161, 'compound': 0.3612}"
95,2021-01-25 23:59:59+00:00,RT BREAKING--First U.S. case of highly transmissible Brazil  coronavirus variant identified of the so-called #P1 variant--invo...,"{'neg': 0.0, 'neu': 1.0, 'pos': 0.0, 'compound': 0.0}"
96,2021-01-25 23:59:59+00:00,"Respected sir!
Are you talking world wide? Already we are at 100,243,110 cases, world wide, sir!","{'neg': 0.0, 'neu': 0.803, 'pos': 0.197, 'compound': 0.5696}"
97,2021-01-25 23:59:59+00:00,"RT In my dystopian novel, a political party desperately tries to hide the fact that several of their staffers travelled abroad...","{'neg': 0.163, 'neu': 0.646, 'pos': 0.19, 'compound': 0.1779}"
98,2021-01-25 23:59:59+00:00,"RT Yesterday 0 locally acquired cases were reported, 1 in hotel quarantine. It's been 20 days since the last locally acquired...","{'neg': 0.0, 'neu': 1.0, 'pos': 0.0, 'compound': 0.0}"
99,2021-01-25 23:59:59+00:00,RT TREVOR KAVANAGH: Don't let the moaners needle you - Britain's Covid jab rollout is the envy of the world,"{'neg': 0.1, 'neu': 0.9, 'pos': 0.0, 'compound': -0.2732}"
100,2021-01-25 23:59:59+00:00,"RT ""The EU has threatened to block exports of coronavirus vaccines to countries outside the bloc such as Britain""

This c...","{'neg': 0.237, 'neu': 0.763, 'pos': 0.0, 'compound': -0.7096}"
101,2021-01-25 23:59:59+00:00,RT BREAKING: Democratic Governor Gavin Newsom chooses profit over human lives.,"{'neg': 0.0, 'neu': 0.775, 'pos': 0.225, 'compound': 0.4404}"
102,2021-01-25 23:59:59+00:00,RT Joining as we watch the now familiar ritual of the House walking the article of impeachment to the Senate...,"{'neg': 0.0, 'neu': 1.0, 'pos': 0.0, 'compound': 0.0}"
103,2021-01-25 23:59:59+00:00,"RT Get the COVID vaccine. It is effective, safe, and not part of a laughably absurd conspiracy to monitor your movements. B...","{'neg': 0.115, 'neu': 0.608, 'pos': 0.277, 'compound': 0.5859}"
104,2021-01-25 23:59:59+00:00,"RT Just voted to confirm as Treasury Secretary.

Continuing phone calls with Georgia public health and local gov lead...","{'neg': 0.0, 'neu': 0.909, 'pos': 0.091, 'compound': 0.2023}"
105,2021-01-25 23:59:59+00:00,RT Joe Biden insisted during campaign he had a pandemic plan. Now he says there's 'nothing' the U.S. can do to counteract...,"{'neg': 0.0, 'neu': 1.0, 'pos': 0.0, 'compound': 0.0}"
106,2021-01-25 23:59:59+00:00,"Love having some throwbacks recently, getting nostalgic growing a year older (1/2)","{'neg': 0.0, 'neu': 0.629, 'pos': 0.371, 'compound': 0.7096}"
107,2021-01-25 23:59:59+00:00,RT STAYCATION Pandemic Horror Film w #StarTrek #NOTC #...,"{'neg': 0.316, 'neu': 0.684, 'pos': 0.0, 'compound': -0.5719}"
108,2021-01-25 23:59:59+00:00,"If grandma gets vaccinated, won't she be protected from little Joey? Wouldn't FaceTimeing with grandma make more sense than closing schools? How has grandma protected herself from every other pandemic? I'm 62, I don't fear little Joey or Covid.  This is child abuse.","{'neg': 0.138, 'neu': 0.755, 'pos': 0.107, 'compound': -0.3855}"
109,2021-01-25 23:59:59+00:00,"RT Anyway, the upshot of all this is: if the govt meets its Cat 1-4 vaxx target by Feb 15th (as now seems v likely) there c...","{'neg': 0.0, 'neu': 1.0, 'pos': 0.0, 'compound': 0.0}"
110,2021-01-25 23:59:59+00:00,RT wheeler sure goes out to a lot of restaurants during a deadly pandemic,"{'neg': 0.0, 'neu': 0.85, 'pos': 0.15, 'compound': 0.3182}"
111,2021-01-25 23:59:59+00:00,RT These democratic tyrant governors and mayors now so excited to re-open... It's almost like they used the coronavirus pandemic...,"{'neg': 0.0, 'neu': 0.772, 'pos': 0.228, 'compound': 0.6512}"
112,2021-01-25 23:59:59+00:00,"RT I'd like to know if Steven Mnuchin will be investigated and charged with funneling $500B of PPP Covid relief loans, giv...","{'neg': 0.109, 'neu': 0.679, 'pos': 0.211, 'compound': 0.5719}"
113,2021-01-26 00:00:00+00:00,"""Wear a mask for your peeps!"" - Lori
 
We couldn't have said it better ourselves. Thanks, Lori! #GotMaskOK","{'neg': 0.0, 'neu': 0.715, 'pos': 0.285, 'compound': 0.7494}"
114,2021-01-26 00:00:00+00:00,RT I would participate in SantaCon if meant the pandemic would end right at this very moment,"{'neg': 0.0, 'neu': 1.0, 'pos': 0.0, 'compound': 0.0}"
115,2021-01-26 00:00:00+00:00,"134 more people test positive, 1 dies from COVID-19 in Northwestern Wisconsin","{'neg': 0.0, 'neu': 0.74, 'pos': 0.26, 'compound': 0.5945}"
116,2021-01-26 00:00:00+00:00,"If the latest variant of COVID was decimating white males between 43 and 65, who are 12-35 lbs. overweight, we would have vaccines door to door. Next Monday.","{'neg': 0.085, 'neu': 0.915, 'pos': 0.0, 'compound': -0.3612}"
117,2021-01-26 00:00:00+00:00,"RT An important response by many Members to #Covid19-driven #humanitarian needs:

...committing:

""not to impose export prohi...","{'neg': 0.0, 'neu': 0.737, 'pos': 0.263, 'compound': 0.4567}"
118,2021-01-26 00:00:00+00:00,RT It's called the City of Angels bc we are all going to die ,"{'neg': 0.231, 'neu': 0.769, 'pos': 0.0, 'compound': -0.5994}"
119,2021-01-26 00:00:00+00:00,"RT We are still waiting for Chen Qiushi's return. Until he reappears, we will keep on counting the days.

Chen Qiushi has b...","{'neg': 0.0, 'neu': 1.0, 'pos': 0.0, 'compound': 0.0}"
120,2021-01-26 00:00:00+00:00,Nothing more 'Christ-like' than putting the elderly at risk and disregarding your neighbours/community by gathering illegally mid-pandemic without masks on.,"{'neg': 0.182, 'neu': 0.818, 'pos': 0.0, 'compound': -0.4588}"
121,2021-01-26 00:00:00+00:00,"Pope Francis talks about the growing crisis of homelessness and prayed for a homeless man, who was found dead near St. Peter's Square.
Read more... #PopeFrancis #COVID19 #coronavirus","{'neg': 0.239, 'neu': 0.712, 'pos': 0.048, 'compound': -0.8271}"
