,created_at,full_text,sentiment_score
118,2021-01-08 19:00:00+00:00,"Singapore Prime Minister Lee Hsien Loong received his first shot of a Covid-19 vaccine on Friday

https://t.co/468JgngFyB","{'neg': 0.0, 'neu': 1.0, 'pos': 0.0, 'compound': 0.0}"
119,2021-01-08 19:00:00+00:00,"DD Dynamite's 'Dagger Heart' was made on an ultra-limited recording set up where background noise is clearly audible and bird calls bleed into the mix. Lockdown studio experimentation.

Click this link to listen on Apple Music and tell us what you think:","{'neg': 0.0, 'neu': 0.853, 'pos': 0.147, 'compound': 0.7845}"
120,2021-01-08 19:00:00+00:00,"""Friday, the 13th, March 2020 was a four day call. We started that call Friday morning and we didn't get off of it until Monday night."" Kansas state CTO Stacy Mill on the start of the pandemic in Kansas. #NASCIOvoices

https://t.co/nnhYDEVU2R","{'neg': 0.0, 'neu': 1.0, 'pos': 0.0, 'compound': 0.0}"
121,2021-01-08 19:00:00+00:00,Please do not turn up to any of the COVID-19 vaccination sites without an appointment. The NHS in Barnsley is working to contact all residents over 80 as more vaccines become available. We will call you when it is your turn.,"{'neg': 0.0, 'neu': 0.946, 'pos': 0.054, 'compound': 0.3182}"
122,2021-01-08 19:00:00+00:00,"Anchorage will open a mass vaccination clinic at the Alaska Airlines Center this weekend for residents eligible for the current phase of vaccinations. 

https://t.co/Bmx18qeN6S","{'neg': 0.0, 'neu': 1.0, 'pos': 0.0, 'compound': 0.0}"
123,2021-01-08 19:00:00+00:00,She pretty much summed up everyone's mood right there,"{'neg': 0.0, 'neu': 0.714, 'pos': 0.286, 'compound': 0.4939}"
124,2021-01-08 19:00:00+00:00,"RT I used to go all over the country, Asia and Canada, but now I can't go because of my illness. I have given up because of fea...","{'neg': 0.116, 'neu': 0.884, 'pos': 0.0, 'compound': -0.5499}"
125,2021-01-08 19:00:00+00:00,"The Lockes and the Downs are back!

They're here to make things clear if you're unsure about what the National Tier 5 Lockdown rules mean for you and your loved ones. 

Stay safe, and we'll get through this again, together.","{'neg': 0.042, 'neu': 0.755, 'pos': 0.203, 'compound': 0.8268}"
126,2021-01-08 19:00:00+00:00,"With face-to-face interaction limited by COVID-19, many of us are missing the human connectivity that's crucial to our happiness. Give yourself a few minutes to watch four stories from our Video Arts program of meaningful connections:","{'neg': 0.098, 'neu': 0.762, 'pos': 0.14, 'compound': 0.4215}"
127,2021-01-08 19:00:00+00:00,Sports teams around the country and their fans simply LOVE Steve Max's hilarious and outrageous Halftime Simon Sez Challenge. Plus he now has a new pandemic-friendly Zoom version. Read more here:,"{'neg': 0.077, 'neu': 0.693, 'pos': 0.229, 'compound': 0.7125}"
128,2021-01-08 19:00:00+00:00,"While the Animal Education Centre may be closed, we have a variety of activity resources on our website to keep children entertained*, educated and inspired during lockdown. 

Visit to download all of our Activity Guides

*Warning it may get messy at home!","{'neg': 0.1, 'neu': 0.774, 'pos': 0.126, 'compound': 0.3164}"
129,2021-01-08 19:00:00+00:00,"PODCAST  What do the shocking scenes on Capitol Hill tell us about the fragility of democracies who come up against leaders who reject the rules? Guest joins us to discuss. And we look at coronavirus vaccine rollout and government in 2021
https://t.co/6vO9HTzGdo","{'neg': 0.119, 'neu': 0.881, 'pos': 0.0, 'compound': -0.6597}"
130,2021-01-08 19:00:00+00:00,"#Brazil's government signed a deal with Sao Paulo's Butantan Institute to buy the full output of a Chinese Sinovac #COVID19 #vaccine it is producing, with an initial provision of 46 million doses. The announcement came shortly after Brazil's COVID death toll passed 20,000.","{'neg': 0.085, 'neu': 0.915, 'pos': 0.0, 'compound': -0.5994}"
131,2021-01-08 19:00:00+00:00,"Thayer County Covid-19 Risk Dial update
for the week of 1-01-2021 to 01-15-2021","{'neg': 0.149, 'neu': 0.851, 'pos': 0.0, 'compound': -0.2732}"
132,2021-01-08 19:00:00+00:00,"We understand the cost and reputation pressures construction businesses are facing and why the right #accesscontrol #turnstiles are so important: for #security and #efficiency, not to mention #Covid19 compliance.","{'neg': 0.066, 'neu': 0.718, 'pos': 0.216, 'compound': 0.6405}"
133,2021-01-08 19:00:00+00:00,Time Boris Johnson and Rishi Sunak make amends for their shortcomings | Ian McConnell,"{'neg': 0.0, 'neu': 1.0, 'pos': 0.0, 'compound': 0.0}"
134,2021-01-08 19:00:00+00:00,RT Is the Nigerian government going to address how pantami added to this pantamic with the NIN mess? How are we in a pantami...,"{'neg': 0.098, 'neu': 0.902, 'pos': 0.0, 'compound': -0.3612}"
135,2021-01-08 19:00:00+00:00,"According to Over 1,000 new cases of #COVID19 were reported on First Nations reserves over the last week, according to the latest data from Indigenous Services Canada:","{'neg': 0.0, 'neu': 1.0, 'pos': 0.0, 'compound': 0.0}"
136,2021-01-08 19:00:00+00:00,"RT TYSON needs a fosterer! He is so cute! These dogs are VERY loving and cuddly. In this Covid time, I can't hug anybody but...","{'neg': 0.06, 'neu': 0.739, 'pos': 0.201, 'compound': 0.6373}"
137,2021-01-08 19:00:00+00:00,Interested in how we'll redefine work after #COVID19? Deloitte's provides insights from his new book #WorkDisrupted with Shobhana Viswanathan on The Change Alchemist Podcast.,"{'neg': 0.0, 'neu': 0.895, 'pos': 0.105, 'compound': 0.4019}"
138,2021-01-08 19:00:00+00:00," The reopening of restaurants in #France  has once again been delayed amid the #Covid19 crisis, forcing many to continue to depend on deliveries and government handouts for survival. 

But according to restaurateurs this is far from being enough","{'neg': 0.1, 'neu': 0.9, 'pos': 0.0, 'compound': -0.4588}"
139,2021-01-08 19:00:00+00:00,"Premier League to punish COVID-rule breaches, 10 Aston Villa players positive","{'neg': 0.212, 'neu': 0.562, 'pos': 0.225, 'compound': 0.0516}"
140,2021-01-08 19:00:00+00:00,"""We were notified that if one person in the entire apartment complex tested positive, then all residents would have to do an in-house 14-day quarantine"" --an American in Shijiazhuang, Hebei province, where there was an outbreak of COVID-19 this week:","{'neg': 0.0, 'neu': 0.915, 'pos': 0.085, 'compound': 0.5574}"
141,2021-01-08 19:00:01+00:00,"We're reporting 6 new cases of COVID-19 today. There are currently 27 active cases. 6 more cases have resolved since yesterday. Check out our updated COVID-19 Dashboard:      

Help #StopTheSpreadHPE by continuing to follow public health advice. #StayHome","{'neg': 0.0, 'neu': 0.822, 'pos': 0.178, 'compound': 0.7479}"
142,2021-01-08 19:00:01+00:00,"Fox News anchor Martha MacCallum stated that the breaching police barricades and causing a lockdown at the US Capitol were ""a huge victory"" for pro-Trump protesters. But she did condemn the illegal acts as wrong.","{'neg': 0.305, 'neu': 0.659, 'pos': 0.036, 'compound': -0.9224}"
143,2021-01-08 19:00:01+00:00,Always appreciate the efforts from and for providing #OnlineCougs with resources specific to their needs during #COVID19. Check out financial &amp; wellness resources at,"{'neg': 0.0, 'neu': 0.797, 'pos': 0.203, 'compound': 0.6808}"
144,2021-01-08 19:00:01+00:00,BOBSA STARTER KET COVID 19,"{'neg': 0.0, 'neu': 1.0, 'pos': 0.0, 'compound': 0.0}"
