,created_at,full_text,sentiment_score
0,2021-02-22 08:59:54+00:00,powerful commitment reiteration currently ongoing plenary stellar example role nature play sustainabledevelopment sustainable recovery plan accelerate transition inclusive healthy future,0.21000000000000002
1,2021-02-22 08:59:54+00:00,grim milestone we pass love one lose many life could save,0.0
2,2021-02-22 08:59:55+00:00,congratulation baseball champions taiwan pandemic put halt professional sport,0.1
3,2021-02-22 08:59:55+00:00,fat phobia bad people mad fat people qualify covid vaccine thin people happen c,-0.5749999999999998
4,2021-02-22 08:59:55+00:00,sound familiar like bc denmark israel austria italy kids outbreak see,0.3875
5,2021-02-22 08:59:55+00:00,we ve tell repeatedly medium listen science however youtube think discussion two medic,0.0
6,2021-02-22 08:59:55+00:00,readiness another lockdown july,0.0
7,2021-02-22 08:59:55+00:00,cipd comment late labour market outlook survey show employer strong intention since start pandemic,0.06666666666666665
8,2021-02-22 08:59:55+00:00,matt hancock find guilty break law pandemic decision cost live nhs workers amp fill bank account friend amp rich tory donorsat least go parliament apologise resign posthancockmustgo,-0.07215909090909091
9,2021-02-22 08:59:55+00:00,hope,0.0
10,2021-02-22 08:59:55+00:00,awesomei think perfect example toxic masculinity huge pssy,0.7000000000000001
11,2021-02-22 08:59:55+00:00,btw see discussion parent discuss covid learning loss etc last year imply want,0.0
12,2021-02-22 08:59:55+00:00,way ill feel safe go back college march mps fully return parliament tha,0.0
13,2021-02-22 08:59:56+00:00,alhamdulillah work agentbased modeling got publish cognitive computation journal work special work mentor talented undergraduate student first timehttpstconoinitrzem,0.4357142857142857
14,2021-02-22 08:59:56+00:00,today honor address scientific conference migration ampdisplacement organise c,0.0
15,2021-02-22 08:59:56+00:00,lowkey scare take vaccine nah,0.0
16,2021-02-22 08:59:56+00:00,course afraid coup way frightening virus that s road today burma rev,-0.55
17,2021-02-22 08:59:56+00:00,one bizarre amp troubling bit reopeningschools saga amp ign,0.4
18,2021-02-22 08:59:56+00:00,might another reason they re curve nope deal around freak world,0.0
19,2021-02-22 08:59:56+00:00,scottish employer report strong employment intention since onset coronavirus pandemic,0.4333333333333333
20,2021-02-22 08:59:56+00:00,gov bello allocate suspicious deny virus exist,0.0
21,2021-02-22 08:59:56+00:00,would love see cop cart coviddenying protester cell flagrant rulebreake unfortunately nz way covid rule seem involve education make rabid conspiracist martyr,0.0
22,2021-02-22 08:59:57+00:00,pls share getting vaccinate ramadan permissible ramadan start april last may,0.0
23,2021-02-22 08:59:57+00:00,although government meet online minister test government decide million u,0.0
24,2021-02-22 08:59:57+00:00,believe mask stay mask,0.0
25,2021-02-22 08:59:57+00:00,two state maharashtra kerala constitute percent total daily covid case rest india le,0.0
26,2021-02-22 08:59:57+00:00,mervs proposallockdown supporter stay lockdown indefinitely wantthe rest we want everything back ope,0.0
27,2021-02-22 08:59:57+00:00,onei dream live weird dictatorship run drug addle snow board instructor pay,-0.18181818181818182
28,2021-02-22 08:59:57+00:00,early last time also look country deal lockdown come bthe infection death rate still high must much lower stable,0.115
29,2021-02-22 08:59:57+00:00,medical student contemplatingattempte suicide witness many death be not wake call c,0.25
30,2021-02-22 08:59:58+00:00,every day rise challenge improve live employee ensure safety well,0.13636363636363635
31,2021-02-22 08:59:58+00:00,business across england anxiously await roadmap lockdown ease today many firm limbo,0.016666666666666663
32,2021-02-22 08:59:58+00:00,kabaret close lockdown due pandemic dweller resort meet discord instead,-0.125
33,2021-02-22 08:59:58+00:00,look line wrap around block tell keep call black folk vaccine hesitant reason b,-0.16666666666666666
34,2021-02-22 08:59:58+00:00,kilimanjaro live boss believe will not safe book major tour april cite much uncertainty term social distancing travel insurance make major event viabledo agreeeventsindustry eventsafety crowdsafety httpstcogkfvuuornl,0.04078282828282828
35,2021-02-22 08:59:58+00:00,may take trophy home million heart heart stay foreverw,0.0
36,2021-02-22 08:59:58+00:00,like post please help we grow share social mediawebsite kid,0.03333333333333333
37,2021-02-22 08:59:58+00:00,today expect govt announce plan admit pupil school ask do measu,0.0
38,2021-02-22 08:59:58+00:00,can not get past fact year old drug addict sexual predator bankrupt every biz ever run c,0.11666666666666665
39,2021-02-22 08:59:58+00:00,hello facebook page able state bit please check first yes still investigate assault criminal damage dozen moto x rider fine breach coronavirus lockdown travel area owner track also,0.19166666666666665
40,2021-02-22 08:59:58+00:00,be not tragic pune city report big surge covid case time serum institute locate cit,0.1875
41,2021-02-22 08:59:58+00:00,heres whole article stanford,0.2
42,2021-02-22 08:59:58+00:00,half million people die covid country could avoid that s go one,-0.16666666666666666
43,2021-02-22 08:59:59+00:00,biden pledge billion help get poor country vaccinate,-0.4
44,2021-02-22 08:59:59+00:00,public accustomed tory sleaze hancock get away like jenrick amp cummings break lock,0.0
45,2021-02-22 08:59:59+00:00,pandemic make hospital even large target malicious cyber threat alreadyakamai amp offer nocost ransomware protection service digitalhealth cybersecurity healthdata,0.21428571428571427
46,2021-02-22 08:59:59+00:00,organization pandemic expose vulnerability relate ransomware phishe campaignsthis article mustread anyone wish understand build security resilience healthcare postpandemichttpstcokoyotjhyur,0.0
47,2021-02-22 08:59:59+00:00,lockdown need spell end fitness journey continue fitness regime learn run,0.0
48,2021-02-22 08:59:59+00:00,nice work gerry harvey jobkeeper largesse time record profit httpstcoiwli,0.6
49,2021-02-22 08:59:59+00:00,surge testing start part leed two possible case south african variant detect city,0.0
50,2021-02-22 08:59:59+00:00,nice potus hold moment silence mourn half million americans die need,0.21666666666666667
51,2021-02-22 08:59:59+00:00,stop transmission occupy palestine mostly israel deny vaccine palestinians,0.5
52,2021-02-22 08:59:59+00:00,scene thailand bangkok un hq least myanmar migrant worker turn oppose militarycoup,-0.3
53,2021-02-22 08:59:59+00:00,chris potts explain technology play vital role help organisation go beyond what s recommend covidsecure guideline order protect employee reduce rate transmission read,0.1
54,2021-02-22 08:59:59+00:00,should not priority vulnerable severe illness even death covid,-0.5
55,2021-02-22 08:59:59+00:00,redesign office layout era social distancing cre office layout design httpstconnwnbqqerh,0.03333333333333333
56,2021-02-22 08:59:59+00:00,quarter teenager show sign depression covid pandemic take toll happen ou,0.0
57,2021-02-22 08:59:59+00:00,inexplicable sweden do not one even debate,-0.6
58,2021-02-22 09:00:00+00:00,british airways defer pension payment sector grapple covid,0.0
59,2021-02-22 09:00:00+00:00,evidence existence thenovel april,0.0
60,2021-02-22 09:00:00+00:00,also eagerly await mr johnsons announcement,0.0
61,2021-02-22 09:00:00+00:00,nhs set mental health hub staff traumatise covid mentalhealth nhs,-0.1
62,2021-02-22 09:00:00+00:00,antonio cervantes bring valentine day gift grave wife gabriela die covid cemetery,0.0
63,2021-02-22 09:00:00+00:00,wednesday join hear experience mental health nurse pandemic,-0.1
64,2021-02-22 09:00:00+00:00,income support helpline open today pandemic unemployment payment remain available anyone eligiblethe quick amp easiest way apply online,0.24444444444444446
65,2021-02-22 09:00:00+00:00,mess go lockdown he s mess everything since start unfit lead open school time massive mistake johnsonhasfailedthenation,-0.0875
66,2021-02-22 09:00:00+00:00,submit new contactless method contacttrace filling sheet form need share pen create safe environment allcheck pandemic safety,0.3181818181818182
67,2021-02-22 09:00:00+00:00,release comparative study impact defense policy european country corentinbr,0.0
68,2021-02-22 09:00:00+00:00,area hull covid rate actually rise,0.0
69,2021-02-22 09:00:00+00:00,find enhance regional cooperationespecially health trade finance disaster riskwill accelerate economic growth asia pacific spur recovery pandemic read,0.2
70,2021-02-22 09:00:00+00:00,careful share thing be not always seem online protect friend false information coronavirus vaccination use share checklist help spot false information,-0.30000000000000004
71,2021-02-22 09:00:00+00:00,giveandtake situation long curfew potential freedom,-0.025
72,2021-02-22 09:00:00+00:00,idea lad would case survive per week,0.0
73,2021-02-22 09:00:00+00:00,number worker furlough reach million current lockdown less half number work past six month other lose job expiry scheme april mean redundancy,-0.17013888888888887
74,2021-02-22 09:00:00+00:00,intimacy affect,0.0
75,2021-02-22 09:00:00+00:00,customer expect wine menu reopen look emerge trend wine might affect sale postlockdown hospitality hospitalityindustry wine,0.0
76,2021-02-22 09:00:00+00:00,staff set food bank help distribute supply pupil family struggle financially lockdownand need helphttpstcoxvmeoujrvv,0.0
77,2021-02-22 09:00:00+00:00,dan james want celebrate like maniac good nothing wrong bit passion can not get excited covid tv football nonsense clearly be not football without fan nothing,0.13124999999999998
78,2021-02-22 09:00:00+00:00,profoundly disagree threshold minister resign anger,-0.3083333333333333
79,2021-02-22 09:00:00+00:00,rector university indonesia ui professor ari kuncoro highlight importance make promote strategic policy effectively efficiently enable limited resource cope impact covid,0.2642857142857143
80,2021-02-22 09:00:00+00:00,staff work hard look animal,-0.2916666666666667
81,2021-02-22 09:00:00+00:00,fantastic way keep touch grandparent current lockdown send lovedones talk photo album orderyour use photo record message talk dementiasupport dementia alzheimer,0.2
82,2021-02-22 09:00:00+00:00,pharmacy help treat noncoronaviru symptom minor ailment winter new pharmacy first service provide medicine counter winter without need see gp,0.11212121212121212
83,2021-02-22 09:00:00+00:00,syringe unitetheunion trade union urge government rule nojabnojob contract employer aim force worker vaccination condition employmentvia unitelive downward,0.0
84,2021-02-22 09:00:00+00:00,meet teamwe think lockdown would great time meet avant skills academy team meettheteammonday daveavantskills apprenticeship traineeship,0.8
85,2021-02-22 09:00:00+00:00,even upliftone six new universalcredit claimant force skip meal evidence suggest uplift inadequate remove questionread,0.13636363636363635
86,2021-02-22 09:00:00+00:00,right lawyer yesterday say pandemic expose flaw countrys social protection system catastrophic impact citizen,0.1595238095238095
87,2021-02-22 09:00:00+00:00,case lockdown build intellectual dishonesty,0.3
88,2021-02-22 09:00:00+00:00,icymi gov visit mobile vaccine site los angeles county sunday highlight states effort vaccinate hardtoreach community,0.0
89,2021-02-22 09:00:00+00:00,time since lockdown announce nothing new put place school mitigate transmission possi,0.13636363636363635
90,2021-02-22 09:00:00+00:00,enjoy pureshoppingpleasure practise social distancing shop we,0.21666666666666667
91,2021-02-22 09:00:00+00:00,prime minister set reveal longawaited roadmap see national lockdown restriction ease across uk,0.0
92,2021-02-22 09:00:00+00:00,tune health humor show healthnew include way get well nourish gut doctor speed recovery,0.0
93,2021-02-22 09:00:00+00:00,case surge many expose devastating cost income reversal explore datum future platform find unconditional emergency cash transfer mitigate bad immediate effect crisis poor household,-0.31999999999999995
94,2021-02-22 09:00:00+00:00,classic common warm weather weekend seem entice quite classic lockdown lounge include humber super snipe series borrow briefly postwar optimism choice many wealthy statesman,0.24583333333333332
95,2021-02-22 09:00:00+00:00,doyourpart stay home save livesavoid nonessential travel make use digital channel banking need leave house necessary remember maskup,0.0
96,2021-02-22 09:00:00+00:00,happy belate inktober creative block pandemic common fish chip speak fish first entrywhat happen fishi post challenge time per weekinktober inktober fish,0.3125
97,2021-02-22 09:00:00+00:00,apply study chemistry university lecturer create several exciting new remote experiment run home spite check lego spectrometer build year student applyingtouni,0.08409090909090908
98,2021-02-22 09:00:00+00:00,barron lockdown home health check check window badly fit window cause draught heat loss make house costly heat simple adjustment often need,0.2
99,2021-02-22 09:00:00+00:00,even mild symptom coronaviru new continuous cough still book test might mild could lifethreatene other go information,0.16950757575757575
100,2021-02-22 09:00:00+00:00,louise minchin reveal coronaviru force face longrunne tv nightmare bbcbreakfast,0.0
101,2021-02-22 09:00:00+00:00,rather play favourite time ensure student leave behind petition,-0.4
102,2021-02-22 09:00:00+00:00,htc continue review service delivery response measure relation burial arrangement hailsham cemetery continue practice protect local communityfind,0.0
103,2021-02-22 09:00:00+00:00,sydney amp melbourne have not single case week nationwide australia see covid death since decem,0.03571428571428571
104,2021-02-22 09:00:00+00:00,need idea homeschooling help foster love read lot fun activity especially love idea create read den let we know give go read lockdown books booktwitter httpstcorvwlngzuhf,0.6
105,2021-02-22 09:00:00+00:00,toowoomba doctor encourage patient get vaccination roll public,0.0
106,2021-02-22 09:00:00+00:00,covid case india cases test india bot,0.0
107,2021-02-22 09:00:01+00:00,vaccine available free nhs benefit receive email text message phone call purport nhs ask provide financial detail pay vaccine scam coronavirusfraud,0.26666666666666666
108,2021-02-22 09:00:01+00:00,man receive dose vaccine vaccination site daxe district beijing capital china feb resident daxe district receive vaccine saturday,0.0
109,2021-02-22 09:00:01+00:00,we take daily walk lockdown even snow know cold temperature see leak burst you re walk spot leak please let we knowto report leak head websitehere,-0.3
110,2021-02-22 09:00:01+00:00,doh log new case,0.13636363636363635
111,2021-02-22 09:00:01+00:00,mass covid testing currently put hold time get staffing resource place ready resume provide governmentfunded kickstart covid tester minimal effort simply complete short form,0.04
112,2021-02-22 09:00:01+00:00,get pcr test do fully accredit sample collection centre kaduna state visit us plot isa kaita roadto find please call send we dm coronavirusteste kaduna pcr staysafe,0.0
113,2021-02-22 09:00:01+00:00,sc justice test positive antiterror law oral argument suspend,0.22727272727272727
114,2021-02-22 09:00:01+00:00,last month far business usual restriction continue develop propertyrelated matter become confusingif you re look advice conveyance transaction pandemic head wimbledon ukpro,-0.049999999999999996
115,2021-02-22 09:00:01+00:00,gay sauna beforeas postpandemic fate uncertain investigate likely outcome,0.20833333333333334
116,2021-02-22 09:00:01+00:00,question please contact helpline access service weekday weekend call,0.0
117,2021-02-22 09:00:01+00:00,business premise continue unoccupied due aware effect policyget touch we provide advice you re policy may effectedbusinessinsurance,0.0625
118,2021-02-22 09:00:01+00:00,relationship landlord tenant tumultuous one especially unprecedented coronavirus pandemic,1.0
119,2021-02-22 09:00:01+00:00,last time around mantra covidsecure workplace school really false sense security what s go,-0.20000000000000004
120,2021-02-22 09:00:01+00:00,commonly think elderly underlie health condition experience severe symptomshowever longterm amp often debilitate effect record young healthy people remember basic handsfacespace longcovid,0.07500000000000001
121,2021-02-22 09:00:01+00:00,fund eu national across great manchester need urgent financial assistance due grant use buy essential like food medication application form manchester,0.16875
122,2021-02-22 09:00:01+00:00,vaccine be not buy covid covid buy vaccineonce realise e,0.0
123,2021-02-22 09:00:01+00:00,hongkong leader carrie lam government official receive vaccine city begin inoculation program,0.0
124,2021-02-22 09:00:01+00:00,application deadline general nursing council england wales research grant next monday marchfocus call learn pandemic health social care implication nursing practice teamcno,0.02777777777777778
125,2021-02-22 09:00:01+00:00,fab may temporarily closed browse they re still offer click call collect service covidsecure measure online content include ebook eaudio book mystokestory,-0.1
126,2021-02-22 09:00:01+00:00,please take moment complete vaccination survey share other gather view across lewishams diverse community,-0.012499999999999997
127,2021-02-22 09:00:01+00:00,allah know world would hit deadly coronaviru therefore build graveyard time awhad could hear say rapturous,-0.2
128,2021-02-22 09:00:01+00:00,township mayor go around loudspeaker say curfew time set martial lawwe alre,0.0
129,2021-02-22 09:00:01+00:00,last chance get ticket registration close book place ecrn roundtable lockdown image,0.0
130,2021-02-22 09:00:01+00:00,icymi chief minister say monday feb answer whether could another outbreak isle mansince new isolate cluster recordedpublic health reiterate risk remain lowfull interview,0.13636363636363635
131,2021-02-22 09:00:02+00:00,today ill set roadmap bring we lockdown cautiously priority always get child,-0.5
132,2021-02-22 09:00:02+00:00,private company import vaccine,0.0
133,2021-02-22 09:00:02+00:00,healthy age journeynothe compare glow see senior age happily home caregiver passionate individual make sure senior stay happy long care read senior,0.35714285714285715
134,2021-02-22 09:00:02+00:00,struggle mentalhealth doncasteriapt team help join free online taster session help wellbee relaxation worry sleep much call we information nhs doncasterisgreat,0.30000000000000004
135,2021-02-22 09:00:02+00:00,want keep active lockdown join late workshop runningfitness workshop host,-0.21666666666666667
136,2021-02-22 09:00:02+00:00,incredibly tight ppe say matt hancockperhaps worth mention reason,0.06071428571428571
137,2021-02-22 09:00:02+00:00,scene thailand bangkok un hq least myanmar migrant worker turn oppose militarycoup,-0.3
138,2021-02-22 09:00:02+00:00,real cure covid renew fractured relationship planet,0.2
139,2021-02-22 09:00:02+00:00,woman worker struggle loss work amp disproportionate increase household responsibility,0.0
140,2021-02-22 09:00:02+00:00,happy monday folk support need testing covid time you re alone get,0.8
141,2021-02-22 09:00:02+00:00,we soon record unfathomable death toll covid perhaps moment pandemic reason optimism,0.0
142,2021-02-22 09:00:03+00:00,renew mentalhealthawareness rise pandemic new normal experiencing need care vulnerable depression even covid read ehealth mhealth ai,-0.07121212121212121
143,2021-02-22 09:00:03+00:00,statebystate breakdown hospital risk closingmore rural hospital we immediate risk closure pandemic financial loss lack reserve maintain operation accord,0.0
144,2021-02-22 09:00:03+00:00,ur covid relationship u beautiful shutin tend garden u nasty little goblin,-0.1125
145,2021-02-22 09:00:03+00:00,need travel subscribe journey alert messenger personalise uptodate journey info keep inform cancellation delay well expect busy servicesimore,0.1
146,2021-02-22 09:00:03+00:00,sum whole pandemic handle,0.2
