,full_text
0,hospitalisation rise third we surge hospitalisation amp death rise caseshospitalisation lag case b
1,victorian continue force mask lead health expert hit andrews government r
2,firebreak work comparison daily case england wales show see slow decline growth obvious variation due different restriction country suggest englands lockdown work either
3,greek region prepare tourism promotional campaign greece travel socialmedia restarttourism greektourism coronavirus coronaviruspandemic coronaviruscrisi ttot
4,case rise nigeria do not forget towash handscover face reasonably distance fro
5,hospitalization sharply increase colorado think everyone could use reminder safe safe
6,dr rajasekaran among world renowne orthopedic surgeon seek sadhgurus insight public
7,uk government fail publish detail covid contract private firm
8,start last night live two week day you ve become obsessed radio lockdown listen
9,obviously could not possibly case milliontoone chance turn leaker actua
10,can not wait start read newrelease
11,bail bank bail governement usa cause globalrecession government incompetence stop trillion reserve business amp public need fund relief corrupt bbc run corrupt puppet gov
12,one deeply concern part lockdown academy boy group allow continue train girl group govern body inequality male family friend utterly appal well
13,defraud federal government profit covid relief must hold accountable
14,impact ebusiness fashion market zalando amazon folk tony boutique zara dannijo etc rejerusalem
15,cnn analysis trump denial election defeat biden gear fight covid
16,welp
17,impact mobile robot market eurowire eurowire futureofag agriculture technology
18,uk surprisingly bit well picture generally depress
19,hi amp please contact excludeduk get rachel flower program th
20,lady building covid family would not open door health ppl came build seal ppl selfcentered istg
21,proud join coalition org drive message lockdown must include lock care ho
22,exactly happen people leave support without time emergency plan n
23,raab brexitwell endure whatever transitional issue amp make good itrisking deal
24,culture sector norway could lose billion krone corona measure continue
25,watch british pm invoke ram amp sita call fightback diwali
26,overwhelming evidence entity connect key government figure make staggering fortune pr
27,opinion housing matter life death homeless people second lockdown
28,apparently fuel find way crazy guy coffer another lnp rort auspol
29,world throw we choice make choice time pandemic
30,folklore duh
31,trump lose public vote twice want except top wtrump responsible american death wmillion infect decide spread I m endanger barely survive pandemic walking pneumoniagopleftme
32,c corona virus vaccine humble energyboost energydrink reducechronicdisease productionofcollagen protectyourself staysafe stayhealthy
33,neighbour run small business lockdown get help form sunak time
34,yet deitrickhaddon lousy mouth celebrate pervesed ignorance
35,christmas restriction inevitable expert warnhttpstcofsmswokkfs
36,head global partnership end tuberculosis tb say sicken research reveal million people expect contract disease result restriction
37,man amp team without vision push nation deep trouble start nov demo
38,one solo dogwalk escape freedom lockdown tomorrow you re lucky one
39,son school host pizza treat year anyone see social distancing photo come restaurant
40,still please continue wear mask practice social distancing
41,second lockdown continue serve support community moment conduct phone call adviceif feel someone know could benefit information please complete online form
42,whenever call friend lockdownyoutube youtuber youtuber subscribe youtubepagepromotion youtubespotlight youtubelike youtubefan youtubecontent youtubepost youtubevideo youtubestar youtubemarkete youtuberlife youtubeguru
43,november day lockdown still plenty paint study copper wood watercolour coppermeasure keepingbusy paintin
44,hey navajo nation turn crucial flip arizona blue go back lockdown bec
45,trump say last week turn corneranother lienumber infection reach daily record we ht
46,due date compliance extendedso pls extend gstamnesty alsomost
47,watch british pm invoke ram amp sita call fightback diwali
48,reminder senate goper like kelly loeffler david perdue ron johnson commit criminal insider trading
49,trumpite sleep night know party lie deceit fraud death neglect nay death intent snub science medicine obvious way combat murderous pandemic despair follower give democracy courage courtesy
50,think covid bad wait hear climate crisis first dog moon
51,lockdown reminder go easy develop selfcare routine you ll get like balance bo
52,key point new research people use health service frequently professional
53,psa thomas tank enginealso
54,dr rajasekaran among world renowne orthopedic surgeon seek sadhgurus insight public
55,one scratch arnab hand amp cabinet governor president concern healthvaravara rao deny prop
56,uganda ubos socialeconomic impact
57,reminder senate goper like kelly loeffler david perdue ron johnson commit criminal insider trading
58,would not look quite bad actually competent be not prevent
59,snazzy scientist cure covid amp nobody tell
60,demonstration coronavirus measure saxony turn violent
61,exactly
62,protestor nigeria discover today warehouse food aid lagos mean people lock b
63,idiot can not help themselvesthey deserve quarantine christmas
64,thing republican suddenly start give shit come january deficitevery deathdivisive parti
65,nhs news hear last week covid app leave potentially ppl unaware may expose coronavirus risk threshold lower remains see whether new measure effectivedigitalhealth
66,that s terrible hate hear system work people defraud like thatwhy need inperson presentation realise pandemic go need top get program come alternate way thing
67,linda bauld expert say coronavirus restriction scotland working report expert say r
68,basic first aid training cpr snake bite awareness session conduct personnel cisf unit statue u
69,tata group launch test kit detect
70,another nationwide lockdown safety home could importantif scared safety safety love one please reach outfleee violence home valid reason leavecontact we today domesticabuse
71,reenter lockdown child may spend time onlineto help stay safe recommend smart heart video full clear advice fun activity child aged explore online
72,tw death really let people die spite intervention
73,hour go westberkshire diversity forum registration closing soon want miss opportunity hear eminent speaker share affected family community plus chance give feedback
74,six millcroft care home resident pass away
75,cry loud stay home perhaps go supermarket watch endless netflix go work unless you re essential worker
76,know software hero softwaredeveloper innovation artificialintelligence hereos sheroe stalinkay imaginetheimpossible onlinebusiness
77,transparency gap unlawfully unpublished contract grow size delay lengthen johnsons gov
78,baguio city benguet province post record high singleday recovery
79,one difficult thing experienceddr murali veerabahu consultant doctor black country talk restriction amp stay safe use nhs need ithandsfacespace healthierfuture
80,lockdown restriction impact business prospect let we
81,late lockdown still open available online go continue you re christmas shopping comfort home staysafe visitlincoln
82,daughter attend baby rhyme time since week old lockdown apart family library visit miss thrill tell would join mummys phone thoroughly enjoy
83,treat dildo like royaltyebonygirl bigass bigbooty twerk blacklivesmatter lightskin redbone leak nude buy sellingcontent onlyfan linkinbio baddie bbc bbw ebonyporn brownskin yellowbone bodypositivity erotica freaksonly nsfwtwt
84,stuff you ll hear late bad hi fm morning show podcast top date term postcovid jonny send contract check new trend call dream tourism listen gtgtgt
85,business shape size use covid secure coworke office malvern ready get house join business community book look around worcestershirehour ad
86,flag raising ceremony signal start naidoc week celebration coffs harbour event scale year due pandemic
87,tell one recent temple land grab tn conversionmafia lockdown one manywatch full interview
88,new coronavirus case saudiarabia confirm riyadh madinah
89,eviction pause there s key possession proceeding still there s additional financial support people vital protection miss renter second lockdown
90,unwind book curl word let imagination take relax lose lockdown literaturepow
91,you ve chance yet please find late update response national lockdownwe thank member amongst local communtiy support challenge time
92,coronavirus case we top million accord tally country report infection five time past seven day
93,medicare openenrollment enrollment oct dec enroll online phone aoi office aoi adhere cdc covid guideline call today help
94,there s big list thing can not moment well get lockdown remembering limit spread coronavirus reduce impact nhs save life playyourparthttpstcokqnlmcymyc
95,whether already one thinking grow one lockdown beard sort barbology london beard oil look sharp drop
96,vivek murthy could play key role biden task force
97,corona disrupt treatment cancer fresh survey revealshttpstcookksgfflkg
98,pace accelerate bad trajectory winter
99,coronavirus global case pass million europe lock mnew
100,time build well postpandemic world write marina malgina dag hovdhaugen coronavirus globale
101,coronavirus hit another sobering milestone million positive case worldwide since pandemic beganhttpstconoodsiqgix
102,dementia ward inpatient need well protection
103,uhuru caution let global response disrupt malaria fight
104,today angler reside wales able travel freely within wales go fish outside wales hope post video provide inspiration help plan future visit visitwaleslatermore info
105,red white black brown yellow rich poor blue bb king mondaymorne musicm
106,income support helpline open today intreo centre open today apply pandemic unemployment payment easiest quick way online
107,icymi amid unprecedented aviation crisis due joe biden set become president united states fare recovery process aviation industry yet see
108,pollutionwatch blanket thick smog envelop new delhibarely week ahead diwali pollution level continue worsen delhi neighbouring state also impose ban use firecracker prevent risk curb airpollution ian
109,lockdown diary day quarantine would declassify everythingstay tuned dispatch radio free diablo countyquarantinediariesquarantinelifecoronalockdownshelterinplaceca
110,sad news stay safe everyone
111,invite year student ni yr reflect upon current crisis competition rethink language language modlang competition enrichment britishacademy
112,real livingwage rate tomorow million key worker still earn need meet everyday bas
113,message owner city dead lets get alive againlockdown
114,enoughafter senate get secret briefing buy stockin company make
115,anwar say budget set aside billion lowerpriority infrastructure project neglect need people cope loss job livelihood due pandemic improve access
116,covid case india case test india bot
117,runner nationwide participate year xian marathon kick sunday provincial capital northwest chinas shaanxi province mark another major marathon event resume since epidemic outbreak
118,well part research innovation quality improvement riqi event november join see talk two library work together
119,government launch nhs app aid test trace effort download app could help keep love one safe uncertain time find download
120,competition time new competition eat yoursbegin week submit entry describe eat cream slice might lucky winner box cream cake sweeten weekbirdsbakery howdoyoueatyour lockdown
121,help support new lockdown ask donation amazon wishlist particularly art amp craft material amp toiletry donation big small greatly support leed
122,cumbrian need support receive vital information week see pandemicfull
123,volunteer pandemic what s like cooking meal service
124,still try rebound market say wes ehrecke president iowa gaming association something like come online could ripple effecthttpstcopxgcjqvgao
125,hear uae convict nigerian wire boko haram federal governm
126,get mondayblue need something pass time lockdown mondaymotivation cool craft activity take product need get start order place tonight
127,advice people england receive letter say they re clinically extremely vulnerable
128,brain trick take risk pandemic
129,new figure reveal many australians turn quick fix pandemic health expert warn potential
130,covid pandemic may hiding sign radical terrorism expert
131,read stayhome survival guide yet check blog blogging blogger quarantine lockdownireland
132,finally account header image group photo team home edition
133,bitte
134,local business count support anything need thinklocal kps base rochester remain open lockdown help covid localbusiness officesupplie
135,eviction pause there s key possession proceeding still there s additional financial support people vital protection miss renter second lockdown
136,listen happy pandemic halloween parenting roundabout podcast
137,november chancellor rishi sunak set government emergency funding plan tackle I ve sign petition call nhs get fund desperately need join add name
138,evacuate hurricane year here we d deal withfema rule sq ft per person sq ft per personatlantic county shelter capacityupper township middle school peoplethe plan
139,national covid alert stay home nov deconly leave home food medical reason exercise education work must work home canavoid travel unless essentialschools essential shop remain open remember wash hand cover face make space
140,vilnius attraction landmark appear almost empty saturday lithuania enter second national lockdown since begin coronavirus pandemiclithuania
141,trek india beginner introduction india stunningly diverse country walk every himalayan state trekking route special character local expert nutan shindepawar offer postcovid trip plan inspiration
142,current condition sayre patemp chill point barometer inhgwind mph nacorona virus weekly statscase nepa bradfordcounty
143,washington state us patient test positive march find still shed infectious viral particle day
144,roll rate remain low area
145,uk government fail publish detail covid contract private firmsthat secretiv
146,friend lose kg largely due sport get sick coronavirus feel weak afraid regain weight still strength training experience return sport covid advise
147,psyop successful world economy cripple many country enter second totally
148,global pandemic company cut people job job might want show gratefulness right
149,mask clinical trial tweet plain wrong scientist know mask limit coronaviruss spread impossible randomize trial prove via
150,german number patient intensive care hit record high
151,presidentelect press well protection nation hit record number daily case
