,full_text
0,see odh disclaimer top number ohio november case hospitalization death presume cantonhealth
1,let part thanksgiving keep people safe healthy celebrate virtually wear mask
2,take time keep people safe thank amazing game
3,pay boot nhs meds review pharmacist
4,make sad fully understand decisionplease take time masterpiece
5,firefighter teacher police officer amp million front line worker keep country go
6,america open business special report one big tech do not want seejoin take
7,million americans take sky hit road ahead thanksgive risk pour gasoline cor
8,let get straight michael flynn face consequence lie fbi undermine prosecutor betr
9,break news steeler say fan allow heinz field sunday team reschedule game raven
10,hypocrisy clown chart hey travel much want fine do not tell everyone else sit home you re run around denver
11,sir mean institution close corona lac student appear mdc
12,pakistan pm imrankhanpti speak global ceos strategic priorities postpandemic era pakistans economy sh
13,I m mask africa wearamask break transmission chain join africamaskweek show care yo
14,bad bunny tiene covid
15,donate food bank amp go fund mes feed child country however government
16,butch sanders catawba indian nation york county south carolina die covid november belove
17,mnuchin scumbag hatch scheme undermine biden administration fact hurt america
18,georgia deserve well vote get rid cowardperdue crimina
19,onus fall trans student macgyver solution deadnamed misgendere
20,great idea
21,unlisted person grateful tara maupin tara nicu nurse take care premature baby baby whose mother
22,flee hadrout mom get covid yerevan hard time we stay hospital month af
23,ucla nurse honor fall nurse lose life candlelight vigilrn call univer
24,twice season team have not able control situation twice have not repurcussion chance get healthy what s point covid protocol like extend roster practice squad etc cancel game like
25,call radical lefty you d like refuse accept system enable jeff bezos grow wealth
26,get government life
27,maybe nfl reschedule game
28,key concern wednesday statement give late nov national average daily cov
29,we ve surpass million coronavirus case lose life united states
30,late elearning journal nbpoli
31,backtheblue street
32,already see photo people camp gamestop november ad state
33,exclusive interviewkpop group big pop band world accord bloombergs pop star power r
34,georgia america deserve well vote dump cowardperdue criminalkelly
35,moment decisiondecide public health mattersdecide health health family matter
36,happen next lockdown matter economy meeting tonight londons likely tier along wi
37,yesterday trump take full credit dow jones take zero credit americans die cov
38,happen post covid
39,new biden call nation unite fight thanksgiving address
40,spot
41,pay american company million dollar fail plan see bad american response wa
42,could watch prime minister trudeau humiliate michelle rempel conservative party canada day long ht
43,complete last duty bod chair today privilege working year hv liaison bod outstanding service outstanding worker service available even pandemic woman amp cyp experience da south lan amp east ren
44,first nfl take away bye week another team can not get covid situation together take away
45,extra ticket thanksgiving game tomorrow comment would bring pi
46,georgia deserve well vote get rid cowardperdue crimina
47,case area
48,dare say five year ago globally vigilant pandemic imo
49,beyond excited nervous partner lose job lockdown he s chef get old
50,
51,mishandle covid ppe supply truly shock doctor amp nurse leave unprotected ten million
52,call radical lefty you d like refuse accept system enable jeff bezos grow wealth
53,thank lovely message read finally tell family morning miscarriage
54,grow number american go hungry
55,exacerbate shine light racial disparity exist global pandemic hit
56,help corona one
57,challenge we right immense need bold action fight pandemic that s
58,let part thanksgiving keep people safe healthy celebrate virtually wear mask
59,break austintravis county official increase coronavirus restriction stage
60,new video david perdue refuse debate what s afraid ask try take healthcare
61,happy birthday spiderverse thanksgiving draw originally post christmas season instead also stay
62,due pandemic weekly compass meeting occur online today nice see first time
63,stay safe healthy thanksgiving holiday do not forget wear mask practice social distancing avoid con
64,hold wear mask believe people wear mask mandate suppose state enact however executive branch get kind power what s stop future president enact unconstitutional measure esp someone like trump
65,people outside atlantic canada might know epitomize great public health leader
66,peter hitchens urge people stop swallow garbage covid r via
67,youth matter life death covid resistant contract transmit well other sir please take stand we responsibility
68,literally disprove argument say take risk know plenty healthy people seriously affect covid do not see nfl take account bad idea
69,frustrating see much covid false balance popular press treat thing like wildly critique barrin
70,december next week time fly life fall apart pandemic
71,mum dad son amp daughter die today govt do not get ttti work lock late amp let
72,afford military budget surely afford pay people stay home contain covid
73,bone head tory do not seem connect word foreign word global watch complain chinas global reach base massive foreign aid policy
74,let get straight michael flynn face consequence lie fbi undermine prosecutor betr
75,think chicken perdue turkey tomorrowwhilst he s give thank money make
76,washington health expert concern hospital capacity case surge
77,december next week time fly life fall apart pandemic
78,premier jason kenney must come clean albertan publicly release recommendation dr deena hi
79,losangeles mayor think cut utility covid good way enforce rule fortunately socalled netneutrality titleii rule make internet utility do not last govt way likely block amp
80,go to party covid actually none people party invite
81,spoton
82,heartbreaking
83,exclusive interviewkpop group big pop band world accord bloombergs pop star power r
84,there s light end tunnel still tunnel fight invisible enemy suck
85,ppl hold gt wealth bottom america there s wealth inequality today time since gilded ag
86,it ll nice bar club postpandemic sure I m really excited ability steal grape
87,shadow pandemic violence woman tackle un fund
88,kind zum thema corona part coronavirus schule kinder zukunft deutschland
89,child experience mild illness tell school send child home following case
90,update seem post miss deliberately otherwise stat w
91,throw kitchen sink try steal election sabotage postal service threaten state election offici
92,republicans complain protest idea second lockdown go non social distancing event travel do not wear mask like could prevent second lockdown
93,exclusive kpop group world big pop band talk covid future plan beulraegpingkeu
94,sorry loss beautiful little hope doris wear mask wear indoors time case
95,throw kitchen sink try steal election sabotage postal service threaten state election offici
96,hard time humanity story one many story may god end pandemic soon people live love onesstay connect father pray himallah ap abbu ko jald az jald sehatyab kareameen
97,international day end violence around experience physical sexual violence
98,insider trading crime flipgeorgiablue wtpblue
99,wegmans comply mask requirement employee amp customer every location
100,december next week time fly life fall apart pandemic
101,raise hand think nurse student debt wipe record covid
102,rappel omfcp
103,average age death covid victim uk rarely ever mention mainstr
104,tenant upper hand postcoronavirus world cre tenanttips newnormal httpstcoxchvrycmyr
105,positive story see two patient covid symptom today one know instead send home wait thing
106,think mitigation strategy base science datum sadly mistakenwe
107,yesterday trump take full credit dow jones take zero credit americans die cov
108,nearly death report today yet come lockdown tier do not work last time scientist warn relaxation measure surely prevent death preferable turkey tinsel coronavirusuk
109,many conservative mp call government publish cost benefit analysis covid restriction wel
110,statin cholesterollowering medication use diabete significantly raise risk death c
111,break year old eld political prisoner dr mutulu shakur contract go along hi
112,case death shatter daily record foreshadow one deadly year american history peo
113,can not slow get join littlelockdownchallenge bird notalone nature wildlife vulture birdsofprey
114,see video today nurse talk shit ton people covid start die getting bl
115,die result tout die covid cancer cancer would list well that s work
116,alert trump useless vanity wall rip eagle pass tx week he s evict goodt
117,also say wear mask be not walk claim practice social distancing he s fraud pay trump fake
118,one hour well streaming live admiral richard schneider president emeritus norwich university norwichnews talk leadership high education tune
119,petition fully fund school cost provide relief loss income
120,florida extend ban maskmandate even case rise florida democrats aka survivor fire desantis next election he s still office
121,new video david perdue refuse debate what s afraid ask try take healthcare
122,frenchlaundry corrupt compromise governor credibility
123,guy continue giggle mewe dj porcs dad really want big thanksgiving give we personal covid update
124,maybe balance thanksgiving tradition safety precaution health expert urge people avoid travel holiday recipe share give dinner blessing via video may great idea
125,black friday time expect look bit different year past
126,city east lansing waive fee newbusinesse pandemic read righttostart field guide policymaker localgovernment step
127,qld opening victoria sa record case overnight day
128,miss chat amazing dr children hospital play essential role address pandemic answer question straight source check
129,hihello make easy reach stay connected network especially timesread networking technique could help
130,leadership entire political faction joyfully encourage action go get supporter sickor kill say chris hayes discuss ted cruz mock safety warning
131,let part thanksgiving keep people safe healthy celebrate virtually wear mask
132,thestayininn majority scotland form lockdown live show keep we go festive magic disappear dopy dunlap save christmas
133,nacchoalert support local health dept develop adopt health policy resolution build evidence base hiap practice capture story health dept use hiap partnership respond mitigate crisis
134,big shoutout alter plan take covid test selfquarantine week show thanksgiving dinner thing require lot effort respect life fellow human thank happy thanksgiving
135,headsup heres need know today nov start
136,covid def hold cradle
137,spending review illustrate damaging economic impact precisely need invest recov
138,house dem vote sanction turkey turkeys defense industry follow last year
139,there s pandemic ffs wear mask
140,school montana attempt make good decision possible student faculty pandemic great fall make decision return school face face learn monday read montana justice
141,oklahoma mens basketball program pause organize team activity due positive test contact tracing team say
142,suck least hopefully go home opener
143,one tragedy epidemic expose inequality health opportunity healthydaniel lieberman
144,unemployment rate rise second straight week united states amid
145,will not condemn adamson bbq reckless behaviour issue real consequence amp mpps do not even follow proper covid behaviour tell people responsible hollow people openly break rule know you re take seriously
146,ongoing success online qualitative research magnify covid crisis still bother facetofacelearn via mrx research remote
147,read pandemic one investing technique rise fame refinancing find realestate realestateiq dealfinde fastcma offmarketlead countydatafinder dealanalyzer repairestimator texas
148,ask amazon walmart amp company pay increase pandemic pay leave virus safety job retaliation protection voice solve health amp safety problem sign fivetosurvive platform
149,stay home yo
150,someone really need explain utility sign assure we covid safety measure effect every road work site pa
151,begin covid pandemic georgia sen david perdue r sell million worth stock company serve boardafter share plummet perdue buy much stock back since quadruple
152,colts force eastmeadowbrook earn another district season tourney game point pandemic struckcoltathletic
153,federal guidance school accountability era impact ohio various way preparation key leader amend state essa plan align federal guidance right
154,negro oriental record active case nov follow recovery individual early test positive virus
155,live groundhog view punxsutawney year pandemic go far
156,world health organization warn new datum show resurgence measles case death impact pandemic measles vaccination rate
157,doctor recreate patient may see die chill video
158,tier decision announce tomorrow
159,nyc covid checkpoint key bridge crossing sqthe city enforce completion traveler form airportspenn station port authority bus terminal selft site team sitesqthe day come
160,professor physical sciences say smartphone main cause symptom use nword
161,chinese firm seek approval public use vaccine western drugmaker emerge
162,recession unique among modern economic shock harm womensfinance prospect via
163,case increase nationwide protect family limit exposure people require guest home wear mask practice good hygiene create sign print home
164,listen huddle avoid covid vaccine mean can not
165,bipoc community hard hit amp blackowne business struggle pandemic recovery put equity forefront let talk tune rfbreakthrough change landscape access capital amp join conversation
166,get late what s open closed
167,quebecs coronavirus caseload top
168,first interview eurogroup president irish finance minister lay domestic agenda rollout eu recovery fund provide path deal late brexit talk
169,wear mask help stop spread inside place difficult stay metre away othersmulticultural resource italian
170,believe access open space within amp around dwelling important mental amp physical wellbeing coronavirus highlight need access amenity amp fresh air without leave home find help
171,across corps culinary artist dine facility manager ensure troop safe thanksgiving meal allow troop observe holiday observe covid mitigation protocol let healthy holiday weekend amp return safelypeoplefirst
172,case increase nationwide protect family limit exposure people require guest home wear mask practice good hygiene create sign print home
173,check awesome work graduate student katie thurson pull together research team study camp adapt publish result read story
174,there s slow thoracic surgery resident like paul devlin md help care patient thanksgive he s ask show thanks healthcareworkers wearingamask practice socialdistance
175,downtown charleston restaurant try pull pandemic counting day christmas
176,sampcs cofounder editorinchief one speaker event share sampcs experience report impact city focus experience marginalise group portsmouthwoman
