,full_text
0,please watch
1,message sameet family fear sameet life dress without bath past day covid
2,lockdown update
3,want see wilson sossion use child crash test dummy preparedness talk
4,avoid violation epc law pass legislature pasecystate pa supreme court must pass law equally protect ensure voter equal chance vote count
5,focus grade convict farright terrorism category child abuse video computerpolice speak highly intelligence receive suspend sentence would case perhaps look different
6,wish I m still work experience fresh hell election along covid patient
7,despite lockdown yasmine still extract mine parasitoids oak leave send treebodyguard
8,twitter ban david icke coronavirus disinformationlesson learnedit okay suggest jews alien lizard w
9,next week fly netherlands miami requirement regard covid testing
10,republican david andahl die october elect north dakota house representatives
11,almost hourse work week
12,cambodias foreign ministry hungarys foreign minister peter szijjarto test positive arriving
13,dem do great day one first china help virus gift dem come impeachment
14,watch live vaccine global challenge amp prospect
15,tag handle brostoppolicebruitalityinuganda
16,he s
17,perhaps important moment speech sme come form tacit admission government get bankguarantee bailout wrong read sme insight guy hosking retail capital cfo via small business site gt
18,notice interest morning respond various tweet mine reason response email either
19,disgusting
20,van hagedobbiesasda livingwilkosrangebampmhalfordsbampqwhat lockdown
21,corona lockdown baby starting pull
22,asan kasingye ssebo u get couple week back wakeera kutuwoganira mbu bad new policeman k
23,leader taskforce develop risk mitigation racial amp minority ethnic staff mental healthcare settin
24,I m furious people say we ve survive four year trump survive four I ve know lot people
25,tear joy thankful people arizona work hardplease listen new senator fr
26,important stunt pull name jerusalem israelis capital checkmate greedy chinese activity we imagine resist expose china amp pandemic anything sleepy joe can not trust like ur president
27,patient show gastrointestinal symptom show study
28,donald trump accuse americans hoard palliative amp decide share
29,huge outbreak virus confirm midlincolnshire factory employ people eviscerate chickensht
30,great mystery cause modern pandemic human activity
31,russias top diplomat say fighter middle east join fight nagornokarabak
32,england local authority high number positive per rolling rate
33,bbc news covid death high normal virus death
34,thank much support worker covid case childs school
35,wear face mask pleaseyoung people die people die face mask please
36,understand since government recent announcement second national lockdown due pandemic resident may experience difficulty number reason find staff help visit website
37,twitter ban david icke coronavirus disinformationlesson learnedit okay suggest jews alien lizard w
38,november december must leave home except specific reason measure apply
39,republican david andahl die october elect north dakota house representatives
40,press freedom india since modi come power least journalist kill confirm motive total number
41,wear mask go
42,excited attend today look like go day full great discussion interestin
43,dyk location proximity time help make safe choice you re area widespread tra
44,prime minister viktor orban say facebook november new step need prevent hospital overwhelme
45,even biden win low margin shocking trump win basically mean nothing matter ppl morality character us intl prestige even covid deathssadly still economy stupiddepresse fact
46,qu onetoone physical training like physio pilates etc rehabilitation medical purpose continue lockdown need special qualificationslicensemembership somethinghelp
47,hello senior information system student university bahrain kindly fill survey regard
48,really go help citizen northdakota plus state horrible situation surge amp state incompetent gop
49,pray everyone mental health next lockdown
50,think ask many symptom many actually die covid
51,number bjp leader suddenly find time official duty condemn arrest arnabgoswami amusing say least do not see fraction outrage towards rape riot death pandemic plight migration worker farmer protest etc
52,corruption obvious government discredit crimeminister johnson lock
53,photo typhoon rollyph aftermath virac catanduanesphone signal still spotty there s electricity
54,government use excuse crush basic democratic right become totalitarian
55,one important assessment that s need urgently test trace billion work effectively lead us lockdown life business lose due incompetenceand silence
56,also damning report say still prepare pandemic back suppose advance science technology year later still place
57,I d say hope kill notit covid poverty racism climate crisis discrimina
58,nowplaying farius miami love listen quoradio qcradio hiphop rnb pop rock radio eclectic onlineradio listen listen hhm quarantinelife
59,pandemic turn business world upside take business keep head water really thrive amid crisis watch full video
60,construction site set remain open new lockdown rule come play product manufacturer builder merchant distributor keep operate material build repair home hospital service
61,matter outcome fact election close clear indicator american be not connect mate
62,closely monitor economic impact pandemic also sceptical v shaped recovery big slump consumer spending biz investment loss month sale global uncertainty can not bounce back quickly
63,last decade ensure basic facility fulfil aspiration say pm modi forbesganj rally
64,need vaccine real fix vexing vulnerability afflict we there s va
65,holamadrid home alone almodovar new film find innovation lockdown film guardian
66,bird flu epidemic cheshire farm
67,amazing project mark november diary gmt premiere youtube
68,pandemic change online search behaviour prospective student dive uk datum focus commencement date student grade attainment level amp subject student look study yearonyear comparison read
69,expert seetionhitachis financial digital solution pandemicwa live todays afternoon showcase various topic digitalinnovation energy do not miss
70,pakistan wave fear case soar pakistan
71,everything can not thursday
72,update tour gt due ongoing situation relate amp precaution safety audience artist amp staff well postpone snoop dogg tourssebelfastarena show reschedule sat sept original ticket remain valid
73,join community likeminded individual work together find yourpersonalbest novemberfind tailor activity plan workout tip amp exercise please adhere government guideline relation
74,carer state mental health impact due covid glasgowcarer access emotional support local carer centre support peer support group discuss help right call we
75,really nice touch handwritten thank card support nhs throughout covidthanks callum
76,taiwanese woman recently return poland test positive bring total number case taiwan wednesday total recover seven die
77,speech debate syrian refugee crisis secure greatly add unimagi
78,aaa weekly food bank help individualsfamilie per week amp another lockdown announce need help support vulnerable family food parcel ever donation big small make differencetogetherwecan makingadifference
79,overview power shift amidst chinas postcovid rise anna malindoguy academic president techperformance corp
80,mean people ever work remotely april people employment work home on high number record check blog smallbiz
81,today
82,worried lockdown effect elderly love one help call we email adviceageuklancsorguk visit
83,even meet mention exam result omit image child abuse charge
84,four year crisis crime kid cage chaos division dead yet still com
85,look mental health moment tough tip advice guidance help young people parent carer
86,vinexpo new york become late trade show casualty coronavirus
87,deputy johnny tunches third harris county sheriffs deputy pass away
88,magnetic north go ahead december spite lockdown partnership magnetic north use streaming technology bring together range artist indigenous nation around arctic
89,explore writing skill pandemic like write technology awareness digital happening invite get publish we submityourblog blogpost
90,third consumer survey say pandemic keep impact life least another year read index
91,david andahl elect serve one north dakota state representative die last month
92,accelerate many business trend like popularization flexible working practice investment employee development opportunity businesstransformation futureofwork
93,money spend londons super prime market year far period despite coronavirus lockdown analysis find
94,new productsexpression plasmid design specifically pseudotype viruslike particle spike sequence available cterminal remove last aa optimize expression check
95,partner new research show people uk say value public sector pandemic read report
96,despite challenging lesson learn achieve responsible supply chain via supplychain covidlesson sustainablebusiness climategoal sustainability
97,representative india rene van berkel press need keep check emission biomedical incinerator amid double whammy rage pandemic rise airpollution indianarrative
98,interesting opinion morning readour life covidhttpstcophylfcxpxu
99,antilockdown protester arrest amid clash melbourne
100,pieter passionate warrior way constantly forward think lead example wonder he s next ppgproud hero learn help ppg southafrica stay secure pandemic
101,pen party valedictory celebration farewell nelson mandela bay acting mayor thsonono buyeye plead bay parent case continue surge metro
102,shop open today gear come pick new coat cold weather get good fitwinter way good range quality winter jacket tall big size staysafe lockdown
103,live slido emesolconf nine million adult uk hold back low basic skill well basic skill vital national response coronavirusjoin we discuss lifelonglearningweek
104,covid case india case test india bot
105,clive consultant physician yorkshire how s cope he s discover pandemic he s look rest world ensure something like never happen
106,join we lunch dinner today last supper second lockdown everything open wait forbook table well see later
107,new group set support poor sick elderly vulnerable disabled resident rural peterboroughhttpstcoyimtlixdor
108,trial plague heart anxiety find strength keep go cast member fpjsangprobinsyano share keep hopeful attitude amid uncertain time
109,different level restriction place across four nation keep member update detail here quick guide what s go gt behindeverymusician
110,symptom coronavirus even mild one must stay home book test soon possiblethis help protect around symptom high temperaturea new continuous cougha loss change sense smell taste
111,host virtual event also free local delivery service product
112,usually buy magazine shop heres info get warner magazine deliver safely door lockdown
113,second week lockdown already link amend temporary timetable essential travel waleslockdown
114,due rise coronavirus case number across country national restriction put place november find new national restriction
115,coronavirus message fluid friend commit provide safe environment employee ensure business continuity good ability thank continue trust fluid
116,take part movement minutes session today join us facebook search weareinthistogether
117,ask child different corner bangladesh look forward go back school closure find say
118,news second lockdown sunday ill restart sunday live stream christmas resident watch care home want break away everything go world get together musician love
119,bad news fan like rest football step two give month play training due lockdown restriction safc
120,proactive pandemic join webinar learn launch directtoconsumer online store quick start week present osf digital register internetworldbusiness
121,chinese reveler party wuhan nightclub europe enter second lockdown
122,two scheme financially support people selfisolate due diagnosis suitable people low income social care worker detail coronavirus
123,mark amp spencer fall first loss covid crisis hit clothing sale business
124,icymi make impact know issue relate structural racism relate history country make certain group disproportionately impact chronic acute disease like
125,thirtysix people die great manchester hospital contract
126,there ve new infection last
127,we nov hackhospitality digital solution recovery festival social science hospitalityatsurrey
128,fourteen per cent say would refuse vaccine another per cent undecided
129,good know lockdown contact train adviser ring chat monday thursday friday support wellbeing energy employmentright scam advice
130,pandemic suppress nature social creature pet give we priceless gift grace companionship
131,world lead resource scottish poetry open business run reduce covidsafe service borrow book we via free postal loan click amp collect service want know click
132,cambodian migrant worker strand thailand extend travel document country declare continue close border november prevent spread cambodian embassy bangkok announce
133,follow announcement second lockdown hit country tomorrow trader fear future high street spike important ever shop localfull
134,real covid emergency people hall do not fuck mask
135,number exhibitor next year aero india already exceed previous edition despite organise amidst global pandemic
136,late shocking coronavirus scandallike health department department education quietly replace e
137,figure show close people fail meet credit loan obligation october increase around september total mark steep increase miss payment since start coronavirus pandemic
138,help humpday lockdown heres july virtualpubquiz minute free quiz fun quiznight quiztime pubquiz humpdayhappiness humpdaaaaaayyyy
139,lmfao
140,pls help we get signature need x pls sign petition support cancer patient pandemic memory mum die treatment cancel
141,semen indonesia clock profit trillion despite pandemic
142,resitance member reason ply wood trend look liberal
143,ongoing crisis create massive challenge business across board especially cashflow perspective smallbusiness banking experian experian
144,selfcare guidelines ministry ayush everyone inculcate life test time c
145,sap brandvoice experience key distribute vaccine
146,vaccine diplomacy india expand cooperation neighboring country coronavirus vaccine development
147,business leader make digital transformation priority catapult us era digital everything keep pace change look insight
148,threat freedom speech writing action though often trivial isolation cumulative effect unless check lead general disrespect rights citizen george orwellisnt exactly what s happen real time
149,mail ballot complicate vote tally vote without vote talliesa shenanigan b
150,bird flu epidemic cheshire farm
151,furlough scheme already extend month due lockdown part
152,explore importance purposedriven culture learn leader twitter cognizant amp center future work
