,created_at,full_text,sentiment_score
114,2022-01-08 15:59:59+00:00,RT Where's CNN's COVID tracker? It was on 24/7 during the Trump Administration.,"{'neg': 0.0, 'neu': 1.0, 'pos': 0.0, 'compound': 0.0}"
115,2022-01-08 15:59:59+00:00,"Agree.
Follow this immunity boosting protocol to greatly minimize your risk of contracting Covid.
I do.
So far so good","{'neg': 0.086, 'neu': 0.585, 'pos': 0.328, 'compound': 0.7655}"
116,2022-01-08 15:59:59+00:00,"RT CDC, 2020: wash your groceries

CDC, 2022: you can cough in someone's mouth if your boss says it's okay","{'neg': 0.0, 'neu': 0.909, 'pos': 0.091, 'compound': 0.2263}"
117,2022-01-08 15:59:59+00:00,"Dear All, it's just a suggestion: I believe the vaccination against Covid-19 must be mandatory for everybody in the World. This is the best way to make the World to win this great war against Covid asap. Vaccines for all!!!","{'neg': 0.07, 'neu': 0.612, 'pos': 0.318, 'compound': 0.9294}"
118,2022-01-08 15:59:59+00:00,I think this tweet is incomplete without this information.,"{'neg': 0.0, 'neu': 1.0, 'pos': 0.0, 'compound': 0.0}"
119,2022-01-08 15:59:59+00:00,"RT ""Ugh I don't feel well. Better go get multiple mammograms and stay home."" -","{'neg': 0.369, 'neu': 0.631, 'pos': 0.0, 'compound': -0.7202}"
120,2022-01-08 15:59:59+00:00,RT I sent a video message to thousands of demonstrators in Paris today who are fighting against authoritarian covid measure...,"{'neg': 0.116, 'neu': 0.884, 'pos': 0.0, 'compound': -0.3612}"
121,2022-01-08 16:00:00+00:00,"I googled to find out what type of diseases that can stop someone from receiving the Covid vaccine, and found nothing, but a confirmed anaphylactic reaction to any of the ingredients in the vaccine, then one can't have the vaccine","{'neg': 0.039, 'neu': 0.961, 'pos': 0.0, 'compound': -0.1531}"
122,2022-01-08 16:00:00+00:00,"RT Unbelievable

The lawyer opposing Biden's vaccine mandate &amp; downplaying Covid is ARGUING REMOTELY because he has Covid &amp; is qu...","{'neg': 0.152, 'neu': 0.774, 'pos': 0.073, 'compound': -0.4466}"
123,2022-01-08 16:00:00+00:00,RT The Omicron surge has been truly devastating... for cancer centers.  1/9,"{'neg': 0.422, 'neu': 0.437, 'pos': 0.141, 'compound': -0.7783}"
124,2022-01-08 16:00:00+00:00,"RT Today's twat in a hat is my brother in law.

He's a bodybuilder who won't have the vaccine because he 'doesn't know what...","{'neg': 0.161, 'neu': 0.839, 'pos': 0.0, 'compound': -0.6597}"
125,2022-01-08 16:00:00+00:00,"Hey you won't believe it man .I work on a cruise ship ,right now docked in the Bahamas . Actually got my first time off in a mth but can't go out as we are level 2 Covid protocol .
So that explains the drinking part last night .Btw I am a great fan of you bro","{'neg': 0.0, 'neu': 0.865, 'pos': 0.135, 'compound': 0.8625}"
126,2022-01-08 16:00:00+00:00,RT We again stand at a juncture where we are battling a COVID wave. Without discussing how dangerous this new variant may...,"{'neg': 0.085, 'neu': 0.811, 'pos': 0.104, 'compound': 0.1164}"
127,2022-01-08 16:00:00+00:00,"COVID hits President Alvi again

https://t.co/TCu7LSpRIa","{'neg': 0.0, 'neu': 1.0, 'pos': 0.0, 'compound': 0.0}"
128,2022-01-08 16:00:00+00:00,Would you back COVID-affected essential businesses please?,"{'neg': 0.0, 'neu': 0.723, 'pos': 0.277, 'compound': 0.3182}"
129,2022-01-08 16:00:00+00:00,"""Covid-19 underlines the importance of grasping the opportunities that arise when you combine pure science with data science and digital technology,"" says Ciara O'Connell, head of the Global Service Centre in Dublin
https://t.co/RrN4DQ63dM","{'neg': 0.0, 'neu': 0.859, 'pos': 0.141, 'compound': 0.6249}"
130,2022-01-08 16:00:00+00:00,"""Yes, Trump famously said the pandemic would soon be over. But even his foes are starting to acknowledge a few things he may have done right,"" writes for","{'neg': 0.126, 'neu': 0.816, 'pos': 0.058, 'compound': -0.4854}"
131,2022-01-08 16:00:00+00:00,BS I'm vaxed I just had covid I spread it to no less then 5 others and every single one of them were vaxed. 1 got very sick and was hospitalized. You don't know shit about this yet you're dumb enough to listen to jackasses. That's the scary part.,"{'neg': 0.259, 'neu': 0.693, 'pos': 0.047, 'compound': -0.9212}"
132,2022-01-08 16:00:00+00:00,"RT I can't wait for my girlfriend to marry me, buy us a house and go to work while I stay at home and watch TV the whole day. ","{'neg': 0.0, 'neu': 1.0, 'pos': 0.0, 'compound': 0.0}"
133,2022-01-08 16:00:00+00:00,"We want to help your house stay homey even after the seasons change. 

#furniture #interiordesign #homedecor #design #interior #furnituredesign #home #decor #sofa #architecture","{'neg': 0.0, 'neu': 0.84, 'pos': 0.16, 'compound': 0.4588}"
134,2022-01-08 16:00:00+00:00,"A new report from the CDC shows that the virus is taking its biggest toll on kids five and younger -- the only ones in the country still not eligible to be vaccinated. 

https://t.co/iZt4A6JVbF","{'neg': 0.0, 'neu': 1.0, 'pos': 0.0, 'compound': 0.0}"
135,2022-01-08 16:00:00+00:00,"A young Nuneaton woman 'who was loved wherever she went' has tragically died just days after catching Covid.

The loss has left her family &amp; friends shattered.

#MCCNews #ChromosomeNews","{'neg': 0.297, 'neu': 0.539, 'pos': 0.164, 'compound': -0.6908}"
136,2022-01-08 16:00:00+00:00,"Ive had Covid and vaccinated and yes they aren't helping but if precautions were taken throughout the past decade or so we would be better off in schools, hospitals and CHSLD homes. Im pro choice. Implementing vax passport in groceries stores and pharmacies is not acceptable imo","{'neg': 0.074, 'neu': 0.818, 'pos': 0.108, 'compound': 0.424}"
137,2022-01-08 16:00:00+00:00,RT Look at the date on tweet. Our community saw what was necessary. It's all outlined.,"{'neg': 0.0, 'neu': 1.0, 'pos': 0.0, 'compound': 0.0}"
138,2022-01-08 16:00:00+00:00,Same tactic used by zionists when they conflate anti Zionism with antisemitism.,"{'neg': 0.173, 'neu': 0.827, 'pos': 0.0, 'compound': -0.3182}"
139,2022-01-08 16:00:00+00:00,"Omicron variant cases increasing in Karachi says, Murad

https://t.co/GW5PrF4CGA","{'neg': 0.0, 'neu': 1.0, 'pos': 0.0, 'compound': 0.0}"
140,2022-01-08 16:00:00+00:00,"RT The schools in question here are the DC public schools, where Senator Cruz wants federal power to over-rule local opinion to...","{'neg': 0.0, 'neu': 1.0, 'pos': 0.0, 'compound': 0.0}"
141,2022-01-08 16:00:00+00:00,"Dallas County parents: if you're looking to get your kids tested for COVID, many school districts are offering free testing services. More info on testing locations and times available here:","{'neg': 0.0, 'neu': 0.898, 'pos': 0.102, 'compound': 0.5106}"
142,2022-01-08 16:00:00+00:00,"From restaurants to gyms, businesses and cities across the country have been issuing vaccine mandates, which has received some backlash nationwide.

https://t.co/cTEwDpQHXj","{'neg': 0.0, 'neu': 1.0, 'pos': 0.0, 'compound': 0.0}"
143,2022-01-08 16:00:00+00:00,an approach I have taken ,"{'neg': 0.0, 'neu': 1.0, 'pos': 0.0, 'compound': 0.0}"
144,2022-01-08 16:00:00+00:00,"RT Pandemic Preparedness in #JammuAndKashmir reviewed. Div Com Kashmir, Div Com Jammu, Mayors Jammu and Srinagar, DDC Cha...","{'neg': 0.0, 'neu': 1.0, 'pos': 0.0, 'compound': 0.0}"
145,2022-01-08 16:00:00+00:00,"World tops 2 million new daily COVID cases, shows AFP tally","{'neg': 0.0, 'neu': 0.752, 'pos': 0.248, 'compound': 0.5106}"
146,2022-01-08 16:00:00+00:00,Yes. Its called screening.,"{'neg': 0.0, 'neu': 0.526, 'pos': 0.474, 'compound': 0.4019}"
147,2022-01-08 16:00:00+00:00,"Don't bring COVID-19 back to University.

Take a rapid COVID-19 test before you return. And if you haven't, get your booster vaccine.

For more information on testing ","{'neg': 0.0, 'neu': 1.0, 'pos': 0.0, 'compound': 0.0}"
148,2022-01-08 16:00:00+00:00,"Starting a new thread re: COVID experience. Fully vaxxed (Pfizer, 2nd dose in May 2021) &amp; boostered (Pfizer, November 2021).","{'neg': 0.0, 'neu': 1.0, 'pos': 0.0, 'compound': 0.0}"
149,2022-01-08 16:00:00+00:00,"The #AmherstMA Board of Health announced they will be delaying any action of a vaccine mandate for certain Amherst businesses such as restaurants, gyms and others during their emergency meeting on Dec. 30. #COVID19 #WesternMA #VaccineMandates
https://t.co/cKjecynUy6","{'neg': 0.065, 'neu': 0.882, 'pos': 0.053, 'compound': -0.128}"
150,2022-01-08 16:00:00+00:00,RT The pandemic isn't ending because the people in power don't want it to,"{'neg': 0.086, 'neu': 0.914, 'pos': 0.0, 'compound': -0.0572}"
151,2022-01-08 16:00:00+00:00,"launched #air purification systems for #cars and #buses clears out more than 95 percent of viruses, including #Covid19. #CES
https://t.co/9AFzHOPGBU","{'neg': 0.0, 'neu': 0.865, 'pos': 0.135, 'compound': 0.2023}"
152,2022-01-08 16:00:00+00:00,"Home births are on the rise in CT; pandemic the reason, mothers say:","{'neg': 0.0, 'neu': 1.0, 'pos': 0.0, 'compound': 0.0}"
153,2022-01-08 16:00:00+00:00,"The Omicron variant has changed the nature of the pandemic, making it far harder to contain. 
https://t.co/1WSQMU6Nbv","{'neg': 0.0, 'neu': 1.0, 'pos': 0.0, 'compound': 0.0}"
154,2022-01-08 16:00:00+00:00,"#RoyalCaribbean Cruises Ltd has paused some of its cruise operations amid rising numbers of #COVID19 infections due to the #Omicron variant.

Read more:","{'neg': 0.0, 'neu': 1.0, 'pos': 0.0, 'compound': 0.0}"
155,2022-01-08 16:00:00+00:00,"Listen to our bilingual phone-in programme on #COVID19 

LIVE","{'neg': 0.0, 'neu': 1.0, 'pos': 0.0, 'compound': 0.0}"
156,2022-01-08 16:00:00+00:00,RT Lionel Messi has been providing us with art like the ghost of Mozart for nearly 20 years and people are mad that he's taking...,"{'neg': 0.183, 'neu': 0.733, 'pos': 0.083, 'compound': -0.4588}"
157,2022-01-08 16:00:00+00:00,"A peak in #omicron cases in the U.S. is coming soon, says #infectiousdisease modeler Here'e what to expect: ","{'neg': 0.0, 'neu': 1.0, 'pos': 0.0, 'compound': 0.0}"
158,2022-01-08 16:00:00+00:00,The show expects Golderberg to return to the panel next week.,"{'neg': 0.0, 'neu': 1.0, 'pos': 0.0, 'compound': 0.0}"
159,2022-01-08 16:00:00+00:00, Covid Test Makers Struggle to Cope With Whiplash From Omicron: Bloomberg,"{'neg': 0.187, 'neu': 0.813, 'pos': 0.0, 'compound': -0.3182}"
160,2022-01-08 16:00:01+00:00,"Michigan currently leads the COVID-19 case rate for incarcerated people with 76 cases per 100 persons, nine times the rate of the entire state.
https://t.co/vHgF3E29Bq","{'neg': 0.0, 'neu': 1.0, 'pos': 0.0, 'compound': 0.0}"
161,2022-01-08 16:00:01+00:00,"Regardless, asymptomatic testing or testing with minor symptoms which, let's face it is the majority of omicron, is currently greatly impacting hospital ERs.","{'neg': 0.0, 'neu': 1.0, 'pos': 0.0, 'compound': 0.0}"
162,2022-01-08 16:00:01+00:00,"RT A question lingering: if Djokovic was claiming a coronavirus positive in last six months as reason for an exemption, whe...","{'neg': 0.0, 'neu': 0.847, 'pos': 0.153, 'compound': 0.5574}"
