,created_at,full_text,sentiment_score
0,2022-01-15 16:59:54+00:00,"RT ""Somebody could show me their fully vaccinated and boosted card and still be positive for COVID,""...""I'm not really sure...","{'neg': 0.085, 'neu': 0.666, 'pos': 0.249, 'compound': 0.6352}"
1,2022-01-15 16:59:54+00:00,RT The Supreme Court Has Anointed Itself Czar of the Country's COVID Rules | By Kimberly Wehle,"{'neg': 0.0, 'neu': 0.816, 'pos': 0.184, 'compound': 0.5574}"
2,2022-01-15 16:59:54+00:00,"RT COVID relief funds diverted to NY CRT-style K-12 training via Biden American Rescue Plan | Just The News 

https://t.c...","{'neg': 0.0, 'neu': 0.738, 'pos': 0.262, 'compound': 0.7506}"
3,2022-01-15 16:59:55+00:00,Covid......,"{'neg': 0.0, 'neu': 1.0, 'pos': 0.0, 'compound': 0.0}"
4,2022-01-15 16:59:55+00:00,RT The fact that one of Minnesota's busiest COVID testing locations has to move out of the convention center for a week b...,"{'neg': 0.0, 'neu': 1.0, 'pos': 0.0, 'compound': 0.0}"
5,2022-01-15 16:59:55+00:00,"RT When anti-vaxxers get COVID, why do they go to emergency rooms? Why don't they stick with natural immunity instead of je...","{'neg': 0.104, 'neu': 0.797, 'pos': 0.1, 'compound': -0.0258}"
6,2022-01-15 16:59:55+00:00,Me yesterday in zoom.  Felt weird yet terrible headache at the end of the day tested positive for Covid. ,"{'neg': 0.197, 'neu': 0.656, 'pos': 0.148, 'compound': -0.0516}"
7,2022-01-15 16:59:55+00:00,"I have big plans today to magically turn some bulk pinto beans into a big pot of delicious frijoles refritos, watch old movies on the Criterion channel with the pup, play a million games of Words with Friends, and shake this non-covid cold and sore throat. No more, no less.","{'neg': 0.105, 'neu': 0.707, 'pos': 0.187, 'compound': 0.7168}"
8,2022-01-15 16:59:55+00:00,"The reminder:
""A 75-year-old man seen on video being brutally beaten inside a Detroit nursing home earlier this year has died.""
""Hayden had been diagnosed with COVID-19...,who added he should have never been at the senior facility.""","{'neg': 0.234, 'neu': 0.766, 'pos': 0.0, 'compound': -0.886}"
9,2022-01-15 16:59:55+00:00,RT Coughing your head off?  Check out this week's blog for some great do's and don'ts.,"{'neg': 0.0, 'neu': 0.785, 'pos': 0.215, 'compound': 0.6249}"
10,2022-01-15 16:59:55+00:00,"RT COVID-19 is one of the most formidable enemies America has ever faced. We've got to work together, not against each other.
 
Get...","{'neg': 0.137, 'neu': 0.863, 'pos': 0.0, 'compound': -0.539}"
11,2022-01-15 16:59:55+00:00,RT Until Covid is over can we cancel Friday as a weekday and just add it to the weekend? M-Thurs is enough,"{'neg': 0.087, 'neu': 0.913, 'pos': 0.0, 'compound': -0.25}"
12,2022-01-15 16:59:55+00:00,RT Yet another US Capitol breach defendant asks court to move his criminal case away from DC jurors.. and into his hometow...,"{'neg': 0.139, 'neu': 0.861, 'pos': 0.0, 'compound': -0.5267}"
13,2022-01-15 16:59:55+00:00,"RT Meanwhile, in the Fascist Republic of Australia, police arrest an elderly lady after being ""tipped off"" that she wasn't...","{'neg': 0.25, 'neu': 0.75, 'pos': 0.0, 'compound': -0.7184}"
14,2022-01-15 16:59:55+00:00,RT ironic that going back to how we used to live usually means technologies that were worse for the environment,"{'neg': 0.204, 'neu': 0.796, 'pos': 0.0, 'compound': -0.5574}"
15,2022-01-15 16:59:55+00:00,"RT FRANCE  -  Regardless of your vaccine status, we must all stand together now. It's time to end mandates and vaccine pa...","{'neg': 0.0, 'neu': 1.0, 'pos': 0.0, 'compound': 0.0}"
16,2022-01-15 16:59:55+00:00,"RT Personal News: Omicron got me:)

Two weeks ago I developed symptoms and tested +ve

Sharing five lessons I learned from t...","{'neg': 0.0, 'neu': 0.882, 'pos': 0.118, 'compound': 0.4215}"
17,2022-01-15 16:59:55+00:00,RT The Covid-19 pandemic has made me realize how many INCREDIBLY SELFISH people there are in this country.,"{'neg': 0.222, 'neu': 0.778, 'pos': 0.0, 'compound': -0.7058}"
18,2022-01-15 16:59:55+00:00,the path back to normal? depends on your interpretation of path &amp; normal. cdc had to change the definition of vax in order for the experimental covid shots to be covered. covid shots cause harm to many; some even death AND does not stop the virus;its transmission for anyone.,"{'neg': 0.134, 'neu': 0.832, 'pos': 0.034, 'compound': -0.7588}"
19,2022-01-15 16:59:55+00:00,thank you shay :( covid really beating my ass rn. i'm scared,"{'neg': 0.575, 'neu': 0.313, 'pos': 0.112, 'compound': -0.8849}"
20,2022-01-15 16:59:55+00:00,"RT ""Breaking News""","{'neg': 0.0, 'neu': 1.0, 'pos': 0.0, 'compound': 0.0}"
21,2022-01-15 16:59:55+00:00,"RT pro-terrorist 

pro-Covid 

that's Fox today, the fifth column.","{'neg': 0.0, 'neu': 1.0, 'pos': 0.0, 'compound': 0.0}"
22,2022-01-15 16:59:55+00:00,"RT MELBOURNE, AUSTRALIA: A huge crowd marches against Covid restrictions and mandates.

https://t.co/ymEhZ36UcI","{'neg': 0.0, 'neu': 0.839, 'pos': 0.161, 'compound': 0.3182}"
23,2022-01-15 16:59:55+00:00,RT Did China write this,"{'neg': 0.0, 'neu': 1.0, 'pos': 0.0, 'compound': 0.0}"
24,2022-01-15 16:59:55+00:00,"RT saw this vid from someone who tested positive for covid-19, got a checkup thru e-konsulta and was given covid-19 care kit FO...","{'neg': 0.0, 'neu': 0.755, 'pos': 0.245, 'compound': 0.7783}"
25,2022-01-15 16:59:55+00:00,RT Wordle is the sourdough starter of Omicron.,"{'neg': 0.0, 'neu': 1.0, 'pos': 0.0, 'compound': 0.0}"
26,2022-01-15 16:59:55+00:00,"RT I love learning about our history and going through archives to find photographs like these. During lockdown, I wanted to sh...","{'neg': 0.0, 'neu': 0.749, 'pos': 0.251, 'compound': 0.7717}"
27,2022-01-15 16:59:55+00:00,RT Which country dropped vaccines?  Spreading lies and misinformation. She needs to be prosecuted under Disaster Manageme...,"{'neg': 0.476, 'neu': 0.524, 'pos': 0.0, 'compound': -0.8957}"
28,2022-01-15 16:59:56+00:00,"RT I would like to point out that even the biggest noob in pandemic management, like me, read in a textbook ages ago that rapid...","{'neg': 0.043, 'neu': 0.78, 'pos': 0.177, 'compound': 0.5859}"
29,2022-01-15 16:59:56+00:00,RT This is on everyone who has fear mongered vaccines for partisan political purposes. Which is an infuriatingly long list who...,"{'neg': 0.138, 'neu': 0.862, 'pos': 0.0, 'compound': -0.4939}"
30,2022-01-15 16:59:56+00:00,"RT Masks + vaccines + boosters = best protection against #Omicron.

When you wear a mask, you help protect yourself &amp; others from...","{'neg': 0.0, 'neu': 0.678, 'pos': 0.322, 'compound': 0.8591}"
31,2022-01-15 16:59:56+00:00,"RT We want online exam as new variant of corona is spreading day by day, we all students can't handle this. #bteuponlinee...","{'neg': 0.0, 'neu': 0.942, 'pos': 0.058, 'compound': 0.0772}"
32,2022-01-15 16:59:56+00:00,RT The 6 justices who held OSHA lacks power to address Covid because the virus isn't limited to the workplace are blinded by the...,"{'neg': 0.0, 'neu': 0.932, 'pos': 0.068, 'compound': 0.1695}"
33,2022-01-15 16:59:56+00:00,"RT Spot the difference:

Italy  class size: 20 pupils
Masks in class: YES
Even in primary: YES
Contact tracing: YES
Less disr...","{'neg': 0.0, 'neu': 0.648, 'pos': 0.352, 'compound': 0.8833}"
34,2022-01-15 16:59:56+00:00,"RT I am trying to get my head around this: a year into Biden inflation is at a 30 year high, he left Americans behind in AF...","{'neg': 0.0, 'neu': 1.0, 'pos': 0.0, 'compound': 0.0}"
35,2022-01-15 16:59:56+00:00,RT I will provide sandwiches this weekend to members of staff who're vaxxed + boosted but afraid they'll...,"{'neg': 0.0, 'neu': 0.907, 'pos': 0.093, 'compound': 0.1901}"
36,2022-01-15 16:59:56+00:00,Not everyone can be as cool as you drinking corona in a blazer at what I'm sure is an amazing PUA workshop.,"{'neg': 0.0, 'neu': 0.693, 'pos': 0.307, 'compound': 0.8126}"
37,2022-01-15 16:59:56+00:00,"RT Regardless of where you live, pay close attention to your local weather forecast to get prepared, and to know whether it's...","{'neg': 0.06, 'neu': 0.858, 'pos': 0.082, 'compound': 0.128}"
38,2022-01-15 16:59:56+00:00,They're doing walk ins at West Angeles till 2 for PCR Covid testing,"{'neg': 0.0, 'neu': 1.0, 'pos': 0.0, 'compound': 0.0}"
39,2022-01-15 16:59:56+00:00,RT then I'm asymptomatic as fck,"{'neg': 0.0, 'neu': 1.0, 'pos': 0.0, 'compound': 0.0}"
40,2022-01-15 16:59:56+00:00,RT The Vaccine Clinic is OPEN and our superheroes are here! Come get your shot and meet some special friends!,"{'neg': 0.0, 'neu': 0.738, 'pos': 0.262, 'compound': 0.7494}"
41,2022-01-15 16:59:56+00:00,For example I live in Colorado and like millions in the US I do not have health care. Nobody is outraged about this in middle of pandemic instead they blame infected when they die from lack of care.,"{'neg': 0.334, 'neu': 0.559, 'pos': 0.106, 'compound': -0.9048}"
42,2022-01-15 16:59:56+00:00,RT BREAKING REPORT: Florida WILL NOT Enforce Centers for Medicare &amp; Medicaid Services (CMS) Vaccine Mandate Upheld by SCOTU...,"{'neg': 0.0, 'neu': 1.0, 'pos': 0.0, 'compound': 0.0}"
43,2022-01-15 16:59:56+00:00,RT This is why I'm not giving up any guns.,"{'neg': 0.184, 'neu': 0.816, 'pos': 0.0, 'compound': -0.2584}"
44,2022-01-15 16:59:56+00:00,"China virus is not an enemy.  Wellll, maybe it is?  Chinese origin,  widely distributed.  

Where are you getting the 10%?","{'neg': 0.0, 'neu': 0.855, 'pos': 0.145, 'compound': 0.4956}"
45,2022-01-15 16:59:56+00:00,RT Covid is really proving how much jobs don't care about their employees.,"{'neg': 0.18, 'neu': 0.82, 'pos': 0.0, 'compound': -0.3875}"
46,2022-01-15 16:59:56+00:00,"Same story repeated all over the world with extremely high vaccination rates. Such as UK, Israel plenty of EU countries etc. The idea of losing thousands of skilled healthcare workers over a vaccine that doesn't do much for transmission is absolutely insane.","{'neg': 0.123, 'neu': 0.877, 'pos': 0.0, 'compound': -0.6801}"
47,2022-01-15 16:59:57+00:00,Eugene is a huge racist &amp; far far leftie who cannot write a column that isn't biased against whites and conservatives !,"{'neg': 0.146, 'neu': 0.693, 'pos': 0.161, 'compound': -0.291}"
48,2022-01-15 16:59:57+00:00,"Nyi nyi nyi nyi nyi nyi nyi....  I have it so bad...  Terrible date.  You treat me so bad and rent the whole cinema.

Please, remind the woman that almost 900,000 Americans are dead of COVID and that young people her age elsewhere in armed combat fighting to save their lives.","{'neg': 0.294, 'neu': 0.591, 'pos': 0.115, 'compound': -0.9282}"
49,2022-01-15 16:59:57+00:00,RT Covid is really proving how much jobs don't care about their employees.,"{'neg': 0.18, 'neu': 0.82, 'pos': 0.0, 'compound': -0.3875}"
50,2022-01-15 16:59:57+00:00,"RT 50,000 daily COVID cases before the vaccine came out, and 1,000,000 a year after. The goal of the vaccine was to stop t...","{'neg': 0.087, 'neu': 0.913, 'pos': 0.0, 'compound': -0.296}"
51,2022-01-15 16:59:57+00:00,"RT Scotland had 7 deaths 'with' COVID in August 2020.

They had 239 deaths 'with' COVID in August 2021.","{'neg': 0.0, 'neu': 1.0, 'pos': 0.0, 'compound': 0.0}"
52,2022-01-15 16:59:57+00:00,RT My bile rises as I'm asked to move my dying cancer patient out of ICU to make room for an unvaccinated man with Covid...,"{'neg': 0.155, 'neu': 0.845, 'pos': 0.0, 'compound': -0.6597}"
53,2022-01-15 16:59:57+00:00,"Omicron is sooooo scary.
There is no test to identify if anyone actually has it.
Dems are all in to terrorize Americans 24/7 to pull off more rigged elections.
They know their ""pandemic"" is totally fake.","{'neg': 0.339, 'neu': 0.661, 'pos': 0.0, 'compound': -0.9421}"
54,2022-01-15 16:59:57+00:00,"#iitkharagpur : Twenty more #COVID19 cases reported on the IITKGP campus

#iitkgp #iitk #iit #covid19 #CovidTesting #CoronaUpdatesInIndia #OmicronVariant #OmicronInIndia #EducationNews 

https://t.co/5g0xA7ALJ5","{'neg': 0.0, 'neu': 1.0, 'pos': 0.0, 'compound': 0.0}"
55,2022-01-15 16:59:57+00:00,Confirmation of police investigation in London.,"{'neg': 0.0, 'neu': 1.0, 'pos': 0.0, 'compound': 0.0}"
56,2022-01-15 16:59:57+00:00,RT So SCOTUS claims they don't have a right to decide people's medical decisions. So they won't enforce a vaccine/testing...,"{'neg': 0.0, 'neu': 1.0, 'pos': 0.0, 'compound': 0.0}"
57,2022-01-15 16:59:57+00:00,RT Funding and time should be provided to teachers to be up-to-date with technology. A great example for this is COVID. All...,"{'neg': 0.0, 'neu': 0.837, 'pos': 0.163, 'compound': 0.6249}"
58,2022-01-15 16:59:57+00:00,RT COVID cases are immensely increasing and the situation is getting worse day by day. It is not at all safe for the student...,"{'neg': 0.2, 'neu': 0.8, 'pos': 0.0, 'compound': -0.6711}"
59,2022-01-15 16:59:57+00:00,RT Preliminary investigations conducted by the Chinese authorities have found no clear evidence of human-to-human transmission of the...,"{'neg': 0.114, 'neu': 0.886, 'pos': 0.0, 'compound': -0.2924}"
60,2022-01-15 16:59:57+00:00,"one of the fun parts of covering chinese games with any kind of race controversy attached is that i have to read comments about how prejudice against chinese people/culture isn't ""real"" racism. 

like dang, did people just fall asleep during the entire pandemic or something?","{'neg': 0.102, 'neu': 0.774, 'pos': 0.124, 'compound': 0.2924}"
61,2022-01-15 16:59:57+00:00,ARCpoint Labs is here for all of your travel needs. We offer reliable COVID tests for your peace of mind before your next trip.  Check out our website for more information,"{'neg': 0.0, 'neu': 0.896, 'pos': 0.104, 'compound': 0.5423}"
62,2022-01-15 16:59:57+00:00,"Without Biden he wouldn't have a penny of this from the federal government. Yet he slams Biden for his diligent work to get COVID-19 under control.   DeSantis signs $101 billion budget laden with federal COVID-19 money
By GRAY ROHRER
ORLANDO SENTINEL
JUN 02, 2021","{'neg': 0.0, 'neu': 1.0, 'pos': 0.0, 'compound': 0.0}"
63,2022-01-15 16:59:57+00:00,"RT Lesson 1: Masks work

I've been around COVID patients over 1000 times in ~2 years and didn't get infected due to masks/PP...","{'neg': 0.0, 'neu': 0.893, 'pos': 0.107, 'compound': 0.3875}"
64,2022-01-15 16:59:57+00:00,"RT He is fully vaccinated. Yet he still got Covid. And ""experts"" conclude his heart condition is linked to his bout with COVI...","{'neg': 0.0, 'neu': 0.84, 'pos': 0.16, 'compound': 0.6369}"
65,2022-01-15 16:59:58+00:00,RT I am continually surprised at the number of anti-vaxxers I know who still have not gotten Covid!,"{'neg': 0.0, 'neu': 0.821, 'pos': 0.179, 'compound': 0.3595}"
66,2022-01-15 16:59:58+00:00,RT Ron DeSantis refuses to say whether he's been boosted because he's afraid to scare his base but says Justice Roberts an...,"{'neg': 0.077, 'neu': 0.692, 'pos': 0.231, 'compound': 0.6428}"
67,2022-01-15 16:59:58+00:00,"Home sales on the East Shore/Nevada side of Lake Tahoe have quadrupled since the pandemic began in March 2020 and two years later, while the pandemic rages on, the market shows no signs of slowing down. 
#realestate #laketahoe 

https://t.co/GX5eT2BJ5O","{'neg': 0.125, 'neu': 0.875, 'pos': 0.0, 'compound': -0.6486}"
68,2022-01-15 16:59:58+00:00,RT Yup. They wear a vest that says Covid Enforcement on the back.,"{'neg': 0.0, 'neu': 1.0, 'pos': 0.0, 'compound': 0.0}"
69,2022-01-15 16:59:58+00:00,"RT Dan Crenshaw as profited from the pandemic so of course he doesn't want it to end.

https://t.co/LrUqF7GS7g","{'neg': 0.063, 'neu': 0.82, 'pos': 0.118, 'compound': 0.2681}"
70,2022-01-15 16:59:58+00:00,"RT #BreakingNews 

UAE reports 3,116 new COVID-19 cases, 3 deaths and 1,182 recoveries","{'neg': 0.0, 'neu': 1.0, 'pos': 0.0, 'compound': 0.0}"
71,2022-01-15 16:59:58+00:00,"*Amongst past reported cases, 692 Omicron cases were confirmed today, of whom 541 are local and 151 are imported.","{'neg': 0.0, 'neu': 1.0, 'pos': 0.0, 'compound': 0.0}"
72,2022-01-15 16:59:58+00:00,I've accepted the fact that this pandemic is never ending. I'm just gonna live my life. I'm vaccinated and I'll get the boosters. Idc,"{'neg': 0.0, 'neu': 0.916, 'pos': 0.084, 'compound': 0.2732}"
73,2022-01-15 16:59:58+00:00,"RT When 50 percent of a remote FN community gets #covid, it's a reminder that structural factors like housing, heating, runnin...","{'neg': 0.0, 'neu': 0.889, 'pos': 0.111, 'compound': 0.3612}"
74,2022-01-15 16:59:58+00:00,RT The Covid vaccines now protecting millions of people are the culmination of decades of fundamental discoveries once shrugged o...,"{'neg': 0.0, 'neu': 1.0, 'pos': 0.0, 'compound': 0.0}"
75,2022-01-15 16:59:58+00:00,"RT West Bengal has extended coronavirus-related restrictions till January 31.

GoWB has permitted marriage events to be h...","{'neg': 0.0, 'neu': 1.0, 'pos': 0.0, 'compound': 0.0}"
76,2022-01-15 16:59:58+00:00,RT How was this ever allowed to happen #COVID19 #Omicron #BorisJohnsonResign,"{'neg': 0.0, 'neu': 1.0, 'pos': 0.0, 'compound': 0.0}"
77,2022-01-15 16:59:58+00:00,"It's a pandemic.  There are new findings every day.  I don't fault the CDC for doing their best as this virus changes and mutates, as new, peer reviewed research comes in from around the world.","{'neg': 0.0, 'neu': 0.836, 'pos': 0.164, 'compound': 0.7549}"
78,2022-01-15 16:59:58+00:00,"Compare that number with other diseases.
How many of them died ""of covid"" and how many died "" with covid""?","{'neg': 0.282, 'neu': 0.667, 'pos': 0.051, 'compound': -0.7845}"
79,2022-01-15 16:59:58+00:00,RT A huge thanks to for the contribution to the #nuestramejorvictoria campaign helping those in need in the fight...,"{'neg': 0.104, 'neu': 0.6, 'pos': 0.296, 'compound': 0.5859}"
80,2022-01-15 16:59:58+00:00,"RT Finland: ""Our estimate is that children will not be the driving force behind the pandemic, so all restrictions related to chi...","{'neg': 0.0, 'neu': 1.0, 'pos': 0.0, 'compound': 0.0}"
81,2022-01-15 16:59:58+00:00,"RT I'm fully vaxxed and boosted (as of 3 months ago), no positive covid tests but may have had it, having heart palpitati...","{'neg': 0.066, 'neu': 0.675, 'pos': 0.259, 'compound': 0.7731}"
82,2022-01-15 16:59:58+00:00,RT BREAKING REPORT: Florida WILL NOT Enforce Centers for Medicare &amp; Medicaid Services (CMS) Vaccine Mandate Upheld by SCOTU...,"{'neg': 0.0, 'neu': 1.0, 'pos': 0.0, 'compound': 0.0}"
83,2022-01-15 16:59:58+00:00,"RT COVID-19 is one of the most formidable enemies America has ever faced. We've got to work together, not against each other.
 
Get...","{'neg': 0.137, 'neu': 0.863, 'pos': 0.0, 'compound': -0.539}"
84,2022-01-15 16:59:58+00:00,RT The DC vaccine mandate kicks in this weekend. My office will not comply. We will not show papers. We will not order ta...,"{'neg': 0.0, 'neu': 1.0, 'pos': 0.0, 'compound': 0.0}"
85,2022-01-15 16:59:58+00:00,"RT Scolding isn't big Deal!!

What about bullying, Abusing, threatening ,Breaking pandemic protocol!

If this is way of servin...","{'neg': 0.411, 'neu': 0.589, 'pos': 0.0, 'compound': -0.9037}"
86,2022-01-15 16:59:58+00:00,"Correct. 
Truly, they're sorry they got caught.","{'neg': 0.141, 'neu': 0.543, 'pos': 0.315, 'compound': 0.3818}"
87,2022-01-15 16:59:58+00:00,RT YouTube has suspended Dan Bongino for spreading COVID disinformation.,"{'neg': 0.256, 'neu': 0.744, 'pos': 0.0, 'compound': -0.4767}"
88,2022-01-15 16:59:58+00:00,RT korea has been keeping Netflix's lights on,"{'neg': 0.0, 'neu': 1.0, 'pos': 0.0, 'compound': 0.0}"
89,2022-01-15 16:59:58+00:00,"RT Rival fans: 'You can't apply to postpone the match, you're not allowed. No one's got Covid, Lasagna gate bla bla'

Arse...","{'neg': 0.0, 'neu': 0.849, 'pos': 0.151, 'compound': 0.3724}"
90,2022-01-15 16:59:58+00:00,Facebook Support system hardly respond to complaints like these because they have less staffs due to the pandemic so save yourself the stress and find a way to contact he would  help you retrieve your account and teach you how to secure your accounts,"{'neg': 0.092, 'neu': 0.653, 'pos': 0.254, 'compound': 0.8473}"
91,2022-01-15 16:59:58+00:00,New Brunswick LOCKDOWN - but sending you BRIGHT LIGHT OF LOVE.  Hi Anna - wanted to include you - been offline PCS/TBI storm / cold air is awesome just bites a bit.,"{'neg': 0.037, 'neu': 0.593, 'pos': 0.37, 'compound': 0.9625}"
92,2022-01-15 16:59:59+00:00,"RT 2 years ago today. 
Never forget their incompetence.","{'neg': 0.0, 'neu': 0.616, 'pos': 0.384, 'compound': 0.5216}"
93,2022-01-15 16:59:59+00:00,"RT We now know that during lockdown, numerous parties took place at 10 Downing Street. 

The Conservative Party has a total lack...","{'neg': 0.096, 'neu': 0.704, 'pos': 0.2, 'compound': 0.4228}"
94,2022-01-15 16:59:59+00:00,"Well done ... they just made us take off our N95 masks and wear the standard ones, even though they're all wearing N95 ones ... this virus is weird ","{'neg': 0.055, 'neu': 0.877, 'pos': 0.068, 'compound': 0.1027}"
95,2022-01-15 16:59:59+00:00,RT Now we know that the communal frenzy whipped up online against Tablighis and Muslims in general in the early days of Covi...,"{'neg': 0.095, 'neu': 0.905, 'pos': 0.0, 'compound': -0.3182}"
96,2022-01-15 16:59:59+00:00,RT All in this together!,"{'neg': 0.0, 'neu': 1.0, 'pos': 0.0, 'compound': 0.0}"
97,2022-01-15 16:59:59+00:00,"The CDC just admitted if you took the virus it can cause immune problems,  and even enlarging the organs of your body","{'neg': 0.107, 'neu': 0.751, 'pos': 0.142, 'compound': -0.0258}"
98,2022-01-15 16:59:59+00:00,RT Corona mahamare se bachao ke liye exam online hona chahiye #bteuponlineexam2022,"{'neg': 0.0, 'neu': 1.0, 'pos': 0.0, 'compound': 0.0}"
99,2022-01-15 16:59:59+00:00,"Another cracking article.

""Longstanding research shows that your mood at any given point in time is a function of your reality minus your expectations.

The greater the mismatch between too-rosy expectations and reality, the worse you'll feel.""","{'neg': 0.076, 'neu': 0.862, 'pos': 0.062, 'compound': -0.1531}"
100,2022-01-15 16:59:59+00:00,"It's already been proven by the numbers of covid-19 that vaccines do not do very much to stop the spread, they provide protection to yourself, and they're not even available to everyone. Physical fitness also helps protect people from severe covid-19 sickness. Surprise surprise","{'neg': 0.095, 'neu': 0.691, 'pos': 0.215, 'compound': 0.6637}"
101,2022-01-15 16:59:59+00:00,Jesus fucking Christ you're an idiot. Coronavirus is an RNA virus and you know absolutely NOTHING about virology so stop fucking embarrassing yourself.,"{'neg': 0.318, 'neu': 0.682, 'pos': 0.0, 'compound': -0.8527}"
102,2022-01-15 16:59:59+00:00,"RT After #COVID19 Third wave
First big film 
#BheemlaNayakOn25thFeb ","{'neg': 0.0, 'neu': 1.0, 'pos': 0.0, 'compound': 0.0}"
103,2022-01-15 16:59:59+00:00,"RT Completely Surprised...NOT.
Nearly 4-in-10 Illegal Aliens Refuse Vax as Americans Face Mandates via...","{'neg': 0.326, 'neu': 0.674, 'pos': 0.0, 'compound': -0.7003}"
104,2022-01-15 16:59:59+00:00,"RT $OCGN Ocugen can supply the #covaxin vaccine to the US  and the world  only should be approved by 

COVID19 vacc...","{'neg': 0.0, 'neu': 0.877, 'pos': 0.123, 'compound': 0.4215}"
105,2022-01-15 17:00:00+00:00,"RT Florida adds 430,297 Covid cases, 470 deaths in past week
https://t.co/UzUomy9XGA","{'neg': 0.0, 'neu': 1.0, 'pos': 0.0, 'compound': 0.0}"
106,2022-01-15 17:00:00+00:00,RT This. I personally know 2 surgeons who can only operate at &lt;50% of their previous capacity due to #longcovid. Several other...,"{'neg': 0.0, 'neu': 1.0, 'pos': 0.0, 'compound': 0.0}"
107,2022-01-15 17:00:00+00:00,"RT As a fellow surgeon, and someone that has been on your show -- I'm incredibly disappointed that you are willing to politic...","{'neg': 0.134, 'neu': 0.866, 'pos': 0.0, 'compound': -0.5256}"
108,2022-01-15 17:00:00+00:00,Bt our new bowlers Siraj n shardul both did well in ENG tht too in covid era  anyways wht jealously  he bowled well he gt wkts thts it he didn't bowled well evn a ordinary wade smacked him simple if he does well in major country thn ok otherwise (cont.),"{'neg': 0.082, 'neu': 0.733, 'pos': 0.185, 'compound': 0.6187}"
109,2022-01-15 17:00:00+00:00,Stanford University: Repeal Stanford University's COVID-19 booster vaccine mandate via,"{'neg': 0.0, 'neu': 1.0, 'pos': 0.0, 'compound': 0.0}"
110,2022-01-15 17:00:00+00:00,#Covid19 directs only those requiring emergency care to visit hospitals to avoid crowding &amp; further spread of the pandemic.,"{'neg': 0.2, 'neu': 0.667, 'pos': 0.133, 'compound': -0.1531}"
111,2022-01-15 17:00:00+00:00,"RT The 47th ranked player in the world, double jabbed, was welcomed into Australia and THEN tested positive!

Meanwhile the...","{'neg': 0.0, 'neu': 0.741, 'pos': 0.259, 'compound': 0.7424}"
112,2022-01-15 17:00:00+00:00,"""If anything is going to eat into whatever support is left for Boris Johnson in this country, it's a story that combines Downing Street lockdown parties and the Queen mourning alone.""

https://t.co/FIKfcHau46","{'neg': 0.128, 'neu': 0.731, 'pos': 0.141, 'compound': 0.128}"
113,2022-01-15 17:00:00+00:00,RT What more could you ask for in a vaccine?? has the remedy.,"{'neg': 0.0, 'neu': 1.0, 'pos': 0.0, 'compound': 0.0}"
114,2022-01-15 17:00:00+00:00,"COVID-19 was the leading cause of death among police officers in 2021, report says
","{'neg': 0.231, 'neu': 0.769, 'pos': 0.0, 'compound': -0.5994}"
115,2022-01-15 17:00:00+00:00,"RT ""This ruling is a damning indictment of the culture of secrecy and spin at the heart of the SNP"" - 

https:...","{'neg': 0.09, 'neu': 0.752, 'pos': 0.158, 'compound': 0.4215}"
116,2022-01-15 17:00:00+00:00,"2022 will be a critical year for Prime Minister Kishida Fumio.
https://t.co/Vxte27f8Kt","{'neg': 0.173, 'neu': 0.827, 'pos': 0.0, 'compound': -0.3182}"
117,2022-01-15 17:00:00+00:00,"RT COVID-19 is one of the most formidable enemies America has ever faced. We've got to work together, not against each other.
 
Get...","{'neg': 0.137, 'neu': 0.863, 'pos': 0.0, 'compound': -0.539}"
