,created_at,full_text,sentiment_score
0,2022-01-08 15:59:54+00:00,"Doctor Ethers TikTok'r For Flexing About 'Bad Bunny' Concert During The Coronavirus Pandemic!

 Posted by Thrillz

https://t.co/XhaGRKDsUN","{'neg': 0.192, 'neu': 0.808, 'pos': 0.0, 'compound': -0.5848}"
1,2022-01-08 15:59:54+00:00,RT Imagine my shock.,"{'neg': 0.464, 'neu': 0.536, 'pos': 0.0, 'compound': -0.3818}"
2,2022-01-08 15:59:54+00:00,"Why? It surely makes much more sense to test when you have fewer cases, not when there's a pandemic and how can assume most people will get it, but usually mildly?","{'neg': 0.0, 'neu': 0.929, 'pos': 0.071, 'compound': 0.3204}"
3,2022-01-08 15:59:54+00:00,"Or just get the fucking vaccine because ""natural immunity"" is a hoax.","{'neg': 0.141, 'neu': 0.673, 'pos': 0.186, 'compound': 0.1689}"
4,2022-01-08 15:59:54+00:00, you are making me howl with laughter. Omicron deaths are in... Have you heard yourself. It's a mild cold even the South Africans where it originated cannot believe the hysteria the west have created over it. We look ridiculous,"{'neg': 0.055, 'neu': 0.776, 'pos': 0.169, 'compound': 0.6256}"
5,2022-01-08 15:59:54+00:00,A comprehensive guide to remote work for both home workers and companies #remotejobs #remotework #COVID #workfromhome #homeoffice #wfh #digitaltransformation,"{'neg': 0.0, 'neu': 0.9, 'pos': 0.1, 'compound': 0.25}"
6,2022-01-08 15:59:54+00:00,"RT Your immune system does not know how to properly fight off a novel virus like COVID.
The vaccines help. They may not keep yo...","{'neg': 0.08, 'neu': 0.619, 'pos': 0.3, 'compound': 0.7269}"
7,2022-01-08 15:59:55+00:00,RT Covid spreading like michoacana store fronts,"{'neg': 0.0, 'neu': 0.706, 'pos': 0.294, 'compound': 0.3612}"
8,2022-01-08 15:59:55+00:00,could you please send me@letter stating what a bad person I am? Can it be suitable for framing? Thanks! GO BLUE,"{'neg': 0.128, 'neu': 0.658, 'pos': 0.214, 'compound': 0.3296}"
9,2022-01-08 15:59:55+00:00,RT We again stand at a juncture where we are battling a COVID wave. Without discussing how dangerous this new variant may...,"{'neg': 0.085, 'neu': 0.811, 'pos': 0.104, 'compound': 0.1164}"
10,2022-01-08 15:59:55+00:00,"RT I can't stop thinking about how many people lost out on time with their families, a paycheck, and potentially life-saving i...","{'neg': 0.095, 'neu': 0.827, 'pos': 0.078, 'compound': -0.1058}"
11,2022-01-08 15:59:55+00:00,"If this is what they're willing to tell you now... Imagine 6 months from now.

Remember the whole myocarditis thing? It was a conspiracy theory for the first year. Then it was a ""minor"" possibility.... Now it has made the covid vax the deadliest vax in history.","{'neg': 0.069, 'neu': 0.931, 'pos': 0.0, 'compound': -0.5267}"
12,2022-01-08 15:59:55+00:00,RT rajapakshe regime is a pandemic itself,"{'neg': 0.0, 'neu': 1.0, 'pos': 0.0, 'compound': 0.0}"
13,2022-01-08 15:59:55+00:00,RT El Salvador 'Covid' health pack,"{'neg': 0.0, 'neu': 1.0, 'pos': 0.0, 'compound': 0.0}"
14,2022-01-08 15:59:55+00:00,the insinuation that covid flares up as a conspiracy to help Democrats win elections only exists in right-wing fever dreams. it makes literally zero sense (how can any one person or group control a virus?!?) yet soooo many folks believe it.,"{'neg': 0.068, 'neu': 0.736, 'pos': 0.196, 'compound': 0.7545}"
15,2022-01-08 15:59:55+00:00,RT The risk of developing diabetes from Covid in kids &lt;18 years old was significantly increased: 31% and 116% in 2 very large d...,"{'neg': 0.08, 'neu': 0.84, 'pos': 0.08, 'compound': 0.0}"
16,2022-01-08 15:59:55+00:00,RT Where's CNN's COVID tracker? It was on 24/7 during the Trump Administration.,"{'neg': 0.0, 'neu': 1.0, 'pos': 0.0, 'compound': 0.0}"
17,2022-01-08 15:59:55+00:00,RT BREAKING: A group of anti-masker passengers who were caught ignoring mask mandates as they partied on a flight to Mexi...,"{'neg': 0.112, 'neu': 0.788, 'pos': 0.1, 'compound': -0.0772}"
18,2022-01-08 15:59:55+00:00,"RT COVID Update: We now understand the difference between a wave and a tsunami.

What I've tried to understand is how big it get...","{'neg': 0.0, 'neu': 1.0, 'pos': 0.0, 'compound': 0.0}"
19,2022-01-08 15:59:55+00:00,RT Also. Yall. Re omicron: if you're able to get the booster i highly recommend. The rate of cases in the boosted seems to be...,"{'neg': 0.0, 'neu': 0.813, 'pos': 0.187, 'compound': 0.6478}"
20,2022-01-08 15:59:55+00:00,RT A very important study. Are we ok to expose young children to a virus that is being associated with a much higher risk of...,"{'neg': 0.128, 'neu': 0.724, 'pos': 0.148, 'compound': 0.1513}"
21,2022-01-08 15:59:55+00:00,"These kind of practices clearly show if a company respect and care for its employees. Covid 19 is a pandemic, people can't practically avoid it. So it would be kind if for once they think PEOLE before MONEY.","{'neg': 0.0, 'neu': 0.698, 'pos': 0.302, 'compound': 0.923}"
22,2022-01-08 15:59:55+00:00,"RT Imo, the anarchist position on the pandemic is that if people had the resources stolen from them by the State &amp; misinform...","{'neg': 0.127, 'neu': 0.873, 'pos': 0.0, 'compound': -0.4939}"
23,2022-01-08 15:59:55+00:00,"Take it you also approve at the fact that he has lied about testing +ve for Covid on 16/12 seeing as there are photos and footage of him at a function in 17/12.
He's a twat.","{'neg': 0.171, 'neu': 0.829, 'pos': 0.0, 'compound': -0.7906}"
24,2022-01-08 15:59:55+00:00,Fucking took long enough. I was correct in my initial assessment. covid is in fact a little bitch and I will have it beaten by tomorrow.,"{'neg': 0.208, 'neu': 0.792, 'pos': 0.0, 'compound': -0.7436}"
25,2022-01-08 15:59:55+00:00,"RT BTW: this tweet by is SPECIFICALLY aimed at Black people. 

White people don't wait in line to vote.","{'neg': 0.0, 'neu': 1.0, 'pos': 0.0, 'compound': 0.0}"
26,2022-01-08 15:59:55+00:00,"Funny thing abt viruses. Those that vow to destory well the virus makes fools of politicians and big mouths. The chronavirus has 30 mutuations and it has made fools,reveal thier control freak tendencies of the belt. Not to mention it made fools via the vaccinated getting Omicron","{'neg': 0.165, 'neu': 0.746, 'pos': 0.089, 'compound': -0.6486}"
27,2022-01-08 15:59:55+00:00,RT Over 95% of COVID patients occupying Oxygen beds in Mumbai are unvaccinated. Vaccines matter.,"{'neg': 0.0, 'neu': 0.927, 'pos': 0.073, 'compound': 0.0258}"
28,2022-01-08 15:59:55+00:00,This is a new era we living in aba,"{'neg': 0.0, 'neu': 1.0, 'pos': 0.0, 'compound': 0.0}"
29,2022-01-08 15:59:56+00:00,"sure because you are so much smarter than those that dedicated their live to medical and pandemic research

 To bad you are smart enough to know how pandemics actually work - as information changes, the results get refined, guidelines are adapted - your ignorance is a blessing","{'neg': 0.099, 'neu': 0.661, 'pos': 0.239, 'compound': 0.8166}"
30,2022-01-08 15:59:56+00:00,"Wisdom from an Old Man; Rumor has it that the next set of restrictions for COVID-19 will require anyone who has tested positive or has had contact with anyone who tested positive for COVID-19 to yell ""Unclean, unclean"" whenever some approaches within 20 feet.","{'neg': 0.0, 'neu': 0.795, 'pos': 0.205, 'compound': 0.891}"
31,2022-01-08 15:59:56+00:00,"Come on, I didn't say nobody get long Covid, but few children do. According to this, 2% of children may get long-Covid: ","{'neg': 0.0, 'neu': 1.0, 'pos': 0.0, 'compound': 0.0}"
32,2022-01-08 15:59:56+00:00,"Sorry Kate - you've had a shocker here. Your boss told people to stay home due to a ""tsunami"" of infections coming (still waiting on that) and that affected business incomes. That's the point you need to acknowledge and address.","{'neg': 0.108, 'neu': 0.892, 'pos': 0.0, 'compound': -0.3612}"
33,2022-01-08 15:59:56+00:00,"RT If your child complains of headaches, tummy aches, odd feeling in throat &amp; chest post covid, believe them. It's all a bit vag...","{'neg': 0.243, 'neu': 0.704, 'pos': 0.053, 'compound': -0.6597}"
34,2022-01-08 15:59:56+00:00,RT The most accurate depiction of the CDC lol,"{'neg': 0.0, 'neu': 0.741, 'pos': 0.259, 'compound': 0.4215}"
35,2022-01-08 15:59:56+00:00,"Mack said covid can come through text messages, bye ","{'neg': 0.0, 'neu': 1.0, 'pos': 0.0, 'compound': 0.0}"
36,2022-01-08 15:59:56+00:00,Alert: SCOTUS Justices Give Key Signals on How They Will Rule on Biden's COVID Vaccine Mandate via,"{'neg': 0.0, 'neu': 0.879, 'pos': 0.121, 'compound': 0.296}"
37,2022-01-08 15:59:56+00:00,"A story as old as Covid:

They Had Reasons for Leaving the City. So Why Are Their Friends Mad?","{'neg': 0.137, 'neu': 0.73, 'pos': 0.133, 'compound': -0.0258}"
38,2022-01-08 15:59:56+00:00,Maane Delta met Omicron and realized that both were separated at Kumbh Mela ?,"{'neg': 0.0, 'neu': 1.0, 'pos': 0.0, 'compound': 0.0}"
39,2022-01-08 15:59:56+00:00,so glad to read this as a person with many risk factors,"{'neg': 0.136, 'neu': 0.65, 'pos': 0.214, 'compound': 0.2944}"
40,2022-01-08 15:59:56+00:00,The court submission Saturday said Djokovic received confirmation from Australia's Department of Home Affairs saying that his travel declaration had been assessed and that his responses indicated he met the requirements for quarantine-free arrival in Australia.,"{'neg': 0.0, 'neu': 1.0, 'pos': 0.0, 'compound': 0.0}"
41,2022-01-08 15:59:56+00:00,"Australia has 80% vax rate, they're averaging 53k covid cases per day.  They will host a tennis tournament at fully capacity for 2 weeks.  And they plan on keeping people safe by excluding a young healthy person with natural immunity?","{'neg': 0.0, 'neu': 0.82, 'pos': 0.18, 'compound': 0.7964}"
42,2022-01-08 15:59:56+00:00,"RT Literally everybody

I get bloodwork done at least 2x per year, each doctor's visit. What do you think that's for? People...","{'neg': 0.0, 'neu': 1.0, 'pos': 0.0, 'compound': 0.0}"
43,2022-01-08 15:59:56+00:00,"Yes. Regular colonoscopies, mammograms, dental cleanings, PSA testing. Annual check ups &amp; labs. Hepatitis. Etc, etc. #EarlyDetectionSavesLives","{'neg': 0.0, 'neu': 0.856, 'pos': 0.144, 'compound': 0.4019}"
44,2022-01-08 15:59:56+00:00,RT Supreme Court justices make puzzling claims about COVID stats in challenges to vaccine mandates | Just The News,"{'neg': 0.0, 'neu': 0.776, 'pos': 0.224, 'compound': 0.5994}"
45,2022-01-08 15:59:56+00:00,"Nobody was arguing that nobody gets Covid. They are arguing against govt mandates.  Where are they? Home sick BUT arguing before the Supreme Court. Pretty high functioning.  They are not in the hospital, nor on a ventilator, nor dead. They have a cold. But you do you.","{'neg': 0.159, 'neu': 0.625, 'pos': 0.217, 'compound': 0.7726}"
46,2022-01-08 15:59:56+00:00,"RT Corona warriors who served nation 14-16 hours every day, deserve one compensatory attempt for the lost attempt of 2020 an...","{'neg': 0.103, 'neu': 0.897, 'pos': 0.0, 'compound': -0.3182}"
47,2022-01-08 15:59:56+00:00,"RT Them: There's no evidence the Wuhan coronavirus vaccine affects reproductive health.

Me: There's no evidence because it...","{'neg': 0.216, 'neu': 0.784, 'pos': 0.0, 'compound': -0.5267}"
48,2022-01-08 15:59:56+00:00,RT Quite often...it's called preventive and first pandemic I've been old enough to be aware....,"{'neg': 0.0, 'neu': 1.0, 'pos': 0.0, 'compound': 0.0}"
49,2022-01-08 15:59:56+00:00,RT BREAKING: A group of anti-masker passengers who were caught ignoring mask mandates as they partied on a flight to Mexi...,"{'neg': 0.112, 'neu': 0.788, 'pos': 0.1, 'compound': -0.0772}"
50,2022-01-08 15:59:56+00:00,RT Having not gotten covid yet feels like I've been hiding in the back of a 2+ year long middle school dodgeball game and the fr...,"{'neg': 0.077, 'neu': 0.836, 'pos': 0.087, 'compound': 0.0772}"
51,2022-01-08 15:59:56+00:00,"Actually it does. 

Vaxxed go to hospital less &amp; d*e less 
from Om variant 
than unvaxxed.","{'neg': 0.0, 'neu': 1.0, 'pos': 0.0, 'compound': 0.0}"
52,2022-01-08 15:59:57+00:00,RT Where's CNN's COVID tracker? It was on 24/7 during the Trump Administration.,"{'neg': 0.0, 'neu': 1.0, 'pos': 0.0, 'compound': 0.0}"
53,2022-01-08 15:59:57+00:00,"RT BOOST BLUE MAJORITY 
SAVE DEMOCRACY

""Over 824,000 Americans, including over 62,000 Floridians, have died of Covid. We c...","{'neg': 0.134, 'neu': 0.593, 'pos': 0.273, 'compound': 0.5812}"
54,2022-01-08 15:59:57+00:00,"RT Is Omicron mild? Or perhaps it just attacks lungs less, leading to less quick hospitalisation/death, while attacking the rest...","{'neg': 0.247, 'neu': 0.753, 'pos': 0.0, 'compound': -0.7096}"
55,2022-01-08 15:59:57+00:00,"RT Take that, you egg-headed little turd.","{'neg': 0.0, 'neu': 1.0, 'pos': 0.0, 'compound': 0.0}"
56,2022-01-08 15:59:57+00:00,"RT They refuse to make our schools safe from COVID.

They refuse to make our schools safe from gun violence.

They refuse to ma...","{'neg': 0.365, 'neu': 0.474, 'pos': 0.162, 'compound': -0.743}"
57,2022-01-08 15:59:57+00:00,"RT ""Claimed covid deaths are at an all time high""

I was shocked by this one. The very first result on Google i...","{'neg': 0.095, 'neu': 0.905, 'pos': 0.0, 'compound': -0.3182}"
58,2022-01-08 15:59:57+00:00,"They have clarified it, variants = alternate universe versions of characters. Sylvie is a Variant of Loki, TASM Spider-Man is a Variant of Tom Spider-Man, etc. Some can look the same, others look different bc it's the multiverse","{'neg': 0.0, 'neu': 1.0, 'pos': 0.0, 'compound': 0.0}"
59,2022-01-08 15:59:57+00:00,RT Where's CNN's COVID tracker? It was on 24/7 during the Trump Administration.,"{'neg': 0.0, 'neu': 1.0, 'pos': 0.0, 'compound': 0.0}"
60,2022-01-08 15:59:57+00:00,"RT #Telangana Covid Cases

2nd Jan -  272
3rd Jan -  482
4th Jan - 1020
5th Jan - 1520
6th Jan - 1913
7th Jan - 2295
8th Jan - 26...","{'neg': 0.0, 'neu': 1.0, 'pos': 0.0, 'compound': 0.0}"
61,2022-01-08 15:59:57+00:00,Perhaps the vaccine ruins or redirects a person's natural immunity.,"{'neg': 0.216, 'neu': 0.597, 'pos': 0.187, 'compound': -0.1027}"
62,2022-01-08 15:59:57+00:00,RT Some have made a fortune off the Covid Industrial Complex,"{'neg': 0.0, 'neu': 1.0, 'pos': 0.0, 'compound': 0.0}"
63,2022-01-08 15:59:57+00:00,"right? like, we are in this field to help your pet, but we also want to keep our staff &amp; our clients safe during this covid spike.","{'neg': 0.0, 'neu': 0.721, 'pos': 0.279, 'compound': 0.7845}"
64,2022-01-08 15:59:57+00:00,"RT Today's jobs report: 

--Added 6.4 million jobs since January of last year 
--Lowest unemployment rate since the beginning...","{'neg': 0.244, 'neu': 0.756, 'pos': 0.0, 'compound': -0.6705}"
65,2022-01-08 15:59:57+00:00,"RT ""How about a two week lockdown?""

""No thank you. I'll take two years of constant disruptions and case surges""","{'neg': 0.105, 'neu': 0.786, 'pos': 0.109, 'compound': 0.0258}"
66,2022-01-08 15:59:57+00:00,RT The CDC after dropping the vaccine in taco bell chicken wings.,"{'neg': 0.0, 'neu': 1.0, 'pos': 0.0, 'compound': 0.0}"
67,2022-01-08 15:59:57+00:00,"New Guidlines issued for closing all Schools and Colleges..But
STUDENTS OF SSC AND HSC.HAVE TO EVEN GO FOR ACTIVITIES IN SCHOOL EVEN IN THIS WORST PHASE OF PANDEMIC Even it is not at Peak Till now..

*Why don't Board Postpone SSC/HSC Exams From March-april To April-May..Please*","{'neg': 0.113, 'neu': 0.855, 'pos': 0.032, 'compound': -0.729}"
68,2022-01-08 15:59:57+00:00,Follow the scienceCDC said since august will retire PCR bec it does not distinguish between covid &amp; influenza... check it out.,"{'neg': 0.0, 'neu': 1.0, 'pos': 0.0, 'compound': 0.0}"
69,2022-01-08 15:59:57+00:00,RT FDA will have 8 months -- not the 75 years it requested -- to release all documents related to the licensing of Pfizer's...,"{'neg': 0.0, 'neu': 1.0, 'pos': 0.0, 'compound': 0.0}"
70,2022-01-08 15:59:57+00:00,RT Texas GOP Governor Greg Abbott won't impose a statewide mask mandate but needs assistance from the federal government...,"{'neg': 0.0, 'neu': 0.926, 'pos': 0.074, 'compound': 0.1139}"
71,2022-01-08 15:59:57+00:00,"RT Our scener party has just ended! Thank you so much for joining, we hope you had fun 
Our peak of participants today was 95...","{'neg': 0.0, 'neu': 0.642, 'pos': 0.358, 'compound': 0.8932}"
72,2022-01-08 15:59:57+00:00,Cleared? What did I miss? Possible Covid or did he get hurt? Man I work all day for one day and this is what happens! Haha,"{'neg': 0.181, 'neu': 0.683, 'pos': 0.137, 'compound': -0.3468}"
73,2022-01-08 15:59:58+00:00,"Yes, there are many I would do this for. Maybe that is why I follow CDC guidelines and have been boosted in Nov. I will get a fourth, when requested and available. I wear a mask in drive thru as well. I do NOT want to be part of problem. I do want to be part of solution","{'neg': 0.06, 'neu': 0.775, 'pos': 0.166, 'compound': 0.7165}"
74,2022-01-08 15:59:58+00:00,"no I am not Australian but every country has its set of. The majority of Europe has a health pass requirement. you need proof of vaccination to enter any public places, board a plane or a train. So if you want to travel , you need to adhere to those or stay home. It's your choice","{'neg': 0.028, 'neu': 0.94, 'pos': 0.032, 'compound': 0.0633}"
75,2022-01-08 15:59:58+00:00,RT The CDC after dropping the vaccine in taco bell chicken wings.,"{'neg': 0.0, 'neu': 1.0, 'pos': 0.0, 'compound': 0.0}"
76,2022-01-08 15:59:58+00:00,RT Immediate relief to aspirants fallout: The impact on education in India -...,"{'neg': 0.0, 'neu': 0.795, 'pos': 0.205, 'compound': 0.4767}"
77,2022-01-08 15:59:58+00:00,RT Having not gotten covid yet feels like I've been hiding in the back of a 2+ year long middle school dodgeball game and the fr...,"{'neg': 0.077, 'neu': 0.836, 'pos': 0.087, 'compound': 0.0772}"
78,2022-01-08 15:59:58+00:00,"RT BREAKING: United States reports over 850,000 new daily coronavirus cases and over 2,000 deaths","{'neg': 0.0, 'neu': 0.833, 'pos': 0.167, 'compound': 0.4215}"
79,2022-01-08 15:59:58+00:00,"RT I FORGOT TO POST THIS ALL LAST WEEK OOPS

There is no Zonebreaker until February 11th, and the PR season will start with tha...","{'neg': 0.084, 'neu': 0.916, 'pos': 0.0, 'compound': -0.296}"
80,2022-01-08 15:59:58+00:00,"I feel that Moe is clearly demonstrating that he has been and still remains negligent in the handling of the pandemic. I've said it before, I don't care that he lacks the intellectual fortitude to understand what's actually going but it's his job to listen to the folks that do.","{'neg': 0.034, 'neu': 0.89, 'pos': 0.076, 'compound': 0.2928}"
81,2022-01-08 15:59:58+00:00,RT The CDC after dropping the vaccine in taco bell chicken wings.,"{'neg': 0.0, 'neu': 1.0, 'pos': 0.0, 'compound': 0.0}"
82,2022-01-08 15:59:58+00:00,Wasn't me,"{'neg': 0.0, 'neu': 1.0, 'pos': 0.0, 'compound': 0.0}"
83,2022-01-08 15:59:58+00:00,"For a state with the worst Covid case increases ever DeathSantis would rather do away with testing altogether. If you didn't test at all your numbers would be great. 62,000+ deaths in Florida. DeathSantis only won by about 30K.
Criminal negligence to waste all those Covid tests.","{'neg': 0.171, 'neu': 0.699, 'pos': 0.13, 'compound': -0.3612}"
84,2022-01-08 15:59:58+00:00,RT Modi ji hai to mumkin hai day': PM Modi congratulates India on...,"{'neg': 0.0, 'neu': 1.0, 'pos': 0.0, 'compound': 0.0}"
85,2022-01-08 15:59:58+00:00,"RT After another week of Covid data, how do the Sage models compare to actual? 

We're running a live comparison at the Spec...","{'neg': 0.0, 'neu': 1.0, 'pos': 0.0, 'compound': 0.0}"
86,2022-01-08 15:59:58+00:00,"RT can't read another ""time to upgrade your mask"" article and see another $50 ad for a 20 pack of n95s without getting hope...","{'neg': 0.095, 'neu': 0.905, 'pos': 0.0, 'compound': -0.3412}"
87,2022-01-08 15:59:58+00:00,I thought this was a scene from The Office or Parks &amp; Rec  We are DOOMED,"{'neg': 0.247, 'neu': 0.753, 'pos': 0.0, 'compound': -0.7125}"
88,2022-01-08 15:59:58+00:00,"RT Due to the number of COVID cases and exposures among museum staff, the MAC will be closed on Saturday and Sunday, Janu...","{'neg': 0.0, 'neu': 0.944, 'pos': 0.056, 'compound': 0.0772}"
89,2022-01-08 15:59:58+00:00,"RT ""How about a two week lockdown?""

""No thank you. I'll take two years of constant disruptions and case surges""","{'neg': 0.105, 'neu': 0.786, 'pos': 0.109, 'compound': 0.0258}"
90,2022-01-08 15:59:58+00:00,RT Why does the pro-life supreme court appears ready to reject a vaccine mandate for businesses when the virus has killed more r...,"{'neg': 0.223, 'neu': 0.588, 'pos': 0.189, 'compound': -0.2732}"
91,2022-01-08 15:59:58+00:00,"RT All these vaccinated people catching Omicron.  Where did they get their antibodies, Santa Cruz?","{'neg': 0.0, 'neu': 1.0, 'pos': 0.0, 'compound': 0.0}"
92,2022-01-08 15:59:58+00:00,"RT Dear #America,
Want to know how the NEXT #Variant will arise:
Allow 600,000 people to get #Infected a day, shorten the...","{'neg': 0.119, 'neu': 0.667, 'pos': 0.215, 'compound': 0.1531}"
93,2022-01-08 15:59:59+00:00,"RT And not only Finland. Yet another reason I worry about all this ""let it rip"" omicron talk, with premature claims about it c...","{'neg': 0.112, 'neu': 0.888, 'pos': 0.0, 'compound': -0.4404}"
94,2022-01-08 15:59:59+00:00,"Are you fuckin stupid. I'll put it in big so you can see it. 
THIS COVID-19 VACCINE IS NOT WORKING AS THEY HAD HOPED!!","{'neg': 0.144, 'neu': 0.743, 'pos': 0.113, 'compound': -0.2368}"
95,2022-01-08 15:59:59+00:00,"The SNP have so much to hide, surely this house of cards will come tumbling down soon. #snpout","{'neg': 0.094, 'neu': 0.767, 'pos': 0.139, 'compound': 0.235}"
96,2022-01-08 15:59:59+00:00,RT Health crisis all over Maryland but not in Harford although the covid numbers are higher than almost any other county t...,"{'neg': 0.108, 'neu': 0.892, 'pos': 0.0, 'compound': -0.3716}"
97,2022-01-08 15:59:59+00:00,Amy Coney Barrett Asks Key COVID-19 Question: When Will The Emergency End?,"{'neg': 0.191, 'neu': 0.809, 'pos': 0.0, 'compound': -0.3818}"
98,2022-01-08 15:59:59+00:00,"The Doherty Institute's Sharon Lewin confirmed to on the other night, that 200,000 #COVID19 positive cases is VERY LIKELY, if not more, by the end of Jan.
#ScottyTheGaslighter
#ScottyTheBullshitArtist
#ScottyThePathologicalLiar strikes AGAIN.
(&amp; the CMO too)","{'neg': 0.062, 'neu': 0.848, 'pos': 0.09, 'compound': 0.2732}"
99,2022-01-08 15:59:59+00:00,RT BREAKING: Two of the lawyers presenting arguments to the Supreme Court to block Biden's vaccine mandate have tested po...,"{'neg': 0.214, 'neu': 0.649, 'pos': 0.137, 'compound': -0.25}"
100,2022-01-08 15:59:59+00:00,"RT ""Because they have close ties to the unions, Democrats are concerned that additional closures like those in Chicago cou...","{'neg': 0.0, 'neu': 0.884, 'pos': 0.116, 'compound': 0.3612}"
101,2022-01-08 15:59:59+00:00,Listening to this morning's American Real Estate and Urban Economics Association session for #ASSA2022 #AEA2022 conference regarding COVID's effect on real estate - this image sums up the question for commercial real estate.  See the paper at this link:...https://t.co/otd5zIk5v6,"{'neg': 0.0, 'neu': 1.0, 'pos': 0.0, 'compound': 0.0}"
102,2022-01-08 15:59:59+00:00,"RT Lying, corruption and incompetence is the ethos of Tory party.

https://t.co/s9vYxESl38

https://...","{'neg': 0.345, 'neu': 0.515, 'pos': 0.139, 'compound': -0.6124}"
103,2022-01-08 15:59:59+00:00,"RT NEW: Justice Sonia Sotomayor said during oral arguments today that ""we have over 100,000 children, which we've never had be...","{'neg': 0.108, 'neu': 0.757, 'pos': 0.135, 'compound': 0.1779}"
104,2022-01-08 15:59:59+00:00,"RT Supreme Court Justices just falsely claimed:

1. The jab prevents transmission
2. Omicron is as deadly as Delta
3. 100K c...","{'neg': 0.0, 'neu': 0.803, 'pos': 0.197, 'compound': 0.5994}"
105,2022-01-08 15:59:59+00:00,RT FDA will have 8 months -- not the 75 years it requested -- to release all documents related to the licensing of Pfizer's...,"{'neg': 0.0, 'neu': 1.0, 'pos': 0.0, 'compound': 0.0}"
106,2022-01-08 15:59:59+00:00,"Meanwhile over on Reddit which is worse, the vax side effects or COVID?

Sometimes hard to tell with these posts. Note there were many other ""Me too"" replies.

Also more the interesting comment re post removed. Why?

(Sometimes) safe and effective.","{'neg': 0.09, 'neu': 0.722, 'pos': 0.187, 'compound': 0.7039}"
107,2022-01-08 15:59:59+00:00,RT Thousands across France are set to take to the streets today to protest against changes to the country's COVID-19 pass regulat...,"{'neg': 0.087, 'neu': 0.913, 'pos': 0.0, 'compound': -0.25}"
108,2022-01-08 15:59:59+00:00,"RT If Joe Biden already admitted that there is no federal solution to the virus, then how could a federal vaccine mandate b...","{'neg': 0.163, 'neu': 0.782, 'pos': 0.055, 'compound': -0.4141}"
109,2022-01-08 15:59:59+00:00,RT If what's happening to Novak Djokovic in Australia doesn't convince you that this whole covid vaccination drive is not abou...,"{'neg': 0.08, 'neu': 0.92, 'pos': 0.0, 'compound': -0.1877}"
110,2022-01-08 15:59:59+00:00,"RT Archaeologists: Here's exactly how pandemics have played out in the past w 10 top examples
Historians: Here's how the 19...","{'neg': 0.0, 'neu': 0.819, 'pos': 0.181, 'compound': 0.4939}"
111,2022-01-08 15:59:59+00:00,RT Military deployed to Leicester hospitals amid Covid pressure,"{'neg': 0.216, 'neu': 0.784, 'pos': 0.0, 'compound': -0.296}"
112,2022-01-08 15:59:59+00:00,"RT 22% COVID beds in Mumbai are occupied 

11.5% COVID beds in Delhi are Occupied

12% Oxygen beds in Delhi are occupied","{'neg': 0.0, 'neu': 1.0, 'pos': 0.0, 'compound': 0.0}"
113,2022-01-08 15:59:59+00:00,"Asked Nigel Pearson on whereabouts of Tyreeq Bakinson. Nige confirms that the midfielder has had covid. ""He tested positive. Every club is dealing with that. He was training today... He'll be around... He's okay."" #BristolCity","{'neg': 0.0, 'neu': 0.857, 'pos': 0.143, 'compound': 0.6705}"
