,created_at,full_text,sentiment_score
118,2022-01-15 17:00:00+00:00,"The lack of truck drivers in the U.S. has contributed to supply chain issues that have arisen globally during the pandemic. Now, to address the shortage, officials are considering allowing teenagers to become truckers.
https://t.co/AbPHGAvOgL","{'neg': 0.115, 'neu': 0.885, 'pos': 0.0, 'compound': -0.5106}"
119,2022-01-15 17:00:00+00:00,Leaving this for perspective of Dem control of government.,"{'neg': 0.0, 'neu': 1.0, 'pos': 0.0, 'compound': 0.0}"
120,2022-01-15 17:00:00+00:00,RT Our people have been pushed into immense vulnerability yet again with major cities registering more cases per day today than...,"{'neg': 0.087, 'neu': 0.913, 'pos': 0.0, 'compound': -0.2263}"
121,2022-01-15 17:00:00+00:00,"Serve as a Vaccine Ambassador for Immunity is made possible with funding from the and the . For more information, visit   

Apply here:","{'neg': 0.0, 'neu': 1.0, 'pos': 0.0, 'compound': 0.0}"
122,2022-01-15 17:00:00+00:00,"Companies cutting #PaidLeave for workers with COVID is a travesty, and ignores the reality of parents and caregivers who may need time for themselves, then to care for sick family. As we told we need action from lawmakers.  ","{'neg': 0.226, 'neu': 0.705, 'pos': 0.068, 'compound': -0.7506}"
123,2022-01-15 17:00:00+00:00,"How many times must this happen before these so-called leaders start to get a clue? #GetVaccinatedNow 

""Official who spoke against vaccines dies from Covid-19 and sparks big re..."" via","{'neg': 0.0, 'neu': 1.0, 'pos': 0.0, 'compound': 0.0}"
124,2022-01-15 17:00:00+00:00,"RT Lots of appts available. Peds -5-11 (need to be 5), Pfizer for 18-29 only, Moderna for 30 plus. 4th doses for immunocompro...","{'neg': 0.0, 'neu': 1.0, 'pos': 0.0, 'compound': 0.0}"
125,2022-01-15 17:00:00+00:00,"The rate has never been higher
https://t.co/UpiteOGb5f","{'neg': 0.0, 'neu': 1.0, 'pos': 0.0, 'compound': 0.0}"
126,2022-01-15 17:00:00+00:00,"RT Against the rules Boris and Mrs Johnson travelled to their second home in first lockdown.

This is exactly the reason...","{'neg': 0.0, 'neu': 1.0, 'pos': 0.0, 'compound': 0.0}"
127,2022-01-15 17:00:00+00:00,"The trend is being seen across the UK

https://t.co/3lGHWgu7Du","{'neg': 0.0, 'neu': 1.0, 'pos': 0.0, 'compound': 0.0}"
128,2022-01-15 17:00:00+00:00,"The COVID-19 pandemic and Omicron variant is putting extreme stress on staffing levels at Southern New Jersey hospitals. There are opportunities for certified &amp; non-certified professionals to volunteer.

Interested? Learn more at","{'neg': 0.083, 'neu': 0.776, 'pos': 0.142, 'compound': 0.2975}"
129,2022-01-15 17:00:00+00:00,"RT When a high school in Korea becomes ground zero for a zombie outbreak, the students who are trapped inside must fight their wa...","{'neg': 0.214, 'neu': 0.786, 'pos': 0.0, 'compound': -0.7184}"
130,2022-01-15 17:00:00+00:00,"We're prepared for winter. Are you? 
https://t.co/qX1euY2Z7E","{'neg': 0.0, 'neu': 0.759, 'pos': 0.241, 'compound': 0.2263}"
131,2022-01-15 17:00:00+00:00,Researchers are now exploring similarities between the effects of Alzheimer's disease and some of the cognitive symptoms and brain changes caused by COVID-19 in an attempt to understand whether viral infections might be a cause of dementia. ,"{'neg': 0.0, 'neu': 1.0, 'pos': 0.0, 'compound': 0.0}"
132,2022-01-15 17:00:00+00:00,RT People have had enough of this tyranny.,"{'neg': 0.0, 'neu': 1.0, 'pos': 0.0, 'compound': 0.0}"
133,2022-01-15 17:00:00+00:00,RT Game off. What started out as postponements due to a pandemic has now become about clubs not having their best team . The Premie...,"{'neg': 0.123, 'neu': 0.877, 'pos': 0.0, 'compound': -0.5216}"
134,2022-01-15 17:00:00+00:00,"RT ""Omicron is so contagious that it can't be stopped.""
""We're all going to catch it. It's inevitable.""
""Omicron is like...","{'neg': 0.123, 'neu': 0.712, 'pos': 0.165, 'compound': 0.0128}"
135,2022-01-15 17:00:00+00:00,"#Australia has likely neared the peak of its #Omicron wave, authorities said, but warned daily #infections will linger near record levels for ""the next few weeks"" after more than 100,000 cases were reported for a fourth straight day.

Read more:","{'neg': 0.062, 'neu': 0.884, 'pos': 0.055, 'compound': -0.0772}"
136,2022-01-15 17:00:00+00:00,"RT I hear an exception has been made if the patient is unvaxxed, by which we mean folks who took the 1st dose, then the 2nd dos...","{'neg': 0.0, 'neu': 1.0, 'pos': 0.0, 'compound': 0.0}"
137,2022-01-15 17:00:00+00:00,"Spurs cancelled 1 game because they had 8 first team players with covid.
You have 1 covid case! Stop comparing apples with pasta 
Your injured and Afcon players mean nothing the game should have gone ahead. 
Cheating gooners","{'neg': 0.241, 'neu': 0.759, 'pos': 0.0, 'compound': -0.8687}"
138,2022-01-15 17:00:00+00:00,"RT Why did an audit just say Gretchen Whitmer failed to report 42% of pandemic-related Michigan nursing home deaths?

","{'neg': 0.155, 'neu': 0.845, 'pos': 0.0, 'compound': -0.5106}"
139,2022-01-15 17:00:00+00:00,"RT The pandemic is over. It's done. The narrative shattered.

Yet still they want to sack over 100k NHS staff, because they a...","{'neg': 0.122, 'neu': 0.827, 'pos': 0.051, 'compound': -0.4215}"
