,created_at,full_text,sentiment_score
0,2020-12-07 21:59:54+00:00,"Just when you thought a Monday in lockdown sucked!!! Not sure who the ""secret Santa"" is, but I sure do appreciate the bright spot in my day!! Thank you ","{'neg': 0.084, 'neu': 0.558, 'pos': 0.358, 'compound': 0.923}"
1,2020-12-07 21:59:54+00:00,"RT my days in lockdown are divided as follows

laptop: work screen

phone: distraction screen

TV: reward screen","{'neg': 0.117, 'neu': 0.717, 'pos': 0.166, 'compound': 0.2732}"
2,2020-12-07 21:59:54+00:00,"RT In California, a state now recording about 10,000 new cases each day, officials issued a stay-at-home order for millions of peop...","{'neg': 0.0, 'neu': 1.0, 'pos': 0.0, 'compound': 0.0}"
3,2020-12-07 21:59:55+00:00,RT Pain all I feel is pain,"{'neg': 0.569, 'neu': 0.431, 'pos': 0.0, 'compound': -0.765}"
4,2020-12-07 21:59:55+00:00,"RT Just as disinformation about COVID19 undermines health care, disinfo about civil protests undermines civil rights, and...","{'neg': 0.293, 'neu': 0.568, 'pos': 0.14, 'compound': -0.3612}"
5,2020-12-07 21:59:55+00:00,"RT Hey everyone! When I tested positive for covid, it was really hard to find any information about how to handle it besides ""...","{'neg': 0.061, 'neu': 0.798, 'pos': 0.141, 'compound': 0.4937}"
6,2020-12-07 21:59:55+00:00,"Greece  in bed 
 Egyptian Dictator 
 Syrian warlord &amp; Dictator Assad
Supports UAE &amp; Saudi Arabia regimes ( Abuse &amp; killing of refugees). In bed with warlord Haftar,after all of that acting as peace of dove and democracy lover. 
 
https://t.co/z83ysP9gDp","{'neg': 0.164, 'neu': 0.649, 'pos': 0.187, 'compound': 0.0516}"
7,2020-12-07 21:59:55+00:00,RT Britain is right now the Guinea pig of the world. Check the covid vaccine in your citizens for us. You are a...,"{'neg': 0.0, 'neu': 1.0, 'pos': 0.0, 'compound': 0.0}"
8,2020-12-07 21:59:55+00:00,"RT This Dallas County judge refuses to acknowledge how he was caught flouting his own rules on masks, outings, and distancing: ht...","{'neg': 0.0, 'neu': 1.0, 'pos': 0.0, 'compound': 0.0}"
9,2020-12-07 21:59:55+00:00,"Blaming the Democrats for your failure to pass a #COVID19 relief bill is just hypocritical. You spent most of the Summer/Fall confirming Federal judges while ignoring the need for fiscal help for struggling Americans. I hope it was worth it. #MoscowMitch 

https://t.co/O8ooC2ioWu","{'neg': 0.256, 'neu': 0.563, 'pos': 0.181, 'compound': -0.6597}"
10,2020-12-07 21:59:55+00:00,"RT In typical Morrison style, his 
'apology' is coward's way out. You need to apologise to Rudd personally and publicly","{'neg': 0.0, 'neu': 0.826, 'pos': 0.174, 'compound': 0.4215}"
11,2020-12-07 21:59:55+00:00,"RT As if fighting COVID-19 wasn't hard enough, explains that it can also lead to long-term erectile dysfunct...","{'neg': 0.126, 'neu': 0.808, 'pos': 0.065, 'compound': -0.2969}"
12,2020-12-07 21:59:55+00:00,"RT How pervasive is neoliberalism that ""everyone decided not to do their part!"" is a more plausible explanation than ""we're forc...","{'neg': 0.0, 'neu': 1.0, 'pos': 0.0, 'compound': 0.0}"
13,2020-12-07 21:59:55+00:00,"RT There have been more American deaths from COVID this day, and every day in December, than the deaths in the Pearl Harbor a...","{'neg': 0.0, 'neu': 1.0, 'pos': 0.0, 'compound': 0.0}"
14,2020-12-07 21:59:55+00:00,Ya Fuck Covid,"{'neg': 0.636, 'neu': 0.364, 'pos': 0.0, 'compound': -0.5423}"
15,2020-12-07 21:59:55+00:00,Everything is so strange right now. Hard to support a lot of this when you watch our stay at home PM run down into a Black Lives Matter protest &amp; kneel in the midst of an epidemic. Following that means no lives matter. Sad.,"{'neg': 0.234, 'neu': 0.693, 'pos': 0.073, 'compound': -0.7461}"
16,2020-12-07 21:59:55+00:00,"I started to record videos of some of my stories for my FB friends to compliment my audio podcast (that most of my FB friends don't listen too, but they like the videos!)","{'neg': 0.0, 'neu': 0.75, 'pos': 0.25, 'compound': 0.8268}"
17,2020-12-07 21:59:55+00:00,RT Breaking NYT: Trump officials passed when Pfizer offered in late summer to sell the U.S. government additional doses of i...,"{'neg': 0.0, 'neu': 1.0, 'pos': 0.0, 'compound': 0.0}"
18,2020-12-07 21:59:55+00:00,"Im actually sick of covid bro, shit made hooping almost an impossibility, and the gyms are always on/off open, they took all our outlets or ways to blow off steam away","{'neg': 0.192, 'neu': 0.808, 'pos': 0.0, 'compound': -0.7845}"
19,2020-12-07 21:59:55+00:00,"RT This is ridiculous.

First her campaign pays him near $2.8 million, and now we find out he received $650k in COVID Relie...","{'neg': 0.102, 'neu': 0.898, 'pos': 0.0, 'compound': -0.3612}"
20,2020-12-07 21:59:55+00:00,"The Democrat areas in question even used COVID to essentially declare marshal law, allowing them to change the rules and restrict observation.","{'neg': 0.11, 'neu': 0.89, 'pos': 0.0, 'compound': -0.3818}"
21,2020-12-07 21:59:55+00:00,RT The world awakening of consciousness on the effects of #Covid19 lockdown ! How zoos should be a thing of the past phasing i...,"{'neg': 0.0, 'neu': 1.0, 'pos': 0.0, 'compound': 0.0}"
22,2020-12-07 21:59:55+00:00,"Refusing to strengthen soot pollution standards could cause over 30,000 deaths annually and will disproportionately harm people of color.","{'neg': 0.253, 'neu': 0.653, 'pos': 0.094, 'compound': -0.5994}"
23,2020-12-07 21:59:55+00:00,"RT ""Covid isn't going away"" yeah because idiots like you can't fucking sacrifice a month inside to potentially save hundreds o...","{'neg': 0.074, 'neu': 0.703, 'pos': 0.223, 'compound': 0.5875}"
24,2020-12-07 21:59:56+00:00,"From the 

The safest way to celebrate the holidays is to stay home &amp; celebrate with the people who live with you. Getting together with family &amp; friends who don't live with you increases the chance of getting or spreading COVID-19 or the flu.","{'neg': 0.045, 'neu': 0.645, 'pos': 0.31, 'compound': 0.9349}"
25,2020-12-07 21:59:56+00:00,"RT CURTIS ZEARLEY, 71 of Bismarck, North Dakota died of COVID complications on Dec. 2. 

A Vietnam War veteran and 20-year r...","{'neg': 0.273, 'neu': 0.727, 'pos': 0.0, 'compound': -0.8176}"
26,2020-12-07 21:59:56+00:00,RT Yep. Here we go again in Cal. I blame every person who refuse to wear a mask &amp; the RepubLieCons who go al...,"{'neg': 0.165, 'neu': 0.755, 'pos': 0.079, 'compound': -0.34}"
27,2020-12-07 21:59:56+00:00,#ResidentialSchools #colonization #SixtiesScoop #culturalgenocide #waysofknowing #Reserves #IndianAct #StolenGenerations this is an opportunity to deepen awareness of what so many have experienced for generations and generations. #BIPOC #decolonize #antiracism #antiprivilege,"{'neg': 0.0, 'neu': 0.909, 'pos': 0.091, 'compound': 0.4215}"
28,2020-12-07 21:59:56+00:00,"RT ""Trump administration officials passed when Pfizer offered in late summer to sell the U.S. government additional doses of it...","{'neg': 0.0, 'neu': 1.0, 'pos': 0.0, 'compound': 0.0}"
29,2020-12-07 21:59:56+00:00,"RT ""how are we going to pay for the stimulus""

In the pandemic, total stock value has grown by $16.6 trillion.

$8.3 tril...","{'neg': 0.056, 'neu': 0.837, 'pos': 0.107, 'compound': 0.3134}"
30,2020-12-07 21:59:56+00:00,"RT *Urgent mutual aid, please share/donate*

My grandfather's prognosis from COVID has gone from bad to worse and I have to...","{'neg': 0.238, 'neu': 0.614, 'pos': 0.148, 'compound': -0.5423}"
31,2020-12-07 21:59:56+00:00,"RT It's totally unnecessary and a move by weak leadership to simply run out the clock.

Everyone in Arizona falls DAYS outs...","{'neg': 0.121, 'neu': 0.879, 'pos': 0.0, 'compound': -0.4404}"
32,2020-12-07 21:59:56+00:00,"RT 

Paving over paradise.
Special favors for bigots.
Covid spreading in schools, LTC.

Fraudnation swirling down t...","{'neg': 0.0, 'neu': 0.611, 'pos': 0.389, 'compound': 0.836}"
33,2020-12-07 21:59:56+00:00,Warp Speed Ahead!,"{'neg': 0.0, 'neu': 1.0, 'pos': 0.0, 'compound': 0.0}"
34,2020-12-07 21:59:56+00:00,"Ya know, people were getting offended by this joke I use to tell about how this ""bitch told me she had COVID, but I fucked her without a mask anyways."" So now I have to say ""she told me she had COVID, so I politely asked if we could use a dental dam.""","{'neg': 0.17, 'neu': 0.804, 'pos': 0.026, 'compound': -0.8674}"
35,2020-12-07 21:59:56+00:00,"RT NEW VIDEO: David Perdue has a long history of trading off of inside information, even before COVID. He even used his t...","{'neg': 0.0, 'neu': 1.0, 'pos': 0.0, 'compound': 0.0}"
36,2020-12-07 21:59:56+00:00,"RT Hey everyone! When I tested positive for covid, it was really hard to find any information about how to handle it besides ""...","{'neg': 0.061, 'neu': 0.798, 'pos': 0.141, 'compound': 0.4937}"
37,2020-12-07 21:59:56+00:00,"It's not surprising Jason Kenney's Government is taking steps to close the Legislative session. They want to hide from accountability on their utter failure to manage the COVID-19 pandemic.
Truly undemocratic and shameful.
2/2
#AbLeg","{'neg': 0.237, 'neu': 0.667, 'pos': 0.097, 'compound': -0.7275}"
38,2020-12-07 21:59:56+00:00,RT Breaking News: Trump administration officials passed when Pfizer offered in the summer to sell the U.S. more coronavirus vacci...,"{'neg': 0.0, 'neu': 1.0, 'pos': 0.0, 'compound': 0.0}"
39,2020-12-07 21:59:56+00:00,RT My heart goes out 2the farmers &amp; their families protesting in the cold in this pandemic.They are the soldiers of the s...,"{'neg': 0.1, 'neu': 0.75, 'pos': 0.15, 'compound': 0.34}"
40,2020-12-07 21:59:56+00:00,Had no clue gas stoves were so harmful! Are folks moving to electric?,"{'neg': 0.172, 'neu': 0.828, 'pos': 0.0, 'compound': -0.3595}"
41,2020-12-07 21:59:57+00:00,"RT Another day, another scandal. The trvmp administration can't do anything right.","{'neg': 0.209, 'neu': 0.791, 'pos': 0.0, 'compound': -0.4404}"
42,2020-12-07 21:59:57+00:00,RT Black and Latino child care providers have been disproportionately affected by the coronavirus pandemic in an industry tha...,"{'neg': 0.073, 'neu': 0.78, 'pos': 0.147, 'compound': 0.3818}"
43,2020-12-07 21:59:57+00:00,"Give me the phone number l want sum.
These people only care about themselves  and power","{'neg': 0.0, 'neu': 0.577, 'pos': 0.423, 'compound': 0.7783}"
44,2020-12-07 21:59:57+00:00,RT COVID-19 UPDATE: UUUGGGGGGHHHHHHHHHH,"{'neg': 0.0, 'neu': 1.0, 'pos': 0.0, 'compound': 0.0}"
45,2020-12-07 21:59:57+00:00,What human right violations? The enforcement of their lockdown was strict but it seems to have paid off. Also those 4 babies did not die bc of a lockdown -- there were no restrictions on infant medical transfer. The hospital made the (incorrect) choice not to send them.,"{'neg': 0.072, 'neu': 0.849, 'pos': 0.08, 'compound': 0.344}"
46,2020-12-07 21:59:57+00:00,y'all wanna hang out w the boys now??????,"{'neg': 0.0, 'neu': 1.0, 'pos': 0.0, 'compound': 0.0}"
47,2020-12-07 21:59:57+00:00,"RT Just heard of a couple who got infected by a college student home for Thanksgiving, but The Federalist thinks that's cool.","{'neg': 0.084, 'neu': 0.798, 'pos': 0.118, 'compound': 0.2144}"
48,2020-12-07 21:59:57+00:00,"For most people Covid is like a bad Flu (I had it for 2-3 days). 
WW2 months of constant bombardment, which one is worse 
(Not talking of my grandparents that lost most of their family)","{'neg': 0.261, 'neu': 0.682, 'pos': 0.057, 'compound': -0.8402}"
49,2020-12-07 21:59:57+00:00,What kind of sh*thole President declines extra vaccines from Pfizer in the early stages of a pandemic. Either 1. He was only going to give them to his red state supporters 2. He wasn't going to make money on the deal or 3. He just doesn't give a crap.,"{'neg': 0.0, 'neu': 0.902, 'pos': 0.098, 'compound': 0.6229}"
50,2020-12-07 21:59:57+00:00,"COVID-19 spit testing is the worst. Just put the fucking stick in your nose, it takes two seconds.","{'neg': 0.194, 'neu': 0.806, 'pos': 0.0, 'compound': -0.6249}"
51,2020-12-07 21:59:57+00:00,"Ok, Overall Moral of the Story... Don't NOT wear a Mask. #coronavirus #Connecticut","{'neg': 0.0, 'neu': 1.0, 'pos': 0.0, 'compound': 0.0}"
52,2020-12-07 21:59:57+00:00,"RT Sen. Bernie Sanders concedes, ""that's right,"" Democrats blocked coronavirus relief
https://t.co/4uzdBivJZO","{'neg': 0.138, 'neu': 0.658, 'pos': 0.204, 'compound': 0.25}"
53,2020-12-07 21:59:57+00:00,"RT America first, baby: 

""Now Pfizer may not be able provide more of its vaccine to the United States until next June because of...","{'neg': 0.0, 'neu': 0.891, 'pos': 0.109, 'compound': 0.4215}"
54,2020-12-07 21:59:57+00:00,"RT Nova Scotia has confirmed to Global News that it will receive 1,950 doses of the first batch of Pfizer's coronavirus vac...","{'neg': 0.0, 'neu': 1.0, 'pos': 0.0, 'compound': 0.0}"
55,2020-12-07 21:59:57+00:00,"So you are going to infect your own mother so she can die of COVID19 just two months before she could have been  vaccinated.  Yeah, that's not sadistically stupid at all.","{'neg': 0.112, 'neu': 0.754, 'pos': 0.134, 'compound': -0.0484}"
56,2020-12-07 21:59:58+00:00,Freeman also beat Covid-19.,"{'neg': 0.0, 'neu': 0.526, 'pos': 0.474, 'compound': 0.4019}"
57,2020-12-07 21:59:58+00:00,RT NEW via the NYT: The Trump Administration passed when Pfizer offered in late summer to sell the U.S. government additional...,"{'neg': 0.0, 'neu': 1.0, 'pos': 0.0, 'compound': 0.0}"
58,2020-12-07 21:59:58+00:00,RT Breaking NYT: Trump officials passed when Pfizer offered in late summer to sell the U.S. government additional doses of i...,"{'neg': 0.0, 'neu': 1.0, 'pos': 0.0, 'compound': 0.0}"
59,2020-12-07 21:59:58+00:00,Lock him down,"{'neg': 0.0, 'neu': 1.0, 'pos': 0.0, 'compound': 0.0}"
60,2020-12-07 21:59:58+00:00,"Yeah sorry they can't stay as a theatrical flop because of covid, is that what you want?","{'neg': 0.183, 'neu': 0.644, 'pos': 0.173, 'compound': -0.0516}"
61,2020-12-07 21:59:58+00:00,"I hear you but... how fast can you put up hospital/ICU, staff it/stock it in RURAL AMERICA!! You can't manage to get food % heat to people now! We are 12 months past ""containment"" of a pandemic When you have no income, there is no ""affordable"" anything We can't wait for Day One!","{'neg': 0.117, 'neu': 0.883, 'pos': 0.0, 'compound': -0.7762}"
62,2020-12-07 21:59:58+00:00,"We remember you (and colleagues) mercilessly hounded a certain Dominic Cummings for 'errors of judgement', even broadcast repeated calls for him to be sacked. Isn't the word 'Karma' ??","{'neg': 0.087, 'neu': 0.847, 'pos': 0.066, 'compound': -0.168}"
63,2020-12-07 21:59:58+00:00,"RT Patriarchy kills, part zillion","{'neg': 0.467, 'neu': 0.533, 'pos': 0.0, 'compound': -0.5423}"
64,2020-12-07 21:59:58+00:00,"RT The Senate knows all about end-of-year drama, but this time the stakes could not be higher. Americans are struggling unde...","{'neg': 0.156, 'neu': 0.844, 'pos': 0.0, 'compound': -0.5719}"
65,2020-12-07 21:59:58+00:00,"RT This crisis shouldn't be paid for on the backs of low paid workers.

Join this call on the Government to introduce a wage...","{'neg': 0.25, 'neu': 0.676, 'pos': 0.074, 'compound': -0.6369}"
66,2020-12-07 21:59:58+00:00,"RT ""how are we going to pay for the stimulus""

In the pandemic, total stock value has grown by $16.6 trillion.

$8.3 tril...","{'neg': 0.056, 'neu': 0.837, 'pos': 0.107, 'compound': 0.3134}"
67,2020-12-07 21:59:58+00:00,"We are happy to provide digital equity for vulnerable and BIPOC communities during the pandemic through Prioritizing mental health is important, and technology makes it easier. Read more about the program here ","{'neg': 0.05, 'neu': 0.733, 'pos': 0.217, 'compound': 0.7506}"
68,2020-12-07 21:59:58+00:00,Thank you #Hospital for highlighting the real impact COVID is having. Also the importance of clinical trials for finding effective treatments for #COVID19. Highlighting the incredible teamwork it takes both clinical and research working together - the NHS is amazing @BBCTwo,"{'neg': 0.0, 'neu': 0.757, 'pos': 0.243, 'compound': 0.8979}"
69,2020-12-07 21:59:58+00:00,"RT There have been more American deaths from COVID this day, and every day in December, than the deaths in the Pearl Harbor a...","{'neg': 0.0, 'neu': 1.0, 'pos': 0.0, 'compound': 0.0}"
70,2020-12-07 21:59:58+00:00,"RT .@SenatorLoeffler for months failed to provide Covid Relief to help Georgians on the verge of eviction. 

She said she c...","{'neg': 0.216, 'neu': 0.584, 'pos': 0.199, 'compound': -0.128}"
71,2020-12-07 21:59:58+00:00,"RT How pervasive is neoliberalism that ""everyone decided not to do their part!"" is a more plausible explanation than ""we're forc...","{'neg': 0.0, 'neu': 1.0, 'pos': 0.0, 'compound': 0.0}"
72,2020-12-07 21:59:58+00:00,"RT This is ridiculous.

First her campaign pays him near $2.8 million, and now we find out he received $650k in COVID Relie...","{'neg': 0.102, 'neu': 0.898, 'pos': 0.0, 'compound': -0.3612}"
73,2020-12-07 21:59:58+00:00,RT I will def keep masking up. There will be no way to tell if the maskless ppl one sees in gro...,"{'neg': 0.095, 'neu': 0.905, 'pos': 0.0, 'compound': -0.296}"
74,2020-12-07 21:59:58+00:00,RT the whole Giuliani few days was so weird - like it was a disaster - the prez lawyer - talking crazy - presenting a drunk witness...,"{'neg': 0.31, 'neu': 0.613, 'pos': 0.077, 'compound': -0.8115}"
75,2020-12-07 21:59:58+00:00,RT The Joint Committee on Vaccination and Immunisation (JCVI) has shared advice on the groups that should be prioritised for th...,"{'neg': 0.0, 'neu': 0.893, 'pos': 0.107, 'compound': 0.34}"
76,2020-12-07 21:59:58+00:00,"RT The government is not being transparent about where coronavirus aid money has gone.

Finance Minister Chrystia Freelan...","{'neg': 0.0, 'neu': 1.0, 'pos': 0.0, 'compound': 0.0}"
77,2020-12-07 21:59:58+00:00,RT Frequent outbreaks triggered by imported frozen products; reports suggesting traces of #coronavirus found elsewhere ea...,"{'neg': 0.0, 'neu': 1.0, 'pos': 0.0, 'compound': 0.0}"
78,2020-12-07 21:59:58+00:00,"RT Hey everyone! When I tested positive for covid, it was really hard to find any information about how to handle it besides ""...","{'neg': 0.061, 'neu': 0.798, 'pos': 0.141, 'compound': 0.4937}"
79,2020-12-07 21:59:58+00:00,"RT Meet Jason, an Idahoan who has recovered from COVID-19 and now chooses to wear a mask to protect others from what he experienced....","{'neg': 0.0, 'neu': 0.898, 'pos': 0.102, 'compound': 0.3818}"
80,2020-12-07 21:59:58+00:00,RT Portugal says it will ease COVID-19 rules over Christmas - #Portugal #COVID19 #Christmas #Holidays #Rul...,"{'neg': 0.0, 'neu': 0.733, 'pos': 0.267, 'compound': 0.6249}"
81,2020-12-07 21:59:58+00:00,All you need to know about covid vaccine in US.,"{'neg': 0.0, 'neu': 1.0, 'pos': 0.0, 'compound': 0.0}"
82,2020-12-07 21:59:58+00:00,"RT ""The virus is so tiny that 20,000 or so fit on the head of a pin. The graphic takes up an entire page.""

It takes 1000 to...","{'neg': 0.0, 'neu': 0.893, 'pos': 0.107, 'compound': 0.5009}"
83,2020-12-07 21:59:58+00:00,"RT Planning for tomorrow may seem like wishful thinking when life today is tough. But even amidst the #COVID19 crisis, it's critical...","{'neg': 0.333, 'neu': 0.608, 'pos': 0.059, 'compound': -0.8442}"
84,2020-12-07 21:59:58+00:00,maybe of interest for you,"{'neg': 0.0, 'neu': 0.571, 'pos': 0.429, 'compound': 0.4588}"
85,2020-12-07 21:59:59+00:00,RT Media briefing on #COVID19 with,"{'neg': 0.0, 'neu': 1.0, 'pos': 0.0, 'compound': 0.0}"
86,2020-12-07 21:59:59+00:00,FUCKING WHY?,"{'neg': 0.0, 'neu': 1.0, 'pos': 0.0, 'compound': 0.0}"
87,2020-12-07 21:59:59+00:00,RT Trump is not only trying to kill you America he is doing all he can to sabotage Joe Biden's presidency. I look forward to...,"{'neg': 0.26, 'neu': 0.74, 'pos': 0.0, 'compound': -0.8442}"
88,2020-12-07 21:59:59+00:00,RT .@GovRonDeSantis is handling this pandemic by listening to his own experts rather than the media and it's driving the ta...,"{'neg': 0.0, 'neu': 1.0, 'pos': 0.0, 'compound': 0.0}"
89,2020-12-07 21:59:59+00:00,RT NEW via the NYT: The Trump Administration passed when Pfizer offered in late summer to sell the U.S. government additional...,"{'neg': 0.0, 'neu': 1.0, 'pos': 0.0, 'compound': 0.0}"
90,2020-12-07 21:59:59+00:00,Trump to sign coronavirus vaccine executive order prioritizing Americans over foreign nations #FoxNews,"{'neg': 0.0, 'neu': 1.0, 'pos': 0.0, 'compound': 0.0}"
91,2020-12-07 21:59:59+00:00,Wow!  Thank you@joebwan!,"{'neg': 0.0, 'neu': 0.127, 'pos': 0.873, 'compound': 0.7835}"
92,2020-12-07 21:59:59+00:00,RT I blame the media and government for all of this. At no point have they tried to reassure anyone. It's just constant sca...,"{'neg': 0.164, 'neu': 0.75, 'pos': 0.086, 'compound': -0.296}"
93,2020-12-07 21:59:59+00:00,"One home win this calendar year. Covid or not, IT'S DECEMBER AND NEARLY CHRISTMAS!!!

Defend that stat. Potterball is not the one. Five games to save his job and even that's a stretch #bhafc","{'neg': 0.0, 'neu': 0.802, 'pos': 0.198, 'compound': 0.8349}"
94,2020-12-07 21:59:59+00:00,RT COVID-19 and the End of Economic Fatalism - Byline Times,"{'neg': 0.138, 'neu': 0.862, 'pos': 0.0, 'compound': -0.1531}"
95,2020-12-07 21:59:59+00:00,"RT The whole world is fighting a pandemic, we are arguing about mackerel.","{'neg': 0.333, 'neu': 0.667, 'pos': 0.0, 'compound': -0.6705}"
96,2020-12-07 21:59:59+00:00,"RT U.S. DEATHS, PEARL HARBOR, 7 DEC 1941: 2,403

U.S. DEATHS, COVID, 1 DEC 2020: 2,473
U.S. DEATHS, COVID, 2 DEC 2020: 2,73...","{'neg': 0.0, 'neu': 1.0, 'pos': 0.0, 'compound': 0.0}"
97,2020-12-07 21:59:59+00:00,Hey When the fuck is this COVID bout to be over this shit is pointless and respond to me  fucking do your job so people wouldn't die ,"{'neg': 0.22, 'neu': 0.683, 'pos': 0.097, 'compound': -0.6531}"
98,2020-12-07 21:59:59+00:00,RT Breaking NYT: Trump officials passed when Pfizer offered in late summer to sell the U.S. government additional doses of i...,"{'neg': 0.0, 'neu': 1.0, 'pos': 0.0, 'compound': 0.0}"
99,2020-12-07 21:59:59+00:00,RT Weird that Covid is just like the flu but every right wing political figure that tests positive is immediately flown to th...,"{'neg': 0.109, 'neu': 0.66, 'pos': 0.231, 'compound': 0.6705}"
100,2020-12-07 21:59:59+00:00,"Rebroadcast: CPAC on YouTube Streamed Live with a subtitle/closed caption. 

December 7, 2020, Monday
Federal COVID-19 update: PM says first vaccine doses could be delivered next week

Watch a YouTube streamed live at:","{'neg': 0.0, 'neu': 1.0, 'pos': 0.0, 'compound': 0.0}"
101,2020-12-07 21:59:59+00:00,RT America First?,"{'neg': 0.0, 'neu': 1.0, 'pos': 0.0, 'compound': 0.0}"
102,2020-12-07 21:59:59+00:00,"This is an important health issue, made worse by our recent pandemic. Hopefully 2021 will be a healthier and happier year for all.","{'neg': 0.103, 'neu': 0.633, 'pos': 0.263, 'compound': 0.5859}"
103,2020-12-07 21:59:59+00:00,"RT ""A person living for decades in a county with high levels of fine particulate matter in the air is 15 percent more likely to di...","{'neg': 0.0, 'neu': 0.892, 'pos': 0.108, 'compound': 0.2263}"
104,2020-12-07 21:59:59+00:00,"RT Here's another CDC case surveillance file mystery for you to ponder on. 

Of the 183K deaths they've confirmed through Nov...","{'neg': 0.0, 'neu': 1.0, 'pos': 0.0, 'compound': 0.0}"
105,2020-12-07 21:59:59+00:00,RT 77 Navajo Nation communities identified as having uncontrolled spread of COVID-19 by Navajo Department of Health,"{'neg': 0.111, 'neu': 0.889, 'pos': 0.0, 'compound': -0.25}"
106,2020-12-07 21:59:59+00:00,WANTED FOR MURDER,"{'neg': 0.701, 'neu': 0.299, 'pos': 0.0, 'compound': -0.6908}"
107,2020-12-07 21:59:59+00:00,CIA psychological profiler who labeled Trump 'dangerous' dies of covid-19 at 86 - The Washington Post #TrumpVirusDeathToll283K ,"{'neg': 0.275, 'neu': 0.725, 'pos': 0.0, 'compound': -0.6908}"
108,2020-12-07 21:59:59+00:00,"RT ""Quit playing politics with people's lives,"" says Sean Blair, who was furloughed from his job back in March due to the pan...","{'neg': 0.0, 'neu': 0.924, 'pos': 0.076, 'compound': 0.2023}"
109,2020-12-07 21:59:59+00:00,WHO looks at giving Covid-19 to healthy people to speed up vaccine trials,"{'neg': 0.0, 'neu': 0.683, 'pos': 0.317, 'compound': 0.6249}"
110,2020-12-07 22:00:00+00:00,"RT Took me less than 5m and it helps a lot! All mutuals please support! 

If you text ""SIGN PKGYOP"" to 50409, will...","{'neg': 0.0, 'neu': 0.71, 'pos': 0.29, 'compound': 0.8011}"
111,2020-12-07 22:00:00+00:00,"RT The Coronavirus pandemic has been tough on us all. 

This will brighten your week. 

Humanity.","{'neg': 0.082, 'neu': 0.761, 'pos': 0.158, 'compound': 0.34}"
112,2020-12-07 22:00:00+00:00,"Will more British Columbians watch the BC government's throne speech at 2pm or Dr. Bonnie Henry's briefing at 3pm?

From my very scientific poll of my family and friends, it seems far more will be tuning in to see if Dr. Henry extends COVID-19 restrictions for the weeks ahead.","{'neg': 0.0, 'neu': 0.911, 'pos': 0.089, 'compound': 0.5574}"
113,2020-12-07 22:00:00+00:00,"RT is a great resource for finding what services restaurants are providing throughout the pandemic.
If you...","{'neg': 0.0, 'neu': 0.796, 'pos': 0.204, 'compound': 0.6249}"
114,2020-12-07 22:00:00+00:00,This is unbelievable!! How can admin officials not purchase enough doses for the population? This is criminal behavior by a lunatic president. He's trying to kill us all.,"{'neg': 0.315, 'neu': 0.637, 'pos': 0.048, 'compound': -0.9018}"
115,2020-12-07 22:00:00+00:00,"RT Let's focus on getting #coronavirus vaccine to people who need and want it and ignore the bleating anti-vaxxers, at lea...","{'neg': 0.11, 'neu': 0.833, 'pos': 0.057, 'compound': -0.296}"
116,2020-12-07 22:00:00+00:00,"In my debut, I'm spilling the tea on financial guilt and how to work through it.

Thanks to and for your insight! #financialwellness #personalfinance 

https://t.co/BPCimXX2bV","{'neg': 0.074, 'neu': 0.813, 'pos': 0.113, 'compound': 0.2714}"
