,created_at,full_text,sentiment_score
0,2020-12-27 02:59:54+00:00,"RT Last January, I recommended a temporary ban on travel from China, when covid was just starting.  Sec. Duque said in Hous...","{'neg': 0.142, 'neu': 0.787, 'pos': 0.071, 'compound': -0.4215}"
1,2020-12-27 02:59:55+00:00,"RT In this post, we'll reverse-engineer the actual mRNA code of the SARS-CoV-2 vaccine, character f...","{'neg': 0.0, 'neu': 1.0, 'pos': 0.0, 'compound': 0.0}"
2,2020-12-27 02:59:55+00:00,RT She's beautiful ,"{'neg': 0.0, 'neu': 0.339, 'pos': 0.661, 'compound': 0.5994}"
3,2020-12-27 02:59:55+00:00,"Weight stigma may compromise men&amp;#8217;s health

https://t.co/hAKlMOAPXL

#Health #inshape #LifeStyle #Keto #weightloss #Covid19","{'neg': 0.0, 'neu': 1.0, 'pos': 0.0, 'compound': 0.0}"
4,2020-12-27 02:59:55+00:00,"RT 1 in 1,000 Americans have now died of COVID-19. 

The suffering is untold, the pain immense. Imagine having the power...","{'neg': 0.357, 'neu': 0.643, 'pos': 0.0, 'compound': -0.875}"
5,2020-12-27 02:59:55+00:00,"The ""Christian"" way to refuse to help the least of us during the celebration of Christ's birth?? No??","{'neg': 0.101, 'neu': 0.732, 'pos': 0.167, 'compound': 0.3527}"
6,2020-12-27 02:59:55+00:00,"RT You might have read the viral obituary that Courtney Farr wrote for his father, Marvin. It's part of a growing genre of...","{'neg': 0.0, 'neu': 0.928, 'pos': 0.072, 'compound': 0.1779}"
7,2020-12-27 02:59:55+00:00,"ya he follows his rules like he listens to his doctor and stays on a healthy diet, not to drink and exercise..","{'neg': 0.0, 'neu': 0.794, 'pos': 0.206, 'compound': 0.6369}"
8,2020-12-27 02:59:55+00:00,What does China have to do with stimulus money? And such a deadly virus could have come out of the U.S. just as easily so chill your racist jets. #COVID19 #TrumpVirus,"{'neg': 0.12, 'neu': 0.813, 'pos': 0.067, 'compound': -0.4336}"
9,2020-12-27 02:59:55+00:00,It'll be really hard to look at COVID-deniers/anti-maskers the same way after all this is said and done,"{'neg': 0.091, 'neu': 0.909, 'pos': 0.0, 'compound': -0.1761}"
10,2020-12-27 02:59:55+00:00,Is there an end in sight to the COVID-19 pandemic? via,"{'neg': 0.0, 'neu': 1.0, 'pos': 0.0, 'compound': 0.0}"
11,2020-12-27 02:59:55+00:00,RT It is disturbing to read about for profit #longtermcare homes paying out millions to shareholders while collecting gove...,"{'neg': 0.142, 'neu': 0.733, 'pos': 0.125, 'compound': -0.1027}"
12,2020-12-27 02:59:55+00:00,"ICE arrests and deportations dropped sharply in 2020, largely due to the pandemic","{'neg': 0.195, 'neu': 0.805, 'pos': 0.0, 'compound': -0.4404}"
13,2020-12-27 02:59:55+00:00,You are right. It's not. It's not right for people to die alone in hospitals all over the world either. It's a pandemic.,"{'neg': 0.219, 'neu': 0.781, 'pos': 0.0, 'compound': -0.7096}"
14,2020-12-27 02:59:55+00:00,"Corona Virus just obliterating Black and Latino communities in LA area....and it seems no one really cares.

What in the Hell are you doing","{'neg': 0.219, 'neu': 0.675, 'pos': 0.106, 'compound': -0.5434}"
15,2020-12-27 02:59:56+00:00,"RT ""It's a chess game and we are pawns."" Unemployment benefits for millions of Americans struggling to make ends meet will lapse at mi...","{'neg': 0.195, 'neu': 0.717, 'pos': 0.089, 'compound': -0.4767}"
16,2020-12-27 02:59:56+00:00,"RT Hold up.

The accidental low dose in the AstraZeneca trial was because Oxford insisted that NANODROP was more accurate...","{'neg': 0.159, 'neu': 0.841, 'pos': 0.0, 'compound': -0.34}"
17,2020-12-27 02:59:56+00:00,RT Fuck covid I miss the nice drunk girls in the bathroom,"{'neg': 0.41, 'neu': 0.437, 'pos': 0.153, 'compound': -0.5719}"
18,2020-12-27 02:59:56+00:00,"YOU LITERALLY DOWNPLAYED THIS PANDEMIC AND SAYING IT'LL GO AWAY LIKE THE COMMON COLD

YOU DESERVED TO LOSE THIS ELECTION","{'neg': 0.116, 'neu': 0.776, 'pos': 0.108, 'compound': -0.0516}"
19,2020-12-27 02:59:56+00:00,RT I know it's late. I know there aren't many on tonight. I'm struggling. My nephew is 3. He caught covid from his pre-school...,"{'neg': 0.109, 'neu': 0.891, 'pos': 0.0, 'compound': -0.4215}"
20,2020-12-27 02:59:56+00:00,"RT This is incompetence, plain and simple. 

This best explains why ours is the worst performing gov't Covid response in t...","{'neg': 0.243, 'neu': 0.592, 'pos': 0.164, 'compound': -0.34}"
21,2020-12-27 02:59:56+00:00,"Corona pandemic has disrupted the economy worldwide.We do not know when the situation will normalise. This is the effect of Kalchakra (time cycle). In such adverse times we need to have a good spiritual power to remain calm. 
#SundayThoughts","{'neg': 0.057, 'neu': 0.824, 'pos': 0.119, 'compound': 0.4019}"
22,2020-12-27 02:59:56+00:00,RT RT if you think should deactivate Twitter account for continuing to spread misinforma...,"{'neg': 0.0, 'neu': 1.0, 'pos': 0.0, 'compound': 0.0}"
23,2020-12-27 02:59:56+00:00,RT Pandemic shopping: there's truly nothing like it. ,"{'neg': 0.192, 'neu': 0.545, 'pos': 0.263, 'compound': 0.1999}"
24,2020-12-27 02:59:56+00:00,"RT guru ser to celaa svaa ser / Salman cooking desi style while his stay at home in Jaipur,Can't wait to have you back .Wishing you...","{'neg': 0.0, 'neu': 0.929, 'pos': 0.071, 'compound': 0.2263}"
25,2020-12-27 02:59:56+00:00,RT Mic drop. Bam!,"{'neg': 0.444, 'neu': 0.556, 'pos': 0.0, 'compound': -0.3382}"
26,2020-12-27 02:59:56+00:00,RT TAU research: 99.9% of COVID-19 virus dead in 30 seconds with UV LEDs - The Jerusalem Post,"{'neg': 0.202, 'neu': 0.798, 'pos': 0.0, 'compound': -0.6486}"
27,2020-12-27 02:59:56+00:00,Informercial with a bunch of non-family members eating indoors together during covid. Some...interesting choices.,"{'neg': 0.0, 'neu': 1.0, 'pos': 0.0, 'compound': 0.0}"
28,2020-12-27 02:59:56+00:00,"Senator,

You FAILED to deliver Georgia for President Trump.

So..

we will fail to vote for you.

BTW, what HAPPENED to the 

Covid Relief bill you bragged about?

President TRUMP called it a ""JOKE"".

He has not signed it.","{'neg': 0.155, 'neu': 0.721, 'pos': 0.124, 'compound': -0.3612}"
29,2020-12-27 02:59:57+00:00,RT New York Health Firm Faces Probe Over Unauthorized COVID-19 Vaccine,"{'neg': 0.0, 'neu': 1.0, 'pos': 0.0, 'compound': 0.0}"
30,2020-12-27 02:59:57+00:00,"RT Operation #Zumbach 
#Polish soldiers with and getting #LorryDrivers thru #Covid testing.
@teryt...","{'neg': 0.0, 'neu': 1.0, 'pos': 0.0, 'compound': 0.0}"
31,2020-12-27 02:59:57+00:00,I thought the hospital's were over run with Covid cases!?!? How do they have time to do this!?!?! Hummm ,"{'neg': 0.0, 'neu': 1.0, 'pos': 0.0, 'compound': 0.0}"
32,2020-12-27 02:59:57+00:00,"RT The ZOE COVID Symptom Study app estimates that there are approximately 48,500 new infections of COVID-19 in the UK per...","{'neg': 0.0, 'neu': 1.0, 'pos': 0.0, 'compound': 0.0}"
33,2020-12-27 02:59:57+00:00,"A real persecution of Christians is part of the ""great reset"".","{'neg': 0.0, 'neu': 0.709, 'pos': 0.291, 'compound': 0.6249}"
34,2020-12-27 02:59:57+00:00,"RT I'm a teacher. I teach English. I don't teach politics. I don't ""indoctrinate"" kids.

I'm not a babysitter. I'm not resp...","{'neg': 0.0, 'neu': 0.912, 'pos': 0.088, 'compound': 0.2584}"
35,2020-12-27 02:59:57+00:00,"RT As of today, 1 of every 1,000 Americans had died of COVID-19, and this irredeemable imbecile is *still* peddling this pr...","{'neg': 0.254, 'neu': 0.746, 'pos': 0.0, 'compound': -0.7783}"
36,2020-12-27 02:59:57+00:00,"A Facebook post from one of my friends.  Talking to her daughter who works at Long Beach Memorial Hospital in Long Beach, CA about #Covid.
 If you care about your family, your friends, your life - PLEASE STAY HOME AND WEAR A MASK.  As she says - this is REAL.","{'neg': 0.0, 'neu': 0.787, 'pos': 0.213, 'compound': 0.9087}"
37,2020-12-27 02:59:57+00:00,RT we are in a PANDEMIC,"{'neg': 0.0, 'neu': 1.0, 'pos': 0.0, 'compound': 0.0}"
38,2020-12-27 02:59:57+00:00,Blame Covid or Dan Andrews,"{'neg': 0.375, 'neu': 0.625, 'pos': 0.0, 'compound': -0.34}"
39,2020-12-27 02:59:57+00:00,"RT Will you choose to be vaccinated for the coronavirus?

https://t.co/IgN6b8SToY","{'neg': 0.0, 'neu': 1.0, 'pos': 0.0, 'compound': 0.0}"
40,2020-12-27 02:59:57+00:00,I know someone whose parents came in from the UK just a couple weeks ago and the dad has covid ,"{'neg': 0.0, 'neu': 1.0, 'pos': 0.0, 'compound': 0.0}"
41,2020-12-27 02:59:57+00:00,RT 31% people get information about #COVID19 from social media &amp; other digital channels. Internet through #PMWANI can litera...,"{'neg': 0.0, 'neu': 1.0, 'pos': 0.0, 'compound': 0.0}"
42,2020-12-27 02:59:57+00:00,RT One of the most dangerous jobs amid the pandemic is being a respiratory therapist! They are at EVERY intubation and manage...,"{'neg': 0.149, 'neu': 0.851, 'pos': 0.0, 'compound': -0.5697}"
43,2020-12-27 02:59:57+00:00,me when i finally meet the corona virus,"{'neg': 0.0, 'neu': 1.0, 'pos': 0.0, 'compound': 0.0}"
44,2020-12-27 02:59:57+00:00,"RT This is not how science works.

Those of you not ready to hear: 

A) Astrology is fake.
B) 2+2 is not equal to 5.
C) Yo...","{'neg': 0.172, 'neu': 0.828, 'pos': 0.0, 'compound': -0.6381}"
45,2020-12-27 02:59:58+00:00,mine neither,"{'neg': 0.0, 'neu': 1.0, 'pos': 0.0, 'compound': 0.0}"
46,2020-12-27 02:59:58+00:00,So how many seasonal workers will get the Covid Bonus like last time,"{'neg': 0.0, 'neu': 0.647, 'pos': 0.353, 'compound': 0.7184}"
47,2020-12-27 02:59:58+00:00,"RT Hey why is your law firm donating to Kelly Loeffler? The QAnon endorsements, KKK photos, repudiation from her WN...","{'neg': 0.0, 'neu': 1.0, 'pos': 0.0, 'compound': 0.0}"
48,2020-12-27 02:59:58+00:00,RT The unchallenged invasion by the  man-made #coronavirus comes from  the  misadministration of the world order. Making...,"{'neg': 0.0, 'neu': 1.0, 'pos': 0.0, 'compound': 0.0}"
49,2020-12-27 02:59:58+00:00,Global Over the Top (OTT) Services Market 2020-2025 (Impact of Covid-19),"{'neg': 0.0, 'neu': 0.847, 'pos': 0.153, 'compound': 0.2023}"
50,2020-12-27 02:59:58+00:00," as someone with absolutely no talent, yet having fabricated a career, what have YOU done for those suffering during this pandemic? With so many supporters over the years, who are now suffering unimaginable losses, hope you feel some responsibility to support THEM.","{'neg': 0.207, 'neu': 0.612, 'pos': 0.181, 'compound': -0.3483}"
51,2020-12-27 02:59:58+00:00,"RT Maya Rowden Hollis, 41yo Nurse, Bastrop, Lousiana, died of #covid19 10/26.  She was smart, caring, and worked extra shifts. A...","{'neg': 0.131, 'neu': 0.655, 'pos': 0.215, 'compound': 0.3182}"
52,2020-12-27 02:59:58+00:00,"RT Every year, we get to see ""galaxy"" of fans outside Galaxy apartment on occassion of birthday, but in c...","{'neg': 0.0, 'neu': 1.0, 'pos': 0.0, 'compound': 0.0}"
53,2020-12-27 02:59:58+00:00,RT NYC becomes Wuhan wet markets,"{'neg': 0.0, 'neu': 1.0, 'pos': 0.0, 'compound': 0.0}"
54,2020-12-27 02:59:58+00:00,"RT WHY won't sign the COVID Relief Bill or the DEFENSE Funding Bill?

I believe these are his...","{'neg': 0.0, 'neu': 0.75, 'pos': 0.25, 'compound': 0.6523}"
55,2020-12-27 02:59:58+00:00,RT China committed the moral equivalent of murder--NY Post Editorial Board: China's deadly COVID cover-up was worse than we thoug...,"{'neg': 0.217, 'neu': 0.697, 'pos': 0.086, 'compound': -0.4939}"
56,2020-12-27 02:59:58+00:00,"RT *puts protective glass to protect staff against coronavirus*

Customers:","{'neg': 0.0, 'neu': 0.776, 'pos': 0.224, 'compound': 0.3818}"
57,2020-12-27 02:59:58+00:00,Wishing u peace and blessings during this difficult time.,"{'neg': 0.152, 'neu': 0.305, 'pos': 0.543, 'compound': 0.7506}"
58,2020-12-27 02:59:58+00:00,"RT One week from tomorrow, a man who herded 1 million Uighurs into camps, jails human rights activists, crushed Tibet, disapp...","{'neg': 0.123, 'neu': 0.877, 'pos': 0.0, 'compound': -0.4215}"
59,2020-12-27 02:59:58+00:00,CDC Recommends Drug-Checking Services Amid Historic Overdose Deaths via,"{'neg': 0.0, 'neu': 0.808, 'pos': 0.192, 'compound': 0.2263}"
60,2020-12-27 02:59:58+00:00,A YouTuber i follow has been traveling non stop all quarantine with groups of friends and recently contracted covid and felt it necessary to go out (while sick) to get tacos from another friend whos apparently a cook. I almost had a melt down watching her cough to whole ride over,"{'neg': 0.094, 'neu': 0.799, 'pos': 0.107, 'compound': 0.2023}"
61,2020-12-27 02:59:59+00:00,"Overwhelmed L.A. hospitals brace for post-Christmas COVID wave
L.A. hospitals expect a new round of infections to result from Christmas gatherings, though it may take several weeks to determine the wave's severity.

#COVID19 #WearAMask #SocialDistancing ","{'neg': 0.0, 'neu': 0.966, 'pos': 0.034, 'compound': 0.0516}"
62,2020-12-27 02:59:59+00:00,"RT .@VJLangmaid reports: The CDC Covid Data Tracker says that as of 9 a.m. Saturday, 9,547,925 vaccine doses have been distrib...","{'neg': 0.0, 'neu': 1.0, 'pos': 0.0, 'compound': 0.0}"
63,2020-12-27 02:59:59+00:00,RT We're lucky COVID happened in 2020 imagine this happened in 2003. Months in your house with a Nokia 3310 playing fucki...,"{'neg': 0.0, 'neu': 0.813, 'pos': 0.187, 'compound': 0.5574}"
64,2020-12-27 02:59:59+00:00,RT we are in a PANDEMIC,"{'neg': 0.0, 'neu': 1.0, 'pos': 0.0, 'compound': 0.0}"
65,2020-12-27 02:59:59+00:00,RT Please continue to give him all you got. He needs it all. His dream is to go to the Amalfi Coast. Picture him there wit...,"{'neg': 0.0, 'neu': 0.848, 'pos': 0.152, 'compound': 0.5106}"
66,2020-12-27 02:59:59+00:00,What about #LongCovid? I personally know 3 people that have survived covid-19 but have long term serious issues.,"{'neg': 0.074, 'neu': 0.816, 'pos': 0.11, 'compound': 0.1779}"
67,2020-12-27 02:59:59+00:00,"RT No, it's the virus ruining their lives. Some governors are tightening things because your neglect and failures give them no g...","{'neg': 0.362, 'neu': 0.638, 'pos': 0.0, 'compound': -0.8481}"
68,2020-12-27 02:59:59+00:00,Your goddamn plans should have been to stay the fuck home!!!!!!,"{'neg': 0.463, 'neu': 0.537, 'pos': 0.0, 'compound': -0.8302}"
69,2020-12-27 02:59:59+00:00,RT This is part of a dangerous trend in reporting each allergic reaction as news. A million people have been vaccinated. A f...,"{'neg': 0.202, 'neu': 0.798, 'pos': 0.0, 'compound': -0.6486}"
70,2020-12-27 02:59:59+00:00,"... and you are defiant, stubborn, and most of all a SPREADER! Just you wait and see.... you'll be thinking of what I said when you are dying from Covid.  Do me a favour.... tell people to listen to the ""science"" when you are infected with this disease.","{'neg': 0.147, 'neu': 0.8, 'pos': 0.053, 'compound': -0.636}"
71,2020-12-27 02:59:59+00:00,RT We're lucky COVID happened in 2020 imagine this happened in 2003. Months in your house with a Nokia 3310 playing fucki...,"{'neg': 0.0, 'neu': 0.813, 'pos': 0.187, 'compound': 0.5574}"
72,2020-12-27 02:59:59+00:00,"RT 14 million Americans will lose their unemployment benefits if Trump does not sign Covid relief legislation today.

Mr. Pres...","{'neg': 0.305, 'neu': 0.598, 'pos': 0.097, 'compound': -0.6761}"
73,2020-12-27 02:59:59+00:00,"the one year i wanted 2 go art museum covid came and fucked up everything, never again","{'neg': 0.216, 'neu': 0.784, 'pos': 0.0, 'compound': -0.6597}"
74,2020-12-27 02:59:59+00:00,RT RT if you think should deactivate Twitter account for continuing to spread misinforma...,"{'neg': 0.0, 'neu': 1.0, 'pos': 0.0, 'compound': 0.0}"
75,2020-12-27 02:59:59+00:00,"RT #DopeyDon still refuses to:

- Accept his historic blowout loss
- Sign the bill for pandemic relief
- Speak about a Christm...","{'neg': 0.082, 'neu': 0.714, 'pos': 0.204, 'compound': 0.5267}"
76,2020-12-27 02:59:59+00:00,"RT #SarileruNeekevvaru is screening in Kurnool at Victory theater post corona 

 #SarkaruVaariPaata","{'neg': 0.0, 'neu': 1.0, 'pos': 0.0, 'compound': 0.0}"
77,2020-12-27 02:59:59+00:00,"A clear demonstration of #Trump's character?
His ability to play golf as thousands die daily from #COVID19, and tens of thousands of other Americans are stressed over their jobs and housing.
#TrumpIsACompleteFailure #TrumpVirus #CongressIsBroken","{'neg': 0.147, 'neu': 0.651, 'pos': 0.202, 'compound': 0.1027}"
78,2020-12-27 02:59:59+00:00,RT I recall a few days before the outbreak seeing a screenshot twitter post from a northern beaches cafe wor...,"{'neg': 0.0, 'neu': 1.0, 'pos': 0.0, 'compound': 0.0}"
79,2020-12-27 03:00:00+00:00,"RT If the president does not sign the $2.3 trillion spending package, two federal jobless programs that expanded and exten...","{'neg': 0.0, 'neu': 1.0, 'pos': 0.0, 'compound': 0.0}"
80,2020-12-27 03:00:00+00:00,"The guy had previously said that estimated increase in suicide rate was between 1 and, like, 146%. And *believing that* he decided that the number of suicides would be greater than the Covid deaths. It was all very googlable but he decided to just repeat or make up an obvs lie.","{'neg': 0.05, 'neu': 0.836, 'pos': 0.114, 'compound': 0.1406}"
81,2020-12-27 03:00:00+00:00,RT Canadian scientist sent deadly viruses to Wuhan lab months before RCMP asked to investigate | CBC News,"{'neg': 0.0, 'neu': 1.0, 'pos': 0.0, 'compound': 0.0}"
82,2020-12-27 03:00:00+00:00,"Men &amp; Women on Basketball Court

c. 1895

Placer County English Citrus Colony

#BoxingDay 
#Christmas 
#COVID19 
#PlacerLife","{'neg': 0.0, 'neu': 1.0, 'pos': 0.0, 'compound': 0.0}"
83,2020-12-27 03:00:00+00:00,"'We owe them a safe environment,' Popovich on fans not able to attend games amid pandemic #nba #gospursgo #nbatwitter","{'neg': 0.0, 'neu': 0.861, 'pos': 0.139, 'compound': 0.4404}"
84,2020-12-27 03:00:00+00:00,"Aussie to receive one of the first COVID-19 vaccinations, via 
https://t.co/spAhS3YvO6","{'neg': 0.0, 'neu': 1.0, 'pos': 0.0, 'compound': 0.0}"
85,2020-12-27 03:00:00+00:00,"Do you have questions about the #COVID19 vaccine? 

These doctors and health experts on TikTok have answers.","{'neg': 0.0, 'neu': 1.0, 'pos': 0.0, 'compound': 0.0}"
86,2020-12-27 03:00:00+00:00,"Singapore to Ease Covid-19 Restrictions Next Week. 

Under Phase 3 of the Lion City's reopening plan, up to eight visitors are allowed inside homes and tourist attractions will get to operate at 65 percent capacity.

https://t.co/t4LQcAxn6D 

#Singapore #Sg #covid19","{'neg': 0.0, 'neu': 0.875, 'pos': 0.125, 'compound': 0.6486}"
87,2020-12-27 03:00:00+00:00,"RT Sarah, in May your own news org reported that McConnell -- speaking for the Republicans who control the Senate --...","{'neg': 0.0, 'neu': 1.0, 'pos': 0.0, 'compound': 0.0}"
88,2020-12-27 03:00:00+00:00,"RT In this pandemic, the countries that have acted swiftly and decisively are the countries that have best protected their ci...","{'neg': 0.0, 'neu': 0.659, 'pos': 0.341, 'compound': 0.8519}"
89,2020-12-27 03:00:00+00:00,RT We're lucky COVID happened in 2020 imagine this happened in 2003. Months in your house with a Nokia 3310 playing fucki...,"{'neg': 0.0, 'neu': 0.813, 'pos': 0.187, 'compound': 0.5574}"
90,2020-12-27 03:00:00+00:00,"Elise Jordan slams GOP for playing ""political Candyland"" on COVID relief","{'neg': 0.0, 'neu': 0.647, 'pos': 0.353, 'compound': 0.5994}"
91,2020-12-27 03:00:00+00:00,Unbelievable the stupidity of these GOP leaders who care for noone. #partyofdeath #LetThemEatCake,"{'neg': 0.162, 'neu': 0.559, 'pos': 0.279, 'compound': 0.2732}"
92,2020-12-27 03:00:00+00:00,"Federal approval of the second coronavirus vaccine means more doses are coming to Washington and with them a growing interest about the distribution of vaccines

https://t.co/y5zEpO2uCx","{'neg': 0.0, 'neu': 0.747, 'pos': 0.253, 'compound': 0.7783}"
93,2020-12-27 03:00:00+00:00,"RT Thinking about all of the health care workers we've lost to COVID-19, whose families are spending their first holidays...","{'neg': 0.092, 'neu': 0.677, 'pos': 0.231, 'compound': 0.5423}"
94,2020-12-27 03:00:00+00:00,"RT Shock Doctrine says Governments uses times of crisis like natural calamities, wars or epidemics to push repressive changes....","{'neg': 0.414, 'neu': 0.423, 'pos': 0.163, 'compound': -0.8271}"
95,2020-12-27 03:00:00+00:00,"Don't go out to celebrate New Year's, #California...

Let's learn from the past and #StayHome to #StopTheSurge!

@CAPublicHealth #PublicHealth #CACounties #NewYears2021 #YourActionsSaveLives","{'neg': 0.0, 'neu': 0.84, 'pos': 0.16, 'compound': 0.6114}"
96,2020-12-27 03:00:00+00:00,Saving lives during the holidays...one drop at a time. Fort Wayne's American Red Cross blood donors continue showing up during the winter months. Some even donate plasma that can help COVID-19 victims.  ,"{'neg': 0.122, 'neu': 0.803, 'pos': 0.075, 'compound': -0.1779}"
97,2020-12-27 03:00:00+00:00,"Around 19,500 doses of the Pfizer/BioNTech #COVID vaccine have arrived in #Paris from the #Pfizer factory in Puurs, Belgium. #France plans to start vaccinations on Sunday, starting with the residents of two elderly care facilities.","{'neg': 0.0, 'neu': 0.914, 'pos': 0.086, 'compound': 0.4939}"
98,2020-12-27 03:00:00+00:00,"#ESSEX COUNTY RECEIVES #VACCINE: The COVID-19 vaccine was distributed to health care workers at Essex County Community College in #Newark.

https://t.co/fuP7dsJ2hm","{'neg': 0.0, 'neu': 0.862, 'pos': 0.138, 'compound': 0.4939}"
99,2020-12-27 03:00:00+00:00,Rensselaer County health officials reported the highest single-day rise in COVID-19 cases with 161 new cases announced Saturday. The previous high was 128 cases on Wednesday.,"{'neg': 0.0, 'neu': 1.0, 'pos': 0.0, 'compound': 0.0}"
100,2020-12-27 03:00:00+00:00,"AP Gears Up For 2-Day Covid-19 Vaccination Dry-Run In Krishna District 
Watch video &gt;&gt; #CoronavirusStrain #NTVNews #NTVTelugu","{'neg': 0.0, 'neu': 1.0, 'pos': 0.0, 'compound': 0.0}"
101,2020-12-27 03:00:00+00:00,"RT Rep. Katie Porter
We need more oversight of the defense industry. In July, I pressed a Lockheed Martin about millions th...","{'neg': 0.0, 'neu': 0.933, 'pos': 0.067, 'compound': 0.128}"
102,2020-12-27 03:00:00+00:00,Timeline: Every major COVID-19 development in San Antonio since the start of the pandemic  ,"{'neg': 0.0, 'neu': 1.0, 'pos': 0.0, 'compound': 0.0}"
103,2020-12-27 03:00:00+00:00,"""I would like very much for the world to know that the numbers of people that have died from COVID-19 are not just numbers, they are real people with heartbroken families.""  
","{'neg': 0.206, 'neu': 0.729, 'pos': 0.065, 'compound': -0.7506}"
104,2020-12-27 03:00:00+00:00,"Jurgen Klopp sends message to Liverpool fans about 2020 and sets out plan for next year

https://t.co/MJgahsrWph","{'neg': 0.0, 'neu': 1.0, 'pos': 0.0, 'compound': 0.0}"
105,2020-12-27 03:00:00+00:00,"It was nine months in the making.

https://t.co/FJtSzVNnvp","{'neg': 0.0, 'neu': 1.0, 'pos': 0.0, 'compound': 0.0}"
106,2020-12-27 03:00:00+00:00,"RT Mask Mandates Seem to Make Coronavirus Infection Rates Climb, Study Says ","{'neg': 0.0, 'neu': 1.0, 'pos': 0.0, 'compound': 0.0}"
107,2020-12-27 03:00:00+00:00,How COVID-19 Hollowed Out A Generation Of Young Black Men,"{'neg': 0.0, 'neu': 1.0, 'pos': 0.0, 'compound': 0.0}"
108,2020-12-27 03:00:00+00:00,Wildlife officials say state park visitation in 2020 has been roughly 31% higher than it was in 2019.,"{'neg': 0.0, 'neu': 1.0, 'pos': 0.0, 'compound': 0.0}"
109,2020-12-27 03:00:00+00:00,"Health officials say the new COVID-19 variant cases in Canada involve a couple near Toronto, with no known travel history, exposure or high-risk contacts.","{'neg': 0.087, 'neu': 0.913, 'pos': 0.0, 'compound': -0.296}"
110,2020-12-27 03:00:00+00:00,"Throughout these past several months, children have seen multiple schools and businesses close their doors. They've watch loved one's and others pass away due to COVID-19. It's all taking a toll on them and their mental health.","{'neg': 0.0, 'neu': 0.902, 'pos': 0.098, 'compound': 0.5994}"
111,2020-12-27 03:00:00+00:00,"CHIME IN: Do you believe employers should be able to make coronavirus vaccinations mandatory for employees?

https://t.co/67VTmhDDbt","{'neg': 0.0, 'neu': 0.925, 'pos': 0.075, 'compound': 0.0772}"
112,2020-12-27 03:00:00+00:00,RT Not surprising after they filed a lawsuit against the state ,"{'neg': 0.292, 'neu': 0.708, 'pos': 0.0, 'compound': -0.4047}"
113,2020-12-27 03:00:00+00:00,"Jim, as his loved ones call him, was rushed to Methodist Hospital with very low oxygen levels but his health worsened.

https://t.co/ZRyfv7WGng","{'neg': 0.205, 'neu': 0.704, 'pos': 0.091, 'compound': -0.476}"
114,2020-12-27 03:00:00+00:00,"RT """"Foreclosures, hunger, homelessness, suicide,"" said Michele Evermore, a senior policy analyst for the National Employment...","{'neg': 0.432, 'neu': 0.568, 'pos': 0.0, 'compound': -0.872}"
115,2020-12-27 03:00:00+00:00,Longevity risk transfer nears record. 2021 to be busy again despite pandemic: WTW,"{'neg': 0.149, 'neu': 0.851, 'pos': 0.0, 'compound': -0.2732}"
116,2020-12-27 03:00:00+00:00,Corona is back and even worse than before. Stay safe!,"{'neg': 0.237, 'neu': 0.56, 'pos': 0.203, 'compound': -0.126}"
117,2020-12-27 03:00:00+00:00,"RT #VIDEO: Prince Khalid Al-Faisal, emir of #Makkah and advisor to King Salman receives the first dose of the #COVID19 vacc...","{'neg': 0.0, 'neu': 1.0, 'pos': 0.0, 'compound': 0.0}"
118,2020-12-27 03:00:00+00:00,"""The lesson of 2020 to me, really is that we are strong and brave -- and there are ways we can help each other be well,"" writes","{'neg': 0.0, 'neu': 0.667, 'pos': 0.333, 'compound': 0.8885}"
119,2020-12-27 03:00:00+00:00,'Abdication of responsibility': Biden slams Trump for holding up coronavirus relief. Similar overtones in india echoing against the fascist regime headed by Narendra modi ( including draconian farmers laws ),"{'neg': 0.104, 'neu': 0.807, 'pos': 0.089, 'compound': -0.128}"
120,2020-12-27 03:00:00+00:00,"RT Republicans in key states that voted for President-elect Joe Biden are pushing for new restrictions, especially to absentee voting....","{'neg': 0.111, 'neu': 0.889, 'pos': 0.0, 'compound': -0.3353}"
