,created_at,full_text,sentiment_score
0,2020-12-17 12:59:54+00:00,"RT First food banks (over 2,000), now UNICEF steps in to feed hungry children in Britain. 65,000+ dead with Covid (6th worst...","{'neg': 0.296, 'neu': 0.704, 'pos': 0.0, 'compound': -0.8555}"
1,2020-12-17 12:59:55+00:00,RT Why is the government collecting taxes from us (and their pay checks) if they do not want to help the Americans in the...,"{'neg': 0.189, 'neu': 0.811, 'pos': 0.0, 'compound': -0.4367}"
2,2020-12-17 12:59:55+00:00,"RT TODAY IN MELBOURNE

Ombudsman: Melbourne public housing Covid lockdown violated human rights.

Government: We'd do it again...","{'neg': 0.167, 'neu': 0.833, 'pos': 0.0, 'compound': -0.5267}"
3,2020-12-17 12:59:55+00:00,RT Hello Twitter I need a festive favour please! I'm making a Christmas Art Club it goes live at 11am on Monday 21st and I need...,"{'neg': 0.0, 'neu': 0.73, 'pos': 0.27, 'compound': 0.8172}"
4,2020-12-17 12:59:55+00:00,It's for unemployed.due to covid .but you needed to qualify for the 2000 ....many received less,"{'neg': 0.0, 'neu': 1.0, 'pos': 0.0, 'compound': 0.0}"
5,2020-12-17 12:59:55+00:00,RT Its has become very clear to me why the 1918 pandemic was followed by the roaring 20s &amp; why people were dressing up to go...,"{'neg': 0.0, 'neu': 0.896, 'pos': 0.104, 'compound': 0.4391}"
6,2020-12-17 12:59:55+00:00,"Took 10 mnth to get PR. Now waiting frm 10 mnth jst 2 get Authorization 2 travel.
Wishing to celebrate X-Mas in Canada
@IRCC be my  give me my gift.
Beg u with fold hand
","{'neg': 0.0, 'neu': 0.726, 'pos': 0.274, 'compound': 0.8934}"
7,2020-12-17 12:59:55+00:00,"RT NEW: 

61,000+! new Covid cases in CALIFORNIA TODAY, massively shattering the single day record for any state. 

246,0...","{'neg': 0.0, 'neu': 1.0, 'pos': 0.0, 'compound': 0.0}"
8,2020-12-17 12:59:55+00:00,RT Macron's positive coronavirus test has also had a ripple effect across the E.U. -- as other European leaders who met with...,"{'neg': 0.0, 'neu': 0.854, 'pos': 0.146, 'compound': 0.5574}"
9,2020-12-17 12:59:55+00:00,RT #LouisTomlinson's #LiveFromLondon gig breaks record for Biggest Male Solo Artist Livestream of The year and saves jobl...,"{'neg': 0.0, 'neu': 1.0, 'pos': 0.0, 'compound': 0.0}"
10,2020-12-17 12:59:55+00:00,RT The U.S doesn't have more covid cases because of more testing.  We don't have more deaths because of inferior HCWs.  It's...,"{'neg': 0.114, 'neu': 0.886, 'pos': 0.0, 'compound': -0.4019}"
11,2020-12-17 12:59:55+00:00,I really love to see all the pics of my colleagues getting called. Finishing Law school during a pandemic was no joke. We deserve every ounce of happiness that the Bar Call moment brings us,"{'neg': 0.045, 'neu': 0.762, 'pos': 0.193, 'compound': 0.8023}"
12,2020-12-17 12:59:55+00:00,RT Its has become very clear to me why the 1918 pandemic was followed by the roaring 20s &amp; why people were dressing up to go...,"{'neg': 0.0, 'neu': 0.896, 'pos': 0.104, 'compound': 0.4391}"
13,2020-12-17 12:59:55+00:00,RT NY GOP asks Trump to force Cuomo to reveal nursing home deaths,"{'neg': 0.0, 'neu': 1.0, 'pos': 0.0, 'compound': 0.0}"
14,2020-12-17 12:59:55+00:00,RT Macron has tested positive for COVID and bigotry.,"{'neg': 0.0, 'neu': 0.69, 'pos': 0.31, 'compound': 0.5574}"
15,2020-12-17 12:59:55+00:00,RT I literally encouraged people to care for each other when I tweeted reasons to #StayHome over the holidays... and this is what...,"{'neg': 0.0, 'neu': 0.707, 'pos': 0.293, 'compound': 0.8074}"
16,2020-12-17 12:59:55+00:00,RT Its has become very clear to me why the 1918 pandemic was followed by the roaring 20s &amp; why people were dressing up to go...,"{'neg': 0.0, 'neu': 0.896, 'pos': 0.104, 'compound': 0.4391}"
17,2020-12-17 12:59:55+00:00,Worry about your constituents instead of fake outrage,"{'neg': 0.65, 'neu': 0.35, 'pos': 0.0, 'compound': -0.8519}"
18,2020-12-17 12:59:55+00:00,RT What was the hurry to notify the laws in Delhi if they were so bad?,"{'neg': 0.23, 'neu': 0.77, 'pos': 0.0, 'compound': -0.6696}"
19,2020-12-17 12:59:55+00:00,RT The Government convinced you to wear a mask and take an experimental vax without liability for a virus with a 99.8 % surviv...,"{'neg': 0.0, 'neu': 0.837, 'pos': 0.163, 'compound': 0.5093}"
20,2020-12-17 12:59:55+00:00,6 weeks . Again gonna stick to this as much as possible but **** this is depressing. I'm fed up of thinking what I've missed seeing or the people I'm desperate to catch up with after months/years of little/no contact.,"{'neg': 0.198, 'neu': 0.802, 'pos': 0.0, 'compound': -0.8462}"
21,2020-12-17 12:59:55+00:00,"RT A devastating day in the pandemic for the US. So far today, Johns Hopkins has reported 242,490 new cases and 3,518 reported dea...","{'neg': 0.158, 'neu': 0.842, 'pos': 0.0, 'compound': -0.6486}"
22,2020-12-17 12:59:56+00:00,"RT U.S. tops 17 million Covid-19 cases after setting record with 3,300 deaths related to coronavirus on Thursday.","{'neg': 0.0, 'neu': 0.837, 'pos': 0.163, 'compound': 0.5106}"
23,2020-12-17 12:59:56+00:00,"RT This is in Columbus, Ohio. Someone posted this on Facebook. Covid has people going crazy ","{'neg': 0.138, 'neu': 0.862, 'pos': 0.0, 'compound': -0.34}"
24,2020-12-17 12:59:56+00:00,That's what you get for hanging around with EU27 heads of govt.,"{'neg': 0.0, 'neu': 1.0, 'pos': 0.0, 'compound': 0.0}"
25,2020-12-17 12:59:56+00:00,There are 5g antennas in the mask.,"{'neg': 0.0, 'neu': 1.0, 'pos': 0.0, 'compound': 0.0}"
26,2020-12-17 12:59:56+00:00,"RT 2020 has become a pivotal moment in history. The pandemic has changed how we work, but not what we do - here we acknowledge some...","{'neg': 0.0, 'neu': 1.0, 'pos': 0.0, 'compound': 0.0}"
27,2020-12-17 12:59:56+00:00,"RT Twitter allowed the Russian collusion hoax, plus the Brett Kavanaugh gang-rapist hoax to circulate...
They censored the T...","{'neg': 0.266, 'neu': 0.734, 'pos': 0.0, 'compound': -0.5859}"
28,2020-12-17 12:59:56+00:00,Covid,"{'neg': 0.0, 'neu': 1.0, 'pos': 0.0, 'compound': 0.0}"
29,2020-12-17 12:59:56+00:00,"RT I can't believe New Zealand are covid free, Australia not far off and Britain are still living this fuckery on repeat a y...","{'neg': 0.0, 'neu': 0.875, 'pos': 0.125, 'compound': 0.5106}"
30,2020-12-17 12:59:56+00:00,"RT Home Secretary Priti Patel says police will deal with ""fragrant"" breaches of Covid-19 restrictions. What about the ones th...","{'neg': 0.0, 'neu': 1.0, 'pos': 0.0, 'compound': 0.0}"
31,2020-12-17 12:59:56+00:00,"RT For the first time in history UNICEF will help feed children in the UK.

This tells you everything you need to know about t...","{'neg': 0.0, 'neu': 0.899, 'pos': 0.101, 'compound': 0.4019}"
32,2020-12-17 12:59:56+00:00,RT COVID is raging and the buffoon in the White House is still tweeting only about the election. Sad!,"{'neg': 0.285, 'neu': 0.715, 'pos': 0.0, 'compound': -0.7777}"
33,2020-12-17 12:59:56+00:00,"somebody's grandparents won't survive the winter because this guy and his wife cut in line.
#truechristian #TrumpVirus","{'neg': 0.116, 'neu': 0.884, 'pos': 0.0, 'compound': -0.2732}"
34,2020-12-17 12:59:56+00:00,RT Its has become very clear to me why the 1918 pandemic was followed by the roaring 20s &amp; why people were dressing up to go...,"{'neg': 0.0, 'neu': 0.896, 'pos': 0.104, 'compound': 0.4391}"
35,2020-12-17 12:59:56+00:00,"RT Sir Ian McKellen has received the Covid vaccine. ""Anyone who has lived as long as I have is alive because they have had...","{'neg': 0.0, 'neu': 0.898, 'pos': 0.102, 'compound': 0.3818}"
36,2020-12-17 12:59:56+00:00,"YouTube team, 
Edumantra is educational channel and it help very all student during this Corona period and 

edumantra did not break any policy of YouTube so kindly solve this problem

@EDUMANTRA3","{'neg': 0.07, 'neu': 0.7, 'pos': 0.23, 'compound': 0.7347}"
37,2020-12-17 12:59:56+00:00,"RT It's not a COVID-19 relief package if it doesn't include survival checks.

It's not a COVID-19 relief package if it doesn't i...","{'neg': 0.196, 'neu': 0.804, 'pos': 0.0, 'compound': -0.6259}"
38,2020-12-17 12:59:56+00:00,RT My boyfriend got his covid vaccine yesterday and I can tell you the most prominent side effect is the inability to shut up...,"{'neg': 0.099, 'neu': 0.806, 'pos': 0.095, 'compound': -0.0276}"
39,2020-12-17 12:59:56+00:00,An asshole,"{'neg': 0.0, 'neu': 1.0, 'pos': 0.0, 'compound': 0.0}"
40,2020-12-17 12:59:56+00:00,"No, the Covid-19 relief package Congress is about to finalize isn't enough for workers, families and entrepreneurs. And everybody seems to have forgotten the lessons of the 2008 crisis. w/@nirkaissar 
https://t.co/JWmcu7d0db","{'neg': 0.162, 'neu': 0.755, 'pos': 0.084, 'compound': -0.4404}"
41,2020-12-17 12:59:56+00:00,RT DeSantis faces renewed scrutiny following discovery of mysterious gap in Florida's COVID death tally,"{'neg': 0.218, 'neu': 0.782, 'pos': 0.0, 'compound': -0.5994}"
42,2020-12-17 12:59:56+00:00,RT The story of the Garden Bridge was this in microcosm with only tens of millions of pounds lost. But Parliament &amp; most of the m...,"{'neg': 0.062, 'neu': 0.938, 'pos': 0.0, 'compound': -0.1655}"
43,2020-12-17 12:59:56+00:00,Just the single sentence 'Covid restrictions are worse' makes me so f*cking angry. He sure seems hellbent on digging passed rock bottom to prove just how deplorable he can be. Disgusting.,"{'neg': 0.254, 'neu': 0.655, 'pos': 0.091, 'compound': -0.8166}"
44,2020-12-17 12:59:57+00:00,RT Covid toh bas bahaana tha...Khudko tune pehle hi maar diya tha...Its a lesson for all the girls/women out there dont suff...,"{'neg': 0.0, 'neu': 1.0, 'pos': 0.0, 'compound': 0.0}"
45,2020-12-17 12:59:57+00:00,We need to watch our gov especially Moscow Mitch live on $1200. For a year It's pathetic what he has done to the American people  COVID has killed 3.5 million of Americans to me McConnell is a pathetic person so is the rest of our gov that doesn't want to help the American people,"{'neg': 0.239, 'neu': 0.761, 'pos': 0.0, 'compound': -0.9369}"
46,2020-12-17 12:59:57+00:00,RT Everyone's waiting for 2021 acting as if COVID expires December 31st ,"{'neg': 0.0, 'neu': 1.0, 'pos': 0.0, 'compound': 0.0}"
47,2020-12-17 12:59:57+00:00,"Service Update 13:00 -  A half hourly Stansted Express service is running.

Please remember to wear a face covering when travelling with us. 

Service updates can be found here ","{'neg': 0.0, 'neu': 0.924, 'pos': 0.076, 'compound': 0.3182}"
48,2020-12-17 12:59:57+00:00,RT i love her,"{'neg': 0.0, 'neu': 0.417, 'pos': 0.583, 'compound': 0.6369}"
49,2020-12-17 12:59:57+00:00,"Service Update 13:00 - Disruption owing to a track defect between London Liverpool Street and Hackney Downs 

All service updates can be found here: Please remember to wear a mask when travelling with us &amp; at our stations.","{'neg': 0.116, 'neu': 0.829, 'pos': 0.055, 'compound': -0.3818}"
50,2020-12-17 12:59:57+00:00,RT This is the seat once held by James Madison. Nuff said.,"{'neg': 0.0, 'neu': 1.0, 'pos': 0.0, 'compound': 0.0}"
51,2020-12-17 12:59:57+00:00,"RT Good morning. It's THURSDAY, Dec. 17.

In the early part of the pandemic, twice as many Black Marylanders died by suicid...","{'neg': 0.136, 'neu': 0.755, 'pos': 0.109, 'compound': -0.1779}"
52,2020-12-17 12:59:57+00:00,"If you don't test, you can't get #COVID19","{'neg': 0.0, 'neu': 1.0, 'pos': 0.0, 'compound': 0.0}"
53,2020-12-17 12:59:57+00:00,RT There are so many others in need at higher risk and Pence &amp; his wife have done NOTHING to prevent the pandemic...,"{'neg': 0.131, 'neu': 0.869, 'pos': 0.0, 'compound': -0.2901}"
54,2020-12-17 12:59:57+00:00,"RT I'm a doctor. Not a politician.

Perhaps that's why nothing about how COVID is being handled makes sense.

From a medica...","{'neg': 0.0, 'neu': 1.0, 'pos': 0.0, 'compound': 0.0}"
55,2020-12-17 12:59:57+00:00,"RT I'm seeing white folks, esp. white women, adamantly say schools are safe &amp; #COVID19 transmission is not happening much th...","{'neg': 0.0, 'neu': 0.873, 'pos': 0.127, 'compound': 0.4404}"
56,2020-12-17 12:59:57+00:00,RT #Pence KNOWS HE LET #Trump PUSH HIM OUT OF HIS ROLE AS THE #COVID19 CZAR &amp; THAT HE'S RESPONSIBLE 4 THE PAIN &amp; DEATH...,"{'neg': 0.257, 'neu': 0.653, 'pos': 0.09, 'compound': -0.7672}"
57,2020-12-17 12:59:57+00:00,RT Today one of the journalists traveling with Biden tested positive for COVID19,"{'neg': 0.0, 'neu': 0.769, 'pos': 0.231, 'compound': 0.5574}"
58,2020-12-17 12:59:57+00:00,"RT *King of Sweden criticizes his government's laissez-faire approach to #coronavirus. 
*""I think we have failed. We have a large...","{'neg': 0.241, 'neu': 0.759, 'pos': 0.0, 'compound': -0.6908}"
59,2020-12-17 12:59:57+00:00,So basically this guy wants everyone to stay inside and not go out and enjoy yourself people did it during ebola outbreak whats the difference now ..,"{'neg': 0.0, 'neu': 0.89, 'pos': 0.11, 'compound': 0.4939}"
60,2020-12-17 12:59:57+00:00,"RT Pandemic increased tech-enabled education in Punjab schools
The Department of School Education, Patiala has started Wha...","{'neg': 0.0, 'neu': 0.884, 'pos': 0.116, 'compound': 0.2732}"
61,2020-12-17 12:59:57+00:00,"I'm Victorian and take no joy in this. Just because some dickheads may have taken glee in our plight, surely they were a tiny minority? Hopefully NSW can stamp this outbreak quickly like the one in SA?","{'neg': 0.064, 'neu': 0.67, 'pos': 0.265, 'compound': 0.8621}"
62,2020-12-17 12:59:57+00:00,"You lost this tweet as soon as you stuck in ""patriarchal.""","{'neg': 0.323, 'neu': 0.677, 'pos': 0.0, 'compound': -0.5106}"
63,2020-12-17 12:59:57+00:00,"RT Democratic governor encourages people to stay home, gets caught out at wine bar
https://t.co/Rsi1yR4tn8","{'neg': 0.0, 'neu': 0.828, 'pos': 0.172, 'compound': 0.4404}"
64,2020-12-17 12:59:57+00:00,"RT Mitch McConnell is the sole reason this country does not have a COVID-19 relief deal. Not ""Congress"" not ""both sides"" ........","{'neg': 0.0, 'neu': 0.871, 'pos': 0.129, 'compound': 0.4767}"
65,2020-12-17 12:59:57+00:00,"Edumantra is best educational channel, helped a lot in this pandemic time please don't do this with edumantra they have done a lot of hard work on this channel 
@YouTube
 
@YouTubeIndia
 and for Sanjeev sir please don't take tension we are with you Red heartFolded hands","{'neg': 0.026, 'neu': 0.771, 'pos': 0.202, 'compound': 0.8542}"
66,2020-12-17 12:59:58+00:00,Asia-Pacific region are not guaranteed to have early access to COVID-19 shots: WHO,"{'neg': 0.0, 'neu': 1.0, 'pos': 0.0, 'compound': 0.0}"
67,2020-12-17 12:59:58+00:00,RT Thank you for your support and response ..our community needs al...,"{'neg': 0.0, 'neu': 0.658, 'pos': 0.342, 'compound': 0.6369}"
68,2020-12-17 12:59:58+00:00,RT Schools closing. Hospitals getting ready to be overloaded. No sick pay. Tenant tribunal turned into an eviction factory. Eco...,"{'neg': 0.118, 'neu': 0.628, 'pos': 0.255, 'compound': 0.3607}"
69,2020-12-17 12:59:58+00:00,"RT SAVE THE DATE! 11-12 February
How is COVID-19 affecting development in Africa? Join our upcoming online conference with","{'neg': 0.0, 'neu': 0.726, 'pos': 0.274, 'compound': 0.7525}"
70,2020-12-17 12:59:58+00:00,"RT -Over 300,000 Americans have died from COVID
-Millions have lots jobs
-Millions have slipped into poverty &amp; unemployment benefi...","{'neg': 0.366, 'neu': 0.634, 'pos': 0.0, 'compound': -0.8689}"
71,2020-12-17 12:59:58+00:00,RT Where'd he Go!? Checked Out? Golfing again? SHORT TIMER SYNDROME,"{'neg': 0.0, 'neu': 1.0, 'pos': 0.0, 'compound': 0.0}"
72,2020-12-17 12:59:58+00:00,"RT HANS. FACE. SPACE. 
We made a thing. Design by &amp; us. #tier3london #ukcovid #diehardisachristmasmovie #Star...","{'neg': 0.0, 'neu': 1.0, 'pos': 0.0, 'compound': 0.0}"
73,2020-12-17 12:59:58+00:00,"RT We're fighting hard for stimulus checks in this COVID-relief bill. And, we believe we'll get them. The American people need...","{'neg': 0.17, 'neu': 0.83, 'pos': 0.0, 'compound': -0.4404}"
74,2020-12-17 12:59:58+00:00,"RT Wow.

A top Trump appointee,  Paul Alexander, repeatedly urged top health officials to adopt a ""herd immunity"" approach to Cov...","{'neg': 0.0, 'neu': 0.651, 'pos': 0.349, 'compound': 0.7964}"
75,2020-12-17 12:59:58+00:00,"RT Sir Ian McKellen has received the Covid vaccine. ""Anyone who has lived as long as I have is alive because they have had...","{'neg': 0.0, 'neu': 0.898, 'pos': 0.102, 'compound': 0.3818}"
76,2020-12-17 12:59:58+00:00,"Final  interview I produced this year and it was one of the defining figures of 2020 Dr. Fauci!

Watch back at the link below  

#Newsnight","{'neg': 0.0, 'neu': 1.0, 'pos': 0.0, 'compound': 0.0}"
77,2020-12-17 12:59:58+00:00,"RT BREAKING: America's Frontline Doctors has now launched an official petition against forced experimental vaccines. 

No St...","{'neg': 0.251, 'neu': 0.676, 'pos': 0.072, 'compound': -0.5719}"
78,2020-12-17 12:59:58+00:00,RT COVID is raging and the buffoon in the White House is still tweeting only about the election. Sad!,"{'neg': 0.285, 'neu': 0.715, 'pos': 0.0, 'compound': -0.7777}"
79,2020-12-17 12:59:58+00:00,"announced wide areas of south England, inc Buckinghamshire and most of Surrey, are moving into tier 3 restrictions, from Saturday. Because #coronavirus infections are continuing to rise. Bristol &amp; North Somerset moves down to tier 2, Herefordshire drops to tier 1.","{'neg': 0.0, 'neu': 1.0, 'pos': 0.0, 'compound': 0.0}"
80,2020-12-17 12:59:58+00:00,"""Video games can teach skills associated with increased happiness and life satisfaction, including openness to experience, self-care, a growth mindset, solution-focused thinking, mindfulness, persistence, self-discovery, and resilience""

https://t.co/GfyFNZurK7","{'neg': 0.0, 'neu': 0.628, 'pos': 0.372, 'compound': 0.9118}"
81,2020-12-17 12:59:58+00:00,RT I feel very lucky to have had the vaccine. I would have no hesitation in recommending it to anyone. ,"{'neg': 0.0, 'neu': 0.786, 'pos': 0.214, 'compound': 0.6003}"
82,2020-12-17 12:59:58+00:00,RT COVID is raging and the buffoon in the White House is still tweeting only about the election. Sad!,"{'neg': 0.285, 'neu': 0.715, 'pos': 0.0, 'compound': -0.7777}"
83,2020-12-17 12:59:58+00:00,"RT Breaking: NBC News confirms 230,365 new COVID-19 cases were reported in the U.S. today for a new single-day record. 

Tod...","{'neg': 0.0, 'neu': 1.0, 'pos': 0.0, 'compound': 0.0}"
84,2020-12-17 12:59:58+00:00,RT Quite something when UK government corruption in a pandemic becomes headline news in the NYTimes.,"{'neg': 0.0, 'neu': 1.0, 'pos': 0.0, 'compound': 0.0}"
85,2020-12-17 12:59:58+00:00,Follow me Back on Instagram my Username is,"{'neg': 0.0, 'neu': 1.0, 'pos': 0.0, 'compound': 0.0}"
86,2020-12-17 12:59:59+00:00,"RT If you trust the mainstream media with covid facts after they ran cover for Epstein, Russia collusion, Hunter Biden's laptop, J...","{'neg': 0.0, 'neu': 0.864, 'pos': 0.136, 'compound': 0.5106}"
87,2020-12-17 12:59:59+00:00,RT $ES_F US Senator Kaine: Agreement On Covid-19 Stimulus Has Basically Been Reached - MSNBC,"{'neg': 0.0, 'neu': 0.739, 'pos': 0.261, 'compound': 0.5574}"
88,2020-12-17 12:59:59+00:00,RT Tanzania has reportedly said it has no plans to import COVID19 vaccines. They say they will pin their hopes on research into loc...,"{'neg': 0.081, 'neu': 0.815, 'pos': 0.104, 'compound': 0.1531}"
89,2020-12-17 12:59:59+00:00,RT Wear a mask. Don't be like Modi ji.,"{'neg': 0.209, 'neu': 0.791, 'pos': 0.0, 'compound': -0.2755}"
90,2020-12-17 12:59:59+00:00,RT My boyfriend got his covid vaccine yesterday and I can tell you the most prominent side effect is the inability to shut up...,"{'neg': 0.099, 'neu': 0.806, 'pos': 0.095, 'compound': -0.0276}"
91,2020-12-17 12:59:59+00:00,World Health Organization Claims Santa Claus Is 'Immune' to COVID-19 via,"{'neg': 0.0, 'neu': 0.82, 'pos': 0.18, 'compound': 0.296}"
92,2020-12-17 12:59:59+00:00,RT Milton Keynes Council has had no prior notification of moving into Tier 3. We were missed off the statement in Parliament...,"{'neg': 0.18, 'neu': 0.82, 'pos': 0.0, 'compound': -0.5267}"
93,2020-12-17 12:59:59+00:00,"RT Because of certain symptoms, I got tested today &amp; have been found Covid positive. I am now in isolation on doctor's adv...","{'neg': 0.095, 'neu': 0.704, 'pos': 0.201, 'compound': 0.4588}"
94,2020-12-17 12:59:59+00:00,RT San Diego judge overrides Newsom's order and allows restaurants to re-open. AmazIng development. Looks like Santa Claus is c...,"{'neg': 0.0, 'neu': 0.741, 'pos': 0.259, 'compound': 0.743}"
95,2020-12-17 12:59:59+00:00,"RT ""Members will not be recognized unless they are wearing a mask and recognition will be withdrawn if they remove the mask wh...","{'neg': 0.0, 'neu': 1.0, 'pos': 0.0, 'compound': 0.0}"
96,2020-12-17 12:59:59+00:00,RT Business people owing a mountain of debt that is climbing higher and higher under a lockdown that has shuttered nearly ev...,"{'neg': 0.106, 'neu': 0.894, 'pos': 0.0, 'compound': -0.3612}"
97,2020-12-17 12:59:59+00:00,"RT Former CDC employees are raising the alarm about how political interference with science, meddling with the budget, and stifl...","{'neg': 0.112, 'neu': 0.888, 'pos': 0.0, 'compound': -0.34}"
98,2020-12-17 12:59:59+00:00,RT My boyfriend got his covid vaccine yesterday and I can tell you the most prominent side effect is the inability to shut up...,"{'neg': 0.099, 'neu': 0.806, 'pos': 0.095, 'compound': -0.0276}"
99,2020-12-17 12:59:59+00:00,"RT Just so we are clear..

No evidence that any of these measures on hospitality, reduced spread or had an affect on Covid 19 inf...","{'neg': 0.078, 'neu': 0.82, 'pos': 0.102, 'compound': 0.1689}"
100,2020-12-17 12:59:59+00:00,how the invisible or signs of parasites kill us and how to get rid of them:,"{'neg': 0.239, 'neu': 0.761, 'pos': 0.0, 'compound': -0.6908}"
101,2020-12-17 12:59:59+00:00,It's euthanasia but it's marketed a little differently. ,"{'neg': 0.0, 'neu': 1.0, 'pos': 0.0, 'compound': 0.0}"
102,2020-12-17 12:59:59+00:00,RT and my new paper with unpacks the first and second-order effects of #Covid_19 on the #digital #...,"{'neg': 0.0, 'neu': 1.0, 'pos': 0.0, 'compound': 0.0}"
103,2020-12-17 12:59:59+00:00,"RT Due to COVID19 I'll be blessing the first 300 people to like &amp; retweet this $500- $1000 through CashApp, Venmo , Apple Pay...","{'neg': 0.05, 'neu': 0.747, 'pos': 0.203, 'compound': 0.6486}"
104,2020-12-17 12:59:59+00:00,The covid shall not pass!!,"{'neg': 0.0, 'neu': 1.0, 'pos': 0.0, 'compound': 0.0}"
105,2020-12-17 12:59:59+00:00,Wuhan is celebrating being virus-free one year after first COVID case - Business Insider,"{'neg': 0.0, 'neu': 0.778, 'pos': 0.222, 'compound': 0.5719}"
106,2020-12-17 13:00:00+00:00,"I'm not stanning your group yet, but I'm looking forward to you to recover from coronavirus  
#GetWellSoonBongJaehyun","{'neg': 0.0, 'neu': 1.0, 'pos': 0.0, 'compound': 0.0}"
107,2020-12-17 13:00:00+00:00,"RT I agree. This is why we try to educate people on the real risks of SARS-COV-2
Please read through our","{'neg': 0.084, 'neu': 0.723, 'pos': 0.193, 'compound': 0.4019}"
108,2020-12-17 13:00:00+00:00,RT WEAR A MASK!,"{'neg': 0.0, 'neu': 1.0, 'pos': 0.0, 'compound': 0.0}"
109,2020-12-17 13:00:00+00:00,RT Anyone out there planning to take the COVID vaccine?...,"{'neg': 0.0, 'neu': 1.0, 'pos': 0.0, 'compound': 0.0}"
110,2020-12-17 13:00:00+00:00,"From the New York Times...
https://t.co/xlYotwrVtO","{'neg': 0.0, 'neu': 1.0, 'pos': 0.0, 'compound': 0.0}"
111,2020-12-17 13:00:00+00:00,RT The Government convinced you to wear a mask and take an experimental vax without liability for a virus with a 99.8 % surviv...,"{'neg': 0.0, 'neu': 0.837, 'pos': 0.163, 'compound': 0.5093}"
112,2020-12-17 13:00:00+00:00,"RT German #Ifo business confidence is expected to slip this month as the lockdown in Europe's biggest economy hardens. $EUR
Eu...","{'neg': 0.0, 'neu': 0.858, 'pos': 0.142, 'compound': 0.5106}"
113,2020-12-17 13:00:00+00:00,"RT Fauci warns coronavirus vaccinations could ""enhance the virus infection, instead of defeat it"". (ADE)

World hear this,...","{'neg': 0.216, 'neu': 0.784, 'pos': 0.0, 'compound': -0.5267}"
114,2020-12-17 13:00:00+00:00,Mandatory COVID vaccines? Not so fast. There are legal implications. #COVID19 #WorkTrends,"{'neg': 0.0, 'neu': 0.781, 'pos': 0.219, 'compound': 0.2023}"
115,2020-12-17 13:00:00+00:00,Could another lockdown be on the way?,"{'neg': 0.0, 'neu': 1.0, 'pos': 0.0, 'compound': 0.0}"
116,2020-12-17 13:00:00+00:00,How to expand access to COVID vaccines without compromising the science,"{'neg': 0.0, 'neu': 0.813, 'pos': 0.187, 'compound': 0.3182}"
117,2020-12-17 13:00:00+00:00,"If you're an employee or self-employed, the #COVID__19 Illness Benefit can provide you with income support if you've been diagnosed with #COVID19, or instructed by a doctor or the HSE to self-isolate.

The payment is EUR350 per week.

For more info visit","{'neg': 0.057, 'neu': 0.823, 'pos': 0.12, 'compound': 0.4588}"
118,2020-12-17 13:00:00+00:00,"How can we strengthen #COVID19 social assistance &amp; health response? Drawing on a recent webinar series, &amp; highlight considerations on targeting of programs, digitization &amp; routine health service delivery.

https://t.co/n2fJTQg0Cz","{'neg': 0.0, 'neu': 0.856, 'pos': 0.144, 'compound': 0.5719}"
119,2020-12-17 13:00:00+00:00,"For day nine of our #12DaysofChristmas, Caryl from our Social Investment Cymru team shares how proud she was that they'd managed to help the small community of Llanferres sustain an important communal space through the pandemic.","{'neg': 0.0, 'neu': 0.766, 'pos': 0.234, 'compound': 0.8316}"
120,2020-12-17 13:00:00+00:00,"#TrueNews
Dogs can smell COVID-19 on humans.
Here is #Misbar's Investigation 
https://t.co/9HiHIkZZe1
@drinksmoothies

#News #FactCheck #BreakingNews #Facts #COVID #Covid_19","{'neg': 0.0, 'neu': 1.0, 'pos': 0.0, 'compound': 0.0}"
121,2020-12-17 13:00:00+00:00,"60 areas in England where the COVID rate is on the decline.
https://t.co/Y7SYP8c010","{'neg': 0.0, 'neu': 1.0, 'pos': 0.0, 'compound': 0.0}"
