,full_text
0,pandemic shine bright light mobile digital capability contact center stretch limit play vital role keep human forefront customer interaction time social distancing
1,anyone year old eligible can receive vaccine new guideline release today newso
2,wednesday january ontario rtontario regional metric national amp provincial r value
3,deeply disturbing report imperative covaxin trial meet high standard one presse
4,thread today launch stampouttheduty campaign call government extend st
5,dr david walker medical director call eastsussex community adhere new lockdown guidance will
6,mln americans receive first covid shot health agency
7,palate cleanser catch episode season big trip need uk get back dale will not year sadly yorkshire
8,wear mask say censor you re give televized speech floor congress sit us house mem
9,near dear one battle life people still protest mask constitutional right freedomwe desperate need control chaos sure hope fool proof plan place
10,ball kick raheem sterling penalty fine break covid travel restriction lande
11,open floor podcast nbas covid woe stephen curry
12,sir since one year suffer animal sheep shelter residential area increase harmful dis
13,member congress feel carry gun protect colleague will not wear mask protect col
14,I ve never see group people less able wear basic face mask properly house republicans vote
15,bob good virginia republicanyou may remember last year challenge amp oust republican incumbe
16,hunch focusse enforcement fine walk coffee might distract people whether lockdown rule
17,shocking ashford truck stop today driver queue hour get border paperwork clear
18,work homestart harwich support family affect please
19,yesterday call fine levy every member cruelly recklessly refuse wear mask capitol
20,update zimbabwe national lockdown
21,anyone look something get lockdown evening spend half hour laugh hard whilst read list new entry oxford english dictionary favourite evening slobberknockeryoure welcome good night
22,azar literally turn freshman homework one week end senior year
23,covid death report uk today really word surprising shocking anyone look can
24,urge every american wear mask stay socially distance avoid large indoor gatheringswe save countless liv
25,uk report covid daily death toll that s people die titanic many n
26,even covid disappear tomorrow still would ve lose much
27,great conversation today prison violence pandemic institutional se
28,uk government may ban flight brazil amid new covid variant pm hint
29,note start january air traveller year age old require present negative test result airline prior boarding international flight bind canada
30,see barker try get hand vaccine try make million ppe fraud
31,dua lipas suitcase start pack holiday since pandemic begin
32,govt strategy appear allow disease circulate young people cause mu
33,covid vaccination soon available boris johnson confirmshttpstcospzlzhraaosent via
34,boris johnson grilled labour mp yvette cooper uk immediately introduce travel ban brazilit come
35,pandemic worsen mental health woman man poll suggest
36,anyone vote impeachment do not try get appointment vaccination do not say
37,headline scotlands total death figure today yet wilfully conceal englands record daily high present
38,completely agree that s fuck
39,pandemic famine maltreatment great conjunction insurrection sound like exodus story republican party madonna say blow white houseme what s parsha week look parsha see exodus
40,perfectly fine merkel say british variant totally unacceptable trump say china virus
41,many vaccine centre queue outside cold weather please wrap warm also do not arrive
42,babe ok you ve barely touch endlessly increase pile work expect even though
43,people report dead covid britain todayi google literally could not visualise
44,superb plan
45,new real talk podcast shirtmaskhoodietshirt maskup mask phonecase hoodie podcast independent nyc realtalk
46,we housing
47,sometimesjust random string word
48,wales one make fast buck free school meal kid get money worth foodthe ha
49,inauguration dayamerican dead covid
50,be not ban bailiff visit pandemic
51,you re tell teenage year steal strict parent twenty ruin global pandemic
52,big barrier vaccine uptake among first nation bc trust
53,cousin raise money dementia research aunt suffer dementia beat donate thank
54,bad president history could not handle pandemic incite violence enough trump
55,gop yes vote impeachment announce far vote electoral college objection last week make
56,
57,gtgt power merchant billy ray chitwoodmystery suspense love pandemic man find near death ditch
58,check inter de milan hoodie man woman kid eupstore storenvy hoodie inter seri
59,everything ensure child go hungry say man vote ensure child go hungryjust
60,wonder lonely animal zoo must since covid start one go visit animal
61,kidney failure pandemic might hit we year time skin cancer might become thing
62,member congress die catch covid republicans refuse wear mask republicans must indi
63,false datum justify lockdown
64,sheer amount people room do not know wear mask mask slip nose speak mask slip either you re wear wrong shit mask
65,I ve receive several dms friend ask parentsfamily member believe misinformation regard th
66,date wrong please delete amp issue correction rep gwen moore test positive amp follow th
67,africa get doctorsscientist fit examine covid come cure vaccine must depend foreign
68,do not charge nicola sturgeon wear facemask do not charge
69,love chinstrapper grownass adult wear mask improperly like toddler determine
70,since political aspirant go god know awareness lazy bunche lockdown expect drag nothing like sowore everywhere bit man agenda
71,guard leader currently capitol send note say they re tired lawmaker talk soldier w
72,feel bad ontariolockdown till nxt winter
73,anything positive come pandemic realization politician party want sp
74,costco covid af
75,comfortable member team undermine health expert pandemic must watch work pay we yes allow peddle conspiracy theory denounce heath advice cho
76,icymi last night scotus reinstate federal policy force people obtain medication abortion person risk
77,care patient every day take huge toll icu community amp wide colleague
78,love covid hair son
79,abortion case front scotu wacb bench trump majority rule people seek medication abortion must phy
80,wild title jobless sell nude still struggle
81,hope coronavirus go
82,question answer remember small step save life stayhomesavelive
83,wrong fuckwit get back heat stable cunt
84,way tweet jet around world global pandemic antivax boyfriend
85,congresswoman lauren boebert arrest history amp refuse top go metal detector allow congr
86,last year host online seminar resilience lockdown we ve add podcast feed
87,americans already hurt pandemic pay bank fee
88,abortion case front scotu wacb bench trump majority rule people seek medication abortion must phy
89,way tweet jet around world global pandemic antivax boyfriend
90,accountabilitybeforeunity impeachtrumpnow fascistzombie new shameful complicitgop pandemic deathcult
91,way tweet jet around world global pandemic antivax boyfriend
92,miss top ten exceptional advisor podcast episode secure act retirement insight covidera retirement income strategy retirement risk
93,help we amp write letter love queer communitywere look last letter writer amp we d love raise money stonewall housing whilst send support amp human contact lgbt community lockdown x
94,thank cdc also begin world large covid vaccination drive day
95,wear year ago spanish flu pandemic mask wear football matchthey survive
96,go carbonnegative huge challenge organization particularly global pandemic learn environmentalstewardship leader caregiver strategically chart path
97,you d think house member would learn wear mask correctly month global pandemic ala
98,never get hate
99,nigga get covid lmao
100,go carbonnegative huge challenge organization particularly global pandemic learn environmentalstewardship leader caregiver strategically chart path
101,bruce willis ask leave pharmacy refuse wear mask
102,idph update public health official announce new case coronavirus disease dose vaccine administer illinois springfield idph today report new confirm amp probable case illinois include additional death
103,new variant spread fast act like you ve get stay home protect nhs save life
104,reporter feeling medium full robot life impact we send love strength
105,vaccine yet develop china eradicate epidemic uk also rich develop country disease wreak havoc may allah protect we epidemic amen
106,do not think republicans stone disingenuous diseased impertinence cite impeachment take precious
107,organization put healthcare visit pandemic you re alone three way get employee health back track
108,initial test mouse suggest new nanoparticle vaccine could produce immunity one dose coronavirus vaccineswork vaccinessavelive
109,there s still time sign tapinto signature event ride wave hope amp concern happen tomorrow
110,depress mucheconomy
111,sea shanty popular right behavioral synchrony feel really really good human many we
112,journalist activist diplomat I ve see worldchange impact critical moment feel
113,chief regulatory officer grant barnes explain turn satellite imagery drone motionactivate surveillance cameras aerial photography protect water lockdown nrar
114,blackburn hospital imam share death grief
115,mental health disorder alltime high right people feel effect pandemic form depression anxiety visit doctor way use space fresh mind
116,well headline seven resident montreal care home get despite receive first vaccine dosemore accurate
117,drcareanywhere strengthen support mental health partner respond rapidly grow demand uk mentalhealth digitalhealth mhealth healthtech mentalhealthmatter startupnews startup
118,county kauai expend fund still time exhaust million allot statefor full story visit link bio
119,announce antigen testsdont wait get test offer antigen test kit pointofcare environment result minute make sure stay date infection statusget antigen test kit
120,st lukes assistant athletic director ms anna part crushcovid get firstround vaccine today thank covid champion stlukesct slsready
121,mlk resources
122,pandemic show current us system state licensure hospitalbase credentialing preclude rapid hire physician
123,jason kenney ucp will not reveal much federal money take subsidize political operation fail secure funding frontline workersableg abpoli canlab
124,pediatric office remain open difficult time aap encourage family keep pediatric appointment
125,beyond safetyrelated benefit offer pandemic telemedicine provide medium cancer care delivery reduce travel burden amp cost via gt learn patient inhome sampling program
126,verify link infertility miscarriage
127,do not miss adver tomorrow coverage great western hospital declare critical incident covid case hospital continue rise take look career jamie cox announce retirement boxing buyapaper
128,pandemic rage million family lose water internet power group urge pass moratorium utility shutoff get family help need noshutoff
129,support member dna community run lockdown coach education program january amp february heres excellent guest set present share knowledge full detail registering release tomorrowcoache
130,governor sununu nurses new hampshire can not schedule covid vaccinesbut mainer vaccinate virus
131,speech amp language therapy wish hear please fill sltsurvey affect access therapy access survey thank
132,vaccinate enough americans stop coronavirus could take well second half estimate
133,pandemic hit jeramey quick take proactive measure prevent rapid spread mayor jeramey continue ensure moss point resource knowledge fight back fierce virusfull post
134,presidential spokesman harry roque draw flak say filipinos can not choosy come vaccine get free argue sinovac vaccine available country june
135,uks wide death toll pass
136,pandemic recovery chance change course smart policy amp right investment chart path bring health revive economy build resilience amp rescue biodiversitymore
137,way introduce new perspective new voice new idea public curious supportindiebookstore
138,good evening devonhour hope everyone manage stay safe keep occupy far lockdown
139,get interview soon look tip get job birmingham staffordshire shropshire derby leicester nottingham warwickshire telford worcester westmidland wfhleadership learn wednesdaymotivation wednesdayinspiration wednesdaythought
140,commit drive economic growth amp building resilience whilst support business across region eu exit amp beyondbusiness support find amp stepforward campaign
141,infection rise belgium belgium
142,example great leadership
143,roasted butternut squash soup sage foodservice foodservice foodbusiness foodmarkete cook coronavirus staysafe organicproduct organicfood epicureangroup epicureangroup naturalvitamin superveggie
144,forever change pandemic true influence smartbuilding facilitiesmgmt facilitiesmanagement emergingtech digitaltransformation
145,stay know still stay home home delivery news available call sign digital subscription unlimited access website code
146,yes solution need
147,vaccination make mandatory workplace halifax partner mark tector answer amp question interview
148,onepot fluorescencebase assay detect rna hour high sensitivity sequence
149,vaccination infectious disease include help keep capatient healthy safe that s pbms work prioritize promote use vaccine see pbms always onyourrxside
150,think permanently shape futureofwork let chat comment ttpswwwemdgroupcomenfutureofworkdemographicchange collaboration connect workfromhome pandemic innovation culture advancingdigitallive
151,sign petition call long covid recognise occupational disease new wave many
152,unusual several reason include fact access capitol complex restrict since publi
