,full_text
0,research show health facility union low mortality rate well access ppe strong infection
1,shocking scene illegal migrant break covid regulations wales show politician take ba
2,slow rollout friday california administer vaccine million peoplethat
3,live covid time can not believe use go work cold would normal
4,half fan give nuno much shit probably do not even give shit club till nuno sign one comment come across yesterday say l hope nuno get covid die fuck sad bastard
5,well say
6,please wear maskit easy nice
7,yes give whole country humanitarian gesture remember
8,german bakery cook syringe cake promote vaccine
9,lowkey like go airport like whole checking eat food court wait gate etc
10,new global methane emission oil amp gas sector fall good news drop mainl
11,rethink tt bc
12,lightfoot need fire harris aoc need put office pay bail criminal lightfoot tell people harrasse get people face eat drink cup remember pandemic
13,anybody work person throughout pandemic need make least hour
14,can not imagine stress pain queue sassa grant getting spray water possibly get
15,former obama official andy slavitt recently appoint biden team senior advisor covid response know
16,friend priest parish area hospitalize please pray intercessio
17,new week fam drink water stay hydratedwear mask mind business dearshave wonderful week ahead
18,canadians pls share prevent spread misinformationfactcheckdid people norway die receive covid va
19,beat cancer amp turn pandemichappy birthday son
20,supremecourt concerned safety woman sit farmersprotest silent thousand migrant woman walk hundred mile reach home woman deliver baby footpath lockdown hypocrisywomenfarmersagainstfarmlaws
21,thalapathyvijays master global film term total gross collection past day extend open
22,anybody work person throughout pandemic need make least hour
23,issue news new case nigeria akwa ibom record new casesnumber school nigeria resume today rep fault january school resumption date demand postponementjoin conversation
24,receive first dose vaccine important trust science listen expert continu
25,wedding stress gtgtgt wedding stress covid
26,stay home safe trust plan emergency alert information
27,new death fresh case record globally
28,info extreme prevalence lowwage work bottom million americans make median hour
29,quite frankly even post covid can not imagine give florida money
30,remember true do not last four decade mask never work virus h
31,break huge win australian lawyer work project governmen
32,think people pay tax unemployment taxbase shrink massively last month people run looter people die hunger pandemic
33,world migration percent due pandemic un via
34,sign corona virus badly affected heart
35,arizona republicans like highly radioactive howler monkey infect rabies covid
36,be not hear nothing bout canada whole pandemic
37,detail story stick washington state record first us coronavirus death
38,smart lockdown impose part lahore gujranwala
39,help accelerate rapid covid testing need place wants reopen interested gett
40,psssst pass covid lung bad smoker lung postcovid lung look bad type terrible
41,make crabby nurse charge er police would immediately
42,report school authority
43,yesterday young son birthday happy birthday obi day fill windy balloon cookie baby
44,regard bali thread delete take twitter stormfirst encourage people skirt immigrati
45,act leadership kindness make everyone well manager suddenly discover compassion pandemic need make
46,complete sop follow n social distancing do well first day college schoolsreopening shafqatmehmo
47,today day johnny mnemonic take placethe film imagine future world wherecomputer technology rule
48,detail story stick washington state record first us coronavirus death
49,I m even read
50,he s lie vaccine enough people speak
51,got rid virus news press reality see multiple province war time protocol china would people actually believe state medium propaganda
52,alright covid wrap hoe
53,healthcare worker die take jab yesterday uttarpradeshs moradabad government
54,anybody work person throughout pandemic need make least hour
55,live oxford londonso breach covid lockdown restrictionshow come be not court monday
56,call commission examine devastating impact pandemic child young people unless
57,I m er nurse seattle last night officer come er obtain statement assault patient one offi
58,live covid time can not believe use go work cold would normal
59,vp robredo remind public complacent deal pandemic even vaccine negotiation underway stress danger bring new variant virus already reach philippinesread
60,many people die covid los angeles they re suspend air quality regulation allow cremation h
61,regard bali thread delete take twitter stormfirst encourage people skirt immigrati
62,remind everyone die covid I d prefer cremate mixed water balloon throw
63,mond live ytd have not start shoot yet due pls waitnotme notmeserie fkan
64,fantastic tool support learner read writing take look available student teamalness
65,chinas economy grew expect last year even rest world upend coronavirus pandemic
66,grossed day emerge global movie achieve majority area record
67,grateful support yesterdays letter conversation harm lockdown underway
68,hundred child admit arizona hospital
69,vs victoria be not ahead test sure nsw gov keep cop criticism give overall stat either
70,recognise devolve scottish government important role play overwhelming majority covid support business people across uk continue deliver uk treasury stephen
71,cyrilramaphosa announce south africa secure million dose vaccine here they ll roll vaccinestrategy look like
72,joe biden goal see dose coronavirus vaccine inject within first day office absolutely achievable top us scientist anthony fauci say day become new president chief advisor
73,insurance policy cancellation hit
74,temporary covid timetable do not forget we ve make temporary change service light government late covid restriction service continue operate reduce frequenciesview time
75,increase fatty acid content diet critical helping solve chronic disease epidemic get enough neolifeafrica
76,wanted pass huge thank staff week seamless consistent lockdown lesson daughter really enjoyedi know difficult thing must appreciate much
77,new reveal former minister fight double tax relief gift pension state murder orient express fbds exposure dispute covid payout deepen beginner guide financial market manage exchange rate exposure
78,uk government confirm hope able lift lockdown measure due next march
79,info shimura
80,swedish government accuse advocate broad infection spread push covid strategy
81,close healthcare worker immunise day one suffer adverse event follow immunisationhere need know adverse event post immunisationby
82,article provide important insight may help country build back well
83,late stat north yorkshire bradford leeds record case county
84,cumbrian struggle mental health blue monday covid
85,precise digitalization msme could ticket speedy recovery coronavirusshaken economy asiapacific region accord think tank via
86,india launch world big vaccination campaign also initiate production affordable easytohandle vaccine read india battle pandemiccoronavirus coronavac coronavirusupdate httpstcoyyorcspcdy
87,sure employee symptomatic test positive work step employer
88,less year kill almost americans next month another life could lose disease incoming director cdc say
89,food security research grant impact available phl southeast asians via foodsecurity research
90,decisive action community cooperation crisis combine drastically reduce crime per cent last year include traffic offence fall even great amountbahrain read
91,hiscox lift pandemic bi estimate net reinsurance court decision
92,pagibig fund member save recordhigh amid pandemic percent realestateblogphpropertynews rebph realestate pagibigfund hdmf realestateloan realestatemortgage
93,exactly explain vaccine also break process reach phase give vaccinesee
94,thousand firm include diversified farm claim covidrelate business interruption loss pay supreme court judgmenthttpstcozsqjkpusnh
95,joe biden goal see dose coronavirus vaccine inject within first day office absolutely achievable top us scientist anthony fauci say day become new president chief advisor usahttpstcolyvkqdfzpx
96,you re feel blue money you re scots worried finance pandemic citadvicescotmoney amp mental health frequently linkedyoure alone
97,appeal solidarity fund do not mampara unityinaction
98,read research teach nihss medicalstudent coronavirus pandemic rct clinicaltrial publish jmir publication follow read clinicaleducation
99,rapid testing begin boston week
100,swift progress vaccine development western country serve highlight delay develop homegrown vaccine japan write suvendrini kakuchi vaccine coronavirus research highere
101,do dust occupancy thalapathy vijay brand new league rival maste
102,super anxious abt new covid regulation come today bc rly miss mom n wanna go see
103,town mother jacqueline town die april virus ill virus month april death
104,people rightly criticise government lock country help alleviate strained public hea
105,strange bit mark lack clear correlation strict lockdown measure mask mandate mortality uncanny month
106,cheer cuppa good book psychologicalthriller bright lie compelling drama hook click cover begin read bluemonday lockdown reading
107,truly nothing well home cook meal freedom comfort cooking dish enjoy fully equip kitchen every suite book stay us doha hotel welcomehome
108,controversial couple babe wodumo mampintshas reality show put ice due adjusted level national lockdown regulation prevent dream wedding
109,patient virus treat st lukes general carlow amp kilkenny last night two county see amp respectively new case confirm
110,lockdown make important we safely get get active plan getoutside week let we know mondaymotivation somerset beactive sitless movemore
111,rapid testing come
112,vaccine three nurse hospitalize complain fever headache uneasiness madhya pradeshadverseevent
113,advice masksand do not give science change rubbish nothing change except narrative
114,want see winner live pls let pandemic end
115,sing sign karaoke covid
116,I ve say week inauguration redux inauguration
117,sex difference mortality agesex increasingly recognize modifier disease role wit
118,lay like really look like map incompetence unbelievableexcept be not
119,pandemic finally corbyn peaceandjustice campaign go explode onto street across
120,current condition sayre patemp chill point barometer inhgwind mph scorona virus weekly statscase nepa bradfordcounty
121,trump say round turn covid spread fast ever nbc number sh
122,time temp wind ssw pressure rain hum et solar uv index sunrise sunset cloudbase conlig bangor stayathome
123,say lunatic office soon nothing protect american people covid tenure
124,anybody work person throughout pandemic need make least hour
125,talk friend country europe mos ago pag hospitalize ang patient dadalhin sya sa hospital ng near country cuz puno na sila good thing tho hospital coordinate w hospital bring patient hindi problema ng pamilya
126,receive first dose vaccine important trust science listen expert continu
127,idea like live country people can not medical assistance die available complaining can not leave city almost year still covid around do not hate people come we covid negative
128,european study find people mild case likely report lose sense smell patient w
129,will not start wear mask social distancing blame democratic leadership everything
130,dear yeezus read piece drivel realize even retrospectively team apocalypse coherent
131,virgin coconut oil help treat find
132,government listen warning january last year ten thousand life could
133,purchase two new lenovo ideapad laptop week ago laptop issue nobody help amazonlenovo hide behind covid go
134,encourage other travel mf pandemic tell other find visa loop
135,covid please stop want wear public
136,new year start unfold make health priority one ever useful coffin therefore
137,anybody work person throughout pandemic need make least hour
138,masterfilm globally rank film term gross collection opening weekend revive indian box office despite pa
139,people dead capital riot terrible trump light fuse americans dead covid
140,live covid time can not believe use go work cold would normal
141,coronavirus russia late news jan
142,invest viv today per share stock price rebound back prepandemic price investment would worth that s growth profit see krma ocsl hbm alacr iesc
143,finally back oncampus school teaching learn covid time hugely demand parenting som
144,virus do not treat specially neither wevictoria state premier respond ausopen pla
145,humanity first support hospital hero around world help we fight
146,australias state state covid restriction coronavirus lockdown rule explain
147,antimask rally shut
148,wb health minister mamata banerjee continues silently watch tmc leader unabashedly usurp covid vaccine mean fr
149,social distancing
150,bad stayhome wearamask many people die los angeles county official
