,created_at,full_text,sentiment_score
0,2022-01-05 06:59:54+00:00,w many weigh ctu vs cps child catch middle different question happen,0.16666666666666666
1,2022-01-05 06:59:54+00:00,meet tc month ago she s girlfriend love meet someone online be not everyone be not intention fall go to dinner beautiful woman middle pandemic maybe spring train baseball buddy,0.45
2,2022-01-05 06:59:55+00:00,one effect live pandemic I ve find simply long want anything do not want,0.043181818181818175
3,2022-01-05 06:59:55+00:00,fuck covid,-0.4
4,2022-01-05 06:59:55+00:00,people get fourth shoot pfizerbiontech vaccine fivefold increase antibody one week later accord dat,0.0
5,2022-01-05 06:59:55+00:00,may june kevin j johnston spend equivalent seven week jail harass threaten alberta hea,-0.1
6,2022-01-05 06:59:55+00:00,cdc say look goblin man buy fruit do not worry soil hungry thir,0.0
7,2022-01-05 06:59:55+00:00,ccpchina propaganda show preparedness make human chain covid worker deliver grocery,-0.05
8,2022-01-05 06:59:55+00:00,omicron social distancing pandemicwhere,0.03333333333333333
9,2022-01-05 06:59:55+00:00,respected sir today collection people affect covid please take effective action respectable one student tamil nadu tprasanna manickam thank sir,0.39999999999999997
10,2022-01-05 06:59:55+00:00,vaxxed u cough cold fever can not breathe girl rocket science covid stay home contagious point,-0.6
11,2022-01-05 06:59:55+00:00,scott morrisons dereliction duty rapid covid test threat australians public safety kevin rudd htt,0.0
12,2022-01-05 06:59:55+00:00,tell seth meyers jimmy fallon sen rob portman dan patrick jim hagedorn bill pascrell defense sec lloyd austin countless other fully vaccinate report covidwhy keep lie american people,-0.05625
13,2022-01-05 06:59:55+00:00,night lockdown announce mean surely change means kindly postpone release,0.2625
14,2022-01-05 06:59:55+00:00,vaccine suppose save save save life take vaccine strengthen immunity virus make easy fast body cure help prevent spread definitely failure,0.10555555555555553
15,2022-01-05 06:59:55+00:00,get phone call mate seem covid make way apy land I m pretty anxious tbh,0.0
16,2022-01-05 06:59:55+00:00,people may need jab say chris whitty explain people amp might need me,0.0
17,2022-01-05 06:59:55+00:00,pandemic union play vital role defend worker call action protect health job,0.1
18,2022-01-05 06:59:55+00:00,test positive covid today via rat drive bondi drivethru clinic turn away immediately,0.22727272727272727
19,2022-01-05 06:59:55+00:00,one effect live pandemic I ve find simply long want anything do not want,0.043181818181818175
20,2022-01-05 06:59:55+00:00,vaxxe much less likely become seriously ill die hospital do not enough staff bc key staff covid personal medical decision impact everybody around least decency never enter public indoor space thank,-0.1074074074074074
21,2022-01-05 06:59:55+00:00,easily new covid variant jump person person definitely be not omarion tristan thom,0.06818181818181818
22,2022-01-05 06:59:55+00:00,many we surprised covid case third wave,0.19999999999999998
23,2022-01-05 06:59:55+00:00,leadership walk walk adam thompson cfo synergy sport speak we unprecedented pandemic shift focus read full blog,0.475
24,2022-01-05 06:59:55+00:00,really unfortunate situation we need careful pls mask take care urself,-0.3
25,2022-01-05 06:59:56+00:00,delhi likely report around covid infection today,0.0
26,2022-01-05 06:59:56+00:00,I m sure lead wonderful thing another political tyrant,0.5
27,2022-01-05 06:59:56+00:00,practice due coviddown varsity player due clearance protocolsnot issue group step,-0.125
28,2022-01-05 06:59:56+00:00,see deny person schooling call temporary pause covid case drop record shatter number many school district purposely mislead,0.5
29,2022-01-05 06:59:56+00:00,one effect live pandemic I ve find simply long want anything do not want,0.043181818181818175
30,2022-01-05 06:59:56+00:00,writer updateso may covid due work yayy pray everyone fine love,0.2638888888888889
31,2022-01-05 06:59:56+00:00,outlet uber eat show delivery partner availableim guess covid yeah,0.0
32,2022-01-05 06:59:56+00:00,humble request government early lockdown rather wait situation get ou,-0.05
33,2022-01-05 06:59:56+00:00,congress lead way always,0.0
34,2022-01-05 06:59:56+00:00,country third large school district officially shutter due omicron chicago teachers union vote ind,0.029761904761904757
35,2022-01-05 06:59:56+00:00,misspell thank mr president grant request open new fema testing sites texas go,0.06818181818181818
36,2022-01-05 06:59:56+00:00,point you all stop tell we,0.0
37,2022-01-05 06:59:56+00:00,hong kong cruise ship hold testing,0.0
38,2022-01-05 06:59:57+00:00,booster vaccine likely need travel many country within week boris johnson warn urge peopl,0.25
39,2022-01-05 06:59:57+00:00,fentanyl number one killer us adult age covid cancer car accidentspe,0.1
40,2022-01-05 06:59:57+00:00,karen aim queenslander get covid freak qld health officer get,0.0
41,2022-01-05 06:59:57+00:00,always good idea art kit hand selft suspect symptom covid well nothing still besides test high accuracy rate do properly,0.2866666666666667
42,2022-01-05 06:59:57+00:00,favorite ex link covid I m seriously think send care package,0.08333333333333334
43,2022-01-05 06:59:57+00:00,little wait witness big story love vs destiny postpone release film radhes,0.10416666666666667
44,2022-01-05 06:59:57+00:00,bro go lockdown like,0.0
45,2022-01-05 06:59:57+00:00,ask rajdeep ask question last month mamata banerjeewhen huge rally hold tmcahead kol,0.20000000000000004
46,2022-01-05 06:59:57+00:00,jeremy corbyn be not leftist leader condemn vaccine mandate passport coercive unjust france,0.025
47,2022-01-05 06:59:57+00:00,post glorious leader spread vaccine misinformation mr andrews go increa,0.0
48,2022-01-05 06:59:57+00:00,one effect live pandemic I ve find simply long want anything do not want,0.043181818181818175
49,2022-01-05 06:59:57+00:00,need sfw art print preferably big warmpeachy tone neutralearth tone fast ish,0.1
50,2022-01-05 06:59:57+00:00,toyota robot butler help elderly japan stay homeai machinelearning robotic,-0.1
51,2022-01-05 06:59:57+00:00,lose fan crazy right wing rationale vaccine personal choice ridiculous,-0.16190476190476188
52,2022-01-05 06:59:57+00:00,wow everyone pretty angry novakhas anyone think maybe medical exemption due fact,-0.05500000000000001
53,2022-01-05 06:59:57+00:00,need everyone stop say coldthat possible right covid prove otherwise st,0.14285714285714285
54,2022-01-05 06:59:57+00:00,court rule die portugal,0.0
55,2022-01-05 06:59:57+00:00,today hospital short staff due covid triple vaxxed say,-0.0625
56,2022-01-05 06:59:57+00:00,classic strategy aid denialism argue death aid overcounte less preventab,0.0
57,2022-01-05 06:59:57+00:00,job healthcare worker go work positive covid test symptom doom,0.22727272727272727
58,2022-01-05 06:59:57+00:00,result world large study ivermectin covid posted meticulously collect datum hundred,0.21428571428571427
59,2022-01-05 06:59:57+00:00,feel like part pandemic nurse doctor also disease keep work,0.0
60,2022-01-05 06:59:57+00:00,cdc say five key explain math level grade,0.0
61,2022-01-05 06:59:57+00:00,hospital bed we require fulltime employee currently need people take care hospital,0.0
62,2022-01-05 06:59:57+00:00,here wish speedy recovery testing postive well soon mate drop,0.0
63,2022-01-05 06:59:58+00:00,competent epidemiologist know march obvious covid can not suppress lockdown,0.25
64,2022-01-05 06:59:58+00:00,doubt we shame big pharmashame tga suppress australian professor borody,0.0
65,2022-01-05 06:59:58+00:00,new variant name ihu detect france,0.13636363636363635
66,2022-01-05 06:59:58+00:00,competent epidemiologist know march obvious covid can not suppress lockdown,0.25
67,2022-01-05 06:59:58+00:00,newspaper finally start catch report fact,0.0
68,2022-01-05 06:59:58+00:00,democrats feet,0.0
69,2022-01-05 06:59:58+00:00,cdc recommend stay home dog they re sad,-0.5
70,2022-01-05 06:59:58+00:00,close school college mall business public transport use crore vaccineseither vaccine,0.0
71,2022-01-05 06:59:58+00:00,we handle covidtsu,0.0
72,2022-01-05 06:59:58+00:00,robredo likely see qualified oversee postpandemic recovery incumbent vicepresident well,0.0
73,2022-01-05 06:59:58+00:00,even vaccine lockdown solution strict monitor vaccine mask mandatory,0.0
74,2022-01-05 06:59:58+00:00,really clear would not matter one bit pandemic conspiracy bc wtf go to conspiracy theory pretty boring compare century atrocity know happen try think one do not know,-0.2875
75,2022-01-05 06:59:58+00:00,doctor stress people can not complacent onset symptom must quarantine,0.0
76,2022-01-05 06:59:58+00:00,well important thing do not tamper natural state body,0.25
77,2022-01-05 06:59:58+00:00,science geek know little science omicron answer immunit get sick stay home recover voila immunity innate system handle protect immunocompromise dump mask healthy people need fresh air exercise kid need school,-0.025446428571428578
78,2022-01-05 06:59:58+00:00,shame do not donate poor country medical organization work place great needridiculous,0.13333333333333333
79,2022-01-05 06:59:58+00:00,covid that s side effect do not know,0.0
80,2022-01-05 06:59:58+00:00,rate spread omicron incrediblelarge number patient turn sore throat cold bodyache fev,-0.6
81,2022-01-05 06:59:58+00:00,sirmadam increase age limit dsssb je vacancies year favour student already year,0.0
82,2022-01-05 06:59:58+00:00,guardian view covid school cross finger be not enough editorial,0.0
83,2022-01-05 06:59:59+00:00,bunso covid positive eat feel well yaya feel well well oh lourd,0.22727272727272727
84,2022-01-05 06:59:59+00:00,ever notice vaccinated people get covid home quarantine facility chilling hospital bed,-0.5
85,2022-01-05 06:59:59+00:00,result world large study ivermectin covid posted meticulously collect datum hundred,0.21428571428571427
86,2022-01-05 06:59:59+00:00,break cdc release nft,0.0
87,2022-01-05 06:59:59+00:00,netherlands start one month full national lockdown response omicronwerent covid passport mask,0.35
88,2022-01-05 06:59:59+00:00,wear three ply plus one ply top minute trip safeway emptyi blow little air come feel safewhen go booster around other wear face shieldwill look ridiculous mattersafe,-0.03645833333333333
89,2022-01-05 06:59:59+00:00,postpone release film radheshyam due ongoing covid situation sincere thank,0.1875
90,2022-01-05 06:59:59+00:00,first professional managerial job year trophy completely revamp youthful amp energetic team fan can,0.2375
91,2022-01-05 06:59:59+00:00,third wave covid pandemic hit delhi around new case expect today city health minister satyendar jain,0.06818181818181818
92,2022-01-05 06:59:59+00:00,go scientist find dinosaur embryo chinai wish peace year,0.0
93,2022-01-05 06:59:59+00:00,guess definitely implement show vaccine certificate enter theatre good,0.35
94,2022-01-05 06:59:59+00:00,people get fourth shoot pfizerbiontech vaccine fivefold increase antibody one week later accord dat,0.0
95,2022-01-05 06:59:59+00:00,elon musk get rich do not give rat fuck ppl die pandemicstop buy car produce h,-0.012500000000000011
96,2022-01-05 06:59:59+00:00,easily new covid variant jump person person definitely be not omarion tristan thom,0.06818181818181818
97,2022-01-05 06:59:59+00:00,partner icu nurse test covid expose work nurse tell work covid will fever,0.0
98,2022-01-05 06:59:59+00:00,debateable,0.0
99,2022-01-05 06:59:59+00:00,would ideal covid isolation guidance beonce rapid antigen test cheap amp isolate first day,0.5166666666666667
100,2022-01-05 06:59:59+00:00,everybody access free rapid antigen test urgent necessary public health measure pande,0.13333333333333333
101,2022-01-05 06:59:59+00:00,night lockdown announce mean surely change means kindly postpone release,0.2625
102,2022-01-05 06:59:59+00:00,man attack worker orange county vaccine clinic call murderer lilaseidman,0.0
103,2022-01-05 06:59:59+00:00,hard question government refuse support people world shut get ch,-0.2916666666666667
104,2022-01-05 06:59:59+00:00,do not think covid oh ask virus like,0.0
105,2022-01-05 06:59:59+00:00,messi test negative covid,-0.3
106,2022-01-05 07:00:00+00:00,never listen first place vaccine ever provide complete individual protectionvaccine be not invidual they re community community fully vaccinate they re partially effectivewe do not get polio anymore,0.06249999999999999
107,2022-01-05 07:00:00+00:00,update map onlinethese map aim support recommendation travel measure eu covid,0.0
108,2022-01-05 07:00:00+00:00,national cabinet meet today discuss rat remember one federal opposition ever invi,0.0
109,2022-01-05 07:00:00+00:00,tell we background experience project development team carry project current pandemic,0.0
110,2022-01-05 07:00:00+00:00,postpone release film radheshyam due ongoing covid situation sincere thank,0.1875
111,2022-01-05 07:00:00+00:00,return school college today remember wear face cover use public transport everyone require wear face mask unless exempt go back school safely,0.16666666666666666
112,2022-01-05 07:00:00+00:00,shiv sena minister eknath shinde twoparty leader ncp mla rohit pawar find positive covid maharashtracivicpoll bmcresult,0.22727272727272727
113,2022-01-05 07:00:00+00:00,come nhs trust declare critical incident nhs leader raise concern could safely provide service due high number coronavirusrelate,0.13375
114,2022-01-05 07:00:00+00:00,mp return westminster christmas break plunge straight potentially fiery prime minister question common showdown,-0.033333333333333326
115,2022-01-05 07:00:00+00:00,lets protect childrenwhat sort world live suggestedno school without vaccine amp,0.13636363636363635
116,2022-01-05 07:00:00+00:00,first result phase one trial reveal jab strong level neutralise,0.3416666666666667
117,2022-01-05 07:00:00+00:00,china chinas health code system strictly govern people movement crash xian week worsen condition lockeddown city country bad outbreak since wuhan,-0.6999999999999998
118,2022-01-05 07:00:00+00:00,novak djokovic australian open vaccine exemption ignite backlash,0.0
119,2022-01-05 07:00:00+00:00,rapid rise case call devotee black nazarene safely observe traslacion attend virtual event home instead go gatheringsread joint press release,0.16666666666666669
120,2022-01-05 07:00:00+00:00,covid modelling use justify kind inhumane restriction say tom,-0.15000000000000002
121,2022-01-05 07:00:00+00:00,glasgow warrior confident bad coronaviru outbreak still several personnel issue contend ahead saturday clash ospreys glasgowwarrior unitedrugbychampionship,-0.06666666666666661
122,2022-01-05 07:00:00+00:00,aspiretothrive tip covid teach we anything move digital want brand stay relevant put one together help market brand longevity last kenya leaders business entrepreneur africa,0.13333333333333333
123,2022-01-05 07:00:00+00:00,although researcher still hard work variant also call ihu report claim detect among twelve people marseille region,-0.2916666666666667
124,2022-01-05 07:00:00+00:00,brit do not take covid seriously food already taste bland,-0.25
125,2022-01-05 07:00:00+00:00,hopefully public believe whitby johnson,0.0
126,2022-01-05 07:00:00+00:00,down street say expert would consider whether expand jab programme primaryage school childrenhttpstcoynanywnmbd,-0.15555555555555559
127,2022-01-05 07:00:00+00:00,airline share take investor bet omicron will not trigger travel restriction,0.0
128,2022-01-05 07:00:00+00:00,change thing school say yearold matlhake thandeka southafrica simple health measure physical distancing hand hygiene practice help reduce spread school watch,0.0
129,2022-01-05 07:00:00+00:00,whatever make feel happy peacejust stayhome that s ask,0.8
130,2022-01-05 07:00:00+00:00,government reconsider plan reopen certain entertainment venue nightclub follow surge infection across country see,0.21428571428571427
131,2022-01-05 07:00:00+00:00,result world large study ivermectin covid posted meticulously collect datum hundred,0.21428571428571427
132,2022-01-05 07:00:00+00:00,do not really get rat issue world fire worried battery smoke alarm therathasbolte stayhome healthcrisis longcovid unvaccinatedkid,-0.1
133,2022-01-05 07:00:00+00:00,low rate hospitalisation due omicron suggest covid might evolve weak formhttpstcoofdjdxzyxl,-0.16666666666666666
134,2022-01-05 07:00:01+00:00,hypertransmissible omicron variant exhibit significant antigenic change vaccine escape switch,0.375
135,2022-01-05 07:00:00+00:00,armed conflict protract instability pandemic increase pressure maternal reproductivehealth service already short supply disproportionately impact life woman girl,0.0
136,2022-01-05 07:00:00+00:00,come omicron impact travel industry amp tim alderslade keir starmers speech deprivation citizenship show good enemiesaasmahmir,0.7
137,2022-01-05 07:00:01+00:00,someday child ask question will not answer pathetic,-1.0
138,2022-01-05 07:00:01+00:00,hamad medical corporation announce noncoronavirus relate services urgent consultation service availableqatar doha healthcare,0.0
139,2022-01-05 07:00:01+00:00,finallythey publishing truth dangerous scott morrison australians kevin rudds article,-0.6
140,2022-01-05 07:00:01+00:00,chicago public schools cps face criticism chicago teachers union union say district safety plan enough,0.0
141,2022-01-05 07:00:01+00:00,hi reminder government do not actually care keep kid school care parent,0.0
142,2022-01-05 07:00:01+00:00,india report new case death hour end wednesday recovery,0.13636363636363635
143,2022-01-05 07:00:01+00:00,new study add evidence omicron variant evade immune protection confer vaccine natural infection suggest need new vaccine treatment anticipate virus may soon,0.12424242424242422
144,2022-01-05 07:00:01+00:00,chillin kookoo nest siaton share eli marie tia ig safe wear face mask observe social distancing dumaguetnon magpabakuna na well day dumagetme,0.26666666666666666
145,2022-01-05 07:00:01+00:00,cdc explain scientific rationale shorten isolation quarantine recommendation clarify guidance apply kid well,0.0
146,2022-01-05 07:00:01+00:00,philippine may log case daily next week octa,0.0
147,2022-01-05 07:00:01+00:00,fear return work christmas holiday could face heavilydisrupted commute morningscotrail bring temporary timetable yesterday covidrelate staff absencesmore daily service cut,0.0
148,2022-01-05 07:00:01+00:00,lovely thing start year heavy lockdownwhy get enjoy edify delicious organise coffee event friend originyou find event experience,0.425
149,2022-01-05 07:00:01+00:00,participant vaccinate australian open novak previously express opposition vaccine ecrsportswave ausopen djokovic,-0.05555555555555555
150,2022-01-05 07:00:01+00:00,parliament recall today first minister give update covid situationit think could include change isolation requirementsdrdmacaskill say staff absence big impact care sectorheartnew,0.07916666666666666
151,2022-01-05 07:00:01+00:00,minister education normafoley say reopening school would challenge difficult demandinghttpstcokunyfckjzm,-0.5
