,full_text
0,teen top test negative filming
1,sabina chege rich courtesy
2,why s always democrat politician violate rule put place
3,cuyahoga county consider help restaurant city food bank leftover coronavirus aid
4,can not complain besides covid really good year pray next year even well
5,refuse issue mask mandate take action even fl become state reach infected hospitalization soar total lack leadership may bad governor we desantis covidsecondwave
6,picture nell yesterday pattys turn lockdown hair
7,army arrive bristol stadium covid vaccine rollout due start next week
8,celebrate anniversary long year december well release remastered edition w new mix
9,married couple ugur sahin ozlem tureci founder biontechgroup invent first vaccine author
10,thank maga
11,able heal baby covid week old breastmilk big flex thus far htt
12,one blood type may safe covid via
13,north dakota hit covid milestone every resident dead
14,year china beijing inflict world continue violate treaty obligation amp destroy th
15,never forgive trump willfully lie love one die watchpass oncov
16,covid ruin life
17,luckily easy source thank lockdown working
18,everyone lockdown always wine
19,antigay hungarian politician resign catch police flee orgy window
20,let friggin hope
21,go to embarrass still want cancel plan stay home
22,vaccine optional calm right choose still remember hate rig
23,like mine first think what s crap fair play apparently run jewel sight get lock
24,fri christmas food amp toy hamper appeal trolley centra edenmore amp centra greendale anything afford donate would brilliant hamper help elderly venerable family distress due job loss covid thank
25,even vaccine become widespread business travel likely change pandemic travel budget slash meeting remain virtual conference convention may
26,remember lockdown word hear prison moviesdont ever forget that s belong
27,true despite eligible come reserve list neither raven rbs mark ingram jk dobbins
28,trumper retweet anti trump quote covid ravage thanksgiving america
29,covid relaxation christmas would hugely discriminatory faith group miss f
30,model base artificial intelligence help doctor make well decision reduce time spend intensive care
31,mostly case delay india make vaccine india go sputnik
32,republicans think child slaughter classroom weapon war cost freedom
33,hoffmann assistant professor college agriculture natural resource msu colleague hoffmann lab study light regulate physiology affect overall wellbeing mood induce change brain
34,let reviewa lawyer pose death threatsa retire general suggest martial lawstate gop official harass th
35,open today lockdown midday abbey road bar amp kitchen harrington street sister site harrisons bar amp k
36,desire get debate brexit today we ve make thought clear beforebut tweet el
37,lets forget paul pelosi jr also work burisma alongside devon archer hunter biden joe biden want end american energy independence kid get rich foreign energy company
38,
39,idc predict laptop sale climb incredible percent quarter thank pandemic normal holiday surge say pc dead
40,people worry lockdown ruin economy canadas rich people get billion wealthy since
41,break daniel ricciardo miss weekend sakhir grand prix positive test
42,true late covid death people die home posthumously test positive hospitalall covid stat believable
43,send pandemicmyaccessbank payusourentitlement
44,be not look big pharma quietly raise price drug course pandemicpharma ceo
45,see tweet yesterday like sometimes forget there s global pandemic live new zealand everyt
46,one direction get back together could destroy
47,may well speak swahili average person rn change tho lockdown force reboot lot folk
48,case talk covid maybe isolate virus first create test third tell people truth pcr test virus
49,she s also former longtime wall street executive slash medicaid vilify medicare
50,miss eat friend
51,turn get vaccinate get vaccinate protect community save livesdont believe antivaxx
52,got block first day start covid denier do not like comment kirstie block big
53,continue hold chinese communust party accountable gross negligence outbreak coronavi
54,first uk lockdown many longitudinal population study launch special survey help track impa
55,main stream medium please start report moscow mitch relief blackmail democr
56,governor must hold responsible
57,ron great gov
58,vote quaranteamblackpink thelockdownaward could way hard
59,help way mhra formally authorise pfizerbiontech vaccine nhs stand ready
60,icymi saskatchewan report new coronavirus case tuesday four death
61,always big boss lady bitch do not even know fucking product do not even answer phone call something negative say customer always right sorry break especially fucking pandemic
62,delighted announce today deliver zero emission bus amp low emission bus green recovery covid
63,retweet reply vote bts solo reason do not lose mind pandemic every day make da
64,fact percent game play thus far actually decent number conference go c
65,hell player gon get covid week moe
66,right death skyrocket year covid bring gas bonfire
67,hello hope record person londonbase studio january however due may possible may resort remote recordingso please send we application consider fairly alongside applicant hope help
68,everyone blame government country government responsible million people individual action people responsible put everyone risk government do not make daily decision
69,see another human outside lockdown
70,record number case amp death florida floridacovidepicenter
71,friendly pe target game socially distance twist lesson student work small bubble team
72,main stream medium please start report moscow mitch relief blackmail democr
73,pollsunday business post red c believe vaccine make compulsory people take
74,chinas covid coverup exposeda bombshell leak report shine light chinas mishandle covid
75,back indoor tonight scholes group meeting sport pavilion plus monday group check temporary home covid can not stop we support youngpeople offer opportunity take part fun activity ever week
76,pfizer biontechs vaccine authorize uk need know
77,hcq work treat early live infection inflammation thrombosis respiratory distress treat
78,govevers state state address budget message deliver virtually year governor office announce continue surge across wisconsinstate state jan message likely feb
79,safe haven final assault we via time
80,lie
81,socialize medicine mean everything takes long learn fact washington dc ht
82,people show aff covid test text social lit sqa exam result
83,let reviewa lawyer pose death threatsa retire general suggest martial lawstate gop official harass th
84,new study coauthore yung au show tech company continue provide online infrastructure co
85,local journalistsill host head two national medical association plus vaccine expert answer
86,seem start spread corona virus
87,good wednesday morning mrs thank update we cdc short quarantine period appreciate
88,yes social distancing rule
89,relatively rare entirely possible get even you ve recover here late sci
90,covid suck football pretty much every night week that s something guess
91,big drama get corona vaccine first
92,republicans think child slaughter classroom weapon war cost freedom
93,headline watch hurriyet daily newsvolunteer take part test potential chinese coronavirus vaccine turkey
94,coronavirus stimulus democratic senator push bring back weekly unemployment boost via
95,we ve say along glad see msm finally catch communist china knowingly lie
96,show symptom book free fast safe test nowtwo negative test result mean safely
97,situation start look like bad case scenarioplease pray midlandodessa hospital full
98,allow sport therapist amp sport massage therapist stay open
99,office tour like cre office tour newnormal httpstcovjpblxiljj
100,senate republicans wear mask let we pass another covid relief bill
101,mbc music core staff test negative coronavirusthey still discuss proceed week broadcast
102,beware
103,bravo salute
104,friend grandma get covid she s recoveredhow get covid she s sneak karaoke bar
105,thank open use candour time necessary strain medical system right could avoid abgov communicate effectively avg week stay covid icu patient ableg abpoli cdnpoli
106,pelosi pass covid relief bill come back marijuana bill faker disingenuous journalist
107,vaccine protect we cholera diphtheria hepatitis japanese encephalitis measles meningitis mumps pertussis
108,infectious via
109,world partly shut due pandemic overheat world still obliterate weather record extre
110,oh sorry state global pandemic response manual follow crowd oh wait
111,necessarily good thing health care spending go right go deep what s behind unpre
112,trump ship ton ppe china extreme rise infection drsand health professional wash mask wear garbage bag gown sanitation pandemic prime objective prevent spread andor death see many
113,really funny they re call theory becaus good they re prove
114,worried mean tweet
115,you all subscribe newsletter two dozen news outlet around appalachia lately they re dominate
116,kenyas case hit test corona
117,see tweet yesterday like sometimes forget there s global pandemic live new zealand everyt
118,big flex
119,evidence show pandemic force large majority organisation change strategy way however statistic indicate remote working solution secure office read
120,north korean dictator kim jongun family receive experimental coronavirus vaccine
121,pandemic bring mighty loss thailands retail royalty even big monopolistic dynasty manage hold onto obscene wealth
122,thalidomide vaccineit never clinical trialscoronavirus vaccine build vaccine science mer
123,utility kilt wherever wanderwherever rovethe hills highland forever love visit website scottish highlands trend fashion styling design fashionweek theutilitykilt
124,cv showcase skill experience crucial standing help effort we ve put together blog rewrite cv stand get notice employment market jobseeker jobfairy
125,national health datum show high prevalence medical condition associate severe infection among people serious mental illnesslearn
126,watch spur popovich talk start season covid safety player injury gospursgo nba nbatwitter
127,oklahoma governor kevin stitt declare day prayer fast affected coronavirus pandemic r
128,republicans think child slaughter classroom weapon war cost freedom
129,call friend
130,watch live leader amp discuss case hospital capacity
131,sturgeon covid bonus prone percent cut unless snp top
132,barrow county make plan million coronavirus relief money approve congress early year
133,gov eric holcomb first lady janet holcomb test negative nov governor experience symptom respiratory disease accord press secretary
134,chemical compound food inhibit key enzymeresearchnew news chemical sar enzyme
135,new site offer free testing anyone regardless presence
136,socially distance event take place forbury wokytoday wokingham wokinghamtoday read bracknell
137,practice proper hand hygiene important step prevent spread use soap water alcoholbase hand rub wash hand second rub palm back hand finger do not forget thumbswashyourhandswednesday
138,wear properly cloth face mask safe effective way slow spread sure mouth nose cover mask publicin pennsylvania mask must wear indoor outdoors away home
139,work fight defeat continue support canadian family business emerge
140,gift cure patient shincheonji church jesus
141,nearly two decade ago chinas general chi haotian defense minister reportedly give secret speech cleari
142,friend grandma get covid she s recoveredhow get covid she s sneak karaoke bar
143,bipartisan group nine senator release billion relief plan today may perfect pl
144,cdc soon shorten recommend quarantine exposure day day day person test negativehttpstcogixxrnburr
145,charity help disabled people last year warn brink financial collapsethe lake district calvert trust offer outdoor adventure break adult child say lose million lockdownhttpstconyngftxiyr
146,center disease control prevention set shorten recommend length quarantine exposure someone positive virus rage across
147,oregon nurse put administrative leave outcry tiktok video make indicate still travel pandemic wear mask public
148,legislative republicans want place new restriction tennessee governor ability extend emergency order address pandemic well future health
149,manager tyson foods waterloo iowa pork processing plant lie interpreter scope coronavirus danger facility federal lawsuit allege
150,track usdas pandemic spending politico pro snap farmaid coronaviruspandemic
151,taiwan seek recruit migrantworker southeast asian nation currently provide country foreign worker say labor minster wednesday day twoweek ban indonesian worker
152,retweet reply vote bts solo reason do not lose mind pandemic every day make da
