,full_text
0,holiday season hard accept family that s lgbtq biological family logical family year pandemic keep we love heres list resource strugglinghttpstcoevrkjuigff
1,bummer
2,corona show zombie virus outbreak we d zombie within week
3,insanity almost death many preventable almost case single day many preventable wear mask stay home contact leader be not support action slow spread elect new leader first opportunity
4,month pandemic I m contemplate texte friend ask still friend
5,year premier one pandemicand doug ford still do not understand without taxis govt
6,omega janela great match janela well within element hardcore rule omega likely destroy anyway makeup janela pull due covid world title eliminator tournament people complain
7,cap get real get covid
8,suddenly do not want stage hogging day
9,small proportion positive case contact reach nhs test trace deprive area
10,month build temporary hospital get icu bed well testing encourage immune health etc restaur
11,
12,south korea record new coronavirus patient case one day pandemic
13,south korea record new coronavirus patient case one day pandemic
14,quite clear do not care human life kid cage covid mismanagement lie ram execution propose return fire squad block relief hungry child greed power vanity dead
15,corona show zombie virus outbreak we d zombie within week
16,canada announce it ll provide new covid vaccine every canadian want freecanada order mo
17,force approval controversial vaccine gunpoint make much sense vaccine go to disastrous manufacturer zero liability read
18,publishedbaricitinib remdesivir superior remdesivir alone reduce recovery time accelerate impr
19,use patent pende indian invention aexpirator eliminate virus planet earth vaccination large masse dangerous without proper datum short term well long term side effect
20,way australia new zealand eliminate covidthey literally well never
21,anything focus solely female consider terf behavior mean something focus even middle pandemic
22,do not get need last lifetime never see
23,daily update publish state report million test record case death
24,accord san bernardino county covid dashboard staff icu bed occupy noncovid
25,workplace open lockdown
26,flu
27,cry sad song soon frn
28,gracias hyde pain harold
29,million coronavirus case death united states devastating
30,million coronavirus case death united states devastating
31,ten month million global death later nurse doctor continue risk life every day
32,new exciting collaboration work lab reveal diverse functional autoantibody covid patient
33,aoc mcconnell want give big corporation total immunity five year covidrelate lawsuit accept
34,do not forget elect official succumb trump bullying vote anyone say fraud
35,head sotang general election commission bambang dwitoro die early morning find positive
36,pfizer say even get vaccine still need wear mask do not rush get vaccine have not widely test read fdas report pfizer
37,devin nunes test positive covid go to leave
38,corona show zombie virus outbreak we d zombie within week
39,well bit awkward may cause longterm erectile dysfunction man yet another reason heed publ
40,history book record evening pivotal moment america supreme court reject attempt sit
41,move away city light covid lunacy
42,lancet safety efficacy vaccine direct link
43,birth chart covid vaccinethank give datum
44,please disregard davidnune
45,heres daily injustice judge hold client will bond pandemic crime failure appear
46,let gooo
47,could also buy one sound crazy need somewhere store damn thing know family pandemicinveste pleased payoff
48,corona show zombie virus outbreak we d zombie within week
49,due ill blessing first people like amp retweet cashapp venmo apple pay
50,datum valuable commodity pandemic we government agency have not always undertake na
51,find strange come covid vaccine within month have not come cure cancer
52,nyc parade world war armistice november influenza pandemichow many photograph wi
53,congratulate faith democracy do not need civil unrest get w try survive pandemic
54,policy debatable human right nothealth care human right proud country hope
55,lets forget school try push staff student turn nhs app
56,skeptical uw play champ game chance imo stateke co change quarantine period
57,corona show zombie virus outbreak we d zombie within week
58,tired damn pandemic
59,wear mask venture outside home necessity safeguard we danger virus
60,patient low vitamin level immediately put iu weekit call vitamin hammer
61,yiiiiike
62,londons heathrow airport friday say terminal remain closed end next year slump passen
63,expect make decision whether give emergency use approval vaccine pfizer moderna astrazeneca come week chief scientist say fridaywho
64,television interview discuss critical proactive detailing benefit vaccine persuade vaccine hesitant counter arbitrary claim antivaccine movement
65,scottish researcher analyze anticorona measure country large modelling study r number begin fall large event ban contact limitedbut plunge significantly school close
66,let eat covid
67,warmington skate around social distancing concern mississauga rink toronto sun
68,sure want see covid though
69,shout dracula renfield rackettering corona viruis
70,huge success try timeshow india get pds delivery right pandemic via
71,we govt secure access million dose modernas vaccine
72,really need miracle today republican deny covid beg prayer hospitalization
73,ruthless mf think well everybodythere pay play attitude smugness govt screw small business die everyday republicans want save stock investment system break big time
74,yeah dare youcheck note post make bread pandemic population learn make bread blogging
75,ultimately become group work bunch people put career hold try help support state really can not say advice heed one ear
76,dear piece shityou order armed man gun near child punish whistleblower wh
77,immediately write time they re long read muchrespected trump get nobel nomination peace mideast never begin war amp speed research covid vaccine totally ignore
78,corona show zombie virus outbreak we d zombie within week
79,chris hayes say use raw material need make vaccine make covid test covid rampant much testing done use raw material need make pfizer moderna vaccine wth
80,year premier one pandemicand doug ford still do not understand without taxis govt
81,many folk inside jail test positive covid free
82,pandemic year researcher work around clock vaccine healthcare worker lose life fight
83,new case announce nh today neighbor dead case child
84,americas billionaire could give everybody country stimulus check still rich
85,traveller win covid claim dispute afca overrule exclusion insurancenews
86,heres what s go happen without extension without small landlord january bring late fee
87,niggas lip get chap easily happy hell get wear mask I m niggas
88,california break singleday record new coronavirus case friday additional people report positive
89,australian govt survey we attitude recent action regard china absent list morr
90,incredible number come new case yesterday today
91,mexico register new case fatality bring total country case death
92,check event political history hip hop zoom check event page eventbrite linkfreshcourt freshcourtlive hiphop rapper rap stayhome history lecture musicpromotion politic hiphophistory eventbrite
93,russian scientist alarmingly announce one billion people stand die come global flu pandemic united states alone many people expect die little six month follow outbreak
94,may covid case sea refuse see situation failure overall make case point week dec get everyone stay home miss ko na kaya ang powerplant
95,health official say vaccine may arrive michigan within next couple weekshttpstcoujvpkfewbd
96,member free eventcome watch ireland football final us saturday december dublin take mayo match miss cash bar site mask social distancing require register
97,mask wear face mask cover nose mouth lather wash hand often soap water sleeve get flu vaccine important everfightflu stayhomestaysafe
98,injecting get vaccine get sick get vaccinate chi health infectious disease expert answer commonly ask questionshttpstcoqamkuxrjza
99,south korea record new coronavirus patient case one day pandemic
100,country face longterm challenge economic reconstruction together urgent need social investment defer trump
101,visitor area plummet percent little month pandemic spread
102,expect vaccine much cost find breakdown via
103,beat take everyone partwear mask social distance limit travel holiday
104,request government please quickly find solution farmer problem number corona case rise delhi painful veteran actor dharmendra write
105,astrazeneca test combine russian shot
106,we suffer covidrelated loss equal even exceed cause world war ii have not stop rich get rich net worth american billionaire soar trillion since marchread
107,study find presence italy november
108,americans willing vaccinate cohost continue discussion hhs azar say fda proceed emergency use authorization pfizerbiontech coronavirus vaccine vaccination could come soon next week
109,city utility customer aware potential scam call threaten water shutoff late bill do not contact customer bill automate call amp currently water shutoff amp late fee suspend pandemic
110,mutate time vaccine still effective
111,update report new case additional recovery quadcounty region bring total number case recovery death case remain active quadcountiesnv
112,friday governor pete ricketts announce state move orange yellow phase coronavirus pandemic response plan
113,four way covid change home
114,imagine exploit pandemic excuse screw nation due incompetence
115,figure we million school kid die covid year typical flu season kil
116,evelia de la cruz strip sheet sanitize bed chicago hospital say she s proud part fight pandemic part less visible category frontline staff continue risk life every day
117,crook see covid chance make buck oppose stimulus check constituent
118,pandemic health official can not even get flu shot distribute without create nearpanic population imagine fear confusion create killer virus new
119,provincial government webbased risctrap reverse isolation contact tracing application hail good among many response initiative coronavirus disease province countryhttpstcovqglcjpunz
120,addiction relapse compound
121,la county confirm total case case report december alone
122,devin nunes say americans disregard covid death previously covid
123,log stringer bridge across fordyce creekc national forest collectionchristmas history
124,suppose stop live amp put million work insanity
125,completely idiotic article eu way dependent uk tourist especially spain throw fit lose
126,efficacy tocilizumab patient hospitalize w detailed summary study publish idtwitter
127,waist size go pandemic
128,word speak incredible challenge teaching pandemic teacherlife teacher teacherproblem
129,expect ford completely lockdown ontariothis go break point many peoplei feel
130,saturday corona times help get rest locked day pad restrain
131,current condition sayre patemp chill point barometer inhgwind mph ssecorona virus weekly statscase nepa bradfordcounty
132,aldersgate designate parking spot worshiper prefer avoid large group service church measure place limit spread
133,covid spike xmas new year something serious want partsdont invite shyt
134,year winchester toy tot office say see almost donation site northern valley report low collection many site close due
135,extraordinarily difficult year event industry disproportionately impact coronavirus
136,americans pay price thanksgiving fall sick health official warn people beg even make mistake christmas new year season
137,vaccine confer protection study
138,humanity indeed
139,I m november child l winter much snowflake lockdown take friendsalway ucu
140,ctvvancouver interview personal injury lawyer legal risk holiday gathering
141,cnn highlight covid death tear heartbreaking
142,north dakota legislator covid still go organizational session legislator refuse
143,former bin laden henchman convict two deadly bombing free living uk week release
144,well team rebuild economy experience deal pandemic yeah I m good
145,I m sensitive smol lmao exercise good health instead especially pandemic
146,mr bill gates acknowledge pakistans effort combat pandemic stimulate economic growththe prime mi
147,malaysian man among six asymptomatic import case singapore
148,alltime top killers davis confederacy civil war we dead trump
149,surprise
150,alright I m do not get covid
151,covid florida new daily case additional death
152,corona show zombie virus outbreak we d zombie within week
153,genrui multiple nucleic acid detection kit influenza virus influenza b virus rtpcr ce markaccurate result udg enzyme sensitivity cv rnaresults ivd meditation
154,cecil falcon value time spend family come screech halt test positive coronavirus
155,kill hundred thousand people vaccine may answer maybe do not know next pandemic around corner talk end animal agriculture instead pandemic come
156,hang ornament tree hope denise rick avenue milan illinois
157,barrettjackson postpones scottsdale collector car auction march surge
158,even work impact pandemic unemployment program expire
159,schooling ongoing challenge pandemic
160,many americans still plan travel december holiday despite nation worsen coronavirus number
