,full_text
0,he s make counter reelect wants take we
1,supreme court brazil issue ruling could see state local government mandate coronavirus vaccin
2,fair amp though another aspect pfizer go covid likely hospital receive vaccine I ve suppose get pulmonology do lockdown begin amp have not reason want go test first
3,wtf thisthey even put statement say oops
4,especially panoramic pandemic
5,bayern announce drop turnover profit financial year consequence covid crisis turnov
6,boyfriend get covid vaccine yesterday tell prominent side effect inability shut
7,rep jordan comment do not make sense elect congress protect we amp guide we guidance criticize easy criticize
8,tn governor slow response pandemic must lot wthis do not mandate order tennessean
9,long run shortage nurse major longterm grow problem nhs bring sharp focus covid
10,expert tell usdont wear mask wear maskclose school open school close schoolsoutdoor dinning
11,I m never go shut interaction idol award show currently miss covid
12,we report covid death yesterday japan since start pandemic
13,become divide coronavirus nation even question government order automatically lump
14,decide life die base race must word
15,say production distribution problem pfizer immediately put public statem
16,covid
17,post covid birthday goal next year
18,tomorrow go senate floor ask vote bill provide direct payment worki
19,massive christmas party dave ramsey throw last weekend williamson co doctor write open letter ram
20,must waaaaatch pandemic pls screen itttttt premiere dapet merch gitu aaaaa
21,thank effort chinese constructor construction new hydroplane terminal project velana international airp
22,year research testing go make vaccine interesting within year already vaccine covid completely untested whether long term side effect even lead organ damage virus do not know enough
23,trump achilles heel lack empathy americans die yesterday thing tw
24,surprised nobody congress propose company pandemic instead hazard pay stimulus give people spirit week themed dress day scavenger hunt prize
25,songvideo covid lol exactly need eminem musictobemurderedbysideb
26,new datum increase fatal drug overdose across united states drive synthetic opioid amp cov
27,let emergency pay leave lapse unconscionable choice dark winter loomscongressional leader must
28,coronavirus weekly needtoknow second us vaccine needle phobia prisoner amp
29,plateau despair longcovid go survivor where s mask I ve yell question
30,give away billion mackenzie scott done hand money last six month help american
31,still refer china virus
32,rich country get access coronavirus vaccine first poor one timeline stretch
33,straight front line read wearamask
34,one powerful work journalism see inperson schooling matter pandemic brilliantly produce amp
35,boyfriend get covid vaccine yesterday tell prominent side effect inability shut
36,million plunge tier deal brexit likely via
37,wonderful sunny treeplanting thursday new oak tree amp acersthank lovely covid
38,boyfriend get covid vaccine yesterday tell prominent side effect inability shut
39,vacancy late many aspirant want year age relaxation becoz overage
40,covid house us fine monitor chest congestion call dr none we might much weak strain
41,vintage metal fold wine bottle opener cork screw wine bar cork opener pocket corkscrew wine bottle opener collectible
42,nbc news confirm we report new case coronavirus thursday set record new single day record
43,update pa doc surpass death incarcerate people covid count last two day
44,interesting article source infection trace
45,federal government grant company like pfizer moderna immunity liability something unintentionally go wrong vaccine
46,league statement management committee vote restart option opt without penalty due c
47,mean
48,bill gate collision symbol pay thousand pound sterling volunteer try corona vaccine watch
49,time smash cake face
50,hey remember guy invent polio vaccine do not patent pay public fund becaus
51,service update disruption owe track defect londonliverpoolstreet hackney down service update find please remember wear mask travel we amp station
52,service update half hourly stansted express service runningplease remember wear face cover travel us service update find
53,mean could day january people die day covid
54,month monsoon month shree pls kindly pass order contractor engrave
55,india utilise opportunity throw covid liberalise economy amp make easy busi
56,make gursahib kaur knps let break chain corona
57,matter vaccine take
58,go
59,do not see alligator covid downside you ll eventually square batman dock
60,elective work cancel centrally last winter one cancer elective wait
61,what s wish hope end concert jm hope suga recover
62,outbreak happen talk ok
63,puppy scam soar amid pandemic pa attorney general issue warn via
64,live britain pandemic genuinely feel like hear every country turn page exam
65,surgeon general fear much covid focus distract fight ailment news
66,company take billion federal aid save job lay worker anyway
67,people count test positive covid north carolina churchs christmas musical
68,radio scotland midday news item aberdeen lockdown pub owner gms morning complain abo
69,give away billion mackenzie scott done hand money last six month help american
70,cdc recommend vaccine give essential worker elderly even acknowledge choi
71,burundi expresident pierre buyoya die
72,people give coronavirus jab first hour first vaccination clinic market harborough hfm news amp
73,another bahrain start use right away successful
74,tory step rhetoric fail nhs unable cope prepare ground privatisati
75,republicans kill americans
76,look accurate amp similar detailed analysesdata show sweden really wellit protect eld
77,wear mask
78,where d go check golfing short timer syndrome
79,preliminary data geneva serosurvey capture wave show population anti
80,vaccinate people want vaccinate already take care vulnerable healt
81,do not die vaccine finally way now time kill other
82,data michigan state university paint pretty bleak employment picture recent college grad labormarket take time recover patient stay positive
83,I m try lose mind work numerous covid case I m make
84,take piss
85,brilliant adviceni
86,view vaccine light end tunnel educate getvaccinate gratitude fridaymorne carenotcovid healthcare healthcareheroes
87,huhu hang bro pogchamp corona awayjk anyways hope feel well
88,report say russia hack us agency business nine month ago mean hack begin everything shut
89,covid update december bad thread hate write write
90,outdoor dining winter pandemic subscribe channel see full video
91,someone sometimes criticise pandemic response important also give credit due performa
92,boyfriend get covid vaccine yesterday tell prominent side effect inability shut
93,solution always pay people stay home people die day might spit pittance
94,want american become ill covid one die say hard watch flout preca
95,seem logical mask etc would something empirically little correlation real world seem clear variable far great impact case fatality allhaile intervention thought
96,lockdown trigger set significant shift new patent application toward technology support work remotely according stanford nicholas bloom chicago booth steven j davis booth phd candidate yulia zhestkova
97,region handwashing remain challenge population monitor main public policy water supply sanitation ws govts latin america amp caribbean introduce due covid
98,twa night lockdown house citizen stir even spouse wonder eye appear new sage announcement increase fear write gawain towler
99,need help deal energy suppliercitizensadvice youcall we visit help fylde ring warm home adviser ring back
100,uwi task force host discussion vaccination today friday dec ast include chair regional immunization technical advisory group prof peter figueroa
101,india stand lose almost gdp compare prepandemic projection second bad amongst select country give unbalanced recovery say amp garima nain
102,bikeonrentchandigarh service consider one good way take complete fun city avoid busy crowd visit ushttpstcodnuswrchukbulletonrentinchandigarh bikerentalinchandigarh bikerentinchandigarh bikeonrentindelhi
103,layan kayed bir zeit university student imprison israeli occupation since june write follow letter family december follow isolation potential exposure
104,late episode nasciovoice chat nascio eric sweden discuss eric hope will not change back normal pandemic endsgo ahead take listen
105,go public risky think may come contact someone might read see step take think might information go
106,carol peletier need ride strangerthewalkingdeadseason november apocalypseatlanta camp georgiaqueencdc greene farm first prison siege wolf siege chem plant massacre amp war survivormelissa mcbride
107,parent carer disabled child england join panel take part short survey january april impact find
108,trust datum drive decision vital public support government response covidi ask step take ensure peer review method independent verification result on estimatesthe response receive
109,know hang friend amp family enclose space long period time deadlylearn spread via droplets air amp ensure amp love one wellbeingcredit research credit
110,threequarters consumer change plan purchase prepared food first national lockdown half claim eat fruit vegetable accord late research igd
111,vaccine set ok we panel endorsement
112,lastminute panic buy do not unimaginative treat friend family adventure discover gift voucher giftable annual passavailable buy online conveniently deliver email christmas day
113,native americans disproportionately impact coronavirus pandemic four time likely hospitalize
114,telegraph report government announce christmas holiday extend secondary school child enable rollout mass covid testing pupil start new term
115,lockdown wuhan tibetan orphanage illegal mine good offering chinas indie documentary filmmaker year
116,what s adverse event what s side effect five question could happen vaccination
117,trump massive breach federal agency trump covid death trump american
118,icymi emergency travel order enact state maryland number new case state continue
119,unusual year would like thank staff primary school support throughout also thankyou pupil see year amazing emotionalintelligence wcommonps
120,provide covid secure recruitment solutionsour exclusive video platform jobwise enable we carry whole process video requiredto find click link get touch we today
121,final weekend christmas amp may finish christmas shopping important plan shopsafely stay home feel unwell go wrap keep distance wear mask instorelookforlocal safechristmas
122,watch government minister warn potentially devastating scenario new year amid concern christmas mixingrestriction ease could shortlivednewschamber reportsvmnews
123,five day large vaccination campaign nation history president have not hold public event trumpet rollout tweet twice
124,think going see grotesque spike fear rise pandemic fatigue couple impending holiday lead big jump case new year caledon
125,covid protocol anytime anywhere even home fote
126,thursday december another day recap gift superwealthy remain silent fail covid response grave threat recant story ban gay conversion therapy try makeup home come
127,americans die one day president do not mention itdiaperdon trump covid coronavirus pandemic election usa america americans we vaccination
128,distribution pfizerbiontech coronavirus vaccine united states begin healthcare workers longterm care resident first line covid
129,dorightrightnow get back good lifeget flu shot give space stay foot apart wearamask wash hand checkin love one visit information
130,festive season upon we second wave grip country many south africans still travel destination across mzansi here important information aware hit road
131,pandemic push livestream shopping mainstream ecommerce digitaltransformation httpstcookdwepgwup
132,they re go claim religious freedom absolute absurdity
133,cyprus immune impact pandemic economy greatly dependent travel tourism
134,have not follow story russia hack number vital agency datum include we nucle
