,full_text
0,guy put splendid performance central defence rashid mohammed yesterday dormaa adu dwomoh joseph ballerstay safe together win
1,ccp leak confirm pfizer astrazeneca employ communist party member
2,yes read we population mill amp corona case millbase double rate month todayso explain be not like thatwhere exponential increase
3,christmas card campaign aim comfort lonely bc senior amid global news
4,else miss travel day lockdown
5,want christmas end pandemic
6,you re still wear mask social distancing wash hand limit contact people please r
7,partial lockdown germany we start ship vaccine around country virus surge
8,know you all go need stuff lockdown I m bald head you all go shop vabuli natural hair ac
9,fr make whatever happen like covid college shit happen whatever fun wanna deserve
10,nurse one patient time doctor patient hospital many leave round pas eye ear middle pandemic decide tell nurse glorify yes people mds work
11,treat elderly like prisoner be not viable option protect enslave themwhat bad vi
12,companion diagnostic test oncology market size forecast post impact top lead playersabbottrochegenomic healthqiagenagilentagendiabiomerieuxilluminasiemen healthcarethermo fisher
13,ooc last position plan go back precovid schedule anytime soon never get day saturday week totally unfair
14,short story I ve yr reflect upon character fuck feel family member particularly tr
15,americas work family frontlines hero cry covid reliefmitch mcconnell stay pause
16,sustainable living celeb spend lockdown gardening grow food
17,fedex yea already know fuck
18,love get phone call ucp mla office tonight ask family amp afte
19,update thread child amp summarise recent researchsummary evidence child adult eq
20,combination brexit covid recession job loss spend cut poverty aggressive increasingly r
21,beyond pathetic billion bill expect include billion unused funding care
22,man bag hip hop album year fucking studio album album drop entire pandemic reme
23,remember follow sweden they re handle right
24,thank do not want part experiment
25,lot post soon people share much achieve midst global pandemic
26,covid surge need especially careful double wear mask watch distance washi
27,biden do not need feed ego biden voter common sense would not support candidate hold rally like trump pep rally may fun may encourage football team they re meaningless election pandemic
28,much test amp get one around ntinda think get rona
29,maulana tariq jameel sahib contract corona virus undergo treatment cmh rawalpindi may god grant perfect health wellbeing great preacher islamic world people prophet peace blessing allaah upon
30,bullhit
31,get paper publish takes long make covid vaccine
32,sevenyearold raise nearly hospital pandemic gear sell bracelet
33,covid fund loot arrive thief must lick lip announcement make wrt much money go availablenow sit problem moneysickeningand yet get away
34,pledge commitment safety amp security people asset amp environment pandemic indianoil securit
35,phone go berserk emergency alert stayathome order system mean alert citizen
36,controversial position lol seem quick glance website she s literally portal info covid amp use publicgov resource amp be not different cnn say tv day covid kill we amp dth rate lst wk horror
37,use community college go hitchhike high school dropout phd physic
38,break foxnews alert first truck pfizer coronavirus vaccine leave michigan facility start shipment
39,white house get early access vaccinecoronavaccine
40,please participate amazing giveawaymake christmas special follow heryou win tws smart home kit smartphonegiveaway irochristmas
41,article wang et al suggest much high risk death within year cancer diagnosis can not say yet much cancer therapy likely real risk well cancer amp met
42,covid train tour irrelevant cnn
43,you all joke kindly reach kind word contribution sure going spark
44,white house staff member reportedly step one another first people united states get
45,remember chris whitty tell we truth risk covid worth watch feel like long time ago eve
46,muchisimas gracias family allow we attend funeral viewing victim side
47,two star force keep distance teammate play tonight clash
48,you all scared vaccine scare covid
49,ultimate betrayal american people take dose vaccine short supply bc administration
50,pandemic persist holiday season consumer seek creative way celebrate safely alcohol brand battle online physical cart space
51,trump wh staffer first recepient vaccine year wear mask host part
52,need get ready shift fight trump virus wear mask thank everyone allow
53,alternative headline nyc medic pay sustainable income despite important role particularly
54,stare be not obvious people oh wait ofc be not gravely underestimate human ignorance do not oh gosh sort upset maybe different reason
55,muslim quietly spend ramadan two eid isolate pandemic go miss christmas
56,false choice analogy be not eitheror stupid minimize risk risky
57,kabakoug want resume work watch omah lie rock kamapala amidst
58,farright group australia exploit coronavirus pandemic expand membership group cause
59,bahrain approve chinese vaccine use
60,pray westcote barton steeple barton duns tew sandford st martin amp nether worton whatever restriction may around christmas church engage everyone experience isolation mental health issue result pandemic
61,per total sample test dec covid corona coronavirus coronavirusindia coronaviruspandemic coronavirusupdates covidupdate coronaupdate coronaupdatesindia
62,people christmas could possibly go wrongcorona
63,instead shame people perfectly legal way make end meet shame system require someone
64,sevenyearold raise nearly hospital pandemic gear sell bracelet
65,please come er volunteer patient cough many people say could b
66,else outrage highranking white house official spend month refuse wear mask long support
67,trust bengal sanitization safety foremost priority try affordablerate staysafe sanitisationservice sanitizationnearmefightagainstcoronavirus sanitizationinkolkata
68,bill gate whose foundation part effort develop deliver vaccine warn sunday next four six month could bad coronavirus pandemic
69,die covidpandemie kruis deur caledon
70,solitude pony stunning canvas art link free shipping uk beat coronavirus blue glam home officeartistontwitter photography photooftheday travel homedecor diy interiordesign scotland
71,cochair base india describe adverse effect unequal access education challenge issue evident long onset public health crisis exacerbate pandemic include country
72,year virginia family adapt survive maintain longstanding farm pandemic challenge even
73,continues spread across uk disinformation watch decadeslong effort slow climate action familiar sight
74,leadership matter florida covid response lead taiwan covid response lead vicepresident dr
75,protect
76,new zealand join long list country use google apples mobile contact trace frameworkbut accord australianz travel bubble need unified covid contacttracing
77,geo news pakistans news channel post news jimin take internet storm take twitter remind
78,hope arrive
79,todays daily podcast discuss particular challenge face people eat disorder year restriction due uncertainty around christmas concern many listen
80,coalition call end uyghur force labor publish name fashion brand believe take adequate step ensure supply chain link force labor xinjiangenduyghurforcedlabour httpstcoyvtvjjjhcx
81,uae hotel return prepandemic occupancy
82,pandemic limit movement spend food play even big role holiday celebration filipinos result nielsen study show filipinos wil make food star holiday traditionsread unsplash
83,world marvel africa bypass bleak projection important celebrate policy make possible note mrs graca machel minds chairperson trustee
84,take long time life return
85,people allergy avoid pfizer vaccineno few one million recipient vaccine year
86,beware winter lesson victorias second wave aprof et al write openaccess insight lockdown remain strong possibility particularly winter adequate vigilance amp quarantine maintain
87,die covidpandemie kruis deur caledon
88,adult social care funding england briefing paper number house commons librarygreylit greyliterature nglc
89,world carbon dioxide emission drop pandemichit
90,white house covid hoax mask do not work also give we vaccine right fucking
91,recent research find children behavior link gut healththe research find certain bacteria find happy child time absent kid consider high maintenance behavioral
92,eswatini pm die hospital coronavirus govt via
93,covid case india case test india bot
94,current condition sayre patemp nawind chill nahumidity nadew point na barometer nawind na nacorona virus weekly statscase nepa bradfordcounty
95,corona simpletruth minute
96,adbs billion vaccine initiative provide comprehensive program support develop asias vaccine process via
97,corona street multiple organ failure sheet
98,new zealand lift covid restriction declare nation virusfree
99,time temp wind sw pressure rain hum et solar uv index sunrise sunset cloudbase conlig bangor stayathome
100,iitmadras turn covid cluster test
101,be not rich month minimize covid hold superspreader event reckless behavior endanger myriad
102,strongly support supreme court ruling defend first amendmentfreedom religion covid may temporari
103,saudi health official declare victory coronavirus say control almost kingdom region safe zone
104,sunday mail front page public money spend private firm carry work nhs louisa jordan ho
105,year virginia family adapt survive maintain longstanding farm pandemic chal
106,health worker lose life province
107,souk see virtual guide shopping tour marrakech like many holiday destination morocco reel pandemic new online tour connect artisan shopper bring glimmer hope lunchtime marrakech
108,keep feel like pinch wake could not possible political party would openly
109,trump refuse lead country first wave covid dump governor newsom work hard come solution ppe find solution save people live he s actual leader take position seriously trump
110,little like try repair fix iceberg ask
111,uber sell autonomous vehicle development arm ridehaile company slim revenue pummel coronavirus pandemic
112,pretty fucking wild us govt like well ignore pandemic wait vaccine ready give we ignore vaccine first
113,hello please change recover survive nobody measure recovery
114,microsoft cofounder bill gates make big claim pandemic detail
115,safe travel pledge explain help travel safely train travelsafelyi info
116,yep article
117,cost ghc thank god simple thing like alive maskup wearamask
118,italy overtake uk bad coronavirus death toll inside europe news video live
119,covid vaccine gps england begin offer pfizer jab
120,safe travel pledge explain help travel safely train travelsafely info
121,safe travel pledge explain help travel safely train travelsafelyi info
122,want inject fucking spine
123,kissboysth dec beautybuffet announce presenter feb wru announcement series
124,single pandemic tough
125,want we believe popular vote loose legal vote obamabiden popular vote twice middle pandemic completemy mishandle really
126,would anyone want compare ipo broad market try qqq instead still lag since despite massive move
127,industry have not really see anything like sudden change pandemic thrust upon massive need manufacturing flexible rapidly adapt change economic picture engineering manufacturing
128,yr have not fireman various underfunded fire dept raise money make shirtless muscle calendar
129,first batch vaccine arrive los angeles lax major milestone science countr
130,she s joke right
131,accord oliver wymans pandemic navigator since april ratio death hospitalize patient decreased hold steady around since may learn via brink news health
132,barclays say clean sanitation stock shine even pandemicltpgtbarclay analyst lauren liebermann expect clea
133,ina grafton hire covid screener job toronto
134,dr fitzhugh participate vaccine trial account sound like get placebo
