,created_at,full_text,sentiment_score
0,2020-12-10 10:59:55+00:00,think back begin plandemic recall commentsinvisible enemychina virushe tell we beginninginfiltration invasion,0.0
1,2020-12-10 10:59:55+00:00,find impact crisis refugee asylum seeker amp undocumented migrant new digita,0.13636363636363635
2,2020-12-10 10:59:55+00:00,lockdown order ignore business school church must immediately open time large,0.10714285714285714
3,2020-12-10 10:59:55+00:00,bbc news downbeat everything pandemic week remarkably pro eu week negotiation accord laura k disastrous well pay heavy price thought bbc unbiased,-0.04999999999999999
4,2020-12-10 10:59:55+00:00,pandemic december become deadly day history america since death coronavirusin usa also putz day recall resign,-0.2
5,2020-12-10 10:59:55+00:00,fat cat top exec owner daily mail collect may share bonus return business r,0.25
6,2020-12-10 10:59:55+00:00,give thank god instead play demon virus take life world oil do not heal blood share cross heal name jesus christ heal,0.0
7,2020-12-10 10:59:56+00:00,be not true accord large randomized control trial evaluate protective efficacy,0.019642857142857142
8,2020-12-10 10:59:56+00:00,check archaeology friend covid okay,0.5
9,2020-12-10 10:59:56+00:00,case hit new record increase bring total update htt,0.06818181818181818
10,2020-12-10 10:59:56+00:00,ghanas president akufoaddo win reelection solid first term agenda face serious challenge hit cocoa gold oil export,0.1791666666666667
11,2020-12-10 10:59:56+00:00,week americas account nearly half new case third new death new case remai,0.04848484848484848
12,2020-12-10 10:59:56+00:00,I m really sorry see ecxperience number provide everyone work home global pandemic would like discuss furtherhave escalate please contact we via account dm herekeri,-0.25
13,2020-12-10 10:59:56+00:00,million unemployed face eviction health insurance go hungry emergency we,0.0
14,2020-12-10 10:59:56+00:00,icymi yesterday taoiseach say ask student nurse midwife work shift abuse say dut,0.0
15,2020-12-10 10:59:56+00:00,irans health ministry spox lari announce thursday total number patient recover number infect case number death toll past hour new case test positive death toll,0.028409090909090905
16,2020-12-10 10:59:56+00:00,pandemic let we see,0.0
17,2020-12-10 10:59:56+00:00,fake pandemic test reaction cure one imagine what s vaxx,-0.5
18,2020-12-10 10:59:56+00:00,murder kick someone bridge hundred thousand people fact million,0.0
19,2020-12-10 10:59:56+00:00,day white house occupy president care deadly destruction covid believe,-0.1
20,2020-12-10 10:59:56+00:00,record magnificent chat opinion red wall public perception politician handle pandemic absolutely pack goody subscribe get moment,0.3
21,2020-12-10 10:59:56+00:00,scale pandemic heartbreakingover casesmore death single daythe economic,0.0642857142857143
22,2020-12-10 10:59:56+00:00,break fda announce death two coronavirus vaccine trial participant,0.0
23,2020-12-10 10:59:56+00:00,do not rule imbecilic government impose third lockdown cancel christmas uk could still happen,0.0
24,2020-12-10 10:59:57+00:00,we ve pull together mostly nation fight virus could achieve focused tackling,0.5
25,2020-12-10 10:59:57+00:00,guy remember thread share moment humanity fear caregiver perso,0.0
26,2020-12-10 10:59:57+00:00,igienizzare la wh,0.0
27,2020-12-10 10:59:57+00:00,leader engage people include elect representative people appeal rationale amp humanity,0.8
28,2020-12-10 10:59:57+00:00,I m officially oppose america first agenda,0.25
29,2020-12-10 10:59:57+00:00,discuss situation shore baltic sea cooperation arctic transatlantic relation,0.0
30,2020-12-10 10:59:57+00:00,copiedhappene currently worldwideuk launch mass vaccination india review vaccine,0.0
31,2020-12-10 10:59:57+00:00,really sorry bottom heart price pay death day unacceptablegerma,-0.5
32,2020-12-10 10:59:58+00:00,inside battleground frontline coronaviru pandemic we,0.0
33,2020-12-10 10:59:58+00:00,americans die today die horrendous attack restructure way life,0.0
34,2020-12-10 10:59:58+00:00,daughter bf test positive covid she s negative far tell dr positive day asthma terrify she s healthy otherwise plz say prayer,0.1509090909090909
35,2020-12-10 10:59:58+00:00,prioritize worker large corporation yet mitch mcconnell fight tooth nail let corporatio,0.21428571428571427
36,2020-12-10 10:59:58+00:00,number new infection tokyo exceed thursdaythe increase may cause go campaign I m sure whether tourist wear mask properly I ve never infect maybe always wear mask even,0.21212121212121213
37,2020-12-10 10:59:59+00:00,absolutely thread highlight many loss staggering,0.35
38,2020-12-10 10:59:59+00:00,discussion hold european commissioner never unimportant,0.1
39,2020-12-10 10:59:59+00:00,meet amazing ethel among first patient receive vaccine coronaviru prevent ethel give great great grandson hug bear lockdownethel can not wait meet properly soon possible,0.4083333333333334
40,2020-12-10 10:59:59+00:00,woman use care grandma junior high school pass away due covid last night do not know well can not stop think,0.011666666666666667
41,2020-12-10 10:59:59+00:00,people recover corona we active case recover active thursday seanhannitychucktoddmorningjoemorningmikajoenbcmsnbc,-0.13333333333333333
42,2020-12-10 10:59:59+00:00,icymi retrospective cohort analysis find metformin use associate significantly reduce death risk woman take medication coronaviru,0.375
43,2020-12-10 10:59:59+00:00,chinese communist party utilize intelligence operative form relationship rise we politician,0.0
44,2020-12-10 10:59:59+00:00,do not stop get do not stop transmit necessarily effect vaccine drhila,0.0
45,2020-12-10 10:59:59+00:00,could prevent cancer death can not,0.0
46,2020-12-10 10:59:59+00:00,new case high day three,0.1481818181818182
47,2020-12-10 10:59:59+00:00,despite fact many view unprecedented trip risky give current state pandemic security,0.3666666666666667
48,2020-12-10 10:59:59+00:00,odx colin invest omega telling sit tight alright big new order rerate come,-0.014069264069264073
49,2020-12-10 11:00:00+00:00,covid death toll exceed amp death toll single day hollow,-0.08571428571428572
50,2020-12-10 11:00:00+00:00,local leader review amp approve regional initiative task force report learn amp program bring prosperity amp equity region new connecteddmv strategic renewal task force report,0.06818181818181818
51,2020-12-10 11:00:00+00:00,pandemic way business adapt order ensure survival undoubtedly change trajectory look likethis article discuss trend drive every business httpstcowbzdjeysqjthirdrepublic,0.0
52,2020-12-10 11:00:00+00:00,education ministry receive fund allocate fy report chimpreportsnews wearamask,0.0
53,2020-12-10 11:00:00+00:00,ralphs store provide access fdaauthorize vaccine become available california supermarket chain owner say wednesday,0.4
54,2020-12-10 11:00:00+00:00,handwashing kitchen reminder national handwashing week aultcare,0.0
55,2020-12-10 11:00:00+00:00,lets go back carmageddon lets invest electrify publiclyowned accessible affordable public transport instead,0.125
56,2020-12-10 11:00:00+00:00,global incidence new case remain similar previous week new case past day,-0.02398989898989899
57,2020-12-10 11:00:00+00:00,common way spread holiday,-0.3
58,2020-12-10 11:00:00+00:00,recently make redundant require employment support help available coronavirus helpline open day week provide employment skill business advice call today,0.05
59,2020-12-10 11:00:00+00:00,everybody get sharp lacey merrick conway tell inman challenge run brokerage today industry amid global pandemic,-0.0625
60,2020-12-10 11:00:00+00:00,year human right day ask we focus need build back well world ensure human right central recovery effort,0.09523809523809523
61,2020-12-10 11:00:00+00:00,important work support colleague,0.4
62,2020-12-10 11:00:00+00:00,really sorry bottom heart price pay death day unacceptablegerma,-0.5
63,2020-12-10 11:00:00+00:00,vaccination vital public health intervention help we return normal learn pfizerbiontech vaccine eligible effectiveness possible side effect click follow link,0.0625
64,2020-12-10 11:00:00+00:00,day artsonreferral lockdown exhibition amp artisticadvent calendar self portrait peter heap pencil drawingapictureofhealth nbtproud,0.0
65,2020-12-10 11:00:00+00:00,government mull standardized policy tourism sector amid pandemic tourism congress philippines president jojo clemente say thursdayhttpstconsqvwfbtjr,0.0
66,2020-12-10 11:00:00+00:00,supermarket staff deserve rest put sort year brave public refuse wear mask threat violence catch virus much frontline worker medical staff,0.25
67,2020-12-10 11:00:00+00:00,another cohort student send home second case turn windsor catholic high school,0.05333333333333334
68,2020-12-10 11:00:00+00:00,work prevent spread new case per day rocket average,-0.0068181818181818205
69,2020-12-10 11:00:00+00:00,uofl develop test antiviral nasal spray prevent,0.0
70,2020-12-10 11:00:00+00:00,amp tory govt have not ignore report tell we be not pandemic ready uk death toll covid would much lower deliberate imho failure act kill sick amp disabled still serious risk,-0.19404761904761902
71,2020-12-10 11:00:00+00:00,announce commit additional million support research development equitable delivery lifesaving tool global effort vaccine,0.0
72,2020-12-10 11:00:00+00:00,county offices holmes county close public notice due uptick positive case area,0.03409090909090909
73,2020-12-10 11:00:00+00:00,economic activity develop asia forecast contract year pick region move toward recovery effect analysis,0.2
74,2020-12-10 11:00:00+00:00,county offices holmes county close public notice due uptick positive case area,0.03409090909090909
75,2020-12-10 11:00:00+00:00,many americans struggle make end meet unprecedented time taylor swift spark joy live two mother need holiday season,0.5090909090909091
76,2020-12-10 11:00:00+00:00,texas doctor say yes you ll still advise wear mask get vaccine here,0.0
77,2020-12-10 11:00:00+00:00,affect student learning,0.0
78,2020-12-10 11:00:00+00:00,lets build back well ensure human right key recovery effort,0.07142857142857142
79,2020-12-10 11:00:00+00:00,red category oklahoma rank third high state country covid hospitalization,-0.16
80,2020-12-10 11:00:00+00:00,ho ho holdupbefore plan christmas party need understand rulesheres covidsafe christmas explain gujaratilook explainer punjabi sylheti tamil urdu,0.0
81,2020-12-10 11:00:00+00:00,gov mcmaster push public school begin rapid testing immediately gtgt,0.0
82,2020-12-10 11:00:00+00:00,covid share experience across globe amp european newspaper ask reader share experience life know iteuropetalk breakdownbarrier conversationssunday,0.0
83,2020-12-10 11:00:00+00:00,behind door awardwinne eufunded peaceiv haip project find project exceed initial target amp break religious amp racial barrier help build positive relation community even restriction,-0.04318181818181819
84,2020-12-10 11:00:00+00:00,icymi woman uk first person world receive fully approve vaccine side effect,0.25
85,2020-12-10 11:00:00+00:00,emergency biventricular assist device implantation patient suspect diseasethis new report,0.13636363636363635
86,2020-12-10 11:00:00+00:00,who s first line covid vaccine share world poor will not get jab anytime soon wealthy nation stockpile dose drugtune stream live,0.12159090909090908
87,2020-12-10 11:00:00+00:00,laptop monitor display sale surge pandemic continue,0.0
88,2020-12-10 11:00:00+00:00,economic fallout pandemic likely push two million family uk poverty family struggle feed stay warm keep clean recession deepen read,0.2916666666666667
89,2020-12-10 11:00:00+00:00,ipl trump coronavirus digital front become mostsearched word google india beat uselection,0.0
90,2020-12-10 11:00:00+00:00,advisor cm sindh syed aijaz ali shah shirazi pass away due onlineindu news,-0.125
91,2020-12-10 11:00:00+00:00,come congress know responsibility pull back curtain american people expose corr,0.0
92,2020-12-10 11:00:00+00:00,covid case india cases test india bot,0.0
93,2020-12-10 11:00:00+00:00,indiana wait first dose vaccine hesitation among many hoosier hesitation likely high among black americans,0.14866666666666667
94,2020-12-10 11:00:01+00:00,olderpeople discover total joy clay lockdown age combine passion danceand clayette incredible material work never dry keep work itcreativity sculpture art novice peace age well,0.43333333333333335
95,2020-12-10 11:00:01+00:00,south dakotans infect covid stunning,0.5
96,2020-12-10 11:00:01+00:00,want know key scientific advice europe organise event legislative science advice mechanism challenge opportunity age meet expert different european office,0.0
97,2020-12-10 11:00:01+00:00,newswatch digest thursday december,0.0
98,2020-12-10 11:00:01+00:00,right equality dignity right live free fromdiscriminationtortureslavery everyone fundamental human right must protect especially canada proud,0.2741883116883117
99,2020-12-10 11:00:01+00:00,didyouknow canadian healthcare startup call share crucial datum outbreak china whole week could report itberci explain ai could play vital role decode pandemic seedtoscale,0.10000000000000002
100,2020-12-10 11:00:01+00:00,relative care home resident unable consent vaccination consent form public health clinicalgovernance informedconsent,-0.16666666666666666
101,2020-12-10 11:00:01+00:00,groundupstorie sanitation worker frontline indias response despite provide essential public health service work without safety gear social security manoj chandraskhekhar talk,0.011111111111111112
102,2020-12-10 11:00:01+00:00,imran khan telephone conversation bill melinda gates foundation cochair bill gates discuss situation polio eradication effort pakistanimrankhan billgate,0.0
103,2020-12-10 11:00:01+00:00,current condition sayre patemp chill point barometer inhgwind mph nacorona virus weekly statscase nadeath nasurvival naweewx nepa bradfordcounty,0.0
104,2020-12-10 11:00:01+00:00,lose americans covid today weep buffoon tweet,0.0
105,2020-12-10 11:00:01+00:00,think health care worker test often coronaviru think,0.0
106,2020-12-10 11:00:01+00:00,ambassador kazakhstan holy see say high hope pope francis visit central asian country next year coronavirus situation via,0.04
107,2020-12-10 11:00:01+00:00,take toll full range human right vaccine alone can not resolve heal damage cause mbachelet call state work together devise way recover well,0.2119047619047619
108,2020-12-10 11:00:01+00:00,ship nick cave idiot prayer live alone alexandra palace bad seed deathly silence empty alexandra palace nick cave simultaneously reflect ward isolation feel across globe pandemic,-0.3659090909090909
109,2020-12-10 11:00:01+00:00,wake frankie,0.0
110,2020-12-10 11:00:01+00:00,right equality dignity right live free fromdiscriminationtortureslavery everyone fundamental human right must protect especially canada proud,0.2741883116883117
111,2020-12-10 11:00:01+00:00,pandemic difficult time especially love around people old amritas rediscover joy conversation telephone friendship service ever one one,0.35
112,2020-12-10 11:00:01+00:00,iran accuse we block coronavirus vaccine purchase,0.0
113,2020-12-10 11:00:02+00:00,indepth digital chain cso pandemic change sport betting,0.0
114,2020-12-10 11:00:02+00:00,gallup view we pandemic worsen amid rise case,0.0
115,2020-12-10 11:00:02+00:00,sap brandvoice automotive supplier emerge pandemic strong,0.4333333333333333
116,2020-12-10 11:00:02+00:00,child safe come that s message medical expert say countrys case mu,0.25
